date,id,position,score,subreddit_display_name,subreddit_id,title,is_self,url,upvote_ratio,num_comments,created,created_date
2024-01-02T08,18wi2m2,5,3992,CFB,2qm9d,"[Postgame Thread] Washington Defeats Texas 37-31",1,https://www.reddit.com/r/CFB/comments/18wi2m2/postgame_thread_washington_defeats_texas_3731/,0.97,4628,1704174723,2024-01-02T05:52:03+0000
2024-01-02T08,18wh675,63,1566,Animemes,2w6fe,Perfection,0,https://i.redd.it/vgfvc4wlly9c1.jpeg,0.96,44,1704171766,2024-01-02T05:02:46+0000
2024-01-02T08,18wh4pd,62,2890,wholesomememes,3gcwj,"A meaningful lesson for even adults like us",0,https://i.redd.it/yfvowol8ly9c1.jpeg,0.98,57,1704171650,2024-01-02T05:00:50+0000
2024-01-02T08,18wgxzz,13,4711,shitposting,2usxq,"mommy kink",0,https://i.redd.it/7gytyj5hjy9c1.png,0.98,64,1704171052,2024-01-02T04:50:52+0000
2024-01-02T08,18wgcoh,49,2079,nba,2qo4s,"[Highlight] Delta Center erupts as Jordan Clarkson grabs his tenth rebound, breaking the Utah Jazz’s 15 year triple double curse",0,https://streamable.com/xtdbij,0.97,156,1704169185,2024-01-02T04:19:45+0000
2024-01-02T08,18wg9a5,38,2648,therewasanattempt,39ne7,"To be a TikTok prankster",0,https://v.redd.it/lh7wr371dy9c1,0.96,304,1704168886,2024-01-02T04:14:46+0000
2024-01-02T08,18wg8ub,84,1359,india,2qh1q,"Illegal Migration from India to USA",0,https://i.redd.it/of4d3w8xcy9c1.jpeg,0.94,338,1704168846,2024-01-02T04:14:06+0000
2024-01-02T08,18wg8ff,81,2581,HolUp,qir9n,"Replace the first 4 letters of both your names with Fuck...",0,https://i.redd.it/fs68hzgpcy9c1.jpeg,0.97,324,1704168808,2024-01-02T04:13:28+0000
2024-01-02T08,18wfw2o,14,4938,wholesomememes,3gcwj,Respect......,0,https://i.redd.it/stzjgeon9y9c1.png,0.95,164,1704167767,2024-01-02T03:56:07+0000
2024-01-02T08,18wfs4q,1,9277,pics,2qh0u,"Conan O'Brien during his visit to the White House last month",0,https://i.redd.it/zmwinfjh8y9c1.jpeg,0.93,460,1704167426,2024-01-02T03:50:26+0000
2024-01-02T08,18wfqu4,51,2384,Funnymemes,2xqtc,"Which corner is the most beautiful?😂",0,https://i.redd.it/hosseb2b8y9c1.jpeg,0.96,276,1704167319,2024-01-02T03:48:39+0000
2024-01-02T08,18wfo6e,3,7037,WhitePeopleTwitter,35n7t,"Donald Trump is confirmed to be on the Epstein flight logs...",0,https://i.redd.it/25h573cp7y9c1.jpeg,0.96,440,1704167104,2024-01-02T03:45:04+0000
2024-01-02T08,18wfg8q,28,6583,todayilearned,2qqjc,"TIL: A wealthy stock trader was sentenced in 2017 after a man he hired to dig a secret tunnel to a nuclear bunker died a fiery death. He made him wear blackout glasses, spoofed the wifi, and lowers a bucket for his tunnel guy to relieve himself for days at a time to keep the location secret.",0,https://wpde.com/news/nation-world/millionaire-resentenced-for-fiery-death-of-man-digging-secret-tunnels-under-maryland-home,0.97,244,1704166440,2024-01-02T03:34:00+0000
2024-01-02T08,18wfav2,11,5573,holdmycatnip,2zhxd,"Waiting for her food dispenser",0,https://v.redd.it/e74a57oh4y9c1,0.97,79,1704166015,2024-01-02T03:26:55+0000
2024-01-02T08,18wf0aa,88,3079,shitposting,2usxq,"What would you do?",0,https://i.redd.it/95gqzn7x1y9c1.jpeg,0.98,117,1704165144,2024-01-02T03:12:24+0000
2024-01-02T08,18wesch,18,5163,HolUp,qir9n,"Bro Tried His Best ",0,https://v.redd.it/k3kw97yzzx9c1,0.93,59,1704164502,2024-01-02T03:01:42+0000
2024-01-02T08,18weppr,41,3193,Satisfyingasfuck,31s00,"cleaning and manicuring horses",0,https://v.redd.it/39or67nczx9c1,0.96,302,1704164304,2024-01-02T02:58:24+0000
2024-01-02T08,18weff1,54,4916,pics,2qh0u,"Priorities in Rural Wisconsin",0,https://i.redd.it/0di85faywx9c1.jpeg,0.98,83,1704163486,2024-01-02T02:44:46+0000
2024-01-02T08,18wec6a,35,3546,LateStageCapitalism,39qgx,"Yeah F filing taxes anymore, straight up. They cant come after us all now, IRS are a joke.",0,https://i.redd.it/emeq9p00wx9c1.jpeg,0.9,198,1704163235,2024-01-02T02:40:35+0000
2024-01-02T08,18we4gp,96,3150,interestingasfuck,2qhsa,"I wonder if they have these/will soon have these available in every states or so. ",0,https://v.redd.it/3rod77rhux9c1,0.93,733,1704162649,2024-01-02T02:30:49+0000
2024-01-02T08,18wdun7,10,7873,TikTokCringe,mvcq5,"Skywriter spells ""UR TAXES KILLED 10K GAZA KIDS"" over Universal Studios today.",0,https://v.redd.it/y9b1mwu9sx9c1,0.84,1641,1704161899,2024-01-02T02:18:19+0000
2024-01-02T08,18wds1t,6,9871,nextfuckinglevel,m0bnr,"Thought the Diva Dance song was physically impossible for a human. How does she do this?",0,https://v.redd.it/ghlq20chrx9c1,0.94,498,1704161697,2024-01-02T02:14:57+0000
2024-01-02T08,18wdn0b,94,1829,blackcats,2twpw,"We adopted these 2 little black beauties about two months ago! Can confirm deep trouble.",0,https://www.reddit.com/gallery/18wdn0b,0.98,44,1704161299,2024-01-02T02:08:19+0000
2024-01-02T08,18wdll1,34,4233,Whatcouldgowrong,2x2oy,"Don’t get too cocky ",0,https://v.redd.it/jbrdaho4qx9c1,0.92,193,1704161186,2024-01-02T02:06:26+0000
2024-01-02T08,18wdhpx,21,5408,PublicFreakout,2yrq6,"People who do this deserve jail",0,https://v.redd.it/hmk1k666px9c1,0.94,758,1704160877,2024-01-02T02:01:17+0000
2024-01-02T08,18wdc6r,55,5665,WhitePeopleTwitter,35n7t,"Reading that is terrifying ‘We’ve read the graphic descriptions’",0,https://i.redd.it/xinqn8g0ox9c1.jpeg,0.96,261,1704160466,2024-01-02T01:54:26+0000
2024-01-02T08,18wda2q,42,3694,sports,2qgzy,"Michigan stops Alabama in OT to advance to the National Title game",0,https://v.redd.it/ydunkohgnx9c1,0.9,398,1704160290,2024-01-02T01:51:30+0000
2024-01-02T08,18wd81o,31,4538,AntiTrumpAlliance,3i9if,"Trump and Kennedy in Epstein’s flight log. Does MAGA care?",0,https://i.redd.it/sjsc88y0nx9c1.jpeg,0.95,152,1704160134,2024-01-02T01:48:54+0000
2024-01-02T08,18wd5xz,32,8851,CFB,2qm9d,"[Postgame Thread] Michigan Defeats Alabama 27-20 (OT)",1,https://www.reddit.com/r/CFB/comments/18wd5xz/postgame_thread_michigan_defeats_alabama_2720_ot/,0.92,8804,1704159964,2024-01-02T01:46:04+0000
2024-01-02T08,18wd3zl,59,5642,FluentInFinance,3qpaq8,"What killed the American Dream?",0,https://i.redd.it/w6ow5fx0mx9c1.png,0.92,856,1704159808,2024-01-02T01:43:28+0000
2024-01-02T08,18wczzt,2,13134,todayilearned,2qqjc,"TIL there are no skeletons in the wreck of the Titanic or debris field. At depths of 3,000+ feet, seawater is undersaturated with calcium carbonate. Once animals ate the flesh of Titanic's passengers and crew, their bones dissolved.",0,"https://www.npr.org/2013/04/19/177944080/studying-earth-to-learn-about-mars#:~:text=And%20the%20water%20in%20the,the%20bones%2C%20the%20bones%20dissolve.",0.97,552,1704159493,2024-01-02T01:38:13+0000
2024-01-02T08,18wcy8v,8,9468,gifs,2qt55,"I like to cut playing cards by hand using a xacto blade. I cut all 52, stack, and slide them back in the box.",0,https://i.redd.it/ewniyr9akx9c1.gif,0.97,185,1704159344,2024-01-02T01:35:44+0000
2024-01-02T08,18wct4d,15,7294,aww,2qh1o,"We went to get a kitten last night and couldn't decide on which little girl to adopt so we took both, they are sisters who get to spend their whole lives together. Meet Midnight and Ghostface",0,https://i.redd.it/0bm45bo6jx9c1.jpeg,0.97,128,1704158943,2024-01-02T01:29:03+0000
2024-01-02T08,18wcqde,7,10625,interestingasfuck,2qhsa,"Epstein flight logs released in USA vs. Maxwell",0,https://www.documentcloud.org/documents/21165424-epstein-flight-logs-released-in-usa-vs-maxwell,0.93,1060,1704158717,2024-01-02T01:25:17+0000
2024-01-02T08,18wcq25,73,4934,oddlysatisfying,2x93b,"Sounds of different sheet metals",0,https://v.redd.it/2jl2j5zqix9c1,0.91,304,1704158697,2024-01-02T01:24:57+0000
2024-01-02T08,18wco4z,98,4153,PeterExplainsTheJoke,121h8r,"Peteerr pls help",0,https://i.redd.it/m6owoipaix9c1.png,0.92,202,1704158545,2024-01-02T01:22:25+0000
2024-01-02T08,18wcklk,99,3990,Damnthatsinteresting,2xxyj,"What a Selfie in the 1920s Looks Like",0,https://i.redd.it/steo1bohhx9c1.jpeg,0.98,39,1704158274,2024-01-02T01:17:54+0000
2024-01-02T08,18wcjv3,57,6047,funny,2qh33,"Lost my phone/wallet in Tahoe, got it back at the front desk with this video on it",0,https://v.redd.it/fgvny8s5hx9c1,0.96,195,1704158215,2024-01-02T01:16:55+0000
2024-01-02T08,18wc9rq,20,9071,PeterExplainsTheJoke,121h8r,Petahh?,0,https://i.redd.it/s66fe7fxex9c1.jpeg,0.85,633,1704157411,2024-01-02T01:03:31+0000
2024-01-02T08,18wc71u,16,10492,memes,2qjpg,"On this day we stand united",0,https://i.redd.it/jdxsmwm9ex9c1.png,0.96,185,1704157222,2024-01-02T01:00:22+0000
2024-01-02T08,18wc6yf,29,5953,BaldursGate3,12967t,"Just doesn’t compare.",0,https://v.redd.it/x1ha7z6cex9c1,0.92,394,1704157215,2024-01-02T01:00:15+0000
2024-01-02T08,18wc1p5,93,2297,delta,2scjv,"To the woman in 3C yesterday on DL187 LHR-LAX",1,https://www.reddit.com/r/delta/comments/18wc1p5/to_the_woman_in_3c_yesterday_on_dl187_lhrlax/,0.92,250,1704156821,2024-01-02T12:53:41+0000
2024-01-02T08,18wbx9b,71,2935,nflcirclejerk,2sulf,"Some dumbass teams really gonna take this guy in the 1st round",0,https://i.redd.it/gcfe3jr5cx9c1.jpeg,0.92,353,1704156480,2024-01-02T12:48:00+0000
2024-01-02T08,18wbvlm,60,3591,crochet,2qm6c,"An homage to 2023 (a temperature blanket)",0,https://i.redd.it/ypmqux8sbx9c1.jpeg,0.97,83,1704156356,2024-01-02T12:45:56+0000
2024-01-02T08,18wbqgh,4,18676,WatchPeopleDieInside,3h4zq,"2 girls practice their catwalk…Only to realize they’ve been caught on camera 🤣",0,https://v.redd.it/genogtemax9c1,0.93,333,1704155987,2024-01-02T12:39:47+0000
2024-01-02T08,18wbotq,82,2774,HonkaiStarRail,4q5zoc,"This is getting interesting",0,https://v.redd.it/z64hi8cbax9c1,0.96,88,1704155863,2024-01-02T12:37:43+0000
2024-01-02T08,18wbce2,79,2990,starwarsmemes,2wzm6,Fair,0,https://i.redd.it/txbexwhj7x9c1.jpeg,0.89,332,1704154959,2024-01-02T12:22:39+0000
2024-01-02T08,18wb6sm,90,2646,DIY,2qh7d,"Chimney update. Any structural reasons I can’t remove this oversized hearth?",0,https://i.redd.it/onmhuuwe6x9c1.jpeg,0.93,850,1704154548,2024-01-02T12:15:48+0000
2024-01-02T08,18wb0l5,19,8978,FluentInFinance,3qpaq8,"Very Depressing",0,https://i.redd.it/wn2p4nr25x9c1.png,0.91,975,1704154102,2024-01-02T12:08:22+0000
2024-01-02T08,18wavwl,47,4978,mildlyinteresting,2ti4h,"My gas station has a heating oil pump",0,https://i.redd.it/wz3jfbw04x9c1.jpeg,0.96,485,1704153755,2024-01-02T12:02:35+0000
2024-01-02T08,18wasw2,12,12712,technology,2qh16,"Moderna’s mRNA cancer vaccine works even better than thought",0,https://www.freethink.com/health/cancer-vaccine,0.94,764,1704153550,2024-01-01T11:59:10+0000
2024-01-02T08,18wasaj,9,18880,funny,2qh33,"Why do I sweat like this?",0,https://i.redd.it/8nxkz02b3x9c1.jpeg,0.93,909,1704153505,2024-01-01T11:58:25+0000
2024-01-02T08,18warob,66,3598,nostalgia,2qnub,"Mazzy Starr. Fade into You. 1993.",0,https://i.redd.it/kqw4vp863x9c1.jpeg,0.94,157,1704153458,2024-01-01T11:57:38+0000
2024-01-02T08,18waqmr,77,6253,mildlyinfuriating,2ubgg,"Delivery driver stole $40 worth of groceries and delivered my (supposed have been) 3lb bag of frozen chicken like this",0,https://i.redd.it/2lhm1zlx2x9c1.jpeg,0.97,345,1704153379,2024-01-01T11:56:19+0000
2024-01-02T08,18waobu,95,2774,GlowUps,ruinb,"1 year. Made 2023 count.",0,https://i.redd.it/y5oydu9f2x9c1.jpeg,0.96,68,1704153206,2024-01-01T11:53:26+0000
2024-01-02T08,18wann6,70,3535,SweatyPalms,2v567,"A group of rock climbers are passed by a free solo climber.",0,https://v.redd.it/0g5qeg7tzw9c1,0.95,500,1704153154,2024-01-01T11:52:34+0000
2024-01-02T08,18wamyz,37,6335,NonPoliticalTwitter,39gt6y,Imagine...,0,https://i.redd.it/ot26hok42x9c1.jpeg,0.98,38,1704153106,2024-01-01T11:51:46+0000
2024-01-02T08,18wak75,36,6648,mildlyinfuriating,2ubgg,"Stayed in on NYE for this white car to smash into my parked car",0,https://www.reddit.com/gallery/18wak75,0.97,642,1704152913,2024-01-01T11:48:33+0000
2024-01-02T08,18waehh,22,10710,tumblr,2r7hk,"You should've become beautiful but you got forced out too soon and now you're in a fucked up half done state",0,https://i.redd.it/gasvyx7mzw9c1.png,0.95,256,1704152489,2024-01-01T11:41:29+0000
2024-01-02T08,18waa7g,61,4546,wallstreetbets,2th52,"A.I stock trader does insider trading and lies about it",0,https://i.redd.it/i6l5aogdzw9c1.jpeg,0.96,325,1704152182,2024-01-01T11:36:22+0000
2024-01-02T08,18wa2py,45,5910,GetNoted,91bxd4,"Oil shill gets owned",0,https://i.redd.it/nqmnp1zqxw9c1.jpeg,0.96,126,1704151634,2024-01-01T11:27:14+0000
2024-01-02T08,18wa0ms,50,5573,clevercomebacks,dyqlw,"Savage Swifty",0,https://i.redd.it/ccab9moaxw9c1.png,0.91,135,1704151482,2024-01-01T11:24:42+0000
2024-01-02T08,18w9wcd,17,13478,Wellthatsucks,2xcv7,"Worked up the courage to go to a bar to try and socialize. Even the bar tender stepped out for a smoke",0,https://www.reddit.com/gallery/18w9wcd,0.91,560,1704151184,2024-01-01T11:19:44+0000
2024-01-02T08,18w9uot,39,7301,BeAmazed,363r3,"Smart boy",0,https://v.redd.it/cfcqbtg0ww9c1,0.92,222,1704151065,2024-01-01T11:17:45+0000
2024-01-02T08,18w9m2f,85,3592,GTA6_NEW,8l5wbz,"Please guys… Don’t be like him.",0,https://i.redd.it/zv7bpw08uw9c1.jpeg,0.92,290,1704150448,2024-01-01T11:07:28+0000
2024-01-02T08,18w9lwh,75,3935,AskReddit,2qh1i,"What is a monthly subscription that is worth every penny?",1,https://www.reddit.com/r/AskReddit/comments/18w9lwh/what_is_a_monthly_subscription_that_is_worth/,0.94,3518,1704150435,2024-01-01T11:07:15+0000
2024-01-02T08,18w92ei,46,8429,dankmemes,2zmfe,"Bye bye copyright",0,https://i.redd.it/8b5wfuh2qw9c1.png,0.97,27,1704149051,2024-01-01T10:44:11+0000
2024-01-02T08,18w8rvo,72,4643,FoodVideoPorn,7387tr,"How to Make McDonald’s Hashbrowns for $1",0,https://v.redd.it/hdrxcgnenw9c1,0.91,250,1704148306,2024-01-01T10:31:46+0000
2024-01-02T08,18w8q6u,64,6171,comics,2qh0s,"Veronica and Mona: ""Heart of the Problem""",0,https://i.redd.it/ugwxf4uhnw9c1.jpeg,0.85,188,1704148198,2024-01-01T10:29:58+0000
2024-01-02T08,18w8epb,87,4176,Spiderman,2rw42,"This might just be the most I’ve ever laughed while reading a comic",0,https://i.redd.it/n3p1j3i3lw9c1.jpeg,0.94,169,1704147379,2024-01-01T10:16:19+0000
2024-01-02T08,18w85a4,100,3809,LiverpoolFC,2qn0o,"Klopp loses his wedding ring while celebrating, then finds it",0,https://v.redd.it/9pl1dzp3jw9c1,0.95,94,1704146709,2024-01-01T10:05:09+0000
2024-01-02T08,18w80e4,27,12490,Fauxmoi,2rqcm8,"David Beckham posts photo with Victoria’s “very working class” family",0,https://i.redd.it/inovp9m4iw9c1.jpeg,0.94,535,1704146381,2024-01-01T09:59:41+0000
2024-01-02T08,18w7r45,67,6028,sciencememes,2u0d4,"Gambler's fallacy",0,https://i.redd.it/mznyyv27gw9c1.png,0.95,167,1704145736,2024-01-01T09:48:56+0000
2024-01-02T08,18w7kog,26,15842,Damnthatsinteresting,2xxyj,"El Nino winter so far visualized",0,https://i.redd.it/frxhpobfew9c1.jpeg,0.93,1655,1704145297,2024-01-01T09:41:37+0000
2024-01-02T08,18w7fxo,53,7877,WTF,2qh61,"At US$10,000 a gram or US$10 million a litre, Scorpion venom is the most expensive liquid in the world.",0,https://v.redd.it/velsuizwdw9c1,0.95,628,1704144974,2024-01-01T09:36:14+0000
2024-01-02T08,18w7eag,24,22640,oddlysatisfying,2x93b,"Steam buns fluffing up",0,https://v.redd.it/inhxvf0ldw9c1,0.86,583,1704144857,2024-01-01T09:34:17+0000
2024-01-02T08,18w7e2c,76,5491,oddlyterrifying,2yo6b,"that one prankster at dr. pepper bottling plant",0,https://v.redd.it/ngdxglrjdw9c1,0.96,179,1704144840,2024-01-01T09:34:00+0000
2024-01-02T08,18w7c3t,43,10708,IdiotsInCars,3aimx,"[oc] Audi Q5 forces me off the road causing my vehicle to flip 5/6 times",0,https://v.redd.it/4a7eqc94dw9c1,0.93,1859,1704144702,2024-01-01T09:31:42+0000
2024-01-02T08,18w77ax,33,27514,Unexpected,2w67q,"This really got me",0,https://v.redd.it/yzmnm9v5cw9c1,0.81,460,1704144375,2024-01-01T09:26:15+0000
2024-01-02T08,18w73nw,40,12373,meirl,2s5ti,meirl,0,https://v.redd.it/1rnvjkeabw9c1,0.96,163,1704144113,2024-01-01T09:21:53+0000
2024-01-02T08,18w6ubl,48,9524,gaming,2qh03,"Former Call of Duty and Blizzard Devs Speak Out Against Bobby Kotick; States He Made Games Worse",0,https://mp1st.com/news/former-call-of-duty-and-blizzard-devs-speak-out-against-bobby-kotick-states-he-made-games-worse,0.95,722,1704143459,2024-01-01T09:10:59+0000
2024-01-02T08,18w6q0m,30,27568,facepalm,2r5rp,"Lets go Crazy",0,https://i.redd.it/ybxeto5h8w9c1.jpeg,0.89,1065,1704143160,2024-01-01T09:06:00+0000
2024-01-02T08,18w6pk9,52,8994,BlackPeopleTwitter,33x33,"2024 New Year’s resolution",0,https://v.redd.it/hdbykbeg8w9c1,0.93,720,1704143128,2024-01-01T09:05:28+0000
2024-01-02T08,18w6nt6,68,6498,PoliticalHumor,2qm21,"Well, yeah.",0,https://i.redd.it/e4nctui28w9c1.jpeg,0.96,158,1704142998,2024-01-01T09:03:18+0000
2024-01-02T08,18w6ndl,97,4931,70s,2s9rl,"How many of you ‘70s kids can feel this picture?",0,https://i.redd.it/pqj7ba6z7w9c1.jpeg,0.92,453,1704142966,2024-01-01T09:02:46+0000
2024-01-02T08,18w6bpd,74,7374,marvelmemes,35mye,"which one is the best ?",0,https://i.redd.it/ud21c2rl5w9c1.jpeg,0.94,652,1704142170,2024-01-01T08:49:30+0000
2024-01-02T08,18w61ly,25,38911,MadeMeSmile,2uqcm,"What a weight loss journey! She looks so much happier now",0,https://v.redd.it/r2jkm9vf3w9c1,0.92,982,1704141467,2024-01-01T08:37:47+0000
2024-01-02T08,18w5y7y,23,24402,politics,2cneq,"House Republican: Jeffrey Epstein flight logs not released because colleagues would be ‘compromised’",0,https://www.washingtontimes.com/news/2023/dec/23/reptim-burchett-jeffrey-epstein-flight-logs-not-re/,0.93,1702,1704141226,2024-01-01T08:33:46+0000
2024-01-02T08,18w5jap,44,14954,news,2qh3l,"CNN: Melissa Hoskins: Two-time Olympic cyclist dies aged 32 after being hit by car",0,https://www.cnn.com/2024/01/01/sport/melissa-hoskins-dies-hit-by-car-spt-intl/index.html,0.93,584,1704140178,2024-01-01T08:16:18+0000
2024-01-02T08,18w5gxb,89,5991,worldnews,2qh13,"42 survivors of the Nova Rave massacre sued Israel's Security Forces for negligence, claiming that the tragedy could have largely been averted",0,https://www.timesofisrael.com/42-survivors-of-the-nova-rave-massacre-sue-defense-establishment-for-negligence/,0.93,333,1704140017,2024-01-01T08:13:37+0000
2024-01-02T08,18w587u,56,13426,CuratedTumblr,3x5kfw,"She's breaking new ground",0,https://i.redd.it/svr5086fxv9c1.jpeg,0.95,550,1704139417,2024-01-01T08:03:37+0000
2024-01-02T08,18w4y5l,58,11920,HumansBeingBros,2xh58,"Daddy’s little helper ",0,https://v.redd.it/86o993pdvv9c1,0.96,128,1704138736,2024-01-01T07:52:16+0000
2024-01-02T08,18w4uay,69,13528,HollowKnightMemes,j958e,"If anyone could find the source, that would be appreciated",0,https://i.redd.it/lipngi6muv9c1.gif,0.93,145,1704138479,2024-01-01T07:47:59+0000
2024-01-02T08,18w4muz,80,8718,BikiniBottomTwitter,3deqz,"Farewell, Tom Scott",0,https://i.redd.it/ev3o8op0tv9c1.jpeg,0.92,86,1704137937,2024-01-01T07:38:57+0000
2024-01-02T08,18w4iwf,92,38935,facepalm,2r5rp,"You aren't welcome here for Christmas",0,https://i.redd.it/ymd3x1s4sv9c1.png,0.87,1389,1704137652,2024-01-01T07:34:12+0000
2024-01-02T08,18w3csk,65,16068,antiwork,2y77d,"This Idea Went Extinct In America.",0,https://i.redd.it/hy0hzr0hjv9c1.jpeg,0.91,301,1704134728,2024-01-01T06:45:28+0000
2024-01-02T08,18w3bnx,91,8423,OldSchoolCool,2tycb,"Chief John Smith was an Ojibwe (Chippewa) Indian who lived in the area of Cass Lake, Minnesota. He died in 1922 at the (alleged) ripe old age of 137.",0,https://i.redd.it/kezakz59jv9c1.jpeg,0.94,331,1704134652,2024-01-01T06:44:12+0000
2024-01-02T08,18w16ov,78,17748,ancientrome,2s8l1,"Syrian Archaeologist Khaled al-Asaad pictured with a 2nd Century Roman Palmyrene family’s funerary relief; Palmyra, Syria. He was beheaded by ISIS in 2015, for refusing to disclose the location of ancient artifacts from the site, after a month of torture. Today would’ve been his 92nd birthday",0,https://i.redd.it/skuiujfm2v9c1.jpeg,0.97,350,1704129059,2024-01-01T05:10:59+0000
2024-01-02T08,18w0vqw,83,44696,me_irl,2vegg,"me irl",0,https://i.redd.it/23o76i870v9c1.png,0.9,694,1704128248,2024-01-01T04:57:28+0000
2024-01-02T08,18w0j8h,86,18656,nottheonion,2qnts,"Pastor accused of trying to push McDonald's cook's head into deep fryer for 'disrespecting' his wife",0,https://abc6onyourside.com/news/nation-world/pastor-accused-pushing-mcdonalds-cooks-head-deep-fryer-disrespecting-wife-dwayne-waden-assault-battery-arrest-charges-fast-food-chain-restaurant-attack-employee-victim-high-point-north-carolina,0.95,1124,1704127299,2024-01-01T04:41:39+0000
