date,id,position,score,subreddit_display_name,subreddit_id,title,is_self,url,upvote_ratio,num_comments,created,created_date
2024-01-09T00,191tnpq,30,4780,gaming,2qh03,"Multiple Sources Indicate Xbox Is Looking To Go Third Party, With Ports In Development For PS5/Switch",0,https://twistedvoxel.com/xbox-looking-to-go-third-party-ports-for-ps5-switch-2/,0.94,1365,1704742320,2024-01-08T07:32:00+0000
2024-01-09T00,191tjvk,10,9643,me_irl,2vegg,me_irl,0,https://i.redd.it/6jlpo76dp9bc1.jpeg,0.97,158,1704742063,2024-01-08T07:27:43+0000
2024-01-09T00,191tjq3,33,4828,todayilearned,2qqjc,"TIL Baby Aspirin should not be given to babies as it can cause Reyes Syndrome",0,https://www.arnoldpalmerhospital.com/content-hub/why-you-shouldnt-give-aspirin-to-your-child,0.96,314,1704742052,2024-01-08T07:27:32+0000
2024-01-09T00,191tgfb,28,5337,technicallythetruth,3pzez,"everything is just a dictionary remix",0,https://i.redd.it/bk6erpjoo9bc1.png,0.97,40,1704741825,2024-01-08T07:23:45+0000
2024-01-09T00,191teko,63,3266,CuratedTumblr,3x5kfw,"Accidental Support Group",0,https://i.redd.it/l0ixh3yao9bc1.jpeg,0.98,136,1704741695,2024-01-08T07:21:35+0000
2024-01-09T00,191tbpz,8,12286,funny,2qh33,"I guess he was just looking for some motivation",0,https://v.redd.it/z8dsnfoin9bc1,0.92,515,1704741507,2024-01-08T07:18:27+0000
2024-01-09T00,191t3o3,67,3392,teenagers,2rjli,"What would u name him?",0,https://i.redd.it/u0xiuq45m9bc1.jpeg,0.94,1765,1704740974,2024-01-08T07:09:34+0000
2024-01-09T00,191t1j1,24,5972,AskReddit,2qh1i,"Who has most successfully milked what should have been 15 minutes of fame?",1,https://www.reddit.com/r/AskReddit/comments/191t1j1/who_has_most_successfully_milked_what_should_have/,0.94,5219,1704740831,2024-01-08T07:07:11+0000
2024-01-09T00,191swkk,54,3568,aww,2qh1o,"Somebody decided he had a lot to say during my zoom meeting",0,https://i.redd.it/q0knh2vuk9bc1.jpeg,0.95,105,1704740538,2024-01-08T07:02:18+0000
2024-01-09T00,191sku3,93,2864,wholesomememes,3gcwj,"Her Dad's response ❤",0,https://i.redd.it/ogqjtrfgi9bc1.jpeg,0.98,40,1704739744,2024-01-08T06:49:04+0000
2024-01-09T00,191s7gp,75,3551,SapphoAndHerFriend,voyv5,"Couldn't help but think how other nations do it differently, as well.",0,https://i.redd.it/fjwan4jhf9bc1.jpeg,0.94,82,1704738828,2024-01-08T06:33:48+0000
2024-01-09T00,191s7do,26,6630,cats,2qhta,"Actual excerpts from vet notes about my cat",0,https://i.redd.it/v2l32uxqf9bc1.jpeg,0.99,260,1704738822,2024-01-08T06:33:42+0000
2024-01-09T00,191s6qh,61,4111,ich_iel,37k29,ich_iel,0,https://i.redd.it/ffaag8smf9bc1.jpeg,0.86,182,1704738779,2024-01-08T06:32:59+0000
2024-01-09T00,191s684,40,5336,shitposting,2usxq,Focus,0,https://v.redd.it/d9ae0toif9bc1,0.97,52,1704738742,2024-01-08T06:32:22+0000
2024-01-09T00,191s5vx,18,11640,StupidFood,37se4,"Crimes against an entire nation.",0,https://v.redd.it/6domilm6f9bc1,0.8,926,1704738719,2024-01-08T06:31:59+0000
2024-01-09T00,191rpq5,17,12529,memes,2qjpg,"How to made yourself a villain for the entire community.",0,https://i.redd.it/4uoe2qy7c9bc1.jpeg,0.94,191,1704737632,2024-01-08T06:13:52+0000
2024-01-09T00,191rh60,48,4648,DOG,2qiy5,"He was so excited for this",0,https://v.redd.it/9osuy8dfa9bc1,0.98,64,1704737049,2024-01-08T06:04:09+0000
2024-01-09T00,191rdi2,98,3079,CFB,2qm9d,"[Washington Dept. of Natural Resources] Good morning from the only state playing football today that actually has wolverines.",1,https://www.reddit.com/r/CFB/comments/191rdi2/washington_dept_of_natural_resources_good_morning/,0.96,388,1704736820,2024-01-08T06:00:20+0000
2024-01-09T00,191r843,65,5047,cursedcomments,hw1ju,cursed_spareparts,0,https://i.redd.it/gsagj9gk89bc1.jpeg,0.97,33,1704736469,2024-01-08T05:54:29+0000
2024-01-09T00,191r7q0,51,4908,PrequelMemes,3i60n,"They're in the ventilation shafts...",0,https://i.redd.it/9lztgc1c89bc1.png,0.97,82,1704736443,2024-01-08T05:54:03+0000
2024-01-09T00,191r7nf,12,13835,FluentInFinance,3qpaq8,"President Biden says Billionaires have a moral obligation to contribute to society, not just hoard wealth. It's time for them to pay their fair share. Do you agree or disagree?",0,https://i.redd.it/otbskjzl89bc1.png,0.89,3144,1704736438,2024-01-08T05:53:58+0000
2024-01-09T00,191qnz5,59,4635,blunderyears,2vy3g,"This was my best friend & I before a night outing to Walmart",0,https://i.redd.it/hnz6ugkt49bc1.jpeg,0.97,210,1704735143,2024-01-08T05:32:23+0000
2024-01-09T00,191qh9u,87,4534,Terraria,2sg5b,"Get FIXED boi !!! (Art by yours truly)",0,https://i.redd.it/7zpth25b39bc1.png,0.92,191,1704734709,2024-01-08T05:25:09+0000
2024-01-09T00,191qgyq,50,5221,BaldursGate3,12967t,"PC players are given freedom, console players railroaded.",0,https://i.redd.it/8zg2lsg539bc1.png,0.95,241,1704734688,2024-01-08T05:24:48+0000
2024-01-09T00,191qdrl,68,4798,megalophobia,31gwh,"First wind-powered cargo ship...",0,https://i.redd.it/6rpyqkyr29bc1.jpeg,0.93,593,1704734474,2024-01-08T05:21:14+0000
2024-01-09T00,191q7vq,21,10453,mildlyinfuriating,2ubgg,"Some guy just stole a coffee and tried to have me pick up the tab",1,https://www.reddit.com/r/mildlyinfuriating/comments/191q7vq/some_guy_just_stole_a_coffee_and_tried_to_have_me/,0.96,553,1704734081,2024-01-08T05:14:41+0000
2024-01-09T00,191q427,71,4823,AllThatIsInteresting,93l1mw,"Disturbing bodycam footage shows the moment 23-year-old Chloe Jones was rescued after being kidnapped, beaten and held captive for four days by William Mozingo in October 2023.",0,https://v.redd.it/bxe4insu09bc1,0.94,719,1704733821,2024-01-08T05:10:21+0000
2024-01-09T00,191q24x,52,34337,facepalm,2r5rp,"Is it creepy to be a good dad?",0,https://i.redd.it/n4gj7jah09bc1.png,0.9,6763,1704733688,2024-01-08T05:08:08+0000
2024-01-09T00,191px8k,90,4452,bi_irl,3nhfo,bi_irl,0,https://i.redd.it/kufygz5hz8bc1.jpeg,0.82,300,1704733346,2024-01-08T05:02:26+0000
2024-01-09T00,191po9d,32,9044,AITAH,446kys,"AITA for saying to my mom at family dinner “well I wouldn’t stay with a man who hits my kids so I guess we have different priorities”",1,https://www.reddit.com/r/AITAH/comments/191po9d/aita_for_saying_to_my_mom_at_family_dinner_well_i/,0.94,1371,1704732728,2024-01-08T04:52:08+0000
2024-01-09T00,191pgx4,77,13974,WhitePeopleTwitter,35n7t,"Trump telling the truth for once",0,https://i.redd.it/e6bexxf3w8bc1.jpeg,0.94,709,1704732208,2024-01-08T04:43:28+0000
2024-01-09T00,191pefi,73,5670,absolutelynotme_irl,3b5ss,absolutelynotme_irl,0,https://i.redd.it/5mcz3k6kv8bc1.png,0.95,105,1704732034,2024-01-08T04:40:34+0000
2024-01-09T00,191pd9w,34,10537,maybemaybemaybe,38e1l,"Maybe maybe maybe ",0,https://v.redd.it/9l17z8rbv8bc1,0.92,483,1704731951,2024-01-08T04:39:11+0000
2024-01-09T00,191pcok,15,24514,BeAmazed,363r3,"As of 2022",0,https://i.redd.it/fm6bd427v8bc1.jpeg,0.94,667,1704731907,2024-01-08T04:38:27+0000
2024-01-09T00,191pc5k,88,4410,WorkReform,5qpzgw,"What happened to the American dream? 😔",0,https://i.redd.it/zykx3atyu8bc1.png,0.93,130,1704731869,2024-01-08T04:37:49+0000
2024-01-09T00,191pa0m,36,8864,SpidermanPS4,3f1fs,"MJ's model speaks out. To whoever has done this, you should feel ashamed.",0,https://i.redd.it/e2gqyzhmu8bc1.jpeg,0.92,1174,1704731715,2024-01-08T04:35:15+0000
2024-01-09T00,191p9yy,89,4682,Money,2qjmw,"is it normal I only took home 65k on a 110k salary?",0,https://i.redd.it/07wgay8mu8bc1.jpeg,0.87,3922,1704731713,2024-01-08T04:35:13+0000
2024-01-09T00,191os6l,74,6702,tumblr,2r7hk,"WEEEE LOVE THE COMPANY",0,https://i.redd.it/0jpruj2xq8bc1.jpeg,0.94,147,1704730467,2024-01-08T04:14:27+0000
2024-01-09T00,191orqw,47,6892,PoliticalHumor,2qm21,"vote ?",0,https://i.redd.it/3uk1oojsq8bc1.jpeg,0.9,742,1704730434,2024-01-08T04:13:54+0000
2024-01-09T00,191opod,81,5309,fixedbytheduet,46tcaa,"What’s for dinner tonight?",0,https://v.redd.it/vjb82fedq8bc1,0.92,146,1704730288,2024-01-08T04:11:28+0000
2024-01-09T00,191omdf,29,11334,JeffArcuri,740oig,"Pregnant ladies",0,https://v.redd.it/16o2uerfp8bc1,0.92,199,1704730051,2024-01-08T04:07:31+0000
2024-01-09T00,191ohgz,57,6585,OldSchoolCool,2tycb,"Nurses show newborn triplets to their father in a New York hospital, 1946",0,https://i.redd.it/uvjzy5rjo8bc1.jpeg,0.94,184,1704729703,2024-01-08T04:01:43+0000
2024-01-09T00,191oc2i,85,6363,meme,2qi1r,"Nice try.",0,https://i.redd.it/jf0hm5hin8bc1.jpeg,0.97,43,1704729322,2024-01-08T03:55:22+0000
2024-01-09T00,191o9wq,38,9732,ContagiousLaughter,2u2bh,"It's painfully cute😭",0,https://v.redd.it/6rl1486zm8bc1,0.96,92,1704729162,2024-01-08T03:52:42+0000
2024-01-09T00,191o1j9,100,5580,blackmagicfuckery,3fn31,"The last woodbender?",0,https://i.redd.it/c93jq498l8bc1.jpeg,0.85,475,1704728569,2024-01-08T03:42:49+0000
2024-01-09T00,191nwj5,25,19285,Embroidery,2rh53,"3 years of work 😅 Only you guys will appreciate it",0,https://i.redd.it/3xqieiq4k8bc1.jpeg,0.96,509,1704728186,2024-01-08T03:36:26+0000
2024-01-09T00,191nvcs,79,6035,nba,2qo4s,"[Wojnarowski] In a new edition of the Draymond Green Show, Golden State’s star suggests that Adam Silver talked him out of retirement: “I told him, ‘Adam this is too much for me…It’s all becoming too much for me – and I’m going to retire.’” Story on ESPN:",0,https://twitter.com/wojespn/status/1744382149145297378,0.92,1511,1704728102,2024-01-08T03:35:02+0000
2024-01-09T00,191nmlj,82,6987,therewasanattempt,39ne7,"To walk with your child holding a white flag",0,https://v.redd.it/ow9yo65wh8bc1,0.87,1085,1704727434,2024-01-08T03:23:54+0000
2024-01-09T00,191nlmx,37,12144,ProgrammerHumor,2tex6,codeReviewDoneRight,0,https://i.redd.it/hmx0q06oh8bc1.jpeg,0.95,174,1704727358,2024-01-08T03:22:38+0000
2024-01-09T00,191ndn4,43,11195,Eyebleach,2s427,"When you’re the handsomest of all the boyz…",0,https://i.imgur.com/D4U9U3P.gifv,0.93,85,1704726756,2024-01-08T03:12:36+0000
2024-01-09T00,191nctb,97,20343,MadeMeSmile,2uqcm,"After 795 days, my son is cancer free! (OC)",0,https://i.redd.it/zx6i2chof8bc1.jpeg,0.95,249,1704726688,2024-01-08T03:11:28+0000
2024-01-09T00,191n4zn,60,8571,StrangerThings,3adlm,"'Stranger Things 5' Officially Begins Production",0,https://i.redd.it/60pm6opwd8bc1.jpeg,0.9,708,1704726097,2024-01-08T03:01:37+0000
2024-01-09T00,191n1wd,99,40938,Unexpected,2w67q,"The real answer to the trolley problem",0,https://v.redd.it/3fupodx9d8bc1,0.86,693,1704725881,2024-01-08T02:58:01+0000
2024-01-09T00,191mzo2,76,12087,videogames,2qhzy,"pC mAsTeR rAcE",0,https://i.redd.it/ziiwc89oc8bc1.png,0.76,2233,1704725702,2024-01-08T02:55:02+0000
2024-01-09T00,191mwwm,96,6381,nextfuckinglevel,m0bnr,"View from a camera on Space X Falcon 9 during liftoff with stage 1 returning to the ground in 90 seconds",0,https://v.redd.it/thvar0d1c8bc1,0.94,393,1704725474,2024-01-08T02:51:14+0000
2024-01-09T00,191mtpj,35,19334,comics,2qh0s,"Direct brain injector",0,https://www.reddit.com/gallery/191mtpj,0.95,441,1704725212,2024-01-08T02:46:52+0000
2024-01-09T00,191mj36,41,14155,oddlysatisfying,2x93b,"Machine automates the process of levelling and troweling",0,https://v.redd.it/vlz9qu4o88bc1,0.92,639,1704724351,2024-01-08T02:32:31+0000
2024-01-09T00,191m48b,42,13169,news,2qh3l,"Lauren Boebert: Police look into apparent Colorado restaurant row",0,https://www.bbc.com/news/world-us-canada-67911826,0.93,939,1704723175,2024-01-08T02:12:55+0000
2024-01-09T00,191m205,56,12074,MapPorn,2si92,"The size of the Roman Empire at its height compared to the United States",0,https://i.redd.it/t14qh2qp48bc1.png,0.92,1072,1704723000,2024-01-08T02:10:00+0000
2024-01-09T00,191ls8x,95,9546,theydidthemath,2x23b,"[Request] Does this work? And if so, why?",0,https://i.redd.it/qui3zivg28bc1.jpeg,0.94,194,1704722245,2024-01-08T01:57:25+0000
2024-01-09T00,191kjam,84,12549,mildlyinteresting,2ti4h,"Dropped my iPhone on a beach and the MagSafe case attracted titanomagnetite from the black sand",0,https://i.redd.it/9axsq9rtq7bc1.jpeg,0.93,541,1704718331,2024-01-08T12:52:11+0000
2024-01-09T00,191kf2o,86,11560,LeopardsAteMyFace,3jp3p,"Florida man notices that DeSantis no longer spends time in the State instead is using donor money for private flights and lifted cowboy boots!",0,https://www.politico.com/news/2024/01/08/ron-desantis-campaign-legislature-florida-00134265,0.95,289,1704717936,2024-01-08T12:45:36+0000
2024-01-09T00,191k7pj,64,27581,Wellthatsucks,2xcv7,"This is so messed up y’all plz be careful out here",0,https://www.reddit.com/gallery/191k7pj,0.89,4218,1704717203,2024-01-08T12:33:23+0000
2024-01-09T00,191k0bb,94,14770,SipsTea,5tdqj0,"Your total is going to be 20.18??🤔🤔",0,https://v.redd.it/3n7e0uial7bc1,0.93,373,1704716469,2024-01-08T12:21:09+0000
