date,id,position,score,subreddit_display_name,subreddit_id,title,is_self,url,upvote_ratio,num_comments,created,created_date
2024-01-09T01,1920kz7,62,1595,Millennials,2rc4u,"Should American Taxpayers Forgive Student Loan Debt?????????",0,https://i.redd.it/1v34fg6d2zac1.png,0.94,510,1704759106,2024-01-09T12:11:46+0000
2024-01-09T01,19209ee,97,1270,Fauxmoi,2rqcm8,"Mark Hamill finally meets his mother, Natalie Portman",0,https://i.redd.it/asbbc5go1bbc1.jpeg,0.97,50,1704758300,2024-01-08T11:58:20+0000
2024-01-09T01,191zr2w,50,1950,tumblr,2r7hk,"South park fans are... something",0,https://i.redd.it/t4ijrjpsxabc1.jpeg,0.97,73,1704757003,2024-01-08T11:36:43+0000
2024-01-09T01,191z0tz,54,3910,WhitePeopleTwitter,35n7t,"Starting the year classy with Boebert!",0,https://i.redd.it/12fqzurdsabc1.png,0.98,256,1704755178,2024-01-08T11:06:18+0000
2024-01-09T01,191yt5s,6,6928,BlackPeopleTwitter,33x33,"Way too many criminal apologist defending this man",0,https://i.redd.it/dsbmygpvqabc1.jpeg,0.94,736,1704754668,2024-01-08T10:57:48+0000
2024-01-09T01,191ymi9,52,2147,CFB,2qm9d,"[Dellenger] As the crowd braves a rain and wind storm to get into NRG Stadium for the national championship game, a Washington fan screams at Michigan fans that their team “isn’t prepared to play in this kinda northwest weather.” The game will be played indoors.",0,https://x.com/rossdellenger/status/1744490677507965148?s=46&t=NSqMrWhSE7eHOVUPkoCjFQ,0.95,291,1704754213,2024-01-08T10:50:13+0000
2024-01-09T01,191ydmx,55,2278,PeterExplainsTheJoke,121h8r,"Petahhh, what is the funniest thing evahhh?",0,https://i.redd.it/jibcmwzpnabc1.jpeg,0.89,224,1704753606,2024-01-08T10:40:06+0000
2024-01-09T01,191ydlm,23,3671,KidsAreFuckingStupid,3948y,"Thats my homework dude! ",0,https://v.redd.it/tw1kh0ppnabc1,0.98,78,1704753604,2024-01-08T10:40:04+0000
2024-01-09T01,191y7us,4,10604,memes,2qjpg,"what game",0,https://i.redd.it/0qsciw1emabc1.png,0.97,1591,1704753207,2024-01-08T10:33:27+0000
2024-01-09T01,191y60p,40,2761,Presidents,2qwlm,"Give me Biden pic that goes harder than this",0,https://i.redd.it/7ewx6wg5mabc1.jpeg,0.76,976,1704753078,2024-01-08T10:31:18+0000
2024-01-09T01,191y4k0,77,1966,fightporn,2u5un,"Machete wielding lunatic gets flattened",0,https://v.redd.it/xf0s5hbrlabc1,0.97,137,1704752986,2024-01-08T10:29:46+0000
2024-01-09T01,191xwzy,99,1685,PublicFreakout,2yrq6,"1st Amendment Auditor Gets a Taste of His Own Medicine",0,https://v.redd.it/vk4ytjo6kabc1,0.83,535,1704752458,2024-01-08T10:20:58+0000
2024-01-09T01,191xmb9,70,4261,Damnthatsinteresting,2xxyj,"The top 100 most-watched U.S. television broadcasts of 2023.",0,https://i.redd.it/145dy113iabc1.jpeg,0.95,539,1704751729,2024-01-08T10:08:49+0000
2024-01-09T01,191x7xa,56,4821,BlackPeopleTwitter,33x33,"I can’t believe they had to do this to him",0,https://i.redd.it/z68uxm3dfabc1.jpeg,0.94,311,1704750796,2024-01-08T09:53:16+0000
2024-01-09T01,191x2sp,44,2773,golf,2qhcs,"Nike Post",0,https://i.redd.it/70hq3bbceabc1.jpeg,0.96,155,1704750451,2024-01-08T09:47:31+0000
2024-01-09T01,191wxvj,20,4672,NonPoliticalTwitter,39gt6y,"She gets my vote",0,https://i.redd.it/sm5yi10cdabc1.jpeg,0.97,59,1704750134,2024-01-08T09:42:14+0000
2024-01-09T01,191wt6c,86,4187,BeAmazed,363r3,"What is your fav?",0,https://v.redd.it/hzcxglkdcabc1,0.94,273,1704749810,2024-01-08T09:36:50+0000
2024-01-09T01,191wpci,7,8984,WhitePeopleTwitter,35n7t,"Mediaite Obtained Audio of Roger Stone Allegedly Discussing Assassinating Lawmakers",0,https://i.redd.it/h0n1bflobabc1.png,0.98,585,1704749559,2024-01-08T09:32:39+0000
2024-01-09T01,191wlne,71,4611,funny,2qh33,"the only solution",0,https://v.redd.it/5767w14saabc1,0.96,713,1704749331,2024-01-08T09:28:51+0000
2024-01-09T01,191wigs,14,6998,europe,2qh4j,"German Depression Aid campaign",0,https://i.redd.it/qei40jedaabc1.png,0.97,304,1704749119,2024-01-08T09:25:19+0000
2024-01-09T01,191w7w0,28,4464,ContagiousLaughter,2u2bh,"Drive-thru worker confirms every ordered item as a question",0,https://v.redd.it/m1f06haa8abc1,0.96,88,1704748423,2024-01-08T09:13:43+0000
2024-01-09T01,191w2b1,1,18039,MadeMeSmile,2uqcm,"Robert Downey Jr. praising Cillian Murphy",0,https://v.redd.it/wivk5j2u6abc1,0.96,404,1704748058,2024-01-08T09:07:38+0000
2024-01-09T01,191w15o,24,5595,whenthe,23gidu,"Stick in comments. ",0,https://v.redd.it/hvu96uoz6abc1,0.96,103,1704747980,2024-01-08T09:06:20+0000
2024-01-09T01,191vy5i,93,2225,mildlyinteresting,2ti4h,"My new dentist has an array of hand soaps to choose from.",0,https://i.redd.it/1rc28old6abc1.jpeg,0.98,113,1704747774,2024-01-08T09:02:54+0000
2024-01-09T01,191vxug,41,3467,lotrmemes,2v0i1,"One thing we can all agree on...",0,https://i.redd.it/ljq6ikbb6abc1.jpeg,0.93,251,1704747752,2024-01-08T09:02:32+0000
2024-01-09T01,191vkse,90,2468,me_irlgbt,3apfn,"Me🔌irlgbt",0,https://i.redd.it/o2o5gj1q3abc1.jpeg,0.98,51,1704746880,2024-01-08T08:48:00+0000
2024-01-09T01,191vke0,11,8560,lethalcompany,9al6ft,"I animated a cinematic trailer for Lethal Company :)",0,https://v.redd.it/3m4xf7jd3abc1,0.96,415,1704746853,2024-01-08T08:47:33+0000
2024-01-09T01,191vjrz,9,8468,worldnews,2qh13,"United Airlines find loose bolts on plug doors of at least five aircraft during Boeing 737 Max 9 inspections",0,https://theaircurrent.com/feed/dispatches/united-finds-loose-bolts-on-plug-doors-during-737-max-9-inspections/,0.98,914,1704746811,2024-01-08T08:46:51+0000
2024-01-09T01,191vi4q,33,4503,ProgrammerHumor,2tex6,itWorksOnMyMachine,0,https://i.redd.it/ghqvhf063abc1.jpeg,0.95,79,1704746695,2024-01-08T08:44:55+0000
2024-01-09T01,191vi4k,78,2742,Destiny,2qnvz,"Ed Krassenstein Here -- It was a pleasure to have Destiny on our side",1,https://www.reddit.com/r/Destiny/comments/191vi4k/ed_krassenstein_here_it_was_a_pleasure_to_have/,0.94,260,1704746695,2024-01-08T08:44:55+0000
2024-01-09T01,191vhsl,60,3128,discordVideos,2cxozx,"BROKE❤️",0,https://v.redd.it/n8b9wa5z2abc1,0.97,50,1704746673,2024-01-08T08:44:33+0000
2024-01-09T01,191vg8p,21,5593,antiwork,2y77d,"The chaotic good",0,https://i.redd.it/yd3dewc4b9bc1.png,0.96,51,1704746567,2024-01-08T08:42:47+0000
2024-01-09T01,191vf02,45,3485,news,2qh3l,"Iowa school students walk out of class to protest gun violence after Perry shooting",0,https://www.press-citizen.com/story/news/education/2024/01/08/student-walkout-held-across-iowa-to-protest-gun-violence-following-perry-high-school-shooting/72126542007/,0.92,311,1704746484,2024-01-08T08:41:24+0000
2024-01-09T01,191v6zo,17,6672,oddlyspecific,2wjlc,"I think I‘m gonna be sick",0,https://i.redd.it/y80mvjgy0abc1.jpeg,0.93,590,1704745950,2024-01-08T08:32:30+0000
2024-01-09T01,191v6pg,53,3620,dankmemes,2zmfe,"Both are bad and unhealthy",0,https://i.redd.it/g2qfduiw0abc1.jpeg,0.84,498,1704745933,2024-01-08T08:32:13+0000
2024-01-09T01,191v4sf,43,3695,formuladank,3ndbi,"this is a real post from the official haas tiktok account",0,https://v.redd.it/4iqlfv9j0abc1,0.96,65,1704745809,2024-01-08T08:30:09+0000
2024-01-09T01,191v47j,47,3542,dataisbeautiful,2tk95,"[OC] Is this the most dangerous gas station in America?",0,https://i.redd.it/jmy6s9pb0abc1.png,0.93,656,1704745772,2024-01-08T08:29:32+0000
2024-01-09T01,191v3mt,27,11557,pics,2qh0u,"Japanese animation legend Hayao Miyazaki wins first Golden Globe at 82",0,https://i.redd.it/07emn4oa0abc1.jpeg,0.98,206,1704745729,2024-01-08T08:28:49+0000
2024-01-09T01,191v37r,15,7421,pcmasterrace,2sgp1,"A good life",0,https://i.redd.it/2uaklew70abc1.jpeg,0.97,78,1704745703,2024-01-08T08:28:23+0000
2024-01-09T01,191v22h,12,8639,politics,2cneq,"Experts: Jack Smith’s “dramatic new proof” so “overwhelming” reluctant witnesses may decide to flip",0,https://www.salon.com/2024/01/08/experts-jack-smiths-dramatic-new-proof-so-overwhelming-reluctant-witnesses-may-decide-to-flip/,0.95,841,1704745629,2024-01-08T08:27:09+0000
2024-01-09T01,191v09l,8,16604,clevercomebacks,dyqlw,"Whatever floats your boat",0,https://i.redd.it/kocyfshnz9bc1.jpeg,0.92,782,1704745511,2024-01-08T08:25:11+0000
2024-01-09T01,191v02a,94,2483,OneOrangeBraincell,5vej89,"It’s my Gimli’s gotcha day can I see your babies as kittens",0,https://www.reddit.com/gallery/191v02a,0.98,185,1704745499,2024-01-08T08:24:59+0000
2024-01-09T01,191uwxd,80,2823,LifeProTips,2s5oq,"LPT: feed your contractors",1,https://www.reddit.com/r/LifeProTips/comments/191uwxd/lpt_feed_your_contractors/,0.9,361,1704745291,2024-01-08T08:21:31+0000
2024-01-09T01,191un33,5,19937,interestingasfuck,2qhsa,"Gas leak in South Korea.",0,https://v.redd.it/wy2caxy0x9bc1,0.96,790,1704744640,2024-01-08T08:10:40+0000
2024-01-09T01,191uj3z,18,7260,Damnthatsinteresting,2xxyj,"The fish that walk on land",0,https://v.redd.it/j05ye3udw9bc1,0.96,295,1704744414,2024-01-08T08:06:54+0000
2024-01-09T01,191uicx,96,2672,rareinsults,48t85,"On a post regarding the worst cities in the uk",0,https://i.redd.it/7a9rsro8w9bc1.jpeg,0.98,17,1704744364,2024-01-08T08:06:04+0000
2024-01-09T01,191uab5,74,3245,dontdeadopeninside,31t4s,"game over grant, cancer won",0,https://i.redd.it/hzoekoaou9bc1.jpeg,0.92,60,1704743840,2024-01-08T07:57:20+0000
2024-01-09T01,191u8pv,82,3080,GlowUps,ruinb,"From 550 lbs (28) to 265 lbs (30) in 24 months.",0,https://www.reddit.com/gallery/191u8pv,0.96,177,1704743733,2024-01-08T07:55:33+0000
2024-01-09T01,191u5b3,87,2989,ThatsInsane,swxxz,"Man who attacked Las Vegas judge is back in court, in front of the same judge.",0,https://i.redd.it/tgkgmy6nt9bc1.png,0.95,432,1704743498,2024-01-08T07:51:38+0000
2024-01-09T01,191u4kg,37,4747,NatureIsFuckingLit,3gdh7,"🔥 Polar bear enjoying some alone time",0,https://v.redd.it/a61w0ctat9bc1,0.98,96,1704743448,2024-01-08T07:50:48+0000
2024-01-09T01,191u48l,64,3502,Wellthatsucks,2xcv7,"Man who attacked Las Vegas judge is back in court, in front of the same judge.",0,https://i.redd.it/y0wxnynft9bc1.png,0.95,524,1704743428,2024-01-08T07:50:28+0000
2024-01-09T01,191trjo,2,52559,pics,2qh0u,"The man who lunged at a Las Vegas judge back in court, in front of the same judge",0,https://i.redd.it/gfqktrvxq9bc1.jpeg,0.95,4202,1704742582,2024-01-08T07:36:22+0000
2024-01-09T01,191to3k,3,33810,facepalm,2r5rp,"Kind of the entire reason for the presentation.",0,https://i.redd.it/j30sgo07q9bc1.jpeg,0.95,607,1704742345,2024-01-08T07:32:25+0000
2024-01-09T01,191tnpq,32,5753,gaming,2qh03,"Multiple Sources Indicate Xbox Is Looking To Go Third Party, With Ports In Development For PS5/Switch",0,https://twistedvoxel.com/xbox-looking-to-go-third-party-ports-for-ps5-switch-2/,0.94,1520,1704742320,2024-01-08T07:32:00+0000
2024-01-09T01,191tjvk,13,13492,me_irl,2vegg,me_irl,0,https://i.redd.it/6jlpo76dp9bc1.jpeg,0.96,238,1704742063,2024-01-08T07:27:43+0000
2024-01-09T01,191tjq3,31,6109,todayilearned,2qqjc,"TIL Baby Aspirin should not be given to babies as it can cause Reyes Syndrome",0,https://www.arnoldpalmerhospital.com/content-hub/why-you-shouldnt-give-aspirin-to-your-child,0.96,393,1704742052,2024-01-08T07:27:32+0000
2024-01-09T01,191tgfb,29,6998,technicallythetruth,3pzez,"everything is just a dictionary remix",0,https://i.redd.it/bk6erpjoo9bc1.png,0.96,48,1704741825,2024-01-08T07:23:45+0000
2024-01-09T01,191teko,69,3844,CuratedTumblr,3x5kfw,"Accidental Support Group",0,https://i.redd.it/l0ixh3yao9bc1.jpeg,0.97,150,1704741695,2024-01-08T07:21:35+0000
2024-01-09T01,191tbpz,10,14240,funny,2qh33,"I guess he was just looking for some motivation",0,https://v.redd.it/z8dsnfoin9bc1,0.91,556,1704741507,2024-01-08T07:18:27+0000
2024-01-09T01,191t3o3,61,4315,teenagers,2rjli,"What would u name him?",0,https://i.redd.it/u0xiuq45m9bc1.jpeg,0.94,2195,1704740974,2024-01-08T07:09:34+0000
2024-01-09T01,191t1j1,26,7205,AskReddit,2qh1i,"Who has most successfully milked what should have been 15 minutes of fame?",1,https://www.reddit.com/r/AskReddit/comments/191t1j1/who_has_most_successfully_milked_what_should_have/,0.93,6069,1704740831,2024-01-08T07:07:11+0000
2024-01-09T01,191swkk,49,4606,aww,2qh1o,"Somebody decided he had a lot to say during my zoom meeting",0,https://i.redd.it/q0knh2vuk9bc1.jpeg,0.95,119,1704740538,2024-01-08T07:02:18+0000
2024-01-09T01,191sku3,67,4368,wholesomememes,3gcwj,"Her Dad's response ❤",0,https://i.redd.it/ogqjtrfgi9bc1.jpeg,0.97,54,1704739744,2024-01-08T06:49:04+0000
2024-01-09T01,191s7gp,88,3960,SapphoAndHerFriend,voyv5,"Couldn't help but think how other nations do it differently, as well.",0,https://i.redd.it/fjwan4jhf9bc1.jpeg,0.93,87,1704738828,2024-01-08T06:33:48+0000
2024-01-09T01,191s7do,22,9413,cats,2qhta,"Actual excerpts from vet notes about my cat",0,https://i.redd.it/v2l32uxqf9bc1.jpeg,0.98,360,1704738822,2024-01-08T06:33:42+0000
2024-01-09T01,191s6qh,85,4341,ich_iel,37k29,ich_iel,0,https://i.redd.it/ffaag8smf9bc1.jpeg,0.86,182,1704738779,2024-01-08T06:32:59+0000
2024-01-09T01,191s684,48,6095,shitposting,2usxq,Focus,0,https://v.redd.it/d9ae0toif9bc1,0.97,68,1704738742,2024-01-08T06:32:22+0000
2024-01-09T01,191s5vx,25,14600,StupidFood,37se4,"Crimes against an entire nation.",0,https://v.redd.it/6domilm6f9bc1,0.79,1057,1704738719,2024-01-08T06:31:59+0000
2024-01-09T01,191rpq5,79,14022,memes,2qjpg,"How to made yourself a villain for the entire community.",0,https://i.redd.it/4uoe2qy7c9bc1.jpeg,0.94,197,1704737632,2024-01-08T06:13:52+0000
2024-01-09T01,191rky7,89,4379,meirl,2s5ti,meirl,0,https://i.redd.it/aeb9mua9b9bc1.jpeg,0.99,50,1704737309,2024-01-08T06:08:29+0000
2024-01-09T01,191rh60,51,5750,DOG,2qiy5,"He was so excited for this",0,https://v.redd.it/9osuy8dfa9bc1,0.98,74,1704737049,2024-01-08T06:04:09+0000
2024-01-09T01,191r843,81,5746,cursedcomments,hw1ju,cursed_spareparts,0,https://i.redd.it/gsagj9gk89bc1.jpeg,0.96,35,1704736469,2024-01-08T05:54:29+0000
2024-01-09T01,191r7q0,65,5412,PrequelMemes,3i60n,"They're in the ventilation shafts...",0,https://i.redd.it/9lztgc1c89bc1.png,0.96,90,1704736443,2024-01-08T05:54:03+0000
2024-01-09T01,191r7nf,16,16411,FluentInFinance,3qpaq8,"President Biden says Billionaires have a moral obligation to contribute to society, not just hoard wealth. It's time for them to pay their fair share. Do you agree or disagree?",0,https://i.redd.it/otbskjzl89bc1.png,0.88,3603,1704736438,2024-01-08T05:53:58+0000
2024-01-09T01,191qnz5,72,5259,blunderyears,2vy3g,"This was my best friend & I before a night outing to Walmart",0,https://i.redd.it/hnz6ugkt49bc1.jpeg,0.97,219,1704735143,2024-01-08T05:32:23+0000
2024-01-09T01,191qgyq,66,5678,BaldursGate3,12967t,"PC players are given freedom, console players railroaded.",0,https://i.redd.it/8zg2lsg539bc1.png,0.95,267,1704734688,2024-01-08T05:24:48+0000
2024-01-09T01,191qdrl,75,5667,megalophobia,31gwh,"First wind-powered cargo ship...",0,https://i.redd.it/6rpyqkyr29bc1.jpeg,0.93,679,1704734474,2024-01-08T05:21:14+0000
2024-01-09T01,191q7vq,30,11906,mildlyinfuriating,2ubgg,"Some guy just stole a coffee and tried to have me pick up the tab",1,https://www.reddit.com/r/mildlyinfuriating/comments/191q7vq/some_guy_just_stole_a_coffee_and_tried_to_have_me/,0.96,617,1704734081,2024-01-08T05:14:41+0000
2024-01-09T01,191q427,73,5867,AllThatIsInteresting,93l1mw,"Disturbing bodycam footage shows the moment 23-year-old Chloe Jones was rescued after being kidnapped, beaten and held captive for four days by William Mozingo in October 2023.",0,https://v.redd.it/bxe4insu09bc1,0.94,833,1704733821,2024-01-08T05:10:21+0000
2024-01-09T01,191q24x,63,37592,facepalm,2r5rp,"Is it creepy to be a good dad?",0,https://i.redd.it/n4gj7jah09bc1.png,0.89,7290,1704733688,2024-01-08T05:08:08+0000
2024-01-09T01,191po9d,35,10095,AITAH,446kys,"AITA for saying to my mom at family dinner “well I wouldn’t stay with a man who hits my kids so I guess we have different priorities”",1,https://www.reddit.com/r/AITAH/comments/191po9d/aita_for_saying_to_my_mom_at_family_dinner_well_i/,0.94,1477,1704732728,2024-01-08T04:52:08+0000
2024-01-09T01,191pefi,68,7319,absolutelynotme_irl,3b5ss,absolutelynotme_irl,0,https://i.redd.it/5mcz3k6kv8bc1.png,0.94,138,1704732034,2024-01-08T04:40:34+0000
2024-01-09T01,191pd9w,39,11736,maybemaybemaybe,38e1l,"Maybe maybe maybe ",0,https://v.redd.it/9l17z8rbv8bc1,0.92,512,1704731951,2024-01-08T04:39:11+0000
2024-01-09T01,191pcok,19,27175,BeAmazed,363r3,"As of 2022",0,https://i.redd.it/fm6bd427v8bc1.jpeg,0.93,719,1704731907,2024-01-08T04:38:27+0000
2024-01-09T01,191pa0m,42,10059,SpidermanPS4,3f1fs,"MJ's model speaks out. To whoever has done this, you should feel ashamed.",0,https://i.redd.it/e2gqyzhmu8bc1.jpeg,0.91,1240,1704731715,2024-01-08T04:35:15+0000
2024-01-09T01,191orqw,58,8052,PoliticalHumor,2qm21,"vote ?",0,https://i.redd.it/3uk1oojsq8bc1.jpeg,0.89,823,1704730434,2024-01-08T04:13:54+0000
2024-01-09T01,191opod,91,6028,fixedbytheduet,46tcaa,"What’s for dinner tonight?",0,https://v.redd.it/vjb82fedq8bc1,0.93,156,1704730288,2024-01-08T04:11:28+0000
2024-01-09T01,191omdf,36,12072,JeffArcuri,740oig,"Pregnant ladies",0,https://v.redd.it/16o2uerfp8bc1,0.92,203,1704730051,2024-01-08T04:07:31+0000
2024-01-09T01,191ohgz,76,7280,OldSchoolCool,2tycb,"Nurses show newborn triplets to their father in a New York hospital, 1946",0,https://i.redd.it/uvjzy5rjo8bc1.jpeg,0.94,198,1704729703,2024-01-08T04:01:43+0000
2024-01-09T01,191oc2i,92,7569,meme,2qi1r,"Nice try.",0,https://i.redd.it/jf0hm5hin8bc1.jpeg,0.97,50,1704729322,2024-01-08T03:55:22+0000
2024-01-09T01,191nwj5,34,20433,Embroidery,2rh53,"3 years of work 😅 Only you guys will appreciate it",0,https://i.redd.it/3xqieiq4k8bc1.jpeg,0.96,521,1704728186,2024-01-08T03:36:26+0000
2024-01-09T01,191nvcs,100,6322,nba,2qo4s,"[Wojnarowski] In a new edition of the Draymond Green Show, Golden State’s star suggests that Adam Silver talked him out of retirement: “I told him, ‘Adam this is too much for me…It’s all becoming too much for me – and I’m going to retire.’” Story on ESPN:",0,https://twitter.com/wojespn/status/1744382149145297378,0.92,1577,1704728102,2024-01-08T03:35:02+0000
2024-01-09T01,191nmlj,98,7741,therewasanattempt,39ne7,"To walk with your child holding a white flag",0,https://v.redd.it/ow9yo65wh8bc1,0.86,1174,1704727434,2024-01-08T03:23:54+0000
2024-01-09T01,191ndn4,57,12614,Eyebleach,2s427,"When you’re the handsomest of all the boyz…",0,https://i.imgur.com/D4U9U3P.gifv,0.93,87,1704726756,2024-01-08T03:12:36+0000
2024-01-09T01,191n4zn,83,9250,StrangerThings,3adlm,"'Stranger Things 5' Officially Begins Production",0,https://i.redd.it/60pm6opwd8bc1.jpeg,0.9,739,1704726097,2024-01-08T03:01:37+0000
2024-01-09T01,191n1wd,38,42987,Unexpected,2w67q,"The real answer to the trolley problem",0,https://v.redd.it/3fupodx9d8bc1,0.85,707,1704725881,2024-01-08T02:58:01+0000
2024-01-09T01,191mzo2,95,13298,videogames,2qhzy,"pC mAsTeR rAcE",0,https://i.redd.it/ziiwc89oc8bc1.png,0.76,2359,1704725702,2024-01-08T02:55:02+0000
2024-01-09T01,191mtpj,46,20003,comics,2qh0s,"Direct brain injector",0,https://www.reddit.com/gallery/191mtpj,0.94,452,1704725212,2024-01-08T02:46:52+0000
2024-01-09T01,191mj36,59,14999,oddlysatisfying,2x93b,"Machine automates the process of levelling and troweling",0,https://v.redd.it/vlz9qu4o88bc1,0.92,656,1704724351,2024-01-08T02:32:31+0000
2024-01-09T01,191m205,84,12639,MapPorn,2si92,"The size of the Roman Empire at its height compared to the United States",0,https://i.redd.it/t14qh2qp48bc1.png,0.92,1099,1704723000,2024-01-08T02:10:00+0000
2024-01-09T00,191yt5s,80,2984,BlackPeopleTwitter,33x33,"Way too many criminal apologist defending this man",0,https://i.redd.it/dsbmygpvqabc1.jpeg,0.96,428,1704754668,2024-01-08T10:57:48+0000
2024-01-09T00,191ydlm,70,1695,KidsAreFuckingStupid,3948y,"Thats my homework dude! ",0,https://v.redd.it/tw1kh0ppnabc1,0.99,53,1704753604,2024-01-08T10:40:04+0000
2024-01-09T00,191y7us,78,3656,memes,2qjpg,"what game",0,https://i.redd.it/0qsciw1emabc1.png,0.98,570,1704753207,2024-01-08T10:33:27+0000
2024-01-09T00,191y6ty,39,2306,meirl,2s5ti,Meirl,0,https://i.imgur.com/zDQdbu5.jpg,0.98,188,1704753134,2024-01-08T10:32:14+0000
2024-01-09T00,191xmif,5,9493,Unexpected,2w67q,"First date with the quiet girl",0,https://v.redd.it/l12dkhb6iabc1,0.9,453,1704751741,2024-01-08T10:09:01+0000
2024-01-09T00,191x7xa,19,3720,BlackPeopleTwitter,33x33,"I can’t believe they had to do this to him",0,https://i.redd.it/z68uxm3dfabc1.jpeg,0.95,250,1704750796,2024-01-08T09:53:16+0000
2024-01-09T00,191x2sp,66,1973,golf,2qhcs,"Nike Post",0,https://i.redd.it/70hq3bbceabc1.jpeg,0.97,115,1704750451,2024-01-08T09:47:31+0000
2024-01-09T00,191wxvj,53,2176,NonPoliticalTwitter,39gt6y,"She gets my vote",0,https://i.redd.it/sm5yi10cdabc1.jpeg,0.98,29,1704750134,2024-01-08T09:42:14+0000
2024-01-09T00,191wpci,9,5815,WhitePeopleTwitter,35n7t,"Mediaite Obtained Audio of Roger Stone Allegedly Discussing Assassinating Lawmakers",0,https://i.redd.it/h0n1bflobabc1.png,0.98,399,1704749559,2024-01-08T09:32:39+0000
2024-01-09T00,191wigs,14,5014,europe,2qh4j,"German Depression Aid campaign",0,https://i.redd.it/qei40jedaabc1.png,0.97,216,1704749119,2024-01-08T09:25:19+0000
2024-01-09T00,191why6,1,13150,StarWars,2qi4s,"This is going to be my favorite tweet of 2024",0,https://i.redd.it/fqbg02u9aabc1.jpeg,0.96,355,1704749084,2024-01-08T09:24:44+0000
2024-01-09T00,191w3x9,72,2260,ExplainTheJoke,2vmj2,"My girlfriend shared this to me. What does it mean?",0,https://i.redd.it/2sor5cue7abc1.png,0.93,288,1704748164,2024-01-08T09:09:24+0000
2024-01-09T00,191w2b1,3,12517,MadeMeSmile,2uqcm,"Robert Downey Jr. praising Cillian Murphy",0,https://v.redd.it/wivk5j2u6abc1,0.97,290,1704748058,2024-01-08T09:07:38+0000
2024-01-09T00,191w15o,23,4314,whenthe,23gidu,"Stick in comments. ",0,https://v.redd.it/hvu96uoz6abc1,0.97,78,1704747980,2024-01-08T09:06:20+0000
2024-01-09T00,191vxug,58,2388,lotrmemes,2v0i1,"One thing we can all agree on...",0,https://i.redd.it/ljq6ikbb6abc1.jpeg,0.93,202,1704747752,2024-01-08T09:02:32+0000
2024-01-09T00,191vke0,11,6376,lethalcompany,9al6ft,"I animated a cinematic trailer for Lethal Company :)",0,https://v.redd.it/3m4xf7jd3abc1,0.96,361,1704746853,2024-01-08T08:47:33+0000
2024-01-09T00,191vjrz,16,5137,worldnews,2qh13,"United Airlines find loose bolts on plug doors of at least five aircraft during Boeing 737 Max 9 inspections",0,https://theaircurrent.com/feed/dispatches/united-finds-loose-bolts-on-plug-doors-during-737-max-9-inspections/,0.98,568,1704746811,2024-01-08T08:46:51+0000
2024-01-09T00,191vi4k,69,2411,Destiny,2qnvz,"Ed Krassenstein Here -- It was a pleasure to have Destiny on our side",1,https://www.reddit.com/r/Destiny/comments/191vi4k/ed_krassenstein_here_it_was_a_pleasure_to_have/,0.95,243,1704746695,2024-01-08T08:44:55+0000
2024-01-09T00,191vhsl,62,2539,discordVideos,2cxozx,"BROKE❤️",0,https://v.redd.it/n8b9wa5z2abc1,0.97,39,1704746673,2024-01-08T08:44:33+0000
2024-01-09T00,191vg8p,31,3818,antiwork,2y77d,"The chaotic good",0,https://i.redd.it/yd3dewc4b9bc1.png,0.97,35,1704746567,2024-01-08T08:42:47+0000
2024-01-09T00,191v6zo,27,4139,oddlyspecific,2wjlc,"I think I‘m gonna be sick",0,https://i.redd.it/y80mvjgy0abc1.jpeg,0.94,361,1704745950,2024-01-08T08:32:30+0000
2024-01-09T00,191v6pg,49,3011,dankmemes,2zmfe,"Both are bad and unhealthy",0,https://i.redd.it/g2qfduiw0abc1.jpeg,0.85,427,1704745933,2024-01-08T08:32:13+0000
2024-01-09T00,191v4sf,45,2992,formuladank,3ndbi,"this is a real post from the official haas tiktok account",0,https://v.redd.it/4iqlfv9j0abc1,0.97,58,1704745809,2024-01-08T08:30:09+0000
2024-01-09T00,191v47j,55,2669,dataisbeautiful,2tk95,"[OC] Is this the most dangerous gas station in America?",0,https://i.redd.it/jmy6s9pb0abc1.png,0.93,535,1704745772,2024-01-08T08:29:32+0000
2024-01-09T00,191v3mt,46,6317,pics,2qh0u,"Japanese animation legend Hayao Miyazaki wins first Golden Globe at 82",0,https://i.redd.it/07emn4oa0abc1.jpeg,0.99,112,1704745729,2024-01-08T08:28:49+0000
2024-01-09T00,191v37r,20,4935,pcmasterrace,2sgp1,"A good life",0,https://i.redd.it/2uaklew70abc1.jpeg,0.97,53,1704745703,2024-01-08T08:28:23+0000
2024-01-09T00,191v22h,13,6052,politics,2cneq,"Experts: Jack Smith’s “dramatic new proof” so “overwhelming” reluctant witnesses may decide to flip",0,https://www.salon.com/2024/01/08/experts-jack-smiths-dramatic-new-proof-so-overwhelming-reluctant-witnesses-may-decide-to-flip/,0.96,613,1704745629,2024-01-08T08:27:09+0000
2024-01-09T00,191v09l,7,13167,clevercomebacks,dyqlw,"Whatever floats your boat",0,https://i.redd.it/kocyfshnz9bc1.jpeg,0.93,669,1704745511,2024-01-08T08:25:11+0000
2024-01-09T00,191un33,6,15882,interestingasfuck,2qhsa,"Gas leak in South Korea.",0,https://v.redd.it/wy2caxy0x9bc1,0.97,664,1704744640,2024-01-08T08:10:40+0000
2024-01-09T00,191uj3z,22,5129,Damnthatsinteresting,2xxyj,"The fish that walk on land",0,https://v.redd.it/j05ye3udw9bc1,0.97,216,1704744414,2024-01-08T08:06:54+0000
2024-01-09T00,191uab5,92,2285,dontdeadopeninside,31t4s,"game over grant, cancer won",0,https://i.redd.it/hzoekoaou9bc1.jpeg,0.93,49,1704743840,2024-01-08T07:57:20+0000
2024-01-09T00,191u8pv,91,2304,GlowUps,ruinb,"From 550 lbs (28) to 265 lbs (30) in 24 months.",0,https://www.reddit.com/gallery/191u8pv,0.97,141,1704743733,2024-01-08T07:55:33+0000
2024-01-09T00,191u5b3,83,2497,ThatsInsane,swxxz,"Man who attacked Las Vegas judge is back in court, in front of the same judge.",0,https://i.redd.it/tgkgmy6nt9bc1.png,0.96,381,1704743498,2024-01-08T07:51:38+0000
2024-01-09T00,191u4kg,44,3449,NatureIsFuckingLit,3gdh7,"🔥 Polar bear enjoying some alone time",0,https://v.redd.it/a61w0ctat9bc1,0.97,72,1704743448,2024-01-08T07:50:48+0000
2024-01-09T00,191trjo,2,46822,pics,2qh0u,"The man who lunged at a Las Vegas judge back in court, in front of the same judge",0,https://i.redd.it/gfqktrvxq9bc1.jpeg,0.95,3827,1704742582,2024-01-08T07:36:22+0000
2024-01-09T00,191to3k,4,28050,facepalm,2r5rp,"Kind of the entire reason for the presentation.",0,https://i.redd.it/j30sgo07q9bc1.jpeg,0.96,525,1704742345,2024-01-08T07:32:25+0000
