date,id,position,score,subreddit_display_name,subreddit_id,title,is_self,url,upvote_ratio,num_comments,created,created_date
2024-01-06T11,18zwiwf,40,1246,pcmasterrace,2sgp1,"First build, is that enough fans ?",0,https://i.redd.it/e6redv6djsac1.jpeg,0.96,290,1704534218,2024-01-06T09:43:38+0000
2024-01-06T11,18zw2c8,66,852,PrequelMemes,3i60n,"Directed by Michael Bay",0,https://v.redd.it/pbc08ypmdsac1,0.99,46,1704532289,2024-01-06T09:11:29+0000
2024-01-06T11,18zuumc,72,1886,Damnthatsinteresting,2xxyj,"Sometimes, deer get their antlers stuck together and this can lead to the death of one or both of them. The only way to rescue them may be to cut their antlers.",0,https://v.redd.it/ngj4816qyrac1,0.96,202,1704527376,2024-01-06T07:49:36+0000
2024-01-06T11,18zut77,26,2113,Whatcouldgowrong,2x2oy,"Touching machinery in operation",0,https://v.redd.it/s099r6siyrac1,0.89,334,1704527207,2024-01-06T07:46:47+0000
2024-01-06T11,18zumzj,62,1272,ich_iel,37k29,"ich🚜🪧📢iel",0,https://i.redd.it/8rgujjzjwrac1.jpeg,0.96,110,1704526546,2024-01-06T07:35:46+0000
2024-01-06T11,18zufal,84,1004,PeterExplainsTheJoke,121h8r,"This sub is going down hill.",0,https://i.redd.it/vel4nut3urac1.jpeg,0.86,105,1704525722,2024-01-06T07:22:02+0000
2024-01-06T11,18zuc0e,60,1343,CuratedTumblr,3x5kfw,Predators,0,https://i.redd.it/lrqfh974trac1.jpeg,0.97,28,1704525390,2024-01-06T07:16:30+0000
2024-01-06T11,18zu953,82,1087,nextfuckinglevel,m0bnr,"Iconic moment during the opening ceremony of Barcelona 1992 when the Olympic Flame was lit by archer Antonio Rebello",0,https://v.redd.it/6l8pez69srac1,0.96,44,1704525102,2024-01-06T07:11:42+0000
2024-01-06T11,18zu6wj,11,3889,Damnthatsinteresting,2xxyj,"Tank Shell Narrowly Avoids Hitting Its Target",0,https://v.redd.it/5bylnyiirrac1,0.98,117,1704524867,2024-01-06T07:07:47+0000
2024-01-06T11,18ztsbx,3,7499,Awww,2suml,"""Liberation, Sort Of...""",0,https://v.redd.it/nk9e7gz0nrac1,0.99,107,1704523375,2024-01-06T06:42:55+0000
2024-01-06T11,18ztre3,14,3803,shitposting,2usxq,"💀💀💀💀",0,https://i.redd.it/8j6a1jjsmrac1.png,0.98,160,1704523279,2024-01-06T06:41:19+0000
2024-01-06T11,18ztfwj,50,1802,Funnymemes,2xqtc,"😎😎😎",0,https://i.redd.it/u85dfwsyirac1.jpeg,0.96,26,1704522097,2024-01-06T06:21:37+0000
2024-01-06T11,18ztcri,20,6186,pics,2qh0u,"A man who did his duty on 1/6/21",0,https://i.redd.it/enmwnj4firac1.jpeg,0.89,334,1704521793,2024-01-06T06:16:33+0000
2024-01-06T11,18ztcit,79,1326,cursedcomments,hw1ju,Cursed_Parents,0,https://i.redd.it/shgo2thcirac1.jpeg,0.99,15,1704521769,2024-01-06T06:16:09+0000
2024-01-06T11,18zt1rx,67,1461,bollywoodmemes,12ppxo,"Average Indian audience and their hypocrisy.",0,https://i.redd.it/ygdaheugfrac1.jpeg,0.91,168,1704520801,2024-01-06T06:00:01+0000
2024-01-06T11,18zt15q,95,1190,Anticonsumption,2r83n,"Humans are not the virus",0,https://i.redd.it/dqu1mtdafrac1.jpeg,0.84,125,1704520744,2024-01-06T05:59:04+0000
2024-01-06T11,18zsyki,16,10505,meirl,2s5ti,Meirl,0,https://i.redd.it/fkwk2qfierac1.png,0.98,136,1704520487,2024-01-06T05:54:47+0000
2024-01-06T11,18zsxfc,89,1289,HonkaiStarRail,4q5zoc,"Did we ever have a choice?",0,https://v.redd.it/eeq8zwdddrac1,0.96,99,1704520373,2024-01-06T05:52:53+0000
2024-01-06T11,18zsrn9,99,4582,facepalm,2r5rp,"who won?",0,https://i.redd.it/vsm580uhcrac1.jpeg,0.97,288,1704519807,2024-01-06T05:43:27+0000
2024-01-06T11,18zs9y8,75,1587,shittymoviedetails,3mj3w,"In Bridge To Terabithia (2007), Mrs Edmunds takes her 11 year old student Jess on a one-on-one field trip, which was essentially a date. I don't know man, sounds like grooming to me",0,https://i.redd.it/bv1mkrck7rac1.png,0.96,64,1704518143,2024-01-06T05:15:43+0000
2024-01-06T11,18zs69t,4,9634,mildlyinfuriating,2ubgg,"People rendering the concept of reusable Cups useless",0,https://i.redd.it/h2ulmxjk6rac1.jpeg,0.93,567,1704517807,2024-01-06T05:10:07+0000
2024-01-06T11,18zrv8e,6,8109,facepalm,2r5rp,"The American dream",0,https://i.redd.it/bunj0amk3rac1.png,0.95,1094,1704516814,2024-01-06T04:53:34+0000
2024-01-06T11,18zrue2,41,3053,meme,2qi1r,"Both Alaska and Texas can fit into Western Australia",0,https://i.redd.it/gifqkagc3rac1.jpeg,0.9,440,1704516736,2024-01-06T04:52:16+0000
2024-01-06T11,18zrrx4,53,2223,aviation,2qhu8,"10 week old 737 MAX Alaska Airlines 1282 successful return to Portland",0,https://v.redd.it/yzc96e0p2rac1,0.96,574,1704516516,2024-01-06T04:48:36+0000
2024-01-06T11,18zrqku,12,6597,madlads,3aegn,"Not all madlads wear capes",0,https://i.redd.it/dthwwnkd2rac1.jpeg,0.91,178,1704516397,2024-01-06T04:46:37+0000
2024-01-06T11,18zrmzs,2,17216,meirl,2s5ti,Meirl,0,https://i.redd.it/q6ypu24f1rac1.jpeg,0.95,968,1704516076,2024-01-06T04:41:16+0000
2024-01-06T11,18zrlbn,96,6080,meirl,2s5ti,meirl,0,https://i.redd.it/qwcmt9qy0rac1.png,0.98,180,1704515928,2024-01-06T04:38:48+0000
2024-01-06T11,18zrhs3,23,3942,wallstreetbets,2th52,"Boeing is so Screwed",0,https://i.redd.it/o3cdskw10rac1.jpeg,0.95,950,1704515615,2024-01-06T04:33:35+0000
2024-01-06T11,18zr3vv,57,2476,AnimalMemes,2wynd,"skinny guy plays dead",0,https://v.redd.it/0nh9q5g2wqac1,0.96,73,1704514378,2024-01-06T04:12:58+0000
2024-01-06T11,18zr3ig,85,3426,MadeMeSmile,2uqcm,"Dad moment",0,https://i.imgur.com/dbXU25O.gifv,0.96,39,1704514345,2024-01-06T04:12:25+0000
2024-01-06T11,18zr0xi,80,1886,PublicFreakout,2yrq6,"Girl Gets Her Boyfriend KOED",0,https://v.redd.it/wyt8z15kvqac1,0.93,227,1704514104,2024-01-06T04:08:24+0000
2024-01-06T11,18zqyh9,78,1941,NatureIsFuckingLit,3gdh7,"🔥 This is how a chameleon gives birth 🔥",0,https://i.imgur.com/iKLUmfn.gifv,0.93,72,1704513883,2024-01-06T04:04:43+0000
2024-01-06T11,18zqxhh,29,4285,nonononoyes,2xp2p,"Machine vs nature",0,https://i.redd.it/t06ri11muqac1.gif,0.92,234,1704513791,2024-01-06T04:03:11+0000
2024-01-06T11,18zqs54,33,4035,Showerthoughts,2szyo,"Robert Downey Jr might be the last mainstream actor in history to get away with blackface.",1,https://www.reddit.com/r/Showerthoughts/comments/18zqs54/robert_downey_jr_might_be_the_last_mainstream/,0.84,773,1704513329,2024-01-06T03:55:29+0000
2024-01-06T11,18zqnn0,5,15010,technicallythetruth,3pzez,"That’s how vents work",0,https://i.redd.it/73wmf053sqac1.jpeg,0.96,58,1704512938,2024-01-06T03:48:58+0000
2024-01-06T11,18zqfw6,18,5953,SipsTea,5tdqj0,"When a local gives you a warning, you should probably listen...",0,https://v.redd.it/k8oxekh5qqac1,0.97,530,1704512288,2024-01-06T03:38:08+0000
2024-01-06T11,18zqe31,74,2154,CatastrophicFailure,38tab,"Alaska Airlines flight from Portland, OR to Ontario, Ca has rapid depressurization and has window/side blown out 1/5/24",0,https://www.reddit.com/gallery/18zqe31,0.97,369,1704512125,2024-01-06T03:35:25+0000
2024-01-06T11,18zq7iu,88,2059,Grimdank,3ilna,"A normal day for the arbites be like: ",0,https://v.redd.it/zvhudgh0oqac1,0.97,44,1704511571,2024-01-06T03:26:11+0000
2024-01-06T11,18zq55p,1,27642,pics,2qh0u,"When you hear a huge boom at 25k feet.",0,https://www.reddit.com/gallery/18zq55p,0.97,3290,1704511366,2024-01-06T03:22:46+0000
2024-01-06T11,18zq2mm,22,5469,wholesomememes,3gcwj,"Mark Hamill is amazing",0,https://i.redd.it/lcoo7izemqac1.jpeg,0.97,113,1704511153,2024-01-06T03:19:13+0000
2024-01-06T11,18zpu2c,13,8504,BaldursGate3,12967t,"Literally me",0,https://i.redd.it/8xbt8o2okqac1.jpeg,0.95,443,1704510441,2024-01-06T03:07:21+0000
2024-01-06T11,18zpr6m,15,8745,me_irl,2vegg,me_irl,0,https://v.redd.it/4pu05hzujqac1,0.95,215,1704510204,2024-01-06T03:03:24+0000
2024-01-06T11,18zpqb4,27,5349,MadeMeSmile,2uqcm,"This is heartwarming",0,https://v.redd.it/hr69lk4qjqac1,0.94,116,1704510134,2024-01-06T03:02:14+0000
2024-01-06T11,18zpprp,46,3646,nottheonion,2qnts,"White Claw launches new 0% alcohol seltzers: 'Depth of flavor and complexity'",0,https://www.foxbusiness.com/lifestyle/white-claw-launches-0-percent-alcohol-seltzers-depth-flavor-complexity,0.94,404,1704510092,2024-01-06T03:01:32+0000
2024-01-06T11,18zppoi,87,2283,CricketShitpost,3fzqh,"If Star sports made a poster for Warner, it would look like this !",0,https://i.redd.it/q5zuusvljqac1.png,0.96,70,1704510086,2024-01-06T03:01:26+0000
2024-01-06T11,18zpo05,86,4457,Awww,2suml,"she tried her best",0,https://v.redd.it/fi0blnz8jqac1,0.99,15,1704509972,2024-01-06T02:59:32+0000
2024-01-06T11,18zpn31,83,2325,Hololive,29numb,"Both Fuwawa's and Mococo's New Year's Outfits are so cute!",0,https://www.reddit.com/gallery/18zpn31,0.93,78,1704509895,2024-01-06T02:58:15+0000
2024-01-06T11,18zpl85,52,3394,FunnyandSad,2z7qd,"strong and ready",0,https://i.redd.it/75gcjjr1hqac1.jpeg,0.94,140,1704509735,2024-01-06T02:55:35+0000
2024-01-06T11,18zphj0,8,11005,todayilearned,2qqjc,"TIL that Queen Anne of Great Britain had seven miscarriages, five stillbirths, two children who died shortly after birth, two who died in infancy, and one who died at age 11. She left no heirs and was succeeded by her second cousin.",0,"https://en.wikipedia.org/wiki/Anne,_Queen_of_Great_Britain",0.96,517,1704509434,2024-01-06T02:50:34+0000
2024-01-06T11,18zpcjm,30,5099,worldnews,2qh13,"Russia Got 7,500-Pound Rockets From North Korea - And promptly Blew Up A Pair Of Ukraine Supply Bases",0,https://www.forbes.com/sites/davidaxe/2024/01/05/russia-got-7500-pound-rockets-from-north-korea-and-promptly-blew-up-a-pair-of-ukrainian-supply-bases/?utm_source=flipboard&utm_content=LindaCypert%2Fmagazine%2F%0AImportant+Trending+Stories+&sh=2134fd8f363f,0.94,825,1704509034,2024-01-06T02:43:54+0000
2024-01-06T11,18zougq,49,3792,WTF,2qh61,"The results of 30 years of chain-smoking inside a living room.",0,https://i.redd.it/dw8jez77cqac1.jpeg,0.96,263,1704507595,2024-01-06T02:19:55+0000
2024-01-06T11,18zos3t,10,11515,WhitePeopleTwitter,35n7t,"Biden from the top rope",0,https://i.redd.it/qa4j5r2nbqac1.jpeg,0.95,285,1704507405,2024-01-06T02:16:45+0000
2024-01-06T11,18zoqni,56,8928,shitposting,2usxq,"Parking lots are very interesting",0,https://v.redd.it/e4xg2j6abqac1,0.95,413,1704507290,2024-01-06T02:14:50+0000
2024-01-06T11,18zontq,36,18542,facepalm,2r5rp,"Gotta love the magic of unintentional, spontaneous photoshoots",0,https://i.redd.it/m7jcf2mlaqac1.jpeg,0.93,637,1704507063,2024-01-06T02:11:03+0000
2024-01-06T11,18zojzp,94,2440,dataisbeautiful,2tk95,"There are more cows than people in the states colored blue. [OC]",0,https://i.redd.it/uajbckao9qac1.png,0.93,240,1704506759,2024-01-06T02:05:59+0000
2024-01-06T11,18zoehm,39,5856,Unexpected,2w67q,"The problem was solved instantly.",0,https://v.redd.it/nyhlkwsh8qac1,0.87,216,1704506348,2024-01-06T01:59:08+0000
2024-01-06T11,18zo5t6,47,4577,CrappyDesign,2sa3m,"Hotel key card that doesn't fit in your wallet",0,https://i.redd.it/5mtgshog6qac1.jpeg,0.95,245,1704505665,2024-01-06T01:47:45+0000
2024-01-06T11,18znyt0,61,3896,nflcirclejerk,2sulf,"the liberals have discovered pat mcafee",0,https://i.redd.it/35p7hvwv4qac1.jpeg,0.88,470,1704505134,2024-01-06T01:38:54+0000
2024-01-06T11,18znwz5,44,5227,Presidents,2qwlm,"Why was Obama’s tan suit so controversial?",0,https://i.redd.it/c3xpmq2g4qac1.jpeg,0.88,1904,1704504986,2024-01-06T01:36:26+0000
2024-01-06T11,18znpw2,7,33189,BeAmazed,363r3,"Marissa Tomei through the years ",0,https://v.redd.it/x6hs7jbd2qac1,0.92,1935,1704504449,2024-01-06T01:27:29+0000
2024-01-06T11,18znpuw,38,6006,nba,2qo4s,"[Slater] Steve Kerr: “I played 15 years and all 15 I was frustrated with my playing time.”",0,https://x.com/anthonyvslater/status/1743443483673919580?s=46&t=gEvQlnNLbU9ke0xn1kR1YA,0.95,765,1704504446,2024-01-06T01:27:26+0000
2024-01-06T11,18znnct,42,5649,Eyebleach,2s427,"His first sound sleep after being adopted from a shelter.",0,https://i.redd.it/fr75rgl62qac1.jpeg,0.97,64,1704504258,2024-01-06T01:24:18+0000
2024-01-06T11,18znlfe,35,7316,ExplainTheJoke,2vmj2,"What happened?",0,https://i.redd.it/y0fwv4ts1qac1.jpeg,0.94,280,1704504101,2024-01-06T01:21:41+0000
2024-01-06T11,18znfqh,76,3425,lego,2qhm7,"All set up in the new cubicle!",0,https://i.redd.it/fgqgtafi0qac1.jpeg,0.93,180,1704503663,2024-01-06T01:14:23+0000
2024-01-06T11,18zndq3,37,6800,interestingasfuck,2qhsa,"how hockey rinks get set up for a game",0,https://v.redd.it/x65n1fnzzpac1,0.95,307,1704503500,2024-01-06T01:11:40+0000
2024-01-06T11,18zn4y0,73,3823,lies,2qloj,"accidentally dropped my phone from our balcony and it did this",0,https://v.redd.it/japw7twuxpac1,0.89,127,1704502839,2024-01-06T01:00:39+0000
2024-01-06T11,18zn127,9,17585,news,2qh3l,"Alaska's snow crab season canceled for second year in a row as population fails to rebound",0,https://www.cbsnews.com/news/alaska-snow-crab-season-canceled-2024/,0.97,1043,1704502541,2024-01-06T12:55:41+0000
2024-01-06T11,18zmvj0,24,9711,holdmycatnip,2zhxd,"Orange cat doing orange cat things",0,https://v.redd.it/0o5bsfosvpac1,0.97,143,1704502114,2024-01-06T12:48:34+0000
2024-01-06T11,18zml9q,91,3770,Terraria,2sg5b,"It may not seem it. But i am not a Roblox addict. 🚫🚫",0,https://i.redd.it/75ukswamtpac1.jpeg,0.93,116,1704501345,2024-01-06T12:35:45+0000
2024-01-06T11,18zmkbr,69,4043,LivestreamFail,38jf0,"Asmongold responds to viewer asking about the charity allegations.",0,https://clips.twitch.tv/ArbitraryFrailQueleaTwitchRPG-CAyLDfPvE8W-u6fD,0.91,810,1704501275,2024-01-06T12:34:35+0000
2024-01-06T11,18zmk9c,77,3985,ProgrammerHumor,2tex6,spentThreeWeeksWritingThis,0,https://i.redd.it/am3hprcetpac1.png,0.97,188,1704501271,2024-01-06T12:34:31+0000
2024-01-06T11,18zmfyz,64,4475,FunnyAnimals,2st2l,"Food now rrrr",0,https://v.redd.it/8wxele0gspac1,0.97,79,1704500971,2024-01-06T12:29:31+0000
2024-01-06T11,18zmcav,93,3577,lgbt,2qhh7,"Rare French W",0,https://i.redd.it/ikkn15uprpac1.jpeg,0.94,228,1704500706,2024-01-06T12:25:06+0000
2024-01-06T11,18zmad9,17,20777,mildlyinteresting,2ti4h,"I’m in a weight loss clinical study and this is the test food I ate.",0,https://i.redd.it/dadiqlmarpac1.jpeg,0.94,2098,1704500563,2024-01-06T12:22:43+0000
2024-01-06T11,18zm45y,25,12187,clevercomebacks,dyqlw,"Readers added context",0,https://i.redd.it/1sifhf90qpac1.jpeg,0.93,495,1704500130,2024-01-06T12:15:30+0000
2024-01-06T11,18zlwle,58,6094,TheLastAirbender,2rybx,"The netflix show's costumes look more show accurate, while the (non-existent) movie's look more grounded",0,https://i.redd.it/avpo4dy5opac1.png,0.93,381,1704499583,2024-01-06T12:06:23+0000
2024-01-06T11,18zlcuv,51,17896,WhitePeopleTwitter,35n7t,"Donald Trump responds to Iowa school shooting, ends his statement with: get over it.",0,https://i.redd.it/v9dqnofckpac1.jpeg,0.94,1835,1704498226,2024-01-05T11:43:46+0000
2024-01-06T11,18zlajx,32,15876,maybemaybemaybe,38e1l,"Maybe maybe maybe",0,https://v.redd.it/abq8ftxujpac1,0.88,1706,1704498066,2024-01-05T11:41:06+0000
2024-01-06T11,18zl84w,19,23997,tumblr,2r7hk,"How to kill a god",0,https://i.redd.it/2enaz7bejpac1.jpeg,0.93,368,1704497908,2024-01-05T11:38:28+0000
2024-01-06T11,18zl82l,21,16088,cats,2qhta,"The jacket we bought did not fit the dog , it did fit the cat.",0,https://i.redd.it/mjdsrnudjpac1.jpeg,0.97,190,1704497904,2024-01-05T11:38:24+0000
2024-01-06T11,18zl2oc,81,4663,Wellthatsucks,2xcv7,"The see me rolling",0,https://v.redd.it/4h94mhaaipac1,0.97,73,1704497533,2024-01-05T11:32:13+0000
2024-01-06T11,18zl0tw,71,4936,AskReddit,2qh1i,"What’s a fact that could save your life?",1,https://www.reddit.com/r/AskReddit/comments/18zl0tw/whats_a_fact_that_could_save_your_life/,0.95,3274,1704497413,2024-01-05T11:30:13+0000
2024-01-06T11,18zl0r6,43,9628,TikTokCringe,mvcq5,"Father & Daughter have great voices ",0,https://v.redd.it/f928chwvhpac1,0.89,695,1704497407,2024-01-05T11:30:07+0000
2024-01-06T11,18zk8wa,31,15408,technology,2qh16,"Tesla Cybertruck gets less than 80% of advertised range in YouTuber’s test",0,https://nypost.com/2024/01/05/business/tesla-cybertruck-achieves-less-than-80-of-teslas-advertised-range/amp/,0.89,1520,1704495430,2024-01-05T10:57:10+0000
2024-01-06T11,18zk5ap,65,6672,comics,2qh0s,"Pets [oc]",0,https://www.reddit.com/gallery/18zk5ap,0.98,72,1704495171,2024-01-05T10:52:51+0000
2024-01-06T11,18zk3va,28,16784,funny,2qh33,"USA - Don't use your cell phone while driving! Meanwhile in Hong Kong...",0,https://i.redd.it/btytr8gnapac1.jpeg,0.95,529,1704495073,2024-01-05T10:51:13+0000
2024-01-06T11,18zjqct,100,17134,mildlyinfuriating,2ubgg,"This new mat my mom put always makes me fall over now. ",0,https://v.redd.it/ldufnsq68pac1,0.84,1917,1704494137,2024-01-05T10:35:37+0000
2024-01-06T11,18zjp6f,34,16538,politics,2cneq,"Joe Biden just delivered the speech Democrats have been desperate for him to give",0,https://themessenger.com/politics/joe-biden-just-delivered-the-speech-democrats-have-been-desperate-for-him-to-give,0.87,1958,1704494058,2024-01-05T10:34:18+0000
2024-01-06T11,18zir2k,63,12605,memes,2qjpg,"I'm polite when in a crowded elevator",0,https://i.redd.it/lfr6jdll0pac1.png,0.95,209,1704491692,2024-01-05T09:54:52+0000
2024-01-06T11,18zi96s,92,7981,dankmemes,2zmfe,"They were not cool enough to be invited",0,https://i.redd.it/sud1wfkkwoac1.jpeg,0.96,41,1704490422,2024-01-05T09:33:42+0000
2024-01-06T11,18zhd7x,45,20670,BlackPeopleTwitter,33x33,"His dad also escaped slavery and fought for the Union",0,https://www.reddit.com/gallery/18zhd7x,0.95,540,1704488224,2024-01-05T08:57:04+0000
2024-01-06T11,18zh2nk,54,19792,BikiniBottomTwitter,3deqz,"Imagine being this inconsiderate...",0,https://i.redd.it/g0f9dy77ooac1.jpeg,0.95,580,1704487479,2024-01-05T08:44:39+0000
2024-01-06T11,18zguyi,70,10118,antiwork,2y77d,"""Middle age"" is a lie",0,https://i.redd.it/tetrp0vqmoac1.jpeg,0.94,306,1704486941,2024-01-05T08:35:41+0000
2024-01-06T11,18zgo3g,59,13676,OldSchoolCool,2tycb,"[90s] Beastie Boys perform Sabotage live on stage.",0,https://v.redd.it/fgyjgbr6loac1,0.95,979,1704486480,2024-01-05T08:28:00+0000
2024-01-06T11,18zgh76,68,14972,wizardposting,5hjlp1,"My fellows...",0,https://i.redd.it/y9ft8c21koac1.png,0.92,492,1704486013,2024-01-05T08:20:13+0000
2024-01-06T11,18zggd2,48,20979,aww,2qh1o,"We spent the entire day searching our apartment for our lost kitten. This is the smug face we saw before we went to bed.",0,https://i.redd.it/ebss1q6vjoac1.jpeg,0.96,353,1704485959,2024-01-05T08:19:19+0000
2024-01-06T11,18zfs8i,97,9562,NonPoliticalTwitter,39gt6y,"Vacations are just sneak previews of retirement",0,https://i.imgur.com/mpgpjR2.jpeg,0.96,84,1704484334,2024-01-05T07:52:14+0000
2024-01-06T11,18zfkrl,90,11833,Justrolledintotheshop,2tteh,"Fed vehicles in for repairs. Government requires emission control devices on OUR vehicles but give themself an exemption to use a “deleted” diesel truck.",0,https://i.redd.it/w1htigchdoac1.jpeg,0.88,1055,1704483811,2024-01-05T07:43:31+0000
2024-01-06T11,18zf2rp,55,44265,oddlysatisfying,2x93b,"Pretty smooth fist bump ",0,https://v.redd.it/dfsnforp9oac1,0.94,494,1704482545,2024-01-05T07:22:25+0000
2024-01-06T11,18zcfop,98,27572,JustGuysBeingDudes,33rtj6,"Dad's words",0,https://v.redd.it/q089ily3qnac1,0.93,747,1704475953,2024-01-05T05:32:33+0000
