date,id,position,score,subreddit_display_name,subreddit_id,title,is_self,url,upvote_ratio,num_comments,created,created_date
2024-01-08T23,191wigs,50,1958,europe,2qh4j,"German Depression Aid campaign",0,https://i.redd.it/qei40jedaabc1.png,0.98,143,1704749119,2024-01-08T09:25:19+0000
2024-01-08T23,191why6,6,5534,StarWars,2qi4s,"This is going to be my favorite tweet of 2024",0,https://i.redd.it/fqbg02u9aabc1.jpeg,0.98,148,1704749084,2024-01-08T09:24:44+0000
2024-01-08T23,191w2b1,9,4449,MadeMeSmile,2uqcm,"Robert Downey Jr. praising Cillian Murphy",0,https://v.redd.it/wivk5j2u6abc1,0.99,81,1704748058,2024-01-08T09:07:38+0000
2024-01-08T23,191w15o,45,2172,whenthe,23gidu,"Stick in comments. ",0,https://v.redd.it/hvu96uoz6abc1,0.98,49,1704747980,2024-01-08T09:06:20+0000
2024-01-08T23,191vke0,21,3273,lethalcompany,9al6ft,"I animated a cinematic trailer for Lethal Company :)",0,https://v.redd.it/3m4xf7jd3abc1,0.98,251,1704746853,2024-01-08T08:47:33+0000
2024-01-08T23,191vjrz,82,1665,worldnews,2qh13,"United Airlines find loose bolts on plug doors of at least five aircraft during Boeing 737 Max 9 inspections",0,https://theaircurrent.com/feed/dispatches/united-finds-loose-bolts-on-plug-doors-during-737-max-9-inspections/,0.99,250,1704746811,2024-01-08T08:46:51+0000
2024-01-08T23,191vi4k,65,1835,Destiny,2qnvz,"Ed Krassenstein Here -- It was a pleasure to have Destiny on our side",1,https://www.reddit.com/r/Destiny/comments/191vi4k/ed_krassenstein_here_it_was_a_pleasure_to_have/,0.96,208,1704746695,2024-01-08T08:44:55+0000
2024-01-08T23,191vhsl,81,1663,discordVideos,2cxozx,"BROKE❤️",0,https://v.redd.it/n8b9wa5z2abc1,0.99,33,1704746673,2024-01-08T08:44:33+0000
2024-01-08T23,191v6zo,77,1822,oddlyspecific,2wjlc,"I think I‘m gonna be sick",0,https://i.redd.it/y80mvjgy0abc1.jpeg,0.96,182,1704745950,2024-01-08T08:32:30+0000
2024-01-08T23,191v6pg,69,1936,dankmemes,2zmfe,"Both are bad and unhealthy",0,https://i.redd.it/g2qfduiw0abc1.jpeg,0.87,252,1704745933,2024-01-08T08:32:13+0000
2024-01-08T23,191v47j,99,1474,dataisbeautiful,2tk95,"[OC] Is this the most dangerous gas station in America?",0,https://i.redd.it/jmy6s9pb0abc1.png,0.94,299,1704745772,2024-01-08T08:29:32+0000
2024-01-08T23,191v37r,55,2183,pcmasterrace,2sgp1,"A good life",0,https://i.redd.it/2uaklew70abc1.jpeg,0.98,33,1704745703,2024-01-08T08:28:23+0000
2024-01-08T23,191v09l,5,7657,clevercomebacks,dyqlw,"Whatever floats your boat",0,https://i.redd.it/kocyfshnz9bc1.jpeg,0.95,407,1704745511,2024-01-08T08:25:11+0000
2024-01-08T23,191un33,3,9688,interestingasfuck,2qhsa,"Gas leak in South Korea.",0,https://v.redd.it/wy2caxy0x9bc1,0.97,392,1704744640,2024-01-08T08:10:40+0000
2024-01-08T23,191u5b3,90,1771,ThatsInsane,swxxz,"Man who attacked Las Vegas judge is back in court, in front of the same judge.",0,https://i.redd.it/tgkgmy6nt9bc1.png,0.96,298,1704743498,2024-01-08T07:51:38+0000
2024-01-08T23,191u4kg,76,2024,NatureIsFuckingLit,3gdh7,"🔥 Polar bear enjoying some alone time",0,https://v.redd.it/a61w0ctat9bc1,0.98,49,1704743448,2024-01-08T07:50:48+0000
2024-01-08T23,191trjo,1,37200,pics,2qh0u,"The man who lunged at a Las Vegas judge back in court, in front of the same judge",0,https://i.redd.it/gfqktrvxq9bc1.jpeg,0.96,3190,1704742582,2024-01-08T07:36:22+0000
2024-01-08T23,191to3k,2,17527,facepalm,2r5rp,"Kind of the entire reason for the presentation.",0,https://i.redd.it/j30sgo07q9bc1.jpeg,0.98,282,1704742345,2024-01-08T07:32:25+0000
2024-01-08T23,191tnpq,33,3218,gaming,2qh03,"Multiple Sources Indicate Xbox Is Looking To Go Third Party, With Ports In Development For PS5/Switch",0,https://twistedvoxel.com/xbox-looking-to-go-third-party-ports-for-ps5-switch-2/,0.94,998,1704742320,2024-01-08T07:32:00+0000
2024-01-08T23,191tgfb,43,3034,technicallythetruth,3pzez,"everything is just a dictionary remix",0,https://i.redd.it/bk6erpjoo9bc1.png,0.98,21,1704741825,2024-01-08T07:23:45+0000
2024-01-08T23,191teko,68,2361,CuratedTumblr,3x5kfw,"Accidental Support Group",0,https://i.redd.it/l0ixh3yao9bc1.jpeg,0.99,101,1704741695,2024-01-08T07:21:35+0000
2024-01-08T23,191tbpz,4,9609,funny,2qh33,"I guess he was just looking for some motivation",0,https://v.redd.it/z8dsnfoin9bc1,0.92,389,1704741507,2024-01-08T07:18:27+0000
2024-01-08T23,191t3o3,78,2297,teenagers,2rjli,"What would u name him?",0,https://i.redd.it/u0xiuq45m9bc1.jpeg,0.95,1283,1704740974,2024-01-08T07:09:34+0000
2024-01-08T23,191t1j1,24,4131,AskReddit,2qh1i,"Who has most successfully milked what should have been 15 minutes of fame?",1,https://www.reddit.com/r/AskReddit/comments/191t1j1/who_has_most_successfully_milked_what_should_have/,0.95,3791,1704740831,2024-01-08T07:07:11+0000
2024-01-08T23,191swkk,91,2066,aww,2qh1o,"Somebody decided he had a lot to say during my zoom meeting",0,https://i.redd.it/q0knh2vuk9bc1.jpeg,0.97,75,1704740538,2024-01-08T07:02:18+0000
2024-01-08T23,191s7gp,61,2851,SapphoAndHerFriend,voyv5,"Couldn't help but think how other nations do it differently, as well.",0,https://i.redd.it/fjwan4jhf9bc1.jpeg,0.95,66,1704738828,2024-01-08T06:33:48+0000
2024-01-08T23,191s6qh,48,3565,ich_iel,37k29,ich_iel,0,https://i.redd.it/ffaag8smf9bc1.jpeg,0.87,182,1704738779,2024-01-08T06:32:59+0000
2024-01-08T23,191s684,35,4013,shitposting,2usxq,Focus,0,https://v.redd.it/d9ae0toif9bc1,0.98,34,1704738742,2024-01-08T06:32:22+0000
2024-01-08T23,191s5vx,14,7144,StupidFood,37se4,"Crimes against an entire nation.",0,https://v.redd.it/6domilm6f9bc1,0.83,626,1704738719,2024-01-08T06:31:59+0000
2024-01-08T23,191rx4a,98,2154,Chadtopia,2eji6w,"As of 2022",0,https://i.redd.it/fm6bd427v8bc1.jpeg,0.97,73,1704738126,2024-01-08T06:22:06+0000
2024-01-08T23,191rpq5,11,8915,memes,2qjpg,"How to made yourself a villain for the entire community.",0,https://i.redd.it/4uoe2qy7c9bc1.jpeg,0.96,132,1704737632,2024-01-08T06:13:52+0000
2024-01-08T23,191rl36,30,4762,politics,2cneq,"Opinion: Really, young voters? You want to teach Democrats a lesson by letting Trump back into the White House?",0,https://www.latimes.com/opinion/story/2024-01-03/polls-election-younger-voters-abortion-student-loan-climate-joe-biden-donald-trump,0.82,2238,1704737319,2024-01-08T06:08:39+0000
2024-01-08T23,191rh60,67,3045,DOG,2qiy5,"He was so excited for this",0,https://v.redd.it/9osuy8dfa9bc1,0.99,51,1704737049,2024-01-08T06:04:09+0000
2024-01-08T23,191rdi2,86,2557,CFB,2qm9d,"[Washington Dept. of Natural Resources] Good morning from the only state playing football today that actually has wolverines.",1,https://www.reddit.com/r/CFB/comments/191rdi2/washington_dept_of_natural_resources_good_morning/,0.96,353,1704736820,2024-01-08T06:00:20+0000
2024-01-08T23,191r843,56,3897,cursedcomments,hw1ju,cursed_spareparts,0,https://i.redd.it/gsagj9gk89bc1.jpeg,0.97,27,1704736469,2024-01-08T05:54:29+0000
2024-01-08T23,191r7q0,40,4082,PrequelMemes,3i60n,"They're in the ventilation shafts...",0,https://i.redd.it/9lztgc1c89bc1.png,0.97,64,1704736443,2024-01-08T05:54:03+0000
2024-01-08T23,191r7nf,8,10335,FluentInFinance,3qpaq8,"President Biden says Billionaires have a moral obligation to contribute to society, not just hoard wealth. It's time for them to pay their fair share. Do you agree or disagree?",0,https://i.redd.it/otbskjzl89bc1.png,0.9,2504,1704736438,2024-01-08T05:53:58+0000
2024-01-08T23,191qnz5,54,3692,blunderyears,2vy3g,"This was my best friend & I before a night outing to Walmart",0,https://i.redd.it/hnz6ugkt49bc1.jpeg,0.97,190,1704735143,2024-01-08T05:32:23+0000
2024-01-08T23,191qh9u,59,3963,Terraria,2sg5b,"Get FIXED boi !!! (Art by yours truly)",0,https://i.redd.it/7zpth25b39bc1.png,0.92,170,1704734709,2024-01-08T05:25:09+0000
2024-01-08T23,191qgyq,38,4361,BaldursGate3,12967t,"PC players are given freedom, console players railroaded.",0,https://i.redd.it/8zg2lsg539bc1.png,0.96,218,1704734688,2024-01-08T05:24:48+0000
2024-01-08T23,191qdrl,64,3577,megalophobia,31gwh,"First wind-powered cargo ship...",0,https://i.redd.it/6rpyqkyr29bc1.jpeg,0.94,462,1704734474,2024-01-08T05:21:14+0000
2024-01-08T23,191q8a4,92,2798,AntiTrumpAlliance,3i9if,"At this point no one can tell me anything. I am not crazy. You are. I will vote for President Joe Biden again. Anyone who even remotely recommends putting this man back in the highest office on earth needs their head checked. This isn't some sick game. This is real life. Are you fucking insane?!",0,https://i.redd.it/1z7k2jy919bc1.jpeg,0.91,206,1704734110,2024-01-08T05:15:10+0000
2024-01-08T23,191q7vq,15,8164,mildlyinfuriating,2ubgg,"Some guy just stole a coffee and tried to have me pick up the tab",1,https://www.reddit.com/r/mildlyinfuriating/comments/191q7vq/some_guy_just_stole_a_coffee_and_tried_to_have_me/,0.96,460,1704734081,2024-01-08T05:14:41+0000
2024-01-08T23,191q6dq,95,2815,foundsatan,r681a,"Walking daughter to school",0,https://i.redd.it/s0bwh73b19bc1.jpeg,0.91,153,1704733978,2024-01-08T05:12:58+0000
2024-01-08T23,191q427,58,3837,AllThatIsInteresting,93l1mw,"Disturbing bodycam footage shows the moment 23-year-old Chloe Jones was rescued after being kidnapped, beaten and held captive for four days by William Mozingo in October 2023.",0,https://v.redd.it/bxe4insu09bc1,0.94,583,1704733821,2024-01-08T05:10:21+0000
2024-01-08T23,191q24x,63,29569,facepalm,2r5rp,"Is it creepy to be a good dad?",0,https://i.redd.it/n4gj7jah09bc1.png,0.91,5956,1704733688,2024-01-08T05:08:08+0000
2024-01-08T23,191px8k,72,3701,bi_irl,3nhfo,bi_irl,0,https://i.redd.it/kufygz5hz8bc1.jpeg,0.82,270,1704733346,2024-01-08T05:02:26+0000
2024-01-08T23,191po9d,20,7393,AITAH,446kys,"AITA for saying to my mom at family dinner “well I wouldn’t stay with a man who hits my kids so I guess we have different priorities”",1,https://www.reddit.com/r/AITAH/comments/191po9d/aita_for_saying_to_my_mom_at_family_dinner_well_i/,0.94,1162,1704732728,2024-01-08T04:52:08+0000
2024-01-08T23,191pgx4,10,12100,WhitePeopleTwitter,35n7t,"Trump telling the truth for once",0,https://i.redd.it/e6bexxf3w8bc1.jpeg,0.95,614,1704732208,2024-01-08T04:43:28+0000
2024-01-08T23,191pgdp,18,8680,cats,2qhta,"Does its spine hurt?",0,https://i.redd.it/4kh3fcksv8bc1.jpeg,0.97,312,1704732170,2024-01-08T04:42:50+0000
2024-01-08T23,191pem9,83,3488,Hololive,29numb,"THANK YOU SO MUCH FOR 700K RUFFIANS!! 💕 A BIG step closer to our goal of 1 MILLION RUFFIANS...! ✨✨【FUWAMOCO🐾】",0,https://i.redd.it/7f94qf2ev8bc1.png,0.94,103,1704732047,2024-01-08T04:40:47+0000
2024-01-08T23,191pefi,71,3863,absolutelynotme_irl,3b5ss,absolutelynotme_irl,0,https://i.redd.it/5mcz3k6kv8bc1.png,0.95,69,1704732034,2024-01-08T04:40:34+0000
2024-01-08T23,191pdrz,89,3285,TrueOffMyChest,2yuqy,"I accidentally got black-out drunk last night. Waking up today, I’m moved by how well I was taken care of.",1,https://www.reddit.com/r/TrueOffMyChest/comments/191pdrz/i_accidentally_got_blackout_drunk_last_night/,0.95,103,1704731988,2024-01-08T04:39:48+0000
2024-01-08T23,191pd9w,22,8552,maybemaybemaybe,38e1l,"Maybe maybe maybe ",0,https://v.redd.it/9l17z8rbv8bc1,0.93,405,1704731951,2024-01-08T04:39:11+0000
2024-01-08T23,191pcok,7,20072,BeAmazed,363r3,"As of 2022",0,https://i.redd.it/fm6bd427v8bc1.jpeg,0.94,574,1704731907,2024-01-08T04:38:27+0000
2024-01-08T23,191pc5k,75,3691,WorkReform,5qpzgw,"What happened to the American dream? 😔",0,https://i.redd.it/zykx3atyu8bc1.png,0.93,108,1704731869,2024-01-08T04:37:49+0000
2024-01-08T23,191pa0m,26,7194,SpidermanPS4,3f1fs,"MJ's model speaks out. To whoever has done this, you should feel ashamed.",0,https://i.redd.it/e2gqyzhmu8bc1.jpeg,0.92,1010,1704731715,2024-01-08T04:35:15+0000
2024-01-08T23,191p9yy,94,3287,Money,2qjmw,"is it normal I only took home 65k on a 110k salary?",0,https://i.redd.it/07wgay8mu8bc1.jpeg,0.88,2958,1704731713,2024-01-08T04:35:13+0000
2024-01-08T23,191oszt,37,5916,formuladank,3ndbi,"Chocolatier Amaury Guichon makes a Formula 1 Car out of Chocolate",0,https://v.redd.it/e74irki2r8bc1,0.92,283,1704730521,2024-01-08T04:15:21+0000
2024-01-08T23,191os6l,49,6090,tumblr,2r7hk,"WEEEE LOVE THE COMPANY",0,https://i.redd.it/0jpruj2xq8bc1.jpeg,0.94,139,1704730467,2024-01-08T04:14:27+0000
2024-01-08T23,191orqw,41,5486,PoliticalHumor,2qm21,"vote ?",0,https://i.redd.it/3uk1oojsq8bc1.jpeg,0.91,594,1704730434,2024-01-08T04:13:54+0000
2024-01-08T23,191opod,66,4334,fixedbytheduet,46tcaa,"What’s for dinner tonight?",0,https://v.redd.it/vjb82fedq8bc1,0.92,130,1704730288,2024-01-08T04:11:28+0000
2024-01-08T23,191omdf,16,10088,JeffArcuri,740oig,"Pregnant ladies",0,https://v.redd.it/16o2uerfp8bc1,0.92,171,1704730051,2024-01-08T04:07:31+0000
2024-01-08T23,191ohgz,46,5523,OldSchoolCool,2tycb,"Nurses show newborn triplets to their father in a New York hospital, 1946",0,https://i.redd.it/uvjzy5rjo8bc1.jpeg,0.94,157,1704729703,2024-01-08T04:01:43+0000
2024-01-08T23,191oc2i,80,4540,meme,2qi1r,"Nice try.",0,https://i.redd.it/jf0hm5hin8bc1.jpeg,0.97,36,1704729322,2024-01-08T03:55:22+0000
2024-01-08T23,191o9wq,31,7976,ContagiousLaughter,2u2bh,"It's painfully cute😭",0,https://v.redd.it/6rl1486zm8bc1,0.96,84,1704729162,2024-01-08T03:52:42+0000
2024-01-08T23,191o94i,93,3993,MinecraftMemes,2sq0h,"That one guy actually did it... (""minecraft lets play episode 2"")",0,https://i.redd.it/gyt5q15qm8bc1.png,0.97,39,1704729107,2024-01-08T03:51:47+0000
2024-01-08T23,191o1j9,70,5111,blackmagicfuckery,3fn31,"The last woodbender?",0,https://i.redd.it/c93jq498l8bc1.jpeg,0.86,441,1704728569,2024-01-08T03:42:49+0000
2024-01-08T23,191nyf6,17,13395,me_irl,2vegg,me_irl,0,https://i.redd.it/9dsyu13jk8bc1.jpeg,0.97,122,1704728333,2024-01-08T03:38:53+0000
2024-01-08T23,191nwj5,12,17118,Embroidery,2rh53,"3 years of work 😅 Only you guys will appreciate it",0,https://i.redd.it/3xqieiq4k8bc1.jpeg,0.96,485,1704728186,2024-01-08T03:36:26+0000
2024-01-08T23,191nwh9,85,4093,BlackPeopleTwitter,33x33,"Coretta Scott King remains the only Black Widow that Kang recognizes",0,https://i.redd.it/s4s4bhg4k8bc1.jpeg,0.96,345,1704728182,2024-01-08T03:36:22+0000
2024-01-08T23,191nvcs,52,5573,nba,2qo4s,"[Wojnarowski] In a new edition of the Draymond Green Show, Golden State’s star suggests that Adam Silver talked him out of retirement: “I told him, ‘Adam this is too much for me…It’s all becoming too much for me – and I’m going to retire.’” Story on ESPN:",0,https://twitter.com/wojespn/status/1744382149145297378,0.92,1445,1704728102,2024-01-08T03:35:02+0000
2024-01-08T23,191nmlj,57,6061,therewasanattempt,39ne7,"To walk with your child holding a white flag",0,https://v.redd.it/ow9yo65wh8bc1,0.87,926,1704727434,2024-01-08T03:23:54+0000
2024-01-08T23,191nlmx,23,10919,ProgrammerHumor,2tex6,codeReviewDoneRight,0,https://i.redd.it/hmx0q06oh8bc1.jpeg,0.96,161,1704727358,2024-01-08T03:22:38+0000
2024-01-08T23,191ndn4,32,9152,Eyebleach,2s427,"When you’re the handsomest of all the boyz…",0,https://i.imgur.com/D4U9U3P.gifv,0.94,61,1704726756,2024-01-08T03:12:36+0000
2024-01-08T23,191n7o2,96,27378,pics,2qh0u,"A sheep showing gratitude to the dog that saved him from a wolf attack. Notice the spike collar.",0,https://www.reddit.com/gallery/191n7o2,0.91,1313,1704726289,2024-01-08T03:04:49+0000
2024-01-08T23,191n4zn,39,7595,StrangerThings,3adlm,"'Stranger Things 5' Officially Begins Production",0,https://i.redd.it/60pm6opwd8bc1.jpeg,0.91,665,1704726097,2024-01-08T03:01:37+0000
2024-01-08T23,191n1wd,13,38220,Unexpected,2w67q,"The real answer to the trolley problem",0,https://v.redd.it/3fupodx9d8bc1,0.86,660,1704725881,2024-01-08T02:58:01+0000
2024-01-08T23,191mzo2,47,10251,videogames,2qhzy,"pC mAsTeR rAcE",0,https://i.redd.it/ziiwc89oc8bc1.png,0.78,2026,1704725702,2024-01-08T02:55:02+0000
2024-01-08T23,191mzhr,28,14001,Damnthatsinteresting,2xxyj,"AI humanoid learned itself how to make a coffee after watching for 10h humans do it",0,https://v.redd.it/rsqyif1kc8bc1,0.88,1355,1704725687,2024-01-08T02:54:47+0000
2024-01-08T23,191mwwm,74,5525,nextfuckinglevel,m0bnr,"View from a camera on Space X Falcon 9 during liftoff with stage 1 returning to the ground in 90 seconds",0,https://v.redd.it/thvar0d1c8bc1,0.94,359,1704725474,2024-01-08T02:51:14+0000
2024-01-08T23,191mwga,42,7633,todayilearned,2qqjc,"TIL that the oldest verified supercentenarian lived to 122 and regularly smoked cigarettes up until the age of 117",0,https://en.wikipedia.org/wiki/Jeanne_Calment,0.95,501,1704725435,2024-01-08T02:50:35+0000
2024-01-08T23,191mtpj,19,18206,comics,2qh0s,"Direct brain injector",0,https://www.reddit.com/gallery/191mtpj,0.95,415,1704725212,2024-01-08T02:46:52+0000
2024-01-08T23,191mkb1,88,5187,reddeadredemption,2rn7o,"arthur doesn’t know what racism is",0,https://v.redd.it/1jollgyy88bc1,0.96,273,1704724450,2024-01-08T02:34:10+0000
2024-01-08T23,191mj36,27,12934,oddlysatisfying,2x93b,"Machine automates the process of levelling and troweling",0,https://v.redd.it/vlz9qu4o88bc1,0.92,590,1704724351,2024-01-08T02:32:31+0000
2024-01-08T23,191mcf1,44,10391,meirl,2s5ti,Meirl,0,https://v.redd.it/n4mfcmy078bc1,0.96,154,1704723822,2024-01-08T02:23:42+0000
2024-01-08T23,191m48b,25,12412,news,2qh3l,"Lauren Boebert: Police look into apparent Colorado restaurant row",0,https://www.bbc.com/news/world-us-canada-67911826,0.93,901,1704723175,2024-01-08T02:12:55+0000
2024-01-08T23,191m205,34,11343,MapPorn,2si92,"The size of the Roman Empire at its height compared to the United States",0,https://i.redd.it/t14qh2qp48bc1.png,0.92,1033,1704723000,2024-01-08T02:10:00+0000
2024-01-08T23,191ls8x,60,9093,theydidthemath,2x23b,"[Request] Does this work? And if so, why?",0,https://i.redd.it/qui3zivg28bc1.jpeg,0.94,182,1704722245,2024-01-08T01:57:25+0000
2024-01-08T23,191l3y7,29,20898,wholesomememes,3gcwj,"sweet dad and daughter ❤️",0,https://i.redd.it/xaq0q5d5w7bc1.jpeg,0.97,137,1704720144,2024-01-08T01:22:24+0000
2024-01-08T23,191kjam,53,11373,mildlyinteresting,2ti4h,"Dropped my iPhone on a beach and the MagSafe case attracted titanomagnetite from the black sand",0,https://i.redd.it/9axsq9rtq7bc1.jpeg,0.94,495,1704718331,2024-01-08T12:52:11+0000
2024-01-08T23,191kij2,97,7222,pokemon,2qmeb,"The plot of Scarlet & Violet is absolutely wild. (OC)",0,https://i.redd.it/tdzb81cmq7bc1.jpeg,0.96,103,1704718261,2024-01-08T12:51:01+0000
2024-01-08T23,191kf2o,51,10893,LeopardsAteMyFace,3jp3p,"Florida man notices that DeSantis no longer spends time in the State instead is using donor money for private flights and lifted cowboy boots!",0,https://www.politico.com/news/2024/01/08/ron-desantis-campaign-legislature-florida-00134265,0.95,276,1704717936,2024-01-08T12:45:36+0000
2024-01-08T23,191k7pj,36,25375,Wellthatsucks,2xcv7,"This is so messed up y’all plz be careful out here",0,https://www.reddit.com/gallery/191k7pj,0.89,3995,1704717203,2024-01-08T12:33:23+0000
2024-01-08T23,191k7m5,87,8753,TikTokCringe,mvcq5,"In a prison, cat is man's best friends",0,https://v.redd.it/kziis41an7bc1,0.92,461,1704717194,2024-01-08T12:33:14+0000
2024-01-08T23,191k0bb,62,13706,SipsTea,5tdqj0,"Your total is going to be 20.18??🤔🤔",0,https://v.redd.it/3n7e0uial7bc1,0.93,351,1704716469,2024-01-08T12:21:09+0000
2024-01-08T23,191jhv8,79,11871,funnyvideos,2qoos,Mr.Bean,0,https://v.redd.it/15nbn31of7bc1,0.95,233,1704714592,2024-01-08T11:49:52+0000
2024-01-08T23,191jbpk,84,10921,educationalgifs,2w708,"MICROORGANISMS in Perspective",0,https://i.imgur.com/hrMeGJc.gifv,0.96,277,1704713963,2024-01-08T11:39:23+0000
2024-01-08T23,191iswp,73,26856,Funnymemes,2xqtc,"Let's keep it going. Give me all you got in the comments 👇",0,https://i.redd.it/rusndkk387bc1.jpeg,0.91,1447,1704712032,2024-01-08T11:07:12+0000
2024-01-08T23,191ik8d,100,13977,fuckcars,3cs2l,"The car-brain mind can't comprehend this",0,https://v.redd.it/eqcvqr9q47bc1,0.81,1607,1704711150,2024-01-08T10:52:30+0000
