date,id,position,score,subreddit_display_name,subreddit_id,title,is_self,url,upvote_ratio,num_comments,created,created_date
2023-12-31T13,18v60bt,58,864,funny,2qh33,"This Malaysian restaurant has had enough",0,https://i.redd.it/l4414aso9m9c1.jpeg,0.94,108,1704022475,2023-12-31T11:34:35+0000
2023-12-31T13,18v5po8,37,2201,Damnthatsinteresting,2xxyj,"Before a heart transplant, organ is connected to a warm perfusion device that pumps a continuous supply of oxygenated blood and electrolytes, keeping temperature and pressure constant while the organ is outside the human body.",0,https://v.redd.it/5jpqq62w5m9c1,0.98,99,1704021204,2023-12-31T11:13:24+0000
2023-12-31T13,18v5jlj,61,1609,shitposting,2usxq,"Heil spez",0,https://i.redd.it/yx8be0qu3m9c1.png,0.92,319,1704020513,2023-12-31T11:01:53+0000
2023-12-31T13,18v5b01,52,1033,brasil,2qh9i,"CHEGOU A HORA! VAMOS LEVAR O CÃO CHUPANDO MANGA PARA A FRONTPAGE MAIS UMA VEZ 🐶🥭",0,https://i.redd.it/tvy9jrfv0m9c1.png,0.94,63,1704019509,2023-12-31T10:45:09+0000
2023-12-31T13,18v543x,27,1683,dankmemes,2zmfe,"Happy new year!",0,https://i.redd.it/gqo12htdyl9c1.jpeg,0.97,52,1704018672,2023-12-31T10:31:12+0000
2023-12-31T13,18v51ob,15,2664,tumblr,2r7hk,"Dog Theater",0,https://i.redd.it/4rxys4kixl9c1.jpeg,0.98,26,1704018380,2023-12-31T10:26:20+0000
2023-12-31T13,18v4sfh,89,840,ich_iel,37k29,Ich_iel,0,https://i.redd.it/xz4c5lwcul9c1.jpeg,0.84,151,1704017318,2023-12-31T10:08:38+0000
2023-12-31T13,18v4qbm,59,1099,NonPoliticalTwitter,39gt6y,"We are not friends, Who are you",0,https://i.redd.it/wppkmn69tl9c1.png,0.97,22,1704017062,2023-12-31T10:04:22+0000
2023-12-31T13,18v4l1f,1,5202,clevercomebacks,dyqlw,"Based Readers added context",0,https://i.redd.it/d330lyljrl9c1.png,0.97,100,1704016464,2023-12-31T09:54:24+0000
2023-12-31T13,18v4kxn,84,899,Grimdank,3ilna,"Happy New Year my dudes and dudettes!",0,https://i.redd.it/sue0namwql9c1.png,0.96,115,1704016450,2023-12-31T09:54:10+0000
2023-12-31T13,18v4fc5,79,948,tja,3jxvk,Tja,0,https://i.redd.it/5brqg1xspl9c1.jpeg,0.96,193,1704015787,2023-12-31T09:43:07+0000
2023-12-31T13,18v45al,30,1981,Satisfyingasfuck,31s00,"Figure skating is such an underrated yet magical sport",0,https://v.redd.it/k1nlq9u3ml9c1,0.94,128,1704014622,2023-12-31T09:23:42+0000
2023-12-31T13,18v42i0,38,1682,Gamingcirclejerk,2sf2b,"someone check on neil 😹",0,https://i.redd.it/2fb8ys2fll9c1.jpeg,0.9,255,1704014313,2023-12-31T09:18:33+0000
2023-12-31T13,18v4186,10,4302,meme,2qi1r,Help??,0,https://i.redd.it/vaknmtdxkl9c1.png,0.91,258,1704014161,2023-12-31T09:16:01+0000
2023-12-31T13,18v40bg,12,3675,mildlyinfuriating,2ubgg,"Email about my HP Printer",0,https://i.redd.it/fk37qkkokl9c1.jpeg,0.98,489,1704014064,2023-12-31T09:14:24+0000
2023-12-31T13,18v3sb1,94,998,formuladank,3ndbi,"2024 will be our year!",0,https://i.redd.it/9gttqi7zhl9c1.png,0.98,12,1704013159,2023-12-31T08:59:19+0000
2023-12-31T13,18v3gnq,50,1601,AbsoluteUnits,a7wuv,"Clint Fastfood",0,https://v.redd.it/ov9c3qw2el9c1,0.9,256,1704011846,2023-12-31T08:37:26+0000
2023-12-31T13,18v3fs7,25,2566,MadeMeSmile,2uqcm,"Man meets his hero in the most unusual circumstance",0,https://v.redd.it/33ezbp4sdl9c1,0.86,210,1704011745,2023-12-31T08:35:45+0000
2023-12-31T13,18v3fj9,3,6018,SipsTea,5tdqj0,"The kangaroo actually passed it back",0,https://v.redd.it/ep7hpx3odl9c1,0.96,157,1704011714,2023-12-31T08:35:14+0000
2023-12-31T13,18v3ds6,86,1138,Steam,2qwis,"My new PC parts haven't arrived yet",0,https://i.redd.it/uwpdsc4ycl9c1.png,0.85,95,1704011518,2023-12-31T08:31:58+0000
2023-12-31T13,18v3bqu,13,4094,KidsAreFuckingStupid,3948y,"She nearly drowned him",0,https://v.redd.it/ggswtlafcl9c1,0.95,180,1704011289,2023-12-31T08:28:09+0000
2023-12-31T13,18v38xx,88,1172,DOG,2qiy5,"Little puppy gets angry at his own hiccups",0,https://v.redd.it/o1ac6tdhbl9c1,0.98,26,1704010970,2023-12-31T08:22:50+0000
2023-12-31T13,18v35w7,98,1121,discordVideos,2cxozx,"In his defense, that backflip was sick",0,https://v.redd.it/nlj24jogal9c1,0.98,17,1704010632,2023-12-31T08:17:12+0000
2023-12-31T13,18v35k3,39,3872,facepalm,2r5rp,"​",0,https://i.redd.it/2ajul37dal9c1.jpeg,0.98,287,1704010596,2023-12-31T08:16:36+0000
2023-12-31T13,18v32cw,36,2213,europe,2qh4j,"Flooding continues in parts of Germany",0,https://i.redd.it/9j475dy89l9c1.jpeg,0.98,145,1704010219,2023-12-31T08:10:19+0000
2023-12-31T13,18v2tnv,28,2671,ProgrammerHumor,2tex6,iDoNotKnowWhatPolymortismIsButIWorkAtGoogle,0,https://i.redd.it/25gnuzk46l9c1.png,0.96,157,1704009249,2023-12-31T07:54:09+0000
2023-12-31T13,18v2qe9,55,1689,Genshin_Impact,12p4l2,"Navia has the tiniest Vision in the game",0,https://i.redd.it/1am8oxx95l9c1.jpeg,0.97,70,1704008883,2023-12-31T07:48:03+0000
2023-12-31T13,18v2in2,83,2483,meirl,2s5ti,meirl,0,https://i.redd.it/ay1rc6qp2l9c1.png,0.99,38,1704008025,2023-12-31T07:33:45+0000
2023-12-31T13,18v2evw,24,3212,MurderedByWords,3hx3r,"Good luck to the women in your future",0,https://i.redd.it/yh44fvji1l9c1.jpeg,0.96,113,1704007621,2023-12-31T07:27:01+0000
2023-12-31T13,18v2ai8,5,7674,pcmasterrace,2sgp1,"Strange purple reflective squares on new gaming monitor",0,https://www.reddit.com/gallery/18v2ai8,0.9,818,1704007149,2023-12-31T07:19:09+0000
2023-12-31T13,18v2afa,74,1589,youngpeopleyoutube,nngwo,"skibidy toilet",0,https://i.redd.it/yzj5j2010l9c1.png,0.95,154,1704007140,2023-12-31T07:19:00+0000
2023-12-31T13,18v20tb,48,2180,DesignPorn,2sj06,"Use Spades Not Ships (1941)",0,https://i.redd.it/yejbauh3xk9c1.png,0.96,36,1704006133,2023-12-31T07:02:13+0000
2023-12-31T13,18v1z7n,6,9385,shitposting,2usxq,"Stay safe buddy",0,https://v.redd.it/724rdxhowk9c1,0.96,214,1704005992,2023-12-31T06:59:52+0000
2023-12-31T13,18v1xya,16,5273,technicallythetruth,3pzez,"It's gonna look very stupid.",0,https://i.redd.it/2798h6o8wk9c1.png,0.97,43,1704005859,2023-12-31T06:57:39+0000
2023-12-31T13,18v1e9s,76,1836,cyberpunkgame,3az7x,"Mr hands gigs where hands down (no pun intended) the best in the game",0,https://i.redd.it/n695xqnaqk9c1.jpeg,0.97,101,1704003845,2023-12-31T06:24:05+0000
2023-12-31T13,18v1dkm,62,2038,comics,2qh0s,"Thanks for another great year of comics! Here's my top contribution from this year, one more time",0,https://i.redd.it/gfejy2yvpk9c1.png,0.98,22,1704003773,2023-12-31T06:22:53+0000
2023-12-31T13,18v1a73,92,1691,TikTokCringe,mvcq5,"Clarence Thomas is the worst",0,https://v.redd.it/i40pz6x2pk9c1,0.93,64,1704003439,2023-12-31T06:17:19+0000
2023-12-31T13,18v18sc,69,1964,ukraine,2qqcn,"The performance of the few M2 Bradley IFVs Ukraine received from the USA is absolutely astonishing. In some cases a single Bradley wiped out entire Russian units and single-handily blunts entire Russian assaults near Avdiivka, thanks to the superior optics and accurate 25mm cannon.",0,https://v.redd.it/a93nlzjook9c1,0.96,112,1704003305,2023-12-31T06:15:05+0000
2023-12-31T13,18v18lg,67,1989,animememes,2tcn0,"Name the character",0,https://i.redd.it/jso40vsmok9c1.jpeg,0.93,773,1704003288,2023-12-31T06:14:48+0000
2023-12-31T13,18v17qd,34,3275,mildlyinteresting,2ti4h,"It is customary to leave a penny on the grave of John Wilkes Booth (man who murdered Abraham Lincoln) as a sign of disrespect",0,https://i.redd.it/9bg1gf1eok9c1.jpeg,0.96,188,1704003203,2023-12-31T06:13:23+0000
2023-12-31T13,18v16ee,80,1823,programming,2fwo,"In 2024, please switch to Firefox",0,https://roytanck.com/2023/12/23/in-2024-please-switch-to-firefox/,0.9,410,1704003080,2023-12-31T06:11:20+0000
2023-12-31T13,18v165c,82,1810,CrazyFuckingVideos,45hae8,"Russian goes to window during live shelling in Belgorod.",0,https://v.redd.it/hxufu38ynk9c1,0.97,164,1704003056,2023-12-31T06:10:56+0000
2023-12-31T13,18v13oi,33,3458,FunnyandSad,2z7qd,"Fascinating Perspectives on Refrigeration",0,https://i.redd.it/10bkb1r6nk9c1.jpeg,0.97,89,1704002818,2023-12-31T06:06:58+0000
2023-12-31T13,18v12om,9,9585,wholesomememes,3gcwj,"Beauty and the Beast",0,https://i.redd.it/fdqs6mkkmk9c1.jpeg,0.97,98,1704002719,2023-12-31T06:05:19+0000
2023-12-31T13,18v12dl,14,6532,holdmycatnip,2zhxd,"Oh lawd he coming. Cannonball chonk",0,https://i.imgur.com/7DCGRKo.gifv,0.97,96,1704002696,2023-12-31T06:04:56+0000
2023-12-31T13,18v100f,17,5849,NatureIsFuckingLit,3gdh7,"🔥 drone footage of volcano eruption 🔥",0,https://i.imgur.com/MWIyDRI.gifv,0.97,119,1704002479,2023-12-31T06:01:19+0000
2023-12-31T13,18v0qij,51,2642,Showerthoughts,2szyo,"Considering how big of a deal it was, it’s really surprising that the moon landing is not a national holiday in the U.S.",1,https://www.reddit.com/r/Showerthoughts/comments/18v0qij/considering_how_big_of_a_deal_it_was_its_really/,0.96,173,1704001600,2023-12-31T05:46:40+0000
2023-12-31T13,18v0k7h,4,11924,todayilearned,2qqjc,"TIL that Better Call Saul was nominated for 53 Primetime Emmys without winning a single one",0,https://www.goldderby.com/article/2023/better-call-saul-last-chance-2023-emmys/,0.97,630,1704001013,2023-12-31T05:36:53+0000
2023-12-31T13,18v0gl0,7,15044,meirl,2s5ti,meirl,0,https://i.redd.it/3yznw1svgk9c1.jpeg,0.96,618,1704000681,2023-12-31T05:31:21+0000
2023-12-31T13,18v0e3o,19,6087,Awww,2suml,"He will cherish this moment for the rest of his life",0,https://v.redd.it/nhgmpxgzfk9c1,0.94,84,1704000456,2023-12-31T05:27:36+0000
2023-12-31T13,18v0dsp,20,7615,memes,2qjpg,"Love Story",0,https://i.redd.it/imvuhsi2gk9c1.jpeg,0.9,455,1704000428,2023-12-31T05:27:08+0000
2023-12-31T13,18v09yq,47,5516,todayilearned,2qqjc,"TIL: Apple Watch sales in 2020 amounted to ~$30.6bn compared to the whole Swiss watch market exports of ~$16bn.",0,https://quillandpad.com/2023/12/29/omega-x-swatch-moonswatch-owner-review-the-good-the-bad-the-complicated/,0.96,462,1704000078,2023-12-31T05:21:18+0000
2023-12-31T13,18v08z0,2,15119,news,2qh3l,"As many as 10 patients dead from nurse injecting tap water instead of Fentanyl at Oregon hospital",0,https://kobi5.com/news/crime-news/only-on-5-sources-say-8-9-died-at-rrmc-from-drug-diversion-219561/,0.97,1221,1703999992,2023-12-31T05:19:52+0000
2023-12-31T13,18v07ww,72,2327,MapPorn,2si92,"Seat Belt Laws in the US",0,https://i.redd.it/gd7axsnhek9c1.jpeg,0.96,316,1703999899,2023-12-31T05:18:19+0000
2023-12-31T13,18uztj7,46,6654,wholesomememes,3gcwj,"One happy family 😍",0,https://i.redd.it/6i43jqbfak9c1.jpeg,0.92,161,1703998594,2023-12-31T04:56:34+0000
2023-12-31T13,18uzo2s,49,3363,IndiaSpeaks,3d4x4,"Stray dog runs alongside train, warning against risky footboard travel",0,https://v.redd.it/ov49egpz8k9c1,0.96,92,1703998114,2023-12-31T04:48:34+0000
2023-12-31T13,18uzi77,8,13785,Damnthatsinteresting,2xxyj,"Anthony Hopkins plays an empty hotel lobby in Vancouver: 'Something about a piano in an empty lobby… PERFECT venue'",0,https://v.redd.it/fab8noka6k9c1,0.96,457,1703997580,2023-12-31T04:39:40+0000
2023-12-31T13,18uz9he,65,2738,detroitlions,2rynx,"Photo of decker “not reporting eligible”",0,https://i.redd.it/3cmsqs2c5k9c1.jpeg,0.92,421,1703996796,2023-12-31T04:26:36+0000
2023-12-31T13,18uz8he,53,3401,Eldenring,122hf1,"Does anyone know why morgott was frozen here?",0,https://v.redd.it/d8ndump05k9c1,0.95,88,1703996710,2023-12-31T04:25:10+0000
2023-12-31T13,18uz3t3,31,5383,geography,2qnms,"An Interesting Fact About Russia And USA",0,https://i.redd.it/nzkh2iwt3k9c1.jpeg,0.94,193,1703996290,2023-12-31T04:18:10+0000
2023-12-31T13,18uz3o7,42,4493,Funnymemes,2xqtc,"Black is....☠️",0,https://i.redd.it/hasvy4zr3k9c1.jpeg,0.9,341,1703996278,2023-12-31T04:17:58+0000
2023-12-31T13,18uyn0g,41,4765,Unexpected,2w67q,"Representing the people of Minnesota",0,https://v.redd.it/5fcjg69bzj9c1,0.95,74,1703994801,2023-12-31T03:53:21+0000
2023-12-31T13,18uyhoj,95,2711,GenZ,2tz25,"pisses me off when people say we grew up with an ipad in our hands",0,https://i.redd.it/837r9ev0yj9c1.jpeg,0.87,498,1703994337,2023-12-31T03:45:37+0000
2023-12-31T13,18uyecs,100,4603,nba,2qo4s,"[Highlight] LeBron can't stop feeling betrayed as he keeps arguing the 2-point ruling on his three pointer attempt to tie",0,https://streamable.com/aem4bx,0.96,833,1703994047,2023-12-31T03:40:47+0000
2023-12-31T13,18uye3a,78,3026,RocketLeague,30cz1,"Edit: They fucked it up",0,https://i.redd.it/d0bfp1d3xj9c1.png,0.95,151,1703994024,2023-12-31T03:40:24+0000
2023-12-31T13,18uyboh,45,4572,starterpacks,34o9s,"Anti-Intellectualism on Social Media Starterpack",0,https://i.redd.it/of7ikn7gwj9c1.jpeg,0.92,319,1703993808,2023-12-31T03:36:48+0000
2023-12-31T13,18uy91u,26,7595,marvelmemes,35mye,"Here comes the Money",0,https://i.redd.it/5p2r4bbqvj9c1.jpeg,0.95,113,1703993577,2023-12-31T03:32:57+0000
2023-12-31T13,18uxtek,11,19509,facepalm,2r5rp,"Back to the time when the White House secretary publicly posted his password 2 days in a row.",0,https://i.redd.it/1kiz0qlrrj9c1.jpeg,0.97,403,1703992242,2023-12-31T03:10:42+0000
2023-12-31T13,18uxamd,90,3324,pics,2qh0u,"Ninety-three year old Clint Eastwood",0,https://i.redd.it/lml7nc15nj9c1.jpeg,0.86,369,1703990681,2023-12-31T02:44:41+0000
2023-12-31T13,18ux448,57,5013,mathmemes,3fz4c,"i don’t understand it either but it belongs here",0,https://i.redd.it/xh69mnhbfj9c1.jpeg,0.93,196,1703990156,2023-12-31T02:35:56+0000
2023-12-31T13,18uwrar,56,5120,DiWHY,2z635,"Should this even work?",0,https://i.redd.it/9838y1bfij9c1.jpeg,0.95,418,1703989090,2023-12-31T02:18:10+0000
2023-12-31T13,18uwr8b,81,3769,SquaredCircle,2sljg,"Kevin Dunn leaving WWE",0,https://www.pwinsider.com/article/178782/on-of-the-important-execs-in-company-history-exiting-world-wrestling-entertainment.html?p=1,0.94,1240,1703989086,2023-12-31T02:18:06+0000
2023-12-31T13,18uwoxg,97,3554,maybemaybemaybe,38e1l,"Maybe Maybe Maybe",0,https://v.redd.it/nowv0h7phj9c1,0.94,271,1703988890,2023-12-31T02:14:50+0000
2023-12-31T13,18uwmqd,18,17894,WhitePeopleTwitter,35n7t,"The richest man in the world can't afford Mr. Beast",0,https://i.redd.it/eq9is1z8hj9c1.png,0.95,444,1703988712,2023-12-31T02:11:52+0000
2023-12-31T13,18uwjvu,35,9113,rareinsults,48t85,"He’s very correct though",0,https://i.redd.it/6kidezaagj9c1.jpeg,0.96,103,1703988474,2023-12-31T02:07:54+0000
2023-12-31T13,18uwgru,22,12513,aww,2qh1o,"(OC) My dog trying to boss my girlfriend into feeding her 15 minutes early",0,https://v.redd.it/gfbf3lrtfj9c1,0.96,326,1703988222,2023-12-31T02:03:42+0000
2023-12-31T13,18uwfiu,77,4334,AITAH,446kys,"I feel my bf is taking advantage of my kindness. I confronted him. AITAH",1,https://www.reddit.com/r/AITAH/comments/18uwfiu/i_feel_my_bf_is_taking_advantage_of_my_kindness_i/,0.91,1189,1703988120,2023-12-31T02:02:00+0000
2023-12-31T13,18uvwrk,21,14208,nba,2qo4s,"[Post Game Thread] Streak Ended - The Detroit Pistons (3-29) avoid the longest losing streak in NBA history - defeating the Toronto Raptors (12-20) by a score of 129-127",1,https://www.reddit.com/r/nba/comments/18uvwrk/post_game_thread_streak_ended_the_detroit_pistons/,0.95,1370,1703986636,2023-12-31T01:37:16+0000
2023-12-31T13,18uvr6b,68,5029,nbacirclejerk,2td2i,"THE JERK IS OVER. FREE WINGSTOP FOR EVERYONE IN DETROIT!!!",0,https://v.redd.it/8bcayses9j9c1,0.94,116,1703986208,2023-12-31T01:30:08+0000
2023-12-31T13,18uvkjz,66,5147,CozyPlaces,34ixl,"Finished our Speakeasy Under the Stairs for the new year.",0,https://www.reddit.com/gallery/18uvkjz,0.96,133,1703985690,2023-12-31T01:21:30+0000
2023-12-31T13,18uvjxx,63,15137,MadeMeSmile,2uqcm,"TOTAL RESPECT FOR THE DOCTOR.",0,https://v.redd.it/kckzakm48j9c1,0.91,360,1703985644,2023-12-31T01:20:44+0000
2023-12-31T13,18uvhit,71,5287,lotrmemes,2v0i1,"The normal versions",0,https://i.redd.it/k1j3will7j9c1.jpeg,0.96,147,1703985451,2023-12-31T01:17:31+0000
2023-12-31T13,18uvehu,99,4451,blackmagicfuckery,3fn31,"Physics you’re drunk, go home",0,https://v.redd.it/6kwrjsjt6j9c1,0.91,131,1703985207,2023-12-31T01:13:27+0000
2023-12-31T13,18uv0xt,29,11930,spaceporn,2s9jc,"It's Jupiter's lo, as seen by Juno spacecraft, taken just moments ago, as it flew just 900 miles above the moon's hypervolcanic surface.",0,https://i.redd.it/879rl0pt3j9c1.jpeg,0.97,434,1703984181,2023-12-31T12:56:21+0000
2023-12-31T13,18uunpr,85,10822,mildlyinteresting,2ti4h,"Found an absolutely absurd amount of 30+ year old cans in the attic above my garage",0,https://i.redd.it/9x0l549t0j9c1.jpeg,0.97,922,1703983169,2023-12-31T12:39:29+0000
2023-12-31T13,18uuh1g,70,6261,IllegallySmolCats,23e19j,"Our little girl had kittens",0,https://i.redd.it/sisv09mczi9c1.png,0.94,122,1703982676,2023-12-31T12:31:16+0000
2023-12-31T13,18uug1x,93,5077,CFB,2qm9d,"[Postgame Thread] Georgia Defeats Florida State 63-3",1,https://www.reddit.com/r/CFB/comments/18uug1x/postgame_thread_georgia_defeats_florida_state_633/,0.92,5013,1703982607,2023-12-31T12:30:07+0000
2023-12-31T13,18uufux,32,16361,BeAmazed,363r3,"Dude channels his inner Celine Dion during karaoke performance and absolutely crushes it",0,https://v.redd.it/k2z3zoi3zi9c1,0.95,644,1703982596,2023-12-31T12:29:56+0000
2023-12-31T13,18uuc40,60,18069,WhitePeopleTwitter,35n7t,"The GOP literally just outed themselves with this action.",0,https://i.redd.it/5rqha539yi9c1.png,0.94,698,1703982308,2023-12-31T12:25:08+0000
2023-12-31T13,18uuboj,23,36832,me_irl,2vegg,Me_irl,0,https://i.redd.it/ja8ilsy5yi9c1.jpeg,0.96,717,1703982277,2023-12-31T12:24:37+0000
2023-12-31T13,18uuami,44,8935,politics,2cneq,"Vivek Ramaswamy Says He Won’t Be on Maine Ballot if Donald Trump Is Banned",0,https://www.thedailybeast.com/vivek-ramaswamay-hits-maine-after-secretary-of-state-shenna-bellows-boots-donald-trump-from-its-ballot,0.92,2005,1703982196,2023-12-31T12:23:16+0000
2023-12-31T13,18utucf,40,11706,worldnews,2qh13,"Brexit has completely failed for UK, say clear majority of Britons – poll",0,https://www.theguardian.com/politics/2023/dec/30/britons-brexit-bad-uk-poll-eu-finances-nhs,0.92,1686,1703980988,2023-12-31T12:03:08+0000
2023-12-31T13,18utneb,91,6342,BikiniBottomTwitter,3deqz,"The Matrix is real or is it ",0,https://v.redd.it/ly6ojv4usi9c1,0.96,96,1703980489,2023-12-30T11:54:49+0000
2023-12-31T13,18usuw0,75,9088,interestingasfuck,2qhsa,"The Netherlands has so many bikes they are literally clogging the canals",0,https://v.redd.it/jeol46rgmi9c1,0.95,444,1703978397,2023-12-30T11:19:57+0000
2023-12-31T13,18us67f,43,19053,nextfuckinglevel,m0bnr,"16 year old Luke Littler thrashes five-time world champion at the World Darts Championship",0,https://v.redd.it/pdddvoh9hi9c1,0.93,1609,1703976621,2023-12-30T10:50:21+0000
2023-12-31T13,18us4n6,73,9538,antiwork,2y77d,"A young mom was asking for immediate job openings, as she is in a difficult position. This was one boomers suggestion.",0,https://i.redd.it/lp2a4ak0hi9c1.jpeg,0.92,1048,1703976510,2023-12-30T10:48:30+0000
2023-12-31T13,18urodx,54,16164,Wellthatsucks,2xcv7,"Asking to get pulled over",0,https://i.redd.it/i8llkq8ldi9c1.jpeg,0.94,408,1703975358,2023-12-30T10:29:18+0000
2023-12-31T13,18upwxk,64,21032,BlackPeopleTwitter,33x33,"Drip so hard the court became a slipping hazard",0,https://i.redd.it/ljz3klmyzh9c1.jpeg,0.9,982,1703970775,2023-12-30T09:12:55+0000
2023-12-31T13,18uolyy,87,26431,Eyebleach,2s427,"The cat , saved from the wreckage, does not leave her rescuer ( Turkey )",0,https://i.imgur.com/hz6cCtJ.gifv,0.96,352,1703967385,2023-12-30T08:16:25+0000
2023-12-31T13,18uoeal,96,18631,WorkReform,5qpzgw,"$20,700,000,000,000",0,https://i.redd.it/7otmxdg8oh9c1.jpeg,0.91,1101,1703966831,2023-12-30T08:07:11+0000
