date,id,position,score,subreddit_display_name,subreddit_id,title,is_self,url,upvote_ratio,num_comments,created,created_date
2024-01-05T12,18z4cyn,63,814,formuladank,3ndbi,"I know it’s cringe",0,https://i.redd.it/o7juwsiqslac1.jpeg,0.97,18,1704452622,2024-01-05T11:03:42+0000
2024-01-05T12,18z3ji6,50,1106,EscapefromTarkov,3aq6o,"Sooo, you like snow, right?",1,https://www.reddit.com/r/EscapefromTarkov/comments/18z3ji6/sooo_you_like_snow_right/,0.96,204,1704449401,2024-01-05T10:10:01+0000
2024-01-05T12,18z3j4l,79,1536,meirl,2s5ti,Meirl,0,https://i.redd.it/gbf77aw0jlac1.jpeg,0.94,131,1704449358,2024-01-05T10:09:18+0000
2024-01-05T12,18z37ne,80,878,PublicFreakout,2yrq6,"Abusive husband spits on his wife's face and gets smacked by big biker,Brazil",0,https://v.redd.it/k057kx9selac1,0.98,74,1704448074,2024-01-05T09:47:54+0000
2024-01-05T12,18z344d,28,3723,shitposting,2usxq,"Hehe 🤡",0,https://i.redd.it/10b22o5zdlac1.jpeg,0.94,194,1704447656,2024-01-05T09:40:56+0000
2024-01-05T12,18z2pmf,78,1011,theydidthemath,2x23b,"[REQUEST] How much CO2 could these trees capture in a year?",0,https://i.redd.it/80qk6ittikq91.jpg,0.97,50,1704446039,2024-01-05T09:13:59+0000
2024-01-05T12,18z2ofu,23,2275,ich_iel,37k29,ich_iel,0,https://i.redd.it/2upl7jnq8lac1.png,0.96,55,1704445908,2024-01-05T09:11:48+0000
2024-01-05T12,18z2h4e,73,1056,bangalore,2qhvf,"Update from Mr. u/Broseph regarding missing caes around KIA",1,https://www.reddit.com/r/bangalore/comments/18z2h4e/update_from_mr_ubroseph_regarding_missing_caes/,0.96,27,1704445112,2024-01-05T08:58:32+0000
2024-01-05T12,18z24d4,4,5661,shitposting,2usxq,Real,0,https://v.redd.it/htdaa4tz1lac1,0.96,61,1704443628,2024-01-05T08:33:48+0000
2024-01-05T12,18z1we4,38,1986,pcmasterrace,2sgp1,"Which game is this",0,https://i.redd.it/34ivajo8zkac1.png,0.93,404,1704442726,2024-01-05T08:18:46+0000
2024-01-05T12,18z1l9t,15,3693,me_irl,2vegg,me_irl,0,https://i.redd.it/rnyy5pxtvkac1.png,0.98,51,1704441557,2024-01-05T07:59:17+0000
2024-01-05T12,18z1gqn,37,2220,TikTokCringe,mvcq5,"You better watch out!",0,https://v.redd.it/w8gxjwoaukac1,0.84,547,1704441043,2024-01-05T07:50:43+0000
2024-01-05T12,18z1cqe,100,1129,Funnymemes,2xqtc,"30 or 3000",0,https://i.redd.it/qxgl2letskac1.jpeg,0.94,65,1704440605,2024-01-05T07:43:25+0000
2024-01-05T12,18z12jh,66,2668,me_irl,2vegg,Me_irl,0,https://v.redd.it/dcovw0zdpkac1,0.98,42,1704439483,2024-01-05T07:24:43+0000
2024-01-05T12,18z11v7,2,8003,nextfuckinglevel,m0bnr,"13-Year-Old Makes History as First Person Ever to Beat Original Tetris",0,https://v.redd.it/6wxvr1pfpkac1,0.94,436,1704439411,2024-01-05T07:23:31+0000
2024-01-05T12,18z110j,42,3805,BeAmazed,363r3,"The little girl kicked the ball into her bag",0,https://v.redd.it/tm1h963pokac1,0.96,53,1704439313,2024-01-05T07:21:53+0000
2024-01-05T12,18z0zjx,70,1452,OneOrangeBraincell,5vej89,"He thinks we cant see him",0,https://i.redd.it/360th7nookac1.jpeg,0.99,50,1704439163,2024-01-05T07:19:23+0000
2024-01-05T12,18z0xip,40,2399,MemePiece,2tt3v,"I think that they made the perfect casting choices for once",0,https://i.redd.it/hhw1ggiwnkac1.png,0.96,64,1704438950,2024-01-05T07:15:50+0000
2024-01-05T12,18z0u50,29,3016,ksi,2xd5g,"Coffeezilla tweeted that right after JJ lmfaooo",0,https://i.redd.it/hh3tn53wmkac1.jpeg,0.95,282,1704438597,2024-01-05T07:09:57+0000
2024-01-05T12,18z0tnt,41,2226,Genshin_Impact,12p4l2,"I think I just got a heart attack",0,https://i.redd.it/tdw8et4wmkac1.jpeg,0.95,117,1704438548,2024-01-05T07:09:08+0000
2024-01-05T12,18z0rnk,33,5488,facepalm,2r5rp,"Why do people think that Pakistan is safe for women ?",0,https://i.redd.it/9hdpprg7mkac1.png,0.93,2072,1704438319,2024-01-05T07:05:19+0000
2024-01-05T12,18z0gsb,77,1586,AnarchyChess,2yvry,"Did a new copypasta just drop?",0,https://i.redd.it/wgvt7oyvikac1.jpeg,0.99,85,1704437201,2024-01-05T06:46:41+0000
2024-01-05T12,18z0a66,13,5093,wholesomememes,3gcwj,"She was really enjoying this moment",0,https://i.redd.it/oeap8zcvgkac1.png,0.98,25,1704436531,2024-01-05T06:35:31+0000
2024-01-05T12,18z05sb,86,1593,bonehurtingjuice,3jwwf,"What are you oofing step-bone?",0,https://i.redd.it/7uec1phmfkac1.jpeg,0.96,59,1704436116,2024-01-05T06:28:36+0000
2024-01-05T12,18yzz8z,60,1974,LeagueOfMemes,2tf0e,"great job riot",0,https://i.redd.it/e4g9ddvkdkac1.png,0.95,178,1704435488,2024-01-05T06:18:08+0000
2024-01-05T12,18yzw2e,85,1671,IndiaTech,50xgtt,"*enters any reliance/croma store*",0,https://i.redd.it/33bj03i9ckac1.png,0.94,78,1704435169,2024-01-05T06:12:49+0000
2024-01-05T12,18yzuii,31,3391,NatureIsFuckingLit,3gdh7,"🔥 An Australian Tarantula Hawk Wasp dragging off a huntsman spider to lay her egg on its paralysed body. When the egg hatches, the larva consumes the paralysed spider from the inside out, leaving the vital organs until last to keep their paralysed meal alive as long as possible.",0,https://i.redd.it/wfa8i7aeckac1.jpeg,0.94,452,1704435021,2024-01-05T06:10:21+0000
2024-01-05T12,18yzt2i,91,1638,Bossfight,3nbbq,"Blaire White, Bane of the Obese",0,https://v.redd.it/uuntejhubkac1,0.76,279,1704434885,2024-01-05T06:08:05+0000
2024-01-05T12,18yzmku,58,2102,DeepRockGalactic,3iufz,"Blessed devs overseeing the lootbug discussion.",0,https://i.redd.it/ve3gjwqbakac1.jpeg,0.97,96,1704434322,2024-01-05T05:58:42+0000
2024-01-05T12,18yzja3,34,3399,therewasanattempt,39ne7,"to not be on the ""list""",0,https://i.redd.it/s85s9n3d9kac1.png,0.96,85,1704434007,2024-01-05T05:53:27+0000
2024-01-05T12,18yzdel,92,1721,Awww,2suml,"Seems relaxing",0,https://v.redd.it/q135j6vp7kac1,0.99,31,1704433482,2024-01-05T05:44:42+0000
2024-01-05T12,18yz4xp,22,4862,comics,2qh0s,"I regret nothing about how stupid this is. I REGRET NOTHING!! (oc)",0,https://www.reddit.com/gallery/18yz4xp,0.95,58,1704432714,2024-01-05T05:31:54+0000
2024-01-05T12,18yz449,1,14618,nba,2qo4s,"[Highlight] Jokic wins it at the buzzer!",0,https://streamable.com/us1ioa,0.95,1637,1704432642,2024-01-05T05:30:42+0000
2024-01-05T12,18yz2r9,5,9664,facepalm,2r5rp,"Raising the Stakes: Exploring the Heights of Lifted Trucks",0,https://i.redd.it/1fqst8tr2kac1.jpeg,0.96,806,1704432527,2024-01-05T05:28:47+0000
2024-01-05T12,18yyy9z,18,5505,meirl,2s5ti,meirl,0,https://i.redd.it/h1yjfn8q3kac1.jpeg,0.95,136,1704432103,2024-01-05T05:21:43+0000
2024-01-05T12,18yyq3y,54,5311,Damnthatsinteresting,2xxyj,"Gravity on each planet",0,https://v.redd.it/zr5qo3oj1kac1,0.95,147,1704431369,2024-01-05T05:09:29+0000
2024-01-05T12,18yyq2h,44,3124,oddlysatisfying,2x93b,"Giant electromagnetic tool for excavator removing nails from sand",0,https://v.redd.it/9cnbpw7j1kac1,0.96,127,1704431365,2024-01-05T05:09:25+0000
2024-01-05T12,18yypdq,75,4156,Unexpected,2w67q,"Dropping your phone from a balcony",0,https://v.redd.it/c4198v391kac1,0.9,221,1704431299,2024-01-05T05:08:19+0000
2024-01-05T12,18yym7i,76,9190,facepalm,2r5rp,"He think about that twice every 5 minutes",0,https://i.redd.it/839tl1ye0kac1.jpeg,0.96,333,1704431018,2024-01-05T05:03:38+0000
2024-01-05T12,18yykph,35,8472,interestingasfuck,2qhsa,"Man mimics how English sounds to non-English speakers",0,https://v.redd.it/20qa8c010kac1,0.96,297,1704430892,2024-01-05T05:01:32+0000
2024-01-05T12,18yyfpl,81,2171,IAmTheMainCharacter,4dh289,"The disrespect",0,https://v.redd.it/c9ljyw4tyjac1,0.91,263,1704430460,2024-01-05T04:54:20+0000
2024-01-05T12,18yybgo,82,4063,NonPoliticalTwitter,39gt6y,"Flattery and Mediocrity",0,https://i.imgur.com/ZjTxKN0.jpeg,0.98,97,1704430081,2024-01-05T04:48:01+0000
2024-01-05T12,18yy9k9,6,11947,BeAmazed,363r3,"Veterinarian deftly removes a toy stuck in a German Shepherd's oesophagus",0,https://i.imgur.com/mdCsINH.gifv,0.97,109,1704429911,2024-01-05T04:45:11+0000
2024-01-05T12,18yy8lv,7,11816,Damnthatsinteresting,2xxyj,"This is how a chameleon gives birth",0,https://i.imgur.com/iKLUmfn.gifv,0.96,365,1704429828,2024-01-05T04:43:48+0000
2024-01-05T12,18yy5cw,10,8961,Eyebleach,2s427,"I have chosen you, human. Come in.",0,https://i.imgur.com/8kRBeCO.gifv,0.97,123,1704429550,2024-01-05T04:39:10+0000
2024-01-05T12,18yy507,49,3247,FunnyAnimals,2st2l,"I have chosen you, human. Come in.",0,https://i.imgur.com/8kRBeCO.gifv,0.96,51,1704429517,2024-01-05T04:38:37+0000
2024-01-05T12,18yxu89,95,3985,therewasanattempt,39ne7,"to BBQ p*dophiles",0,https://i.redd.it/0n5a8bd7tjac1.jpeg,0.95,318,1704428565,2024-01-05T04:22:45+0000
2024-01-05T12,18yxqwp,89,2412,perfectlycutscreams,3n7fs,"Perfect and Multiple",0,https://v.redd.it/osoqzn4dsjac1,0.88,81,1704428283,2024-01-05T04:18:03+0000
2024-01-05T12,18yxpd7,21,7060,memes,2qjpg,"Which one are you?",0,https://i.redd.it/7dr0ep6xrjac1.png,0.95,482,1704428153,2024-01-05T04:15:53+0000
2024-01-05T12,18yxofb,32,5002,NonPoliticalTwitter,39gt6y,"Costco samples in a classier setting",0,https://i.redd.it/apjpqcgqrjac1.jpeg,0.94,118,1704428071,2024-01-05T04:14:31+0000
2024-01-05T12,18yxnhx,26,6697,HolUp,qir9n,"I didn’t get confused to be honest with you guys lmao",0,https://v.redd.it/u9e4sxqhrjac1,0.95,61,1704427989,2024-01-05T04:13:09+0000
2024-01-05T12,18yxkza,47,3559,australia,2qh8e,"Just saw this",0,https://i.redd.it/aequar2wqjac1.jpeg,0.94,489,1704427786,2024-01-05T04:09:46+0000
2024-01-05T12,18yxizb,3,32678,maybemaybemaybe,38e1l,"Maybe Maybe Maybe",0,https://v.redd.it/prh47isbqjac1,0.91,934,1704427613,2024-01-05T04:06:53+0000
2024-01-05T12,18yxha7,56,3234,technicallythetruth,3pzez,"Two is less than three",0,https://i.redd.it/oec9y4pxpjac1.jpeg,0.95,48,1704427470,2024-01-05T04:04:30+0000
2024-01-05T12,18yxc3n,43,4330,meme,2qi1r,"Song suggestions please!(3)",0,https://i.redd.it/ts565e1nojac1.jpeg,0.97,466,1704427036,2024-01-05T03:57:16+0000
2024-01-05T12,18yxbw4,8,12311,interestingasfuck,2qhsa,"Identical triplet brothers, who were separated and adopted at birth, only learned of each other’s existence when 2 of the brothers met at a dorm party while attending the same college",0,https://i.redd.it/clrty3vlojac1.jpeg,0.95,359,1704427018,2024-01-05T03:56:58+0000
2024-01-05T12,18yxbpb,64,2856,nottheonion,2qnts,"Man in Las Vegas courtroom attack video says he had bad day, tried to kill judge",0,https://www.8newsnow.com/investigators/man-in-las-vegas-courtroom-attack-says-he-had-bad-day-tried-to-kill-judge-documents,0.96,209,1704427001,2024-01-05T03:56:41+0000
2024-01-05T12,18yx7sq,53,3439,movies,2qh3s,"30 Years On, Tombstone Looks Like The Only Normal Western Of The ‘90’s",0,https://www.pastemagazine.com/movies/kurt-russell/tombstone-western-90s-old-fashioned,0.92,570,1704426655,2024-01-05T03:50:55+0000
2024-01-05T12,18yx3ub,14,10813,SipsTea,5tdqj0,"Airplane mode ",0,https://v.redd.it/xsq6wg7imjac1,0.91,494,1704426315,2024-01-05T03:45:15+0000
2024-01-05T12,18ywz2l,36,5134,BlackPeopleTwitter,33x33,"Out of the mouths of babes",0,https://www.reddit.com/gallery/18ywz2l,0.93,141,1704425908,2024-01-05T03:38:28+0000
2024-01-05T12,18ywv92,12,16228,Unexpected,2w67q,"I remember when I was so innocent ♥️",0,https://v.redd.it/kpzgxigckjac1,0.88,260,1704425585,2024-01-05T03:33:05+0000
2024-01-05T12,18ywv2i,88,2694,DIY,2qh7d,"Vent right next to/under toilet. How would you deal with this? There is a smell 😵‍💫",0,https://www.reddit.com/gallery/18ywv2i,0.93,1143,1704425570,2024-01-05T03:32:50+0000
2024-01-05T12,18ywrsf,16,8536,pics,2qh0u,"I saw this when I parked and opened my car door after work. It is not my husband's.",0,https://i.redd.it/i2zr399ijjac1.jpeg,0.92,924,1704425304,2024-01-05T03:28:24+0000
2024-01-05T12,18ywk3v,9,14929,holdmycatnip,2zhxd,"this is my throne now",0,https://v.redd.it/qhw4igjlhjac1,0.96,222,1704424671,2024-01-05T03:17:51+0000
2024-01-05T12,18ywjup,25,8322,clevercomebacks,dyqlw,"Naruto irony",0,https://i.redd.it/81qxttdkhjac1.jpeg,0.95,185,1704424650,2024-01-05T03:17:30+0000
2024-01-05T12,18ywa9x,67,3311,malelivingspace,2v70p,"First High Rise Apartment (650sqft)",0,https://www.reddit.com/gallery/18ywa9x,0.94,807,1704423875,2024-01-05T03:04:35+0000
2024-01-05T12,18yw72w,11,13133,mildlyinteresting,2ti4h,"This remote can take a single 12 volt battery or two AAA batteries",0,https://i.redd.it/w4s2lhugejac1.jpeg,0.97,278,1704423639,2024-01-05T03:00:39+0000
2024-01-05T12,18yvyd0,62,6829,nba,2qo4s,"[Highlight] Wemby blocks the Giannis dunk to save the game!",0,https://streamable.com/ikr7ra,0.96,531,1704422965,2024-01-05T02:49:25+0000
2024-01-05T12,18yvs38,27,7652,todayilearned,2qqjc,"TIL General Electric dumped toxic ""forever"" chemicals into the Hudson River and its CEO, Jack Welch, disputed the EPA's findings that these chemicals are toxic.",0,https://www.timesunion.com/business/article/Jack-Welch-GE-chairman-who-left-complicated-15098587.php,0.97,289,1704422459,2024-01-05T02:40:59+0000
2024-01-05T12,18yvlqi,65,3753,AITAH,446kys,"AITA for giving my children permission to defend themselves and ruining my brother's visit?",1,https://www.reddit.com/r/AITAH/comments/18yvlqi/aita_for_giving_my_children_permission_to_defend/,0.93,568,1704421961,2024-01-05T02:32:41+0000
2024-01-05T12,18yvf7n,99,3069,lotr,2rfb9,"Lol, try not to judge him too harshly ",0,https://v.redd.it/fdi3kpfz7jac1,0.96,48,1704421447,2024-01-05T02:24:07+0000
2024-01-05T12,18yv9p8,55,4676,WhitePeopleTwitter,35n7t,"BREAKING: Trump attorney Alina Habba calls for the immediate arrest of ALL Jeffery Epstein associates.",0,https://i.redd.it/igl06j6o6jac1.png,0.97,335,1704421004,2024-01-05T02:16:44+0000
2024-01-05T12,18yv78v,98,3199,mildlyinfuriating,2ubgg,"I was laughed at for wanting to buy a car at sticker price",1,https://www.reddit.com/r/mildlyinfuriating/comments/18yv78v/i_was_laughed_at_for_wanting_to_buy_a_car_at/,0.96,654,1704420809,2024-01-05T02:13:29+0000
2024-01-05T12,18yv5nv,19,13191,MadeMeSmile,2uqcm,"Brotherly love",0,https://v.redd.it/eyqbu37r2jac1,0.96,197,1704420678,2024-01-05T02:11:18+0000
2024-01-05T12,18yunq6,94,3590,AskReddit,2qh1i,"Europeans of Reddit, what do Americans have everyday that you see as a luxury?",1,https://www.reddit.com/r/AskReddit/comments/18yunq6/europeans_of_reddit_what_do_americans_have/,0.86,5674,1704419260,2024-01-05T01:47:40+0000
2024-01-05T12,18yulmi,71,4175,nflcirclejerk,2sulf,"Another member for the Classy, Sneaky Athletic Team",0,https://i.redd.it/ny3jvn621jac1.jpeg,0.94,322,1704419099,2024-01-05T01:44:59+0000
2024-01-05T12,18yufbf,39,7402,sports,2qgzy,"Shaq is told on air that the Orlando Magic are retiring his jersey number.",0,https://v.redd.it/c74ow5hmziac1,0.94,282,1704418626,2024-01-05T01:37:06+0000
2024-01-05T12,18yuez1,97,3677,CuratedTumblr,3x5kfw,"The Dunning-Krueger of Dragon Nerds",0,https://i.redd.it/5ed7fyikziac1.png,0.95,103,1704418598,2024-01-05T01:36:38+0000
2024-01-05T12,18yudwr,24,15565,tumblr,2r7hk,"The Dunning-Krueger of Dragon Nerds",0,https://i.redd.it/0fhqq3lbziac1.png,0.96,286,1704418515,2024-01-05T01:35:15+0000
2024-01-05T12,18yuatd,20,19568,AbsoluteUnits,a7wuv,"of this Crocodile, a real river monster",0,https://v.redd.it/muk7hl7rxiac1,0.91,1175,1704418285,2024-01-05T01:31:25+0000
2024-01-05T12,18yu87z,61,8236,PeterExplainsTheJoke,121h8r,Peetah,0,https://i.redd.it/8gv2slg2yiac1.jpeg,0.71,562,1704418093,2024-01-05T01:28:13+0000
2024-01-05T12,18yu7mi,17,15009,PoliticalHumor,2qm21,"GOP, just be yourself",0,https://i.redd.it/ygvzkj9xxiac1.png,0.92,502,1704418045,2024-01-05T01:27:25+0000
2024-01-05T12,18yu7f2,68,4850,oddlyterrifying,2yo6b,"Bull Orca dying of natural causes and sinking to bottom of ocean",0,https://v.redd.it/3ppn59ouxiac1,0.95,268,1704418030,2024-01-05T01:27:10+0000
2024-01-05T12,18ytxk9,74,4887,ImTheMainCharacter,4c4j2u,"It’s almost like people don’t want to be recorded while minding their own business.",0,https://v.redd.it/kbw62belviac1,0.88,468,1704417280,2024-01-05T01:14:40+0000
2024-01-05T12,18ytvp1,59,5940,PrequelMemes,3i60n,"A rude awakening",0,https://i.redd.it/6hxb3gt7viac1.jpeg,0.98,54,1704417135,2024-01-05T01:12:15+0000
2024-01-05T12,18ytnid,72,5198,TIHI,r1l2z,"Thanks, I hate Disney Princess faceswaps with Villains",0,https://i.redd.it/twqg2pddtiac1.jpeg,0.96,202,1704416525,2024-01-05T01:02:05+0000
2024-01-05T12,18ytn8k,87,4427,aww,2qh1o,"Picking this boy up from the pound tomorrow. (OC)",0,https://i.redd.it/va6jo5dctiac1.jpeg,0.99,78,1704416504,2024-01-05T01:01:44+0000
2024-01-05T12,18yskib,51,7745,antiwork,2y77d,"The CEO actually admitted fault. Are we in the twilight zone?",0,https://i.redd.it/mkhhjli0liac1.jpeg,0.95,446,1704413703,2024-01-05T12:15:03+0000
2024-01-05T12,18ys5fz,93,5207,houseplants,2skiq,"Plant shelf before and after 10 months of growth.",0,https://www.reddit.com/gallery/18ys5fz,0.97,152,1704412658,2024-01-04T11:57:38+0000
2024-01-05T12,18ys1yu,48,14782,whenthe,23gidu,"The Iron Nonce",0,https://v.redd.it/5egq77v4hiac1,0.92,268,1704412412,2024-01-04T11:53:32+0000
2024-01-05T12,18ys1bz,83,15251,todayilearned,2qqjc,"TIL: The USA doesnt use A4 or other A series paper sizes, but instead their own standard, ""Letter"", ""Legal"" and ""Tabloid""",0,"https://www.swiftpublisher.com/useful-articles/paper-sizes-and-formats-explained#:~:text=The%20most%20commonly%20used%20ISO,8.5%20in%20%C3%97%2014%20in).",0.89,2274,1704412367,2024-01-04T11:52:47+0000
2024-01-05T12,18yrdgv,96,5625,OldSchoolCool,2tycb,"Chris Farley and Patrick Swayze on SNL in 1990",0,https://v.redd.it/8nj4rx6zbiac1,0.96,215,1704410694,2024-01-04T11:24:54+0000
2024-01-05T12,18yrbr2,30,26014,funny,2qh33,"""It's mine meow""",0,https://v.redd.it/jmvm0cuobiac1,0.95,301,1704410568,2024-01-04T11:22:48+0000
2024-01-05T12,18yqkok,57,9319,politics,2cneq,"Illinois voters ask elections board to take Trump off 2024 ballot",0,https://www.cnn.com/2024/01/04/politics/illinois-voters-ask-elections-board-to-take-trump-off-2024-ballot/index.html,0.96,632,1704408700,2024-01-04T10:51:40+0000
2024-01-05T12,18ypz37,69,9665,Construction,2qiuc,"Anybody else following that tunnel lady on tiktok?",0,https://v.redd.it/6e8cad272iac1,0.9,1847,1704407383,2024-01-04T10:29:43+0000
2024-01-05T12,18ypnpu,46,18891,AnimalsBeingBros,2wmvy,"That’s his kitten now",0,https://v.redd.it/dhq3nrovzhac1,0.95,135,1704406609,2024-01-04T10:16:49+0000
2024-01-05T12,18ypmsb,52,15954,cats,2qhta,"Jack, my oldest cat and most willing to entertain me with photos",0,https://www.reddit.com/gallery/18ypmsb,0.96,718,1704406546,2024-01-04T10:15:46+0000
2024-01-05T12,18yoybk,45,23498,pettyrevenge,2vg7t,"Continuously kick my seat on flight, get your belongings soaked",1,https://www.reddit.com/r/pettyrevenge/comments/18yoybk/continuously_kick_my_seat_on_flight_get_your/,0.94,589,1704404884,2024-01-04T09:48:04+0000
2024-01-05T12,18ym52c,84,20464,news,2qh3l,"New York City announces lawsuit against bus companies sending migrants to city, seeks $708 million",0,https://abcnews.go.com/US/new-york-city-announces-lawsuit-bus-companies-sending/story?id=106110357,0.91,1441,1704397922,2024-01-04T07:52:02+0000
2024-01-05T12,18ylskt,90,26198,BrandNewSentence,mbn0j,"It was just a good Christian honk",0,https://i.redd.it/z391cy0k7hac1.png,0.93,713,1704397098,2024-01-04T07:38:18+0000
