date,id,position,score,subreddit_display_name,subreddit_id,title,is_self,url,upvote_ratio,num_comments,created,created_date
2024-01-09T03,1922204,75,1425,popculturechat,5rj68d,"Lindsay Lohan makes a surprise appearance at “Mean Girls” premiere",0,https://www.reddit.com/gallery/1922204,0.98,116,1704763136,2024-01-09T01:18:56+0000
2024-01-09T03,1921vll,5,5401,Damnthatsinteresting,2xxyj,"An angelfish receiving a CT scan at the Denver Zoo",0,https://i.redd.it/ux2xjc2lebbc1.jpeg,0.98,251,1704762640,2024-01-09T01:10:40+0000
2024-01-09T03,1921p91,81,1438,nba,2qo4s,"[Highlight] Haliburton does the splits and looks to be in tons of pain",0,https://streamable.com/vc2r9u,0.97,345,1704762149,2024-01-09T01:02:29+0000
2024-01-09T03,1921nqh,80,1580,SipsTea,5tdqj0,"On this day, the pain was real",0,https://v.redd.it/k6ixoabtcbbc1,0.97,76,1704762046,2024-01-09T01:00:46+0000
2024-01-09T03,1921n7p,26,2659,gaming,2qh03,"In a letter to the Marvel's Spider-Man community, MJ model reports fan harassment and confirms she's no longer ""actively auditioning""",0,https://www.gamesradar.com/in-a-letter-to-the-marvels-spider-man-community-mj-model-reports-fan-harassment-and-confirms-shes-no-longer-actively-auditioning/,0.91,568,1704762014,2024-01-09T01:00:14+0000
2024-01-09T03,19213sy,82,1566,OldSchoolCool,2tycb,"Jennifer Connelly in ‘The Rocketeer’ (1991).",0,https://i.redd.it/np6wmlua8bbc1.jpeg,0.97,96,1704760527,2024-01-09T12:35:27+0000
2024-01-09T03,1920q0d,1,9812,pics,2qh0u,"Paul Giamatti with his Golden Globe at In-N-Out.",0,https://i.redd.it/swnw74t65bbc1.jpeg,0.98,314,1704759481,2024-01-09T12:18:01+0000
2024-01-09T03,1920o2t,24,3222,nextfuckinglevel,m0bnr,"Lung capacity of this kid is amazing",0,https://i.imgur.com/MrDCsML.gifv,0.95,133,1704759338,2024-01-09T12:15:38+0000
2024-01-09T03,1920kz7,18,4027,Millennials,2rc4u,"Should American Taxpayers Forgive Student Loan Debt?????????",0,https://i.redd.it/1v34fg6d2zac1.png,0.92,1040,1704759106,2024-01-09T12:11:46+0000
2024-01-09T03,1920cvj,40,2717,science,mouw,"Bottled water contains hundreds of thousands of plastic bits: study",0,https://www.france24.com/en/live-news/20240108-bottled-water-contains-hundreds-of-thousands-of-plastic-bits-study,0.95,444,1704758531,2024-01-09T12:02:11+0000
2024-01-09T03,19209ee,37,2843,Fauxmoi,2rqcm8,"Mark Hamill finally meets his mother, Natalie Portman",0,https://i.redd.it/asbbc5go1bbc1.jpeg,0.96,96,1704758300,2024-01-08T11:58:20+0000
2024-01-09T03,191zyci,58,2182,CuratedTumblr,3x5kfw,"Biology of the Greek Chimera",0,https://www.reddit.com/gallery/191zyci,0.98,111,1704757514,2024-01-08T11:45:14+0000
2024-01-09T03,191zr2w,35,3193,tumblr,2r7hk,"South park fans are... something",0,https://i.redd.it/t4ijrjpsxabc1.jpeg,0.95,121,1704757003,2024-01-08T11:36:43+0000
2024-01-09T03,191zfa7,54,2391,Starfield,3g41m,"A bug turned me into Jack Sparrow",0,https://v.redd.it/dncorerpsabc1,0.97,93,1704756172,2024-01-08T11:22:52+0000
2024-01-09T03,191zdwj,95,1810,terriblefacebookmemes,2tja6,"At least get the grammar right",0,https://i.redd.it/lmi6dng2vabc1.jpeg,0.95,187,1704756077,2024-01-08T11:21:17+0000
2024-01-09T03,191z528,88,3795,politics,2cneq,"Trump Loses Federal Appeal on Immunity in E. Jean Carroll Case",0,https://themessenger.com/politics/trump-loses-federal-appeal-immunity-e-jean-carroll-defamation-case,0.98,137,1704755459,2024-01-08T11:10:59+0000
2024-01-09T03,191z0tz,31,7331,WhitePeopleTwitter,35n7t,"Starting the year classy with Boebert!",0,https://i.redd.it/12fqzurdsabc1.png,0.97,413,1704755178,2024-01-08T11:06:18+0000
2024-01-09T03,191ytwi,46,2856,mildlyinteresting,2ti4h,"Our 30 year old horse lost a tooth while eating the other day.",0,https://i.redd.it/4xq5x151rabc1.jpeg,0.97,190,1704754719,2024-01-08T10:58:39+0000
2024-01-09T03,191yt5s,3,10625,BlackPeopleTwitter,33x33,"Way too many criminal apologist defending this man",0,https://i.redd.it/dsbmygpvqabc1.jpeg,0.93,948,1704754668,2024-01-08T10:57:48+0000
2024-01-09T03,191ymi9,47,2840,CFB,2qm9d,"[Dellenger] As the crowd braves a rain and wind storm to get into NRG Stadium for the national championship game, a Washington fan screams at Michigan fans that their team “isn’t prepared to play in this kinda northwest weather.” The game will be played indoors.",0,https://x.com/rossdellenger/status/1744490677507965148?s=46&t=NSqMrWhSE7eHOVUPkoCjFQ,0.94,329,1704754213,2024-01-08T10:50:13+0000
2024-01-09T03,191yjt2,91,2082,midjourney,5zvcfk,"Datenight 5",0,https://www.reddit.com/gallery/191yjt2,0.9,198,1704754027,2024-01-08T10:47:07+0000
2024-01-09T03,191ydmx,34,4084,PeterExplainsTheJoke,121h8r,"Petahhh, what is the funniest thing evahhh?",0,https://i.redd.it/jibcmwzpnabc1.jpeg,0.87,351,1704753606,2024-01-08T10:40:06+0000
2024-01-09T03,191ydlm,16,5817,KidsAreFuckingStupid,3948y,"Thats my homework dude! ",0,https://v.redd.it/tw1kh0ppnabc1,0.97,124,1704753604,2024-01-08T10:40:04+0000
2024-01-09T03,191y7us,4,16297,memes,2qjpg,"what game",0,https://i.redd.it/0qsciw1emabc1.png,0.96,2398,1704753207,2024-01-08T10:33:27+0000
2024-01-09T03,191y6s4,92,2142,shittytattoos,2tbk2,"Speaks for itself",0,https://i.redd.it/9obbdp2bmabc1.jpeg,0.91,158,1704753131,2024-01-08T10:32:11+0000
2024-01-09T03,191y6lu,51,2899,aww,2qh1o,"he is spoiled",0,https://v.redd.it/tpc25sn9mabc1,0.97,121,1704753118,2024-01-08T10:31:58+0000
2024-01-09T03,191y60p,29,4531,Presidents,2qwlm,"Give me Biden pic that goes harder than this",0,https://i.redd.it/7ewx6wg5mabc1.jpeg,0.75,1136,1704753078,2024-01-08T10:31:18+0000
2024-01-09T03,191y51u,93,2205,madlads,3aegn,"Here it is",0,https://i.redd.it/ng28f8vylabc1.jpeg,0.94,62,1704753017,2024-01-08T10:30:17+0000
2024-01-09T03,191y4k0,59,2729,fightporn,2u5un,"Machete wielding lunatic gets flattened",0,https://v.redd.it/xf0s5hbrlabc1,0.97,195,1704752986,2024-01-08T10:29:46+0000
2024-01-09T03,191xwzy,85,2294,PublicFreakout,2yrq6,"1st Amendment Auditor Gets a Taste of His Own Medicine",0,https://v.redd.it/vk4ytjo6kabc1,0.82,683,1704752458,2024-01-08T10:20:58+0000
2024-01-09T03,191xto7,68,2616,BatmanArkham,2y9q4,"Rocksteady has announced there finale arkham game titled Arkham Knight set to be released in June 23, 2015",0,https://i.redd.it/pva4jnkmjabc1.jpeg,0.97,193,1704752230,2024-01-08T10:17:10+0000
2024-01-09T03,191xmb9,57,6381,Damnthatsinteresting,2xxyj,"The top 100 most-watched U.S. television broadcasts of 2023.",0,https://i.redd.it/145dy113iabc1.jpeg,0.93,828,1704751729,2024-01-08T10:08:49+0000
2024-01-09T03,191x7xa,76,5486,BlackPeopleTwitter,33x33,"I can’t believe they had to do this to him",0,https://i.redd.it/z68uxm3dfabc1.jpeg,0.93,347,1704750796,2024-01-08T09:53:16+0000
2024-01-09T03,191x2sp,45,3619,golf,2qhcs,"Nike Post",0,https://i.redd.it/70hq3bbceabc1.jpeg,0.95,185,1704750451,2024-01-08T09:47:31+0000
2024-01-09T03,191wxvj,15,7630,NonPoliticalTwitter,39gt6y,"She gets my vote",0,https://i.redd.it/sm5yi10cdabc1.jpeg,0.96,97,1704750134,2024-01-08T09:42:14+0000
2024-01-09T03,191wt6c,21,6140,BeAmazed,363r3,"What is your fav?",0,https://v.redd.it/hzcxglkdcabc1,0.93,348,1704749810,2024-01-08T09:36:50+0000
2024-01-09T03,191wpci,6,11551,WhitePeopleTwitter,35n7t,"Mediaite Obtained Audio of Roger Stone Allegedly Discussing Assassinating Lawmakers",0,https://i.redd.it/h0n1bflobabc1.png,0.97,726,1704749559,2024-01-08T09:32:39+0000
2024-01-09T03,191wlne,73,6043,funny,2qh33,"the only solution",0,https://v.redd.it/5767w14saabc1,0.95,905,1704749331,2024-01-08T09:28:51+0000
2024-01-09T03,191wigs,13,8616,europe,2qh4j,"German Depression Aid campaign",0,https://i.redd.it/qei40jedaabc1.png,0.96,352,1704749119,2024-01-08T09:25:19+0000
2024-01-09T03,191w7w0,20,6989,ContagiousLaughter,2u2bh,"Drive-thru worker confirms every ordered item as a question",0,https://v.redd.it/m1f06haa8abc1,0.95,156,1704748423,2024-01-08T09:13:43+0000
2024-01-09T03,191w2b1,2,22851,MadeMeSmile,2uqcm,"Robert Downey Jr. praising Cillian Murphy",0,https://v.redd.it/wivk5j2u6abc1,0.95,512,1704748058,2024-01-08T09:07:38+0000
2024-01-09T03,191w15o,25,6790,whenthe,23gidu,"Stick in comments. ",0,https://v.redd.it/hvu96uoz6abc1,0.95,123,1704747980,2024-01-08T09:06:20+0000
2024-01-09T03,191vxug,44,4415,lotrmemes,2v0i1,"One thing we can all agree on...",0,https://i.redd.it/ljq6ikbb6abc1.jpeg,0.92,303,1704747752,2024-01-08T09:02:32+0000
2024-01-09T03,191vkse,86,3098,me_irlgbt,3apfn,"Me🔌irlgbt",0,https://i.redd.it/o2o5gj1q3abc1.jpeg,0.97,62,1704746880,2024-01-08T08:48:00+0000
2024-01-09T03,191vke0,12,10577,lethalcompany,9al6ft,"I animated a cinematic trailer for Lethal Company :)",0,https://v.redd.it/3m4xf7jd3abc1,0.96,476,1704746853,2024-01-08T08:47:33+0000
2024-01-09T03,191vjrz,10,11467,worldnews,2qh13,"United Airlines find loose bolts on plug doors of at least five aircraft during Boeing 737 Max 9 inspections",0,https://theaircurrent.com/feed/dispatches/united-finds-loose-bolts-on-plug-doors-during-737-max-9-inspections/,0.98,1170,1704746811,2024-01-08T08:46:51+0000
2024-01-09T03,191vjds,67,3838,dankmemes,2zmfe,"Future is not here.",0,https://i.redd.it/nmyscojf3abc1.jpeg,0.98,47,1704746783,2024-01-08T08:46:23+0000
2024-01-09T03,191vi4q,27,6471,ProgrammerHumor,2tex6,itWorksOnMyMachine,0,https://i.redd.it/ghqvhf063abc1.jpeg,0.95,123,1704746695,2024-01-08T08:44:55+0000
2024-01-09T03,191vi4k,94,3003,Destiny,2qnvz,"Ed Krassenstein Here -- It was a pleasure to have Destiny on our side",1,https://www.reddit.com/r/Destiny/comments/191vi4k/ed_krassenstein_here_it_was_a_pleasure_to_have/,0.94,280,1704746695,2024-01-08T08:44:55+0000
2024-01-09T03,191vhsl,69,3658,discordVideos,2cxozx,"BROKE❤️",0,https://v.redd.it/n8b9wa5z2abc1,0.97,58,1704746673,2024-01-08T08:44:33+0000
2024-01-09T03,191vg8p,32,5627,antiwork,2y77d,"The chaotic good",0,https://i.redd.it/yd3dewc4b9bc1.png,0.95,52,1704746567,2024-01-08T08:42:47+0000
2024-01-09T03,191vf02,39,5307,news,2qh3l,"Iowa school students walk out of class to protest gun violence after Perry shooting",0,https://www.press-citizen.com/story/news/education/2024/01/08/student-walkout-held-across-iowa-to-protest-gun-violence-following-perry-high-school-shooting/72126542007/,0.92,390,1704746484,2024-01-08T08:41:24+0000
2024-01-09T03,191vc7h,43,5131,me_irl,2vegg,"me irl",0,https://i.redd.it/xvrlzywz1abc1.jpeg,0.96,190,1704746300,2024-01-08T08:38:20+0000
2024-01-09T03,191vc3k,71,3696,PrequelMemes,3i60n,"Genuine thought on my mind",0,https://i.redd.it/ctqbd91z1abc1.jpeg,0.98,114,1704746292,2024-01-08T08:38:12+0000
2024-01-09T03,191v6zo,19,9399,oddlyspecific,2wjlc,"I think I‘m gonna be sick",0,https://i.redd.it/y80mvjgy0abc1.jpeg,0.93,876,1704745950,2024-01-08T08:32:30+0000
2024-01-09T03,191v4sf,53,4238,formuladank,3ndbi,"this is a real post from the official haas tiktok account",0,https://v.redd.it/4iqlfv9j0abc1,0.95,68,1704745809,2024-01-08T08:30:09+0000
2024-01-09T03,191v47j,50,4418,dataisbeautiful,2tk95,"[OC] Is this the most dangerous gas station in America?",0,https://i.redd.it/jmy6s9pb0abc1.png,0.93,780,1704745772,2024-01-08T08:29:32+0000
2024-01-09T03,191v37r,17,9975,pcmasterrace,2sgp1,"A good life",0,https://i.redd.it/2uaklew70abc1.jpeg,0.96,98,1704745703,2024-01-08T08:28:23+0000
2024-01-09T03,191v22h,11,10936,politics,2cneq,"Experts: Jack Smith’s “dramatic new proof” so “overwhelming” reluctant witnesses may decide to flip",0,https://www.salon.com/2024/01/08/experts-jack-smiths-dramatic-new-proof-so-overwhelming-reluctant-witnesses-may-decide-to-flip/,0.94,1044,1704745629,2024-01-08T08:27:09+0000
2024-01-09T03,191v09l,9,19586,clevercomebacks,dyqlw,"Whatever floats your boat",0,https://i.redd.it/kocyfshnz9bc1.jpeg,0.91,888,1704745511,2024-01-08T08:25:11+0000
2024-01-09T03,191v02a,96,3028,OneOrangeBraincell,5vej89,"It’s my Gimli’s gotcha day can I see your babies as kittens",0,https://www.reddit.com/gallery/191v02a,0.98,209,1704745499,2024-01-08T08:24:59+0000
2024-01-09T03,191uwxd,72,3671,LifeProTips,2s5oq,"LPT: feed your contractors",1,https://www.reddit.com/r/LifeProTips/comments/191uwxd/lpt_feed_your_contractors/,0.89,455,1704745291,2024-01-08T08:21:31+0000
2024-01-09T03,191un33,7,23782,interestingasfuck,2qhsa,"Gas leak in South Korea.",0,https://v.redd.it/wy2caxy0x9bc1,0.96,921,1704744640,2024-01-08T08:10:40+0000
2024-01-09T03,191uicx,99,3234,rareinsults,48t85,"On a post regarding the worst cities in the uk",0,https://i.redd.it/7a9rsro8w9bc1.jpeg,0.98,22,1704744364,2024-01-08T08:06:04+0000
2024-01-09T03,191uab5,66,4240,dontdeadopeninside,31t4s,"game over grant, cancer won",0,https://i.redd.it/hzoekoaou9bc1.jpeg,0.92,76,1704743840,2024-01-08T07:57:20+0000
2024-01-09T03,191u8pv,83,3747,GlowUps,ruinb,"From 550 lbs (28) to 265 lbs (30) in 24 months.",0,https://www.reddit.com/gallery/191u8pv,0.96,198,1704743733,2024-01-08T07:55:33+0000
2024-01-09T03,191u5b3,98,3342,ThatsInsane,swxxz,"Man who attacked Las Vegas judge is back in court, in front of the same judge.",0,https://i.redd.it/tgkgmy6nt9bc1.png,0.95,468,1704743498,2024-01-08T07:51:38+0000
2024-01-09T03,191u4kg,41,6209,NatureIsFuckingLit,3gdh7,"🔥 Polar bear enjoying some alone time",0,https://v.redd.it/a61w0ctat9bc1,0.97,121,1704743448,2024-01-08T07:50:48+0000
2024-01-09T03,191u48l,63,4378,Wellthatsucks,2xcv7,"Man who attacked Las Vegas judge is back in court, in front of the same judge.",0,https://i.redd.it/y0wxnynft9bc1.png,0.94,612,1704743428,2024-01-08T07:50:28+0000
2024-01-09T03,191trjo,28,57257,pics,2qh0u,"The man who lunged at a Las Vegas judge back in court, in front of the same judge",0,https://i.redd.it/gfqktrvxq9bc1.jpeg,0.94,4505,1704742582,2024-01-08T07:36:22+0000
2024-01-09T03,191to3k,8,38232,facepalm,2r5rp,"Kind of the entire reason for the presentation.",0,https://i.redd.it/j30sgo07q9bc1.jpeg,0.95,679,1704742345,2024-01-08T07:32:25+0000
2024-01-09T03,191tjq3,38,7151,todayilearned,2qqjc,"TIL Baby Aspirin should not be given to babies as it can cause Reyes Syndrome",0,https://www.arnoldpalmerhospital.com/content-hub/why-you-shouldnt-give-aspirin-to-your-child,0.95,452,1704742052,2024-01-08T07:27:32+0000
2024-01-09T03,191tgfb,30,8723,technicallythetruth,3pzez,"everything is just a dictionary remix",0,https://i.redd.it/bk6erpjoo9bc1.png,0.96,54,1704741825,2024-01-08T07:23:45+0000
2024-01-09T03,191tbpz,14,16101,funny,2qh33,"I guess he was just looking for some motivation",0,https://v.redd.it/z8dsnfoin9bc1,0.91,606,1704741507,2024-01-08T07:18:27+0000
2024-01-09T03,191t3o3,74,5046,teenagers,2rjli,"What would u name him?",0,https://i.redd.it/u0xiuq45m9bc1.jpeg,0.93,2534,1704740974,2024-01-08T07:09:34+0000
2024-01-09T03,191t1j1,33,8201,AskReddit,2qh1i,"Who has most successfully milked what should have been 15 minutes of fame?",1,https://www.reddit.com/r/AskReddit/comments/191t1j1/who_has_most_successfully_milked_what_should_have/,0.93,6702,1704740831,2024-01-08T07:07:11+0000
2024-01-09T03,191sku3,60,5921,wholesomememes,3gcwj,"Her Dad's response ❤",0,https://i.redd.it/ogqjtrfgi9bc1.jpeg,0.96,78,1704739744,2024-01-08T06:49:04+0000
2024-01-09T03,191s7do,23,11943,cats,2qhta,"Actual excerpts from vet notes about my cat",0,https://i.redd.it/v2l32uxqf9bc1.jpeg,0.98,448,1704738822,2024-01-08T06:33:42+0000
2024-01-09T03,191s684,65,6646,shitposting,2usxq,Focus,0,https://v.redd.it/d9ae0toif9bc1,0.96,75,1704738742,2024-01-08T06:32:22+0000
2024-01-09T03,191s5vx,36,16886,StupidFood,37se4,"Crimes against an entire nation.",0,https://v.redd.it/6domilm6f9bc1,0.78,1150,1704738719,2024-01-08T06:31:59+0000
2024-01-09T03,191rh60,61,6657,DOG,2qiy5,"He was so excited for this",0,https://v.redd.it/9osuy8dfa9bc1,0.98,79,1704737049,2024-01-08T06:04:09+0000
2024-01-09T03,191r843,97,6385,cursedcomments,hw1ju,cursed_spareparts,0,https://i.redd.it/gsagj9gk89bc1.jpeg,0.96,40,1704736469,2024-01-08T05:54:29+0000
2024-01-09T03,191r7nf,22,18888,FluentInFinance,3qpaq8,"President Biden says Billionaires have a moral obligation to contribute to society, not just hoard wealth. It's time for them to pay their fair share. Do you agree or disagree?",0,https://i.redd.it/otbskjzl89bc1.png,0.87,4026,1704736438,2024-01-08T05:53:58+0000
2024-01-09T03,191qnz5,90,5805,blunderyears,2vy3g,"This was my best friend & I before a night outing to Walmart",0,https://i.redd.it/hnz6ugkt49bc1.jpeg,0.96,238,1704735143,2024-01-08T05:32:23+0000
2024-01-09T03,191qgyq,84,6044,BaldursGate3,12967t,"PC players are given freedom, console players railroaded.",0,https://i.redd.it/8zg2lsg539bc1.png,0.95,274,1704734688,2024-01-08T05:24:48+0000
2024-01-09T03,191qdrl,89,6508,megalophobia,31gwh,"First wind-powered cargo ship...",0,https://i.redd.it/6rpyqkyr29bc1.jpeg,0.93,756,1704734474,2024-01-08T05:21:14+0000
2024-01-09T03,191q7vq,42,12947,mildlyinfuriating,2ubgg,"Some guy just stole a coffee and tried to have me pick up the tab",1,https://www.reddit.com/r/mildlyinfuriating/comments/191q7vq/some_guy_just_stole_a_coffee_and_tried_to_have_me/,0.96,656,1704734081,2024-01-08T05:14:41+0000
2024-01-09T03,191q427,64,7952,AllThatIsInteresting,93l1mw,"Disturbing bodycam footage shows the moment 23-year-old Chloe Jones was rescued after being kidnapped, beaten and held captive for four days by William Mozingo in October 2023.",0,https://v.redd.it/bxe4insu09bc1,0.94,1053,1704733821,2024-01-08T05:10:21+0000
2024-01-09T03,191q24x,100,40518,facepalm,2r5rp,"Is it creepy to be a good dad?",0,https://i.redd.it/n4gj7jah09bc1.png,0.88,7745,1704733688,2024-01-08T05:08:08+0000
2024-01-09T03,191po9d,49,11177,AITAH,446kys,"AITA for saying to my mom at family dinner “well I wouldn’t stay with a man who hits my kids so I guess we have different priorities”",1,https://www.reddit.com/r/AITAH/comments/191po9d/aita_for_saying_to_my_mom_at_family_dinner_well_i/,0.94,1584,1704732728,2024-01-08T04:52:08+0000
2024-01-09T03,191pefi,78,8932,absolutelynotme_irl,3b5ss,absolutelynotme_irl,0,https://i.redd.it/5mcz3k6kv8bc1.png,0.94,164,1704732034,2024-01-08T04:40:34+0000
2024-01-09T03,191pd9w,55,12875,maybemaybemaybe,38e1l,"Maybe maybe maybe ",0,https://v.redd.it/9l17z8rbv8bc1,0.92,546,1704731951,2024-01-08T04:39:11+0000
2024-01-09T03,191pa0m,62,11039,SpidermanPS4,3f1fs,"MJ's model speaks out. To whoever has done this, you should feel ashamed.",0,https://i.redd.it/e2gqyzhmu8bc1.jpeg,0.91,1294,1704731715,2024-01-08T04:35:15+0000
2024-01-09T03,191orqw,77,9136,PoliticalHumor,2qm21,"vote ?",0,https://i.redd.it/3uk1oojsq8bc1.jpeg,0.88,891,1704730434,2024-01-08T04:13:54+0000
2024-01-09T03,191omdf,52,12777,JeffArcuri,740oig,"Pregnant ladies",0,https://v.redd.it/16o2uerfp8bc1,0.92,204,1704730051,2024-01-08T04:07:31+0000
2024-01-09T03,191nwj5,48,21472,Embroidery,2rh53,"3 years of work 😅 Only you guys will appreciate it",0,https://i.redd.it/3xqieiq4k8bc1.jpeg,0.95,536,1704728186,2024-01-08T03:36:26+0000
2024-01-09T03,191ndn4,79,13996,Eyebleach,2s427,"When you’re the handsomest of all the boyz…",0,https://i.imgur.com/D4U9U3P.gifv,0.93,91,1704726756,2024-01-08T03:12:36+0000
2024-01-09T03,191n1wd,56,44771,Unexpected,2w67q,"The real answer to the trolley problem",0,https://v.redd.it/3fupodx9d8bc1,0.85,722,1704725881,2024-01-08T02:58:01+0000
2024-01-09T03,191mtpj,70,20469,comics,2qh0s,"Direct brain injector",0,https://www.reddit.com/gallery/191mtpj,0.94,462,1704725212,2024-01-08T02:46:52+0000
2024-01-09T03,191mj36,87,15779,oddlysatisfying,2x93b,"Machine automates the process of levelling and troweling",0,https://v.redd.it/vlz9qu4o88bc1,0.92,670,1704724351,2024-01-08T02:32:31+0000
