date,id,position,score,subreddit_display_name,subreddit_id,title,is_self,url,upvote_ratio,num_comments,created,created_date
2024-01-02T06,18wi2m2,69,1893,CFB,2qm9d,"[Postgame Thread] Washington Defeats Texas 37-31",1,https://www.reddit.com/r/CFB/comments/18wi2m2/postgame_thread_washington_defeats_texas_3731/,0.99,2666,1704174723,2024-01-02T05:52:03+0000
2024-01-02T06,18wfs4q,13,3402,pics,2qh0u,"Conan O'Brien during his visit to the White House last month",0,https://i.redd.it/zmwinfjh8y9c1.jpeg,0.94,167,1704167426,2024-01-02T03:50:26+0000
2024-01-02T06,18wfo6e,68,2793,WhitePeopleTwitter,35n7t,"Donald Trump is confirmed to be on the Epstein flight logs...",0,https://i.redd.it/25h573cp7y9c1.jpeg,0.98,220,1704167104,2024-01-02T03:45:04+0000
2024-01-02T06,18wfav2,31,2525,holdmycatnip,2zhxd,"Waiting for her food dispenser",0,https://v.redd.it/e74a57oh4y9c1,0.98,37,1704166015,2024-01-02T03:26:55+0000
2024-01-02T06,18wesch,32,2755,HolUp,qir9n,"Bro Tried His Best ",0,https://v.redd.it/k3kw97yzzx9c1,0.95,35,1704164502,2024-01-02T03:01:42+0000
2024-01-02T06,18weppr,89,1332,Satisfyingasfuck,31s00,"cleaning and manicuring horses",0,https://v.redd.it/39or67nczx9c1,0.97,159,1704164304,2024-01-02T02:58:24+0000
2024-01-02T06,18weff1,76,3086,pics,2qh0u,"Priorities in Rural Wisconsin",0,https://i.redd.it/0di85faywx9c1.jpeg,0.98,43,1704163486,2024-01-02T02:44:46+0000
2024-01-02T06,18wec6a,39,2556,LateStageCapitalism,39qgx,"Yeah F filing taxes anymore, straight up. They cant come after us all now, IRS are a joke.",0,https://i.redd.it/emeq9p00wx9c1.jpeg,0.91,158,1704163235,2024-01-02T02:40:35+0000
2024-01-02T06,18wdun7,10,5217,TikTokCringe,mvcq5,"Skywriter spells ""UR TAXES KILLED 10K GAZA KIDS"" over Universal Studios today.",0,https://v.redd.it/y9b1mwu9sx9c1,0.86,1062,1704161899,2024-01-02T02:18:19+0000
2024-01-02T06,18wds1t,9,5389,nextfuckinglevel,m0bnr,"Thought the Diva Dance song was physically impossible for a human. How does she do this?",0,https://v.redd.it/ghlq20chrx9c1,0.95,314,1704161697,2024-01-02T02:14:57+0000
2024-01-02T06,18wdll1,47,2530,Whatcouldgowrong,2x2oy,"Don’t get too cocky ",0,https://v.redd.it/jbrdaho4qx9c1,0.92,152,1704161186,2024-01-02T02:06:26+0000
2024-01-02T06,18wdhpx,26,3823,PublicFreakout,2yrq6,"People who do this deserve jail",0,https://v.redd.it/hmk1k666px9c1,0.94,593,1704160877,2024-01-02T02:01:17+0000
2024-01-02T06,18wdfj8,1,11425,nottheonion,2qnts,"Crocs CEO says business is booming because people just don’t want to dress smartly anymore",0,https://fortune.com/2023/10/06/crocs-ceo-andrew-rees-casual-dressing-booming-sales/,0.97,1130,1704160723,2024-01-02T01:58:43+0000
2024-01-02T06,18wdc6r,25,4153,WhitePeopleTwitter,35n7t,"Reading that is terrifying ‘We’ve read the graphic descriptions’",0,https://i.redd.it/xinqn8g0ox9c1.jpeg,0.97,213,1704160466,2024-01-02T01:54:26+0000
2024-01-02T06,18wda2q,36,3067,sports,2qgzy,"Michigan stops Alabama in OT to advance to the National Title game",0,https://v.redd.it/ydunkohgnx9c1,0.91,331,1704160290,2024-01-02T01:51:30+0000
2024-01-02T06,18wd81o,43,2782,AntiTrumpAlliance,3i9if,"Trump and Kennedy in Epstein’s flight log. Does MAGA care?",0,https://i.redd.it/sjsc88y0nx9c1.jpeg,0.96,109,1704160134,2024-01-02T01:48:54+0000
2024-01-02T06,18wd70f,92,1596,MichiganWolverines,2s3vu,"Blake Corum appreciation post 🌹",0,https://i.redd.it/rcoou9yrmx9c1.jpeg,0.88,131,1704160050,2024-01-02T01:47:30+0000
2024-01-02T06,18wd5xz,4,8351,CFB,2qm9d,"[Postgame Thread] Michigan Defeats Alabama 27-20 (OT)",1,https://www.reddit.com/r/CFB/comments/18wd5xz/postgame_thread_michigan_defeats_alabama_2720_ot/,0.93,8600,1704159964,2024-01-02T01:46:04+0000
2024-01-02T06,18wd3zl,72,3990,FluentInFinance,3qpaq8,"What killed the American Dream?",0,https://i.redd.it/w6ow5fx0mx9c1.png,0.92,671,1704159808,2024-01-02T01:43:28+0000
2024-01-02T06,18wczzt,3,8990,todayilearned,2qqjc,"TIL there are no skeletons in the wreck of the Titanic or debris field. At depths of 3,000+ feet, seawater is undersaturated with calcium carbonate. Once animals ate the flesh of Titanic's passengers and crew, their bones dissolved.",0,"https://www.npr.org/2013/04/19/177944080/studying-earth-to-learn-about-mars#:~:text=And%20the%20water%20in%20the,the%20bones%2C%20the%20bones%20dissolve.",0.98,373,1704159493,2024-01-02T01:38:13+0000
2024-01-02T06,18wcy8v,12,5298,gifs,2qt55,"I like to cut playing cards by hand using a xacto blade. I cut all 52, stack, and slide them back in the box.",0,https://i.redd.it/ewniyr9akx9c1.gif,0.97,132,1704159344,2024-01-02T01:35:44+0000
2024-01-02T06,18wct4d,16,5085,aww,2qh1o,"We went to get a kitten last night and couldn't decide on which little girl to adopt so we took both, they are sisters who get to spend their whole lives together. Meet Midnight and Ghostface",0,https://i.redd.it/0bm45bo6jx9c1.jpeg,0.98,93,1704158943,2024-01-02T01:29:03+0000
2024-01-02T06,18wcqde,7,7755,interestingasfuck,2qhsa,"Epstein flight logs released in USA vs. Maxwell",0,https://www.documentcloud.org/documents/21165424-epstein-flight-logs-released-in-usa-vs-maxwell,0.94,814,1704158717,2024-01-02T01:25:17+0000
2024-01-02T06,18wcq25,99,3318,oddlysatisfying,2x93b,"Sounds of different sheet metals",0,https://v.redd.it/2jl2j5zqix9c1,0.91,233,1704158697,2024-01-02T01:24:57+0000
2024-01-02T06,18wcjv3,60,4792,funny,2qh33,"Lost my phone/wallet in Tahoe, got it back at the front desk with this video on it",0,https://v.redd.it/fgvny8s5hx9c1,0.96,159,1704158215,2024-01-02T01:16:55+0000
2024-01-02T06,18wc9rq,15,6861,PeterExplainsTheJoke,121h8r,Petahh?,0,https://i.redd.it/s66fe7fxex9c1.jpeg,0.87,488,1704157411,2024-01-02T01:03:31+0000
2024-01-02T06,18wc71u,23,5878,memes,2qjpg,"On this day we stand united",0,https://i.redd.it/jdxsmwm9ex9c1.png,0.97,124,1704157222,2024-01-02T01:00:22+0000
2024-01-02T06,18wc6yf,28,4282,BaldursGate3,12967t,"Just doesn’t compare.",0,https://v.redd.it/x1ha7z6cex9c1,0.93,290,1704157215,2024-01-02T01:00:15+0000
2024-01-02T06,18wc1p5,88,1948,delta,2scjv,"To the woman in 3C yesterday on DL187 LHR-LAX",1,https://www.reddit.com/r/delta/comments/18wc1p5/to_the_woman_in_3c_yesterday_on_dl187_lhrlax/,0.93,229,1704156821,2024-01-02T12:53:41+0000
2024-01-02T06,18wbx9b,65,2495,nflcirclejerk,2sulf,"Some dumbass teams really gonna take this guy in the 1st round",0,https://i.redd.it/gcfe3jr5cx9c1.jpeg,0.92,315,1704156480,2024-01-02T12:48:00+0000
2024-01-02T06,18wbvlm,55,2875,crochet,2qm6c,"An homage to 2023 (a temperature blanket)",0,https://i.redd.it/ypmqux8sbx9c1.jpeg,0.97,76,1704156356,2024-01-02T12:45:56+0000
2024-01-02T06,18wbqgh,2,13875,WatchPeopleDieInside,3h4zq,"2 girls practice their catwalk…Only to realize they’ve been caught on camera 🤣",0,https://v.redd.it/genogtemax9c1,0.94,247,1704155987,2024-01-02T12:39:47+0000
2024-01-02T06,18wbotq,91,2049,HonkaiStarRail,4q5zoc,"This is getting interesting",0,https://v.redd.it/z64hi8cbax9c1,0.97,72,1704155863,2024-01-02T12:37:43+0000
2024-01-02T06,18wb6sm,93,2120,DIY,2qh7d,"Chimney update. Any structural reasons I can’t remove this oversized hearth?",0,https://i.redd.it/onmhuuwe6x9c1.jpeg,0.93,759,1704154548,2024-01-02T12:15:48+0000
2024-01-02T06,18wb0l5,17,7112,FluentInFinance,3qpaq8,"Very Depressing",0,https://i.redd.it/wn2p4nr25x9c1.png,0.91,860,1704154102,2024-01-02T12:08:22+0000
2024-01-02T06,18wavwl,45,3879,mildlyinteresting,2ti4h,"My gas station has a heating oil pump",0,https://i.redd.it/wz3jfbw04x9c1.jpeg,0.96,417,1704153755,2024-01-02T12:02:35+0000
2024-01-02T06,18watbq,5,17541,facepalm,2r5rp,"This hurts a bit",0,https://i.redd.it/g63u82kf3x9c1.jpeg,0.96,760,1704153582,2024-01-01T11:59:42+0000
2024-01-02T06,18wasw2,8,9930,technology,2qh16,"Moderna’s mRNA cancer vaccine works even better than thought",0,https://www.freethink.com/health/cancer-vaccine,0.95,643,1704153550,2024-01-01T11:59:10+0000
2024-01-02T06,18wasaj,6,15045,funny,2qh33,"Why do I sweat like this?",0,https://i.redd.it/8nxkz02b3x9c1.jpeg,0.94,777,1704153505,2024-01-01T11:58:25+0000
2024-01-02T06,18warob,61,2960,nostalgia,2qnub,"Mazzy Starr. Fade into You. 1993.",0,https://i.redd.it/kqw4vp863x9c1.jpeg,0.95,136,1704153458,2024-01-01T11:57:38+0000
2024-01-02T06,18waobu,94,2249,GlowUps,ruinb,"1 year. Made 2023 count.",0,https://i.redd.it/y5oydu9f2x9c1.jpeg,0.96,53,1704153206,2024-01-01T11:53:26+0000
2024-01-02T06,18wann6,79,2609,SweatyPalms,2v567,"A group of rock climbers are passed by a free solo climber.",0,https://v.redd.it/0g5qeg7tzw9c1,0.95,411,1704153154,2024-01-01T11:52:34+0000
2024-01-02T06,18wamyz,40,4344,NonPoliticalTwitter,39gt6y,Imagine...,0,https://i.redd.it/ot26hok42x9c1.jpeg,0.98,25,1704153106,2024-01-01T11:51:46+0000
2024-01-02T06,18wak75,33,4962,mildlyinfuriating,2ubgg,"Stayed in on NYE for this white car to smash into my parked car",0,https://www.reddit.com/gallery/18wak75,0.97,510,1704152913,2024-01-01T11:48:33+0000
2024-01-02T06,18waehh,14,9410,tumblr,2r7hk,"You should've become beautiful but you got forced out too soon and now you're in a fucked up half done state",0,https://i.redd.it/gasvyx7mzw9c1.png,0.95,233,1704152489,2024-01-01T11:41:29+0000
2024-01-02T06,18wac1e,75,2789,nba,2qo4s,"Westbrook should contend for DPOY / 1st Team All Defense. He is #2 for guards in DEF FG% DIFF% and #4 PG in DEF EPM. Westbrook is the best lockdown defender, and opposing shooters get Westbricked and shoot 6% worse. Westbrook's new role forces him to play D every second.",1,https://www.reddit.com/r/nba/comments/18wac1e/westbrook_should_contend_for_dpoy_1st_team_all/,0.81,441,1704152318,2024-01-01T11:38:38+0000
2024-01-02T06,18waa7g,56,3599,wallstreetbets,2th52,"A.I stock trader does insider trading and lies about it",0,https://i.redd.it/i6l5aogdzw9c1.jpeg,0.96,279,1704152182,2024-01-01T11:36:22+0000
2024-01-02T06,18wa2py,48,4179,GetNoted,91bxd4,"Oil shill gets owned",0,https://i.redd.it/nqmnp1zqxw9c1.jpeg,0.96,95,1704151634,2024-01-01T11:27:14+0000
2024-01-02T06,18wa0ms,46,4486,clevercomebacks,dyqlw,"Savage Swifty",0,https://i.redd.it/ccab9moaxw9c1.png,0.91,114,1704151482,2024-01-01T11:24:42+0000
2024-01-02T06,18w9zd4,51,4385,shitposting,2usxq,"My brain can’t handle this YouTube ad.",0,https://v.redd.it/bza7o1b0xw9c1,0.95,124,1704151393,2024-01-01T11:23:13+0000
2024-01-02T06,18w9xlc,84,2778,starterpacks,34o9s,"The Student We All Hated Starter Pack",0,https://i.redd.it/2z3anuygww9c1.png,0.88,155,1704151270,2024-01-01T11:21:10+0000
2024-01-02T06,18w9wcd,11,10930,Wellthatsucks,2xcv7,"Worked up the courage to go to a bar to try and socialize. Even the bar tender stepped out for a smoke",0,https://www.reddit.com/gallery/18w9wcd,0.92,489,1704151184,2024-01-01T11:19:44+0000
2024-01-02T06,18w9uot,37,5291,BeAmazed,363r3,"Smart boy",0,https://v.redd.it/cfcqbtg0ww9c1,0.92,166,1704151065,2024-01-01T11:17:45+0000
2024-01-02T06,18w9m2f,87,2845,GTA6_NEW,8l5wbz,"Please guys… Don’t be like him.",0,https://i.redd.it/zv7bpw08uw9c1.jpeg,0.92,252,1704150448,2024-01-01T11:07:28+0000
2024-01-02T06,18w9lwh,80,2913,AskReddit,2qh1i,"What is a monthly subscription that is worth every penny?",1,https://www.reddit.com/r/AskReddit/comments/18w9lwh/what_is_a_monthly_subscription_that_is_worth/,0.94,2818,1704150435,2024-01-01T11:07:15+0000
2024-01-02T06,18w9koj,66,3469,wholesomegreentext,3i3vm,"Chad dad strikes again!!",0,https://i.redd.it/8vzqpdmoreza1.jpg,0.93,29,1704150348,2024-01-01T11:05:48+0000
2024-01-02T06,18w92ei,35,6833,dankmemes,2zmfe,"Bye bye copyright",0,https://i.redd.it/8b5wfuh2qw9c1.png,0.97,24,1704149051,2024-01-01T10:44:11+0000
2024-01-02T06,18w8rvo,71,3675,FoodVideoPorn,7387tr,"How to Make McDonald’s Hashbrowns for $1",0,https://v.redd.it/hdrxcgnenw9c1,0.92,205,1704148306,2024-01-01T10:31:46+0000
2024-01-02T06,18w8q6u,54,5073,comics,2qh0s,"Veronica and Mona: ""Heart of the Problem""",0,https://i.redd.it/ugwxf4uhnw9c1.jpeg,0.87,154,1704148198,2024-01-01T10:29:58+0000
2024-01-02T06,18w8mru,95,3092,Hololive,29numb,"There are two types of Holofans",0,https://i.redd.it/97tvsntmmw9c1.png,0.95,52,1704147949,2024-01-01T10:25:49+0000
2024-01-02T06,18w8kln,52,12837,todayilearned,2qqjc,"TIL that Toronto firefighter Danny Flippidis mysteriously disappeared on a skiing trip in New York. Sis days later, he resurfaced 3000 miles away in Sacramento California with no memory of how he got there. He was wearing the same exact gear when he disappeared and with no ID except a credit card.",0,https://www.cbc.ca/radio/docproject/why-this-toronto-firefighter-may-never-know-what-happened-on-his-puzzling-journey-across-the-u-s-1.4998819,0.94,557,1704147792,2024-01-01T10:23:12+0000
2024-01-02T06,18w8epb,78,3680,Spiderman,2rw42,"This might just be the most I’ve ever laughed while reading a comic",0,https://i.redd.it/n3p1j3i3lw9c1.jpeg,0.95,155,1704147379,2024-01-01T10:16:19+0000
2024-01-02T06,18w85a4,85,3437,LiverpoolFC,2qn0o,"Klopp loses his wedding ring while celebrating, then finds it",0,https://v.redd.it/9pl1dzp3jw9c1,0.95,88,1704146709,2024-01-01T10:05:09+0000
2024-01-02T06,18w82cl,49,5760,wholesomememes,3gcwj,"Your best is good enough ❤️",0,https://i.redd.it/prg3tacgiw9c1.jpeg,0.97,59,1704146495,2024-01-01T10:01:35+0000
2024-01-02T06,18w80e4,22,11129,Fauxmoi,2rqcm8,"David Beckham posts photo with Victoria’s “very working class” family",0,https://i.redd.it/inovp9m4iw9c1.jpeg,0.94,494,1704146381,2024-01-01T09:59:41+0000
2024-01-02T06,18w7r45,63,4779,sciencememes,2u0d4,"Gambler's fallacy",0,https://i.redd.it/mznyyv27gw9c1.png,0.95,142,1704145736,2024-01-01T09:48:56+0000
2024-01-02T06,18w7kog,21,13933,Damnthatsinteresting,2xxyj,"El Nino winter so far visualized",0,https://i.redd.it/frxhpobfew9c1.jpeg,0.94,1525,1704145297,2024-01-01T09:41:37+0000
2024-01-02T06,18w7fxo,42,6865,WTF,2qh61,"At US$10,000 a gram or US$10 million a litre, Scorpion venom is the most expensive liquid in the world.",0,https://v.redd.it/velsuizwdw9c1,0.95,573,1704144974,2024-01-01T09:36:14+0000
2024-01-02T06,18w7eag,20,20306,oddlysatisfying,2x93b,"Steam buns fluffing up",0,https://v.redd.it/inhxvf0ldw9c1,0.87,537,1704144857,2024-01-01T09:34:17+0000
2024-01-02T06,18w7e2c,70,4688,oddlyterrifying,2yo6b,"that one prankster at dr. pepper bottling plant",0,https://v.redd.it/ngdxglrjdw9c1,0.97,165,1704144840,2024-01-01T09:34:00+0000
2024-01-02T06,18w7c3t,30,9546,IdiotsInCars,3aimx,"[oc] Audi Q5 forces me off the road causing my vehicle to flip 5/6 times",0,https://v.redd.it/4a7eqc94dw9c1,0.93,1724,1704144702,2024-01-01T09:31:42+0000
2024-01-02T06,18w77ax,24,24529,Unexpected,2w67q,"This really got me",0,https://v.redd.it/yzmnm9v5cw9c1,0.82,435,1704144375,2024-01-01T09:26:15+0000
2024-01-02T06,18w73pr,98,3565,NoStupidQuestions,2w844,"What is the US and the rest of the world actually going to do when the list of 147 persons on Jeffery Epstein's flightlist gets revealed?",1,https://www.reddit.com/r/NoStupidQuestions/comments/18w73pr/what_is_the_us_and_the_rest_of_the_world_actually/,0.91,1801,1704144116,2024-01-01T09:21:56+0000
2024-01-02T06,18w73nw,29,10446,meirl,2s5ti,meirl,0,https://v.redd.it/1rnvjkeabw9c1,0.96,154,1704144113,2024-01-01T09:21:53+0000
2024-01-02T06,18w73li,73,6641,therewasanattempt,39ne7,"To “never again” (Gaza 2023 vs Nazi Germany 1943)",0,https://i.redd.it/owfvzehdbw9c1.jpeg,0.68,1634,1704144109,2024-01-01T09:21:49+0000
2024-01-02T06,18w6xc0,100,4239,OnePiece,2rfz5,"my cosplay attempt at Nami",0,http://i.imgur.com/loVfiyb.jpg,0.75,416,1704143675,2024-01-01T09:14:35+0000
2024-01-02T06,18w6ubl,34,8596,gaming,2qh03,"Former Call of Duty and Blizzard Devs Speak Out Against Bobby Kotick; States He Made Games Worse",0,https://mp1st.com/news/former-call-of-duty-and-blizzard-devs-speak-out-against-bobby-kotick-states-he-made-games-worse,0.95,655,1704143459,2024-01-01T09:10:59+0000
2024-01-02T06,18w6q0m,57,24728,facepalm,2r5rp,"Lets go Crazy",0,https://i.redd.it/ybxeto5h8w9c1.jpeg,0.9,1000,1704143160,2024-01-01T09:06:00+0000
2024-01-02T06,18w6pk9,38,8290,BlackPeopleTwitter,33x33,"2024 New Year’s resolution",0,https://v.redd.it/hdbykbeg8w9c1,0.93,676,1704143128,2024-01-01T09:05:28+0000
2024-01-02T06,18w6oya,90,9972,interestingasfuck,2qhsa,"Hidden freezer under floorboard at an open house. 2 acre property in Sonoma County.",0,https://v.redd.it/3yly6f7b8w9c1,0.92,1530,1704143086,2024-01-01T09:04:46+0000
2024-01-02T06,18w6nt6,59,5411,PoliticalHumor,2qm21,"Well, yeah.",0,https://i.redd.it/e4nctui28w9c1.jpeg,0.96,141,1704142998,2024-01-01T09:03:18+0000
2024-01-02T06,18w6ndl,83,4379,70s,2s9rl,"How many of you ‘70s kids can feel this picture?",0,https://i.redd.it/pqj7ba6z7w9c1.jpeg,0.92,422,1704142966,2024-01-01T09:02:46+0000
2024-01-02T06,18w6bpd,62,6215,marvelmemes,35mye,"which one is the best ?",0,https://i.redd.it/ud21c2rl5w9c1.jpeg,0.95,577,1704142170,2024-01-01T08:49:30+0000
2024-01-02T06,18w61ly,18,36254,MadeMeSmile,2uqcm,"What a weight loss journey! She looks so much happier now",0,https://v.redd.it/r2jkm9vf3w9c1,0.93,938,1704141467,2024-01-01T08:37:47+0000
2024-01-02T06,18w5y7y,19,22831,politics,2cneq,"House Republican: Jeffrey Epstein flight logs not released because colleagues would be ‘compromised’",0,https://www.washingtontimes.com/news/2023/dec/23/reptim-burchett-jeffrey-epstein-flight-logs-not-re/,0.93,1615,1704141226,2024-01-01T08:33:46+0000
2024-01-02T06,18w5jap,27,14175,news,2qh3l,"CNN: Melissa Hoskins: Two-time Olympic cyclist dies aged 32 after being hit by car",0,https://www.cnn.com/2024/01/01/sport/melissa-hoskins-dies-hit-by-car-spt-intl/index.html,0.93,584,1704140178,2024-01-01T08:16:18+0000
2024-01-02T06,18w5gxb,82,5147,worldnews,2qh13,"42 survivors of the Nova Rave massacre sued Israel's Security Forces for negligence, claiming that the tragedy could have largely been averted",0,https://www.timesofisrael.com/42-survivors-of-the-nova-rave-massacre-sue-defense-establishment-for-negligence/,0.93,299,1704140017,2024-01-01T08:13:37+0000
2024-01-02T06,18w587u,41,12649,CuratedTumblr,3x5kfw,"She's breaking new ground",0,https://i.redd.it/svr5086fxv9c1.jpeg,0.95,514,1704139417,2024-01-01T08:03:37+0000
2024-01-02T06,18w4y5l,44,10767,HumansBeingBros,2xh58,"Daddy’s little helper ",0,https://v.redd.it/86o993pdvv9c1,0.96,116,1704138736,2024-01-01T07:52:16+0000
2024-01-02T06,18w4uay,53,12631,HollowKnightMemes,j958e,"If anyone could find the source, that would be appreciated",0,https://i.redd.it/lipngi6muv9c1.gif,0.93,140,1704138479,2024-01-01T07:47:59+0000
2024-01-02T06,18w4muz,67,7836,BikiniBottomTwitter,3deqz,"Farewell, Tom Scott",0,https://i.redd.it/ev3o8op0tv9c1.jpeg,0.92,83,1704137937,2024-01-01T07:38:57+0000
2024-01-02T06,18w49tg,81,6625,AbsoluteUnits,a7wuv,"Dwarf Juggernaut",0,https://v.redd.it/53wqfc73qv9c1,0.93,400,1704137018,2024-01-01T07:23:38+0000
2024-01-02T06,18w3e5m,96,6774,BrandNewSentence,mbn0j,"Go go gadget holocaust trauma",0,https://i.redd.it/4d7ce0irjv9c1.png,0.96,106,1704134824,2024-01-01T06:47:04+0000
2024-01-02T06,18w3csk,50,14792,antiwork,2y77d,"This Idea Went Extinct In America.",0,https://i.redd.it/hy0hzr0hjv9c1.jpeg,0.91,279,1704134728,2024-01-01T06:45:28+0000
2024-01-02T06,18w3bnx,74,7870,OldSchoolCool,2tycb,"Chief John Smith was an Ojibwe (Chippewa) Indian who lived in the area of Cass Lake, Minnesota. He died in 1922 at the (alleged) ripe old age of 137.",0,https://i.redd.it/kezakz59jv9c1.jpeg,0.94,319,1704134652,2024-01-01T06:44:12+0000
2024-01-02T06,18w2dti,97,8752,SipsTea,5tdqj0,"that smile... that damned smile.",0,https://v.redd.it/nnbbklcwbv9c1,0.92,113,1704132218,2024-01-01T06:03:38+0000
2024-01-02T06,18w16ov,58,17253,ancientrome,2s8l1,"Syrian Archaeologist Khaled al-Asaad pictured with a 2nd Century Roman Palmyrene family’s funerary relief; Palmyra, Syria. He was beheaded by ISIS in 2015, for refusing to disclose the location of ancient artifacts from the site, after a month of torture. Today would’ve been his 92nd birthday",0,https://i.redd.it/skuiujfm2v9c1.jpeg,0.97,342,1704129059,2024-01-01T05:10:59+0000
2024-01-02T06,18w0vqw,64,42398,me_irl,2vegg,"me irl",0,https://i.redd.it/23o76i870v9c1.png,0.9,677,1704128248,2024-01-01T04:57:28+0000
2024-01-02T06,18w0ho5,77,31451,Funnymemes,2xqtc,"Aye yo lmao 😂 😂",0,https://i.redd.it/tegctgv1xu9c1.jpeg,0.86,979,1704127185,2024-01-01T04:39:45+0000
2024-01-02T06,18vzo5p,86,17171,videos,2qh1e,"Tom Scott - After ten years, it's time to stop making videos",0,https://www.youtube.com/watch?v=7DKv5H5Frt0,0.91,978,1704124942,2024-01-01T04:02:22+0000
