date,id,position,score,subreddit_display_name,subreddit_id,title,is_self,url,upvote_ratio,num_comments,created,created_date
2024-01-04T14,18yc8f7,55,808,ich_iel,37k29,ich_iel,0,https://i.redd.it/choruas05fac1.jpeg,0.87,65,1704372004,2024-01-04T12:40:04+0000
2024-01-04T14,18yc87d,86,1775,comics,2qh0s,Di$ney,0,https://www.reddit.com/gallery/18yc87d,0.97,47,1704371983,2024-01-04T12:39:43+0000
2024-01-04T14,18ybnj8,9,3002,me_irl,2vegg,me_irl,0,https://i.redd.it/5eyxpo7czeac1.png,0.98,57,1704370099,2024-01-04T12:08:19+0000
2024-01-04T14,18ybmpq,44,1146,politics,2cneq,"Fear of MAGA ""backlash"" is no reason to let Donald Trump make an illegal run for president",0,https://www.salon.com/2024/01/04/fear-of-maga-backlash-is-no-reason-to-let-donald-make-an-illegal-run-for/,0.97,111,1704370017,2024-01-04T12:06:57+0000
2024-01-04T14,18ybiz4,99,1865,Damnthatsinteresting,2xxyj,"Man Attacked a Las Vegas Judge During Sentencing",0,https://v.redd.it/0wgtx0v1yeac1,0.93,668,1704369675,2024-01-04T12:01:15+0000
2024-01-04T14,18ybh7c,22,2117,interestingasfuck,2qhsa,"Man Attacked a Las Vegas Judge During Sentencing",0,https://v.redd.it/nqem4sakxeac1,0.89,764,1704369524,2024-01-04T11:58:44+0000
2024-01-04T14,18yb3gu,14,2838,technicallythetruth,3pzez,"He does have a point",0,https://i.redd.it/d5k11fbnteac1.png,0.94,103,1704368180,2024-01-04T11:36:20+0000
2024-01-04T14,18yb2kz,62,937,cursedcomments,hw1ju,Cursed_leglock,0,https://i.redd.it/7sp7a3pdteac1.jpeg,0.99,10,1704368089,2024-01-04T11:34:49+0000
2024-01-04T14,18yav8r,46,1222,CuratedTumblr,3x5kfw,"The words in this sentence are all in the Bible (NIV)",0,https://i.redd.it/y3itvqp1reac1.png,0.98,52,1704367339,2024-01-04T11:22:19+0000
2024-01-04T14,18yakyl,56,1057,PoliticalCompassMemes,3ipa1,"It's those gosh darned colonists again",0,https://i.redd.it/wt3ryf2oneac1.png,0.9,96,1704366270,2024-01-04T11:04:30+0000
2024-01-04T14,18yaj7e,76,934,CasualUK,3j2jr,"I was helping my son pack his bag for school this morning. Among the things I needed to remove there was an empty bag of crisps, a damp PE kit and the indicator/light stalk from a 2011 Renault Twingo RS.",0,https://i.redd.it/b69lilufneac1.jpeg,0.97,78,1704366092,2024-01-04T11:01:32+0000
2024-01-04T14,18yaj2a,79,893,deutschememes,3hn0l,"Deutsche sein wie",0,https://i.redd.it/daj1bpdeneac1.jpeg,0.81,202,1704366078,2024-01-04T11:01:18+0000
2024-01-04T14,18yahas,98,808,books,2qh4i,"As a survivor, Lolita was oddly validating for me",1,https://www.reddit.com/r/books/comments/18yahas/as_a_survivor_lolita_was_oddly_validating_for_me/,0.91,115,1704365908,2024-01-04T10:58:28+0000
2024-01-04T14,18yabq5,68,1012,ThatsInsane,swxxz,"Tried to use all the new types of trauma. Unfortunately.....",0,https://v.redd.it/z0eivfc3leac1,0.93,181,1704365310,2024-01-04T10:48:30+0000
2024-01-04T14,18yaasv,33,1745,europe,2qh4j,"Trump 2.0 is major security risk to UK, warn top former British-US diplomats - The British Government must privately come up with plans to mitigate risks to national security if Donald Trump becomes US president again, according to senior diplomatic veterans",0,https://inews.co.uk/news/trump-major-security-risk-uk-top-diplomats-2834083,0.89,515,1704365203,2024-01-04T10:46:43+0000
2024-01-04T14,18ya7ol,31,1916,nonononoyes,2xp2p,"I hate people like that actually blind",0,https://i.imgur.com/vnj3ZK1.gifv,0.92,58,1704364856,2024-01-04T10:40:56+0000
2024-01-04T14,18ya6yn,54,1177,madlads,3aegn,"Madboy beats Tetris",0,https://i.redd.it/wq3m8yakjeac1.jpeg,0.94,50,1704364788,2024-01-04T10:39:48+0000
2024-01-04T14,18ya2ks,5,5033,shitposting,2usxq,"froot loops 👍",0,https://v.redd.it/93h2aum3ieac1,0.94,362,1704364303,2024-01-04T10:31:43+0000
2024-01-04T14,18y9y7f,75,3027,shitposting,2usxq,TINEYATPH,0,https://v.redd.it/g425puemgeac1,0.99,83,1704363831,2024-01-04T10:23:51+0000
2024-01-04T14,18y9jzl,24,2991,holdmycatnip,2zhxd,"It fought back",0,https://v.redd.it/5v9d50dwbeac1,0.97,52,1704362273,2024-01-04T09:57:53+0000
2024-01-04T14,18y9i2b,2,7218,tumblr,2r7hk,"Mermaids and werewolves",0,https://i.redd.it/derkqtkebeac1.jpeg,0.95,53,1704362052,2024-01-04T09:54:12+0000
2024-01-04T14,18y9g5p,3,6968,BeAmazed,363r3,"Lichtenberg Figure",0,https://v.redd.it/dpbnvkypaeac1,0.92,227,1704361832,2024-01-04T09:50:32+0000
2024-01-04T14,18y99c7,47,1641,StardustCrusaders,2tny5,"he aint DIO 😤😤😤",0,https://v.redd.it/b7r2hnmi8eac1,0.95,101,1704361073,2024-01-04T09:37:53+0000
2024-01-04T14,18y966s,94,1087,LateStageCapitalism,39qgx,"teenager with a watermelon symbol t shirt is antisemitic now",0,https://i.redd.it/ygx5sgcg7eac1.jpeg,0.97,100,1704360715,2024-01-04T09:31:55+0000
2024-01-04T14,18y9277,50,1596,worldnews,2qh13,"Nasrallah warns Israel of war 'with no rules'",0,https://www.jns.org/nasrallah-warns-israel-of-war-with-no-rules/,0.89,559,1704360268,2024-01-04T09:24:28+0000
2024-01-04T14,18y9104,67,1355,youtube,2qh44,"OH MY GOD SHUT THE FUCK UP",0,https://i.redd.it/3jv6ak2q5eac1.jpeg,0.91,156,1704360132,2024-01-04T09:22:12+0000
2024-01-04T14,18y8zof,38,1963,Genshin_Impact,12p4l2,"I often wondered how Favonius Knights manage to compete with other nations. Then I realised...",0,https://i.redd.it/5blcs5fa5eac1.png,0.96,226,1704359993,2024-01-04T09:19:53+0000
2024-01-04T14,18y8y1z,64,1414,HonkaiStarRail,4q5zoc,"Clara mains💀💀",0,https://i.redd.it/p9e1cobr4eac1.jpeg,0.9,262,1704359809,2024-01-04T09:16:49+0000
2024-01-04T14,18y8xkg,82,1201,soccercirclejerk,2tfso,"My first trip to Stadio Olimpico was electric ⚡️⚡️",0,https://i.redd.it/firaqlpl4eac1.jpeg,0.96,38,1704359758,2024-01-04T09:15:58+0000
2024-01-04T14,18y8x4v,96,1106,melbourne,2qkhb,"I work in fraud and here are some things you need to know to keep safe.",1,https://www.reddit.com/r/melbourne/comments/18y8x4v/i_work_in_fraud_and_here_are_some_things_you_need/,0.95,211,1704359710,2024-01-04T09:15:10+0000
2024-01-04T14,18y8w4j,16,4462,mapporncirclejerk,2wxxs,"🇪🇺 Eurotrip 🇪🇺",0,https://i.redd.it/tisblttu3eac1.jpeg,0.93,540,1704359582,2024-01-04T09:13:02+0000
2024-01-04T14,18y8u6r,26,2980,gaming,2qh03,"Oklahoma 13-year-old believed to be first person ever to beat Tetris",0,https://www.theguardian.com/technology/2024/jan/03/oklahoma-teen-beat-tetris-first-person-willis-gibson,0.91,222,1704359375,2024-01-04T09:09:35+0000
2024-01-04T14,18y8r41,25,3363,UkraineWarVideoReport,5wjmo8,"Vadim gets emotional explaining his life in Russia",0,https://v.redd.it/aiepx2iy1eac1,0.95,237,1704359015,2024-01-04T09:03:35+0000
2024-01-04T14,18y8qsr,66,1439,discordVideos,2cxozx,"convertible concentration camp",0,https://v.redd.it/mzd4ls562eac1,0.92,20,1704358981,2024-01-04T09:03:01+0000
2024-01-04T14,18y8pq7,1,27560,MadeMeSmile,2uqcm,"Parents watching their kid take his first steps",0,https://v.redd.it/tc077dox1eac1,0.96,438,1704358869,2024-01-04T09:01:09+0000
2024-01-04T14,18y8hdm,17,4479,WhitePeopleTwitter,35n7t,"Trump supporters in a nutshell. Living in constant denial.",0,https://www.reddit.com/gallery/18y8hdm,0.97,261,1704357902,2024-01-04T08:45:02+0000
2024-01-04T14,18y8fvd,30,2766,KidsAreFuckingStupid,3948y,"Wanna try wasabi?",0,https://v.redd.it/cwsr59ujydac1,0.9,200,1704357720,2024-01-04T08:42:00+0000
2024-01-04T14,18y8bvp,36,2368,cyberpunkgame,3az7x,"A friendly reminder to meet Hanako at Embers",0,https://i.redd.it/bydjrev5xdac1.jpeg,0.98,37,1704357254,2024-01-04T08:34:14+0000
2024-01-04T14,18y89b4,23,4296,HolUp,qir9n,"I got problems with your wife password",0,https://v.redd.it/pqbgm84awdac1,0.91,305,1704356964,2024-01-04T08:29:24+0000
2024-01-04T14,18y88ml,93,1313,2westerneurope4u,66zq15,"The non European mind cannot comprehend this",0,https://v.redd.it/nxmkcjxzvdac1,0.93,287,1704356883,2024-01-04T08:28:03+0000
2024-01-04T14,18y88aq,48,1996,Animemes,2w6fe,"Step one.",0,https://i.redd.it/7moxqcwxvdac1.jpeg,0.98,38,1704356844,2024-01-04T08:27:24+0000
2024-01-04T14,18y841j,10,6505,facepalm,2r5rp,"Excuse me?",0,https://i.redd.it/yvs2xuliudac1.jpeg,0.98,459,1704356372,2024-01-04T08:19:32+0000
2024-01-04T14,18y830j,57,1780,whenthe,23gidu,"The list is actually long (list in the comment)",0,https://i.redd.it/1m8c9w65udac1.gif,0.95,265,1704356246,2024-01-04T08:17:26+0000
2024-01-04T14,18y821r,87,1418,ukraine,2qqcn,"Halyna Fedyshyn, the last female Ukrainian marine in Russian captivity, is now home! She was in Mariupol and Azovstal as a combat medic from the 36th brigade and made it her principle to only speak Ukrainian while in captivity",0,https://i.redd.it/r2llgn3itdac1.jpeg,0.97,25,1704356132,2024-01-04T08:15:32+0000
2024-01-04T14,18y7zwo,63,1741,FunnyAnimals,2st2l,"Chicken stops alpaca from eating its food",0,https://v.redd.it/ghs7hrf3tdac1,0.98,38,1704355895,2024-01-04T08:11:35+0000
2024-01-04T14,18y7vj7,73,1658,Genshin_Impact_Leaks,3l2acu,"4.3 Phase 2 Character and Weapon Banners",0,https://www.reddit.com/gallery/18y7vj7,0.94,431,1704355409,2024-01-04T08:03:29+0000
2024-01-04T14,18y7qos,77,1615,MapPorn,2si92,"The 20 Countries that don't have people living in Frankfurt/Main (Germany)",0,https://i.redd.it/7pl08fy3qdac1.jpeg,0.95,128,1704354883,2024-01-04T07:54:43+0000
2024-01-04T14,18y76e6,6,9072,comics,2qh0s,"I'm sick today",0,https://i.redd.it/m66awibejdac1.png,0.98,46,1704352652,2024-01-04T07:17:32+0000
2024-01-04T14,18y75oi,15,8940,dankmemes,2zmfe,what,0,https://i.redd.it/169oplh8jdac1.gif,0.92,408,1704352572,2024-01-04T07:16:12+0000
2024-01-04T14,18y74c6,52,2316,Whatcouldgowrong,2x2oy,"Boat fails to clear wave",0,https://v.redd.it/695xcmpridac1,0.94,124,1704352431,2024-01-04T07:13:51+0000
2024-01-04T14,18y73t5,8,8884,Awww,2suml,"Adorable Prank by a Clever Pup",0,https://v.redd.it/lh1mlgwlidac1,0.96,71,1704352374,2024-01-04T07:12:54+0000
2024-01-04T14,18y6wqb,80,1857,notinteresting,2u0xf,"My can of no sugar coke expired in October. Only realised after drinking half of it. Farewell cruel world.",0,https://i.redd.it/2tmtypifgdac1.jpeg,0.94,117,1704351628,2024-01-04T07:00:28+0000
2024-01-04T14,18y6pia,89,5773,wholesomememes,3gcwj,"Give love without discrimination",0,https://i.redd.it/h32mmpjwddac1.jpeg,0.97,36,1704350877,2024-01-04T06:47:57+0000
2024-01-04T14,18y6juf,61,2343,pcmasterrace,2sgp1,"Who else wants a 1:1 size Lego PC next to their actual PC?",0,https://i.redd.it/ade6bnddcdac1.jpeg,0.9,182,1704350263,2024-01-04T06:37:43+0000
2024-01-04T14,18y6hex,92,1885,Satisfyingasfuck,31s00,"The stone sculptures are very lifelike",0,https://v.redd.it/asz3u8cebdac1,0.95,82,1704349993,2024-01-04T06:33:13+0000
2024-01-04T14,18y68mg,97,1946,bonehurtingjuice,3jwwf,president,0,https://i.redd.it/lm1ie5ox8dac1.jpeg,0.95,40,1704349106,2024-01-04T06:18:26+0000
2024-01-04T14,18y5zjt,45,3543,MinecraftMemes,2sq0h,...,0,https://i.redd.it/pvlmqvma6dac1.jpeg,0.92,183,1704348218,2024-01-04T06:03:38+0000
2024-01-04T14,18y5v80,4,28881,ProgrammerHumor,2tex6,programmingPeaked,0,https://i.redd.it/s2dimkb55dac1.jpeg,0.96,539,1704347833,2024-01-04T05:57:13+0000
2024-01-04T14,18y5rii,21,8483,Steam,2qwis,"Show me a single person who voted RDR2",0,https://i.redd.it/639ams414dac1.png,0.92,659,1704347479,2024-01-04T05:51:19+0000
2024-01-04T14,18y5nu7,19,11508,BatmanArkham,2y9q4,"Our insanity has reached there",0,https://i.redd.it/tdtbv9n33dac1.png,0.92,152,1704347145,2024-01-04T05:45:45+0000
2024-01-04T14,18y530y,42,4395,batman,2qqt8,"Maybe he would actually be a good Batman",0,https://v.redd.it/81hncbnfxcac1,0.93,390,1704345253,2024-01-04T05:14:13+0000
2024-01-04T14,18y51tj,12,21890,wholesomememes,3gcwj,"healthy thinking",0,https://i.redd.it/6chzygf9wcac1.png,0.93,960,1704345142,2024-01-04T05:12:22+0000
2024-01-04T14,18y4zq1,7,28847,meirl,2s5ti,meirl,0,https://v.redd.it/mtgp5y3mwcac1,0.92,352,1704344965,2024-01-04T05:09:25+0000
2024-01-04T14,18y4ze4,58,3352,Hololive,29numb,"Do I return the other one?",0,https://i.redd.it/toz8v3jhwcac1.png,0.95,40,1704344935,2024-01-04T05:08:55+0000
2024-01-04T14,18y4rfo,13,18616,Damnthatsinteresting,2xxyj,"Tsunami in the making",0,https://v.redd.it/snqu8fhducac1,0.95,450,1704344232,2024-01-04T04:57:12+0000
2024-01-04T14,18y4pl4,11,18707,Eyebleach,2s427,"ᵂᵉᵉᵉᵉ",0,https://i.imgur.com/7AJi4eR.gifv,0.98,114,1704344064,2024-01-04T04:54:24+0000
2024-01-04T14,18y4oxn,41,4701,CrazyFuckingVideos,45hae8,"IRL streamer swatted while drunk streaming, he's so out of it he has no idea what is going on",0,https://v.redd.it/yvzq2jgrtcac1,0.94,448,1704344004,2024-01-04T04:53:24+0000
2024-01-04T14,18y4lhi,35,5801,meme,2qi1r,"Good teacher",0,https://i.redd.it/rq9nou6vscac1.png,0.97,46,1704343709,2024-01-04T04:48:29+0000
2024-01-04T14,18y4fm2,28,7156,technology,2qh16,"Starbucks accused of rigging payments in app for nearly $900 million gain over 5 years by consumer watchdog group",0,https://fortune.com/2024/01/03/starbucks-app-dark-side-unspent-payments-900-million-5-years/,0.96,501,1704343195,2024-01-04T04:39:55+0000
2024-01-04T14,18y4dg1,20,16851,memes,2qjpg,"He was on the list, apparently.",0,https://i.redd.it/ykz3brvqqcac1.gif,0.94,495,1704342990,2024-01-04T04:36:30+0000
2024-01-04T14,18y46qm,74,3271,ChainsawMan,rmtrq,Congrats,0,https://i.redd.it/11bd82jzocac1.jpeg,0.96,87,1704342399,2024-01-04T04:26:39+0000
2024-01-04T14,18y3vtu,34,7423,therewasanattempt,39ne7,"To mind your own business",0,https://v.redd.it/29iy6j19mcac1,0.83,205,1704341478,2024-01-04T04:11:18+0000
2024-01-04T14,18y3loi,84,3453,teenagers,2rjli,"My dad bought me this for Christmas…",0,https://i.redd.it/j727940rjcac1.jpeg,0.94,355,1704340639,2024-01-04T03:57:19+0000
2024-01-04T14,18y3cev,71,3699,nba,2qo4s,"[Highlight] Jalen Duren dunks on Walker Kessler then gets on his shoulders for a piggyback ride",0,https://streamable.com/91wpjl,0.97,300,1704339876,2024-01-04T03:44:36+0000
2024-01-04T14,18y3ab7,37,6427,JustGuysBeingDudes,33rtj6,"Care for a puff of color boys?",0,https://v.redd.it/ezeacfiwgcac1,0.92,173,1704339699,2024-01-04T03:41:39+0000
2024-01-04T14,18y378h,18,28357,Unexpected,2w67q,"Everyone loves her present",0,https://v.redd.it/1f60z2y4gcac1,0.93,629,1704339434,2024-01-04T03:37:14+0000
2024-01-04T14,18y337s,27,12394,mildlyinfuriating,2ubgg,"I had a dentist fart in my face today.",1,https://www.reddit.com/r/mildlyinfuriating/comments/18y337s/i_had_a_dentist_fart_in_my_face_today/,0.93,869,1704339098,2024-01-04T03:31:38+0000
2024-01-04T14,18y30pt,83,3874,Terraria,2sg5b,"Some humanized bosses ft. the ladies :D",0,https://www.reddit.com/gallery/18y30pt,0.93,258,1704338900,2024-01-04T03:28:20+0000
2024-01-04T14,18y2uj0,60,4367,pics,2qh0u,"My Mom’s annual Christmas Village/Nativity Scene that takes up half of our living room",0,https://i.redd.it/d91zj0l2dcac1.jpeg,0.97,244,1704338397,2024-01-04T03:19:57+0000
2024-01-04T14,18y2h2e,100,3558,malelivingspace,2v70p,"Office set up when I’m too tired to commute",0,https://i.redd.it/hazdz2wp9cac1.jpeg,0.92,387,1704337315,2024-01-04T03:01:55+0000
2024-01-04T14,18y291u,29,12538,nottheonion,2qnts,"'Rich Dad, Poor Dad' Robert Kiyosaki says he's $1.2 billion in debt because 'if I go bankrupt, the bank goes bankrupt.' not my problem'",0,https://biz.crast.net/rich-dad-poor-dad-robert-kiyosaki-says-hes-1-2-billion-in-debt-because-if-i-go-bankrupt-the-bank-goes-bankrupt-not-my-problem/,0.94,912,1704336683,2024-01-04T02:51:23+0000
2024-01-04T14,18y22ma,32,11904,NonPoliticalTwitter,39gt6y,Y2K,0,https://i.redd.it/skvz6ieh6cac1.jpeg,0.96,125,1704336175,2024-01-04T02:42:55+0000
2024-01-04T14,18y1xch,40,7918,mildlyinteresting,2ti4h,"The fake phone number I use to get a grocery discount already has saved people $1471.79 this year",0,https://i.redd.it/7g7v41t25cac1.jpeg,0.95,448,1704335765,2024-01-04T02:36:05+0000
2024-01-04T14,18y1mox,78,5150,theydidthemath,2x23b,"[REQUEST] How small would the earth have to be for the bottom to be true?",0,https://i.redd.it/1sc3c7xt2cac1.jpeg,0.93,250,1704334947,2024-01-04T02:22:27+0000
2024-01-04T14,18y10x1,51,6876,aww,2qh1o,"My boy will be 20 this year, and he's still majestic AF",0,https://www.reddit.com/gallery/18y10x1,0.96,107,1704333308,2024-01-04T01:55:08+0000
2024-01-04T14,18y0r7x,72,6463,oddlyspecific,2wjlc,"Time to grab the pitchforks.",0,https://i.redd.it/7r1ffo6svbac1.jpeg,0.93,1042,1704332576,2024-01-04T01:42:56+0000
2024-01-04T14,18y0irm,69,6220,AskReddit,2qh1i,"What hobby is an instant red flag?",1,https://www.reddit.com/r/AskReddit/comments/18y0irm/what_hobby_is_an_instant_red_flag/,0.92,6077,1704331942,2024-01-04T01:32:22+0000
2024-01-04T14,18y0b0d,43,11079,BlackPeopleTwitter,33x33,"Man was movin like Polamalu",0,https://v.redd.it/rhxvqtr5sbac1,0.94,661,1704331364,2024-01-04T01:22:44+0000
2024-01-04T14,18y04ar,85,5927,BaldursGate3,12967t,"It's tough being the protagonist",0,https://i.redd.it/989j244mqbac1.jpeg,0.94,239,1704330874,2024-01-04T01:14:34+0000
2024-01-04T14,18xzzjq,39,13704,ContagiousLaughter,2u2bh,"Drill Sergeant Daddy",0,https://v.redd.it/g2bv4nahpbac1,0.93,317,1704330526,2024-01-04T01:08:46+0000
2024-01-04T14,18xzfk8,91,5929,gifs,2qt55,"Automatic Candle Extinguisher from 1841",0,https://i.imgur.com/LwWYEaJ.gifv,0.93,134,1704329087,2024-01-04T12:44:47+0000
2024-01-04T14,18xykgz,88,9067,perfectlycutscreams,3n7fs,"the best one I've seen",0,https://v.redd.it/xpst531sebac1,0.89,73,1704326858,2024-01-04T12:07:38+0000
2024-01-04T14,18xxryv,90,8342,cats,2qhta,"Wife kept saying my snoring was waking her up but as it turns out….",0,https://v.redd.it/5vd5ck4y8bac1,0.99,109,1704324898,2024-01-03T11:34:58+0000
2024-01-04T14,18xxkam,70,12735,rareinsults,48t85,"Cute- 😍😍 Not cute- ☹️☹️",0,https://i.redd.it/ra7998je7bac1.jpeg,0.95,150,1704324378,2024-01-03T11:26:18+0000
2024-01-04T14,18xx4un,49,18258,todayilearned,2qqjc,"TIL: Short Sleeper Syndrome is a gene mutation discovered by the University of Pittsburgh in 2014. They can function normally with less than 6 hours of sleep and never need to ""recover"" from lack of sleep as opposed to people who purposefully limit sleep. The mutation was given to mice and worked.",0,https://www.healthline.com/health/sleep/natural-short-sleeper,0.96,1222,1704323332,2024-01-03T11:08:52+0000
2024-01-04T14,18xx0vg,65,12928,lego,2qhm7,"I made a brass armor for Lego",0,https://www.reddit.com/gallery/18xx0vg,0.98,278,1704323060,2024-01-03T11:04:20+0000
2024-01-04T14,18xwz76,95,10655,oddlysatisfying,2x93b,"Candle Perfectly Fits Under The Glass",0,https://v.redd.it/s3v9pqq43bac1,0.84,236,1704322942,2024-01-03T11:02:22+0000
2024-01-04T14,18xvyop,53,25623,NatureIsFuckingLit,3gdh7,"🔥 Chimp experiences freedom from a cage for the first time in 28 years 🔥 ",0,https://v.redd.it/sqwyz2osvaac1,0.95,878,1704320493,2024-01-03T10:21:33+0000
2024-01-04T14,18xvltp,81,16449,nextfuckinglevel,m0bnr,"Man reveals the technique that could have been used on Stonehedge",0,https://v.redd.it/e33rao0vpaac1,0.93,548,1704319633,2024-01-03T10:07:13+0000
2024-01-04T14,18xvio8,59,19965,PublicFreakout,2yrq6,"A Man Attacked a Las Vegas Judge During Sentencing Today",0,https://v.redd.it/0klbaupjsaac1,0.96,3339,1704319419,2024-01-03T10:03:39+0000
