date,id,position,score,subreddit_display_name,subreddit_id,title,is_self,url,upvote_ratio,num_comments,created,created_date
2024-01-01T10,18vsaga,74,910,CatastrophicFailure,38tab,"M7.4 Earthquake Hitting Japan, Tsunami Over 1m Observed. Live camera footage of the moment the earthquake - January 1, 2024(Noto, Ishikawa, Japan)",0,https://v.redd.it/ggtawskges9c1,0.98,64,1704096848,2024-01-01T08:14:08+0000
2024-01-01T10,18vs6me,80,885,PublicFreakout,2yrq6,"Powerful earthquake hits Japan on first day of 2024, tsunami warnings issued",0,https://v.redd.it/vizn5vt0ds9c1,0.99,92,1704096384,2024-01-01T08:06:24+0000
2024-01-01T10,18vrzy6,51,1177,antiwork,2y77d,"Imagine the mental health improvements",0,https://i.redd.it/w9smfcuk9r9c1.jpeg,0.98,32,1704095623,2024-01-01T07:53:43+0000
2024-01-01T10,18vrrf6,2,3769,worldnews,2qh13,"Tsunami warning issued as magnitude 7.4 earthquake hits Japan",0,https://news.sky.com/story/tsunami-warning-issued-as-magnitude-7-4-earthquake-hits-japan-13040225,0.98,329,1704094612,2024-01-01T07:36:52+0000
2024-01-01T10,18vrqm4,21,2060,toptalent,3ptyd,"The most controversial video I've ever done",0,https://v.redd.it/ppikx7fw7s9c1,0.93,119,1704094514,2024-01-01T07:35:14+0000
2024-01-01T10,18vrgkb,43,1454,Hololive,29numb,"Welp, it was a good run. Oshio-mama saw the shuffle medley and is planning to destroy Cover's 2.7 billion yen 3D studio",0,https://i.redd.it/0br3bfvb4s9c1.jpeg,0.97,47,1704093315,2024-01-01T07:15:15+0000
2024-01-01T10,18vqsxl,67,1315,ProgrammerHumor,2tex6,whichOneAreYou,0,https://i.redd.it/7r4hjs24wr9c1.png,0.99,97,1704090650,2024-01-01T06:30:50+0000
2024-01-01T10,18vqga5,60,2775,Unexpected,2w67q,"What a sick burn.",0,https://v.redd.it/we48g0m2sr9c1,0.9,219,1704089226,2024-01-01T06:07:06+0000
2024-01-01T10,18vqdrp,59,1498,LinusTechTips,2v5ru,"Congratulations old Colton",0,https://i.redd.it/m8bl8q0err9c1.jpeg,0.95,64,1704088961,2024-01-01T06:02:41+0000
2024-01-01T10,18vq71w,86,1267,notmycat,38c5p,"His mother died on my grandparents property. He was originally supposed to go to the DNR but he's still here 5 months later",0,https://www.reddit.com/gallery/18vq71w,0.99,42,1704088224,2024-01-01T05:50:24+0000
2024-01-01T10,18vq3dq,24,5381,Damnthatsinteresting,2xxyj,"The perfect snowflake falling onto this arm",0,https://v.redd.it/ewp3t0ixnr9c1,0.97,79,1704087810,2024-01-01T05:43:30+0000
2024-01-01T10,18vq10j,64,1570,LifeProTips,2s5oq,"LPT: If you intend to purchase a website domain name, do not search the availability of the domain until you are ready to buy it immediately",1,https://www.reddit.com/r/LifeProTips/comments/18vq10j/lpt_if_you_intend_to_purchase_a_website_domain/,0.96,107,1704087550,2024-01-01T05:39:10+0000
2024-01-01T10,18vpy8h,50,1799,MapPorn,2si92,"The largest generation in every European country; Europe has the oldest population in the world",0,https://i.redd.it/vvlztp2amr9c1.png,0.91,198,1704087244,2024-01-01T05:34:04+0000
2024-01-01T10,18vporl,95,1351,BikiniBottomTwitter,3deqz,"New year, same me.",0,https://i.redd.it/3fhkdjm4jr9c1.jpeg,0.97,9,1704086182,2024-01-01T05:16:22+0000
2024-01-01T10,18vpl09,26,5537,mildlyinteresting,2ti4h,"I (may) have just sold the first Mickey Mouse as an individual.",0,https://i.redd.it/8n0fu12xhr9c1.jpeg,0.88,148,1704085780,2024-01-01T05:09:40+0000
2024-01-01T10,18vpj4i,91,1411,BeAmazed,363r3,"Asteroid impact",0,https://v.redd.it/gsw6v4o8hr9c1,0.96,171,1704085577,2024-01-01T05:06:17+0000
2024-01-01T10,18vpihv,42,2176,MadeMeSmile,2uqcm,"Dog's happiness after achieving his objective!",0,https://v.redd.it/v7da2dx4hr9c1,0.98,14,1704085513,2024-01-01T05:05:13+0000
2024-01-01T10,18vpfta,39,2338,CrazyFuckingVideos,45hae8,"A Venezuelan family with a toddler, trying to cross the Mexico-USA border. ",0,https://v.redd.it/u8gjwj4dgr9c1,0.89,477,1704085263,2024-01-01T05:01:03+0000
2024-01-01T10,18vpcfq,81,1592,perfectlycutscreams,3n7fs,"How could he not know 😭",0,https://v.redd.it/0vyxik5cfr9c1,0.94,127,1704084908,2024-01-01T04:55:08+0000
2024-01-01T10,18vp5yl,5,6156,funny,2qh33,"Reddit Relationships",0,https://i.redd.it/0iopr5h5dr9c1.jpeg,0.97,80,1704084174,2024-01-01T04:42:54+0000
2024-01-01T10,18vp55e,76,1718,Satisfyingasfuck,31s00,"How to tie a scarf",0,https://v.redd.it/lw4ihq23cr9c1,0.97,23,1704084085,2024-01-01T04:41:25+0000
2024-01-01T10,18vp2ug,57,2044,PeterExplainsTheJoke,121h8r,"From a party cracker and we’re all stumped",0,https://i.redd.it/zv3prr04cr9c1.jpeg,0.96,134,1704083829,2024-01-01T04:37:09+0000
2024-01-01T10,18vp2qd,75,1756,trashy,2uao3,"What in the std pump and pass game are they playing",0,https://v.redd.it/z3uy8u23cr9c1,0.85,140,1704083815,2024-01-01T04:36:55+0000
2024-01-01T10,18vp0uc,27,3057,Awww,2suml,boop!!!!!!,0,https://v.redd.it/ohsejibcbr9c1,0.97,36,1704083597,2024-01-01T04:33:17+0000
2024-01-01T10,18voxyx,93,1604,mapporncirclejerk,2wxxs,"Who would win in this hypothetical war?",0,https://i.redd.it/im8tysiiar9c1.jpeg,0.88,258,1704083286,2024-01-01T04:28:06+0000
2024-01-01T10,18voxt3,19,3945,DIY,2qh7d,"I installed new flooring in our trailer",0,https://www.reddit.com/gallery/18voxt3,0.94,278,1704083267,2024-01-01T04:27:47+0000
2024-01-01T10,18vorfg,12,5348,CuratedTumblr,3x5kfw,"Snails are a great perspective to learn anything",0,https://i.redd.it/ii55tv9e8r9c1.jpeg,0.91,79,1704082573,2024-01-01T04:16:13+0000
2024-01-01T10,18vonkd,20,4418,me_irl,2vegg,me_irl,0,https://v.redd.it/e2jr6u957r9c1,0.98,76,1704082158,2024-01-01T04:09:18+0000
2024-01-01T10,18vomsa,6,7515,gaming,2qh03,"Blows my mind that GTA 6 is going to surpass these visuals",0,https://i.redd.it/lb5g6ejr6r9c1.gif,0.88,475,1704082068,2024-01-01T04:07:48+0000
2024-01-01T10,18volty,30,3235,HonkaiStarRail,4q5zoc,"Guys, am I doing it right?",0,https://i.redd.it/58cdk7vf6r9c1.png,0.93,220,1704081963,2024-01-01T04:06:03+0000
2024-01-01T10,18volsk,37,5412,WhitePeopleTwitter,35n7t,"Grandpa’s furious",0,https://i.redd.it/551oi6ok6r9c1.jpeg,0.97,127,1704081961,2024-01-01T04:06:01+0000
2024-01-01T10,18voirr,23,4115,Genshin_Impact,12p4l2,"Official Illustration Commemorating New Year's 2024 in Japan",0,https://i.redd.it/mdlaghwj5r9c1.jpeg,0.96,68,1704081644,2024-01-01T04:00:44+0000
2024-01-01T10,18voin5,96,1699,FortNiteBR,3oeyf,"Bro had it coming",0,https://v.redd.it/iwmn9ydg5r9c1,0.97,107,1704081634,2024-01-01T04:00:34+0000
2024-01-01T10,18vogls,4,8223,mildlyinteresting,2ti4h,"I logged how every day went in 2023",0,https://i.redd.it/i4vl86kx4r9c1.jpeg,0.92,439,1704081409,2024-01-01T03:56:49+0000
2024-01-01T10,18vof16,58,2284,Music,2qh1u,"Green Day Slams Trump's 'MAGA Agenda' During 'American Idiot' Performance on 'Dick Clark's New Year's Rockin Eve'",0,https://themessenger.com/entertainment/green-day-maga-agenda-american-idiot-dick-clark-new-years-rockin-eve,0.84,342,1704081232,2024-01-01T03:53:52+0000
2024-01-01T10,18vob1d,28,3292,IllegallySmolCats,23e19j,"my ivy at 6 weeks!",0,https://i.redd.it/nodgcfg33r9c1.jpeg,0.98,42,1704080791,2024-01-01T03:46:31+0000
2024-01-01T10,18vo8ky,17,5269,interestingasfuck,2qhsa,"The warning on nuclear waste disposal sites designed to be read hundreds of thousands of years into the future",0,https://i.redd.it/lbyv375a2r9c1.jpeg,0.94,802,1704080522,2024-01-01T03:42:02+0000
2024-01-01T10,18vo81x,54,2496,BaldursGate3,12967t,"A warning to those looking forward to the romance scenes",1,https://www.reddit.com/r/BaldursGate3/comments/18vo81x/a_warning_to_those_looking_forward_to_the_romance/,0.96,79,1704080467,2024-01-01T03:41:07+0000
2024-01-01T10,18vo7o7,32,3175,PoliticalHumor,2qm21,"MAGA Brains Woud Explode",0,https://i.imgur.com/Y41J77a.png,0.96,165,1704080435,2024-01-01T03:40:35+0000
2024-01-01T10,18vo4h2,38,3135,mildlyinfuriating,2ubgg,"My dog has to celebrate the new year like this because some lady let her antisocial dog escape and it attacked mine inside my own fucking home. She refused to pay the vet's bill and a lawsuit is on the way.",0,https://i.redd.it/zmjmw4iz0r9c1.jpeg,0.97,100,1704080086,2024-01-01T03:34:46+0000
2024-01-01T10,18vnzqh,35,7184,wholesomememes,3gcwj,"She must have happily accepted being tricked like this",0,https://i.redd.it/ybpu0ylmyq9c1.png,0.98,110,1704079566,2024-01-01T03:26:06+0000
2024-01-01T10,18vnyd6,87,1983,cats,2qhta,"Had to say goodbye to sweet Cleopatra tonight",0,https://www.reddit.com/gallery/18vnyd6,0.98,67,1704079419,2024-01-01T03:23:39+0000
2024-01-01T10,18vnxoq,18,6461,shitposting,2usxq,"🗿",0,https://i.redd.it/x8ehv3fsyq9c1.jpeg,0.98,114,1704079343,2024-01-01T03:22:23+0000
2024-01-01T10,18vnrqe,1,22697,Damnthatsinteresting,2xxyj,"Night vision has come a long way. ",0,https://v.redd.it/rmq7nfhvwq9c1,0.96,572,1704078698,2024-01-01T03:11:38+0000
2024-01-01T10,18vnisk,84,4254,holdmycatnip,2zhxd,"Mom cat having a . . . moment. ",0,https://v.redd.it/tqqb1f70uq9c1,0.98,51,1704077787,2024-01-01T02:56:27+0000
2024-01-01T10,18vndzi,3,14590,facepalm,2r5rp,"No it’s really not the fault of the victim.",0,https://i.redd.it/46i5jf4osq9c1.jpeg,0.91,1993,1704077284,2024-01-01T02:48:04+0000
2024-01-01T10,18vnc0x,16,6671,NonPoliticalTwitter,39gt6y,"Basically that urinal meme",0,https://i.redd.it/l35tg0w2sq9c1.jpeg,0.97,136,1704077086,2024-01-01T02:44:46+0000
2024-01-01T10,18vn2kb,9,10451,WhitePeopleTwitter,35n7t,"When You Design a Vehicle with the Express Intention of Killing People",0,https://i.redd.it/zenqrfj4pq9c1.png,0.92,756,1704076100,2024-01-01T02:28:20+0000
2024-01-01T10,18vmyy0,31,4289,SweatyPalms,2v567,"railway market",0,https://v.redd.it/albv9vd1oq9c1,0.96,128,1704075731,2024-01-01T02:22:11+0000
2024-01-01T10,18vms03,48,3585,wholesomegreentext,3i3vm,"“How I met your mother” 4chan edition",0,https://i.redd.it/4vdpbqsjdqm51.jpg,0.94,45,1704075030,2024-01-01T02:10:30+0000
2024-01-01T10,18vmpts,79,2698,fuckcars,3cs2l,"Bicycle, what are you a commie?",0,https://i.redd.it/2dplu56alq9c1.jpeg,0.93,77,1704074800,2024-01-01T02:06:40+0000
2024-01-01T10,18vmp7y,40,3998,UpliftingNews,2u3ta,"Homicides See Historic Decline In 2023 Despite Perceptions That Crime Is On The Rise",0,https://www.forbes.com/sites/jamesfarrell/2023/12/29/homicides-see-historic-decline-in-2023-despite-perceptions-that-crime-is-on-the-rise/,0.94,205,1704074736,2024-01-01T02:05:36+0000
2024-01-01T10,18vmjkg,15,8230,NatureIsFuckingLit,3gdh7,"🔥 Bison Shedding a Tear",0,https://v.redd.it/0ec11bjgjq9c1,0.95,213,1704074207,2024-01-01T01:56:47+0000
2024-01-01T10,18vmejp,8,14435,Unexpected,2w67q,"Drawing Iron Man",0,https://v.redd.it/kdm60vp1iq9c1,0.92,127,1704073715,2024-01-01T01:48:35+0000
2024-01-01T10,18vmav3,98,2594,OnePunchMan,2vm97,"Murata launched an anime production studio.",0,https://i.redd.it/x31ofhvygq9c1.jpeg,0.96,100,1704073349,2024-01-01T01:42:29+0000
2024-01-01T10,18vm8cu,7,17429,memes,2qjpg,"When will it end",0,https://v.redd.it/cn2bf6b8gq9c1,0.96,348,1704073109,2024-01-01T01:38:29+0000
2024-01-01T10,18vm6hp,10,13571,wholesomememes,3gcwj,"Gotta love kids, lol.",0,https://i.imgur.com/j0QQX63.png,0.97,53,1704072924,2024-01-01T01:35:24+0000
2024-01-01T10,18vm44k,73,3385,nope,2s5fh,"Nope nope NOPE. From tomorrow only steaks. ",0,https://v.redd.it/co85l2d1fq9c1,0.94,122,1704072702,2024-01-01T01:31:42+0000
2024-01-01T10,18vm2v0,78,3063,blackcats,2twpw,"The worst day",0,https://www.reddit.com/gallery/18vm2v0,0.96,198,1704072582,2024-01-01T01:29:42+0000
2024-01-01T10,18vm1tu,47,4141,SipsTea,5tdqj0,"Greatest assist of the year",0,https://v.redd.it/fd539l7deq9c1,0.97,96,1704072477,2024-01-01T01:27:57+0000
2024-01-01T10,18vm1qm,53,3904,nba,2qo4s,"[Highlight] Victor Wembanyama takes one dribble from 3/4 court and dunks the basketball",0,https://streamable.com/ukl6dz,0.82,639,1704072466,2024-01-01T01:27:46+0000
2024-01-01T10,18vm0yj,14,8932,politics,2cneq,"Trump's rhetoric is increasingly mirroring Nazi talking points, and nobody is paying attention, an expert on extremism warns",0,https://www.businessinsider.com/trump-rhetoric-mirroring-nazi-fascism-hitler-expert-warns-2023-11,0.89,626,1704072395,2024-01-01T01:26:35+0000
2024-01-01T10,18vlw2y,71,3453,Showerthoughts,2szyo,"Most peoples' first word of the year is Happy",1,https://www.reddit.com/r/Showerthoughts/comments/18vlw2y/most_peoples_first_word_of_the_year_is_happy/,0.95,193,1704071940,2024-01-01T01:19:00+0000
2024-01-01T10,18vlu3m,25,6651,holdmycatnip,2zhxd,"A good helper",0,https://v.redd.it/vczys3b7cq9c1,0.98,29,1704071751,2024-01-01T01:15:51+0000
2024-01-01T10,18vls05,49,8242,funny,2qh33,"Pregaming for NYE in your 40's.",0,https://i.redd.it/w6ubuhombq9c1.png,0.95,257,1704071554,2024-01-01T01:12:34+0000
2024-01-01T10,18vlp6r,65,3772,gtaonline,2xrd1,"The most dangerous time of year for trucking, be careful out there drivers.",0,https://v.redd.it/qswapunpaq9c1,0.96,122,1704071291,2024-01-01T01:08:11+0000
2024-01-01T10,18vlkrb,46,5899,todayilearned,2qqjc,"TIL that you shouldn't use soap to wash your asshole as they will reduce the natural oils that protect the anus",0,"https://www.healthdirect.gov.au/anal-care#:~:text=Good%20anal%20hygiene,you%20feel%20you%20need%20them.",0.71,1836,1704070882,2024-01-01T01:01:22+0000
2024-01-01T10,18vlhii,99,3009,FunnyAnimals,2st2l,"Corgi gets shoved too hard",0,https://v.redd.it/vw10f0on8q9c1,0.98,65,1704070598,2024-01-01T12:56:38+0000
2024-01-01T10,18vlgk1,83,3288,FUCKYOUINPARTICULAR,3538a,"fuck his hockey stick",0,https://v.redd.it/29g6wvqg8q9c1,0.97,155,1704070505,2024-01-01T12:55:05+0000
2024-01-01T10,18vl92o,33,6053,DOG,2qiy5,"Louie is amazing",0,https://v.redd.it/89gsjq5a6q9c1,0.96,113,1704069808,2024-01-01T12:43:28+0000
2024-01-01T10,18vl73t,62,4315,comics,2qh0s,"My top 3 of 2023 [OC]",0,https://www.reddit.com/gallery/18vl73t,0.98,37,1704069633,2024-01-01T12:40:33+0000
2024-01-01T10,18vkk2p,36,6992,ContagiousLaughter,2u2bh,"Bro is about to see sound",0,https://v.redd.it/fvymj9phzp9c1,0.92,325,1704067473,2024-01-01T12:04:33+0000
2024-01-01T10,18vkifx,41,7052,PrequelMemes,3i60n,"For The Republic🫡",0,https://v.redd.it/ce1ky5l2zp9c1,0.95,117,1704067331,2024-01-01T12:02:11+0000
2024-01-01T10,18vkgkp,22,9853,news,2qh3l,"New York sergeant, wife and two sons found dead in murder-suicide, police say | US crime",0,https://www.theguardian.com/us-news/2023/dec/31/new-york-police-sergeant-wife-two-sons-found-dead,0.95,947,1704067186,2023-12-31T11:59:46+0000
2024-01-01T10,18vk2xk,66,6565,cursedcomments,hw1ju,Cursed_Snake,0,https://i.redd.it/1vyuwabyup9c1.jpeg,0.97,74,1704065945,2023-12-31T11:39:05+0000
2024-01-01T10,18vk2md,13,24689,AbsoluteUnits,a7wuv,"When a Powerlifter meets a Bodybuilder",0,https://v.redd.it/zcgudaxpup9c1,0.95,804,1704065918,2023-12-31T11:38:38+0000
2024-01-01T10,18vjy78,11,31333,pics,2qh0u,"Gary Sinise here. Wishing you all a Happy New Year and a great 2024 from my family to yours",0,https://i.redd.it/4ac8r0xgpp9c1.jpeg,0.91,759,1704065512,2023-12-31T11:31:52+0000
2024-01-01T10,18vjq4z,90,4998,meme,2qi1r,"Europe gang",0,https://i.redd.it/aue1rjufrp9c1.jpeg,0.96,110,1704064764,2023-12-31T11:19:24+0000
2024-01-01T10,18vjpqq,92,10091,facepalm,2r5rp,"oh yeah?",0,https://i.redd.it/3laauqobrp9c1.jpeg,0.91,1345,1704064725,2023-12-31T11:18:45+0000
2024-01-01T10,18vjl51,72,6208,TIHI,r1l2z,"Thanks I hate this activity",0,https://i.redd.it/d99vnph1qp9c1.jpeg,0.94,355,1704064297,2023-12-31T11:11:37+0000
2024-01-01T10,18vj8b1,52,22810,pics,2qh0u,"Just bought a house and found this on the garage. 🥺",0,https://i.redd.it/n51gqb2jmp9c1.jpeg,0.95,1304,1704063147,2023-12-31T10:52:27+0000
2024-01-01T10,18vj56x,55,6455,OldSchoolCool,2tycb,"That’s a pretty risqué joke for the 1940s!",0,https://i.redd.it/u5aks1julp9c1.jpeg,0.95,284,1704062883,2023-12-31T10:48:03+0000
2024-01-01T10,18vj0ac,56,7013,menwritingwomen,3ox0h,"Anti-Suffragette political cartoons from the early 1900s are wild",0,https://www.reddit.com/gallery/18vj0ac,0.94,403,1704062464,2023-12-31T10:41:04+0000
2024-01-01T10,18viz8l,68,7948,MinecraftMemes,2sq0h,"Dont ask",0,https://i.redd.it/weosqko7kp9c1.png,0.95,65,1704062376,2023-12-31T10:39:36+0000
2024-01-01T10,18visxg,97,4959,shittymoviedetails,3mj3w,"Daniel Day Lewis on the set of Wonka (2023) 2 weeks before he was fired and recasted in favor of Timothée Chalamet.",0,https://www.reddit.com/gallery/18visxg,0.97,103,1704061830,2023-12-31T10:30:30+0000
2024-01-01T10,18vimbx,29,15658,meirl,2s5ti,meirl,0,https://i.redd.it/k2m63u62hp9c1.jpeg,0.96,244,1704061273,2023-12-31T10:21:13+0000
2024-01-01T10,18vihhj,82,5685,nostalgia,2qnub,"Family popcorn bowl that was also used as a “barf bowl” when we got sick",0,https://i.redd.it/4c8ufhsufp9c1.jpeg,0.94,544,1704060870,2023-12-31T10:14:30+0000
2024-01-01T10,18vie0i,44,9659,CrappyDesign,2sa3m,"The armrest of my United Airlines seat has flight attendant call buttons. We are only 30 minutes into the flight, and they have already made two announcements not to accidentally push the buttons.",0,https://i.redd.it/8d6wma0yep9c1.jpeg,0.96,231,1704060573,2023-12-31T10:09:33+0000
2024-01-01T10,18vicnx,77,6887,me_irlgbt,3apfn,me_irlgbt,0,https://i.redd.it/m0213cvqpn9c1.png,0.92,126,1704060450,2023-12-31T10:07:30+0000
2024-01-01T10,18vib0a,85,5908,fixedbytheduet,46tcaa,"What else would we be doing?",0,https://v.redd.it/bwwbz7h5ep9c1,0.94,181,1704060308,2023-12-31T10:05:08+0000
2024-01-01T10,18vi8zh,69,8436,europe,2qh4j,"Estonia has fully legalized same-sex marriages!",0,https://i.redd.it/qfx1805ndp9c1.jpeg,0.81,933,1704060128,2023-12-31T10:02:08+0000
2024-01-01T10,18vhvhe,34,19466,maybemaybemaybe,38e1l,"Maybe Maybe Maybe ",0,https://v.redd.it/oyrb4tp7ap9c1,0.9,785,1704058987,2023-12-31T09:43:07+0000
2024-01-01T10,18vhnof,89,6574,abandoned,2qicm,"Can't believe they just left them all behind 😳",0,https://v.redd.it/vxxufip48p9c1,0.94,352,1704058329,2023-12-31T09:32:09+0000
2024-01-01T10,18vhkhw,88,8382,technicallythetruth,3pzez,"In a binary world",0,https://i.redd.it/j0sre4pg7p9c1.png,0.99,36,1704058067,2023-12-31T09:27:47+0000
2024-01-01T10,18vglx2,70,11080,therewasanattempt,39ne7,"To practice American exceptionalism ",0,https://v.redd.it/4g15v0b4zo9c1,0.93,782,1704055240,2023-12-31T08:40:40+0000
2024-01-01T10,18vfrjc,45,24004,aww,2qh1o,"People always said my puppy looked like a fox… swipe to see how he turned out",0,https://www.reddit.com/gallery/18vfrjc,0.94,883,1704052798,2023-12-31T07:59:58+0000
2024-01-01T10,18vf8vd,63,24543,oddlysatisfying,2x93b,"Putting hard oil on my knife handle.",0,https://v.redd.it/k110h9hgno9c1,0.88,940,1704051319,2023-12-31T07:35:19+0000
2024-01-01T10,18vetxq,61,28404,clevercomebacks,dyqlw,"Another reason to love the Beatles",0,https://i.imgur.com/SXTEFOm.jpg,0.93,451,1704050160,2023-12-31T07:16:00+0000
2024-01-01T10,18vdst4,100,15457,CozyPlaces,34ixl,"New Years Eve Cozy Dinner",0,https://i.redd.it/t00chuzcbo9c1.jpeg,0.94,465,1704047250,2023-12-31T06:27:30+0000
2024-01-01T10,18vd80p,94,22222,BlackPeopleTwitter,33x33,"The survival skills were lagging tbf",0,https://v.redd.it/ytuuza384o9c1,0.94,320,1704045603,2023-12-31T06:00:03+0000
