date,id,position,score,subreddit_display_name,subreddit_id,title,is_self,url,upvote_ratio,num_comments,created,created_date
2024-01-01T22,18w61ly,71,3299,MadeMeSmile,2uqcm,"What a weight loss journey! She looks so much happier now",0,https://v.redd.it/r2jkm9vf3w9c1,0.99,69,1704141467,2024-01-01T08:37:47+0000
2024-01-01T22,18w5jap,88,2824,news,2qh3l,"CNN: Melissa Hoskins: Two-time Olympic cyclist dies aged 32 after being hit by car",0,https://www.cnn.com/2024/01/01/sport/melissa-hoskins-dies-hit-by-car-spt-intl/index.html,0.96,187,1704140178,2024-01-01T08:16:18+0000
2024-01-01T22,18w587u,19,3300,CuratedTumblr,3x5kfw,"She's breaking new ground",0,https://i.redd.it/svr5086fxv9c1.jpeg,0.98,101,1704139417,2024-01-01T08:03:37+0000
2024-01-01T22,18w4uay,31,2722,HollowKnightMemes,j958e,"If anyone could find the source, that would be appreciated",0,https://i.redd.it/lipngi6muv9c1.gif,0.98,57,1704138479,2024-01-01T07:47:59+0000
2024-01-01T22,18w4iwf,1,13666,facepalm,2r5rp,"You aren't welcome here for Christmas",0,https://i.redd.it/ymd3x1s4sv9c1.png,0.92,718,1704137652,2024-01-01T07:34:12+0000
2024-01-01T22,18w49tg,60,2042,AbsoluteUnits,a7wuv,"Dwarf Juggernaut",0,https://v.redd.it/53wqfc73qv9c1,0.96,150,1704137018,2024-01-01T07:23:38+0000
2024-01-01T22,18w425y,9,6294,pics,2qh0u,"My grandpa just showed me this picture, of my great grandmother with an German politician.",0,https://i.redd.it/7wx4dj9qov9c1.jpeg,0.96,718,1704136494,2024-01-01T07:14:54+0000
2024-01-01T22,18w3szu,20,3754,comics,2qh0s,"Leaving the Flock",0,https://i.redd.it/049bft3jmv9c1.png,0.93,51,1704135859,2024-01-01T07:04:19+0000
2024-01-01T22,18w3re0,2,13206,Damnthatsinteresting,2xxyj,"The exhaustion level of the participants of the French Cross Race Championship",0,https://v.redd.it/kzqqnlremv9c1,0.92,1376,1704135748,2024-01-01T07:02:28+0000
2024-01-01T22,18w3k0d,47,2506,BlackPeopleTwitter,33x33,"Does Elon not know what their biggest song is about?",0,https://i.redd.it/boqecm20lv9c1.jpeg,0.96,183,1704135240,2024-01-01T06:54:00+0000
2024-01-01T22,18w3gmc,56,2399,Terraria,2sg5b,"lucky item idea",0,https://i.redd.it/r7dd20sakv9c1.png,0.98,31,1704135004,2024-01-01T06:50:04+0000
2024-01-01T22,18w3csk,61,2243,antiwork,2y77d,"This Idea Went Extinct In America.",0,https://i.redd.it/hy0hzr0hjv9c1.jpeg,0.97,55,1704134728,2024-01-01T06:45:28+0000
2024-01-01T22,18w3bnx,90,1679,OldSchoolCool,2tycb,"Chief John Smith was an Ojibwe (Chippewa) Indian who lived in the area of Cass Lake, Minnesota. He died in 1922 at the (alleged) ripe old age of 137.",0,https://i.redd.it/kezakz59jv9c1.jpeg,0.96,93,1704134652,2024-01-01T06:44:12+0000
2024-01-01T22,18w2z1k,15,5124,mildlyinfuriating,2ubgg,"Greedy Landlords are killing the few good businesses.",0,https://i.redd.it/n4gxfljmgv9c1.jpeg,0.93,379,1704133768,2024-01-01T06:29:28+0000
2024-01-01T22,18w2xc0,42,7727,facepalm,2r5rp,"Just your average pro life hypocrite.",0,https://i.redd.it/evvxzry7gv9c1.jpeg,0.94,390,1704133641,2024-01-01T06:27:21+0000
2024-01-01T22,18w2np9,44,2863,PublicFreakout,2yrq6,"Entitled Billionaire NFL Owner Throws Drink At Fans",0,https://v.redd.it/mwidnbw3ev9c1,0.95,305,1704132950,2024-01-01T06:15:50+0000
2024-01-01T22,18w2hbi,21,4925,whenthe,23gidu,"Whenthe: ",0,https://v.redd.it/7uxgfkkscv9c1,0.97,133,1704132482,2024-01-01T06:08:02+0000
2024-01-01T22,18w2dhe,8,8240,WhitePeopleTwitter,35n7t,"I'm sensing a trend",0,https://i.redd.it/ebm3ztpxbv9c1.jpeg,0.98,193,1704132192,2024-01-01T06:03:12+0000
2024-01-01T22,18w2bon,77,2208,lgbt,2qhh7,"Starting the new year with a win for the girls and the gays😌💅",0,https://i.redd.it/4uflprdkbv9c1.png,0.94,89,1704132070,2024-01-01T06:01:10+0000
2024-01-01T22,18w2ake,39,3362,cursedcomments,hw1ju,"cursed canine",0,https://i.redd.it/wz6nyntdbv9c1.jpeg,0.99,30,1704132008,2024-01-01T06:00:08+0000
2024-01-01T22,18w259h,11,6608,todayilearned,2qqjc,"TIL After Vancouver hosted 2010 Olympics, its Olympics Village became a ghost town, to the extent that a sales campaign discounted remaining units by up to 50% in 2011. The developer fell short on its loan payments because of poor sales",0,https://bc.ctvnews.ca/can-lower-prices-kill-olympic-village-s-ghost-town-image-1.609187,0.97,411,1704131624,2024-01-01T05:53:44+0000
2024-01-01T22,18w20w3,65,2519,nba,2qo4s,"[Katz] OG Anunoby: “When I found out it was the Knicks, I was definitely excited. I’ve always liked the team. I grew up a fan of basketball, so I always watched the Knicks.”",0,https://x.com/FredKatz/status/1741878187468964094,0.96,209,1704131304,2024-01-01T05:48:24+0000
2024-01-01T22,18w1r0f,93,2046,madlads,3aegn,"Happy public domain day",0,https://i.redd.it/weofzbp37v9c1.jpeg,0.98,10,1704130565,2024-01-01T05:36:05+0000
2024-01-01T22,18w1kao,69,2601,nextfuckinglevel,m0bnr,"James Morrison trumpet solo",0,https://v.redd.it/khagf3kn5v9c1,0.96,131,1704130080,2024-01-01T05:28:00+0000
2024-01-01T22,18w1dg6,85,2267,ToiletPaperUSA,3pccn,"Two America's folks",0,https://i.redd.it/68qgwf054v9c1.png,0.96,270,1704129570,2024-01-01T05:19:30+0000
2024-01-01T22,18w1929,30,4779,tumblr,2r7hk,Goop,0,https://i.redd.it/rddnsqk53v9c1.jpeg,0.98,21,1704129240,2024-01-01T05:14:00+0000
2024-01-01T22,18w18d4,46,3651,therewasanattempt,39ne7,"To sell a pen.",0,https://v.redd.it/netehriz2v9c1,0.93,90,1704129184,2024-01-01T05:13:04+0000
2024-01-01T22,18w1712,96,2155,Millennials,2rc4u,"I woke up on the first day of 2024 feeling like a sad, unaccomplished loser",1,https://www.reddit.com/r/Millennials/comments/18w1712/i_woke_up_on_the_first_day_of_2024_feeling_like_a/,0.87,707,1704129084,2024-01-01T05:11:24+0000
2024-01-01T22,18w16vq,45,3792,theydidthemath,2x23b,"[Request] is this true?",0,https://i.redd.it/guqm82fn2v9c1.jpeg,0.94,175,1704129073,2024-01-01T05:11:13+0000
2024-01-01T22,18w16ov,18,5747,ancientrome,2s8l1,"Syrian Archaeologist Khaled al-Asaad pictured with a 2nd Century Roman Palmyrene family’s funerary relief; Palmyra, Syria. He was beheaded by ISIS in 2015, for refusing to disclose the location of ancient artifacts from the site, after a month of torture. Today would’ve been his 92nd birthday",0,https://i.redd.it/skuiujfm2v9c1.jpeg,0.98,112,1704129059,2024-01-01T05:10:59+0000
2024-01-01T22,18w15f3,92,2253,PrequelMemes,3i60n,"Your droid is very safe. Or is it?",0,https://i.redd.it/nome58o82v9c1.png,0.97,56,1704128964,2024-01-01T05:09:24+0000
2024-01-01T22,18w0vqw,4,23166,me_irl,2vegg,"me irl",0,https://i.redd.it/23o76i870v9c1.png,0.93,450,1704128248,2024-01-01T04:57:28+0000
2024-01-01T22,18w0phj,75,2825,AITAH,446kys,"AITA for not telling my sister that my baby's ""name"" was always just a joke",1,https://www.reddit.com/r/AITAH/comments/18w0phj/aita_for_not_telling_my_sister_that_my_babys_name/,0.95,514,1704127776,2024-01-01T04:49:36+0000
2024-01-01T22,18w0ouk,14,7545,MadeMeSmile,2uqcm,"Son Pays The Mortgage Of Parents",0,https://v.redd.it/n14qa1olyu9c1,0.96,282,1704127725,2024-01-01T04:48:45+0000
2024-01-01T22,18w0m0e,3,22221,gaming,2qh03,"Mickey Mouse went Public Domain for like 12 hours and someone already made a horror game about him...",0,https://i.redd.it/klorwygwxu9c1.png,0.91,929,1704127513,2024-01-01T04:45:13+0000
2024-01-01T22,18w0k89,53,3622,Wellthatsucks,2xcv7,"Happy new year indeed",0,https://i.redd.it/n31xbb4mxu9c1.jpeg,0.98,43,1704127376,2024-01-01T04:42:56+0000
2024-01-01T22,18w0jpw,84,2613,Showerthoughts,2szyo,"A majority of people’s LAST word of the year is ‘one’",1,https://www.reddit.com/r/Showerthoughts/comments/18w0jpw/a_majority_of_peoples_last_word_of_the_year_is_one/,0.88,267,1704127335,2024-01-01T04:42:15+0000
2024-01-01T22,18w0j8h,6,12257,nottheonion,2qnts,"Pastor accused of trying to push McDonald's cook's head into deep fryer for 'disrespecting' his wife",0,https://abc6onyourside.com/news/nation-world/pastor-accused-pushing-mcdonalds-cooks-head-deep-fryer-disrespecting-wife-dwayne-waden-assault-battery-arrest-charges-fast-food-chain-restaurant-attack-employee-victim-high-point-north-carolina,0.96,756,1704127299,2024-01-01T04:41:39+0000
2024-01-01T22,18w0ied,40,4074,wallstreetbets,2th52,"I Demand Satisfaction",0,https://i.redd.it/pfp0v9e7xu9c1.jpeg,0.96,194,1704127237,2024-01-01T04:40:37+0000
2024-01-01T22,18w0hso,25,5249,politics,2cneq,"The Wisconsin Supreme Court has thrown out the GOP-drawn district maps. That could be a huge change for the purple state",0,https://www.cbsnews.com/news/wisconsin-supreme-court-ruling-republican-drawn-district-maps-fallout/,0.98,172,1704127195,2024-01-01T04:39:55+0000
2024-01-01T22,18w0ho5,5,23800,Funnymemes,2xqtc,"Aye yo lmao 😂 😂",0,https://i.redd.it/tegctgv1xu9c1.jpeg,0.9,738,1704127185,2024-01-01T04:39:45+0000
2024-01-01T22,18w0g7v,34,4357,europe,2qh4j,"France will no longer accept imams trained by foreign countries",0,https://www.rfi.fr/en/france/20240101-france-will-no-longer-accept-imams-trained-by-foreign-countries,0.96,319,1704127074,2024-01-01T04:37:54+0000
2024-01-01T22,18w0bdm,95,2456,CrazyFuckingVideos,45hae8,"Biker freestyle gone wrong",0,https://v.redd.it/xna0hjmivu9c1,0.97,169,1704126702,2024-01-01T04:31:42+0000
2024-01-01T22,18w081v,35,4657,ProgrammerHumor,2tex6,iThoughtItWasAJoke,0,https://i.redd.it/e0jit5zpuu9c1.jpeg,0.95,269,1704126455,2024-01-01T04:27:35+0000
2024-01-01T22,18w02da,52,3953,instantbarbarians,35heo,"⚽🧴balls and gifts",0,https://v.redd.it/5tr6xgjjtu9c1,0.94,21,1704126031,2024-01-01T04:20:31+0000
2024-01-01T22,18vzz4r,49,4269,DOG,2qiy5,"This owner did not give up on their dog after it had stroke. What a champion!",0,https://v.redd.it/i0a9g7v8su9c1,0.97,66,1704125793,2024-01-01T04:16:33+0000
2024-01-01T22,18vzyoz,72,3190,AskReddit,2qh1i,"What's a life hack that's so simple yet so effective, you're shocked more people don't know about it?",1,https://www.reddit.com/r/AskReddit/comments/18vzyoz/whats_a_life_hack_thats_so_simple_yet_so/,0.93,2258,1704125759,2024-01-01T04:15:59+0000
2024-01-01T22,18vzo5p,10,11019,videos,2qh1e,"Tom Scott - After ten years, it's time to stop making videos",0,https://www.youtube.com/watch?v=7DKv5H5Frt0,0.92,644,1704124942,2024-01-01T04:02:22+0000
2024-01-01T22,18vzgii,16,9025,clevercomebacks,dyqlw,"Onions are superior",0,https://i.redd.it/g3ypimvlou9c1.png,0.95,229,1704124347,2024-01-01T03:52:27+0000
2024-01-01T22,18vz9fd,28,6871,SipsTea,5tdqj0,"Sir,this is a marker",0,https://v.redd.it/2f9ues9wmu9c1,0.92,155,1704123782,2024-01-01T03:43:02+0000
2024-01-01T22,18vz88m,33,7128,shitposting,2usxq,"511 👍",0,https://v.redd.it/hi9zhpqmmu9c1,0.94,311,1704123682,2024-01-01T03:41:22+0000
2024-01-01T22,18vz65a,7,18657,technology,2qh16,"Japanese disaster prevention X account can’t post anymore after hitting API limit - The issue has arisen after major Tsunami warnings have been issued in areas of Japan following a strong earthquake",0,https://www.dexerto.com/tech/japanese-disaster-prevention-x-account-cant-post-anymore-after-hitting-api-limit-2451266/,0.94,1133,1704123526,2024-01-01T03:38:46+0000
2024-01-01T22,18vyyow,48,15007,pics,2qh0u,"The apartment building in Japan fell over by the earthquake today.",0,https://www.reddit.com/gallery/18vyyow,0.97,523,1704122911,2024-01-01T03:28:31+0000
2024-01-01T22,18vyy1r,94,3040,Awww,2suml,"Those dogs are so happy!",0,https://v.redd.it/2ehhqnx3ku9c1,0.96,27,1704122852,2024-01-01T03:27:32+0000
2024-01-01T22,18vyy1h,68,4046,lotrmemes,2v0i1,"For anyone who needs help with their New Years Resolution!",0,https://v.redd.it/qm6el8tpju9c1,0.93,127,1704122851,2024-01-01T03:27:31+0000
2024-01-01T22,18vyx3a,12,11184,news,2qh3l,"Disney's earliest Mickey and Minnie Mouse enter public domain as US copyright expires",0,https://www.bbc.com/news/entertainment-arts-67833411,0.96,518,1704122771,2024-01-01T03:26:11+0000
2024-01-01T22,18vyugs,37,21206,WhitePeopleTwitter,35n7t,"“I’m not a part of the MAGA agenda”",0,https://i.redd.it/jxeszpu9ju9c1.jpeg,0.94,1232,1704122552,2024-01-01T03:22:32+0000
2024-01-01T22,18vysqo,57,4462,atheism,2qh2p,"Mormons are no longer in the majority in Utah, researchers say.",0,https://www.friendlyatheist.com/p/mormons-are-no-longer-in-the-majority,0.97,156,1704122412,2024-01-01T03:20:12+0000
2024-01-01T22,18vykgm,36,6098,megalophobia,31gwh,"This bodycam horror game taking place inside a deep forest where you try to survive against a giant snake",0,https://v.redd.it/3i1iqf6mgu9c1,0.92,318,1704121720,2024-01-01T03:08:40+0000
2024-01-01T22,18vyjmk,38,5908,MapPorn,2si92,"European exploration of North America",0,https://i.redd.it/ponhuyvkgu9c1.jpeg,0.94,397,1704121649,2024-01-01T03:07:29+0000
2024-01-01T22,18vy9w8,81,4044,lego,2qhm7,"Why is this set 18+? It's quite simple",0,https://i.redd.it/ytywlo51eu9c1.jpeg,0.92,313,1704120824,2024-01-01T02:53:44+0000
2024-01-01T22,18vy9cv,91,8735,todayilearned,2qqjc,"TIL rabbit starvation is when the body takes in too much protein with not enough fat and carbohydrate. When excessive amounts are consumed, it can put the body at risk for increased levels of ammonia in the blood. Protein poisoning can be fatal because of these increased levels.",0,https://www.healthline.com/health/protein-poisoning,0.96,395,1704120774,2024-01-01T02:52:54+0000
2024-01-01T22,18vy8v2,54,6351,MinecraftMemes,2sq0h,"The terror...",0,https://i.redd.it/zporifludu9c1.jpeg,0.96,117,1704120729,2024-01-01T02:52:09+0000
2024-01-01T22,18vy6l1,23,12259,oddlyterrifying,2yo6b,"New Year's Eve in Paris - 1/1/2024",0,https://v.redd.it/3gik3omucu9c1,0.88,1042,1704120529,2024-01-01T02:48:49+0000
2024-01-01T22,18vxx99,82,14093,mildlyinfuriating,2ubgg,"Dog destroyed trim",0,https://i.redd.it/hn4a9qkrau9c1.jpeg,0.93,2063,1704119691,2024-01-01T02:34:51+0000
2024-01-01T22,18vxta2,86,4119,perfectlycutscreams,3n7fs,"What could go wrong by pulling a joke at your parents",0,https://v.redd.it/cdvk3chg9u9c1,0.91,133,1704119336,2024-01-01T02:28:56+0000
2024-01-01T22,18vxroe,67,6037,dankmemes,2zmfe,"Story may be slightly* exaggerated",0,https://i.redd.it/10ur5ngz8u9c1.png,0.93,141,1704119173,2024-01-01T02:26:13+0000
2024-01-01T22,18vxkff,27,9146,PoliticalHumor,2qm21,"quit whining 'cause it's bringing me down",0,https://i.redd.it/fq7dt0m87u9c1.jpeg,0.96,269,1704118504,2024-01-01T02:15:04+0000
2024-01-01T22,18vxjyv,29,9317,NatureIsFuckingLit,3gdh7,"🔥 A Battle Scarred Indian Leopard (Marlon du Toit - Instagram) 🔥",0,https://i.redd.it/t0dsejc37u9c1.jpeg,0.97,96,1704118455,2024-01-01T02:14:15+0000
2024-01-01T22,18vxitl,87,4273,suicidebywords,3on1q,"It's called as Self awareness",0,https://i.redd.it/hc6wh5fo6u9c1.png,0.95,126,1704118339,2024-01-01T02:12:19+0000
2024-01-01T22,18vxgqd,73,4994,2meirl4meirl,3ee85,2meirl4meirl,0,https://i.redd.it/5ghdpqi56u9c1.jpeg,0.95,121,1704118143,2024-01-01T02:09:03+0000
2024-01-01T22,18vxeqz,70,5053,iamatotalpieceofshit,3jj03,"Indian railway worker dumping trash out of a moving train",0,https://v.redd.it/fxrfci9k5u9c1,0.95,272,1704117952,2024-01-01T02:05:52+0000
2024-01-01T22,18vxeje,24,10733,science,mouw,"Cannabis users appear to be relying less on conventional sleep aids: 80% of surveyed cannabis users reported no longer using sleep aids such as melatonin and benzodiazepines. Instead, they had a strong preference for inhaling high-THC cannabis by smoking joints or vaporizing flower",0,https://news.wsu.edu/press-release/2023/11/13/cannabis-users-appear-to-be-relying-less-on-conventional-sleep-aids/,0.9,1326,1704117933,2024-01-01T02:05:33+0000
2024-01-01T22,18vxd3y,50,6726,toptalent,3ptyd,"Magnus Scheving almost 20 years after Lazy Town",0,https://v.redd.it/h7odkym35u9c1,0.97,114,1704117803,2024-01-01T02:03:23+0000
2024-01-01T22,18vxcn3,79,4983,FunnyAnimals,2st2l,Restraint,0,https://v.redd.it/gm6y09pq4u9c1,0.97,36,1704117763,2024-01-01T02:02:43+0000
2024-01-01T22,18vx81g,13,33437,rareinsults,48t85,"self depricating humour",0,https://i.redd.it/xp4zfexs3u9c1.jpeg,0.93,383,1704117351,2024-01-01T01:55:51+0000
2024-01-01T22,18vx4nn,78,5129,BeAmazed,363r3,"london's new year's drone show",0,https://v.redd.it/id4owhes2u9c1,0.95,157,1704117015,2024-01-01T01:50:15+0000
2024-01-01T22,18vx4ck,76,5279,Anticonsumption,2r83n,"Is tourism becoming toxic?",0,https://www.reddit.com/gallery/18vx4ck,0.88,516,1704116983,2024-01-01T01:49:43+0000
2024-01-01T22,18vwyva,98,4371,wholesomememes,3gcwj,"a father who loves his child very much",0,https://i.redd.it/93zpinl11u9c1.jpeg,0.99,10,1704116432,2024-01-01T01:40:32+0000
2024-01-01T22,18vwwm8,99,4319,Whatcouldgowrong,2x2oy,"Doing a back flip",0,https://v.redd.it/y9iqtlid0u9c1,0.95,84,1704116204,2024-01-01T01:36:44+0000
2024-01-01T22,18vwvg1,17,21159,funny,2qh33,"Sir,this is a marker ",0,https://v.redd.it/k13jmfb10u9c1,0.89,517,1704116090,2024-01-01T01:34:50+0000
2024-01-01T22,18vwtp9,62,6330,cats,2qhta,"You’ve got a friend in me",0,https://i.redd.it/7j1bq3rgzt9c1.jpeg,0.98,63,1704115917,2024-01-01T01:31:57+0000
2024-01-01T22,18vwoej,83,5453,interestingasfuck,2qhsa,"That's how they clean stadium seats and get it new again!",0,https://v.redd.it/knvh1thyxt9c1,0.85,506,1704115394,2024-01-01T01:23:14+0000
2024-01-01T22,18vw3k4,32,22051,memes,2qjpg,"What a fucking genius",0,https://i.redd.it/z48bqaunrt9c1.jpeg,0.95,328,1704113267,2024-01-01T12:47:47+0000
2024-01-01T22,18vw1w1,22,35494,Unexpected,2w67q,"Paying good deeds forward! ",0,https://v.redd.it/xhezds5uqt9c1,0.89,513,1704113075,2024-01-01T12:44:35+0000
2024-01-01T22,18vw1p4,66,7176,worldnews,2qh13,"First surface vessel attack on Crimea failed as Musk turned off connection – UP",0,https://www.pravda.com.ua/eng/news/2024/01/1/7435389/,0.9,976,1704113050,2024-01-01T12:44:10+0000
2024-01-01T22,18vvzun,63,8086,oddlysatisfying,2x93b,"Making matchsticks",0,https://v.redd.it/8yvlwe5dqt9c1,0.93,284,1704112839,2024-01-01T12:40:39+0000
2024-01-01T22,18vvx8p,58,8162,DIY,2qh7d,"My father was a carpenter-I am not. We started a decorative fence for mom, but only a couple of posts in the ground before my dad got very sick and passed. I finished it for Mom, hopefully Dad would like it.",0,https://www.reddit.com/gallery/18vvx8p,0.94,266,1704112547,2024-01-01T12:35:47+0000
2024-01-01T22,18vvvww,100,5195,aww,2qh1o,"Bailey is excited to see you 😃",0,https://i.redd.it/29actey2pt9c1.jpeg,0.97,46,1704112399,2024-01-01T12:33:19+0000
2024-01-01T22,18vvj57,51,15919,pcmasterrace,2sgp1,"I’m a 3 what’s yours?",0,https://i.redd.it/b6qaxhjwkt9c1.jpeg,0.88,12245,1704110994,2024-01-01T12:09:54+0000
2024-01-01T22,18vvccv,26,24732,Construction,2qiuc,"Bricklayer had some time on his hands",0,https://i.redd.it/zlo4rigpit9c1.jpeg,0.97,449,1704110255,2024-01-01T11:57:35+0000
2024-01-01T22,18vv9sq,43,17193,funnyvideos,2qoos,"Watch out my friend",0,https://v.redd.it/7bbs8mxrht9c1,0.93,78,1704109943,2024-01-01T11:52:23+0000
2024-01-01T22,18vv8u8,97,6276,spaceporn,2s9jc,"I took my final Saturn shot of 2023!",0,https://i.redd.it/xoecvwmnis9c1.jpeg,0.97,70,1704109830,2024-01-01T11:50:30+0000
2024-01-01T22,18vv6sh,74,10056,maybemaybemaybe,38e1l,"maybe maybe maybe",0,https://v.redd.it/fs9zwnepgt9c1,0.91,180,1704109583,2024-01-01T11:46:23+0000
2024-01-01T22,18vuz5p,41,21422,Weird,2qlia,"Children living in Siberia getting UV light exposure during the long dark winter months",0,https://i.redd.it/z3rtcrlzdt9c1.jpeg,0.94,886,1704108668,2024-01-01T11:31:08+0000
2024-01-01T22,18vug2j,55,24054,technicallythetruth,3pzez,"Happy New Year !",0,https://i.redd.it/7qb5q5u97t9c1.png,0.94,152,1704106410,2024-01-01T10:53:30+0000
2024-01-01T22,18vufn8,59,15650,mildlyinteresting,2ti4h,"It's -36 celsius in Finland today",0,https://i.redd.it/l40sjmq37t9c1.jpeg,0.96,874,1704106353,2024-01-01T10:52:33+0000
2024-01-01T22,18vu09q,64,18458,KidsAreFuckingStupid,3948y,"And the Oscar goes to…",0,https://v.redd.it/ad20c32i1t9c1,0.93,1393,1704104470,2024-01-01T10:21:10+0000
2024-01-01T22,18vtneg,89,12860,meirl,2s5ti,Meirl,0,https://i.redd.it/9ivre49zws9c1.png,0.96,334,1704102954,2024-01-01T09:55:54+0000
2024-01-01T22,18vtmv2,80,15284,ContagiousLaughter,2u2bh,"Traffic news from Japan",0,https://v.redd.it/lnth2eqrws9c1,0.96,245,1704102889,2024-01-01T09:54:49+0000
