date,id,position,score,subreddit_display_name,subreddit_id,title,is_self,url,upvote_ratio,num_comments,created,created_date
2023-12-31T02,18uvwrk,3,3908,nba,2qo4s,"[Post Game Thread] Streak Ended - The Detroit Pistons (3-29) avoid the longest losing streak in NBA history - defeating the Toronto Raptors (12-20) by a score of 129-127",1,https://www.reddit.com/r/nba/comments/18uvwrk/post_game_thread_streak_ended_the_detroit_pistons/,0.98,882,1703986636,2023-12-31T01:37:16+0000
2023-12-31T02,18uug1x,22,2741,CFB,2qm9d,"[Postgame Thread] Georgia Defeats Florida State 63-3",1,https://www.reddit.com/r/CFB/comments/18uug1x/postgame_thread_georgia_defeats_florida_state_633/,0.95,3394,1703982607,2023-12-31T12:30:07+0000
2023-12-31T02,18usu7l,84,1501,tattooadvice,2tmyg,"Got this and now regretting it… is it too big in the middle of my chest??",0,https://i.redd.it/aoip43wgmi9c1.jpeg,0.92,418,1703978344,2023-12-30T11:19:04+0000
2023-12-31T02,18usbss,39,2674,bi_irl,3nhfo,bi_irl,0,https://i.imgur.com/iODAd3c.png,0.96,70,1703977014,2023-12-30T10:56:54+0000
2023-12-31T02,18us67f,11,4974,nextfuckinglevel,m0bnr,"16 year old Luke Littler thrashes five-time world champion at the World Darts Championship",0,https://v.redd.it/pdddvoh9hi9c1,0.95,556,1703976621,2023-12-30T10:50:21+0000
2023-12-31T02,18us5r1,91,1619,ukraine,2qqcn,"The NYT is covering Belgorod on its front page. The photo features people carrying a victim . Astonishingly, that photo is of Ukrainian victims in Zaporizhzhia — not Belgorod.",0,https://x.com/stepantxt/status/1741190257377214963?s=46&t=Hsc1NEA8zwUu-UnKBhP8dQ,0.96,133,1703976592,2023-12-30T10:49:52+0000
2023-12-31T02,18us4n6,37,2850,antiwork,2y77d,"A young mom was asking for immediate job openings, as she is in a difficult position. This was one boomers suggestion.",0,https://i.redd.it/lp2a4ak0hi9c1.jpeg,0.95,361,1703976510,2023-12-30T10:48:30+0000
2023-12-31T02,18us1pz,25,3803,meirl,2s5ti,meirl,0,https://i.redd.it/qfibw6hdgi9c1.jpeg,0.96,177,1703976299,2023-12-30T10:44:59+0000
2023-12-31T02,18urye3,96,1514,nbacirclejerk,2td2i,"Why are “we” (y’all) so obsessed with this dude? I just want actual NBA jerking back",0,https://i.redd.it/4airsbyofi9c1.jpeg,0.97,109,1703976065,2023-12-30T10:41:05+0000
2023-12-31T02,18urvll,19,4367,BeAmazed,363r3,"NASAs rotating detonation engine",0,https://v.redd.it/wm2cww83fi9c1,0.98,216,1703975869,2023-12-30T10:37:49+0000
2023-12-31T02,18urodx,21,4344,Wellthatsucks,2xcv7,"Asking to get pulled over",0,https://i.redd.it/i8llkq8ldi9c1.jpeg,0.96,130,1703975358,2023-12-30T10:29:18+0000
2023-12-31T02,18urkx0,78,2905,pics,2qh0u,"Just adopted a 15yo Pittie Mix. Best decision ever!",0,https://i.redd.it/lcqhk7ulci9c1.jpeg,0.83,270,1703975112,2023-12-30T10:25:12+0000
2023-12-31T02,18ure39,31,6309,facepalm,2r5rp,"🙂",0,https://i.redd.it/3fglzj1gbi9c1.png,0.96,728,1703974638,2023-12-30T10:17:18+0000
2023-12-31T02,18ur4uz,36,3444,CrazyFuckingVideos,45hae8,"US Border Patrol finds 10-year-old boy walking alone in Texas desert.",0,https://v.redd.it/a9qz87sg9i9c1,0.96,484,1703973990,2023-12-30T10:06:30+0000
2023-12-31T02,18ur40g,52,2612,PublicFreakout,2yrq6,"US Border Patrol finds 10-year-old boy walking alone in Texas desert.",0,https://v.redd.it/2sz1l8x79i9c1,0.95,401,1703973929,2023-12-30T10:05:29+0000
2023-12-31T02,18ur3el,16,5073,todayilearned,2qqjc,"TIL The US navy has its own army which in turn has its own air force. The US Marine Corps Aviation is the the fifth largest air force in the world.",0,https://en.wikipedia.org/wiki/United_States_Marine_Corps_Aviation,0.93,622,1703973891,2023-12-30T10:04:51+0000
2023-12-31T02,18uquv2,76,2171,geometrydash,304br,"Breaking news: Robtop just announced on Twitter that he will be reverting the game back to 2.11 because the community couldn't behave",0,https://i.redd.it/vrscnghc7i9c1.png,0.96,113,1703973281,2023-12-30T09:54:41+0000
2023-12-31T02,18uqb9k,60,2756,PoliticalHumor,2qm21,"Freedom 2024",0,https://i.redd.it/dm0b5ze43i9c1.jpeg,0.93,142,1703971839,2023-12-30T09:30:39+0000
2023-12-31T02,18uq0rg,12,6524,mildlyinteresting,2ti4h,"This book, sold to me as ‘New’ from Amazon, had an invoice inside showing it had been previously sold to someone else, 13 years ago.",0,https://i.redd.it/zd1trtts0i9c1.jpeg,0.96,305,1703971060,2023-12-30T09:17:40+0000
2023-12-31T02,18upwxk,2,11900,BlackPeopleTwitter,33x33,"Drip so hard the court became a slipping hazard",0,https://i.redd.it/ljz3klmyzh9c1.jpeg,0.94,680,1703970775,2023-12-30T09:12:55+0000
2023-12-31T02,18upw83,53,3163,starterpacks,34o9s,"Playing the opposite gender in a YouTube comedy sketch - Starter Pack",0,https://i.redd.it/k2bm30sqzh9c1.png,0.97,33,1703970724,2023-12-30T09:12:04+0000
2023-12-31T02,18uptvt,34,4103,cats,2qhta,"At a restaurant in Morocco, this cat really thought she was a customer",0,https://i.redd.it/g4l6d6dazh9c1.jpeg,0.98,79,1703970555,2023-12-30T09:09:15+0000
2023-12-31T02,18upqml,66,4334,MadeMeSmile,2uqcm,"The way the baby looks and listens to her mom. ",0,https://v.redd.it/gsz8u16lyh9c1,0.99,80,1703970318,2023-12-30T09:05:18+0000
2023-12-31T02,18upkhk,55,4875,politics,2cneq,"Maine Secretary of State Shenna Bellows's house swatted after Trump ballot decision",0,https://www.washingtonexaminer.com/news/maine-secretary-of-state-house-swatted,0.96,342,1703969908,2023-12-30T08:58:28+0000
2023-12-31T02,18upire,56,3211,gaming,2qh03,"I'm sorry, but is this a joke?!! Also Rock & Stone!",0,https://i.redd.it/gc3bnlrtwh9c1.jpeg,0.93,316,1703969782,2023-12-30T08:56:22+0000
2023-12-31T02,18upi9k,45,3552,mildlyinfuriating,2ubgg,"Brand new $300 microwave from Amazon came full of crusty old food",0,https://www.reddit.com/gallery/18upi9k,0.96,529,1703969748,2023-12-30T08:55:48+0000
2023-12-31T02,18upgyk,87,3771,technicallythetruth,3pzez,"Harry potter is a jock",0,https://i.redd.it/h4bnexdlwh9c1.png,0.99,70,1703969653,2023-12-30T08:54:13+0000
2023-12-31T02,18up8ru,1,19480,Damnthatsinteresting,2xxyj,"The grandson of the 10th U.S. president (born 1790) is still alive in 2023",0,https://i.redd.it/j64648ktuh9c1.jpeg,0.95,803,1703969045,2023-12-30T08:44:05+0000
2023-12-31T02,18up2yv,7,10543,SipsTea,5tdqj0,"I want to love my job like this guy 😂👏",0,https://v.redd.it/igcoxb8ith9c1,0.95,105,1703968617,2023-12-30T08:36:57+0000
2023-12-31T02,18up1np,4,13660,tattoos,2qj9g,"My fiancee got me a coverup for Christmas. Super happy with the result.",0,https://www.reddit.com/gallery/18up1np,0.93,465,1703968519,2023-12-30T08:35:19+0000
2023-12-31T02,18up0f4,26,6826,memes,2qjpg,"Any guesses what 2024 will bring?",0,https://i.redd.it/ky7nyvuwsh9c1.jpeg,0.93,1080,1703968430,2023-12-30T08:33:50+0000
2023-12-31T02,18uouv0,15,7501,TikTokCringe,mvcq5,"There's a trend in Africa TikTok about making fun of unsanitary Indian street food videos",0,https://v.redd.it/jy6tr5mmrh9c1,0.92,1065,1703968022,2023-12-30T08:27:02+0000
2023-12-31T02,18uor59,88,3026,rareinsults,48t85,"If offended scroll down you'll be OK I promise",0,https://i.redd.it/qs3p76uyqh9c1.jpeg,0.69,601,1703967750,2023-12-30T08:22:30+0000
2023-12-31T02,18uolyy,8,11687,Eyebleach,2s427,"The cat , saved from the wreckage, does not leave her rescuer ( Turkey )",0,https://i.imgur.com/hz6cCtJ.gifv,0.97,183,1703967385,2023-12-30T08:16:25+0000
2023-12-31T02,18uolce,99,2382,DOG,2qiy5,"Let's get a husky, he won't break anything they said lmao",0,https://v.redd.it/5k97w1ioph9c1,0.97,87,1703967338,2023-12-30T08:15:38+0000
2023-12-31T02,18uokiv,85,2672,TrueOffMyChest,2yuqy,"His gift is sitting under my tree",1,https://www.reddit.com/r/TrueOffMyChest/comments/18uokiv/his_gift_is_sitting_under_my_tree/,0.97,177,1703967286,2023-12-30T08:14:46+0000
2023-12-31T02,18uojsf,13,11786,PrequelMemes,3i60n,"One can only hope🥹",0,https://v.redd.it/ersvw3efph9c1,0.89,377,1703967232,2023-12-30T08:13:52+0000
2023-12-31T02,18uoj3y,46,4204,Unexpected,2w67q,"Even her teeth were in shock!",0,https://v.redd.it/jsz8sjx9ph9c1,0.9,242,1703967184,2023-12-30T08:13:04+0000
2023-12-31T02,18uoflj,14,8753,interestingasfuck,2qhsa,"Milking an Easter diamond back rattlesnake, The most venomous snake in North America.",0,https://v.redd.it/rb55txjioh9c1,0.95,812,1703966925,2023-12-30T08:08:45+0000
2023-12-31T02,18uoeal,10,9687,WorkReform,5qpzgw,"$20,700,000,000,000",0,https://i.redd.it/7otmxdg8oh9c1.jpeg,0.93,596,1703966831,2023-12-30T08:07:11+0000
2023-12-31T02,18uobgt,89,2704,popculturechat,5rj68d,"The year is 2009. This is what award shows look like.",0,https://www.reddit.com/gallery/18uobgt,0.94,344,1703966628,2023-12-30T08:03:48+0000
2023-12-31T02,18uo9xw,64,12903,facepalm,2r5rp,"I have no words",0,https://i.redd.it/pkmvq1panh9c1.jpeg,0.92,1677,1703966516,2023-12-30T08:01:56+0000
2023-12-31T02,18uo9mb,92,2655,IdiotsInCars,3aimx,"Why does this keep happening to me?[oc]",0,https://v.redd.it/6jh9o7s7nh9c1,0.97,272,1703966493,2023-12-30T08:01:33+0000
2023-12-31T02,18uo4nd,6,13659,AbsoluteUnits,a7wuv,"Absolutely big Shawama",0,https://v.redd.it/wllpn575mh9c1,0.94,981,1703966131,2023-12-30T07:55:31+0000
2023-12-31T02,18uo2j1,44,4471,malelivingspace,2v70p,"Newly single at 28, rented an old crackhouse apartment on impulse. This is my dingy but cozy 1930s tenement.",0,https://www.reddit.com/gallery/18uo2j1,0.96,519,1703965976,2023-12-30T07:52:56+0000
2023-12-31T02,18uo1eb,23,8444,me_irlgbt,3apfn,"Me⚽⚾IRLGBT",0,https://i.redd.it/jt3nj3b7lh9c1.png,0.9,166,1703965890,2023-12-30T07:51:30+0000
2023-12-31T02,18uo17a,73,3274,amazonprime,2u7hc,"You people are crazy for canceling Prime!",1,https://www.reddit.com/r/amazonprime/comments/18uo17a/you_people_are_crazy_for_canceling_prime/,0.91,466,1703965875,2023-12-30T07:51:15+0000
2023-12-31T02,18unzz6,62,3711,ShermanPosting,11dpd1,"But… mUh hOsToRy! mUh hUrRiTaGe!!!”",0,https://v.redd.it/p2xlijf5lh9c1,0.89,91,1703965794,2023-12-30T07:49:54+0000
2023-12-31T02,18unz6b,97,2606,terriblefacebookmemes,2tja6,"I've seen this one posted so many times today for some reason",0,https://i.redd.it/2zzhe81zkh9c1.png,0.93,207,1703965735,2023-12-30T07:48:55+0000
2023-12-31T02,18unwef,9,15718,facepalm,2r5rp,"Do people.. actually think like this?!",0,https://i.redd.it/qa3tgh3dkh9c1.jpeg,0.91,4598,1703965537,2023-12-30T07:45:37+0000
2023-12-31T02,18untx7,80,3050,technology,2qh16,"As Bobby Kotick leaves Microsoft and Activision for good, an ex-employee describes how he once threatened to ""have an employee killed""",0,https://www.windowscentral.com/gaming/xbox/bobby-kotick-leaves-microsoft-and-activision,0.95,171,1703965362,2023-12-30T07:42:42+0000
2023-12-31T02,18unr5w,40,4896,worldnews,2qh13,"Russia has deployed battalion of Ukrainian prisoners of war to frontlines",0,https://www.ukrinform.net/rubric-ato/3806689-russia-has-deployed-battalion-of-ukrainian-prisoners-of-war-to-frontline-isw.html,0.95,629,1703965174,2023-12-30T07:39:34+0000
2023-12-31T02,18unqwd,30,6326,funny,2qh33,"Remember Y2K?",0,https://i.redd.it/xdgr0719jh9c1.jpeg,0.93,426,1703965155,2023-12-30T07:39:15+0000
2023-12-31T02,18unqth,17,10504,technicallythetruth,3pzez,"Dad jokes for the win",0,https://i.redd.it/ydm874z7jh9c1.png,0.94,52,1703965149,2023-12-30T07:39:09+0000
2023-12-31T02,18uno47,95,4583,PrequelMemes,3i60n,"The pros and cons of going into exile.",0,https://v.redd.it/izb50cckih9c1,0.99,29,1703964946,2023-12-30T07:35:46+0000
2023-12-31T02,18unk1c,18,8410,politics,2cneq,"Putin 'Actively Hoping' to Get Donald Trump Back as President: Ret. General",0,https://www.newsweek.com/putin-hoping-get-donald-trump-back-president-barry-mccaffrey-1856697,0.94,599,1703964657,2023-12-30T07:30:57+0000
2023-12-31T02,18uncnd,63,8859,memes,2qjpg,"The world has gone crazy",0,https://i.redd.it/wj0d9i97gh9c1.jpeg,0.94,429,1703964129,2023-12-30T07:22:09+0000
2023-12-31T02,18un65b,5,32447,MadeMeSmile,2uqcm,"Sew much love",0,https://v.redd.it/agvg8jhteh9c1,0.95,984,1703963676,2023-12-30T07:14:36+0000
2023-12-31T02,18umweg,32,9271,shitposting,2usxq,"Uno reverse?",0,https://v.redd.it/ydnccf2rch9c1,0.93,93,1703962971,2023-12-30T07:02:51+0000
2023-12-31T02,18umqo8,28,8867,tumblr,2r7hk,"Error: 404",0,https://i.redd.it/rudurugkbh9c1.jpeg,0.96,140,1703962572,2023-12-30T06:56:12+0000
2023-12-31T02,18umm9u,20,10341,europe,2qh4j,"Minister of Foreign Affairs of the Czech Republic",0,https://i.redd.it/8vis25flah9c1.png,0.94,349,1703962250,2023-12-30T06:50:50+0000
2023-12-31T02,18um94e,65,4697,KidsAreFuckingStupid,3948y,"This could've ended way worse",0,https://v.redd.it/sz9is46r7h9c1,0.9,238,1703961289,2023-12-30T06:34:49+0000
2023-12-31T02,18um3mu,69,4757,ExplainTheJoke,2vmj2,"I dont get it? People Said dont Google but i dont even know How to…",0,https://i.redd.it/latspihk6h9c1.jpeg,0.91,147,1703960890,2023-12-30T06:28:10+0000
2023-12-31T02,18um34h,71,7406,WhitePeopleTwitter,35n7t,"Trouble in paradise",0,https://i.redd.it/h76c1zxf6h9c1.jpeg,0.97,261,1703960850,2023-12-30T06:27:30+0000
2023-12-31T02,18um2xk,49,7165,cursedcomments,hw1ju,Cursed_sandwich,0,https://i.redd.it/7qcjvsme6h9c1.jpeg,0.97,121,1703960836,2023-12-30T06:27:16+0000
2023-12-31T02,18um2xd,81,3960,coolguides,310rm,"A Cool Guide To The Most Popular Video Game Console In Each State",0,https://i.redd.it/dbi0hr8b6h9c1.png,0.92,293,1703960836,2023-12-30T06:27:16+0000
2023-12-31T02,18ulq8k,50,6312,blackmagicfuckery,3fn31,"Water bending ",0,https://v.redd.it/q77oj88p3h9c1,0.9,208,1703959928,2023-12-30T06:12:08+0000
2023-12-31T02,18ulpum,83,6906,MurderedByWords,3hx3r,"If i can't get the benefits, No one should.",0,https://i.redd.it/3ojs698s5g9c1.jpeg,0.96,166,1703959900,2023-12-30T06:11:40+0000
2023-12-31T02,18ulmwr,79,4203,OldSchoolCool,2tycb,"My husband, 2nd grade 1991",0,https://i.redd.it/15l62gs03h9c1.jpeg,0.93,589,1703959697,2023-12-30T06:08:17+0000
2023-12-31T02,18ulk8n,43,6965,therewasanattempt,39ne7,"To set a whole new standard of reporting",0,https://www.reddit.com/gallery/18ulk8n,0.88,730,1703959504,2023-12-30T06:05:04+0000
2023-12-31T02,18ulj4r,57,6679,whenthe,23gidu,Peakcess,0,https://v.redd.it/wk8zk7qt0h9c1,0.96,49,1703959422,2023-12-30T06:03:42+0000
2023-12-31T02,18ule9v,74,5722,dankmemes,2zmfe,"U.S. anti-asian hate crimes",0,https://i.redd.it/67sywe8pvg9c1.png,0.93,420,1703959084,2023-12-30T05:58:04+0000
2023-12-31T02,18uldf8,41,7313,oddlysatisfying,2x93b,"Gift wrapping in a Japanese rice cracker shop",0,https://v.redd.it/bu0d28mz0h9c1,0.96,104,1703959016,2023-12-30T05:56:56+0000
2023-12-31T02,18ul8vi,86,4429,SpidermanPS4,3f1fs,NAH,0,https://i.redd.it/paus4gyyzg9c1.jpeg,0.96,103,1703958671,2023-12-30T05:51:11+0000
2023-12-31T02,18ul7g6,70,5312,maybemaybemaybe,38e1l,"Maybe maybe maybe",0,https://v.redd.it/9j8xp1dmzg9c1,0.93,160,1703958566,2023-12-30T05:49:26+0000
2023-12-31T02,18ukyla,29,25206,pics,2qh0u,"Indian Famine under British rule, which killed 5mil people. Man guards his family from cannibals.",0,https://i.redd.it/acihihcqxg9c1.png,0.76,3723,1703957919,2023-12-30T05:38:39+0000
2023-12-31T02,18ukske,100,7745,mildlyinfuriating,2ubgg,"I work for one of the biggest companies in the world, this was my Christmas ‘bonus’",0,https://i.redd.it/xa2086vdwg9c1.jpeg,0.86,2064,1703957464,2023-12-30T05:31:04+0000
2023-12-31T02,18uksje,24,12840,gifs,2qt55,"Icy Road Problems.",0,https://i.imgur.com/ZgekBRC.gifv,0.96,1267,1703957462,2023-12-30T05:31:02+0000
2023-12-31T02,18ukroa,38,9809,wholesomememes,3gcwj,"Kittens also make me happy ❤️",0,https://i.redd.it/ckaxrc8ivg9c1.jpeg,0.97,65,1703957405,2023-12-30T05:30:05+0000
2023-12-31T02,18ukony,51,7798,Awww,2suml,"It hurts so much. 😭",0,https://v.redd.it/yjcby07fvg9c1,0.95,186,1703957180,2023-12-30T05:26:20+0000
2023-12-31T02,18ukloo,90,4790,marvelmemes,35mye,"The more you know",0,https://i.redd.it/qscgloosug9c1.jpeg,0.96,114,1703956964,2023-12-30T05:22:44+0000
2023-12-31T02,18ukhi4,59,6517,news,2qh3l,"Woman sues dentist over visit she says included 4 root canals, 8 crowns, 20 fillings",0,https://www.cnn.com/2023/12/27/us/minnesota-dentist-dr-kevin-molldrem/index.html,0.93,767,1703956659,2023-12-30T05:17:39+0000
2023-12-31T02,18ukhag,93,4698,CuratedTumblr,3x5kfw,"stupid customers and frivolous lawsuits",0,https://i.redd.it/thse1x8xtg9c1.jpeg,0.95,202,1703956639,2023-12-30T05:17:19+0000
2023-12-31T02,18ukh6p,72,9482,nba,2qo4s,"[Wojnarowski] The Toronto Raptors are finalizing a trade to send OG Anunoby to the New York Knicks for a package including RJ Barrett, Immanuel Quickley and draft considerations, sources tell ESPN.",0,https://x.com/wojespn/status/1741146251532603871?s=46&t=bsTHbtMSqHXbNGi0vWP8hw,0.95,2498,1703956632,2023-12-30T05:17:12+0000
2023-12-31T02,18uke9t,75,5225,movies,2qh3s,"Full Monty actor Tom Wilkinson dies aged 75",0,https://www.theguardian.com/film/2023/dec/30/full-monty-actor-tom-wilkinson-dies-aged-75?CMP=Share_AndroidApp_Other,0.94,582,1703956413,2023-12-30T05:13:33+0000
2023-12-31T02,18ukc0v,54,19737,Damnthatsinteresting,2xxyj,"Rug shaving,  certain rugs are hand finished this way for a smooth feel",0,https://v.redd.it/2i1bnluqsg9c1,0.92,425,1703956241,2023-12-30T05:10:41+0000
2023-12-31T02,18ujv3b,27,16705,CozyPlaces,34ixl,"Winter Part II, Northern New England",0,https://i.redd.it/kxucsfw5pg9c1.jpeg,0.96,315,1703955046,2023-12-30T04:50:46+0000
2023-12-31T02,18ujruo,68,6674,JustGuysBeingDudes,33rtj6,"Equal souls",0,https://v.redd.it/v564ajngog9c1,0.95,105,1703954810,2023-12-30T04:46:50+0000
2023-12-31T02,18ujocx,35,12496,MurderedByWords,3hx3r,"Yeah, but you can't trust the government",0,https://i.redd.it/al59cb4nng9c1.jpeg,0.94,580,1703954554,2023-12-30T04:42:34+0000
2023-12-31T02,18ujnu8,48,8757,WTF,2qh61,"Men’s retreat at James River Church in Springfield, MO",0,https://v.redd.it/8uie883kng9c1,0.93,1691,1703954513,2023-12-30T04:41:53+0000
2023-12-31T02,18ujdwg,42,11686,MapPorn,2si92,"US counties without a single Black or African American person. Source: 2020 United States census",0,https://i.redd.it/iqp48ta4lg9c1.png,0.93,1160,1703953771,2023-12-30T04:29:31+0000
2023-12-31T02,18uirhe,61,8760,LeopardsAteMyFace,3jp3p,"Shock as Ben Shapiro's racist friends are racist not only towards other people, but towards him.",0,https://i.redd.it/9vlvvu8agg9c1.png,0.91,600,1703952078,2023-12-30T04:01:18+0000
2023-12-31T02,18uii9b,47,13134,FunnyAnimals,2st2l,"The cat is just accepting it 🤣",0,https://v.redd.it/640h2s8aeg9c1,0.97,309,1703951380,2023-12-30T03:49:40+0000
2023-12-31T02,18uic1o,33,18351,WhitePeopleTwitter,35n7t,"Seriously, Republicans, you don't look like the sane people here",0,https://i.redd.it/yzpdk42ucg9c1.png,0.93,651,1703950890,2023-12-30T03:41:30+0000
2023-12-31T02,18uhxlc,82,7524,aww,2qh1o,"Looking after my parents' dog and my cat is not impressed with our visitor",0,https://i.redd.it/dnemqhye9g9c1.jpeg,0.98,112,1703949741,2023-12-30T03:22:21+0000
2023-12-31T02,18uhrnr,94,8418,oddlyterrifying,2yo6b,"Uncomfortable but fascinating how the brain works",0,https://v.redd.it/6eccac018g9c1,0.94,328,1703949278,2023-12-30T03:14:38+0000
2023-12-31T02,18uhcca,77,15874,PeterExplainsTheJoke,121h8r,Peetah,0,https://i.redd.it/kxo05v6i4g9c1.jpeg,0.87,349,1703948090,2023-12-30T02:54:50+0000
2023-12-31T02,18ug2d6,58,25789,holdmycatnip,2zhxd,"That escalated quickly",0,https://v.redd.it/56utfxnzsf9c1,0.96,289,1703944219,2023-12-30T01:50:19+0000
2023-12-31T02,18ufpsd,67,21483,GlowUps,ruinb,"Homeless Fentanyl Addict➡️3 Years Clean",0,https://www.reddit.com/gallery/18ufpsd,0.95,851,1703943101,2023-12-30T01:31:41+0000
2023-12-31T02,18uei9c,98,15297,nottheonion,2qnts,"Sacred Stones Worshipped For Generations In India Turn Out To Be Dinosaur Eggs",0,https://inshort.geartape.com/sacred-stones-worshipped-for-generations-in-india-turn-out-to-be-dinosaur-eggs/,0.96,529,1703938924,2023-12-30T12:22:04+0000
