date,id,position,score,subreddit_display_name,subreddit_id,title,is_self,url,upvote_ratio,num_comments,created,created_date
2024-01-03T05,18x9d6x,20,2451,nottheonion,2qnts,"Burger King Employee Who Went 27 Years Without Missing a Day of Work Buys First Home Thanks to Donations",0,https://inshort.geartape.com/burger-king-employee-who-went-27-years-without-missing-a-day-of-work-buys-first-home-thanks-to-donations/,0.97,130,1704253003,2024-01-03T03:36:43+0000
2024-01-03T05,18x867c,9,3929,pokemon,2qmeb,"Seems accurate",0,https://i.redd.it/zi3s0qgt05ac1.jpeg,0.98,121,1704249521,2024-01-03T02:38:41+0000
2024-01-03T05,18x7lrn,34,2464,pics,2qh0u,"My Husband knows I'm not a fan of gemstones, so he got me this ring for Christmas...",0,https://www.reddit.com/gallery/18x7lrn,0.96,182,1704247927,2024-01-03T02:12:07+0000
2024-01-03T05,18x7gwi,51,2045,cyberpunkgame,3az7x,"The difference between CDPR and Bethesda...",0,https://i.redd.it/rhm0dkgwu4ac1.jpeg,0.91,157,1704247556,2024-01-03T02:05:56+0000
2024-01-03T05,18x7c4u,84,1364,TwoXChromosomes,2r2jt,"I have grocery shopped, organized food and made dinner every night for 12 years,",1,https://www.reddit.com/r/TwoXChromosomes/comments/18x7c4u/i_have_grocery_shopped_organized_food_and_made/,0.94,143,1704247212,2024-01-03T02:00:12+0000
2024-01-03T05,18x71eu,100,1267,shittyfoodporn,2u1if,"Everything I’ve eaten since my girlfriend went home for the week.",0,https://www.reddit.com/gallery/18x71eu,0.89,536,1704246384,2024-01-03T01:46:24+0000
2024-01-03T05,18x6xxz,86,1423,anime_irl,386zh,anime_irl,0,https://v.redd.it/ip6sfpieq4ac1,0.96,35,1704246113,2024-01-03T01:41:53+0000
2024-01-03T05,18x6spo,63,1897,movies,2qh3s,"Steven Yeun Exits Marvel’s ‘Thunderbolts’",0,https://www.hollywoodreporter.com/movies/movie-news/steven-yeun-will-not-star-marvel-thunderbolts-1235777860/,0.95,370,1704245717,2024-01-03T01:35:17+0000
2024-01-03T05,18x6nsh,22,3460,holdmycatnip,2zhxd,"Inspecting the new kitty ",0,https://v.redd.it/hyyiwljdo4ac1,0.98,70,1704245346,2024-01-03T01:29:06+0000
2024-01-03T05,18x6htm,16,4378,wallstreetbets,2th52,"'Rich Dad, Poor Dad's' Robert Kiyosaki Says He's $1.2 Billion In Debt Because 'If I Go Bust, The Bank Goes Bust. Not My Problem'",0,https://finance.yahoo.com/news/rich-dad-poor-dads-robert-193714809.html,0.95,683,1704244893,2024-01-03T01:21:33+0000
2024-01-03T05,18x6hja,4,5742,worldnews,2qh13,"Scientists have confirmed 2023 was the hottest year on record.",0,https://www.abc.net.au/news/2023-12-08/2023-hottest-year-on-record/103205324,0.94,540,1704244870,2024-01-03T01:21:10+0000
2024-01-03T05,18x6grs,5,5463,LeopardsAteMyFace,3jp3p,"JUST IN: Fox News Sees Worst Ratings In Nearly A Decade In 2023",0,https://trendingpoliticsnews.com/just-in-fox-news-sees-worst-ratings-in-nearly-a-decade-in-2023-mace/,0.96,313,1704244817,2024-01-03T01:20:17+0000
2024-01-03T05,18x6d2z,43,2488,BlackPeopleTwitter,33x33,"There’s something so primal about this choice especially when you’re out walking",0,https://i.redd.it/yntbrz20m4ac1.jpeg,0.97,209,1704244539,2024-01-03T01:15:39+0000
2024-01-03T05,18x6d2j,44,2509,aww,2qh1o,"Rescued this little guy 2 months ago on a cold night. Pics from the night he was found and then last night.",0,https://www.reddit.com/gallery/18x6d2j,0.99,47,1704244539,2024-01-03T01:15:39+0000
2024-01-03T05,18x62h5,1,11361,MadeMeSmile,2uqcm,"50 Cent is awesome ❤️",0,https://v.redd.it/nenrb6fkj4ac1,0.95,311,1704243720,2024-01-03T01:02:00+0000
2024-01-03T05,18x5p5z,35,3222,CuratedTumblr,3x5kfw,"This is for the girls, the gays, and Coleman",0,https://www.reddit.com/gallery/18x5p5z,0.97,85,1704242749,2024-01-03T12:45:49+0000
2024-01-03T05,18x5p4l,13,5284,todayilearned,2qqjc,"TIL that during the first moon landing, according to the schedule, the astronauts were SUPPOSED to sleep for a few hours first, keeping the entire world waiting, but they could not sleep and asked to go ahead of schedule and leave the lander early.",0,https://www.scienceandmediamuseum.org.uk/objects-and-stories/moon-to-living-room-apollo-11-broadcast,0.98,120,1704242747,2024-01-03T12:45:47+0000
2024-01-03T05,18x5p3b,93,1581,JusticeServed,2vxxc,"Kim Davis ordered to pay additional $260K to gay couple she denied a marriage license to",0,https://deadstate.org/kim-davis-ordered-to-pay-additional-260k-to-gay-couple-she-denied-a-marriage-license-to/,0.93,30,1704242744,2024-01-03T12:45:44+0000
2024-01-03T05,18x5d9m,21,4097,popculturechat,5rj68d,"Jimmy Kimmel Threatens Legal Action Against Aaron Rodgers for Epstein List Claim",0,https://i.redd.it/rkl5cj54e4ac1.jpeg,0.94,424,1704241886,2024-01-03T12:31:26+0000
2024-01-03T05,18x5bbw,12,5523,Fauxmoi,2rqcm8,"Jimmy Kimmel responds to Quarterback Aaron Rodgers suggesting that he will be on the Epstein list",0,https://i.redd.it/k937mnbqd4ac1.jpeg,0.94,528,1704241756,2024-01-03T12:29:16+0000
2024-01-03T05,18x50dx,27,4030,AITAH,446kys,"AITA For Telling My Daughter if She Keeps Her Pregnancy I’m Kicking Her Out",1,https://www.reddit.com/r/AITAH/comments/18x50dx/aita_for_telling_my_daughter_if_she_keeps_her/,0.91,1657,1704240984,2024-01-03T12:16:24+0000
2024-01-03T05,18x4s3j,37,3533,clevercomebacks,dyqlw,"Why in the world is this a thing people believe",0,https://i.imgur.com/sgUp4VC.jpg,0.97,45,1704240393,2024-01-03T12:06:33+0000
2024-01-03T05,18x4r3s,2,11219,facepalm,2r5rp,"How ""facepalm"" is this lol",0,https://i.redd.it/ry7n5eqe94ac1.jpeg,0.95,513,1704240323,2024-01-03T12:05:23+0000
2024-01-03T05,18x4nnl,92,1876,discordVideos,2cxozx,"Coming soon to Japan",0,https://v.redd.it/k8ct69sj84ac1,0.97,66,1704240081,2024-01-03T12:01:21+0000
2024-01-03T05,18x4ep0,3,11721,nflcirclejerk,2sulf,"Jimmy Kimmel Response to Aaron Rodgers🤣",0,https://i.redd.it/4uj8360w64ac1.jpeg,0.91,1518,1704239456,2024-01-02T11:50:56+0000
2024-01-03T05,18x41j0,40,3581,SnapshotHistory,7o6ere,"Nicholas Winton helped 669 Jewish children escape the Nazis. His efforts went unrecognised for 50 years. Then, in 1998, while sitting as a member of a TV audience, he suddenly found himself surrounded by the kids he had rescued, who were now adults.",0,https://v.redd.it/2kxakfy644ac1,0.94,150,1704238550,2024-01-02T11:35:50+0000
2024-01-03T05,18x3ujg,72,2439,redditonwiki,6uf899,"Sad/wholesome reading for y'all.",0,https://i.redd.it/75u7dw7r24ac1.jpeg,0.95,97,1704238066,2024-01-02T11:27:46+0000
2024-01-03T05,18x3iyp,45,3680,chaoticgood,2qjo5,"All cops? Idk..",0,https://i.redd.it/9bt0kh2b04ac1.png,0.95,36,1704237246,2024-01-02T11:14:06+0000
2024-01-03T05,18x3c3y,7,11087,tumblr,2r7hk,"a typo",0,https://i.redd.it/baot1woty3ac1.png,0.95,58,1704236760,2024-01-02T11:06:00+0000
2024-01-03T05,18x39ws,17,6651,mildlyinteresting,2ti4h,"Monopoly games on sale 60% off, excluding all Monopoly games",0,https://i.redd.it/l6w5gqsey3ac1.jpeg,0.93,567,1704236605,2024-01-02T11:03:25+0000
2024-01-03T05,18x31xd,54,3395,IASIP,2s28b,"The Most Quoted Scene In Always Sunny History, Now Legofied!!! Enjoy!! lol 😂🤣",0,https://v.redd.it/zskrcankw3ac1,0.96,89,1704236061,2024-01-02T10:54:21+0000
2024-01-03T05,18x31p6,47,3700,atheism,2qh2p,"Former Kentucky County Clerk Kim Davis Ordered To Pay $260,000 To Lawyers Of Gay Couple She Discriminated Against For Her Bigoted Religious Beliefs. She has to pay $100,000 to them as well.",0,https://www.joemygod.com/2024/01/anti-gay-former-kentucky-county-clerk-kim-davis-ordered-to-pay-260000-in-legal-fees-to-attorneys/,0.96,137,1704236044,2024-01-02T10:54:04+0000
2024-01-03T05,18x3120,80,2536,cats,2qhta,"How cute is my moms cat",0,https://i.redd.it/r3x5qjnlw3ac1.jpeg,0.98,73,1704235996,2024-01-02T10:53:16+0000
2024-01-03T05,18x2w4f,53,3510,nba,2qo4s,"LaMarcus Aldridge on Kawhi’s conflict with Greg Popovich: “Kawhi also didn’t want to do Pop’s learning stuff. He just wanted to hoop. Not everyone wants to learn about what’s in Africa or learn the maps”",0,https://streamable.com/p5jwc3,0.95,1064,1704235653,2024-01-02T10:47:33+0000
2024-01-03T05,18x2l06,8,10043,FunnyAnimals,2st2l,"Dog bullies owner into playing piano so he can sing",0,https://v.redd.it/yf2vrqe5t3ac1,0.96,259,1704234907,2024-01-02T10:35:07+0000
2024-01-03T05,18x28so,28,6076,PeterExplainsTheJoke,121h8r,"TBH, I read this so many times and I still dont get it",0,https://i.redd.it/eob3w5ptq3ac1.png,0.9,211,1704234057,2024-01-02T10:20:57+0000
2024-01-03T05,18x28rz,36,5152,wholesomememes,3gcwj,"Kindness that makes you look great!",0,https://i.redd.it/bsrwmu1rq3ac1.png,0.98,35,1704234056,2024-01-02T10:20:56+0000
2024-01-03T05,18x232l,15,8782,WhitePeopleTwitter,35n7t,"Starting off the year right.",0,https://i.redd.it/fwbsswwpp3ac1.png,0.97,254,1704233688,2024-01-02T10:14:48+0000
2024-01-03T05,18x1y3w,97,2532,Chadtopia,2eji6w,"based af woman doesnt give racism baiter the answer he wants",0,https://v.redd.it/3l83bf8ro3ac1,0.94,62,1704233361,2024-01-02T10:09:21+0000
2024-01-03T05,18x1uko,52,4177,PoliticalHumor,2qm21,"Worst argument ever.",0,https://i.redd.it/0qvmrc72o3ac1.jpeg,0.96,107,1704233129,2024-01-02T10:05:29+0000
2024-01-03T05,18x1ujf,26,6429,interestingasfuck,2qhsa,"Training a raven",0,https://v.redd.it/r3074et0o3ac1,0.96,135,1704233126,2024-01-02T10:05:26+0000
2024-01-03T05,18x1rgh,30,6125,meirl,2s5ti,Meirl,0,https://i.redd.it/qw57svyhn3ac1.png,0.98,83,1704232936,2024-01-02T10:02:16+0000
2024-01-03T05,18x1qu5,23,7128,AskReddit,2qh1i,"What’s the adult version of being picked last in gym class?",1,https://www.reddit.com/r/AskReddit/comments/18x1qu5/whats_the_adult_version_of_being_picked_last_in/,0.95,3446,1704232898,2024-01-02T10:01:38+0000
2024-01-03T05,18x1msk,85,3014,lies,2qloj,"This is fully legal ",0,https://v.redd.it/4sq5fja8m3ac1,0.95,87,1704232643,2024-01-02T09:57:23+0000
2024-01-03T05,18x1lfb,61,3901,politics,2cneq,"Bernie Sanders Calls On Congress To Reject Unconditional Military Aid To Israel",0,https://themessenger.com/politics/bernie-sanders-calls-on-congress-to-reject-unconditional-military-aid-to-israel,0.94,324,1704232550,2024-01-02T09:55:50+0000
2024-01-03T05,18x1fqy,69,3354,Economics,2qh1s,"Americans Are Canceling More of Their Streaming Services",0,https://www.wsj.com/business/media/americans-are-canceling-more-of-their-streaming-services-fb9284c8,0.97,512,1704232182,2024-01-02T09:49:42+0000
2024-01-03T05,18x1ark,39,6112,technicallythetruth,3pzez,"This is very improbable but still possible",0,https://i.redd.it/iaq7paj9k3ac1.jpeg,0.95,216,1704231847,2024-01-02T09:44:07+0000
2024-01-03T05,18x16p9,33,7196,dankmemes,2zmfe,"Served on the rocks",0,https://i.redd.it/ahlx7w8gj3ac1.gif,0.96,62,1704231581,2024-01-02T09:39:41+0000
2024-01-03T05,18x14am,79,3236,sports,2qgzy,"16-year-old Luke Littler is in the final of the World Darts Championship",0,https://v.redd.it/ec8mjjqhi3ac1,0.91,399,1704231423,2024-01-02T09:37:03+0000
2024-01-03T05,18x13lv,99,2847,reddeadredemption,2rn7o,"I found this in my dad's old stuff... I'm literally shaking crying rn what do I do?",0,https://i.redd.it/kpmwjibvi3ac1.jpeg,0.91,288,1704231380,2024-01-02T09:36:20+0000
2024-01-03T05,18x1205,58,4366,PublicFreakout,2yrq6,"Customer at the mall wants a refund. Cashier isn’t having it. ",0,https://v.redd.it/rl1e43bii3ac1,0.93,639,1704231277,2024-01-02T09:34:37+0000
2024-01-03T05,18x11ym,10,13676,Wellthatsucks,2xcv7,"Just went to replace my air filter…",0,https://i.redd.it/buzh1zeji3ac1.jpeg,0.93,709,1704231274,2024-01-02T09:34:34+0000
2024-01-03T05,18x0pdj,75,3581,interiordecorating,2t8dh,"Mirror help!",0,https://www.reddit.com/gallery/18x0pdj,0.92,1893,1704230443,2024-01-02T09:20:43+0000
2024-01-03T05,18x0jvl,78,3663,KidsAreFuckingStupid,3948y,"Socially conscious kid",0,https://v.redd.it/677k7p1oe3ac1,0.88,197,1704230081,2024-01-02T09:14:41+0000
2024-01-03T05,18x0ggm,18,12678,SipsTea,5tdqj0,"The gravity of his situation",0,https://v.redd.it/g8w4v0z8e3ac1,0.91,228,1704229847,2024-01-02T09:10:47+0000
2024-01-03T05,18x0dsj,14,15661,funny,2qh33,"Ruined a Woman’s Birthday…",0,https://v.redd.it/v8p0zf8sd3ac1,0.86,308,1704229670,2024-01-02T09:07:50+0000
2024-01-03T05,18x06qd,60,4631,TheWayWeWere,2tp0t,"grandpa’s photos from the dorms freshmen year at Purdue University 1956",0,https://www.reddit.com/gallery/18x06qd,0.97,218,1704229209,2024-01-02T09:00:09+0000
2024-01-03T05,18x04ru,31,7363,technology,2qh16,"Since Elon Musk’s Twitter purchase, firm reportedly lost 72% of its value",0,https://arstechnica.com/tech-policy/2024/01/since-elon-musks-twitter-purchase-firm-reportedly-lost-72-of-its-value/,0.9,949,1704229073,2024-01-02T08:57:53+0000
2024-01-03T05,18x0421,48,6083,pcmasterrace,2sgp1,"Should've won best disappointment",0,https://v.redd.it/5uu2cx4tb3ac1,0.89,477,1704229022,2024-01-02T08:57:02+0000
2024-01-03T05,18x01aa,66,4786,MapPorn,2si92,"If you had to leave your country, where would you move if you could choose.",0,https://i.redd.it/15hrbehbb3ac1.jpeg,0.88,1080,1704228839,2024-01-02T08:53:59+0000
2024-01-03T05,18x00c2,59,5338,shittymoviedetails,3mj3w,"people love to poke fun hollywood casting, this is just another example of- wait- wait what do you mean this is real?",0,https://i.redd.it/9j9q2w5za3ac1.png,0.94,296,1704228774,2024-01-02T08:52:54+0000
2024-01-03T05,18wzv0g,41,7585,HolUp,qir9n,"Officer, I promise it's not meth",0,https://i.redd.it/d0c5blx2a3ac1.jpeg,0.97,232,1704228422,2024-01-02T08:47:02+0000
2024-01-03T05,18wzps2,83,3972,oddlyterrifying,2yo6b,"I woke up to find blood; both inside and outside my back door",0,https://www.reddit.com/gallery/18wzps2,0.96,344,1704228081,2024-01-02T08:41:21+0000
2024-01-03T05,18wzpev,19,12154,Futurology,2t7no,"China Is Pressing Women to Have More Babies. Many Are Saying No. - The population, now around 1.4 billion, is likely to drop to around half a billion by 2100—and women are being blamed",0,https://www.wsj.com/articles/china-population-births-decline-womens-rights-5af9937b,0.91,1896,1704228057,2024-01-02T08:40:57+0000
2024-01-03T05,18wzn3i,95,3482,2meirl4meirl,3ee85,2meirl4meirl,0,https://i.redd.it/hsh095zh83ac1.jpeg,0.96,94,1704227901,2024-01-02T08:38:21+0000
2024-01-03T05,18wzm85,74,4576,PrequelMemes,3i60n,"The one true tier list",0,https://i.redd.it/22b2zsk383ac1.png,0.9,167,1704227840,2024-01-02T08:37:20+0000
2024-01-03T05,18wzlew,90,3752,foundsatan,r681a,"Imagine if you could teleport",0,https://i.redd.it/9ed14vl683ac1.jpeg,0.96,31,1704227784,2024-01-02T08:36:24+0000
2024-01-03T05,18wzj50,6,30718,Damnthatsinteresting,2xxyj,"Arsenio Hall asks Muhammad Ali and Mike Tyson who would have won if they both fought each other in their prime (1989)",0,https://v.redd.it/25ysvswa73ac1,0.95,1012,1704227626,2024-01-02T08:33:46+0000
2024-01-03T05,18wz57s,42,6647,NewsOfTheStupid,2tpr6,"Trump’s odd Jan. 6 defense: It was the Russian interference. After years of mocking intel that showed Russia meddled, now his defense cites it.",0,https://www.mercurynews.com/2024/01/02/trumps-odd-jan-6-defense-it-was-the-russian-interference/,0.95,278,1704226708,2024-01-02T08:18:28+0000
2024-01-03T05,18wz4nc,76,4388,ContagiousLaughter,2u2bh,"Bro’s neck hit recline so fast 😭",0,https://v.redd.it/qqgzij1t43ac1,0.93,164,1704226666,2024-01-02T08:17:46+0000
2024-01-03T05,18wz1rc,96,8087,todayilearned,2qqjc,"TIL of ""Palilalia,"" a condition in which some people repeat their own words to themselves, usually although not always under their breath.",0,https://www.ahaparenting.com/read/palilalia-child-whispers-and-repeats-under-his-breath,0.96,756,1704226474,2024-01-02T08:14:34+0000
2024-01-03T05,18wyudo,70,5776,shitposting,2usxq,"Tf2 > any other fps",0,https://v.redd.it/gv5bd5oo23ac1,0.96,217,1704225983,2024-01-02T08:06:23+0000
2024-01-03T05,18wypwb,25,12564,OldSchoolCool,2tycb,"The Obamas on their wedding day-1992",0,https://i.redd.it/iemvp1av13ac1.jpeg,0.85,641,1704225690,2024-01-02T08:01:30+0000
2024-01-03T05,18wyj7n,55,6905,therewasanattempt,39ne7,"to steal copper",0,https://v.redd.it/utafs37j03ac1,0.97,510,1704225277,2024-01-02T07:54:37+0000
2024-01-03T05,18wyizq,11,25734,news,2qh3l,"Kim Davis must pay $260,000 legal fees over same-sex marriage license refusal",0,https://www.theguardian.com/us-news/2024/jan/02/kim-davis-lawyers-fees-same-sex-marriage-kentucky,0.93,1100,1704225262,2024-01-02T07:54:22+0000
2024-01-03T05,18wybl2,29,23393,memes,2qjpg,"No easy option here",0,https://i.redd.it/hiioyu47z2ac1.jpeg,0.87,1665,1704224763,2024-01-02T07:46:03+0000
2024-01-03T05,18wy7gq,24,14731,TheMajorityReport,36goq,"Green Day: “Fuck you, Donald Trump!”",0,https://v.redd.it/ufufkgcdy2ac1,0.86,1139,1704224485,2024-01-02T07:41:25+0000
2024-01-03T05,18wxq47,77,17873,tumblr,2r7hk,"to me, he’s the main character",0,https://i.redd.it/sxsx7aqxu2ac1.jpeg,0.93,120,1704223329,2024-01-02T07:22:09+0000
2024-01-03T05,18wxoxi,67,23779,facepalm,2r5rp,"They are turning the fricking lions gay...",0,https://i.redd.it/k7tzspiju2ac1.png,0.94,406,1704223252,2024-01-02T07:20:52+0000
2024-01-03T05,18wxbfe,82,7123,TikTokCringe,mvcq5,"Just leave ",0,https://v.redd.it/lqrzqyc0s2ac1,0.72,2573,1704222350,2024-01-02T07:05:50+0000
2024-01-03T05,18wx13p,46,11669,me_irl,2vegg,me_irl,0,https://i.redd.it/91f2npqzp2ac1.png,0.97,113,1704221674,2024-01-02T06:54:34+0000
2024-01-03T05,18wx0dk,64,9642,maybemaybemaybe,38e1l,"Maybe maybe maybe",0,https://v.redd.it/osxqcenup2ac1,0.83,865,1704221623,2024-01-02T06:53:43+0000
2024-01-03T05,18wwm1r,91,5713,Satisfyingasfuck,31s00,"satisfied with the car",0,https://v.redd.it/7qwwhxnwm2ac1,0.91,325,1704220661,2024-01-02T06:37:41+0000
2024-01-03T05,18wwlwu,94,5509,Showerthoughts,2szyo,"You forget how much force it takes to walk until you walk into a wall",1,https://www.reddit.com/r/Showerthoughts/comments/18wwlwu/you_forget_how_much_force_it_takes_to_walk_until/,0.96,227,1704220652,2024-01-02T06:37:32+0000
2024-01-03T05,18wwhhj,88,6380,Animemes,2w6fe,"Already messed up, here’s to next year",0,https://i.redd.it/0ciigwp3m2ac1.jpeg,0.95,119,1704220358,2024-01-02T06:32:38+0000
2024-01-03T05,18wwd75,71,7385,egg_irl,3n3op,"Egg✝️irl",0,https://i.redd.it/yj7mps47l2ac1.jpeg,0.9,131,1704220084,2024-01-02T06:28:04+0000
2024-01-03T05,18wwazl,89,20000,MadeMeSmile,2uqcm,"Dog gets sad watching Lion King ",0,https://v.redd.it/ex5w0sstk2ac1,0.95,397,1704219933,2024-01-02T06:25:33+0000
2024-01-03T05,18ww1hs,73,24621,WhitePeopleTwitter,35n7t,"Yes, BIDEN did that.",0,https://i.redd.it/c3m81yzwi2ac1.png,0.95,614,1704219295,2024-01-02T06:14:55+0000
2024-01-03T05,18wvv66,81,8326,whenthe,23gidu,"Public domain is good Public domain is good Public domain is good Public domain is good Public domain is good Public domain is good Public domain is good Public domain is good",0,https://v.redd.it/7g6fq0rmh2ac1,0.95,176,1704218866,2024-01-02T06:07:46+0000
2024-01-03T05,18wvu4w,57,11021,BaldursGate3,12967t,"Perception check but the Dark Urge is a ✨BARD✨ by 예이헴yayhem",0,https://v.redd.it/8znvbzkwg2ac1,0.94,204,1704218796,2024-01-02T06:06:36+0000
2024-01-03T05,18wvs1z,32,31522,mildlyinfuriating,2ubgg,"My friend won an eBay bid (to go collect the item) and this was the response he got…",0,https://i.redd.it/q8t2yyo2h2ac1.jpeg,0.92,1281,1704218668,2024-01-02T06:04:28+0000
2024-01-03T05,18wvrqm,49,11978,WorkReform,5qpzgw,"We don't hate working. We hate working for *you*",0,https://i.redd.it/6c5j5feyg2ac1.jpeg,0.94,235,1704218646,2024-01-02T06:04:06+0000
2024-01-03T05,18wvrqk,50,18162,Steam,2qwis,"And the Winners Are:",0,https://i.redd.it/85z3t1yxg2ac1.png,0.88,3663,1704218645,2024-01-02T06:04:05+0000
2024-01-03T05,18wujr7,62,14610,me_irlgbt,3apfn,"me🐭irlgbt",0,https://i.redd.it/79xomqw982ac1.jpeg,0.88,157,1704215738,2024-01-02T05:15:38+0000
2024-01-03T05,18wuhr0,87,8648,BikiniBottomTwitter,3deqz,"Dear Gen Z and Alpha, I have a humble request",0,https://i.redd.it/kxe3074y72ac1.png,0.92,392,1704215601,2024-01-02T05:13:21+0000
2024-01-03T05,18wucrq,68,11314,antiwork,2y77d,"Found this floating on the interwebs...",0,https://i.redd.it/05rxlomu62ac1.png,0.96,79,1704215263,2024-01-02T05:07:43+0000
2024-01-03T05,18wuc1r,38,37007,HumansBeingBros,2xh58,"Boxer encouraging opponent he defeated",0,https://v.redd.it/ok7yl5ss62ac1,0.93,743,1704215215,2024-01-02T05:06:55+0000
2024-01-03T05,18wu5n6,56,16488,DOG,2qiy5,"1 year ago vs now: some things will never change",0,https://v.redd.it/9re4gcki52ac1,0.97,160,1704214803,2024-01-02T05:00:03+0000
2024-01-03T05,18wrz6s,98,13940,ExplainTheJoke,2vmj2,"Absolutely lost on this one…",0,https://i.redd.it/brkzhet4p1ac1.jpeg,0.92,601,1704209271,2024-01-02T03:27:51+0000
2024-01-03T05,18wrs66,65,33022,oddlysatisfying,2x93b,"Sunflower oil extraction",0,https://v.redd.it/wm3iu4obn1ac1,0.95,680,1704208755,2024-01-02T03:19:15+0000
