date,id,position,score,subreddit_display_name,subreddit_id,title,is_self,url,upvote_ratio,num_comments,created,created_date
2024-01-02T21,18wxq47,29,2725,tumblr,2r7hk,"to me, he’s the main character",0,https://i.redd.it/sxsx7aqxu2ac1.jpeg,0.97,18,1704223329,2024-01-02T07:22:09+0000
2024-01-02T21,18wx4tm,26,2863,nba,2qo4s,"[Almanza] Chet Holmgren was asked what he thinks he’s proven so far. His response? “I haven’t proven shit. I’ve played 30 games.”",0,https://x.com/calmanza1007/status/1742234779955659015?s=46&t=Jp46n6K9dJePGT6DcRc9IA,0.98,230,1704221933,2024-01-02T06:58:53+0000
2024-01-02T21,18wx4fb,93,1318,movies,2qh3s,"Jack Black Joins 'Minecraft' Movie at Warner Bros",0,https://deadline.com/2024/01/minecraft-jack-black-1235693816/,0.91,153,1704221906,2024-01-02T06:58:26+0000
2024-01-02T21,18wwry1,78,1682,AskReddit,2qh1i,"What's the most mind-blowing fact you've ever learned that made you question everything you thought you knew?",1,https://www.reddit.com/r/AskReddit/comments/18wwry1/whats_the_most_mindblowing_fact_youve_ever/,0.95,1731,1704221059,2024-01-02T06:44:19+0000
2024-01-02T21,18ww8o9,79,3831,gaming,2qh03,"This is satire, right?",0,https://i.redd.it/xh45rfedk2ac1.jpeg,0.91,456,1704219777,2024-01-02T06:22:57+0000
2024-01-02T21,18ww0xu,59,2151,CuratedTumblr,3x5kfw,culture,0,https://i.redd.it/j8rpoiiti2ac1.png,0.96,278,1704219254,2024-01-02T06:14:14+0000
2024-01-02T21,18wvu4w,31,3164,BaldursGate3,12967t,"Perception check but the Dark Urge is a ✨BARD✨ by 예이헴yayhem",0,https://v.redd.it/8znvbzkwg2ac1,0.96,60,1704218796,2024-01-02T06:06:36+0000
2024-01-02T21,18wvs1z,2,8825,mildlyinfuriating,2ubgg,"My friend won an eBay bid (to go collect the item) and this was the response he got…",0,https://i.redd.it/q8t2yyo2h2ac1.jpeg,0.96,358,1704218668,2024-01-02T06:04:28+0000
2024-01-02T21,18wvrqm,53,2418,WorkReform,5qpzgw,"We don't hate working. We hate working for *you*",0,https://i.redd.it/6c5j5feyg2ac1.jpeg,0.96,44,1704218646,2024-01-02T06:04:06+0000
2024-01-02T21,18wvrqk,10,5665,Steam,2qwis,"And the Winners Are:",0,https://i.redd.it/85z3t1yxg2ac1.png,0.93,1562,1704218645,2024-01-02T06:04:05+0000
2024-01-02T21,18wv1l6,61,2285,CrazyFuckingVideos,45hae8,"Two Guys are interviewed about the worst consequences of the ""subject""",0,https://v.redd.it/uo0zsav3b2ac1,0.95,385,1704216946,2024-01-02T05:35:46+0000
2024-01-02T21,18wuxom,41,2937,whatismycookiecutter,7j5zwe,"I thought I knew whatmycookiecutter was…",0,https://i.redd.it/0t9nwnk6b2ac1.jpeg,0.94,157,1704216686,2024-01-02T05:31:26+0000
2024-01-02T21,18wutqm,92,3886,therewasanattempt,39ne7,"to get justice for a 13 year old schoolgirl",0,https://i.redd.it/2eiqi9tba2ac1.png,0.92,238,1704216421,2024-01-02T05:27:01+0000
2024-01-02T21,18wurfw,96,4053,me_irl,2vegg,"Me irl",0,https://i.redd.it/cx7ub5rx92ac1.jpeg,0.94,246,1704216268,2024-01-02T05:24:28+0000
2024-01-02T21,18wuos5,83,1931,PublicFreakout,2yrq6,"Imagine Being Under Her 🤢🤮",0,https://v.redd.it/3l3uwx1j82ac1,0.92,250,1704216083,2024-01-02T05:21:23+0000
2024-01-02T21,18wujr7,12,5542,me_irlgbt,3apfn,"me🐭irlgbt",0,https://i.redd.it/79xomqw982ac1.jpeg,0.92,59,1704215738,2024-01-02T05:15:38+0000
2024-01-02T21,18wuj9r,80,2018,LeopardsAteMyFace,3jp3p,"Party who cultivated a rabid unhinged base now in fear for their lives from their base",0,https://i.redd.it/5527uk3a82ac1.jpeg,0.96,76,1704215710,2024-01-02T05:15:10+0000
2024-01-02T21,18wuhr0,71,2231,BikiniBottomTwitter,3deqz,"Dear Gen Z and Alpha, I have a humble request",0,https://i.redd.it/kxe3074y72ac1.png,0.95,115,1704215601,2024-01-02T05:13:21+0000
2024-01-02T21,18wud5j,21,4507,Money,2qjmw,"Freshman in high school",0,https://i.redd.it/vcxu78h172ac1.jpeg,0.91,224,1704215293,2024-01-02T05:08:13+0000
2024-01-02T21,18wucrq,94,3965,antiwork,2y77d,"Found this floating on the interwebs...",0,https://i.redd.it/05rxlomu62ac1.png,0.98,43,1704215263,2024-01-02T05:07:43+0000
2024-01-02T21,18wuc1r,1,18460,HumansBeingBros,2xh58,"Boxer encouraging opponent he defeated",0,https://v.redd.it/ok7yl5ss62ac1,0.96,495,1704215215,2024-01-02T05:06:55+0000
2024-01-02T21,18wu48g,23,4727,clevercomebacks,dyqlw,"No one can troll Indians online anymore",0,https://i.redd.it/nmb0ht7b52ac1.jpeg,0.9,542,1704214714,2024-01-02T04:58:34+0000
2024-01-02T21,18wtu93,49,8172,Damnthatsinteresting,2xxyj,"Planet of the apes without CGI",0,https://v.redd.it/oir4yvf932ac1,0.98,182,1704214030,2024-01-02T04:47:10+0000
2024-01-02T21,18wttsd,15,6159,theydidthemath,2x23b,"[Request] How long would it take to watch every video?",0,https://i.redd.it/xm51w2y632ac1.png,0.94,106,1704213999,2024-01-02T04:46:39+0000
2024-01-02T21,18wtc2h,13,6470,therewasanattempt,39ne7,"to never surrender",0,https://i.imgur.com/X6CE7A0.gifv,0.93,315,1704212746,2024-01-02T04:25:46+0000
2024-01-02T21,18wt9tc,95,2058,wizardposting,5hjlp1,"I feel like a god",0,https://i.redd.it/69s3iprzy1ac1.jpeg,0.98,50,1704212588,2024-01-02T04:23:08+0000
2024-01-02T21,18wt277,17,5775,gaming,2qh03,"Xbox Issues One Year Ban To Baldur's Gate 3 Player For Capturing Gameplay Clips",0,https://gameinfinitus.com/news/xbox-one-year-ban-baldurs-gate-3-player/,0.95,603,1704212060,2024-01-02T04:14:20+0000
2024-01-02T21,18wt185,90,2118,KidsAreFuckingStupid,3948y,"A Never-Ending Story",0,https://v.redd.it/jaxry2u2x1ac1,0.95,58,1704211992,2024-01-02T04:13:12+0000
2024-01-02T21,18wt0ry,70,2704,UkraineWarVideoReport,5wjmo8,"HIMARS with two direct hits destroys the rare and newest artillery reconnaissance complex 1K148 ""Yastreb-AV"" of the Russian Armed Forces worth about $250 million.",0,https://v.redd.it/0jcaxmw4x1ac1,0.96,310,1704211962,2024-01-02T04:12:42+0000
2024-01-02T21,18wt0bt,20,5524,todayilearned,2qqjc,"TIL 20th US president, James Garfield, didn't want to be a candidate. When he got his first votes, he challenged it by saying without his consent, he should not be receiving votes, but he was dismissed. After winning the nomination, Garfield looked ""pale as death"". He was assassinated a year later",0,https://en.wikipedia.org/wiki/1880_Republican_National_Convention#Balloting,0.98,175,1704211932,2024-01-02T04:12:12+0000
2024-01-02T21,18wsx21,16,5871,politics,2cneq,"Donald Trump Flights on Jeffrey Epstein's 'Lolita Express'—What We Know",0,https://www.newsweek.com/donald-trump-flights-jeffrey-epstein-jet-lolita-express-1857109,0.96,528,1704211712,2024-01-02T04:08:32+0000
2024-01-02T21,18wst0r,50,3751,wholesomememes,3gcwj,"Thanks to that, you have the motivation to start pursuing her. And now she has become your wife",0,https://i.redd.it/u4fvbl6bv1ac1.jpeg,0.99,22,1704211429,2024-01-02T04:03:49+0000
2024-01-02T21,18wssb7,57,3449,nextfuckinglevel,m0bnr,"Not selling their plot and home, despite immense pressure",0,https://v.redd.it/5l51bad0v1ac1,0.84,417,1704211378,2024-01-02T04:02:58+0000
2024-01-02T21,18wskyo,86,6947,HolUp,qir9n,"We want justice",0,https://i.redd.it/t0fuvehut1ac1.jpeg,0.99,81,1704210856,2024-01-02T03:54:16+0000
2024-01-02T21,18wsig3,68,7408,MadeMeSmile,2uqcm,"Restroom Attendant",0,https://i.redd.it/2p0fab7at1ac1.jpeg,0.98,62,1704210670,2024-01-02T03:51:10+0000
2024-01-02T21,18wshtd,3,15403,antiwork,2y77d,"First day forced back to the office after 4 years of wfh and management left us gift bags on our desks with this pen inside",0,https://i.redd.it/2cf6x8k5t1ac1.jpeg,0.95,837,1704210624,2024-01-02T03:50:24+0000
2024-01-02T21,18wsfal,63,3474,whenthe,23gidu,"should've bought a decent holster",0,https://v.redd.it/5eokkzlgs1ac1,0.95,139,1704210437,2024-01-02T03:47:17+0000
2024-01-02T21,18ws8fw,43,4139,TikTokCringe,mvcq5,"David Guetta tries to bring the people together ",0,https://v.redd.it/y02jm3m4r1ac1,0.94,289,1704209942,2024-01-02T03:39:02+0000
2024-01-02T21,18ws55b,89,2429,Millennials,2rc4u,"With any luck these numbers will ease in the coming New Year!",0,https://i.redd.it/avvzx6ieq1ac1.jpeg,0.91,611,1704209698,2024-01-02T03:34:58+0000
2024-01-02T21,18ws2ut,85,2728,Funnymemes,2xqtc,"💀",0,https://i.redd.it/m0soc40wp1ac1.jpeg,0.97,413,1704209527,2024-01-02T03:32:07+0000
2024-01-02T21,18wrz6s,18,7442,ExplainTheJoke,2vmj2,"Absolutely lost on this one…",0,https://i.redd.it/brkzhet4p1ac1.jpeg,0.93,325,1704209271,2024-01-02T03:27:51+0000
2024-01-02T21,18wry1r,66,3289,videos,2qh1e,"The Town of St. John held ANOTHER unauthorized meeting without 48 hours of notice, and declared the previous one to be legal.... Because the attorney says so.",0,https://www.youtube.com/live/TIGPsWZljNk?si=ncGkJ0mAjef69KPI,0.92,403,1704209187,2024-01-02T03:26:27+0000
2024-01-02T21,18wrw2f,42,5148,memes,2qjpg,"Sex sells",0,https://i.redd.it/do1igzndo1ac1.jpeg,0.93,253,1704209043,2024-01-02T03:24:03+0000
2024-01-02T21,18wrs66,6,15533,oddlysatisfying,2x93b,"Sunflower oil extraction",0,https://v.redd.it/wm3iu4obn1ac1,0.97,413,1704208755,2024-01-02T03:19:15+0000
2024-01-02T21,18wrr1j,48,4177,worldnews,2qh13,"2,000 petrol pumps run dry in western and northern India as truck drivers strike against new hit-and-run law",0,https://www.businesstoday.in/latest/in-focus/story/2000-petrol-pumps-run-dry-in-western-and-northern-india-as-truck-drivers-strike-against-new-hit-and-run-law-411621-2024-01-02,0.95,473,1704208671,2024-01-02T03:17:51+0000
2024-01-02T21,18wrpnz,56,3931,Satisfyingasfuck,31s00,"Satisfying Pressure Washing Video",0,https://v.redd.it/ymbxg50km1ac1,0.95,181,1704208563,2024-01-02T03:16:03+0000
2024-01-02T21,18wro5k,11,11762,MadeMeSmile,2uqcm,"True happiness",0,https://v.redd.it/h01eheunm1ac1,0.94,320,1704208449,2024-01-02T03:14:09+0000
2024-01-02T21,18wrj09,51,4273,nottheonion,2qnts,"Passengers attempt to celebrate NYE twice on time traveling flight but land in wrong year",0,https://www.fox13news.com/news/united-celebrate-nye-twice-time-traveling-flight-hawaii-guam-wrong-year,0.95,109,1704208057,2024-01-02T03:07:37+0000
2024-01-02T21,18wrgcm,25,6628,mildlyinteresting,2ti4h,"My coffee cup is edible.",0,https://i.redd.it/3z2k78nwk1ac1.jpeg,0.95,513,1704207850,2024-01-02T03:04:10+0000
2024-01-02T21,18wrgb4,40,5062,europe,2qh4j,"Finland (and Sweden) are freezing in minus 40C",0,https://i.redd.it/6sz6zqyvk1ac1.jpeg,0.97,504,1704207847,2024-01-02T03:04:07+0000
2024-01-02T21,18wre0e,91,2639,OldSchoolCool,2tycb,"American burlesque artist and actress Betty Rowland, 1940.",0,https://i.redd.it/b1e13cdek1ac1.jpeg,0.96,85,1704207679,2024-01-02T03:01:19+0000
2024-01-02T21,18wrdmv,5,24390,pics,2qh0u,"One of the greatest photos ever taken as an act of defiance.",0,https://i.redd.it/avy1rrzbk1ac1.jpeg,0.87,1407,1704207656,2024-01-02T03:00:56+0000
2024-01-02T21,18wrcph,75,3223,CrappyDesign,2sa3m,"You just had to design the reset button in the exact shape and anticipated location of a USB slot.",0,https://i.redd.it/h6af9ic5k1ac1.png,0.95,117,1704207599,2024-01-02T02:59:59+0000
2024-01-02T21,18wrcbx,72,3267,FunnyandSad,2z7qd,"Capitalism and workers",0,https://i.redd.it/pzl6jvtxj1ac1.jpeg,0.96,86,1704207566,2024-01-02T02:59:26+0000
2024-01-02T21,18wrbu6,81,3084,BrandNewSentence,mbn0j,"This is fucked up on so many levels.",0,https://i.redd.it/pmm98mqxj1ac1.png,0.94,298,1704207524,2024-01-02T02:58:44+0000
2024-01-02T21,18wr8cc,97,2772,starwarsmemes,2wzm6,Best,0,https://i.redd.it/xs59l0cyi1ac1.jpeg,0.97,59,1704207253,2024-01-02T02:54:13+0000
2024-01-02T21,18wr7zm,52,4749,mathmemes,3fz4c,"The optimal known packing of 16 equal squares into a larger square",0,https://i.redd.it/73wolghui1ac1.png,0.91,208,1704207222,2024-01-02T02:53:42+0000
2024-01-02T21,18wr6x9,28,6157,comics,2qh0s,"""One ring to rule theHEY. HEY. STOP. NO""",0,https://i.redd.it/fxob4rsfi1ac1.png,0.97,26,1704207137,2024-01-02T02:52:17+0000
2024-01-02T21,18wr280,64,3866,GlowUps,ruinb,"M/36/6’4” 285lbs to 205lbs 6 month progress",0,https://i.redd.it/dpkku11qh1ac1.jpeg,0.96,289,1704206778,2024-01-02T02:46:18+0000
2024-01-02T21,18wqyv6,8,21701,HolUp,qir9n,"Best trick",0,https://i.redd.it/ixwro5oyg1ac1.jpeg,0.97,334,1704206524,2024-01-02T02:42:04+0000
2024-01-02T21,18wqyaq,4,22062,news,2qh3l,"Value of X has fallen 71% since purchase by Musk and name change from Twitter",0,https://www.theguardian.com/technology/2024/jan/02/x-twitter-stock-falls-elon-musk,0.92,2098,1704206480,2024-01-02T02:41:20+0000
2024-01-02T21,18wqxj1,36,6133,IdiotsInCars,3aimx,"Got rear ended while stopped in traffic [oc]",0,https://v.redd.it/j8rmb6omg1ac1,0.92,490,1704206423,2024-01-02T02:40:23+0000
2024-01-02T21,18wqx4j,46,5024,oddlyspecific,2wjlc,"Sounds pretty normal to me.",0,https://i.redd.it/lbkki8pkg1ac1.jpeg,0.93,354,1704206392,2024-01-02T02:39:52+0000
2024-01-02T21,18wqutp,7,18838,Damnthatsinteresting,2xxyj,"China's birth rate has collapsed completely. 19.7m births were registered in 2012, compared to 7.8m births in 2023, which marks a 60% decline in just 11 years. Unprecedented for any country in peacetime.",0,https://i.redd.it/gs2mtqawf1ac1.png,0.94,2293,1704206206,2024-01-02T02:36:46+0000
2024-01-02T21,18wqhcq,74,3825,rareinsults,48t85,"10/10 for the burn",0,https://i.imgur.com/awZYUfT.jpg,0.96,15,1704205171,2024-01-02T02:19:31+0000
2024-01-02T21,18wqfsk,76,3794,suicidebywords,3on1q,"Perfect answer",0,https://i.redd.it/i3t73slec1ac1.jpeg,0.95,39,1704205038,2024-01-02T02:17:18+0000
2024-01-02T21,18wqf63,67,4377,PeterExplainsTheJoke,121h8r,"what...? am i going crazy",0,https://i.redd.it/z4v0w29ec1ac1.jpeg,0.9,817,1704204987,2024-01-02T02:16:27+0000
2024-01-02T21,18wqbrc,22,10913,shitposting,2usxq,"When they ask proof of your imaginary girlfriend",0,https://v.redd.it/r893vn2jb1ac1,0.97,101,1704204703,2024-01-02T02:11:43+0000
2024-01-02T21,18wq8qv,77,3858,formuladank,3ndbi,"Did you know that, in November 2022, Lewis Hamilton posted a video of him driving a Nissan Skyline R34 on the Tokyo Expressway that caused a lot of controversies? For more information google Lewis Hamilton R34.",0,https://i.redd.it/4cm25y4ua1ac1.jpeg,0.93,82,1704204463,2024-01-02T02:07:43+0000
2024-01-02T21,18wpzll,9,19392,interestingasfuck,2qhsa,"A whole baby woolly mammoth was found frozen in the permafrost of north-western Canada - the first such discovery in N. America. The mummified ice age mammoth is thought to be more than 30,000 years old!",0,https://i.redd.it/ozvgtdkq81ac1.jpeg,0.97,614,1704203759,2024-01-02T01:55:59+0000
2024-01-02T21,18wpuuu,55,5269,PoliticalHumor,2qm21,"We're just asking questions, like where's Melania?",0,https://i.redd.it/cyj1xr3l71ac1.jpeg,0.94,340,1704203378,2024-01-02T01:49:38+0000
2024-01-02T21,18wpuhi,100,3364,mapporncirclejerk,2wxxs,"Who would win in this hypothetical war?",0,https://i.redd.it/607dxhti71ac1.jpeg,0.95,199,1704203349,2024-01-02T01:49:09+0000
2024-01-02T21,18wpu5p,44,7050,MinecraftMemes,2sq0h,"Build different",0,https://i.redd.it/qsgjo1of71ac1.jpeg,0.93,86,1704203320,2024-01-02T01:48:40+0000
2024-01-02T21,18wprs9,34,8396,NonPoliticalTwitter,39gt6y,"Which one are y'all taking?",0,https://i.redd.it/1ymreq3v61ac1.jpeg,0.94,400,1704203128,2024-01-02T01:45:28+0000
2024-01-02T21,18wpjo1,69,4787,adventuretime,2s54g,"This is how it happened no one can convince me otherwise",0,https://i.redd.it/hddq3les41ac1.png,0.96,100,1704202447,2024-01-02T01:34:07+0000
2024-01-02T21,18wphgz,82,4083,JustGuysBeingDudes,33rtj6,"Love how their mood changes",0,https://v.redd.it/rd1uvts941ac1,0.91,46,1704202261,2024-01-02T01:31:01+0000
2024-01-02T21,18wpgzl,99,8091,news,2qh3l,"Intruder breaks into building of Colorado Supreme Court, allegedly fires shots and is arrested",0,https://www.cbsnews.com/colorado/news/intruder-colorado-supreme-court-building-fires-shots-arrested-denver/,0.96,579,1704202225,2024-01-02T01:30:25+0000
2024-01-02T21,18wpdot,54,6405,Awww,2suml,"Results beyond expectations.",0,https://v.redd.it/h9a4ynug21ac1,0.9,139,1704201949,2024-01-02T01:25:49+0000
2024-01-02T21,18wpcr7,33,9627,wholesome,2z9ds,"A couple makes this cute video for their wedding",0,https://v.redd.it/9pjf8x5331ac1,0.87,198,1704201874,2024-01-02T01:24:34+0000
2024-01-02T21,18wpa48,98,3637,abandoned,2qicm,"Huge Abandoned $30,000,000 Mansion",0,https://www.reddit.com/gallery/18wpa48,0.96,309,1704201642,2024-01-02T01:20:42+0000
2024-01-02T21,18wp3y7,19,17759,me_irl,2vegg,Me_irl,0,https://i.redd.it/x0s0tzcv01ac1.png,0.95,485,1704201119,2024-01-02T01:11:59+0000
2024-01-02T21,18wop6d,47,7844,cats,2qhta,"Why is my cat so small? She just turned 2 yrs old in September. Monster can (500ml can) for size comparison",0,https://i.redd.it/w8dgqle1x0ac1.jpeg,0.96,1006,1704199824,2024-01-02T12:50:24+0000
2024-01-02T21,18wojvz,14,27752,facepalm,2r5rp,"Who'd have thought",0,https://i.redd.it/58x4y2bhv0ac1.png,0.9,2587,1704199329,2024-01-02T12:42:09+0000
2024-01-02T21,18wojt5,27,10908,BlackPeopleTwitter,33x33,"Blacks Rule!!1",0,https://i.redd.it/9maxpqqjv0ac1.png,0.93,150,1704199321,2024-01-02T12:42:01+0000
2024-01-02T21,18woclh,65,6228,reddeadredemption,2rn7o,"""You know what?"" QuickDraw in Red Dead Redemption 2",0,https://v.redd.it/660ec5bft0ac1,0.96,277,1704198632,2024-01-02T12:30:32+0000
2024-01-02T21,18wo7rd,60,8379,technicallythetruth,3pzez,"And dad jokes are the best",0,https://i.redd.it/3wfleog4s0ac1.jpeg,0.93,26,1704198180,2024-01-02T12:23:00+0000
2024-01-02T21,18wo5ja,39,9651,NoStupidQuestions,2w844,"Why have I never encountered a “Native American” style restaurant?",1,https://www.reddit.com/r/NoStupidQuestions/comments/18wo5ja/why_have_i_never_encountered_a_native_american/,0.93,3443,1704197981,2024-01-02T12:19:41+0000
2024-01-02T21,18wo2pt,32,13173,ImTheMainCharacter,4c4j2u,"Kinda made the video better",0,https://v.redd.it/6rsqm010c0ac1,0.91,1120,1704197710,2024-01-02T12:15:10+0000
2024-01-02T21,18wo19v,24,16567,BeAmazed,363r3,"That is remarkable",0,https://i.redd.it/6za8i6d8q0ac1.jpeg,0.95,352,1704197567,2024-01-02T12:12:47+0000
2024-01-02T21,18wnt6y,88,5438,Eldenring,122hf1,"I cannot thank dexerto enough for this article 🥹🥹🥹",0,https://i.redd.it/ugkj8is2o0ac1.jpeg,0.96,321,1704196810,2024-01-02T12:00:10+0000
2024-01-02T21,18wnozz,37,10870,CozyPlaces,34ixl,"New 1920s-inspired sunroom on our 1927 home in Detroit.",0,https://www.reddit.com/gallery/18wnozz,0.96,257,1704196386,2024-01-02T11:53:06+0000
2024-01-02T21,18wnj2x,38,12289,2meirl4meirl,3ee85,2meirl4meirl,0,https://i.redd.it/7nqv2k8xk0ac1.jpeg,0.96,178,1704195753,2024-01-02T11:42:33+0000
2024-01-02T21,18wnh2g,87,17863,politics,2cneq,"Trump paid me to find voter fraud. Then he lied after I found 2020 election wasn't stolen.",0,https://www.usatoday.com/story/opinion/2024/01/02/trump-lies-voter-fraud-2020-impact-2024-election/72057016007/,0.92,778,1704195546,2024-01-02T11:39:06+0000
2024-01-02T21,18wnczc,73,7169,ProgrammerHumor,2tex6,whereIsDbGone,0,https://i.redd.it/l039lib0j0ac1.jpeg,0.95,124,1704195104,2024-01-02T11:31:44+0000
2024-01-02T21,18wn6d4,30,21354,funny,2qh33,"There will always be someone stronger than you.",0,https://v.redd.it/u3hzqi1yg0ac1,0.9,256,1704194413,2024-01-02T11:20:13+0000
2024-01-02T21,18wmqfw,35,27777,meirl,2s5ti,Meirl,0,https://i.redd.it/k7dzkfbzb0ac1.jpeg,0.93,1959,1704192746,2024-01-02T10:52:26+0000
2024-01-02T21,18wmkqp,84,8291,Gamingcirclejerk,2sf2b,"Genshin Impact (2020)",0,https://i.redd.it/bbpjuoz6a0ac1.jpeg,0.92,381,1704192140,2024-01-02T10:42:20+0000
2024-01-02T21,18wlusk,45,18982,WhitePeopleTwitter,35n7t,Currently....,0,https://i.redd.it/6sh090ms10ac1.jpeg,0.95,422,1704189315,2024-01-02T09:55:15+0000
2024-01-02T21,18wltkm,58,22554,funnyvideos,2qoos,"Yo, you got a fucking problem?! ",0,https://v.redd.it/jpboff3d10ac1,0.9,296,1704189172,2024-01-02T09:52:52+0000
2024-01-02T21,18wl41n,62,19543,pcmasterrace,2sgp1,"Thanks I guess?",0,https://www.reddit.com/gallery/18wl41n,0.97,209,1704186230,2024-01-02T09:03:50+0000
