date,id,position,score,subreddit_display_name,subreddit_id,title,is_self,url,upvote_ratio,num_comments,created,created_date
2024-01-05T02,18ytt49,58,1280,nba,2qo4s,"[Highlight] Wemby throws off the backboard and slams it!",0,https://streamable.com/22kd99,0.98,174,1704416944,2024-01-05T01:09:04+0000
2024-01-05T02,18ysh1t,28,2313,nottheonion,2qnts,"Florida venue cancels Marjorie Taylor Greene event after learning of its Jan. 6 focus",0,https://www.nbcnews.com/politics/politics-news/florida-venue-cancels-marjorie-taylor-greene-jan-6-event-rcna132365,0.96,106,1704413450,2024-01-05T12:10:50+0000
2024-01-05T02,18ysczr,82,1214,LivestreamFail,38jf0,"Emily gets mistaken for a crackhead",0,https://clips.twitch.tv/StupidExquisiteEggDancingBaby-2JVQv7x5rZ2uxwzg,0.93,120,1704413160,2024-01-05T12:06:00+0000
2024-01-05T02,18ys1bz,31,2270,todayilearned,2qqjc,"TIL: The USA doesnt use A4 or other A series paper sizes, but instead their own standard, ""Letter"", ""Legal"" and ""Tabloid""",0,"https://www.swiftpublisher.com/useful-articles/paper-sizes-and-formats-explained#:~:text=The%20most%20commonly%20used%20ISO,8.5%20in%20%C3%97%2014%20in).",0.91,468,1704412367,2024-01-04T11:52:47+0000
2024-01-05T02,18yrbr2,54,4031,funny,2qh33,"""It's mine meow""",0,https://v.redd.it/jmvm0cuobiac1,0.98,70,1704410568,2024-01-04T11:22:48+0000
2024-01-05T02,18yr825,1,9076,interestingasfuck,2qhsa,"The Final Moments of a Bull Killer Whale.",0,https://v.redd.it/0r2r0zuqaiac1,0.95,863,1704410310,2024-01-04T11:18:30+0000
2024-01-05T02,18yqrir,30,2890,BatmanArkham,2y9q4,"İF THİS POST GETS 2048 UPVOTES İ WİLL POST 2048 MAN",0,https://i.redd.it/89q2lihi7iac1.jpeg,0.87,91,1704409167,2024-01-04T10:59:27+0000
2024-01-05T02,18yqoe5,19,4160,memes,2qjpg,Philosophy,0,https://i.redd.it/wuzqu07w6iac1.jpeg,0.83,459,1704408954,2024-01-04T10:55:54+0000
2024-01-05T02,18yq74j,66,1808,Tinder,2w7mz,"My attempt at flirting failed miserably. Also, he totally ruined the mood.",0,https://www.reddit.com/gallery/18yq74j,0.91,452,1704407784,2024-01-04T10:36:24+0000
2024-01-05T02,18yq0s0,68,1821,wholesomememes,3gcwj,"Gonna teach this to my kids",0,https://i.redd.it/cvyluewe2iac1.jpeg,0.93,79,1704407454,2024-01-04T10:30:54+0000
2024-01-05T02,18ypwgr,69,1801,notmycat,38c5p,"I’m a mailman. There are some strays at a trailer park I deliver to that I feed every day. Here are a few of them",0,https://www.reddit.com/gallery/18ypwgr,0.98,100,1704407201,2024-01-04T10:26:41+0000
2024-01-05T02,18ypu98,37,2935,PrequelMemes,3i60n,"Roses Are Red🌹",0,https://i.redd.it/4anbpqv61iac1.jpeg,0.96,124,1704407055,2024-01-04T10:24:15+0000
2024-01-05T02,18ypscs,55,2193,HermitCraft,2twma,"I’d like to make a Jellie appreciation thread. Rest in peace Jellie",0,https://i.redd.it/u8rjs13v0iac1.jpeg,0.95,244,1704406926,2024-01-04T10:22:06+0000
2024-01-05T02,18ypnpu,11,5160,AnimalsBeingBros,2wmvy,"That’s his kitten now",0,https://v.redd.it/dhq3nrovzhac1,0.96,45,1704406609,2024-01-04T10:16:49+0000
2024-01-05T02,18ypl1m,93,1581,insanepeoplefacebook,3acf2,"Getting someone fired for buying Christmas gifts for their children",0,https://i.redd.it/84uc34pdzhac1.jpeg,0.97,265,1704406427,2024-01-04T10:13:47+0000
2024-01-05T02,18ypkqh,60,2134,MapPorn,2si92,"The population of jews in Europe (1939 vs 2015)",0,https://www.reddit.com/gallery/18ypkqh,0.94,711,1704406403,2024-01-04T10:13:23+0000
2024-01-05T02,18ypikv,59,2155,sadcringe,2wsc9,"News Anchor tells 13 year old kid to ""go outside"" and that beating the game ""isn't a life goal"" after he becomes the first person to beat Classic Tetris",0,https://v.redd.it/6nu1cl0iyhac1,0.93,246,1704406250,2024-01-04T10:10:50+0000
2024-01-05T02,18ypfzm,74,1849,Wellthatsucks,2xcv7,"They bought a dog for the little girl so that she would spend less time on the internet🤣🤣",0,https://v.redd.it/jby448kbyhac1,0.91,83,1704406072,2024-01-04T10:07:52+0000
2024-01-05T02,18yp6cp,39,2946,shittymoviedetails,3mj3w,"According to Jason X, hockey was outlawed in 2024. Enjoy while you can, hockey fans",0,https://i.redd.it/7metdwpbwhac1.png,0.97,55,1704405454,2024-01-04T09:57:34+0000
2024-01-05T02,18yp3of,98,1656,AbruptChaos,3nasz,"Voluntarily 25 steps flight time later",0,https://v.redd.it/vb50j7qwvhac1,0.93,228,1704405260,2024-01-04T09:54:20+0000
2024-01-05T02,18yoyx9,36,3206,pokemon,2qmeb,"Which full art goes the hardest?",0,https://www.reddit.com/gallery/18yoyx9,0.96,357,1704404927,2024-01-04T09:48:47+0000
2024-01-05T02,18yoybk,2,10018,pettyrevenge,2vg7t,"Continuously kick my seat on flight, get your belongings soaked",1,https://www.reddit.com/r/pettyrevenge/comments/18yoybk/continuously_kick_my_seat_on_flight_get_your/,0.96,274,1704404884,2024-01-04T09:48:04+0000
2024-01-05T02,18yoms0,94,1802,ukraine,2qqcn,"Officialy confirmed: Ukraine received the first SKYNEX system from Germany. (1 system = 4 x SPAAG trucks, 1 command unit, 1 radar unit.)",0,https://i.redd.it/28da9kncshac1.png,0.98,175,1704404087,2024-01-04T09:34:47+0000
2024-01-05T02,18yomc1,62,2313,fixedbytheduet,46tcaa,"Dad of the year",0,https://v.redd.it/3xcsi7vbshac1,0.96,33,1704404057,2024-01-04T09:34:17+0000
2024-01-05T02,18yolpn,51,2698,BaldursGate3,12967t,"If you wake Shadowheart with Astarion instead of TAV...",1,https://www.reddit.com/r/BaldursGate3/comments/18yolpn/if_you_wake_shadowheart_with_astarion_instead_of/,0.97,221,1704404011,2024-01-04T09:33:31+0000
2024-01-05T02,18yois3,34,3447,80s,2raga,"A very Atari Christmas (1981)",0,https://i.redd.it/zp6mzcqlrhac1.jpeg,0.97,383,1704403812,2024-01-04T09:30:12+0000
2024-01-05T02,18yofld,41,3096,fightporn,2u5un,"Security guy makes quick work of heckler",0,https://v.redd.it/09l8r24nqhac1,0.97,268,1704403591,2024-01-04T09:26:31+0000
2024-01-05T02,18yoa6p,26,4533,me_irlgbt,3apfn,"me🦄irlgbt",0,https://i.redd.it/b8doecinphac1.png,0.87,102,1704403220,2024-01-04T09:20:20+0000
2024-01-05T02,18yo2eu,64,2444,badroommates,2w1n0,"Here we go final update.",0,https://i.redd.it/5j4xdrj9ohac1.jpeg,0.95,546,1704402689,2024-01-04T09:11:29+0000
2024-01-05T02,18yo0t5,96,1888,crochet,2qm6c,"Which one do you prefer? No ears or with ears",0,https://i.redd.it/8ficyumynhac1.jpeg,0.98,272,1704402588,2024-01-04T09:09:48+0000
2024-01-05T02,18ynzcm,40,3378,CuratedTumblr,3x5kfw,"The classic equivalent of getting a random Chinese character tatto",0,https://i.redd.it/grwfs83nnhac1.jpeg,0.97,141,1704402479,2024-01-04T09:07:59+0000
2024-01-05T02,18ynybc,85,2058,KidsAreFuckingStupid,3948y,"I feel so bad for this first grade teacher at my kids school...so gross and she's a real sweet lady.",0,https://i.redd.it/1ygee8wenhac1.png,0.98,226,1704402405,2024-01-04T09:06:45+0000
2024-01-05T02,18ynw9f,44,3428,technicallythetruth,3pzez,"true to the word cheesburger",0,https://i.redd.it/xe2zby9zmhac1.png,0.97,174,1704402261,2024-01-04T09:04:21+0000
2024-01-05T02,18ynvjm,63,2551,mildlyinteresting,2ti4h,"The restaurant I'm at has suggested tips of 2% to 7%",0,https://i.redd.it/axqj6gksmhac1.jpeg,0.91,413,1704402213,2024-01-04T09:03:33+0000
2024-01-05T02,18ynree,38,3741,ExplainTheJoke,2vmj2,"This one stumped me.",0,https://i.redd.it/bz0x17q1mhac1.jpeg,0.88,306,1704401943,2024-01-04T08:59:03+0000
2024-01-05T02,18ynmp4,32,4073,comics,2qh0s,Fandom,0,https://i.redd.it/8ejhuvu1lhac1.png,0.97,68,1704401612,2024-01-04T08:53:32+0000
2024-01-05T02,18yngjv,97,4426,WhitePeopleTwitter,35n7t,"American Dream",0,https://i.redd.it/1dyqrapsjhac1.jpeg,0.98,167,1704401186,2024-01-04T08:46:26+0000
2024-01-05T02,18ynefi,42,3878,whenthe,23gidu,"""MINORS!?!?!?!, 💦💦💦🥵🥵🥵💦🥵🥵💦"" -SH",0,https://v.redd.it/oxmtj6gcjhac1,0.89,151,1704401036,2024-01-04T08:43:56+0000
2024-01-05T02,18ynddz,86,2286,dankmemes,2zmfe,"If you don't agree, you probably are one",0,https://i.redd.it/ohlidwp2jhac1.jpeg,0.81,191,1704400963,2024-01-04T08:42:43+0000
2024-01-05T02,18yn810,75,2404,travel,2qh41,"Japanese Stranger Jumped off Subway to Help My Daughter",1,https://www.reddit.com/r/travel/comments/18yn810/japanese_stranger_jumped_off_subway_to_help_my/,0.95,111,1704400592,2024-01-04T08:36:32+0000
2024-01-05T02,18ymt6z,92,2292,Grimdank,3ilna,Nevermore,0,https://i.redd.it/3ty4jnrxehac1.jpeg,0.98,68,1704399552,2024-01-04T08:19:12+0000
2024-01-05T02,18ymp8f,95,2249,atheism,2qh2p,"Michigan State Rep. Josh Schriver Declares That He Works For God, Not Man. Schriver announced that he will be attempting to strip “tax exempt status from non-theistic churches” like The Church of Satan.",0,https://www.rightwingwatch.org/post/michigan-state-rep-josh-schriver-declares-that-he-works-for-god-not-man/,0.97,407,1704399278,2024-01-04T08:14:38+0000
2024-01-05T02,18ymn1j,16,6783,aww,2qh1o,"Coyote broke into our yard to play with and steal our dogs toys ",0,https://v.redd.it/p6852aohdhac1,0.97,198,1704399127,2024-01-04T08:12:07+0000
2024-01-05T02,18ymlxk,72,2713,theydidthemath,2x23b,"[Request] How fast would an average human need to run to accomplish this?",0,https://i.redd.it/3q98eshfdhac1.jpeg,0.95,107,1704399045,2024-01-04T08:10:45+0000
2024-01-05T02,18ymkmg,12,8978,TheLastAirbender,2rybx,"The difference is INSANE",0,https://www.reddit.com/gallery/18ymkmg,0.92,642,1704398958,2024-01-04T08:09:18+0000
2024-01-05T02,18ym71g,24,6292,2meirl4meirl,3ee85,2meirl4meirl,0,https://i.redd.it/vrai085hahac1.png,0.95,229,1704398055,2024-01-04T07:54:15+0000
2024-01-05T02,18ym52c,3,13832,news,2qh3l,"New York City announces lawsuit against bus companies sending migrants to city, seeks $708 million",0,https://abcnews.go.com/US/new-york-city-announces-lawsuit-bus-companies-sending/story?id=106110357,0.93,1445,1704397922,2024-01-04T07:52:02+0000
2024-01-05T02,18ym4ws,99,2405,dankchristianmemes,37bil,"Yeah he did",0,https://i.redd.it/bgm5tv70ahac1.jpeg,0.95,120,1704397912,2024-01-04T07:51:52+0000
2024-01-05T02,18ym4s5,29,5770,meirl,2s5ti,Meirl,0,https://i.redd.it/23b42581ahac1.jpeg,0.95,205,1704397903,2024-01-04T07:51:43+0000
2024-01-05T02,18ym1ez,48,3878,JustGuysBeingDudes,33rtj6,"Not everyone is greedy.",0,https://v.redd.it/n3gq6d5b9hac1,0.95,53,1704397683,2024-01-04T07:48:03+0000
2024-01-05T02,18ylzqh,70,3007,HolUp,qir9n,"I don't even know what to say.",0,https://v.redd.it/fx8wj9619hac1,0.95,67,1704397568,2024-01-04T07:46:08+0000
2024-01-05T02,18ylyz9,43,4412,gaming,2qh03,"Stellar Blade protagonist Eve's body figure was actually based on a 3D scan of the Korean model Shin Jae-eun.",0,https://i.redd.it/ayfwtgif8hac1.jpeg,0.88,505,1704397513,2024-01-04T07:45:13+0000
2024-01-05T02,18ylw6d,79,2825,CringeVideo,3c7w8,"Dude tries to rob a CVS, but a customer stops him",0,https://v.redd.it/t55f7fr98hac1,0.89,1412,1704397331,2024-01-04T07:42:11+0000
2024-01-05T02,18ylskt,4,16416,BrandNewSentence,mbn0j,"It was just a good Christian honk",0,https://i.redd.it/z391cy0k7hac1.png,0.95,548,1704397098,2024-01-04T07:38:18+0000
2024-01-05T02,18ylqs9,20,7050,OldSchoolCool,2tycb,"My mom circa 1998",0,https://i.redd.it/tsz936b97hac1.png,0.94,404,1704396975,2024-01-04T07:36:15+0000
2024-01-05T02,18ylqdk,46,4269,PublicFreakout,2yrq6,"Korean streamer confronts kid saying “ching chang chong” in India",0,https://v.redd.it/l2ouy6u47hac1,0.95,382,1704396947,2024-01-04T07:35:47+0000
2024-01-05T02,18ylo03,81,7311,SipsTea,5tdqj0,"Not even a loud fake cough can cover up that beep 😂😂😂",0,https://v.redd.it/mf0hur7k6hac1,0.91,358,1704396781,2024-01-04T07:33:01+0000
2024-01-05T02,18ylnng,5,15483,funny,2qh33,"I found this on the back of my sons homework.",0,https://i.redd.it/dhaazv5m6hac1.jpeg,0.94,1178,1704396755,2024-01-04T07:32:35+0000
2024-01-05T02,18ylhs6,10,12082,oddlysatisfying,2x93b,"Creation of ceiling art using plaster",0,https://v.redd.it/xims3e395hac1,0.95,305,1704396347,2024-01-04T07:25:47+0000
2024-01-05T02,18yl7ta,17,8882,WhitePeopleTwitter,35n7t,"A bit of a stretch..eh?",0,https://i.redd.it/yji3scy93hac1.png,0.93,1033,1704395672,2024-01-04T07:14:32+0000
2024-01-05T02,18yl4q5,8,13522,politics,2cneq,"House Republican says he won't accept a border deal because it may help Biden politically",0,https://www.businessinsider.com/troy-nehls-senate-border-security-deal-biden-2024-1,0.96,1186,1704395456,2024-01-04T07:10:56+0000
2024-01-05T02,18yl1a4,90,2908,lgbt,2qhh7,"New Year kiss 😘 🏳️‍🌈",0,https://i.redd.it/eirxegx12hac1.jpeg,0.9,86,1704395219,2024-01-04T07:06:59+0000
2024-01-05T02,18ykqta,21,8586,BlackPeopleTwitter,33x33,"Problems of getting with a bi girl",0,https://i.redd.it/kc4ld26zzgac1.jpeg,0.92,455,1704394521,2024-01-04T06:55:21+0000
2024-01-05T02,18ykpsp,7,23492,tumblr,2r7hk,"The serial killers got them :(",0,https://i.redd.it/56nb4rvrzgac1.jpeg,0.96,285,1704394454,2024-01-04T06:54:14+0000
2024-01-05T02,18ykic2,27,7290,pics,2qh0u,"I hear we're sharing pictures of our grandparents next to dictators. (Grandpa is next to the pole)",0,https://i.redd.it/0jjg53faygac1.jpeg,0.93,529,1704393953,2024-01-04T06:45:53+0000
2024-01-05T02,18ykdrk,15,12765,facepalm,2r5rp,"Damn, Jack",0,https://i.redd.it/qbsb3jkdxgac1.jpeg,0.96,217,1704393657,2024-01-04T06:40:57+0000
2024-01-05T02,18yk33p,57,5354,PeterExplainsTheJoke,121h8r,"Petah please",0,https://i.redd.it/qfzo5m9avgac1.jpeg,0.88,223,1704392943,2024-01-04T06:29:03+0000
2024-01-05T02,18yk1c7,6,33171,mildlyinfuriating,2ubgg,"Hotel Manager decided to come into my room while I was still in there to paint the door (that didn’t even need painting in my opinion)",0,https://i.redd.it/60yax81xugac1.jpeg,0.94,2553,1704392820,2024-01-04T06:27:00+0000
2024-01-05T02,18yjwqm,14,20006,Unexpected,2w67q,"This guy won in life ",0,https://v.redd.it/l4i7d62xtgac1,0.83,633,1704392514,2024-01-04T06:21:54+0000
2024-01-05T02,18yjswj,25,8942,ContagiousLaughter,2u2bh,"Marriage Goals.",0,https://v.redd.it/pdvv8ug9tgac1,0.95,93,1704392263,2024-01-04T06:17:43+0000
2024-01-05T02,18yjjyc,9,25959,MadeMeSmile,2uqcm,"Fun family games, nice",0,https://v.redd.it/5rlr5ue6rgac1,0.94,267,1704391639,2024-01-04T06:07:19+0000
2024-01-05T02,18yjj36,89,3494,shittyfoodporn,2u1if,"Moldy pizza was actually served at an Arkansas high school yesterday. Yes, the health department has been notified",0,https://i.redd.it/3c9wv5l4rgac1.jpeg,0.97,194,1704391579,2024-01-04T06:06:19+0000
2024-01-05T02,18yjgbq,49,5711,TikTokCringe,mvcq5,"Her excuses are crazy bruh 🤦‍♂️",0,https://v.redd.it/wdawpicoqgac1,0.9,885,1704391396,2024-01-04T06:03:16+0000
2024-01-05T02,18yjaaf,71,4134,europe,2qh4j,"Finns casually enjoying winter",0,https://v.redd.it/3s610tufpgac1,0.97,160,1704391001,2024-01-04T05:56:41+0000
2024-01-05T02,18yj5xk,53,7328,shitposting,2usxq,"Wait a minute.",0,https://v.redd.it/b0mrjcueogac1,0.94,156,1704390696,2024-01-04T05:51:36+0000
2024-01-05T02,18yido6,88,4212,holdmycatnip,2zhxd,"Super fast kitten",0,https://v.redd.it/dpival8sigac1,0.97,53,1704388749,2024-01-04T05:19:09+0000
2024-01-05T02,18yi9ce,18,23729,lego,2qhm7,"I was messing around and discovered you can perfectly insert 8 cheese slope pieces into window panes. Makes for a cool stained-glass effect.",0,https://i.redd.it/1igfkulxhgac1.jpeg,0.89,103,1704388453,2024-01-04T05:14:13+0000
2024-01-05T02,18yi8px,61,5939,HydroHomies,10288s,"I think the rest of the world has noticed",0,https://i.redd.it/ho1joyushgac1.jpeg,0.93,575,1704388409,2024-01-04T05:13:29+0000
2024-01-05T02,18yi6eq,56,31298,MadeMeSmile,2uqcm,"She thought she was witnessing someone else's proposal but it was really her own ",0,https://v.redd.it/tvo2obd7hgac1,0.93,764,1704388248,2024-01-04T05:10:48+0000
2024-01-05T02,18yi213,22,24385,Damnthatsinteresting,2xxyj,"Kindergarten game in China",0,https://v.redd.it/7mp5m1rdggac1,0.88,2186,1704387943,2024-01-04T05:05:43+0000
2024-01-05T02,18yhzer,50,7460,BikiniBottomTwitter,3deqz,"This new cable package has everything!",0,https://i.redd.it/1vlphiktfgac1.gif,0.95,147,1704387756,2024-01-04T05:02:36+0000
2024-01-05T02,18yhwwn,13,19431,worldnews,2qh13,"Joe Biden boots Uganda from trade deal over horrific “Kill the Gays” law",0,https://www.lgbtqnation.com/2024/01/joe-biden-boots-uganda-from-trade-deal-over-horrific-kill-the-gays-law/,0.94,1091,1704387605,2024-01-04T05:00:05+0000
2024-01-05T02,18yhor0,35,10168,cats,2qhta,"I told Elmo if he was good for his doctors appointment we would stop to get snacks and a toy on the way home",0,https://i.redd.it/81zdyriodgac1.jpeg,0.95,244,1704387023,2024-01-04T04:50:23+0000
2024-01-05T02,18ygshv,73,28790,facepalm,2r5rp,"Imagine taking a picture of this thinking the note writer is unreasonable.",0,https://i.redd.it/aqg16czz6gac1.jpeg,0.95,2992,1704384777,2024-01-04T04:12:57+0000
2024-01-05T02,18ygbyo,23,39863,SipsTea,5tdqj0,"Cameraman did her dirty",0,https://v.redd.it/rxlcuv1l3gac1,0.93,1038,1704383637,2024-01-04T03:53:57+0000
2024-01-05T02,18yg8rg,67,8046,oddlyspecific,2wjlc,"I can understand",0,https://i.redd.it/ywaii6uw2gac1.png,0.92,570,1704383401,2024-01-04T03:50:01+0000
2024-01-05T02,18yg66f,77,6188,technology,2qh16,"HyperVerse hedge fund CEO may not exist — Investigation finds no record of identity after collapse causing an estimated $1.3 billion in customer losses",0,https://arstechnica.com/tech-policy/2024/01/crypto-hedge-fund-ceo-may-not-exist-probe-finds-no-record-of-identity/,0.96,539,1704383204,2024-01-04T03:46:44+0000
2024-01-05T02,18yg1la,65,9707,AdviceAnimals,2s7tt,"I’ll take “cutting off your nose to spite your face” for a bag of peanuts, Alex",0,https://i.redd.it/d21ihy1c1gac1.jpeg,0.74,2926,1704382871,2024-01-04T03:41:11+0000
2024-01-05T02,18yfucs,87,6444,chaoticgood,2qjo5,"How to treat an obnoxious Karen",0,https://i.redd.it/07mpscrpzfac1.jpeg,0.94,129,1704382327,2024-01-04T03:32:07+0000
2024-01-05T02,18yfhim,47,16149,rareinsults,48t85,"Christmas Time in Westeros!",0,https://i.redd.it/hogbadjuwfac1.png,0.91,596,1704381376,2024-01-04T03:16:16+0000
2024-01-05T02,18yf9ld,91,25139,politics,2cneq,"Trump Received Millions From Foreign Governments as President, Report Finds",0,https://www.nytimes.com/2024/01/04/us/politics/trump-hotels-foreign-business-report.html,0.93,1535,1704380767,2024-01-04T03:06:07+0000
2024-01-05T02,18yf40i,84,7294,comicbookmovies,2qx71,"Patrick Stewart says he filmed his ‘MULTIVERSE OF MADNESS’ sequence alone and it was “frustrating and disappointing.”",0,https://i.redd.it/y3e65ktvtfac1.jpeg,0.95,486,1704380367,2024-01-04T02:59:27+0000
2024-01-05T02,18yet1e,33,39667,clevercomebacks,dyqlw,"Well can’t argue with that.",0,https://i.redd.it/ls0d364erfac1.jpeg,0.92,627,1704379527,2024-01-04T02:45:27+0000
2024-01-05T02,18yekm0,45,17027,WorkReform,5qpzgw,"Your fellow workers are not the enemy.",0,https://i.redd.it/5ytpsx1dpfac1.png,0.94,290,1704378862,2024-01-04T02:34:22+0000
2024-01-05T02,18ydq14,100,9453,lotrmemes,2v0i1,"Is there any character done dirtier by the movies than Faramir?",0,https://i.redd.it/rlu0c8vdifac1.jpeg,0.92,555,1704376498,2024-01-04T01:54:58+0000
2024-01-05T02,18ydknj,52,44074,Anticonsumption,2r83n,Absolutamente,0,https://i.redd.it/pow5m273hfac1.jpeg,0.85,1645,1704376062,2024-01-04T01:47:42+0000
2024-01-05T02,18yd5iw,78,17340,Weird,2qlia,"Human-shaped grass patch where everything else dried out.",0,https://i.redd.it/wxkl4tlddfac1.jpeg,0.9,1262,1704374823,2024-01-04T01:27:03+0000
2024-01-05T02,18yd3gy,76,13349,NonPoliticalTwitter,39gt6y,"Jar of Caramel...",0,https://i.redd.it/i20jvnqvcfac1.jpeg,0.96,273,1704374647,2024-01-04T01:24:07+0000
2024-01-05T02,18yd2df,83,12102,IllegallySmolCats,23e19j,"I think I got the perfect shot 🙃",0,https://i.redd.it/k5uk49odcfac1.jpeg,0.97,189,1704374552,2024-01-04T01:22:32+0000
2024-01-05T02,18yc6bt,80,23822,PoliticalHumor,2qm21,"Make glorious Reddit post for benefit Mother Russia.",0,https://i.redd.it/wbwyr3kf4fac1.png,0.82,1424,1704371810,2024-01-04T12:36:50+0000
