date,id,position,score,subreddit_display_name,subreddit_id,title,is_self,url,upvote_ratio,num_comments,created,created_date
2024-01-01T14,18vvvvl,99,715,osugame,2s3lm,"Former Rank 1 meetup!",0,https://i.redd.it/m2ss84m2pt9c1.jpeg,0.99,47,1704112396,2024-01-01T12:33:16+0000
2024-01-01T14,18vvj57,51,1196,pcmasterrace,2sgp1,"I’m a 3 what’s yours?",0,https://i.redd.it/b6qaxhjwkt9c1.jpeg,0.94,1424,1704110994,2024-01-01T12:09:54+0000
2024-01-01T14,18vvabk,1,5166,tumblr,2r7hk,"Canon event?",0,https://i.redd.it/g6j6ao0zht9c1.jpeg,0.98,47,1704110008,2024-01-01T11:53:28+0000
2024-01-01T14,18vv9sq,16,2298,funnyvideos,2qoos,"Watch out my friend",0,https://v.redd.it/7bbs8mxrht9c1,0.97,18,1704109943,2024-01-01T11:52:23+0000
2024-01-01T14,18vuz5p,9,3256,Weird,2qlia,"Children living in Siberia getting UV light exposure during the long dark winter months",0,https://i.redd.it/z3rtcrlzdt9c1.jpeg,0.96,137,1704108668,2024-01-01T11:31:08+0000
2024-01-01T14,18vuz0e,89,862,pokemon,2qmeb,"“Leon is the best Champion”🤓",0,https://i.redd.it/kx20ysqxdt9c1.jpeg,0.83,227,1704108651,2024-01-01T11:30:51+0000
2024-01-01T14,18vuv98,27,2064,funny,2qh33,"Happy New Year!",0,https://v.redd.it/3frswd7mct9c1,0.94,91,1704108209,2024-01-01T11:23:29+0000
2024-01-01T14,18vuqkw,95,902,MinecraftMemes,2sq0h,title,0,https://i.redd.it/s3oqb60zat9c1.jpeg,0.99,18,1704107671,2024-01-01T11:14:31+0000
2024-01-01T14,18vunsd,58,1318,ImTheMainCharacter,4c4j2u,"That was painful to watch",0,https://v.redd.it/1k1jls5d6t9c1,0.87,461,1704107325,2024-01-01T11:08:45+0000
2024-01-01T14,18vukbg,73,1093,nextfuckinglevel,m0bnr,"Cutting coconuts with both speed and precision simultaneously",0,https://v.redd.it/i5k24nzq8t9c1,0.9,88,1704106918,2024-01-01T11:01:58+0000
2024-01-01T14,18vug2j,10,3640,technicallythetruth,3pzez,"Happy New Year !",0,https://i.redd.it/7qb5q5u97t9c1.png,0.98,35,1704106410,2024-01-01T10:53:30+0000
2024-01-01T14,18vufmu,45,1561,AITAH,446kys,"Aita for telling my wife that I would choose my mom over the birth of our baby",1,https://www.reddit.com/r/AITAH/comments/18vufmu/aita_for_telling_my_wife_that_i_would_choose_my/,0.89,1247,1704106352,2024-01-01T10:52:32+0000
2024-01-01T14,18vuavl,90,986,CricketShitpost,3fzqh,"Riyal Question ❓",0,https://i.redd.it/5pfxcc8b5t9c1.png,0.95,54,1704105751,2024-01-01T10:42:31+0000
2024-01-01T14,18vu2cs,85,1078,lotr,2rfb9,"Those Ring of Power book covers…",0,https://i.redd.it/cjdrbl682t9c1.jpeg,0.86,146,1704104712,2024-01-01T10:25:12+0000
2024-01-01T14,18vu09q,6,4362,KidsAreFuckingStupid,3948y,"And the Oscar goes to…",0,https://v.redd.it/ad20c32i1t9c1,0.96,363,1704104470,2024-01-01T10:21:10+0000
2024-01-01T14,18vu04a,97,1052,maybemaybemaybe,38e1l,"maybe maybe maybe ",0,https://v.redd.it/uq8tkln21t9c1,0.96,92,1704104453,2024-01-01T10:20:53+0000
2024-01-01T14,18vtz2t,67,1351,discordVideos,2cxozx,Dafuq?,0,https://v.redd.it/j0k929pvws9c1,0.97,46,1704104344,2024-01-01T10:19:04+0000
2024-01-01T14,18vty80,65,1368,formuladank,3ndbi,"🥩",0,https://i.redd.it/kl0bwdit0t9c1.jpeg,0.93,54,1704104239,2024-01-01T10:17:19+0000
2024-01-01T14,18vtu9d,79,1201,starwarsmemes,2wzm6,"“You’re breaking my heart!”",0,https://i.redd.it/yx9njgddzs9c1.jpeg,0.93,32,1704103759,2024-01-01T10:09:19+0000
2024-01-01T14,18vttdi,19,2989,marvelmemes,35mye,"He's not wrong",0,https://i.redd.it/94flpr82zs9c1.png,0.89,168,1704103649,2024-01-01T10:07:29+0000
2024-01-01T14,18vtneg,14,3628,meirl,2s5ti,Meirl,0,https://i.redd.it/9ivre49zws9c1.png,0.98,108,1704102954,2024-01-01T09:55:54+0000
2024-01-01T14,18vtmv2,5,5021,ContagiousLaughter,2u2bh,"Traffic news from Japan",0,https://v.redd.it/lnth2eqrws9c1,0.97,92,1704102889,2024-01-01T09:54:49+0000
2024-01-01T14,18vtmtb,83,1189,CasualUK,3j2jr,"Anyone else quitting drugs/booze today?",1,https://www.reddit.com/r/CasualUK/comments/18vtmtb/anyone_else_quitting_drugsbooze_today/,0.91,445,1704102882,2024-01-01T09:54:42+0000
2024-01-01T14,18vtftn,23,2997,SipsTea,5tdqj0,"The world is so cruel yet so beautiful ",0,https://v.redd.it/t88illy4us9c1,0.97,69,1704101994,2024-01-01T09:39:54+0000
2024-01-01T14,18vtadl,96,1211,Fauxmoi,2rqcm8,"Sinéad O'Connor's relative checks Eve Barlow (Eve Fartlow) for wearing a Sinéad (she supported Palestine) shirt while taking a Zionist selfie in Israel: ""I don’t know why anyone would disrespect her by wearing her T shirt, it just shows how disgusting they are.""",0,https://i.redd.it/5spobsbors9c1.png,0.86,46,1704101318,2024-01-01T09:28:38+0000
2024-01-01T14,18vta51,18,3436,FunnyandSad,2z7qd,Plane,0,https://i.redd.it/1at3jhfzrs9c1.jpeg,0.89,67,1704101284,2024-01-01T09:28:04+0000
2024-01-01T14,18vt1zy,22,3380,oddlyterrifying,2yo6b,"inside a parking lot when the 7.4 earthquake hit Japan, 1/1/2024",0,https://v.redd.it/a9ik83j0ps9c1,0.96,177,1704100279,2024-01-01T09:11:19+0000
2024-01-01T14,18vszdh,38,2462,ich_iel,37k29,"ich🐕🎇iel",0,https://i.redd.it/5gbs39j0os9c1.jpeg,0.93,99,1704099933,2024-01-01T09:05:33+0000
2024-01-01T14,18vswbg,75,1528,mathmemes,3fz4c,"The circle of life",0,https://i.redd.it/th6jop01ns9c1.jpeg,0.96,28,1704099601,2024-01-01T09:00:01+0000
2024-01-01T14,18vstjd,21,3993,shitposting,2usxq,"Society ",0,https://v.redd.it/vu3d6kdxls9c1,0.98,73,1704099231,2024-01-01T08:53:51+0000
2024-01-01T14,18vst3d,15,4074,WTF,2qh61,"Footage of 7.6 magnitude earthquake struck in Japan",0,https://v.redd.it/tzaasfagls9c1,0.97,268,1704099168,2024-01-01T08:52:48+0000
2024-01-01T14,18vss1c,30,3043,Animemes,2w6fe,"Unironically changed my life",0,https://i.redd.it/6ptqllials9c1.jpeg,0.96,60,1704099020,2024-01-01T08:50:20+0000
2024-01-01T14,18vsn33,100,2766,BeAmazed,363r3,"Some footage of Japan's magnitude-7.4 earthquake on January 1, 2024",0,https://v.redd.it/p2mj9w7ajs9c1,0.98,104,1704098409,2024-01-01T08:40:09+0000
2024-01-01T14,18vsm3z,70,1738,whenthe,23gidu,"2024 is starting off great",0,https://v.redd.it/p04bso3ois9c1,0.98,62,1704098282,2024-01-01T08:38:02+0000
2024-01-01T14,18vshmc,12,5345,comics,2qh0s,"[OC] Public Domain",0,https://www.reddit.com/gallery/18vshmc,0.97,50,1704097729,2024-01-01T08:28:49+0000
2024-01-01T14,18vsg6w,92,1504,ChatGPT,7hqomg,"Depressed Man Feels Increasingly Better (2024 will be okay)",0,https://www.reddit.com/gallery/18vsg6w,0.92,134,1704097550,2024-01-01T08:25:50+0000
2024-01-01T14,18vscc6,71,1843,tf2,2qka0,"What would you choose?",0,https://i.redd.it/0j4w3qlucs9c1.png,0.95,331,1704097081,2024-01-01T08:18:01+0000
2024-01-01T14,18vsbiz,25,3861,interestingasfuck,2qhsa,"Footage from the local Shinkansen station in Ishikawa prefecture, extremely powerful shaking from the earthquake in japan",0,https://v.redd.it/cu8yd668fs9c1,0.98,109,1704096978,2024-01-01T08:16:18+0000
2024-01-01T14,18vsaga,35,3032,CatastrophicFailure,38tab,"M7.4 Earthquake Hitting Japan, Tsunami Over 1m Observed. Live camera footage of the moment the earthquake - January 1, 2024(Noto, Ishikawa, Japan)",0,https://v.redd.it/ggtawskges9c1,0.97,148,1704096848,2024-01-01T08:14:08+0000
2024-01-01T14,18vs80x,29,3383,CrazyFuckingVideos,45hae8,"Powerful earthquake hits Japan on first day of 2024, tsunami warnings issued",0,https://v.redd.it/hhaa1j4jds9c1,0.97,183,1704096556,2024-01-01T08:09:16+0000
2024-01-01T14,18vs6me,41,2814,PublicFreakout,2yrq6,"Powerful earthquake hits Japan on first day of 2024, tsunami warnings issued",0,https://v.redd.it/vizn5vt0ds9c1,0.97,183,1704096384,2024-01-01T08:06:24+0000
2024-01-01T14,18vs05t,62,2333,anime_irl,386zh,anime_irl,0,https://i.redd.it/7eeusiw9bs9c1.jpeg,0.97,29,1704095650,2024-01-01T07:54:10+0000
2024-01-01T14,18vrzy6,7,7338,antiwork,2y77d,"Imagine the mental health improvements",0,https://i.redd.it/w9smfcuk9r9c1.jpeg,0.93,221,1704095623,2024-01-01T07:53:43+0000
2024-01-01T14,18vrzpk,3,10223,todayilearned,2qqjc,"TIL that the con-artist, Frank Abagnale, from Catch Me if You Can, lied about most of the story. His book retelling his ""crimes"" was the only successful con he ever pulled.",0,https://whyy.org/segments/the-greatest-hoax-on-earth/,0.96,453,1704095592,2024-01-01T07:53:12+0000
2024-01-01T14,18vrxz4,40,3078,oddlyspecific,2wjlc,"Kindle people",0,https://i.redd.it/3lkddxyhas9c1.jpeg,0.95,41,1704095389,2024-01-01T07:49:49+0000
2024-01-01T14,18vrx5r,91,3425,MadeMeSmile,2uqcm,"Graduating dad receives heartwarming shout out from his child as he climbs the stage",0,https://v.redd.it/4skgd417as9c1,0.99,24,1704095291,2024-01-01T07:48:11+0000
2024-01-01T14,18vrrf6,2,11402,worldnews,2qh13,"Tsunami warning issued as magnitude 7.4 earthquake hits Japan",0,https://news.sky.com/story/tsunami-warning-issued-as-magnitude-7-4-earthquake-hits-japan-13040225,0.98,761,1704094612,2024-01-01T07:36:52+0000
2024-01-01T14,18vrr8r,46,2876,Gamingcirclejerk,2sf2b,"Blows my mind that GTA 6 is going to surpass these visuals",0,https://i.redd.it/eha7tgm08s9c1.jpeg,0.94,88,1704094590,2024-01-01T07:36:30+0000
2024-01-01T14,18vrqm4,4,11481,toptalent,3ptyd,"The most controversial video I've ever done",0,https://v.redd.it/ppikx7fw7s9c1,0.91,508,1704094514,2024-01-01T07:35:14+0000
2024-01-01T14,18vrmy5,17,5426,MadeMeSmile,2uqcm,"Made this lasagna instead of worrying about being alone on NYE",0,https://i.imgur.com/5t23C02.jpg,0.95,120,1704094077,2024-01-01T07:27:57+0000
2024-01-01T14,18vrgkb,53,2950,Hololive,29numb,"Welp, it was a good run. Oshio-mama saw the shuffle medley and is planning to destroy Cover's 2.7 billion yen 3D studio",0,https://i.redd.it/0br3bfvb4s9c1.jpeg,0.94,76,1704093315,2024-01-01T07:15:15+0000
2024-01-01T14,18vr52v,93,4373,shitposting,2usxq,shitposting,0,https://v.redd.it/zbk2ifpg0s9c1,0.98,42,1704092013,2024-01-01T06:53:33+0000
2024-01-01T14,18vqyjq,37,3953,politics,2cneq,"Green Day Slams Trump’s ‘MAGA Agenda’ During ‘American Idiot’ Performance on ‘Dick Clark’s New Year’s Rockin Eve’",0,https://themessenger.com/entertainment/green-day-maga-agenda-american-idiot-dick-clark-new-years-rockin-eve,0.95,226,1704091272,2024-01-01T06:41:12+0000
2024-01-01T14,18vqsxl,39,4026,ProgrammerHumor,2tex6,whichOneAreYou,0,https://i.redd.it/7r4hjs24wr9c1.png,0.97,190,1704090650,2024-01-01T06:30:50+0000
2024-01-01T14,18vqqh9,8,15072,me_irl,2vegg,Me_irl,0,https://i.redd.it/nyg18ugmvr9c1.jpeg,0.97,65,1704090385,2024-01-01T06:26:25+0000
2024-01-01T14,18vqm0b,72,2740,ExplainTheJoke,2vmj2,"Why is everyone looking at the camera in the 4th panel??",0,https://i.redd.it/2arxmto3ur9c1.jpeg,0.88,103,1704089873,2024-01-01T06:17:53+0000
2024-01-01T14,18vqga5,13,10123,Unexpected,2w67q,"What a sick burn.",0,https://v.redd.it/we48g0m2sr9c1,0.86,871,1704089226,2024-01-01T06:07:06+0000
2024-01-01T14,18vqdrp,63,3263,LinusTechTips,2v5ru,"Congratulations old Colton",0,https://i.redd.it/m8bl8q0err9c1.jpeg,0.92,87,1704088961,2024-01-01T06:02:41+0000
2024-01-01T14,18vq71w,74,2794,notmycat,38c5p,"His mother died on my grandparents property. He was originally supposed to go to the DNR but he's still here 5 months later",0,https://www.reddit.com/gallery/18vq71w,0.97,68,1704088224,2024-01-01T05:50:24+0000
2024-01-01T14,18vq5qm,77,6119,meirl,2s5ti,Meirl,0,https://i.redd.it/zpvwm1dror9c1.jpeg,0.95,107,1704088084,2024-01-01T05:48:04+0000
2024-01-01T14,18vq3dq,11,15849,Damnthatsinteresting,2xxyj,"The perfect snowflake falling onto this arm",0,https://v.redd.it/ewp3t0ixnr9c1,0.95,157,1704087810,2024-01-01T05:43:30+0000
2024-01-01T14,18vq10j,60,3615,LifeProTips,2s5oq,"LPT: If you intend to purchase a website domain name, do not search the availability of the domain until you are ready to buy it immediately",1,https://www.reddit.com/r/LifeProTips/comments/18vq10j/lpt_if_you_intend_to_purchase_a_website_domain/,0.95,210,1704087550,2024-01-01T05:39:10+0000
2024-01-01T14,18vpy8h,44,4955,MapPorn,2si92,"The largest generation in every European country; Europe has the oldest population in the world",0,https://i.redd.it/vvlztp2amr9c1.png,0.9,394,1704087244,2024-01-01T05:34:04+0000
2024-01-01T14,18vpwci,80,3143,cursedcomments,hw1ju,"cursed _ladybug",0,https://i.redd.it/il8godrnlr9c1.jpeg,0.96,88,1704087035,2024-01-01T05:30:35+0000
2024-01-01T14,18vpj4i,31,6529,BeAmazed,363r3,"Asteroid impact",0,https://v.redd.it/gsw6v4o8hr9c1,0.95,462,1704085577,2024-01-01T05:06:17+0000
2024-01-01T14,18vpcfq,56,4611,perfectlycutscreams,3n7fs,"How could he not know 😭",0,https://v.redd.it/0vyxik5cfr9c1,0.93,232,1704084908,2024-01-01T04:55:08+0000
2024-01-01T14,18vp55e,47,5250,Satisfyingasfuck,31s00,"How to tie a scarf",0,https://v.redd.it/lw4ihq23cr9c1,0.96,75,1704084085,2024-01-01T04:41:25+0000
2024-01-01T14,18vp2ug,98,3142,PeterExplainsTheJoke,121h8r,"From a party cracker and we’re all stumped",0,https://i.redd.it/zv3prr04cr9c1.jpeg,0.94,194,1704083829,2024-01-01T04:37:09+0000
2024-01-01T14,18vp0uc,32,7139,Awww,2suml,boop!!!!!!,0,https://v.redd.it/ohsejibcbr9c1,0.97,54,1704083597,2024-01-01T04:33:17+0000
2024-01-01T14,18voxt3,42,5738,DIY,2qh7d,"I installed new flooring in our trailer",0,https://www.reddit.com/gallery/18voxt3,0.94,363,1704083267,2024-01-01T04:27:47+0000
2024-01-01T14,18vorfg,34,8392,CuratedTumblr,3x5kfw,"Snails are a great perspective to learn anything",0,https://i.redd.it/ii55tv9e8r9c1.jpeg,0.88,156,1704082573,2024-01-01T04:16:13+0000
2024-01-01T14,18vonkd,76,10850,me_irl,2vegg,me_irl,0,https://v.redd.it/e2jr6u957r9c1,0.97,220,1704082158,2024-01-01T04:09:18+0000
2024-01-01T14,18vomsa,26,14002,gaming,2qh03,"Blows my mind that GTA 6 is going to surpass these visuals",0,https://i.redd.it/lb5g6ejr6r9c1.gif,0.85,771,1704082068,2024-01-01T04:07:48+0000
2024-01-01T14,18vomp6,66,4552,clevercomebacks,dyqlw,"On a post displaying a quote from Alicia Silverstone using the word “retard” to describe herself.",0,https://i.redd.it/97rcdz2v6r9c1.jpeg,0.95,263,1704082058,2024-01-01T04:07:38+0000
2024-01-01T14,18volty,69,4768,HonkaiStarRail,4q5zoc,"Guys, am I doing it right?",0,https://i.redd.it/58cdk7vf6r9c1.png,0.92,298,1704081963,2024-01-01T04:06:03+0000
2024-01-01T14,18voirr,59,5547,Genshin_Impact,12p4l2,"Official Illustration Commemorating New Year's 2024 in Japan",0,https://i.redd.it/mdlaghwj5r9c1.jpeg,0.95,82,1704081644,2024-01-01T04:00:44+0000
2024-01-01T14,18vogls,20,16281,mildlyinteresting,2ti4h,"I logged how every day went in 2023",0,https://i.redd.it/i4vl86kx4r9c1.jpeg,0.9,728,1704081409,2024-01-01T03:56:49+0000
2024-01-01T14,18vof16,87,3646,Music,2qh1u,"Green Day Slams Trump's 'MAGA Agenda' During 'American Idiot' Performance on 'Dick Clark's New Year's Rockin Eve'",0,https://themessenger.com/entertainment/green-day-maga-agenda-american-idiot-dick-clark-new-years-rockin-eve,0.83,462,1704081232,2024-01-01T03:53:52+0000
2024-01-01T14,18vob1d,52,5854,IllegallySmolCats,23e19j,"my ivy at 6 weeks!",0,https://i.redd.it/nodgcfg33r9c1.jpeg,0.98,68,1704080791,2024-01-01T03:46:31+0000
2024-01-01T14,18vo8ky,81,10562,interestingasfuck,2qhsa,"The warning on nuclear waste disposal sites designed to be read hundreds of thousands of years into the future",0,https://i.redd.it/lbyv375a2r9c1.jpeg,0.92,1357,1704080522,2024-01-01T03:42:02+0000
2024-01-01T14,18vo81x,84,3911,BaldursGate3,12967t,"A warning to those looking forward to the romance scenes",1,https://www.reddit.com/r/BaldursGate3/comments/18vo81x/a_warning_to_those_looking_forward_to_the_romance/,0.95,121,1704080467,2024-01-01T03:41:07+0000
2024-01-01T14,18vo7o7,55,5577,PoliticalHumor,2qm21,"MAGA Brains Woud Explode",0,https://i.imgur.com/Y41J77a.png,0.94,245,1704080435,2024-01-01T03:40:35+0000
2024-01-01T14,18vo4h2,61,5779,mildlyinfuriating,2ubgg,"My dog has to celebrate the new year like this because some lady let her antisocial dog escape and it attacked mine inside my own fucking home. She refused to pay the vet's bill and a lawsuit is on the way.",0,https://i.redd.it/zmjmw4iz0r9c1.jpeg,0.96,197,1704080086,2024-01-01T03:34:46+0000
2024-01-01T14,18vnzqh,24,17893,wholesomememes,3gcwj,"She must have happily accepted being tricked like this",0,https://i.redd.it/ybpu0ylmyq9c1.png,0.95,223,1704079566,2024-01-01T03:26:06+0000
2024-01-01T14,18vnrqe,50,33040,Damnthatsinteresting,2xxyj,"Night vision has come a long way. ",0,https://v.redd.it/rmq7nfhvwq9c1,0.96,711,1704078698,2024-01-01T03:11:38+0000
2024-01-01T14,18vnisk,57,7137,holdmycatnip,2zhxd,"Mom cat having a . . . moment. ",0,https://v.redd.it/tqqb1f70uq9c1,0.98,65,1704077787,2024-01-01T02:56:27+0000
2024-01-01T14,18vndzi,28,20364,facepalm,2r5rp,"No it’s really not the fault of the victim.",0,https://i.redd.it/46i5jf4osq9c1.jpeg,0.89,2721,1704077284,2024-01-01T02:48:04+0000
2024-01-01T14,18vnc0x,43,10147,NonPoliticalTwitter,39gt6y,"Basically that urinal meme",0,https://i.redd.it/l35tg0w2sq9c1.jpeg,0.96,199,1704077086,2024-01-01T02:44:46+0000
2024-01-01T14,18vn2kb,33,14847,WhitePeopleTwitter,35n7t,"When You Design a Vehicle with the Express Intention of Killing People",0,https://i.redd.it/zenqrfj4pq9c1.png,0.9,1020,1704076100,2024-01-01T02:28:20+0000
2024-01-01T14,18vmyy0,64,6845,SweatyPalms,2v567,"railway market",0,https://v.redd.it/albv9vd1oq9c1,0.95,176,1704075731,2024-01-01T02:22:11+0000
2024-01-01T14,18vms03,94,5469,wholesomegreentext,3i3vm,"“How I met your mother” 4chan edition",0,https://i.redd.it/4vdpbqsjdqm51.jpg,0.93,69,1704075030,2024-01-01T02:10:30+0000
2024-01-01T14,18vmp7y,86,5164,UpliftingNews,2u3ta,"Homicides See Historic Decline In 2023 Despite Perceptions That Crime Is On The Rise",0,https://www.forbes.com/sites/jamesfarrell/2023/12/29/homicides-see-historic-decline-in-2023-despite-perceptions-that-crime-is-on-the-rise/,0.93,262,1704074736,2024-01-01T02:05:36+0000
2024-01-01T14,18vmjkg,48,11048,NatureIsFuckingLit,3gdh7,"🔥 Bison Shedding a Tear",0,https://v.redd.it/0ec11bjgjq9c1,0.94,247,1704074207,2024-01-01T01:56:47+0000
2024-01-01T14,18vmejp,88,26204,Unexpected,2w67q,"Drawing Iron Man",0,https://v.redd.it/kdm60vp1iq9c1,0.9,170,1704073715,2024-01-01T01:48:35+0000
2024-01-01T14,18vm8cu,36,25591,memes,2qjpg,"When will it end",0,https://v.redd.it/cn2bf6b8gq9c1,0.95,431,1704073109,2024-01-01T01:38:29+0000
2024-01-01T14,18vm5bw,82,6141,aww,2qh1o,"Our puppy and kitty both turned 1 today!",0,https://www.reddit.com/gallery/18vm5bw,0.99,46,1704072820,2024-01-01T01:33:40+0000
2024-01-01T14,18vl92o,78,8386,DOG,2qiy5,"Louie is amazing",0,https://v.redd.it/89gsjq5a6q9c1,0.96,131,1704069808,2024-01-01T12:43:28+0000
2024-01-01T14,18vkgkp,68,11499,news,2qh3l,"New York sergeant, wife and two sons found dead in murder-suicide, police say | US crime",0,https://www.theguardian.com/us-news/2023/dec/31/new-york-police-sergeant-wife-two-sons-found-dead,0.94,1100,1704067186,2023-12-31T11:59:46+0000
2024-01-01T14,18vk2md,54,28026,AbsoluteUnits,a7wuv,"When a Powerlifter meets a Bodybuilder",0,https://v.redd.it/zcgudaxpup9c1,0.94,861,1704065918,2023-12-31T11:38:38+0000
2024-01-01T14,18vjy78,49,34981,pics,2qh0u,"Gary Sinise here. Wishing you all a Happy New Year and a great 2024 from my family to yours",0,https://i.redd.it/4ac8r0xgpp9c1.jpeg,0.9,807,1704065512,2023-12-31T11:31:52+0000
