date,id,position,score,subreddit_display_name,subreddit_id,title,is_self,url,upvote_ratio,num_comments,created,created_date
2024-01-06T19,19057b7,70,1117,news,2qh3l,"United Airlines to ground Boeing 737 Max 9 planes after panel blew off Alaska Air flight",0,https://www.cnbc.com/2024/01/06/boeing-737-max-9-grounding-after-alaska-airlines-door-blows-midflight.html,0.98,163,1704562522,2024-01-06T05:35:22+0000
2024-01-06T19,1904hpx,98,984,ufc,2qsev,"Song YaDong Respectively Destroys Sean Strickland",0,https://i.redd.it/rzcp1p51quac1.png,0.88,312,1704560691,2024-01-06T05:04:51+0000
2024-01-06T19,19046gf,33,2300,wholesomememes,3gcwj,"Nice Work Ravens",0,https://i.redd.it/mu5nvstknuac1.jpeg,0.99,13,1704559854,2024-01-06T04:50:54+0000
2024-01-06T19,1903zx1,72,1243,Awww,2suml,"Baby reacts to mother's first kiss",0,https://v.redd.it/hnqcx6htluac1,0.97,19,1704559357,2024-01-06T04:42:37+0000
2024-01-06T19,1903y76,92,1116,BoomersBeingFools,22p3je,"News Anchor tells 13 year old kid to ""go outside"" and that beating the game ""isn't a life goal"" after he becomes the first person to beat Classic Tetris. Kid’s dad passed away a week prior to this and he hyper fixated on Tetris likely as a form of grief. He dedicated the win to his dad.",0,https://v.redd.it/vag2hyjm5nac1,0.96,118,1704559232,2024-01-06T04:40:32+0000
2024-01-06T19,1903s62,100,1085,Grimdank,3ilna,"Abaddon after every inevitable failure",0,https://i.redd.it/35mcra4fkuac1.jpeg,0.97,52,1704558786,2024-01-06T04:33:06+0000
2024-01-06T19,1903o55,59,1599,whenthe,23gidu,"DONT MINE AT NIGHT 🗣️🔥🔥",0,https://v.redd.it/w5r3ko3jjuac1,0.98,51,1704558494,2024-01-06T04:28:14+0000
2024-01-06T19,1903n8p,38,2244,PeterExplainsTheJoke,121h8r,"I’m not American",0,https://i.redd.it/us80zbkcjuac1.jpeg,0.92,151,1704558426,2024-01-06T04:27:06+0000
2024-01-06T19,1903bu4,76,1298,fightporn,2u5un,"Man gets caught keying someone’s car in broad daylight, doesn’t end well for him ",0,https://v.redd.it/0nm8apmrguac1,0.94,254,1704557580,2024-01-06T04:13:00+0000
2024-01-06T19,19038tw,64,1549,worldnews,2qh13,"Ukraine shows evidence Russia fired North Korea missile at Kharkiv",0,https://www.reuters.com/world/ukraine-shows-evidence-russia-fired-north-korea-missile-kharkiv-2024-01-06/,0.95,162,1704557360,2024-01-06T04:09:20+0000
2024-01-06T19,1903846,8,5037,funny,2qh33,"I am a Woman ",0,https://v.redd.it/xvohlayyfuac1,0.93,214,1704557307,2024-01-06T04:08:27+0000
2024-01-06T19,19037ke,1,14504,facepalm,2r5rp,"""Leave it up to the states"" They said.",0,https://i.redd.it/jwwroj1wfuac1.png,0.95,1334,1704557262,2024-01-06T04:07:42+0000
2024-01-06T19,19035on,58,1711,starwarsmemes,2wzm6,"Your worst moment",0,https://i.redd.it/skxb82h8fuac1.jpeg,0.94,323,1704557118,2024-01-06T04:05:18+0000
2024-01-06T19,1902xla,40,2309,WorkReform,5qpzgw,"The companies are the crisis.",0,https://i.redd.it/0xfsjlfiduac1.jpeg,0.97,20,1704556513,2024-01-06T03:55:13+0000
2024-01-06T19,1902wcf,60,1651,CFB,2qm9d,"[Thamel] Jim Harbaugh gave another impassioned plea for revenue sharing. He proposes slicing 5 to 10-percent off salaries and TV deals to create a pot for all student athletes. Memorable line he took from his dad: “We’re all robbing the same train here.”",0,https://x.com/PeteThamel/status/1743661097352036855?s=20,0.94,389,1704556414,2024-01-06T03:53:34+0000
2024-01-06T19,1902udv,2,10473,meirl,2s5ti,meirl,0,https://i.redd.it/5fmvru4wcuac1.jpeg,0.96,594,1704556254,2024-01-06T03:50:54+0000
2024-01-06T19,1902rym,30,3061,memes,2qjpg,"Hell yeah",0,https://i.redd.it/x2fpedtbcuac1.jpeg,0.98,174,1704556066,2024-01-06T03:47:46+0000
2024-01-06T19,1902qm4,89,1327,distressingmemes,5aiyne,"Lobotomy always hits hard",0,https://v.redd.it/3t7hlqbzbuac1,0.93,46,1704555953,2024-01-06T03:45:53+0000
2024-01-06T19,1902l07,53,1988,holdmycatnip,2zhxd,"How daring I am ",0,https://v.redd.it/x2uzlctnauac1,0.97,31,1704555506,2024-01-06T03:38:26+0000
2024-01-06T19,1902jm8,22,3667,CuratedTumblr,3x5kfw,Realism,0,https://i.redd.it/t29j4s1bauac1.jpeg,0.97,77,1704555398,2024-01-06T03:36:38+0000
2024-01-06T19,1902b9e,78,3487,shitposting,2usxq,"reels comments",0,https://v.redd.it/4caozbgd8uac1,0.99,60,1704554737,2024-01-06T03:25:37+0000
2024-01-06T19,19028jx,74,1537,NewsOfTheStupid,2tpr6,"Trump on Iowa School Shooting: ‘Get Over It’ | The former president's comments come a day after a gunman killed a sixth grade student and wounded five other people at Perry High School",0,https://www.rollingstone.com/politics/politics-news/trump-iowa-school-shooting-1234941542/,0.94,208,1704554520,2024-01-06T03:22:00+0000
2024-01-06T19,190219i,46,2439,notliketheothergirls,3opft,"Now it’s a little doggie!!!!",0,https://www.reddit.com/gallery/190219i,0.94,81,1704553932,2024-01-06T03:12:12+0000
2024-01-06T19,1901ys5,80,1565,FunnyAnimals,2st2l,"We could watch this dog all day!",0,https://v.redd.it/k5rs3qo85uac1,0.98,21,1704553735,2024-01-06T03:08:55+0000
2024-01-06T19,1901y7r,65,3805,politics,2cneq,"Trump Calls On Supporters To Stop 'Bags Of Crap' Who Enter Polling Places",0,https://www.huffpost.com/entry/trump-supporters-stop-bags-of-crap-voting_n_6598f4bde4b0f9f6621cc828,0.95,773,1704553690,2024-01-06T03:08:10+0000
2024-01-06T19,1901xaa,26,3750,AITAH,446kys,"AITAH For Publicly Humiliating My Friend Who Confessed To My Husband",1,https://www.reddit.com/r/AITAH/comments/1901xaa/aitah_for_publicly_humiliating_my_friend_who/,0.93,1076,1704553616,2024-01-06T03:06:56+0000
2024-01-06T19,1901pgz,5,9345,clevercomebacks,dyqlw,"Billions and billions of people",0,https://i.redd.it/jxzwugm83uac1.jpeg,0.96,479,1704553007,2024-01-06T02:56:47+0000
2024-01-06T19,1901p2f,66,1783,OldSchoolCool,2tycb,"11-year-old Dwayne ""The Rock"" Johnson sitting in the crowd watching his father about to wrestle, 1984",0,https://v.redd.it/znr5x5943uac1,0.92,112,1704552974,2024-01-06T02:56:14+0000
2024-01-06T19,1901mj6,67,1795,lego,2qhm7,"Guess the movies!",0,https://www.reddit.com/gallery/1901mj6,0.93,233,1704552765,2024-01-06T02:52:45+0000
2024-01-06T19,1901lkq,44,2795,ich_iel,37k29,"ich🤔iel",0,https://i.redd.it/8z8f6lw92uac1.jpeg,0.97,135,1704552684,2024-01-06T02:51:24+0000
2024-01-06T19,1901i3a,13,6428,therewasanattempt,39ne7,"To prevent from sitting",0,https://i.redd.it/c6iqlwxd1uac1.jpeg,0.96,328,1704552385,2024-01-06T02:46:25+0000
2024-01-06T19,1901gpg,95,1533,chaoticgood,2qjo5,"Feeling ~*c h a o t i c*~ in my lecture today",0,https://i.redd.it/pbv7fs3j97l71.jpg,0.95,43,1704552269,2024-01-06T02:44:29+0000
2024-01-06T19,1901fpr,94,1537,ThatsInsane,swxxz,"Gone in 60 Seconds",0,https://v.redd.it/247hy38s0uac1,0.95,312,1704552188,2024-01-06T02:43:08+0000
2024-01-06T19,1901cx4,93,1574,SweatyPalms,2v567,"He's insane",0,https://v.redd.it/6oj7c9520uac1,0.93,217,1704551960,2024-01-06T02:39:20+0000
2024-01-06T19,19019fs,50,2578,houseplants,2skiq,"How can I get rid of these pandas eating all my plants?",0,https://i.redd.it/i4wzltz8ztac1.jpeg,0.88,142,1704551668,2024-01-06T02:34:28+0000
2024-01-06T19,19017cr,48,2701,cats,2qhta,"The surface temp of these bros is around 140F",0,https://i.redd.it/t9xs58oqytac1.jpeg,0.98,67,1704551496,2024-01-06T02:31:36+0000
2024-01-06T19,190147m,87,3808,WhitePeopleTwitter,35n7t,"Donald Trump was in fact on the list, and there is documentary to apparently prove it",0,https://i.redd.it/p5qs2yuyxtac1.png,0.98,123,1704551242,2024-01-06T02:27:22+0000
2024-01-06T19,19013eu,56,2446,dankmemes,2zmfe,"Mr. “Buy now” on Amazon",0,https://i.redd.it/elvhsrprxtac1.gif,0.98,11,1704551175,2024-01-06T02:26:15+0000
2024-01-06T19,190125w,97,1641,spaceporn,2s9jc,"RIGHT: How the planets are often portrayed (overcontrasted/saturated, false color). LEFT: how they actually look like to the human eye (or close to it)!",0,https://i.redd.it/1ubq8bkzwtac1.png,0.78,343,1704551069,2024-01-06T02:24:29+0000
2024-01-06T19,1900z16,21,4728,technology,2qh16,"YouTube demonetizes public domain 'Steamboat Willie' video after copyright claim",0,https://mashable.com/article/youtube-demontizes-public-domain-steamboat-willie-disney-copyright-claim,0.95,302,1704550810,2024-01-06T02:20:10+0000
2024-01-06T19,1900v6u,85,4107,Unexpected,2w67q,"Murphy's law, if something can go wrong, it will!",0,https://v.redd.it/secjdrdrvtac1,0.96,300,1704550495,2024-01-06T02:14:55+0000
2024-01-06T19,1900t30,82,1839,gaming,2qh03,"What game made you wish you could switch sides, but you couldn’t?",1,https://www.reddit.com/r/gaming/comments/1900t30/what_game_made_you_wish_you_could_switch_sides/,0.93,879,1704550313,2024-01-06T02:11:53+0000
2024-01-06T19,1900rvp,19,5539,BlackPeopleTwitter,33x33,"Sometimes it don’t really take a lot to hear them out.",0,https://v.redd.it/vqgf6jgwutac1,0.95,252,1704550212,2024-01-06T02:10:12+0000
2024-01-06T19,1900rbv,55,2524,DIY,2qh7d,"My vent / heater connects to my roommates room and I can hear EVERYTHING. How can I muffle the sounds?",0,https://i.redd.it/v2goswfsutac1.jpeg,0.94,1317,1704550166,2024-01-06T02:09:26+0000
2024-01-06T19,1900ngm,10,6892,law,2qh9k,"Trump used four properties to accept $7.8 million from foreign governments, during his presidency — without congressional approval per Article I of the U.S. Constitution",0,https://oversightdemocrats.house.gov/sites/democrats.oversight.house.gov/files/2024-01-04.COA%20DEMS%20-%20Mazars%20Report.pdf,0.95,385,1704549839,2024-01-06T02:03:59+0000
2024-01-06T19,1900ey8,18,6052,oddlysatisfying,2x93b,"Making a pysanky egg",0,https://v.redd.it/d6aby4clrtac1,0.96,132,1704549093,2024-01-06T01:51:33+0000
2024-01-06T19,1900cz3,9,8055,pics,2qh0u,"Whenever it freezes this happens to our spare bedroom windows.",0,https://www.reddit.com/gallery/1900cz3,0.97,336,1704548926,2024-01-06T01:48:46+0000
2024-01-06T19,1900c48,77,2010,malelivingspace,2v70p,"Updated my moody bedroom",0,https://i.redd.it/mksnhcyuqtac1.jpeg,0.97,129,1704548847,2024-01-06T01:47:27+0000
2024-01-06T19,1900bq1,6,12275,blunderyears,2vy3g,"The year is 2012. Tumblr, planking, and mustaches are all the rage. Your dad got you a digital camera for Christmas. Life is good.",0,https://www.reddit.com/gallery/1900bq1,0.94,834,1704548808,2024-01-06T01:46:48+0000
2024-01-06T19,1900b27,17,7764,perfectlycutscreams,3n7fs,"This Chiropractor got no chill",0,https://v.redd.it/gczngswgqtac1,0.9,949,1704548750,2024-01-06T01:45:50+0000
2024-01-06T19,190071e,71,2110,atheism,2qh2p,"My aunt lost 2 daughters the same week and the Pastor said don't question God.",1,https://www.reddit.com/r/atheism/comments/190071e/my_aunt_lost_2_daughters_the_same_week_and_the/,0.92,326,1704548393,2024-01-06T01:39:53+0000
2024-01-06T19,19006xe,57,2685,dataisbeautiful,2tk95,"[OC] Generation Z are increasingly working during their High School years (16-19 year olds) after a significant drop during the Millennial generation. Still not as much a Generation X, Boomers, and the Silent Generation.",0,https://i.redd.it/93629m1sotac1.jpeg,0.9,600,1704548383,2024-01-06T01:39:43+0000
2024-01-06T19,19005x7,23,6555,shitposting,2usxq,"News report",0,https://v.redd.it/o27tjc4rotac1,0.95,156,1704548288,2024-01-06T01:38:08+0000
2024-01-06T19,19005p4,52,2939,PoliticalHumor,2qm21,"Republicans take another trip to Hypocrisy Island.",0,https://i.redd.it/6yysb835ptac1.jpeg,0.96,86,1704548267,2024-01-06T01:37:47+0000
2024-01-06T19,19003cg,12,7630,politics,2cneq,"Biden Torches ‘Loser’ Trump at Length During Fiery Campaign Speech",0,https://www.rollingstone.com/politics/politics-news/biden-torches-loser-trump-2024-campaign-speech-pennsylvania-1234941332/,0.94,478,1704548045,2024-01-06T01:34:05+0000
2024-01-06T19,18zzzs6,37,4035,UkraineWarVideoReport,5wjmo8,"Ukrainian combat medic Halyna Fedyshyn before and after Russian captivity",0,https://i.redd.it/liu7n49hntac1.jpeg,0.95,237,1704547715,2024-01-06T01:28:35+0000
2024-01-06T19,18zzx6d,42,3789,notinteresting,2u0xf,"I messaged this guy and he did not respond",0,https://i.redd.it/ul8dnoarmtac1.jpeg,0.94,144,1704547465,2024-01-06T01:24:25+0000
2024-01-06T19,18zzwyd,3,36161,Unexpected,2w67q,"Hope the guy is okay",0,https://v.redd.it/ohklfhgomtac1,0.84,427,1704547444,2024-01-06T01:24:04+0000
2024-01-06T19,18zzwan,36,4322,SipsTea,5tdqj0,"Parking lot review is a thing?",0,https://v.redd.it/irly86bhmtac1,0.9,493,1704547381,2024-01-06T01:23:01+0000
2024-01-06T19,18zzu89,69,2313,harrypotter,2qiqi,"I still don't know if she actually meant it 💀",0,https://i.redd.it/tndrwmutltac1.png,0.95,87,1704547191,2024-01-06T01:19:51+0000
2024-01-06T19,18zzt37,41,3769,antiwork,2y77d,"Back pain due to months of using company-issued ""chairs"" so I bought my own and it went over about as well as a bucket of farts",0,https://www.reddit.com/gallery/18zzt37,0.95,324,1704547079,2024-01-06T01:17:59+0000
2024-01-06T19,18zzmvv,4,18806,WhitePeopleTwitter,35n7t,"He told parents to get over their dead kids…..",0,https://i.redd.it/8lcmbofvjtac1.jpeg,0.93,677,1704546495,2024-01-06T01:08:15+0000
2024-01-06T19,18zzgve,25,5615,todayilearned,2qqjc,"TIL Australia's first govt-backed pill & drug testing service, after its first month of operation, found that all the cocaine tested by the service had purity levels below 27% with 40% of the samples containing zero cocaine.",0,https://www.theguardian.com/society/2022/aug/25/first-government-backed-pill-testing-clinic-finds-40-of-cocaine-contained-no-coke,0.97,354,1704545907,2024-01-06T12:58:27+0000
2024-01-06T19,18zzfw6,68,2503,NonPoliticalTwitter,39gt6y,"Oh whale..",0,https://i.imgur.com/y5jj5dZ.jpeg,0.97,17,1704545810,2024-01-06T12:56:50+0000
2024-01-06T19,18zzeti,14,9233,Eyebleach,2s427,"Clouded leopard and a photographer",0,https://i.imgur.com/nr2ZH2k.gifv,0.98,147,1704545703,2024-01-06T12:55:03+0000
2024-01-06T19,18zzca9,20,7481,BeAmazed,363r3,"This Japanese Mcdonalds has a phone cleaner in the bathroom",0,https://i.imgur.com/njVz63a.gifv,0.94,797,1704545443,2024-01-06T12:50:43+0000
2024-01-06T19,18zzc5c,35,4755,PublicFreakout,2yrq6,"Unhinged at its finest ",0,https://v.redd.it/seuadiapgtac1,0.93,731,1704545431,2024-01-06T12:50:31+0000
2024-01-06T19,18zzbo2,43,4209,Wellthatsucks,2xcv7,"Gas leak mistaken as fog",0,https://i.imgur.com/MQZvByh.gifv,0.98,174,1704545387,2024-01-06T12:49:47+0000
2024-01-06T19,18zz9m1,96,2216,aww,2qh1o,"Hope he'll rate 5 star for the service 😁",0,https://v.redd.it/h7q5c6jpftac1,0.97,22,1704545165,2024-01-06T12:46:05+0000
2024-01-06T19,18zz8or,84,6178,Damnthatsinteresting,2xxyj,"Handmade Electronic Iron Press",0,https://v.redd.it/3j536mjlftac1,0.95,223,1704545069,2024-01-06T12:44:29+0000
2024-01-06T19,18zz4rj,31,5505,Satisfyingasfuck,31s00,"The perfect creamy carbonara",0,https://v.redd.it/vcj000odetac1,0.91,413,1704544672,2024-01-06T12:37:52+0000
2024-01-06T19,18zyyzb,63,3213,Animemes,2w6fe,"Dear lord",0,https://i.redd.it/2osrnwhmctac1.jpeg,0.97,63,1704544057,2024-01-06T12:27:37+0000
2024-01-06T19,18zyxzc,47,4493,europe,2qh4j,"European passport rank",0,https://i.redd.it/5fccj06bctac1.jpeg,0.87,592,1704543951,2024-01-06T12:25:51+0000
2024-01-06T19,18zyw3s,54,3937,Terraria,2sg5b,"Useful concept I made :)",0,https://i.redd.it/4sa28wsobtac1.jpeg,0.95,94,1704543744,2024-01-06T12:22:24+0000
2024-01-06T19,18zytu7,27,6874,nextfuckinglevel,m0bnr,"Props to the pilot landing this plane with a hole in the side yesterday",0,https://v.redd.it/7q5ry3uyatac1,0.94,834,1704543507,2024-01-06T12:18:27+0000
2024-01-06T19,18zyt1b,11,16856,funnyvideos,2qoos,"Heckler making fun of comedian.",0,https://v.redd.it/isn1jyznatac1,0.86,671,1704543418,2024-01-06T12:16:58+0000
2024-01-06T19,18zysn6,83,2755,MinecraftMemes,2sq0h,"The New Rock Paper Scissors [OC]",0,https://i.redd.it/ucom6criatac1.png,0.97,42,1704543374,2024-01-06T12:16:14+0000
2024-01-06T19,18zyq7j,75,2773,rickandmorty,2u4lp,"All the fake opening credit scenes",0,https://www.reddit.com/gallery/18zyq7j,0.95,219,1704543103,2024-01-06T12:11:43+0000
2024-01-06T19,18zyoi5,61,3427,interesting,2qib0,"South Korean guards hold hands when checking rooms in the shared conference room on the DMZ to minimize the chances of getting pulled to the North Korean side",0,https://i.redd.it/xttnlk799tac1.jpeg,0.98,152,1704542924,2024-01-06T12:08:44+0000
2024-01-06T19,18zyo6p,91,6430,therewasanattempt,39ne7,"To defend billionaires.",0,https://v.redd.it/bgl07a539tac1,0.91,199,1704542892,2024-01-06T12:08:12+0000
2024-01-06T19,18zy5cd,90,2932,BrandNewSentence,mbn0j,"“I have become pregnant from the starter fluid”",0,https://i.redd.it/9tltohv23tac1.jpeg,0.94,196,1704540848,2024-01-06T11:34:08+0000
2024-01-06T19,18zy3fb,15,22697,mildlyinfuriating,2ubgg,"I have been mistaken for my boyfriend’s mother twice.",0,https://www.reddit.com/gallery/18zy3fb,0.87,4519,1704540636,2024-01-06T11:30:36+0000
2024-01-06T19,18zy0o8,7,43613,interestingasfuck,2qhsa,"When a Retired Veteran Soldier Play Battlefield for the first time",0,https://v.redd.it/dh0tsfnk1tac1,0.89,951,1704540342,2024-01-06T11:25:42+0000
2024-01-06T19,18zy0g5,45,25170,clevercomebacks,dyqlw,"I wonder who won that war?",0,https://i.redd.it/iwql1plh1tac1.jpeg,0.92,1122,1704540313,2024-01-06T11:25:13+0000
2024-01-06T19,18zxy28,32,7812,me_irl,2vegg,"Me irl",0,https://i.redd.it/hbf9sg2p0tac1.jpeg,0.89,604,1704540047,2024-01-06T11:20:47+0000
2024-01-06T19,18zxpmc,24,11247,comics,2qh0s,"‘Shootout’",0,https://www.reddit.com/gallery/18zxpmc,0.91,75,1704539113,2024-01-06T11:05:13+0000
2024-01-06T19,18zxo6j,79,3487,MemePiece,2tt3v,"Someone get him an icepack and a cooler story! Quick!",0,https://www.reddit.com/gallery/18zxo6j,0.96,107,1704538945,2024-01-06T11:02:25+0000
2024-01-06T19,18zxivm,88,3511,gtaonline,2xrd1,"Did someone seriously just spend $750k to kill 3 dogs? 🤦‍♂️",0,https://v.redd.it/5ge9b3qnvsac1,0.94,67,1704538373,2024-01-06T10:52:53+0000
2024-01-06T19,18zx9ng,16,19527,Damnthatsinteresting,2xxyj,"New Photo of the Alaska Boeing 737 after depressurization. The Airplane in question was very newly delivered from Boeing",0,https://i.redd.it/2pop6afkssac1.jpeg,0.96,2521,1704537312,2024-01-06T10:35:12+0000
2024-01-06T19,18zx8kr,29,14964,MadeMeSmile,2uqcm,"New Zealand's youngest ever MP starts her first parliament speech by performing haka",0,https://v.redd.it/gqc8mmuursac1,0.78,2044,1704537174,2024-01-06T10:32:54+0000
2024-01-06T19,18zwvp0,49,6338,science,mouw,"Same-sex sexual behavior does not result in offspring, and evolutionary biologists have wondered how genes associated with this behavior persisted. A new study revealed that male heterosexuals who carry genes associated with bisexual behavior father more children and are more likely risk-takers.",0,https://news.umich.edu/genetic-variants-underlying-male-bisexual-behavior-risk-taking-linked-to-more-children-study-shows/,0.89,679,1704535686,2024-01-06T10:08:06+0000
2024-01-06T19,18zwsiv,39,10895,technicallythetruth,3pzez,"My English teacher has this in her classroom",0,https://i.redd.it/ucw02dykmsac1.png,0.96,94,1704535311,2024-01-06T10:01:51+0000
2024-01-06T19,18zwiwf,28,21387,pcmasterrace,2sgp1,"First build, is that enough fans ?",0,https://i.redd.it/e6redv6djsac1.jpeg,0.91,2186,1704534218,2024-01-06T09:43:38+0000
2024-01-06T19,18zwgod,86,4285,IASIP,2s28b,"I reached this episode today and it completely unzipped me.",0,https://i.redd.it/jvdw241kisac1.jpeg,0.93,367,1704533945,2024-01-06T09:39:05+0000
2024-01-06T19,18zw2c8,34,15102,PrequelMemes,3i60n,"Directed by Michael Bay",0,https://v.redd.it/pbc08ypmdsac1,0.95,309,1704532289,2024-01-06T09:11:29+0000
2024-01-06T19,18zvysg,62,6888,rareinsults,48t85,"Pokémon don't care about your feelings",0,https://i.redd.it/8p3kfgpdcsac1.png,0.95,89,1704531884,2024-01-06T09:04:44+0000
2024-01-06T19,18zvi0i,51,9307,mildlyinteresting,2ti4h,"Puréed 'roast dinner with gravy' served to my Dad in hospital",0,https://i.redd.it/6exn3j0o6sac1.jpeg,0.97,516,1704529996,2024-01-06T08:33:16+0000
2024-01-06T19,18zvhsd,73,5944,frogs,2r6bj,"My frog’s first trip to the vet",0,https://i.redd.it/r0hqvjvq6sac1.jpeg,0.97,156,1704529974,2024-01-06T08:32:54+0000
2024-01-06T19,18zvh2s,81,5918,BaldursGate3,12967t,"Had to make sure. You never.... never mind.",0,https://v.redd.it/dx3hww366sac1,0.98,198,1704529896,2024-01-06T08:31:36+0000
2024-01-06T19,18zv4lp,99,6060,tumblr,2r7hk,"But could they foresee the Emu War?",0,https://i.redd.it/dnh23yza2sac1.jpeg,0.97,48,1704528479,2024-01-06T08:07:59+0000
