date,id,position,score,subreddit_display_name,subreddit_id,title,is_self,url,upvote_ratio,num_comments,created,created_date
2024-01-02T14,18wo2pt,56,1097,ImTheMainCharacter,4c4j2u,"Kinda made the video better",0,https://v.redd.it/6rsqm010c0ac1,0.97,118,1704197710,2024-01-02T12:15:10+0000
2024-01-02T14,18wnzzb,90,800,BikiniBottomTwitter,3deqz,Yes,0,https://i.redd.it/4g9y2xlyp0ac1.jpeg,0.91,64,1704197443,2024-01-02T12:10:43+0000
2024-01-02T14,18wnsbc,59,1054,NewsOfTheStupid,2tpr6,"Elon Musk is beefing with Green Day for slamming MAGA in their latest rendition of 'American Idiot'",0,https://www.businessinsider.com/elon-musk-beefs-with-green-day-maga-trump-american-idiot-2024-1,0.94,168,1704196722,2024-01-02T11:58:42+0000
2024-01-02T14,18wnqhi,7,3453,SipsTea,5tdqj0,"She definitely had the right answer",0,https://v.redd.it/ar5bp5j3n0ac1,0.96,111,1704196539,2024-01-02T11:55:39+0000
2024-01-02T14,18wnozz,65,1032,CozyPlaces,34ixl,"New 1920s-inspired sunroom on our 1927 home in Detroit.",0,https://www.reddit.com/gallery/18wnozz,0.97,24,1704196386,2024-01-02T11:53:06+0000
2024-01-02T14,18wnon5,76,975,DOG,2qiy5,"I am friendly",0,https://v.redd.it/74d5ikq1l0ac1,0.94,62,1704196350,2024-01-02T11:52:30+0000
2024-01-02T14,18wnl17,42,1429,nonononoyes,2xp2p,"This could be a sign",0,https://i.redd.it/p3e2m47kl0ac1.jpeg,0.95,57,1704195966,2024-01-02T11:46:06+0000
2024-01-02T14,18wnj2x,97,759,2meirl4meirl,3ee85,2meirl4meirl,0,https://i.redd.it/7nqv2k8xk0ac1.jpeg,0.98,13,1704195753,2024-01-02T11:42:33+0000
2024-01-02T14,18wnh2g,9,3269,politics,2cneq,"Trump paid me to find voter fraud. Then he lied after I found 2020 election wasn't stolen.",0,https://www.usatoday.com/story/opinion/2024/01/02/trump-lies-voter-fraud-2020-impact-2024-election/72057016007/,0.96,113,1704195546,2024-01-02T11:39:06+0000
2024-01-02T14,18wnczc,50,1323,ProgrammerHumor,2tex6,whereIsDbGone,0,https://i.redd.it/l039lib0j0ac1.jpeg,0.98,24,1704195104,2024-01-02T11:31:44+0000
2024-01-02T14,18wn6d4,32,1707,funny,2qh33,"There will always be someone stronger than you.",0,https://v.redd.it/u3hzqi1yg0ac1,0.95,47,1704194413,2024-01-02T11:20:13+0000
2024-01-02T14,18wn68k,87,916,punk,2qjx5,"I don't think she has ever listened to Punk",0,https://i.redd.it/goy6q6wwg0ac1.jpeg,0.94,129,1704194402,2024-01-02T11:20:02+0000
2024-01-02T14,18wn19w,39,1670,memes,2qjpg,"New, years be like",0,https://i.redd.it/uxphq4gdf0ac1.jpeg,0.99,14,1704193882,2024-01-02T11:11:22+0000
2024-01-02T14,18wmxor,8,3992,technicallythetruth,3pzez,"he has Outsmarted our Outsmarting",0,https://i.redd.it/cna18v63e0ac1.png,0.96,34,1704193499,2024-01-02T11:04:59+0000
2024-01-02T14,18wmwiw,92,908,Genshin_Impact,12p4l2,"4.3 Spiral Abyss Usage Rate (Sample size: 160,692)",0,https://www.reddit.com/gallery/18wmwiw,0.94,257,1704193372,2024-01-02T11:02:52+0000
2024-01-02T14,18wmqfw,16,3116,meirl,2s5ti,Meirl,0,https://i.redd.it/k7dzkfbzb0ac1.jpeg,0.98,241,1704192746,2024-01-02T10:52:26+0000
2024-01-02T14,18wmn4q,70,1182,Hololive,29numb,"Damn💀",0,https://i.redd.it/ku3k79hva0ac1.jpeg,0.97,25,1704192392,2024-01-02T10:46:32+0000
2024-01-02T14,18wmmd8,2,8003,wholesomememes,3gcwj,"Strong friendship",0,https://i.redd.it/u2jap3qoa0ac1.png,0.96,277,1704192313,2024-01-02T10:45:13+0000
2024-01-02T14,18wml6n,58,1362,WTF,2qh61,"Aircraft collision in Japan Tokyo-Haneda airport.",0,https://v.redd.it/qe1wlm85a0ac1,0.96,92,1704192188,2024-01-02T10:43:08+0000
2024-01-02T14,18wmkqp,45,1618,Gamingcirclejerk,2sf2b,"Genshin Impact (2020)",0,https://i.redd.it/bbpjuoz6a0ac1.jpeg,0.94,80,1704192140,2024-01-02T10:42:20+0000
2024-01-02T14,18wmiow,77,1151,CrazyFuckingVideos,45hae8,"WWE don't do this at home or at school...",0,https://v.redd.it/o5jnbxwk90ac1,0.94,114,1704191934,2024-01-02T10:38:54+0000
2024-01-02T14,18wmb94,66,1322,gaming,2qh03,"You are forced to choose one and will be stuck with it for the rest of your life, which one?? (Considering Performance is the same for both)",0,https://i.redd.it/f5ljsbkv60ac1.png,0.88,383,1704191105,2024-01-02T10:25:05+0000
2024-01-02T14,18wma4e,64,1361,ich_iel,37k29,"ich🧨🚯iel",0,https://i.redd.it/4acoqfab60ac1.jpeg,0.96,49,1704190975,2024-01-02T10:22:55+0000
2024-01-02T14,18wm4ob,91,1083,OldSchoolCool,2tycb,"Debbie Harry, 1978.",0,https://i.redd.it/ei8zduzy40ac1.jpeg,0.95,33,1704190384,2024-01-02T10:13:04+0000
2024-01-02T14,18wm00l,78,1282,TerrifyingAsFuck,31d92,"Not a single person living in the moment…",0,https://v.redd.it/q5z4mqng30ac1,0.82,253,1704189878,2024-01-02T10:04:38+0000
2024-01-02T14,18wlxgr,1,15883,mildlyinfuriating,2ubgg,"My Friend was Confromted with a Threatening Note at a Guest House in Tokyo",0,https://i.redd.it/a497qflk10ac1.jpeg,0.89,1839,1704189627,2024-01-02T10:00:27+0000
2024-01-02T14,18wlvty,61,1516,Terraria,2sg5b,"Here ya go buddy",0,https://www.reddit.com/gallery/18wlvty,0.88,97,1704189437,2024-01-02T09:57:17+0000
2024-01-02T14,18wltkm,4,6881,funnyvideos,2qoos,"Yo, you got a fucking problem?! ",0,https://v.redd.it/jpboff3d10ac1,0.94,99,1704189172,2024-01-02T09:52:52+0000
2024-01-02T14,18wlncd,3,11979,facepalm,2r5rp,"Ok then, let's bring back slavery!",0,https://i.redd.it/9teyz176zz9c1.jpeg,0.93,1505,1704188446,2024-01-02T09:40:46+0000
2024-01-02T14,18wllob,49,1900,popculturechat,5rj68d,"celebrities going through it in public: a collection",0,https://www.reddit.com/gallery/18wllob,0.91,360,1704188261,2024-01-02T09:37:41+0000
2024-01-02T14,18wlkqv,86,1264,ik_ihe,39bxv,"Ik🚲ihe",0,https://i.redd.it/4n5yhanbyz9c1.jpeg,0.96,35,1704188150,2024-01-02T09:35:50+0000
2024-01-02T14,18wliuz,20,3205,CatastrophicFailure,38tab,"Japan Airlines plane with 367 people on board collides with Coast Guard plane at Tokyo Airport - Jan. 2, 2024 (Tokyo Haneda Airport, Japan)",0,https://v.redd.it/tm9nspsnxz9c1,0.97,259,1704187930,2024-01-02T09:32:10+0000
2024-01-02T14,18wli8x,95,1181,titanfall,2xh0g,"Fuck it nade",0,https://i.redd.it/gmmjx9qfxz9c1.jpeg,0.96,59,1704187861,2024-01-02T09:31:01+0000
2024-01-02T14,18wli31,88,1272,me_irl,2vegg,me_irl,0,https://i.redd.it/fifiv4yexz9c1.jpeg,0.98,23,1704187843,2024-01-02T09:30:43+0000
2024-01-02T14,18wlfvs,48,2002,ukraine,2qqcn,"This morning Russia did another massive missile attack towards Ukraine: 10 out 10 air-launched ballistic missiles ""Kinzhal"" were intercepted, as well as 62 cruise missiles",0,https://i.redd.it/sxn7x7ogwz9c1.jpeg,0.98,119,1704187589,2024-01-02T09:26:29+0000
2024-01-02T14,18wlecz,96,1194,AskReddit,2qh1i,"What is the BIGGEST scam that people still fell for?",1,https://www.reddit.com/r/AskReddit/comments/18wlecz/what_is_the_biggest_scam_that_people_still_fell/,0.88,2263,1704187416,2024-01-02T09:23:36+0000
2024-01-02T14,18wldij,40,2313,whenthe,23gidu,"Lethal company",0,https://v.redd.it/vizumdttvz9c1,0.97,27,1704187316,2024-01-02T09:21:56+0000
2024-01-02T14,18wlbuk,30,2596,news,2qh3l,"Japan Airlines plane in flames at Tokyo airport",0,http://www.bbc.co.uk/news/world-67862011,0.96,261,1704187140,2024-01-02T09:19:00+0000
2024-01-02T14,18wlbp7,11,5320,dankmemes,2zmfe,"Copywrite expiry",0,https://i.redd.it/t83co9u9vz9c1.jpeg,0.93,76,1704187122,2024-01-02T09:18:42+0000
2024-01-02T14,18wl59c,83,1398,aviation,2qhu8,"Just saw this on the news. JAL plane at Haneda. Any information?",0,https://www.reddit.com/gallery/18wl59c,0.96,403,1704186374,2024-01-02T09:06:14+0000
2024-01-02T14,18wl41n,5,7590,pcmasterrace,2sgp1,"Thanks I guess?",0,https://www.reddit.com/gallery/18wl41n,0.98,92,1704186230,2024-01-02T09:03:50+0000
2024-01-02T14,18wl03r,72,1631,PropagandaPosters,2rm3n,"""They're having problems with their economy again"" [1975]",0,https://i.redd.it/qzaxl24arz9c1.jpeg,0.95,60,1704185806,2024-01-02T08:56:46+0000
2024-01-02T14,18wkyuf,100,1228,youtube,2qh44,"OH MY FUCKING GOD LEAVE ME ALONE",0,https://i.redd.it/2r1bexcxqz9c1.jpeg,0.97,75,1704185664,2024-01-02T08:54:24+0000
2024-01-02T14,18wktge,24,3400,worldnews,2qh13,"Ukraine updates: Russia hits Kyiv with heavy missile attack – DW",0,https://www.dw.com/en/ukraine-updates-russia-hits-kyiv-with-heavy-missile-attack/live-67871492,0.95,296,1704185039,2024-01-02T08:43:59+0000
2024-01-02T14,18wkrhw,13,4987,Damnthatsinteresting,2xxyj,"In 2015, North Koreans in Pyongyang witnessed their first concert by outsiders. It was a band called Laibach from the small European country Slovenia.",0,https://v.redd.it/pm89mr6coz9c1,0.96,343,1704184819,2024-01-02T08:40:19+0000
2024-01-02T14,18wkq9u,22,3688,comics,2qh0s,"Part 2 Swipe Adventure Collab with Swords Comic - Pick a rock, swipe to loot",0,https://www.reddit.com/gallery/18wkq9u,0.95,176,1704184681,2024-01-02T08:38:01+0000
2024-01-02T14,18wkoe7,6,7511,fixedbytheduet,46tcaa,Education,0,https://v.redd.it/vthgkznanz9c1,0.94,312,1704184461,2024-01-02T08:34:21+0000
2024-01-02T14,18wklh5,25,3534,mildlyinteresting,2ti4h,"this honey container from my hotel breakfast buffet is edible",0,https://i.redd.it/tbbjoq8emz9c1.jpeg,0.96,181,1704184138,2024-01-02T08:28:58+0000
2024-01-02T14,18wkint,71,4717,facepalm,2r5rp,"I’m grateful that I didn’t grow around this kind of misogyny",0,https://i.redd.it/t6bpp5dflz9c1.jpeg,0.91,1202,1704183810,2024-01-02T08:23:30+0000
2024-01-02T14,18wkhip,23,4281,cursedcomments,hw1ju,Cursed_270minutes,0,https://i.redd.it/m2jaivy0lz9c1.jpeg,0.98,57,1704183676,2024-01-02T08:21:16+0000
2024-01-02T14,18wkdl5,36,2875,FunnyandSad,2z7qd,"Father ""supports""",0,https://i.redd.it/chmnd2omjz9c1.jpeg,0.94,65,1704183223,2024-01-02T08:13:43+0000
2024-01-02T14,18wkcl9,33,3055,Weird,2qlia,"I took an impression of my belly button!",0,https://i.redd.it/4rwqtf1cjz9c1.jpeg,0.88,508,1704183109,2024-01-02T08:11:49+0000
2024-01-02T14,18wk59s,60,2182,lotr,2rfb9,"I take pride in this",0,https://v.redd.it/njajtna1hz9c1,0.93,41,1704182342,2024-01-02T07:59:02+0000
2024-01-02T14,18wjzna,57,2385,australia,2qh8e,"Pretty much the perfect welcome home to Australia after living abroad for 6 years lmao 🇦🇺",0,https://v.redd.it/2dngzwa5fz9c1,0.96,166,1704181708,2024-01-02T07:48:28+0000
2024-01-02T14,18wjxzw,12,6481,OneOrangeBraincell,5vej89,"Bagel hates my new fish flops.",0,https://i.redd.it/wp24xgbgez9c1.jpeg,0.97,118,1704181536,2024-01-02T07:45:36+0000
2024-01-02T14,18wjod8,85,1902,Awww,2suml,"Captured: A Magical Feline Encounter",0,https://v.redd.it/90d208mebz9c1,0.96,17,1704180492,2024-01-02T07:28:12+0000
2024-01-02T14,18wjjal,67,2323,notliketheothergirls,3opft,"Okay so… Found this on Tik Tok…",0,https://www.reddit.com/gallery/18wjjal,0.95,85,1704179943,2024-01-02T07:19:03+0000
2024-01-02T14,18wjhis,75,2221,CuratedTumblr,3x5kfw,"I have never seen Paw Patrol, but I've seen the discourse",0,https://i.redd.it/9flq3rd89z9c1.png,0.94,118,1704179759,2024-01-02T07:15:59+0000
2024-01-02T14,18wjd83,63,2553,terriblefacebookmemes,2tja6,"Finally found something terrible",0,https://i.redd.it/51l0znq08z9c1.jpeg,0.93,144,1704179302,2024-01-02T07:08:22+0000
2024-01-02T14,18wj9o5,10,8613,europe,2qh4j,"Kyiv today",0,https://www.reddit.com/gallery/18wj9o5,0.91,987,1704178913,2024-01-02T07:01:53+0000
2024-01-02T14,18wi2m2,26,5923,CFB,2qm9d,"[Postgame Thread] Washington Defeats Texas 37-31",1,https://www.reddit.com/r/CFB/comments/18wi2m2/postgame_thread_washington_defeats_texas_3731/,0.94,5120,1704174723,2024-01-02T05:52:03+0000
2024-01-02T14,18wi1st,31,5318,MapPorn,2si92,"European countries where the majority believes/doesn't believe in God",0,https://i.redd.it/ck6ijby6uy9c1.png,0.92,1118,1704174652,2024-01-02T05:50:52+0000
2024-01-02T14,18whwap,84,2719,ExplainTheJoke,2vmj2,"My friend called me an uncultured swine for not getting this",0,https://i.redd.it/tvx4nzjosy9c1.jpeg,0.85,154,1704174143,2024-01-02T05:42:23+0000
2024-01-02T14,18whigw,44,5388,HolUp,qir9n,"Absolute insult",0,https://i.redd.it/uwlrig4woy9c1.jpeg,0.9,326,1704172871,2024-01-02T05:21:11+0000
2024-01-02T14,18whccp,34,5791,MadeMeSmile,2uqcm,"Rasputin dance couple",0,https://v.redd.it/d7eegja6ny9c1,0.88,203,1704172324,2024-01-02T05:12:04+0000
2024-01-02T14,18whazx,18,9409,oddlysatisfying,2x93b,"Precise tile work being done",0,https://v.redd.it/1srbs5humy9c1,0.94,210,1704172209,2024-01-02T05:10:09+0000
2024-01-02T14,18wha5w,79,12237,Damnthatsinteresting,2xxyj,"Twins born in two different years",0,https://i.redd.it/0r3w3qhgmy9c1.png,0.92,304,1704172130,2024-01-02T05:08:50+0000
2024-01-02T14,18wh2lo,62,3826,toptalent,3ptyd,"New Years drone show",0,https://v.redd.it/rpm9vvm3ky9c1,0.96,106,1704171475,2024-01-02T04:57:55+0000
2024-01-02T14,18wgxzz,17,16375,shitposting,2usxq,"mommy kink",0,https://i.redd.it/7gytyj5hjy9c1.png,0.96,142,1704171052,2024-01-02T04:50:52+0000
2024-01-02T14,18wgcoh,80,3702,nba,2qo4s,"[Highlight] Delta Center erupts as Jordan Clarkson grabs his tenth rebound, breaking the Utah Jazz’s 15 year triple double curse",0,https://streamable.com/xtdbij,0.96,214,1704169185,2024-01-02T04:19:45+0000
2024-01-02T14,18wg9a5,35,7199,therewasanattempt,39ne7,"To be a TikTok prankster",0,https://v.redd.it/lh7wr371dy9c1,0.95,651,1704168886,2024-01-02T04:14:46+0000
2024-01-02T14,18wg11y,55,5763,Unexpected,2w67q,"hyundai car is trash?",0,https://v.redd.it/9jx7bnyxay9c1,0.92,238,1704168180,2024-01-02T04:03:00+0000
2024-01-02T14,18wfs4q,14,19851,pics,2qh0u,"Conan O'Brien during his visit to the White House last month",0,https://i.redd.it/zmwinfjh8y9c1.jpeg,0.9,783,1704167426,2024-01-02T03:50:26+0000
2024-01-02T14,18wfqu4,28,12175,Funnymemes,2xqtc,"Which corner is the most beautiful?😂",0,https://i.redd.it/hosseb2b8y9c1.jpeg,0.91,860,1704167319,2024-01-02T03:48:39+0000
2024-01-02T14,18wfo6e,15,20584,WhitePeopleTwitter,35n7t,"Donald Trump is confirmed to be on the Epstein flight logs...",0,https://i.redd.it/25h573cp7y9c1.jpeg,0.92,1110,1704167104,2024-01-02T03:45:04+0000
2024-01-02T14,18wfg8q,21,14372,todayilearned,2qqjc,"TIL: A wealthy stock trader was sentenced in 2017 after a man he hired to dig a secret tunnel to a nuclear bunker died a fiery death. He made him wear blackout glasses, spoofed the wifi, and lowers a bucket for his tunnel guy to relieve himself for days at a time to keep the location secret.",0,https://wpde.com/news/nation-world/millionaire-resentenced-for-fiery-death-of-man-digging-secret-tunnels-under-maryland-home,0.95,645,1704166440,2024-01-02T03:34:00+0000
2024-01-02T14,18wfav2,19,17759,holdmycatnip,2zhxd,"Waiting for her food dispenser",0,https://v.redd.it/e74a57oh4y9c1,0.96,193,1704166015,2024-01-02T03:26:55+0000
2024-01-02T14,18wf1ie,99,3560,ChatGPT,7hqomg,"Public Domain Jailbreak",0,https://www.reddit.com/gallery/18wf1ie,0.97,120,1704165248,2024-01-02T03:14:08+0000
2024-01-02T14,18weppr,43,9215,Satisfyingasfuck,31s00,"cleaning and manicuring horses",0,https://v.redd.it/39or67nczx9c1,0.94,684,1704164304,2024-01-02T02:58:24+0000
2024-01-02T14,18wec6a,74,5601,LateStageCapitalism,39qgx,"Yeah F filing taxes anymore, straight up. They cant come after us all now, IRS are a joke.",0,https://i.redd.it/emeq9p00wx9c1.jpeg,0.87,308,1704163235,2024-01-02T02:40:35+0000
2024-01-02T14,18wdun7,41,14587,TikTokCringe,mvcq5,"Skywriter spells ""UR TAXES KILLED 10K GAZA KIDS"" over Universal Studios today.",0,https://v.redd.it/y9b1mwu9sx9c1,0.81,2561,1704161899,2024-01-02T02:18:19+0000
2024-01-02T14,18wds1t,29,18724,nextfuckinglevel,m0bnr,"Thought the Diva Dance song was physically impossible for a human. How does she do this?",0,https://v.redd.it/ghlq20chrx9c1,0.92,802,1704161697,2024-01-02T02:14:57+0000
2024-01-02T14,18wdll1,54,9134,Whatcouldgowrong,2x2oy,"Don’t get too cocky ",0,https://v.redd.it/jbrdaho4qx9c1,0.91,288,1704161186,2024-01-02T02:06:26+0000
2024-01-02T14,18wdhpx,53,9036,PublicFreakout,2yrq6,"People who do this deserve jail",0,https://v.redd.it/hmk1k666px9c1,0.92,1208,1704160877,2024-01-02T02:01:17+0000
2024-01-02T14,18wda2q,98,4715,sports,2qgzy,"Michigan stops Alabama in OT to advance to the National Title game",0,https://v.redd.it/ydunkohgnx9c1,0.9,455,1704160290,2024-01-02T01:51:30+0000
2024-01-02T14,18wd81o,52,8671,AntiTrumpAlliance,3i9if,"Trump and Kennedy in Epstein’s flight log. Does MAGA care?",0,https://i.redd.it/sjsc88y0nx9c1.jpeg,0.94,250,1704160134,2024-01-02T01:48:54+0000
2024-01-02T14,18wd3zl,47,11322,FluentInFinance,3qpaq8,"What killed the American Dream?",0,https://i.redd.it/w6ow5fx0mx9c1.png,0.91,1289,1704159808,2024-01-02T01:43:28+0000
2024-01-02T14,18wcy8v,27,20206,gifs,2qt55,"I like to cut playing cards by hand using a xacto blade. I cut all 52, stack, and slide them back in the box.",0,https://i.redd.it/ewniyr9akx9c1.gif,0.95,277,1704159344,2024-01-02T01:35:44+0000
2024-01-02T14,18wct4d,46,11494,aww,2qh1o,"We went to get a kitten last night and couldn't decide on which little girl to adopt so we took both, they are sisters who get to spend their whole lives together. Meet Midnight and Ghostface",0,https://i.redd.it/0bm45bo6jx9c1.jpeg,0.96,173,1704158943,2024-01-02T01:29:03+0000
2024-01-02T14,18wcqde,37,15610,interestingasfuck,2qhsa,"Epstein flight logs released in USA vs. Maxwell",0,https://www.documentcloud.org/documents/21165424-epstein-flight-logs-released-in-usa-vs-maxwell,0.9,1385,1704158717,2024-01-02T01:25:17+0000
2024-01-02T14,18wc9rq,69,14824,PeterExplainsTheJoke,121h8r,Petahh?,0,https://i.redd.it/s66fe7fxex9c1.jpeg,0.82,894,1704157411,2024-01-02T01:03:31+0000
2024-01-02T14,18wc6yf,68,10087,BaldursGate3,12967t,"Just doesn’t compare.",0,https://v.redd.it/x1ha7z6cex9c1,0.9,690,1704157215,2024-01-02T01:00:15+0000
2024-01-02T14,18wbqgh,38,27684,WatchPeopleDieInside,3h4zq,"2 girls practice their catwalk…Only to realize they’ve been caught on camera 🤣",0,https://v.redd.it/genogtemax9c1,0.92,439,1704155987,2024-01-02T12:39:47+0000
2024-01-02T14,18wasw2,51,17304,technology,2qh16,"Moderna’s mRNA cancer vaccine works even better than thought",0,https://www.freethink.com/health/cancer-vaccine,0.93,975,1704153550,2024-01-01T11:59:10+0000
2024-01-02T14,18wamyz,81,11135,NonPoliticalTwitter,39gt6y,Imagine...,0,https://i.redd.it/ot26hok42x9c1.jpeg,0.97,63,1704153106,2024-01-01T11:51:46+0000
2024-01-02T14,18waehh,82,13458,tumblr,2r7hk,"You should've become beautiful but you got forced out too soon and now you're in a fucked up half done state",0,https://i.redd.it/gasvyx7mzw9c1.png,0.95,312,1704152489,2024-01-01T11:41:29+0000
2024-01-02T14,18wa2py,89,9756,GetNoted,91bxd4,"Oil shill gets owned",0,https://i.redd.it/nqmnp1zqxw9c1.jpeg,0.96,208,1704151634,2024-01-01T11:27:14+0000
2024-01-02T14,18w9wcd,73,18358,Wellthatsucks,2xcv7,"Worked up the courage to go to a bar to try and socialize. Even the bar tender stepped out for a smoke",0,https://www.reddit.com/gallery/18w9wcd,0.89,663,1704151184,2024-01-01T11:19:44+0000
2024-01-02T14,18w9uot,93,12303,BeAmazed,363r3,"Smart boy",0,https://v.redd.it/cfcqbtg0ww9c1,0.9,320,1704151065,2024-01-01T11:17:45+0000
2024-01-02T14,18w80e4,94,15218,Fauxmoi,2rqcm8,"David Beckham posts photo with Victoria’s “very working class” family",0,https://i.redd.it/inovp9m4iw9c1.jpeg,0.93,598,1704146381,2024-01-01T09:59:41+0000
