date,id,position,score,subreddit_display_name,subreddit_id,title,is_self,url,upvote_ratio,num_comments,created,created_date
2024-01-06T17,190219i,56,1142,notliketheothergirls,3opft,"Now it’s a little doggie!!!!",0,https://www.reddit.com/gallery/190219i,0.96,56,1704553932,2024-01-06T03:12:12+0000
2024-01-06T17,1901xaa,42,1444,AITAH,446kys,"AITAH For Publicly Humiliating My Friend Who Confessed To My Husband",1,https://www.reddit.com/r/AITAH/comments/1901xaa/aitah_for_publicly_humiliating_my_friend_who/,0.94,400,1704553616,2024-01-06T03:06:56+0000
2024-01-06T17,1901pgz,86,2325,clevercomebacks,dyqlw,"Billions and billions of people",0,https://i.redd.it/jxzwugm83uac1.jpeg,0.99,114,1704553007,2024-01-06T02:56:47+0000
2024-01-06T17,1901lkq,41,1518,ich_iel,37k29,"ich🤔iel",0,https://i.redd.it/8z8f6lw92uac1.jpeg,0.98,76,1704552684,2024-01-06T02:51:24+0000
2024-01-06T17,1901lij,76,945,TwoXChromosomes,2r2jt,"I'm sorry, but is there a sub for women and women's issues where it's not just stories of women staying with the worst fucking men?",1,https://www.reddit.com/r/TwoXChromosomes/comments/1901lij/im_sorry_but_is_there_a_sub_for_women_and_womens/,0.88,183,1704552678,2024-01-06T02:51:18+0000
2024-01-06T17,1901i3a,90,2321,therewasanattempt,39ne7,"To prevent from sitting",0,https://i.redd.it/c6iqlwxd1uac1.jpeg,0.97,159,1704552385,2024-01-06T02:46:25+0000
2024-01-06T17,1901c0h,12,3999,facepalm,2r5rp,"Followed it ""exactly""",0,https://i.redd.it/sqelbj1wztac1.jpeg,0.98,98,1704551882,2024-01-06T02:38:02+0000
2024-01-06T17,19019fs,45,1512,houseplants,2skiq,"How can I get rid of these pandas eating all my plants?",0,https://i.redd.it/i4wzltz8ztac1.jpeg,0.9,105,1704551668,2024-01-06T02:34:28+0000
2024-01-06T17,19017cr,72,1044,cats,2qhta,"The surface temp of these bros is around 140F",0,https://i.redd.it/t9xs58oqytac1.jpeg,0.99,28,1704551496,2024-01-06T02:31:36+0000
2024-01-06T17,1900z16,46,1528,technology,2qh16,"YouTube demonetizes public domain 'Steamboat Willie' video after copyright claim",0,https://mashable.com/article/youtube-demontizes-public-domain-steamboat-willie-disney-copyright-claim,0.95,118,1704550810,2024-01-06T02:20:10+0000
2024-01-06T17,1900rvp,26,2511,BlackPeopleTwitter,33x33,"Sometimes it don’t really take a lot to hear them out.",0,https://v.redd.it/vqgf6jgwutac1,0.96,145,1704550212,2024-01-06T02:10:12+0000
2024-01-06T17,1900rbv,66,1213,DIY,2qh7d,"My vent / heater connects to my roommates room and I can hear EVERYTHING. How can I muffle the sounds?",0,https://i.redd.it/v2goswfsutac1.jpeg,0.94,819,1704550166,2024-01-06T02:09:26+0000
2024-01-06T17,1900ngm,30,2396,law,2qh9k,"Trump used four properties to accept $7.8 million from foreign governments, during his presidency — without congressional approval per Article I of the U.S. Constitution",0,https://oversightdemocrats.house.gov/sites/democrats.oversight.house.gov/files/2024-01-04.COA%20DEMS%20-%20Mazars%20Report.pdf,0.96,203,1704549839,2024-01-06T02:03:59+0000
2024-01-06T17,1900jra,100,935,insanepeoplefacebook,3acf2,"What an appropriate cake for a child!",0,https://www.reddit.com/gallery/1900jra,0.97,141,1704549530,2024-01-06T01:58:50+0000
2024-01-06T17,1900gll,10,4350,PoliticalHumor,2qm21,"Donnie wins again",0,https://i.redd.it/kkigqk8xrtac1.png,0.96,200,1704549247,2024-01-06T01:54:07+0000
2024-01-06T17,1900ey8,32,2478,oddlysatisfying,2x93b,"Making a pysanky egg",0,https://v.redd.it/d6aby4clrtac1,0.96,62,1704549093,2024-01-06T01:51:33+0000
2024-01-06T17,1900cz3,16,3713,pics,2qh0u,"Whenever it freezes this happens to our spare bedroom windows.",0,https://www.reddit.com/gallery/1900cz3,0.98,162,1704548926,2024-01-06T01:48:46+0000
2024-01-06T17,1900cml,81,2798,facepalm,2r5rp,"This is Roya Heshmati, a woman in Iran who just received 74 lashes from the islamic regime for not wearing an Islamic veil to cover her head .",0,https://i.redd.it/d9khl8wzqtac1.jpeg,0.94,592,1704548896,2024-01-06T01:48:16+0000
2024-01-06T17,1900bq1,9,4501,blunderyears,2vy3g,"The year is 2012. Tumblr, planking, and mustaches are all the rage. Your dad got you a digital camera for Christmas. Life is good.",0,https://www.reddit.com/gallery/1900bq1,0.95,327,1704548808,2024-01-06T01:46:48+0000
2024-01-06T17,1900b27,19,3666,perfectlycutscreams,3n7fs,"This Chiropractor got no chill",0,https://v.redd.it/gczngswgqtac1,0.91,433,1704548750,2024-01-06T01:45:50+0000
2024-01-06T17,190071e,70,1251,atheism,2qh2p,"My aunt lost 2 daughters the same week and the Pastor said don't question God.",1,https://www.reddit.com/r/atheism/comments/190071e/my_aunt_lost_2_daughters_the_same_week_and_the/,0.93,233,1704548393,2024-01-06T01:39:53+0000
2024-01-06T17,19006xe,49,1597,dataisbeautiful,2tk95,"[OC] Generation Z are increasingly working during their High School years (16-19 year olds) after a significant drop during the Millennial generation. Still not as much a Generation X, Boomers, and the Silent Generation.",0,https://i.redd.it/93629m1sotac1.jpeg,0.9,409,1704548383,2024-01-06T01:39:43+0000
2024-01-06T17,19005x7,17,4089,shitposting,2usxq,"News report",0,https://v.redd.it/o27tjc4rotac1,0.96,86,1704548288,2024-01-06T01:38:08+0000
2024-01-06T17,19003cg,20,3521,politics,2cneq,"Biden Torches ‘Loser’ Trump at Length During Fiery Campaign Speech",0,https://www.rollingstone.com/politics/politics-news/biden-torches-loser-trump-2024-campaign-speech-pennsylvania-1234941332/,0.95,209,1704548045,2024-01-06T01:34:05+0000
2024-01-06T17,18zzzs6,38,2108,UkraineWarVideoReport,5wjmo8,"Ukrainian combat medic Halyna Fedyshyn before and after Russian captivity",0,https://i.redd.it/liu7n49hntac1.jpeg,0.96,163,1704547715,2024-01-06T01:28:35+0000
2024-01-06T17,18zzx6d,53,1663,notinteresting,2u0xf,"I messaged this guy and he did not respond",0,https://i.redd.it/ul8dnoarmtac1.jpeg,0.96,84,1704547465,2024-01-06T01:24:25+0000
2024-01-06T17,18zzwyd,1,19630,Unexpected,2w67q,"Hope the guy is okay",0,https://v.redd.it/ohklfhgomtac1,0.89,264,1704547444,2024-01-06T01:24:04+0000
2024-01-06T17,18zzwan,34,2506,SipsTea,5tdqj0,"Parking lot review is a thing?",0,https://v.redd.it/irly86bhmtac1,0.91,334,1704547381,2024-01-06T01:23:01+0000
2024-01-06T17,18zzvoa,5,8848,memes,2qjpg,"That's exactly how it is.",0,https://v.redd.it/hw99og10mtac1,0.98,155,1704547324,2024-01-06T01:22:04+0000
2024-01-06T17,18zzu89,88,1168,harrypotter,2qiqi,"I still don't know if she actually meant it 💀",0,https://i.redd.it/tndrwmutltac1.png,0.96,58,1704547191,2024-01-06T01:19:51+0000
2024-01-06T17,18zzt37,44,1960,antiwork,2y77d,"Back pain due to months of using company-issued ""chairs"" so I bought my own and it went over about as well as a bucket of farts",0,https://www.reddit.com/gallery/18zzt37,0.96,198,1704547079,2024-01-06T01:17:59+0000
2024-01-06T17,18zzpiz,60,1559,BikiniBottomTwitter,3deqz,"Geniuses. They hid it in plain sight.",0,https://v.redd.it/i5uwgdtiktac1,0.94,27,1704546741,2024-01-06T01:12:21+0000
2024-01-06T17,18zzouf,94,1116,thalassophobia,2xfs1,"For me this shot is the scariest part of Jaws.",0,https://i.redd.it/8jwuweqektac1.jpeg,0.96,90,1704546675,2024-01-06T01:11:15+0000
2024-01-06T17,18zzmvv,2,11300,WhitePeopleTwitter,35n7t,"He told parents to get over their dead kids…..",0,https://i.redd.it/8lcmbofvjtac1.jpeg,0.95,396,1704546495,2024-01-06T01:08:15+0000
2024-01-06T17,18zzk43,40,2190,CuratedTumblr,3x5kfw,"Pascal's wager for techbros made up by a Harry Potter fic writer.",0,https://i.redd.it/l3zz72switac1.jpeg,0.96,152,1704546204,2024-01-06T01:03:24+0000
2024-01-06T17,18zzgwn,74,3777,shitposting,2usxq,Real,0,https://v.redd.it/0ketr2z4itac1,0.97,92,1704545912,2024-01-06T12:58:32+0000
2024-01-06T17,18zzgve,35,2523,todayilearned,2qqjc,"TIL Australia's first govt-backed pill & drug testing service, after its first month of operation, found that all the cocaine tested by the service had purity levels below 27% with 40% of the samples containing zero cocaine.",0,https://www.theguardian.com/society/2022/aug/25/first-government-backed-pill-testing-clinic-finds-40-of-cocaine-contained-no-coke,0.98,132,1704545907,2024-01-06T12:58:27+0000
2024-01-06T17,18zzeti,15,4639,Eyebleach,2s427,"Clouded leopard and a photographer",0,https://i.imgur.com/nr2ZH2k.gifv,0.98,82,1704545703,2024-01-06T12:55:03+0000
2024-01-06T17,18zzca9,28,3199,BeAmazed,363r3,"This Japanese Mcdonalds has a phone cleaner in the bathroom",0,https://i.imgur.com/njVz63a.gifv,0.95,286,1704545443,2024-01-06T12:50:43+0000
2024-01-06T17,18zzc5c,27,3126,PublicFreakout,2yrq6,"Unhinged at its finest ",0,https://v.redd.it/seuadiapgtac1,0.93,536,1704545431,2024-01-06T12:50:31+0000
2024-01-06T17,18zzbo2,96,1198,Wellthatsucks,2xcv7,"Gas leak mistaken as fog",0,https://i.imgur.com/MQZvByh.gifv,0.99,52,1704545387,2024-01-06T12:49:47+0000
2024-01-06T17,18zz9m1,95,1205,aww,2qh1o,"Hope he'll rate 5 star for the service 😁",0,https://v.redd.it/h7q5c6jpftac1,0.97,16,1704545165,2024-01-06T12:46:05+0000
2024-01-06T17,18zz4rj,31,3135,Satisfyingasfuck,31s00,"The perfect creamy carbonara",0,https://v.redd.it/vcj000odetac1,0.92,281,1704544672,2024-01-06T12:37:52+0000
2024-01-06T17,18zz3xf,75,1460,TheMajorityReport,36goq,"Irish MP to EU ""When you are going to move beyond words of concern and impose sanction on Israel?!""",0,https://v.redd.it/k4qy8716etac1,0.9,60,1704544580,2024-01-06T12:36:20+0000
2024-01-06T17,18zz198,63,1705,dankmemes,2zmfe,"With extra step",0,https://i.redd.it/0rd7y9mbdtac1.jpeg,0.85,102,1704544293,2024-01-06T12:31:33+0000
2024-01-06T17,18zyyzb,67,1647,Animemes,2w6fe,"Dear lord",0,https://i.redd.it/2osrnwhmctac1.jpeg,0.98,42,1704544057,2024-01-06T12:27:37+0000
2024-01-06T17,18zyxzc,29,3442,europe,2qh4j,"European passport rank",0,https://i.redd.it/5fccj06bctac1.jpeg,0.87,486,1704543951,2024-01-06T12:25:51+0000
2024-01-06T17,18zyw3s,36,2919,Terraria,2sg5b,"Useful concept I made :)",0,https://i.redd.it/4sa28wsobtac1.jpeg,0.96,73,1704543744,2024-01-06T12:22:24+0000
2024-01-06T17,18zytu7,25,3798,nextfuckinglevel,m0bnr,"Props to the pilot landing this plane with a hole in the side yesterday",0,https://v.redd.it/7q5ry3uyatac1,0.95,512,1704543507,2024-01-06T12:18:27+0000
2024-01-06T17,18zyt1b,6,11610,funnyvideos,2qoos,"Heckler making fun of comedian.",0,https://v.redd.it/isn1jyznatac1,0.88,482,1704543418,2024-01-06T12:16:58+0000
2024-01-06T17,18zysn6,73,1570,MinecraftMemes,2sq0h,"The New Rock Paper Scissors [OC]",0,https://i.redd.it/ucom6criatac1.png,0.99,28,1704543374,2024-01-06T12:16:14+0000
2024-01-06T17,18zyq7j,62,1826,rickandmorty,2u4lp,"All the fake opening credit scenes",0,https://www.reddit.com/gallery/18zyq7j,0.96,165,1704543103,2024-01-06T12:11:43+0000
2024-01-06T17,18zyo6p,22,4624,therewasanattempt,39ne7,"To defend billionaires.",0,https://v.redd.it/bgl07a539tac1,0.9,170,1704542892,2024-01-06T12:08:12+0000
2024-01-06T17,18zynmx,77,1604,cursedcomments,hw1ju,Cursed_Bull,0,https://i.redd.it/kvhzzm7z8tac1.jpeg,0.99,36,1704542831,2024-01-06T12:07:11+0000
2024-01-06T17,18zy7d9,82,1642,NatureIsFuckingLit,3gdh7,"🔥A Blue-ringed Octopus, one of the world's most venomous marine animals.",0,https://v.redd.it/ceunqc1r3tac1,0.97,39,1704541074,2024-01-06T11:37:54+0000
2024-01-06T17,18zy5cd,64,2020,BrandNewSentence,mbn0j,"“I have become pregnant from the starter fluid”",0,https://i.redd.it/9tltohv23tac1.jpeg,0.95,157,1704540848,2024-01-06T11:34:08+0000
2024-01-06T17,18zy3fb,7,15920,mildlyinfuriating,2ubgg,"I have been mistaken for my boyfriend’s mother twice.",0,https://www.reddit.com/gallery/18zy3fb,0.89,3489,1704540636,2024-01-06T11:30:36+0000
2024-01-06T17,18zy1it,55,2376,HonkaiStarRail,4q5zoc,"Since everyone’s been praising the game recently , say one thing to criticise it on.",0,https://i.redd.it/66p5f2wu1tac1.jpeg,0.92,621,1704540437,2024-01-06T11:27:17+0000
2024-01-06T17,18zy0o8,3,29832,interestingasfuck,2qhsa,"When a Retired Veteran Soldier Play Battlefield for the first time",0,https://v.redd.it/dh0tsfnk1tac1,0.91,733,1704540342,2024-01-06T11:25:42+0000
2024-01-06T17,18zy0g5,4,18530,clevercomebacks,dyqlw,"I wonder who won that war?",0,https://i.redd.it/iwql1plh1tac1.jpeg,0.93,920,1704540313,2024-01-06T11:25:13+0000
2024-01-06T17,18zxz6c,52,2381,holdmycatnip,2zhxd,"Secret guest",0,https://i.imgur.com/YugrIJt.gifv,0.97,21,1704540168,2024-01-06T11:22:48+0000
2024-01-06T17,18zxy28,23,5057,me_irl,2vegg,"Me irl",0,https://i.redd.it/hbf9sg2p0tac1.jpeg,0.91,421,1704540047,2024-01-06T11:20:47+0000
2024-01-06T17,18zxws1,98,3965,BeAmazed,363r3,"How porcupine quills work",0,https://v.redd.it/3jrllzt80tac1,0.98,53,1704539914,2024-01-06T11:18:34+0000
2024-01-06T17,18zxwnu,83,4775,Unexpected,2w67q,"Dude reloaded last auto save ",0,https://v.redd.it/gpubhod90tac1,0.97,83,1704539902,2024-01-06T11:18:22+0000
2024-01-06T17,18zxq4g,92,1714,foundsatan,r681a,"GAH DAMN",0,https://i.redd.it/bzv1iw11ysac1.png,0.96,26,1704539167,2024-01-06T11:06:07+0000
2024-01-06T17,18zxpmc,13,8309,comics,2qh0s,"‘Shootout’",0,https://www.reddit.com/gallery/18zxpmc,0.91,62,1704539113,2024-01-06T11:05:13+0000
2024-01-06T17,18zxo6j,51,2612,MemePiece,2tt3v,"Someone get him an icepack and a cooler story! Quick!",0,https://www.reddit.com/gallery/18zxo6j,0.96,85,1704538945,2024-01-06T11:02:25+0000
2024-01-06T17,18zxny7,80,1870,scambait,2r0z5,"Same scammer tries again after a few days",0,https://www.reddit.com/gallery/18zxny7,0.97,156,1704538926,2024-01-06T11:02:06+0000
2024-01-06T17,18zxivm,69,2173,gtaonline,2xrd1,"Did someone seriously just spend $750k to kill 3 dogs? 🤦‍♂️",0,https://v.redd.it/5ge9b3qnvsac1,0.94,67,1704538373,2024-01-06T10:52:53+0000
2024-01-06T17,18zxeum,97,1696,LeagueOfMemes,2tf0e,"Smolder when he successfully divide the league community because of his initial design ",0,https://v.redd.it/65oq47fcusac1,0.95,57,1704537911,2024-01-06T10:45:11+0000
2024-01-06T17,18zxalp,79,2018,chaoticgood,2qjo5,"The response of Cards Against Humanity to legislation pertaining to trigger laws.",0,https://i.redd.it/rzj2yt8mssac1.jpeg,0.94,123,1704537421,2024-01-06T10:37:01+0000
2024-01-06T17,18zx9ng,8,14510,Damnthatsinteresting,2xxyj,"New Photo of the Alaska Boeing 737 after depressurization. The Airplane in question was very newly delivered from Boeing",0,https://i.redd.it/2pop6afkssac1.jpeg,0.97,1945,1704537312,2024-01-06T10:35:12+0000
2024-01-06T17,18zx8kr,14,11360,MadeMeSmile,2uqcm,"New Zealand's youngest ever MP starts her first parliament speech by performing haka",0,https://v.redd.it/gqc8mmuursac1,0.79,1632,1704537174,2024-01-06T10:32:54+0000
2024-01-06T17,18zwx4d,65,2679,Hololive,29numb,"ayo wtf she readin' all of it 💀",0,https://i.redd.it/fyqiu3i7osac1.jpeg,0.94,121,1704535847,2024-01-06T10:10:47+0000
2024-01-06T17,18zwvp0,33,4813,science,mouw,"Same-sex sexual behavior does not result in offspring, and evolutionary biologists have wondered how genes associated with this behavior persisted. A new study revealed that male heterosexuals who carry genes associated with bisexual behavior father more children and are more likely risk-takers.",0,https://news.umich.edu/genetic-variants-underlying-male-bisexual-behavior-risk-taking-linked-to-more-children-study-shows/,0.89,519,1704535686,2024-01-06T10:08:06+0000
2024-01-06T17,18zwsiv,24,7410,technicallythetruth,3pzez,"My English teacher has this in her classroom",0,https://i.redd.it/ucw02dykmsac1.png,0.96,72,1704535311,2024-01-06T10:01:51+0000
2024-01-06T17,18zwom1,59,2963,2westerneurope4u,66zq15,"Respect for our Italian bros for welcoming regularly and massively the most annoying tourists in the world 🙏",0,https://v.redd.it/7787ghddlsac1,0.88,356,1704534894,2024-01-06T09:54:54+0000
2024-01-06T17,18zwiwf,11,18566,pcmasterrace,2sgp1,"First build, is that enough fans ?",0,https://i.redd.it/e6redv6djsac1.jpeg,0.92,2190,1704534218,2024-01-06T09:43:38+0000
2024-01-06T17,18zwgod,58,3151,IASIP,2s28b,"I reached this episode today and it completely unzipped me.",0,https://i.redd.it/jvdw241kisac1.jpeg,0.93,304,1704533945,2024-01-06T09:39:05+0000
2024-01-06T17,18zw2c8,18,12147,PrequelMemes,3i60n,"Directed by Michael Bay",0,https://v.redd.it/pbc08ypmdsac1,0.95,279,1704532289,2024-01-06T09:11:29+0000
2024-01-06T17,18zvysg,43,4701,rareinsults,48t85,"Pokémon don't care about your feelings",0,https://i.redd.it/8p3kfgpdcsac1.png,0.96,61,1704531884,2024-01-06T09:04:44+0000
2024-01-06T17,18zvxo6,21,9714,funny,2qh33,"Best way to advertise ",0,https://v.redd.it/kdh0rwi1csac1,0.91,155,1704531759,2024-01-06T09:02:39+0000
2024-01-06T17,18zvw2v,61,3446,ProgrammerHumor,2tex6,nodeModules,0,https://i.redd.it/fhc1xo0mbsac1.jpeg,0.96,38,1704531610,2024-01-06T09:00:10+0000
2024-01-06T17,18zvi0i,37,5987,mildlyinteresting,2ti4h,"Puréed 'roast dinner with gravy' served to my Dad in hospital",0,https://i.redd.it/6exn3j0o6sac1.jpeg,0.97,400,1704529996,2024-01-06T08:33:16+0000
2024-01-06T17,18zvhsd,54,4123,frogs,2r6bj,"My frog’s first trip to the vet",0,https://i.redd.it/r0hqvjvq6sac1.jpeg,0.97,128,1704529974,2024-01-06T08:32:54+0000
2024-01-06T17,18zvh2s,50,4383,BaldursGate3,12967t,"Had to make sure. You never.... never mind.",0,https://v.redd.it/dx3hww366sac1,0.98,136,1704529896,2024-01-06T08:31:36+0000
2024-01-06T17,18zvdze,91,2826,SweatyPalms,2v567,"Documentary film maker gets discovered by a group of lions he was filming",0,https://v.redd.it/uxcwypcy4sac1,0.97,209,1704529573,2024-01-06T08:26:13+0000
2024-01-06T17,18zv6i7,93,2957,interesting,2qib0,"This Japanese Mcdonalds has a phone cleaner in the bathroom",0,https://v.redd.it/ay1aj6lp2sac1,0.92,194,1704528698,2024-01-06T08:11:38+0000
2024-01-06T17,18zv4lp,48,4983,tumblr,2r7hk,"But could they foresee the Emu War?",0,https://i.redd.it/dnh23yza2sac1.jpeg,0.97,44,1704528479,2024-01-06T08:07:59+0000
2024-01-06T17,18zul5m,68,4318,starwarsmemes,2wzm6,"One of your favorites",0,https://i.redd.it/b3f1u2grvrac1.jpeg,0.97,94,1704526346,2024-01-06T07:32:26+0000
2024-01-06T17,18zu6wj,71,23785,Damnthatsinteresting,2xxyj,"Tank Shell Narrowly Avoids Hitting Its Target",0,https://v.redd.it/5bylnyiirrac1,0.96,456,1704524867,2024-01-06T07:07:47+0000
2024-01-06T17,18ztvw1,84,4273,Weird,2qlia,"Found this on my walk today",0,https://i.redd.it/bbo19bs7orac1.jpeg,0.93,222,1704523741,2024-01-06T06:49:01+0000
2024-01-06T17,18ztfwj,47,7870,Funnymemes,2xqtc,"😎😎😎",0,https://i.redd.it/u85dfwsyirac1.jpeg,0.94,131,1704522097,2024-01-06T06:21:37+0000
2024-01-06T17,18zsuya,85,5082,NonPoliticalTwitter,39gt6y,"Bringing attention to this here",0,https://i.redd.it/2anmpr8gdrac1.jpeg,0.97,113,1704520129,2024-01-06T05:48:49+0000
2024-01-06T17,18zrrx4,99,5286,aviation,2qhu8,"10 week old 737 MAX Alaska Airlines 1282 successful return to Portland",0,https://v.redd.it/yzc96e0p2rac1,0.96,1106,1704516516,2024-01-06T04:48:36+0000
2024-01-06T17,18zrmzs,39,28757,meirl,2s5ti,Meirl,0,https://i.redd.it/q6ypu24f1rac1.jpeg,0.93,1301,1704516076,2024-01-06T04:41:16+0000
2024-01-06T17,18zrhs3,57,10429,wallstreetbets,2th52,"Boeing is so Screwed",0,https://i.redd.it/o3cdskw10rac1.jpeg,0.94,2002,1704515615,2024-01-06T04:33:35+0000
2024-01-06T17,18zquf8,87,7749,TikTokCringe,mvcq5,"Alpha moms",0,https://v.redd.it/3qlp3jnutqac1,0.94,188,1704513540,2024-01-06T03:59:00+0000
2024-01-06T17,18zpo05,89,12660,Awww,2suml,"she tried her best",0,https://v.redd.it/fi0blnz8jqac1,0.97,57,1704509972,2024-01-06T02:59:32+0000
2024-01-06T17,18zn127,78,23399,news,2qh3l,"Alaska's snow crab season canceled for second year in a row as population fails to rebound",0,https://www.cbsnews.com/news/alaska-snow-crab-season-canceled-2024/,0.97,1295,1704502541,2024-01-06T12:55:41+0000
