date,id,position,score,subreddit_display_name,subreddit_id,title,is_self,url,upvote_ratio,num_comments,created,created_date
2024-01-08T06,191d435,15,2321,fantasyfootball,2qlqq,"Falcons have fired Arthur Smith, per source.",0,https://x.com/adamschefter/status/1744222940403511355,0.99,287,1704690160,2024-01-08T05:02:40+0000
2024-01-08T06,191c086,2,4681,nba,2qo4s,"LeBron dunks it from the dotted lines over Paul George (+ replays)",0,https://streamable.com/3m7wy9,0.96,384,1704686650,2024-01-08T04:04:10+0000
2024-01-08T06,191bc5x,99,1137,Satisfyingasfuck,31s00,"True peak",0,https://v.redd.it/lf8a1g5cy4bc1,0.97,18,1704684588,2024-01-08T03:29:48+0000
2024-01-08T06,191bajy,85,3362,MadeMeSmile,2uqcm,"Challenge accepted",0,https://v.redd.it/s8sefun2y4bc1,0.99,82,1704684447,2024-01-08T03:27:27+0000
2024-01-08T06,191b7c5,59,1608,Unexpected,2w67q,"Good ole Uncle Jesse ",0,https://v.redd.it/vmscpc2ax4bc1,0.97,37,1704684181,2024-01-08T03:23:01+0000
2024-01-08T06,191anpp,61,1972,Superstonk,43zwn1,"RYAN COHEN on twitter",0,https://i.redd.it/n19q5b7hs4bc1.jpeg,0.93,321,1704682564,2024-01-08T02:56:04+0000
2024-01-08T06,191aevr,96,1308,baseball,2qm7u,"[Passan] BREAKING: Outfielder Teoscar Hernández and the Los Angeles Dodgers are in agreement on a one-year, $23.5 million contract, sources tell ESPN. Hernández joins Shohei Ohtani, Yoshinobu Yamamoto and Tyler Glasnow on the new-look Dodgers, who add another All-Star bat to the lineup.",0,https://x.com/jeffpassan/status/1744188097930170754?s=46&t=bsTHbtMSqHXbNGi0vWP8hw,0.92,633,1704681847,2024-01-08T02:44:07+0000
2024-01-08T06,191a4w1,100,1345,anime,2qh22,"""The Boy and The Heron"" Wins the 2024 Golden Globe for Best Animated Movie",0,https://twitter.com/goldenglobes/status/1744184675164455169,0.97,105,1704681021,2024-01-08T02:30:21+0000
2024-01-08T06,191a3ny,56,1963,TikTokCringe,mvcq5,"Honesty is the best policy ",0,https://v.redd.it/9sgbwc6ln4bc1,0.96,38,1704680921,2024-01-08T02:28:41+0000
2024-01-08T06,1919xqj,19,3768,SuccessionTV,3exs8,"Kieran Culkin Wins the 2024 Golden Globe for Best Actor in a Drama Series for 'Succession'",0,https://i.redd.it/7sjkr9k5m4bc1.jpeg,0.95,205,1704680446,2024-01-08T02:20:46+0000
2024-01-08T06,1919vbe,97,1413,TheBear,6abpyt,"Ayo Edebiri wins the #GoldenGlobe for Best Actress in a TV Comedy.",0,https://i.redd.it/mv27d4unl4bc1.jpeg,0.95,55,1704680272,2024-01-08T02:17:52+0000
2024-01-08T06,1919rrl,26,3237,nottheonion,2qnts,"Family of woman shot during January 6 Capitol riot sues US government, seeking $30 million",0,https://inshort.geartape.com/family-of-woman-shot-during-january-6-capitol-riot-sues-us-government-seeking-30-million/,0.9,552,1704679992,2024-01-08T02:13:12+0000
2024-01-08T06,1919lun,16,4162,Weird,2qlia,"Strange things found in the basement ceiling of new acquired home",0,https://i.redd.it/zh4i7z0hj4bc1.jpeg,0.95,2936,1704679536,2024-01-08T02:05:36+0000
2024-01-08T06,1919lme,22,3766,WhitePeopleTwitter,35n7t,unreal,0,https://i.redd.it/t0w1mn4fj4bc1.jpeg,0.98,179,1704679518,2024-01-08T02:05:18+0000
2024-01-08T06,1919eri,77,1695,Fauxmoi,2rqcm8,"Brie Larson meets Jennifer Lopez for the first time at the Golden Globes",0,https://v.redd.it/37k9pcoth4bc1,0.92,118,1704678982,2024-01-08T01:56:22+0000
2024-01-08T06,1919cxd,84,1693,fixedbytheduet,46tcaa,"Something goes wrong",0,https://v.redd.it/rlliwm1bh4bc1,0.96,17,1704678836,2024-01-08T01:53:56+0000
2024-01-08T06,1919cwv,14,4458,funny,2qh33,"The hardest buttons to button",0,https://i.redd.it/1qiql4tdh4bc1.jpeg,0.92,98,1704678835,2024-01-08T01:53:55+0000
2024-01-08T06,19195ab,46,2491,90DayFiance,34i5y,"Im screaming",0,https://i.redd.it/2rk174omf4bc1.jpeg,0.93,283,1704678243,2024-01-08T01:44:03+0000
2024-01-08T06,19193h4,51,2388,NonPoliticalTwitter,39gt6y,"Wonder what the WR is",0,https://i.redd.it/ec0y2608f4bc1.jpeg,0.98,36,1704678106,2024-01-08T01:41:46+0000
2024-01-08T06,1918unt,25,3753,KidsAreFuckingStupid,3948y,"At least he was gentle",0,https://v.redd.it/7kncowf1d4bc1,0.94,292,1704677425,2024-01-08T01:30:25+0000
2024-01-08T06,1918sfj,53,2455,30PlusSkinCare,379gw,"82 years old and look at her skin",0,https://i.redd.it/ob88ybbpc4bc1.jpeg,0.94,137,1704677259,2024-01-08T01:27:39+0000
2024-01-08T06,1918ral,6,7401,MadeMeSmile,2uqcm,"It costs nothing to be kind. 
",0,https://v.redd.it/x2c6f6rfc4bc1,0.97,202,1704677170,2024-01-08T01:26:10+0000
2024-01-08T06,1918ld6,32,3501,worldnews,2qh13,"Ukraine Blows Up As Much Naval Tonnage As Russian Shipyards Can Build",0,https://www.forbes.com/sites/davidaxe/2024/01/06/the-ukrainian-navy-blows-up-as-much-russian-naval-tonnage-as-russian-shipyards-manage-to-build/,0.95,156,1704676713,2024-01-08T01:18:33+0000
2024-01-08T06,1918ki4,36,3507,ExplainTheJoke,2vmj2,"Please explain this",0,https://i.redd.it/80n5hi8va4bc1.jpeg,0.94,112,1704676644,2024-01-08T01:17:24+0000
2024-01-08T06,1918647,42,3236,TaylorSwift,2rlwe,"Taylor at the 81st Golden Globe Awards",0,https://www.reddit.com/gallery/1918647,0.83,232,1704675575,2024-01-08T12:59:35+0000
2024-01-08T06,19184ra,44,5601,facepalm,2r5rp,"Well Fuck me dead... where the fuck am I standing then cunt??",0,https://i.redd.it/qp2vi8vc74bc1.jpeg,0.97,593,1704675472,2024-01-08T12:57:52+0000
2024-01-08T06,191843w,70,2200,technology,2qh16,"AirTag 2 not expected until 2025 as Apple sits on backlog of first-gen inventory",0,https://9to5mac.com/2024/01/07/airtag-2-launch-date-features-rumor/,0.94,282,1704675423,2024-01-08T12:57:03+0000
2024-01-08T06,1917xkp,39,3420,oddlysatisfying,2x93b,"Abused c. 1940s French copper pot  restored for everyday cooking. This one is a good example of why traditional copper is the most immortal cookware: the impact to dent it like this would have cracked a cast iron pot. ",0,https://v.redd.it/mfpmpt5u54bc1,0.84,296,1704674952,2024-01-08T12:49:12+0000
2024-01-08T06,1917uz1,37,3602,harrypotter,2qiqi,"I finished the ""Harry Potter"" reading closet for my daughter. Hopefully it's up to everyone's liking here.",0,https://www.reddit.com/gallery/1917uz1,0.95,165,1704674758,2024-01-08T12:45:58+0000
2024-01-08T06,1917ucy,69,2342,CuratedTumblr,3x5kfw,"Cunter scale",0,https://i.redd.it/on65tx8354bc1.jpeg,0.95,125,1704674711,2024-01-08T12:45:11+0000
2024-01-08T06,1917n4h,43,3365,mildlyinfuriating,2ubgg,"Local real estate “investor” is mad that I told him I didn’t have time to speak when he showed up unannounced",0,https://i.redd.it/vdej4bri34bc1.jpeg,0.95,270,1704674171,2024-01-08T12:36:11+0000
2024-01-08T06,1917chd,78,2420,stupidquestions,2qxdl,"Why does society excuse people of color who are racist?",1,https://www.reddit.com/r/stupidquestions/comments/1917chd/why_does_society_excuse_people_of_color_who_are/,0.73,2532,1704673377,2024-01-08T12:22:57+0000
2024-01-08T06,1917bwj,75,2367,Piracy,2qmox,"Rate this guy's method of piracy",0,https://v.redd.it/qsl6mpy014bc1,0.95,273,1704673334,2024-01-08T12:22:14+0000
2024-01-08T06,1917ae5,29,4512,popculturechat,5rj68d,"Margot Robbie referencing the 1977 Superstar Barbie in Armani at the 2024 Golden Globes",0,https://www.reddit.com/gallery/1917ae5,0.94,127,1704673225,2024-01-08T12:20:25+0000
2024-01-08T06,19178ti,91,2135,meirl,2s5ti,meirl,0,https://i.redd.it/irk4oz5d04bc1.jpeg,0.98,27,1704673114,2024-01-08T12:18:34+0000
2024-01-08T06,191727d,33,4283,LeopardsAteMyFace,3jp3p,"Harvard doxxer Bill Ackman flip flops on plagiarism after wife exposed for plagiarism",0,https://www.thedailybeast.com/billionaire-bill-ackman-flip-flops-on-plagiarism-after-his-wife-neri-oxman-gets-caught,0.94,235,1704672626,2024-01-08T12:10:26+0000
2024-01-08T06,1916z9t,50,3286,IdiotsInCars,3aimx,"Spotted one in the wild [oc]",0,https://i.redd.it/7xwwlq3ay3bc1.jpeg,0.96,262,1704672411,2024-01-08T12:06:51+0000
2024-01-08T06,1916z94,18,6202,mildlyinteresting,2ti4h,"This underwear has a pocket for your phone",0,https://i.redd.it/pwobpy99y3bc1.jpeg,0.94,1091,1704672410,2024-01-08T12:06:50+0000
2024-01-08T06,1916xma,68,2615,tooktoomuch,38aq5,"Me running away from my problems: ",0,https://v.redd.it/n8ua2xkxx3bc1,0.97,244,1704672292,2024-01-08T12:04:52+0000
2024-01-08T06,1916ths,24,5723,GreenBayPackers,2qqd2,"THE PACKERS ARE GOING TO THE PLAYOFFS UPVOTE PARTY",1,https://www.reddit.com/r/GreenBayPackers/comments/1916ths/the_packers_are_going_to_the_playoffs_upvote_party/,0.77,482,1704672018,2024-01-08T12:00:18+0000
2024-01-08T06,1916sfw,1,17287,Damnthatsinteresting,2xxyj,"Massive bluefin tuna weighing more than 500 pounds reels in almost $800,000 at Tokyo auction",0,https://i.redd.it/go237rlww3bc1.jpeg,0.94,1073,1704671946,2024-01-07T11:59:06+0000
2024-01-08T06,1916qb3,8,8421,nostalgia,2qnub,"Just opened a Little Free Blockbuster in LA",0,https://www.reddit.com/gallery/1916qb3,0.96,427,1704671799,2024-01-07T11:56:39+0000
2024-01-08T06,1916nzx,30,5184,me_irl,2vegg,me_irl,0,https://v.redd.it/sjdpg7hyv3bc1,0.94,152,1704671629,2024-01-07T11:53:49+0000
2024-01-08T06,1916no3,3,21885,theydidthemath,2x23b,"[Request] Would they really be able to carry them above their heads like that?",0,https://i.redd.it/kn35hhyvv3bc1.jpeg,0.93,1018,1704671604,2024-01-07T11:53:24+0000
2024-01-08T06,1916njo,5,15106,popheadscirclejerk,39ou5,"A woman over 25 touched him and it spooked him",0,https://v.redd.it/tz10ommtv3bc1,0.88,1402,1704671594,2024-01-07T11:53:14+0000
2024-01-08T06,1916jbp,4,15245,holdmycatnip,2zhxd,"Mr. Willis, a sickly senior cat, gets adopted and is transformed",0,https://v.redd.it/yaq85r9wu3bc1,0.96,238,1704671284,2024-01-07T11:48:04+0000
2024-01-08T06,1916j8b,62,3030,Wellthatsucks,2xcv7,"Almost made it all the way home safely",0,https://i.redd.it/ytr1eqqwu3bc1.jpeg,0.95,338,1704671276,2024-01-07T11:47:56+0000
2024-01-08T06,191652e,27,6022,wholesomememes,3gcwj,"Long distance relationships are hard 😭",0,https://i.redd.it/f8ukb38sr3bc1.gif,0.92,204,1704670253,2024-01-07T11:30:53+0000
2024-01-08T06,1915vh5,40,4451,StandUpComedy,2qrp8,"🇮🇪 Famine",0,https://v.redd.it/777panwvp3bc1,0.91,311,1704669590,2024-01-07T11:19:50+0000
2024-01-08T06,1915rd9,57,3930,FluentInFinance,3qpaq8,"Billionaires aren't the reason that you’re poor",0,https://i.redd.it/3cnvgmsyo3bc1.png,0.74,1010,1704669307,2024-01-07T11:15:07+0000
2024-01-08T06,1915q9k,89,2662,CozyPlaces,34ixl,"Nothing crazy but I love my cozy little living room ❤️",0,https://i.redd.it/23edi1yto3bc1.jpeg,0.97,84,1704669231,2024-01-07T11:13:51+0000
2024-01-08T06,1915o24,95,2537,trees,2r9vp,"Laugh as much as you want, I've been smoking for 14 years and this is all I need at any given moment",0,https://i.redd.it/6hcubcudo3bc1.jpeg,0.94,123,1704669081,2024-01-07T11:11:21+0000
2024-01-08T06,1915kw7,11,10687,facepalm,2r5rp,"Reighfyl, pronounced Rifle.",0,https://i.redd.it/o4nmfacon3bc1.jpeg,0.96,1343,1704668864,2024-01-07T11:07:44+0000
2024-01-08T06,1915jkc,7,12592,todayilearned,2qqjc,"TIL when he was an Illinois state legislator, Abraham Lincoln was challenged to a duel by state auditor James Shields. Lincoln insisted on broadswords as the weapon rather than pistols prompting Shields to back out and call for a truce.",0,https://presidentlincoln.illinois.gov/Blog/Posts/141/Abraham-Lincoln/2021/8/Lincolns-avoided-duel/blog-post/,0.97,541,1704668772,2024-01-07T11:06:12+0000
2024-01-08T06,1915gnp,48,4054,NFCEastMemeWar,26lph2,"Upvote to ruin a eagle fans day",0,https://i.redd.it/fqnkcs5vm3bc1.jpeg,0.92,169,1704668570,2024-01-07T11:02:50+0000
2024-01-08T06,1915czh,74,3189,notinteresting,2u0xf,"I am at a gender reveal, today I will find out if I am an Aunt or an Uncle.",0,https://i.redd.it/rphwyby5m3bc1.jpeg,0.92,162,1704668336,2024-01-07T10:58:56+0000
2024-01-08T06,1915bhq,21,7749,Eyebleach,2s427,"Wiggle wiggle wiggle",0,https://i.imgur.com/99PJXRq.gifv,0.98,98,1704668234,2024-01-07T10:57:14+0000
2024-01-08T06,19154zc,28,6268,nflcirclejerk,2sulf,"I Thought This Was A Classy Sport",0,https://v.redd.it/d8p3cfllk3bc1,0.95,272,1704667809,2024-01-07T10:50:09+0000
2024-01-08T06,1914ys0,60,3735,DIY,2qh7d,"I refreshed the grout in our bathroom. Maybe the most tedious thing I’ve ever done lol.",0,https://i.redd.it/zatl2zhcj3bc1.jpeg,0.96,233,1704667387,2024-01-07T10:43:07+0000
2024-01-08T06,1914w11,10,11240,sports,2qgzy,"200IQ play by Cam Brown to avoid a roughing the punter penalty.",0,https://v.redd.it/ajbzl1asi3bc1,0.95,459,1704667207,2024-01-07T10:40:07+0000
2024-01-08T06,1914txp,98,2850,sciencememes,2u0d4,"Nobody's perfect and thats perfectly fine😍😘.",0,https://i.redd.it/pjkx8i8ci3bc1.png,0.95,151,1704667058,2024-01-07T10:37:38+0000
2024-01-08T06,1914rrv,52,4511,pcmasterrace,2sgp1,"Being IT is…",0,https://i.redd.it/0vmjbpjxh3bc1.jpeg,0.97,208,1704666911,2024-01-07T10:35:11+0000
2024-01-08T06,1914r6q,79,3514,shitposting,2usxq,What?,0,https://v.redd.it/c8qtwh1th3bc1,0.97,29,1704666872,2024-01-07T10:34:32+0000
2024-01-08T06,1914r09,93,4950,BlackPeopleTwitter,33x33,"The Caucacity…..",0,https://i.redd.it/5rvm9yzrh3bc1.jpeg,0.94,87,1704666859,2024-01-07T10:34:19+0000
2024-01-08T06,1914oxf,34,14194,todayilearned,2qqjc,"TIL in 2020, 68-year-old actress Ana Obregón lost her only son to cancer at 27. After his death, she used her son's frozen sperm to grant her wish of having a granddaughter (via surrogacy) who she's currently raising as her daughter.",0,https://www.vice.com/en/article/z3mv79/ana-obregon-surrogate-baby-son-aless-lequio-garcia,0.88,1149,1704666719,2024-01-07T10:31:59+0000
2024-01-08T06,19146cl,20,9547,pics,2qh0u,"Ehud Barak hides his face as he enters Jeffery Epstein's Manhattan mansion in 2016",0,https://i.redd.it/29id9qhnd3bc1.png,0.93,329,1704665472,2024-01-07T10:11:12+0000
2024-01-08T06,19144b8,58,4329,OneOrangeBraincell,5vej89,"Just made him slow dance with me to I will always love you and cried I love him so much look at this face why can’t they live forever",0,https://i.redd.it/xzvucjt8d3bc1.jpeg,0.96,82,1704665335,2024-01-07T10:08:55+0000
2024-01-08T06,1913yig,9,16578,BlackPeopleTwitter,33x33,"🗣️🗣️🗣️ North Carolinians y’all stay safe out there! Criminal charges are being filed!",0,https://www.reddit.com/gallery/1913yig,0.95,1314,1704664950,2024-01-07T10:02:30+0000
2024-01-08T06,1913wsc,55,5139,DeepRockGalactic,3iufz,"Absolute heresy",0,https://i.redd.it/rtayht0sb3bc1.jpeg,0.93,326,1704664842,2024-01-07T10:00:42+0000
2024-01-08T06,1913wlz,13,13044,interestingasfuck,2qhsa,"Amazing colors *_*",0,https://v.redd.it/jolrndhqb3bc1,0.97,190,1704664832,2024-01-07T10:00:32+0000
2024-01-08T06,1913efn,63,4705,notliketheothergirls,3opft,"A very modest chinchilla",0,https://www.reddit.com/gallery/1913efn,0.94,165,1704663608,2024-01-07T09:40:08+0000
2024-01-08T06,191396s,86,3825,oddlyterrifying,2yo6b,"The Black and White Carnival, Colombia. ",0,https://v.redd.it/v48lqqp173bc1,0.95,72,1704663253,2024-01-07T09:34:13+0000
2024-01-08T06,19138xj,54,5210,woahdude,2r8tu,"The Black and White Carnival, Colombia. ",0,https://v.redd.it/avmz4zqz63bc1,0.96,74,1704663235,2024-01-07T09:33:55+0000
2024-01-08T06,1912vg1,17,20921,memes,2qjpg,"Boom roasted",0,https://i.redd.it/wmp16jwb43bc1.jpeg,0.95,341,1704662337,2024-01-07T09:18:57+0000
2024-01-08T06,1912p12,94,3987,MapPorn,2si92,"Regions in Europe with muslim majority",0,https://i.redd.it/erpx2rl233bc1.png,0.9,998,1704661914,2024-01-07T09:11:54+0000
2024-01-08T06,1912hh5,12,19532,AnimalsBeingDerps,2xbrg,"This young capybara going to a quick dip in the pool",0,https://i.imgur.com/lNaobow.gifv,0.98,113,1704661411,2024-01-07T09:03:31+0000
2024-01-08T06,19129ao,73,8640,funny,2qh33,"Can't you just get in the f****ng net",0,https://v.redd.it/f9j5qhj003bc1,0.91,371,1704660907,2024-01-07T08:55:07+0000
2024-01-08T06,191288m,35,31014,MadeMeSmile,2uqcm,"Love her positive attitude",0,https://v.redd.it/s1xuuu9uz2bc1,0.95,431,1704660829,2024-01-07T08:53:49+0000
2024-01-08T06,191242r,65,15836,memes,2qjpg,"This meme is just a reason to post Trinity's dumptruck",0,https://i.redd.it/azpgu740z2bc1.jpeg,0.92,364,1704660545,2024-01-07T08:49:05+0000
2024-01-08T06,1911xvt,83,8795,mildlyinteresting,2ti4h,"Chinese grocery store draws circles on the onions with a sharpie",0,https://i.redd.it/3hrbjf9qx2bc1.jpeg,0.95,538,1704660119,2024-01-07T08:41:59+0000
2024-01-08T06,1911tx0,38,8237,news,2qh3l,"Man arrested after World of Warcraft game helps police in Florida find missing 16-year-old girl from Ohio",0,https://www.cnn.com/2024/01/06/us/world-of-warcraft-missing-ohio-teen/index.html,0.95,826,1704659857,2024-01-07T08:37:37+0000
2024-01-08T06,1911m2a,82,9474,interestingasfuck,2qhsa,"18,000 people live in this single building in Russia",0,https://www.reddit.com/gallery/1911m2a,0.92,1496,1704659330,2024-01-07T08:28:50+0000
2024-01-08T06,1911lwh,88,4846,therewasanattempt,39ne7,"to enter a military base without permission ",0,https://v.redd.it/yisv4oiav2bc1,0.94,377,1704659319,2024-01-07T08:28:39+0000
2024-01-08T06,1911aoa,23,13637,NewsOfTheStupid,2tpr6,"Lauren Boebert involved in physical fight with ex-husband in Colorado restaurant",0,https://www.yahoo.com/news/lauren-boebert-involved-physical-fight-135904331.html,0.95,1238,1704658559,2024-01-07T08:15:59+0000
2024-01-08T06,1910uva,67,7028,comics,2qh0s,"Putting the ""ass"" in assistance...",0,https://i.redd.it/fi9uydhzp2bc1.png,0.92,140,1704657514,2024-01-07T07:58:34+0000
2024-01-08T06,1910tjw,41,11851,PeterExplainsTheJoke,121h8r,Canada?,0,https://i.redd.it/f90xexmpp2bc1.jpeg,0.92,461,1704657420,2024-01-07T07:57:00+0000
2024-01-08T06,1910p08,31,16558,HumansBeingBros,2xh58,"Saving a very frightened kitty ",0,https://v.redd.it/5u0mqovho2bc1,0.94,312,1704657093,2024-01-07T07:51:33+0000
2024-01-08T06,1910m4n,64,6546,politics,2cneq,"Trump just promised an authoritarian ‘task force’ to impose Christian ideology",0,https://www.msnbc.com/opinion/msnbc-opinion/trump-2024-christian-right-truth-social-rcna132082,0.95,1039,1704656898,2024-01-07T07:48:18+0000
2024-01-08T06,1910bmy,81,5918,PublicFreakout,2yrq6,"Does this happen at literally all these events? ",0,https://v.redd.it/zteqr24vl2bc1,0.95,879,1704656155,2024-01-07T07:35:55+0000
2024-01-08T06,190zsxe,71,21350,holdmycatnip,2zhxd,"Now we best Friends.",0,https://v.redd.it/dsb6kw70i2bc1,0.93,297,1704654830,2024-01-07T07:13:50+0000
2024-01-08T06,190zo51,92,6308,FunnyandSad,2z7qd,"A little heartbreaking",0,https://i.redd.it/xk79n51yg2bc1.jpeg,0.95,59,1704654492,2024-01-07T07:08:12+0000
2024-01-08T06,190zbn6,72,8183,WitchesVsPatriarchy,p3r73,"There has to be a pun here 🤔",0,https://i.redd.it/jloulo9fe2bc1.jpeg,0.93,148,1704653626,2024-01-07T06:53:46+0000
2024-01-08T06,190ysb4,66,38516,pics,2qh0u,"I work in hotels, and a guest tips me in Pokémon cards, this is about the 10th he has given me!",0,https://i.redd.it/gfybu50j62bc1.jpeg,0.94,1156,1704652290,2024-01-07T06:31:30+0000
2024-01-08T06,190ynq8,45,14604,OldSchoolCool,2tycb,"Princess Diana look-alike contest in Washington D.C., 1985",0,https://i.redd.it/9r7cdwqh92bc1.jpeg,0.95,756,1704651982,2024-01-07T06:26:22+0000
2024-01-08T06,190yfzi,47,28967,AbsoluteUnits,a7wuv,"of a chef",0,https://v.redd.it/giiv4nbs72bc1,0.84,1613,1704651413,2024-01-07T06:16:53+0000
2024-01-08T06,190y0qe,87,9308,madlads,3aegn,"Brownie night it is",0,https://i.redd.it/6ktvmaej42bc1.jpeg,0.96,223,1704650351,2024-01-07T05:59:11+0000
2024-01-08T06,190xr4o,90,9466,technicallythetruth,3pzez,"As a human, I can confirm",0,https://i.redd.it/n8c30seo22bc1.jpeg,0.97,87,1704649678,2024-01-07T05:47:58+0000
2024-01-08T06,190xjvb,49,22699,cats,2qhta,"Kind stranger fishes Cat out of the water",0,https://v.redd.it/zru4671412bc1,0.95,650,1704649173,2024-01-07T05:39:33+0000
2024-01-08T06,190x5ao,76,10582,PoliticalHumor,2qm21,"Nepo Baby Feigns Hardship",0,https://i.redd.it/yirt61n6y1bc1.jpeg,0.95,663,1704648163,2024-01-07T05:22:43+0000
2024-01-08T06,190w4ga,80,12664,space,2qh87,"I traveled 33 hours to Africa and shot for over 4 hours to capture this image. The final resolution is 24,000 x 12,000!",0,https://i.redd.it/9k2y40rho1bc1.jpeg,0.94,362,1704645500,2024-01-07T04:38:20+0000
