date,id,position,score,subreddit_display_name,subreddit_id,title,is_self,url,upvote_ratio,num_comments,created,created_date
2024-01-04T10,18xvt2s,77,5552,MaliciousCompliance,3boqz,"Boss introduces new timetracking tool to ""avoid time manipulation"", backfires on him",1,https://www.reddit.com/r/MaliciousCompliance/comments/18xvt2s/boss_introduces_new_timetracking_tool_to_avoid/,0.96,233,1704320117,2024-01-03T10:15:17+0000
2024-01-04T10,18xvodd,81,5763,vegaslocals,2xdzp,"Man Attacks Vegas Judge During Sentencing Today",0,https://v.redd.it/7lu5w2qotaac1,0.95,1351,1704319804,2024-01-03T10:10:04+0000
2024-01-04T10,18xvo5t,29,22081,BeAmazed,363r3,"Absolute Badass",0,https://i.imgur.com/NLABMUv.jpeg,0.93,438,1704319789,2024-01-03T10:09:49+0000
2024-01-04T10,18xvltp,34,13011,nextfuckinglevel,m0bnr,"Man reveals the technique that could have been used on Stonehedge",0,https://v.redd.it/e33rao0vpaac1,0.94,478,1704319633,2024-01-03T10:07:13+0000
2024-01-04T10,18xvio8,21,18507,PublicFreakout,2yrq6,"A Man Attacked a Las Vegas Judge During Sentencing Today",0,https://v.redd.it/0klbaupjsaac1,0.97,3171,1704319419,2024-01-03T10:03:39+0000
2024-01-04T10,18xvdhi,55,8594,wizardposting,5hjlp1,"You fools! You absolute fools!",0,https://i.redd.it/7es49kloraac1.jpeg,0.96,210,1704319090,2024-01-03T09:58:10+0000
2024-01-04T10,18xvbu1,27,18507,interestingasfuck,2qhsa,"Beachgoers have a close encounter with a Cassowary ",0,https://v.redd.it/lyp451lbraac1,0.94,2073,1704318974,2024-01-03T09:56:14+0000
2024-01-04T10,18xvadq,62,7730,BrandNewSentence,mbn0j,"Now here's a religion I can understand",0,https://i.redd.it/smwfzbwzqaac1.png,0.97,257,1704318872,2024-01-03T09:54:32+0000
2024-01-04T10,18xv6zs,28,18388,WhitePeopleTwitter,35n7t,"Oh please do go there! Who wants popcorn?",0,https://i.redd.it/ld61kqybqaac1.jpeg,0.95,901,1704318638,2024-01-03T09:50:38+0000
2024-01-04T10,18xuwv0,80,7811,OnePiece,2rfz5,"Nico Robin attempt (surprise on 3rd slide) :D",0,https://www.reddit.com/gallery/18xuwv0,0.81,357,1704317961,2024-01-03T09:39:21+0000
2024-01-04T10,18xu3p1,63,9519,FluentInFinance,3qpaq8,"Should Student Loans be Forgiven like PPP Loans were?",0,https://i.redd.it/n1r2tyxdiaac1.png,0.88,1079,1704315991,2024-01-03T09:06:31+0000
2024-01-04T10,18xtyve,58,11752,clevercomebacks,dyqlw,"Just like the women he's been with, he never saw this coming",0,https://i.redd.it/8k421j5ihaac1.png,0.87,746,1704315668,2024-01-03T09:01:08+0000
2024-01-04T10,18xtxnp,70,8694,TikTokCringe,mvcq5,"That's a blessin",0,https://v.redd.it/2nlz5br5haac1,0.95,204,1704315599,2024-01-03T08:59:59+0000
2024-01-04T10,18xtu67,59,11094,funny,2qh33,"Superhero entanglement (Batman, Wonder Woman & Superman)",0,https://i.redd.it/4zzsw8ojgaac1.jpeg,0.88,136,1704315350,2024-01-03T08:55:50+0000
2024-01-04T10,18xtjtd,99,6253,IdiotsInCars,3aimx,"“Dude are you kidding me right now?!” Audi idiot didn’t even look, claims they were not at fault. Dashcam to the rescue! [oc]",0,https://v.redd.it/lhjg7pbheaac1,0.96,741,1704314653,2024-01-03T08:44:13+0000
2024-01-04T10,18xtga5,82,8136,gaming,2qh03,"Jailed Nintendo hacker Gary Bowser denies link to new Switch flash cart",0,https://www.videogameschronicle.com/news/jailed-nintendo-hacker-gary-bowser-denies-link-to-new-switch-flash-cart/,0.95,482,1704314414,2024-01-03T08:40:14+0000
2024-01-04T10,18xs90u,68,16869,SipsTea,5tdqj0,"But friend shape...",0,https://v.redd.it/ertmyfr25aac1,0.9,529,1704311488,2024-01-03T07:51:28+0000
2024-01-04T10,18xs8kt,94,9320,Wellthatsucks,2xcv7,"Went to Goodwill yesterday. Got a discount at the register, thought it was because of tag color. Looked at my receipt today and saw this.",0,https://i.redd.it/3xvxjoiz4aac1.jpeg,0.92,302,1704311458,2024-01-03T07:50:58+0000
2024-01-04T10,18xqr6r,71,19951,FunnyAnimals,2st2l,"Dog thought he was home alone ",0,https://v.redd.it/bc2fgd5nu9ac1,0.96,170,1704307979,2024-01-03T06:52:59+0000
2024-01-04T10,18xqr1b,48,27904,news,2qh3l,"Names in Jeffrey Epstein court documents to be unsealed in New York on Wednesday",0,https://www.cnbc.com/2024/01/03/jeffrey-epstein-court-document-names-unsealed-wednesday-.html,0.94,2598,1704307970,2024-01-03T06:52:50+0000
2024-01-04T10,18xq16a,91,20219,BikiniBottomTwitter,3deqz,"Gary hit em wit the",0,https://v.redd.it/koc84toep9ac1,0.9,409,1704306237,2024-01-03T06:23:57+0000
2024-01-04T10,18xpx54,92,15155,holdmycatnip,2zhxd,"Have a look at this businessman!",0,https://v.redd.it/5wbxadclo9ac1,0.97,117,1704305971,2024-01-03T06:19:31+0000
2024-01-04T10,18xpe1t,96,16768,MurderedByWords,3hx3r,"It's clear as can be",0,https://i.redd.it/t013eymuk9ac1.jpeg,0.89,310,1704304712,2024-01-03T05:58:32+0000
2024-01-04T09,18y658r,21,2410,pcmasterrace,2sgp1,"Edge's pdf reader is best I've ever seen.",0,https://i.redd.it/9lo2c1id7dac1.png,0.96,185,1704348765,2024-01-04T06:12:45+0000
2024-01-04T09,18y61ks,93,1912,meirl,2s5ti,Meirl,0,https://i.redd.it/h94hhzct6dac1.jpeg,0.99,40,1704348411,2024-01-04T06:06:51+0000
2024-01-04T09,18y5v80,3,5947,ProgrammerHumor,2tex6,programmingPeaked,0,https://i.redd.it/s2dimkb55dac1.jpeg,0.98,147,1704347833,2024-01-04T05:57:13+0000
2024-01-04T09,18y5rii,45,1569,Steam,2qwis,"Show me a single person who voted RDR2",0,https://i.redd.it/639ams414dac1.png,0.95,150,1704347479,2024-01-04T05:51:19+0000
2024-01-04T09,18y5nu7,15,3078,BatmanArkham,2y9q4,"Our insanity has reached there",0,https://i.redd.it/tdtbv9n33dac1.png,0.97,67,1704347145,2024-01-04T05:45:45+0000
2024-01-04T09,18y5huf,16,3260,memes,2qjpg,"Crawls back into my Shell",0,https://i.redd.it/qttb6gzh1dac1.jpeg,0.91,377,1704346607,2024-01-04T05:36:47+0000
2024-01-04T09,18y51tj,2,7480,wholesomememes,3gcwj,"healthy thinking",0,https://i.redd.it/6chzygf9wcac1.png,0.96,351,1704345142,2024-01-04T05:12:22+0000
2024-01-04T09,18y4zq1,4,6579,meirl,2s5ti,meirl,0,https://v.redd.it/mtgp5y3mwcac1,0.97,108,1704344965,2024-01-04T05:09:25+0000
2024-01-04T09,18y4rfo,38,4296,Damnthatsinteresting,2xxyj,"Tsunami in the making",0,https://v.redd.it/snqu8fhducac1,0.98,157,1704344232,2024-01-04T04:57:12+0000
2024-01-04T09,18y4pl4,19,3281,Eyebleach,2s427,"ᵂᵉᵉᵉᵉ",0,https://i.imgur.com/7AJi4eR.gifv,0.99,28,1704344064,2024-01-04T04:54:24+0000
2024-01-04T09,18y4oxn,49,1789,CrazyFuckingVideos,45hae8,"IRL streamer swatted while drunk streaming, he's so out of it he has no idea what is going on",0,https://v.redd.it/yvzq2jgrtcac1,0.96,221,1704344004,2024-01-04T04:53:24+0000
2024-01-04T09,18y4fm2,46,1902,technology,2qh16,"Starbucks accused of rigging payments in app for nearly $900 million gain over 5 years by consumer watchdog group",0,https://fortune.com/2024/01/03/starbucks-app-dark-side-unspent-payments-900-million-5-years/,0.96,121,1704343195,2024-01-04T04:39:55+0000
2024-01-04T09,18y4dg1,68,3566,memes,2qjpg,"He was on the list, apparently.",0,https://i.redd.it/ykz3brvqqcac1.gif,0.97,94,1704342990,2024-01-04T04:36:30+0000
2024-01-04T09,18y49zj,31,2711,DOG,2qiy5,"Brave boi...",0,https://v.redd.it/v06utu5tpcac1,0.98,68,1704342683,2024-01-04T04:31:23+0000
2024-01-04T09,18y46qm,100,1206,ChainsawMan,rmtrq,Congrats,0,https://i.redd.it/11bd82jzocac1.jpeg,0.98,34,1704342399,2024-01-04T04:26:39+0000
2024-01-04T09,18y3vtu,23,3638,therewasanattempt,39ne7,"To mind your own business",0,https://v.redd.it/29iy6j19mcac1,0.87,111,1704341478,2024-01-04T04:11:18+0000
2024-01-04T09,18y3loi,88,1485,teenagers,2rjli,"My dad bought me this for Christmas…",0,https://i.redd.it/j727940rjcac1.jpeg,0.96,170,1704340639,2024-01-04T03:57:19+0000
2024-01-04T09,18y3cev,48,2203,nba,2qo4s,"[Highlight] Jalen Duren dunks on Walker Kessler then gets on his shoulders for a piggyback ride",0,https://streamable.com/91wpjl,0.98,204,1704339876,2024-01-04T03:44:36+0000
2024-01-04T09,18y3ab7,43,2320,JustGuysBeingDudes,33rtj6,"Care for a puff of color boys?",0,https://v.redd.it/ezeacfiwgcac1,0.93,88,1704339699,2024-01-04T03:41:39+0000
2024-01-04T09,18y378h,1,13852,Unexpected,2w67q,"Everyone loves her present",0,https://v.redd.it/1f60z2y4gcac1,0.95,386,1704339434,2024-01-04T03:37:14+0000
2024-01-04T09,18y337s,9,6486,mildlyinfuriating,2ubgg,"I had a dentist fart in my face today.",1,https://www.reddit.com/r/mildlyinfuriating/comments/18y337s/i_had_a_dentist_fart_in_my_face_today/,0.95,579,1704339098,2024-01-04T03:31:38+0000
2024-01-04T09,18y31ml,12,5446,tumblr,2r7hk,"ngl I feel like Dio would be a fun coworker to have",0,https://i.redd.it/1h1lcmnrecac1.jpeg,0.97,71,1704338978,2024-01-04T03:29:38+0000
2024-01-04T09,18y30pt,63,2158,Terraria,2sg5b,"Some humanized bosses ft. the ladies :D",0,https://www.reddit.com/gallery/18y30pt,0.95,176,1704338900,2024-01-04T03:28:20+0000
2024-01-04T09,18y2qe5,62,4548,todayilearned,2qqjc,"TIL That the dried up white dog poop common before the '90s was due to dog food containing too much calcium and bone meal.",0,https://www.iflscience.com/why-was-white-dog-poop-so-common-before-the-90s-66581,0.97,173,1704338071,2024-01-04T03:14:31+0000
2024-01-04T09,18y2h2e,99,1573,malelivingspace,2v70p,"Office set up when I’m too tired to commute",0,https://i.redd.it/hazdz2wp9cac1.jpeg,0.93,197,1704337315,2024-01-04T03:01:55+0000
2024-01-04T09,18y291u,6,8132,nottheonion,2qnts,"'Rich Dad, Poor Dad' Robert Kiyosaki says he's $1.2 billion in debt because 'if I go bankrupt, the bank goes bankrupt.' not my problem'",0,https://biz.crast.net/rich-dad-poor-dad-robert-kiyosaki-says-hes-1-2-billion-in-debt-because-if-i-go-bankrupt-the-bank-goes-bankrupt-not-my-problem/,0.95,606,1704336683,2024-01-04T02:51:23+0000
2024-01-04T09,18y25u9,67,2300,AITAH,446kys,"AITAH for calling my Father in law a bastard after he pressured us into getting a paternity test.",1,https://www.reddit.com/r/AITAH/comments/18y25u9/aitah_for_calling_my_father_in_law_a_bastard/,0.93,263,1704336433,2024-01-04T02:47:13+0000
2024-01-04T09,18y22ma,14,5701,NonPoliticalTwitter,39gt6y,Y2K,0,https://i.redd.it/skvz6ieh6cac1.jpeg,0.97,69,1704336175,2024-01-04T02:42:55+0000
2024-01-04T09,18y22j6,83,1986,SweatyPalms,2v567,"This is dangerous as fuck",0,https://v.redd.it/neutpgag6cac1,0.91,258,1704336167,2024-01-04T02:42:47+0000
2024-01-04T09,18y1mox,70,2437,theydidthemath,2x23b,"[REQUEST] How small would the earth have to be for the bottom to be true?",0,https://i.redd.it/1sc3c7xt2cac1.jpeg,0.95,136,1704334947,2024-01-04T02:22:27+0000
2024-01-04T09,18y1gxn,8,11821,facepalm,2r5rp,"Keep it simple stupid",0,https://i.redd.it/4wtyo5vg1cac1.jpeg,0.93,717,1704334500,2024-01-04T02:15:00+0000
2024-01-04T09,18y1d2b,29,4543,Awww,2suml,"Swan couple reunited after one was treated for sickness.",0,https://v.redd.it/5gk5wp6i0cac1,0.97,76,1704334208,2024-01-04T02:10:08+0000
2024-01-04T09,18y10x1,33,4177,aww,2qh1o,"My boy will be 20 this year, and he's still majestic AF",0,https://www.reddit.com/gallery/18y10x1,0.97,80,1704333308,2024-01-04T01:55:08+0000
2024-01-04T09,18y10av,81,4879,mildlyinteresting,2ti4h,"Got tipped 5lbs 12oz of chow mein",0,https://i.redd.it/orwd1yltxbac1.jpeg,0.97,179,1704333262,2024-01-04T01:54:22+0000
2024-01-04T09,18y0r7x,65,2983,oddlyspecific,2wjlc,"Time to grab the pitchforks.",0,https://i.redd.it/7r1ffo6svbac1.jpeg,0.93,542,1704332576,2024-01-04T01:42:56+0000
2024-01-04T09,18y0nfc,51,7854,Unexpected,2w67q,"Professional pouring job",0,https://v.redd.it/imtssqvtubac1,0.96,156,1704332291,2024-01-04T01:38:11+0000
2024-01-04T09,18y0irm,64,3031,AskReddit,2qh1i,"What hobby is an instant red flag?",1,https://www.reddit.com/r/AskReddit/comments/18y0irm/what_hobby_is_an_instant_red_flag/,0.92,3301,1704331942,2024-01-04T01:32:22+0000
2024-01-04T09,18y0cfe,41,3882,Hololive,29numb,"Happy New Year, r/hololive! 🐾✨【FUWAMOCO🐾】",0,https://www.reddit.com/gallery/18y0cfe,0.95,93,1704331471,2024-01-04T01:24:31+0000
2024-01-04T09,18y0c3m,27,7443,shitposting,2usxq,"epstein shid himself",0,https://v.redd.it/j7ed6gvesbac1,0.96,200,1704331447,2024-01-04T01:24:07+0000
2024-01-04T09,18y0b39,80,2710,technicallythetruth,3pzez,"No, she's got the Point",0,https://i.redd.it/7ugu3un5sbac1.png,0.96,44,1704331370,2024-01-04T01:22:50+0000
2024-01-04T09,18y0b0d,11,8243,BlackPeopleTwitter,33x33,"Man was movin like Polamalu",0,https://v.redd.it/rhxvqtr5sbac1,0.95,533,1704331364,2024-01-04T01:22:44+0000
2024-01-04T09,18y0965,94,2230,CemeteryPorn,2sur3,"After 40 years I righted a wrong",0,https://i.redd.it/1epuqhyrrbac1.jpeg,0.95,45,1704331233,2024-01-04T01:20:33+0000
2024-01-04T09,18y04ar,42,3821,BaldursGate3,12967t,"It's tough being the protagonist",0,https://i.redd.it/989j244mqbac1.jpeg,0.95,176,1704330874,2024-01-04T01:14:34+0000
2024-01-04T09,18xzzni,7,23027,Damnthatsinteresting,2xxyj,"How to make lipstick (2000 years ago)",0,https://v.redd.it/asy2bptjpbac1,0.9,932,1704330534,2024-01-04T01:08:54+0000
2024-01-04T09,18xzzjq,10,9739,ContagiousLaughter,2u2bh,"Drill Sergeant Daddy",0,https://v.redd.it/g2bv4nahpbac1,0.94,244,1704330526,2024-01-04T01:08:46+0000
2024-01-04T09,18xzu86,22,6533,politics,2cneq,"Clinton and Trump are named in Jeffrey Epstein documents, no wrongdoing alleged",0,https://www.usatoday.com/story/news/politics/2024/01/03/jeffrey-epstein-list-clinton-trump/72086945007/,0.94,1212,1704330129,2024-01-04T01:02:09+0000
2024-01-04T09,18xzg5o,66,3425,worldnews,2qh13,"Hezbollah confirms: Senior member of the organization killed in Israeli strike",0,https://www.israelnationalnews.com/news/383037,0.93,305,1704329125,2024-01-04T12:45:25+0000
2024-01-04T09,18xzfk8,57,3687,gifs,2qt55,"Automatic Candle Extinguisher from 1841",0,https://i.imgur.com/LwWYEaJ.gifv,0.93,95,1704329087,2024-01-04T12:44:47+0000
2024-01-04T09,18xze67,5,28576,MadeMeSmile,2uqcm,"Winning! Final hematologist appointment, cancer free! Acute Myeloid Leukemia in remission, cheers with me.",0,https://i.redd.it/1f6qdhr3lbac1.jpeg,0.95,555,1704328985,2024-01-04T12:43:05+0000
2024-01-04T09,18xz2wm,76,3235,nope,2s5fh,"Man attacks judge after she refused to give him probation",0,https://v.redd.it/zol0i61mibac1,0.93,317,1704328176,2024-01-04T12:29:36+0000
2024-01-04T09,18xyyma,86,2923,chaoticgood,2qjo5,"Texas coffee shop under fire for providing Plan B through Jane’s Due Process",0,https://i.redd.it/7g04whdrhbac1.jpeg,0.97,74,1704327865,2024-01-04T12:24:25+0000
2024-01-04T09,18xyvrx,72,3638,FUCKYOUINPARTICULAR,3538a,"From r/foundsatan 😶",0,https://i.redd.it/we6prpa6hbac1.jpeg,0.93,256,1704327664,2024-01-04T12:21:04+0000
2024-01-04T09,18xyqll,91,2763,Epstein,1lruuu,"1.3.24 Epstein documents 943 pages",0,https://www.documentcloud.org/documents/24253239-1324-epstein-documents-943-pages,0.95,816,1704327291,2024-01-04T12:14:51+0000
2024-01-04T09,18xykou,55,4500,TopCharacterDesigns,86ohyi,"West of Loathing Concept Art vs In-Game:",0,https://www.reddit.com/gallery/18xykou,0.96,93,1704326873,2024-01-04T12:07:53+0000
2024-01-04T09,18xykgz,53,4678,perfectlycutscreams,3n7fs,"the best one I've seen",0,https://v.redd.it/xpst531sebac1,0.9,51,1704326858,2024-01-04T12:07:38+0000
2024-01-04T09,18xya9t,92,6368,PublicFreakout,2yrq6,"Full video of the man who attacked a Clark County judge in court after she denied his probation.",0,https://v.redd.it/9q9tvilocbac1,0.96,1113,1704326154,2024-01-03T11:55:54+0000
2024-01-04T09,18xy6fb,39,5940,PrequelMemes,3i60n,"The truth was out there",0,https://v.redd.it/ig62pijnbbac1,0.97,43,1704325879,2024-01-03T11:51:19+0000
2024-01-04T09,18xxryv,69,4150,cats,2qhta,"Wife kept saying my snoring was waking her up but as it turns out….",0,https://v.redd.it/5vd5ck4y8bac1,1.0,76,1704324898,2024-01-03T11:34:58+0000
2024-01-04T09,18xxl6u,89,3591,Gamingcirclejerk,2sf2b,"War has began",0,https://www.reddit.com/gallery/18xxl6u,0.82,655,1704324440,2024-01-03T11:27:20+0000
2024-01-04T09,18xxkam,35,6969,rareinsults,48t85,"Cute- 😍😍 Not cute- ☹️☹️",0,https://i.redd.it/ra7998je7bac1.jpeg,0.96,84,1704324378,2024-01-03T11:26:18+0000
2024-01-04T09,18xxgy3,37,6837,KidsAreFuckingStupid,3948y,"He did not care one bit",0,https://v.redd.it/bpzvgolp6bac1,0.92,398,1704324144,2024-01-03T11:22:24+0000
2024-01-04T09,18xxgk2,44,5471,AbruptChaos,3nasz,"A judge in Las Vegas is attacked during a live hearing after she denied probation",0,https://v.redd.it/g20it3wm6bac1,0.94,913,1704324119,2024-01-03T11:21:59+0000
2024-01-04T09,18xxfgu,84,4108,Deltarune,qmi8w,"think about it",0,https://i.redd.it/dsb469zd6bac1.png,0.96,89,1704324044,2024-01-03T11:20:44+0000
2024-01-04T09,18xx8kh,77,4064,blackcats,2twpw,"Everyone congratulate my house panther on her SOCK KILL",0,https://i.redd.it/2x8mdmj05bac1.png,0.97,86,1704323574,2024-01-03T11:12:54+0000
2024-01-04T09,18xx4un,13,15198,todayilearned,2qqjc,"TIL: Short Sleeper Syndrome is a gene mutation discovered by the University of Pittsburgh in 2014. They can function normally with less than 6 hours of sleep and never need to ""recover"" from lack of sleep as opposed to people who purposefully limit sleep. The mutation was given to mice and worked.",0,https://www.healthline.com/health/sleep/natural-short-sleeper,0.97,1015,1704323332,2024-01-03T11:08:52+0000
2024-01-04T09,18xx0vg,30,8736,lego,2qhm7,"I made a brass armor for Lego",0,https://www.reddit.com/gallery/18xx0vg,0.98,215,1704323060,2024-01-03T11:04:20+0000
2024-01-04T09,18xx084,75,4237,CatDistributionSystem,7l5bxn,"We stopped at a gas station and got back in car to find this lad in the backseat.",0,https://i.redd.it/2r2i7hpc3bac1.jpeg,0.96,165,1704323015,2024-01-03T11:03:35+0000
2024-01-04T09,18xwz76,34,8492,oddlysatisfying,2x93b,"Candle Perfectly Fits Under The Glass",0,https://v.redd.it/s3v9pqq43bac1,0.85,205,1704322942,2024-01-03T11:02:22+0000
2024-01-04T09,18xwdo4,28,11715,pics,2qh0u,"Black children watching as white children play in a only whites park, 1955",0,https://i.redd.it/nwmr2p1wyaac1.jpeg,0.9,964,1704321515,2024-01-03T10:38:35+0000
2024-01-04T09,18xw9j8,56,6121,iamatotalpieceofshit,3jj03,"Man attacks Las Vegas judge during sentencing today",0,https://v.redd.it/ibt7lqf0yaac1,0.94,1003,1704321233,2024-01-03T10:33:53+0000
2024-01-04T09,18xw9fl,97,9688,tumblr,2r7hk,"This is extremely real",0,https://i.redd.it/ko7w6v41yaac1.jpeg,0.95,178,1704321227,2024-01-03T10:33:47+0000
2024-01-04T09,18xvzdn,20,33007,mildlyinteresting,2ti4h,"Bubbles in my coffee this morning",0,https://i.redd.it/i45ex2nzvaac1.png,0.85,2348,1704320541,2024-01-03T10:22:21+0000
2024-01-04T09,18xvyop,17,22111,NatureIsFuckingLit,3gdh7,"🔥 Chimp experiences freedom from a cage for the first time in 28 years 🔥 ",0,https://v.redd.it/sqwyz2osvaac1,0.95,807,1704320493,2024-01-03T10:21:33+0000
2024-01-04T09,18xvtbd,36,9965,me_irl,2vegg,me_irl,0,https://i.imgur.com/7jMqPwL.jpeg,0.94,120,1704320134,2024-01-03T10:15:34+0000
2024-01-04T09,18xvt2s,73,5253,MaliciousCompliance,3boqz,"Boss introduces new timetracking tool to ""avoid time manipulation"", backfires on him",1,https://www.reddit.com/r/MaliciousCompliance/comments/18xvt2s/boss_introduces_new_timetracking_tool_to_avoid/,0.96,221,1704320117,2024-01-03T10:15:17+0000
2024-01-04T09,18xvodd,95,4252,vegaslocals,2xdzp,"Man Attacks Vegas Judge During Sentencing Today",0,https://v.redd.it/7lu5w2qotaac1,0.95,1098,1704319804,2024-01-03T10:10:04+0000
2024-01-04T09,18xvo5t,26,20811,BeAmazed,363r3,"Absolute Badass",0,https://i.imgur.com/NLABMUv.jpeg,0.93,423,1704319789,2024-01-03T10:09:49+0000
2024-01-04T09,18xvltp,32,12136,nextfuckinglevel,m0bnr,"Man reveals the technique that could have been used on Stonehedge",0,https://v.redd.it/e33rao0vpaac1,0.94,458,1704319633,2024-01-03T10:07:13+0000
2024-01-04T09,18xvio8,18,18116,PublicFreakout,2yrq6,"A Man Attacked a Las Vegas Judge During Sentencing Today",0,https://v.redd.it/0klbaupjsaac1,0.97,3119,1704319419,2024-01-03T10:03:39+0000
2024-01-04T09,18xvdhi,47,8110,wizardposting,5hjlp1,"You fools! You absolute fools!",0,https://i.redd.it/7es49kloraac1.jpeg,0.96,202,1704319090,2024-01-03T09:58:10+0000
2024-01-04T09,18xvbu1,24,17843,interestingasfuck,2qhsa,"Beachgoers have a close encounter with a Cassowary ",0,https://v.redd.it/lyp451lbraac1,0.94,2036,1704318974,2024-01-03T09:56:14+0000
2024-01-04T09,18xvadq,59,7098,BrandNewSentence,mbn0j,"Now here's a religion I can understand",0,https://i.redd.it/smwfzbwzqaac1.png,0.97,245,1704318872,2024-01-03T09:54:32+0000
2024-01-04T09,18xv6zs,25,17819,WhitePeopleTwitter,35n7t,"Oh please do go there! Who wants popcorn?",0,https://i.redd.it/ld61kqybqaac1.jpeg,0.95,881,1704318638,2024-01-03T09:50:38+0000
2024-01-04T09,18xuwv0,71,7470,OnePiece,2rfz5,"Nico Robin attempt (surprise on 3rd slide) :D",0,https://www.reddit.com/gallery/18xuwv0,0.81,352,1704317961,2024-01-03T09:39:21+0000
2024-01-04T09,18xuryy,96,4578,YouShouldKnow,2r94o,"YSK: Do not share or click on sappy animal rescue videos",1,https://www.reddit.com/r/YouShouldKnow/comments/18xuryy/ysk_do_not_share_or_click_on_sappy_animal_rescue/,0.93,148,1704317628,2024-01-03T09:33:48+0000
2024-01-04T09,18xu3p1,54,9156,FluentInFinance,3qpaq8,"Should Student Loans be Forgiven like PPP Loans were?",0,https://i.redd.it/n1r2tyxdiaac1.png,0.88,1066,1704315991,2024-01-03T09:06:31+0000
2024-01-04T09,18xtyve,50,11221,clevercomebacks,dyqlw,"Just like the women he's been with, he never saw this coming",0,https://i.redd.it/8k421j5ihaac1.png,0.87,720,1704315668,2024-01-03T09:01:08+0000
2024-01-04T09,18xtxnp,61,8332,TikTokCringe,mvcq5,"That's a blessin",0,https://v.redd.it/2nlz5br5haac1,0.95,198,1704315599,2024-01-03T08:59:59+0000
2024-01-04T09,18xtu67,52,10395,funny,2qh33,"Superhero entanglement (Batman, Wonder Woman & Superman)",0,https://i.redd.it/4zzsw8ojgaac1.jpeg,0.88,131,1704315350,2024-01-03T08:55:50+0000
2024-01-04T09,18xtjtd,87,6092,IdiotsInCars,3aimx,"“Dude are you kidding me right now?!” Audi idiot didn’t even look, claims they were not at fault. Dashcam to the rescue! [oc]",0,https://v.redd.it/lhjg7pbheaac1,0.96,731,1704314653,2024-01-03T08:44:13+0000
2024-01-04T09,18xtga5,74,7949,gaming,2qh03,"Jailed Nintendo hacker Gary Bowser denies link to new Switch flash cart",0,https://www.videogameschronicle.com/news/jailed-nintendo-hacker-gary-bowser-denies-link-to-new-switch-flash-cart/,0.95,464,1704314414,2024-01-03T08:40:14+0000
2024-01-04T09,18xs90u,58,16123,SipsTea,5tdqj0,"But friend shape...",0,https://v.redd.it/ertmyfr25aac1,0.9,520,1704311488,2024-01-03T07:51:28+0000
2024-01-04T09,18xs8kt,82,9083,Wellthatsucks,2xcv7,"Went to Goodwill yesterday. Got a discount at the register, thought it was because of tag color. Looked at my receipt today and saw this.",0,https://i.redd.it/3xvxjoiz4aac1.jpeg,0.92,298,1704311458,2024-01-03T07:50:58+0000
2024-01-04T09,18xqr6r,60,19380,FunnyAnimals,2st2l,"Dog thought he was home alone ",0,https://v.redd.it/bc2fgd5nu9ac1,0.96,164,1704307979,2024-01-03T06:52:59+0000
2024-01-04T09,18xqr1b,40,27515,news,2qh3l,"Names in Jeffrey Epstein court documents to be unsealed in New York on Wednesday",0,https://www.cnbc.com/2024/01/03/jeffrey-epstein-court-document-names-unsealed-wednesday-.html,0.94,2577,1704307970,2024-01-03T06:52:50+0000
2024-01-04T09,18xqmsj,98,8731,TwoXChromosomes,2r2jt,"He left and I barely noticed.",1,https://www.reddit.com/r/TwoXChromosomes/comments/18xqmsj/he_left_and_i_barely_noticed/,0.9,365,1704307693,2024-01-03T06:48:13+0000
2024-01-04T09,18xq16a,78,20019,BikiniBottomTwitter,3deqz,"Gary hit em wit the",0,https://v.redd.it/koc84toep9ac1,0.9,399,1704306237,2024-01-03T06:23:57+0000
2024-01-04T09,18xpx54,79,14794,holdmycatnip,2zhxd,"Have a look at this businessman!",0,https://v.redd.it/5wbxadclo9ac1,0.97,116,1704305971,2024-01-03T06:19:31+0000
2024-01-04T09,18xpe1t,85,16466,MurderedByWords,3hx3r,"It's clear as can be",0,https://i.redd.it/t013eymuk9ac1.jpeg,0.89,305,1704304712,2024-01-03T05:58:32+0000
2024-01-04T09,18xoqm4,90,17310,nbacirclejerk,2td2i,"Since my friend pissed me off: he's both zprolgt and mrsonsfan. They're the same person. You're welcome.",0,https://i.redd.it/6cvalohzf9ac1.png,0.9,1058,1704303135,2024-01-03T05:32:15+0000
2024-01-04T08,18y658r,70,1069,pcmasterrace,2sgp1,"Edge's pdf reader is best I've ever seen.",0,https://i.redd.it/9lo2c1id7dac1.png,0.97,101,1704348765,2024-01-04T06:12:45+0000
2024-01-04T08,18y5v80,24,2111,ProgrammerHumor,2tex6,programmingPeaked,0,https://i.redd.it/s2dimkb55dac1.jpeg,0.98,55,1704347833,2024-01-04T05:57:13+0000
2024-01-04T08,18y5nu7,36,1610,BatmanArkham,2y9q4,"Our insanity has reached there",0,https://i.redd.it/tdtbv9n33dac1.png,0.98,48,1704347145,2024-01-04T05:45:45+0000
2024-01-04T08,18y51tj,6,4199,wholesomememes,3gcwj,"healthy thinking",0,https://i.redd.it/6chzygf9wcac1.png,0.97,143,1704345142,2024-01-04T05:12:22+0000
2024-01-04T08,18y4zq1,14,3160,meirl,2s5ti,meirl,0,https://v.redd.it/mtgp5y3mwcac1,0.98,61,1704344965,2024-01-04T05:09:25+0000
2024-01-04T08,18y4pl4,41,1772,Eyebleach,2s427,"ᵂᵉᵉᵉᵉ",0,https://i.imgur.com/7AJi4eR.gifv,0.99,16,1704344064,2024-01-04T04:54:24+0000
2024-01-04T08,18y4fm2,80,1248,technology,2qh16,"Starbucks accused of rigging payments in app for nearly $900 million gain over 5 years by consumer watchdog group",0,https://fortune.com/2024/01/03/starbucks-app-dark-side-unspent-payments-900-million-5-years/,0.96,89,1704343195,2024-01-04T04:39:55+0000
2024-01-04T08,18y49zj,52,1668,DOG,2qiy5,"Brave boi...",0,https://v.redd.it/v06utu5tpcac1,0.98,49,1704342683,2024-01-04T04:31:23+0000
2024-01-04T08,18y3vtu,25,2896,therewasanattempt,39ne7,"To mind your own business",0,https://v.redd.it/29iy6j19mcac1,0.88,88,1704341478,2024-01-04T04:11:18+0000
2024-01-04T08,18y3cev,53,1888,nba,2qo4s,"[Highlight] Jalen Duren dunks on Walker Kessler then gets on his shoulders for a piggyback ride",0,https://streamable.com/91wpjl,0.99,179,1704339876,2024-01-04T03:44:36+0000
2024-01-04T08,18y3ab7,61,1752,JustGuysBeingDudes,33rtj6,"Care for a puff of color boys?",0,https://v.redd.it/ezeacfiwgcac1,0.94,70,1704339699,2024-01-04T03:41:39+0000
2024-01-04T08,18y378h,1,10478,Unexpected,2w67q,"Everyone loves her present",0,https://v.redd.it/1f60z2y4gcac1,0.95,292,1704339434,2024-01-04T03:37:14+0000
