date,id,position,score,subreddit_display_name,subreddit_id,title,is_self,url,upvote_ratio,num_comments,created,created_date
2024-01-04T05,18y10x1,70,1573,aww,2qh1o,"My boy will be 20 this year, and he's still majestic AF",0,https://www.reddit.com/gallery/18y10x1,0.98,54,1704333308,2024-01-04T01:55:08+0000
2024-01-04T05,18y0v0f,73,1511,chaoticgood,2qjo5,"Card Against Humanity pissing off pro-lifers. Pretty amusing.",0,https://i.redd.it/ypkgszrqohm91.jpg,0.94,68,1704332861,2024-01-04T01:47:41+0000
2024-01-04T05,18y0nfc,30,2785,Unexpected,2w67q,"Professional pouring job",0,https://v.redd.it/imtssqvtubac1,0.97,65,1704332291,2024-01-04T01:38:11+0000
2024-01-04T05,18y0cfe,46,2413,Hololive,29numb,"Happy New Year, r/hololive! 🐾✨【FUWAMOCO🐾】",0,https://www.reddit.com/gallery/18y0cfe,0.97,66,1704331471,2024-01-04T01:24:31+0000
2024-01-04T05,18y0b0d,12,4237,BlackPeopleTwitter,33x33,"Man was movin like Polamalu",0,https://v.redd.it/rhxvqtr5sbac1,0.96,313,1704331364,2024-01-04T01:22:44+0000
2024-01-04T05,18y0965,94,1358,CemeteryPorn,2sur3,"After 40 years I righted a wrong",0,https://i.redd.it/1epuqhyrrbac1.jpeg,0.97,37,1704331233,2024-01-04T01:20:33+0000
2024-01-04T05,18y04ar,64,1931,BaldursGate3,12967t,"It's tough being the protagonist",0,https://i.redd.it/989j244mqbac1.jpeg,0.96,124,1704330874,2024-01-04T01:14:34+0000
2024-01-04T05,18xzzni,53,5968,Damnthatsinteresting,2xxyj,"How to make lipstick (2000 years ago)",0,https://v.redd.it/asy2bptjpbac1,0.95,329,1704330534,2024-01-04T01:08:54+0000
2024-01-04T05,18xzzjq,18,3916,ContagiousLaughter,2u2bh,"Drill Sergeant Daddy",0,https://v.redd.it/g2bv4nahpbac1,0.96,92,1704330526,2024-01-04T01:08:46+0000
2024-01-04T05,18xzt47,17,4010,PoliticalHumor,2qm21,"Sending thoughts and prayers",0,https://i.redd.it/51l0mjn1obac1.png,0.96,109,1704330051,2024-01-04T01:00:51+0000
2024-01-04T05,18xzmz6,85,1590,NonPoliticalTwitter,39gt6y,"furries are unironically the very thread that holds the fabric of our modern society together",0,https://i.redd.it/0lwzb8hymbac1.jpeg,0.9,60,1704329608,2024-01-04T12:53:28+0000
2024-01-04T05,18xzg5o,67,1967,worldnews,2qh13,"Hezbollah confirms: Senior member of the organization killed in Israeli strike",0,https://www.israelnationalnews.com/news/383037,0.95,171,1704329125,2024-01-04T12:45:25+0000
2024-01-04T05,18xzfk8,88,1597,gifs,2qt55,"Automatic Candle Extinguisher from 1841",0,https://i.imgur.com/LwWYEaJ.gifv,0.93,55,1704329087,2024-01-04T12:44:47+0000
2024-01-04T05,18xze67,1,16408,MadeMeSmile,2uqcm,"Winning! Final hematologist appointment, cancer free! Acute Myeloid Leukemia in remission, cheers with me.",0,https://i.redd.it/1f6qdhr3lbac1.jpeg,0.97,363,1704328985,2024-01-04T12:43:05+0000
2024-01-04T05,18xz2wm,65,2157,nope,2s5fh,"Man attacks judge after she refused to give him probation",0,https://v.redd.it/zol0i61mibac1,0.94,263,1704328176,2024-01-04T12:29:36+0000
2024-01-04T05,18xyvrx,62,2311,FUCKYOUINPARTICULAR,3538a,"From r/foundsatan 😶",0,https://i.redd.it/we6prpa6hbac1.jpeg,0.94,191,1704327664,2024-01-04T12:21:04+0000
2024-01-04T05,18xyusz,13,5920,memes,2qjpg,"Be safe guys",0,https://i.redd.it/optkvh5zgbac1.jpeg,0.91,309,1704327597,2024-01-04T12:19:57+0000
2024-01-04T05,18xyqll,83,1781,Epstein,1lruuu,"1.3.24 Epstein documents 943 pages",0,https://www.documentcloud.org/documents/24253239-1324-epstein-documents-943-pages,0.96,637,1704327291,2024-01-04T12:14:51+0000
2024-01-04T05,18xykou,50,2828,TopCharacterDesigns,86ohyi,"West of Loathing Concept Art vs In-Game:",0,https://www.reddit.com/gallery/18xykou,0.96,67,1704326873,2024-01-04T12:07:53+0000
2024-01-04T05,18xyb1o,86,1886,Animemes,2w6fe,"Magical Girls are having yet another turn!",0,https://i.redd.it/18ykeb3jcbac1.png,0.96,91,1704326209,2024-01-03T11:56:49+0000
2024-01-04T05,18xya9t,90,4445,PublicFreakout,2yrq6,"Full video of the man who attacked a Clark County judge in court after she denied his probation.",0,https://v.redd.it/9q9tvilocbac1,0.97,848,1704326154,2024-01-03T11:55:54+0000
2024-01-04T05,18xy6fb,42,3475,PrequelMemes,3i60n,"The truth was out there",0,https://v.redd.it/ig62pijnbbac1,0.98,28,1704325879,2024-01-03T11:51:19+0000
2024-01-04T05,18xy4al,5,11638,facepalm,2r5rp,"here goes my hope in humanity",0,https://i.redd.it/dbpdiaiebbac1.jpeg,0.96,1557,1704325732,2024-01-03T11:48:52+0000
2024-01-04T05,18xxwq7,24,4705,shitposting,2usxq,ZUCC,0,https://v.redd.it/9o02xqpp9bac1,0.99,75,1704325218,2024-01-03T11:40:18+0000
2024-01-04T05,18xxpgf,29,4284,therewasanattempt,39ne7,"To appear in court",0,https://v.redd.it/2gognt298bac1,0.95,475,1704324728,2024-01-03T11:32:08+0000
2024-01-04T05,18xxm1g,60,2692,nba,2qo4s,"Bill Simmons says Shai Gilgeous-Alexander is better than Jayson Tatum “SGA is a Top 5 guy in the league now”",0,https://www.theringer.com/bill-simmons,0.92,975,1704324500,2024-01-03T11:28:20+0000
2024-01-04T05,18xxl6u,71,2451,Gamingcirclejerk,2sf2b,"War has began",0,https://www.reddit.com/gallery/18xxl6u,0.85,451,1704324440,2024-01-03T11:27:20+0000
2024-01-04T05,18xxkam,59,2823,rareinsults,48t85,"Cute- 😍😍 Not cute- ☹️☹️",0,https://i.redd.it/ra7998je7bac1.jpeg,0.96,34,1704324378,2024-01-03T11:26:18+0000
2024-01-04T05,18xxgy3,39,3872,KidsAreFuckingStupid,3948y,"He did not care one bit",0,https://v.redd.it/bpzvgolp6bac1,0.93,271,1704324144,2024-01-03T11:22:24+0000
2024-01-04T05,18xxgk2,41,3710,AbruptChaos,3nasz,"A judge in Las Vegas is attacked during a live hearing after she denied probation",0,https://v.redd.it/g20it3wm6bac1,0.95,605,1704324119,2024-01-03T11:21:59+0000
2024-01-04T05,18xxfgu,66,2645,Deltarune,qmi8w,"think about it",0,https://i.redd.it/dsb469zd6bac1.png,0.96,63,1704324044,2024-01-03T11:20:44+0000
2024-01-04T05,18xxcfu,99,2005,dankmemes,2zmfe,"my first post here",0,https://i.redd.it/k52fv3t25bac1.jpeg,0.94,50,1704323837,2024-01-03T11:17:17+0000
2024-01-04T05,18xx8kh,68,2596,blackcats,2twpw,"Everyone congratulate my house panther on her SOCK KILL",0,https://i.redd.it/2x8mdmj05bac1.png,0.97,66,1704323574,2024-01-03T11:12:54+0000
2024-01-04T05,18xx4un,7,9634,todayilearned,2qqjc,"TIL: Short Sleeper Syndrome is a gene mutation discovered by the University of Pittsburgh in 2014. They can function normally with less than 6 hours of sleep and never need to ""recover"" from lack of sleep as opposed to people who purposefully limit sleep. The mutation was given to mice and worked.",0,https://www.healthline.com/health/sleep/natural-short-sleeper,0.97,638,1704323332,2024-01-03T11:08:52+0000
2024-01-04T05,18xx0vg,32,4454,lego,2qhm7,"I made a brass armor for Lego",0,https://www.reddit.com/gallery/18xx0vg,0.98,152,1704323060,2024-01-03T11:04:20+0000
2024-01-04T05,18xx084,58,2983,CatDistributionSystem,7l5bxn,"We stopped at a gas station and got back in car to find this lad in the backseat.",0,https://i.redd.it/2r2i7hpc3bac1.jpeg,0.96,142,1704323015,2024-01-03T11:03:35+0000
2024-01-04T05,18xwz76,19,5575,oddlysatisfying,2x93b,"Candle Perfectly Fits Under The Glass",0,https://v.redd.it/s3v9pqq43bac1,0.87,165,1704322942,2024-01-03T11:02:22+0000
2024-01-04T05,18xwwuw,31,4574,nottheonion,2qnts,"Father says his daughter’s car is melting in the driveway. Honda says it’s not covered by warranty",0,https://www.wsbtv.com/news/local/dekalb-county/father-says-his-daughters-car-is-melting-driveway-honda-says-its-not-covered-by-warranty/SYEKOWWHKVBORBR4NMYKVOALW4/,0.94,248,1704322798,2024-01-03T10:59:58+0000
2024-01-04T05,18xwt4i,82,2309,BG3,35s7n,"I HAVE PEAKED",0,https://i.redd.it/gi6b8lfx1bac1.png,0.96,104,1704322536,2024-01-03T10:55:36+0000
2024-01-04T05,18xwqcv,28,4999,cats,2qhta,"A mother always knows the sound of her babies.",0,https://v.redd.it/6fslysc11bac1,0.97,84,1704322349,2024-01-03T10:52:29+0000
2024-01-04T05,18xwkm5,48,3755,CrazyFuckingVideos,45hae8,"Man attacks Las Vegas judge after she denies his probation",0,https://v.redd.it/bf5hk7p80bac1,0.95,527,1704321969,2024-01-03T10:46:09+0000
2024-01-04T05,18xwdo4,11,8104,pics,2qh0u,"Black children watching as white children play in a only whites park, 1955",0,https://i.redd.it/nwmr2p1wyaac1.jpeg,0.91,708,1704321515,2024-01-03T10:38:35+0000
2024-01-04T05,18xw9j8,34,4894,iamatotalpieceofshit,3jj03,"Man attacks Las Vegas judge during sentencing today",0,https://v.redd.it/ibt7lqf0yaac1,0.95,863,1704321233,2024-01-03T10:33:53+0000
2024-01-04T05,18xw9fl,15,7584,tumblr,2r7hk,"This is extremely real",0,https://i.redd.it/ko7w6v41yaac1.jpeg,0.95,130,1704321227,2024-01-03T10:33:47+0000
2024-01-04T05,18xvzdn,2,26407,mildlyinteresting,2ti4h,"Bubbles in my coffee this morning",0,https://i.redd.it/i45ex2nzvaac1.png,0.87,2051,1704320541,2024-01-03T10:22:21+0000
2024-01-04T05,18xvyop,4,16138,NatureIsFuckingLit,3gdh7,"🔥 Chimp experiences freedom from a cage for the first time in 28 years 🔥 ",0,https://v.redd.it/sqwyz2osvaac1,0.96,645,1704320493,2024-01-03T10:21:33+0000
2024-01-04T05,18xvtbd,27,5986,me_irl,2vegg,me_irl,0,https://i.imgur.com/7jMqPwL.jpeg,0.96,63,1704320134,2024-01-03T10:15:34+0000
2024-01-04T05,18xvt2s,57,3565,MaliciousCompliance,3boqz,"Boss introduces new timetracking tool to ""avoid time manipulation"", backfires on him",1,https://www.reddit.com/r/MaliciousCompliance/comments/18xvt2s/boss_introduces_new_timetracking_tool_to_avoid/,0.96,165,1704320117,2024-01-03T10:15:17+0000
2024-01-04T05,18xvo5t,10,12866,BeAmazed,363r3,"Absolute Badass",0,https://i.imgur.com/NLABMUv.jpeg,0.94,305,1704319789,2024-01-03T10:09:49+0000
2024-01-04T05,18xvltp,20,6770,nextfuckinglevel,m0bnr,"Man reveals the technique that could have been used on Stonehedge",0,https://v.redd.it/e33rao0vpaac1,0.94,311,1704319633,2024-01-03T10:07:13+0000
2024-01-04T05,18xvk7h,69,3214,ActualPublicFreakouts,27mtyi,"Man Attacks Las Vegas Judge During Sentencing Today",0,https://v.redd.it/47dllx6rsaac1,0.95,697,1704319525,2024-01-03T10:05:25+0000
2024-01-04T05,18xvio8,3,15321,PublicFreakout,2yrq6,"A Man Attacked a Las Vegas Judge During Sentencing Today",0,https://v.redd.it/0klbaupjsaac1,0.97,2813,1704319419,2024-01-03T10:03:39+0000
2024-01-04T05,18xvdhi,36,5570,wizardposting,5hjlp1,"You fools! You absolute fools!",0,https://i.redd.it/7es49kloraac1.jpeg,0.96,171,1704319090,2024-01-03T09:58:10+0000
2024-01-04T05,18xvbu1,8,14037,interestingasfuck,2qhsa,"Beachgoers have a close encounter with a Cassowary ",0,https://v.redd.it/lyp451lbraac1,0.95,1758,1704318974,2024-01-03T09:56:14+0000
2024-01-04T05,18xvadq,51,4198,BrandNewSentence,mbn0j,"Now here's a religion I can understand",0,https://i.redd.it/smwfzbwzqaac1.png,0.97,166,1704318872,2024-01-03T09:54:32+0000
2024-01-04T05,18xv7s3,84,2768,LeopardsAteMyFace,3jp3p,"shocking discovery: misogyny attracts misogynists",0,https://www.reddit.com/gallery/18xv7s3,0.95,141,1704318690,2024-01-03T09:51:30+0000
2024-01-04T05,18xv6zs,9,13549,WhitePeopleTwitter,35n7t,"Oh please do go there! Who wants popcorn?",0,https://i.redd.it/ld61kqybqaac1.jpeg,0.96,695,1704318638,2024-01-03T09:50:38+0000
2024-01-04T05,18xuwv0,44,5660,OnePiece,2rfz5,"Nico Robin attempt (surprise on 3rd slide) :D",0,https://www.reddit.com/gallery/18xuwv0,0.82,296,1704317961,2024-01-03T09:39:21+0000
2024-01-04T05,18xuv6q,6,20045,Damnthatsinteresting,2xxyj,"Best Buy is removing all physical media from their stores as of today.",0,https://i.redd.it/ggg8kznynaac1.jpeg,0.94,4232,1704317840,2024-01-03T09:37:20+0000
2024-01-04T05,18xuryy,78,3199,YouShouldKnow,2r94o,"YSK: Do not share or click on sappy animal rescue videos",1,https://www.reddit.com/r/YouShouldKnow/comments/18xuryy/ysk_do_not_share_or_click_on_sappy_animal_rescue/,0.94,109,1704317628,2024-01-03T09:33:48+0000
2024-01-04T05,18xulpi,98,2783,starterpacks,34o9s,"The ""fellas, is it gay to...?"" starter pack",0,https://i.redd.it/vtg94z7ylaac1.png,0.94,307,1704317201,2024-01-03T09:26:41+0000
2024-01-04T05,18xujil,55,4457,mildlyinfuriating,2ubgg,"The amount of wrapping paper on this partially used vintage roll (left) vs. a brand new modern roll (right)",0,https://i.redd.it/zgg4z5xmlaac1.jpeg,0.95,189,1704317057,2024-01-03T09:24:17+0000
2024-01-04T05,18xubqo,100,2955,TerrifyingAsFuck,31d92,"Black children watching as white children play in a whites only park, 1956",0,https://i.redd.it/4huvrky2kaac1.jpeg,0.85,105,1704316535,2024-01-03T09:15:35+0000
2024-01-04T05,18xu74c,21,8529,wholesomememes,3gcwj,"I always feel so terrible",0,https://i.redd.it/07ip85z4jaac1.jpeg,0.97,98,1704316226,2024-01-03T09:10:26+0000
2024-01-04T05,18xu3p1,33,6983,FluentInFinance,3qpaq8,"Should Student Loans be Forgiven like PPP Loans were?",0,https://i.redd.it/n1r2tyxdiaac1.png,0.89,911,1704315991,2024-01-03T09:06:31+0000
2024-01-04T05,18xu35o,91,3186,Genshin_Impact,12p4l2,"Albedo's family tree.",0,https://i.redd.it/71ghps2ciaac1.png,0.96,221,1704315955,2024-01-03T09:05:55+0000
2024-01-04T05,18xu222,95,10984,facepalm,2r5rp,"The whole clip..",0,https://i.redd.it/68vwtv14iaac1.jpeg,0.86,3780,1704315884,2024-01-03T09:04:44+0000
2024-01-04T05,18xtyve,25,8407,clevercomebacks,dyqlw,"Just like the women he's been with, he never saw this coming",0,https://i.redd.it/8k421j5ihaac1.png,0.89,540,1704315668,2024-01-03T09:01:08+0000
2024-01-04T05,18xtxnp,38,6261,TikTokCringe,mvcq5,"That's a blessin",0,https://v.redd.it/2nlz5br5haac1,0.96,169,1704315599,2024-01-03T08:59:59+0000
2024-01-04T05,18xtu67,35,7208,funny,2qh33,"Superhero entanglement (Batman, Wonder Woman & Superman)",0,https://i.redd.it/4zzsw8ojgaac1.jpeg,0.88,109,1704315350,2024-01-03T08:55:50+0000
2024-01-04T05,18xtjtd,54,5131,IdiotsInCars,3aimx,"“Dude are you kidding me right now?!” Audi idiot didn’t even look, claims they were not at fault. Dashcam to the rescue! [oc]",0,https://v.redd.it/lhjg7pbheaac1,0.96,663,1704314653,2024-01-03T08:44:13+0000
2024-01-04T05,18xtga5,40,6744,gaming,2qh03,"Jailed Nintendo hacker Gary Bowser denies link to new Switch flash cart",0,https://www.videogameschronicle.com/news/jailed-nintendo-hacker-gary-bowser-denies-link-to-new-switch-flash-cart/,0.96,378,1704314414,2024-01-03T08:40:14+0000
2024-01-04T05,18xskmw,63,6151,PeterExplainsTheJoke,121h8r,"Someone please help before I go insane!",0,https://i.redd.it/nvjas4xc7aac1.png,0.88,140,1704312258,2024-01-03T08:04:18+0000
2024-01-04T05,18xsga0,75,4572,europe,2qh4j,"Belarusian is disappearing (2009 & 2019)",0,https://www.reddit.com/gallery/18xsga0,0.95,680,1704311982,2024-01-03T07:59:42+0000
2024-01-04T05,18xs90u,26,12391,SipsTea,5tdqj0,"But friend shape...",0,https://v.redd.it/ertmyfr25aac1,0.91,445,1704311488,2024-01-03T07:51:28+0000
2024-01-04T05,18xs8kt,47,7503,Wellthatsucks,2xcv7,"Went to Goodwill yesterday. Got a discount at the register, thought it was because of tag color. Looked at my receipt today and saw this.",0,https://i.redd.it/3xvxjoiz4aac1.jpeg,0.92,268,1704311458,2024-01-03T07:50:58+0000
2024-01-04T05,18xs6ck,14,15417,politics,2cneq,"Trump’s Idiot Lawyer Just Admitted He May Be Guilty of Insurrection: Donald Trump keeps hiring the very best.",0,https://newrepublic.com/post/177822/trump-idiot-lawyer-admit-may-guilty-insurrection,0.93,637,1704311308,2024-01-03T07:48:28+0000
2024-01-04T05,18xrqgo,79,5954,maybemaybemaybe,38e1l,"Maybe Maybe Maybe ",0,https://v.redd.it/2xrpegvy0aac1,0.79,311,1704310262,2024-01-03T07:31:02+0000
2024-01-04T05,18xrmgi,89,4529,CuratedTumblr,3x5kfw,"Chinese rocks",0,https://www.reddit.com/gallery/18xrmgi,0.97,71,1704310001,2024-01-03T07:26:41+0000
2024-01-04T05,18xr2r3,77,6893,whenthe,23gidu,Perspectives,0,https://v.redd.it/77zxwghuw9ac1,0.93,203,1704308728,2024-01-03T07:05:28+0000
2024-01-04T05,18xqtcm,92,4617,AskReddit,2qh1i,"What’s the craziest WW2 fact that you know of?",1,https://www.reddit.com/r/AskReddit/comments/18xqtcm/whats_the_craziest_ww2_fact_that_you_know_of/,0.93,4591,1704308119,2024-01-03T06:55:19+0000
2024-01-04T05,18xqt09,61,7606,TrueOffMyChest,2yuqy,"My soon to be ex-husband humiliated me on our wedding day and met his karma instantly.",1,https://www.reddit.com/r/TrueOffMyChest/comments/18xqt09/my_soon_to_be_exhusband_humiliated_me_on_our/,0.89,1427,1704308101,2024-01-03T06:55:01+0000
2024-01-04T05,18xqsk8,96,16451,pics,2qh0u,"Temporary NYPD headquarters at a Burger King, 9/11/2001",0,https://i.redd.it/38fxac5wu9ac1.jpeg,0.95,505,1704308073,2024-01-03T06:54:33+0000
2024-01-04T05,18xqr6r,23,15693,FunnyAnimals,2st2l,"Dog thought he was home alone ",0,https://v.redd.it/bc2fgd5nu9ac1,0.96,147,1704307979,2024-01-03T06:52:59+0000
2024-01-04T05,18xqr1b,16,24675,news,2qh3l,"Names in Jeffrey Epstein court documents to be unsealed in New York on Wednesday",0,https://www.cnbc.com/2024/01/03/jeffrey-epstein-court-document-names-unsealed-wednesday-.html,0.95,2372,1704307970,2024-01-03T06:52:50+0000
2024-01-04T05,18xqmsj,56,7784,TwoXChromosomes,2r2jt,"He left and I barely noticed.",1,https://www.reddit.com/r/TwoXChromosomes/comments/18xqmsj/he_left_and_i_barely_noticed/,0.9,331,1704307693,2024-01-03T06:48:13+0000
2024-01-04T05,18xqlpm,97,17828,WhitePeopleTwitter,35n7t,"Trump's Version of 'America First'",0,https://i.redd.it/c8lvm1cit9ac1.png,0.93,666,1704307620,2024-01-03T06:47:00+0000
2024-01-04T05,18xqio1,22,20884,meirl,2s5ti,meirl,0,https://i.redd.it/uc11q2vys9ac1.jpeg,0.97,108,1704307415,2024-01-03T06:43:35+0000
2024-01-04T05,18xqelw,80,6239,Steam,2qwis,"POV: You woke up the next day and realized that the whole Game Award was a bad dream",0,https://i.redd.it/lfngtbe3s9ac1.png,0.86,477,1704307150,2024-01-03T06:39:10+0000
2024-01-04T05,18xq5a0,52,8370,technology,2qh16,"23andMe tells victims it's their fault that their data was breached",0,https://techcrunch.com/2024/01/03/23andme-tells-victims-its-their-fault-that-their-data-was-breached/,0.96,758,1704306520,2024-01-03T06:28:40+0000
2024-01-04T05,18xq16a,37,18319,BikiniBottomTwitter,3deqz,"Gary hit em wit the",0,https://v.redd.it/koc84toep9ac1,0.91,365,1704306237,2024-01-03T06:23:57+0000
2024-01-04T05,18xpyab,76,6558,NoStupidQuestions,2w844,"In the 80s did parents really just let their kids go out wherever or is this only in movies?",1,https://www.reddit.com/r/NoStupidQuestions/comments/18xpyab/in_the_80s_did_parents_really_just_let_their_kids/,0.93,8786,1704306043,2024-01-03T06:20:43+0000
2024-01-04T05,18xpx54,43,12791,holdmycatnip,2zhxd,"Have a look at this businessman!",0,https://v.redd.it/5wbxadclo9ac1,0.97,107,1704305971,2024-01-03T06:19:31+0000
2024-01-04T05,18xpe1t,45,14819,MurderedByWords,3hx3r,"It's clear as can be",0,https://i.redd.it/t013eymuk9ac1.jpeg,0.89,277,1704304712,2024-01-03T05:58:32+0000
2024-01-04T05,18xoxdh,72,9295,ExplainTheJoke,2vmj2,"My friends in Tech found this hilarious. Captioned ""Stack Overflow, In a nutshell"". Please help.",0,https://i.redd.it/xmeqbzjlh9ac1.jpeg,0.95,167,1704303592,2024-01-03T05:39:52+0000
2024-01-04T05,18xoqm4,49,15540,nbacirclejerk,2td2i,"Since my friend pissed me off: he's both zprolgt and mrsonsfan. They're the same person. You're welcome.",0,https://i.redd.it/6cvalohzf9ac1.png,0.91,1016,1704303135,2024-01-03T05:32:15+0000
2024-01-04T05,18xn8xa,87,11328,lotrmemes,2v0i1,"*using Pippin because he wouldn’t have read them",0,https://i.redd.it/zdhohfjp39ac1.jpeg,0.91,2618,1704298922,2024-01-03T04:22:02+0000
2024-01-04T05,18xmz0a,81,9663,JeffArcuri,740oig,"Bathroom prank",0,https://v.redd.it/ogur2zul19ac1,0.93,150,1704298228,2024-01-03T04:10:28+0000
2024-01-04T05,18xlz2c,74,15198,WorkReform,5qpzgw,"Hustle culture is not normal.",0,https://i.redd.it/3qynn1mwt8ac1.jpeg,0.93,468,1704295649,2024-01-03T03:27:29+0000
2024-01-04T05,18xlnne,93,11882,comics,2qh0s,"[oc] DISGUSTING",0,https://i.redd.it/dylf065hr8ac1.jpeg,0.95,195,1704294808,2024-01-03T03:13:28+0000
2024-01-04T04,18y0cfe,55,1859,Hololive,29numb,"Happy New Year, r/hololive! 🐾✨【FUWAMOCO🐾】",0,https://www.reddit.com/gallery/18y0cfe,0.97,60,1704331471,2024-01-04T01:24:31+0000
2024-01-04T04,18y0b0d,86,2874,BlackPeopleTwitter,33x33,"Man was movin like Polamalu",0,https://v.redd.it/rhxvqtr5sbac1,0.97,246,1704331364,2024-01-04T01:22:44+0000
2024-01-04T04,18y04ar,94,1275,BaldursGate3,12967t,"It's tough being the protagonist",0,https://i.redd.it/989j244mqbac1.jpeg,0.98,101,1704330874,2024-01-04T01:14:34+0000
2024-01-04T04,18xzzjq,45,2192,ContagiousLaughter,2u2bh,"Drill Sergeant Daddy",0,https://v.redd.it/g2bv4nahpbac1,0.96,50,1704330526,2024-01-04T01:08:46+0000
2024-01-04T04,18xzt47,31,2589,PoliticalHumor,2qm21,"Sending thoughts and prayers",0,https://i.redd.it/51l0mjn1obac1.png,0.97,72,1704330051,2024-01-04T01:00:51+0000
2024-01-04T04,18xze67,1,11323,MadeMeSmile,2uqcm,"Winning! Final hematologist appointment, cancer free! Acute Myeloid Leukemia in remission, cheers with me.",0,https://i.redd.it/1f6qdhr3lbac1.jpeg,0.97,278,1704328985,2024-01-04T12:43:05+0000
2024-01-04T04,18xz2wm,71,1763,nope,2s5fh,"Man attacks judge after she refused to give him probation",0,https://v.redd.it/zol0i61mibac1,0.95,228,1704328176,2024-01-04T12:29:36+0000
2024-01-04T04,18xyvrx,69,1850,FUCKYOUINPARTICULAR,3538a,"From r/foundsatan 😶",0,https://i.redd.it/we6prpa6hbac1.jpeg,0.94,169,1704327664,2024-01-04T12:21:04+0000
2024-01-04T04,18xyusz,98,3485,memes,2qjpg,"Be safe guys",0,https://i.redd.it/optkvh5zgbac1.jpeg,0.93,209,1704327597,2024-01-04T12:19:57+0000
2024-01-04T04,18xykou,56,2303,TopCharacterDesigns,86ohyi,"West of Loathing Concept Art vs In-Game:",0,https://www.reddit.com/gallery/18xykou,0.96,52,1704326873,2024-01-04T12:07:53+0000
2024-01-04T04,18xya9t,93,3640,PublicFreakout,2yrq6,"Full video of the man who attacked a Clark County judge in court after she denied his probation.",0,https://v.redd.it/9q9tvilocbac1,0.97,739,1704326154,2024-01-03T11:55:54+0000
2024-01-04T04,18xy6fb,48,2690,PrequelMemes,3i60n,"The truth was out there",0,https://v.redd.it/ig62pijnbbac1,0.99,24,1704325879,2024-01-03T11:51:19+0000
2024-01-04T04,18xy4al,46,7355,facepalm,2r5rp,"here goes my hope in humanity",0,https://i.redd.it/dbpdiaiebbac1.jpeg,0.97,933,1704325732,2024-01-03T11:48:52+0000
2024-01-04T04,18xxpgf,36,3400,therewasanattempt,39ne7,"To appear in court",0,https://v.redd.it/2gognt298bac1,0.95,407,1704324728,2024-01-03T11:32:08+0000
2024-01-04T04,18xxm1g,60,2319,nba,2qo4s,"Bill Simmons says Shai Gilgeous-Alexander is better than Jayson Tatum “SGA is a Top 5 guy in the league now”",0,https://www.theringer.com/bill-simmons,0.92,915,1704324500,2024-01-03T11:28:20+0000
2024-01-04T04,18xxl6u,77,2021,Gamingcirclejerk,2sf2b,"War has began",0,https://www.reddit.com/gallery/18xxl6u,0.85,401,1704324440,2024-01-03T11:27:20+0000
2024-01-04T04,18xxkam,83,1945,rareinsults,48t85,"Cute- 😍😍 Not cute- ☹️☹️",0,https://i.redd.it/ra7998je7bac1.jpeg,0.97,26,1704324378,2024-01-03T11:26:18+0000
2024-01-04T04,18xxgy3,47,2938,KidsAreFuckingStupid,3948y,"He did not care one bit",0,https://v.redd.it/bpzvgolp6bac1,0.93,229,1704324144,2024-01-03T11:22:24+0000
2024-01-04T04,18xxgk2,42,3106,AbruptChaos,3nasz,"A judge in Las Vegas is attacked during a live hearing after she denied probation",0,https://v.redd.it/g20it3wm6bac1,0.95,525,1704324119,2024-01-03T11:21:59+0000
2024-01-04T04,18xxfgu,70,2232,Deltarune,qmi8w,"think about it",0,https://i.redd.it/dsb469zd6bac1.png,0.97,61,1704324044,2024-01-03T11:20:44+0000
2024-01-04T04,18xx98s,53,2781,antiwork,2y77d,"Got fired for this text message",0,https://i.redd.it/m97nezo55bac1.jpeg,0.96,175,1704323622,2024-01-03T11:13:42+0000
2024-01-04T04,18xx8kh,80,2047,blackcats,2twpw,"Everyone congratulate my house panther on her SOCK KILL",0,https://i.redd.it/2x8mdmj05bac1.png,0.98,59,1704323574,2024-01-03T11:12:54+0000
2024-01-04T04,18xx4un,10,7334,todayilearned,2qqjc,"TIL: Short Sleeper Syndrome is a gene mutation discovered by the University of Pittsburgh in 2014. They can function normally with less than 6 hours of sleep and never need to ""recover"" from lack of sleep as opposed to people who purposefully limit sleep. The mutation was given to mice and worked.",0,https://www.healthline.com/health/sleep/natural-short-sleeper,0.97,472,1704323332,2024-01-03T11:08:52+0000
2024-01-04T04,18xx0vg,41,3390,lego,2qhm7,"I made a brass armor for Lego",0,https://www.reddit.com/gallery/18xx0vg,0.98,130,1704323060,2024-01-03T11:04:20+0000
2024-01-04T04,18xx084,63,2474,CatDistributionSystem,7l5bxn,"We stopped at a gas station and got back in car to find this lad in the backseat.",0,https://i.redd.it/2r2i7hpc3bac1.jpeg,0.96,126,1704323015,2024-01-03T11:03:35+0000
2024-01-04T04,18xwz76,21,4493,oddlysatisfying,2x93b,"Candle Perfectly Fits Under The Glass",0,https://v.redd.it/s3v9pqq43bac1,0.88,148,1704322942,2024-01-03T11:02:22+0000
2024-01-04T04,18xwwuw,34,3777,nottheonion,2qnts,"Father says his daughter’s car is melting in the driveway. Honda says it’s not covered by warranty",0,https://www.wsbtv.com/news/local/dekalb-county/father-says-his-daughters-car-is-melting-driveway-honda-says-its-not-covered-by-warranty/SYEKOWWHKVBORBR4NMYKVOALW4/,0.94,214,1704322798,2024-01-03T10:59:58+0000
2024-01-04T04,18xwt4i,91,2003,BG3,35s7n,"I HAVE PEAKED",0,https://i.redd.it/gi6b8lfx1bac1.png,0.95,99,1704322536,2024-01-03T10:55:36+0000
2024-01-04T04,18xwkm5,44,3443,CrazyFuckingVideos,45hae8,"Man attacks Las Vegas judge after she denies his probation",0,https://v.redd.it/bf5hk7p80bac1,0.95,481,1704321969,2024-01-03T10:46:09+0000
2024-01-04T04,18xwdo4,14,6491,pics,2qh0u,"Black children watching as white children play in a only whites park, 1955",0,https://i.redd.it/nwmr2p1wyaac1.jpeg,0.92,581,1704321515,2024-01-03T10:38:35+0000
2024-01-04T04,18xw9j8,27,4410,iamatotalpieceofshit,3jj03,"Man attacks Las Vegas judge during sentencing today",0,https://v.redd.it/ibt7lqf0yaac1,0.95,803,1704321233,2024-01-03T10:33:53+0000
2024-01-04T04,18xw9fl,15,6661,tumblr,2r7hk,"This is extremely real",0,https://i.redd.it/ko7w6v41yaac1.jpeg,0.95,112,1704321227,2024-01-03T10:33:47+0000
2024-01-04T04,18xw8yg,7,10168,facepalm,2r5rp,"Maybe this is why a President shouldn’t be telling Police to “rough up” suspects a little bit",0,https://i.redd.it/q2edppowxaac1.jpeg,0.97,368,1704321194,2024-01-03T10:33:14+0000
