date,id,position,score,subreddit_display_name,subreddit_id,title,is_self,url,upvote_ratio,num_comments,created,created_date
2024-01-04T02,18xn8xa,57,10242,lotrmemes,2v0i1,"*using Pippin because he wouldn’t have read them",0,https://i.redd.it/zdhohfjp39ac1.jpeg,0.92,2367,1704298922,2024-01-03T04:22:02+0000
2024-01-04T02,18xmz0a,52,8885,JeffArcuri,740oig,"Bathroom prank",0,https://v.redd.it/ogur2zul19ac1,0.93,136,1704298228,2024-01-03T04:10:28+0000
2024-01-04T02,18xmige,44,14133,TikTokCringe,mvcq5,"Not in here",0,https://v.redd.it/tsunlxoxx8ac1,0.91,1711,1704297066,2024-01-03T03:51:06+0000
2024-01-04T02,18xmie9,79,7216,shittymoviedetails,3mj3w,"In The Last Jedi(2017), Finn and Rose save horses from captivity while not saving the child slaves. The movie was then awarded an Oscar from PETA.",0,https://i.redd.it/gpgg5jv0y8ac1.jpeg,0.93,361,1704297061,2024-01-03T03:51:01+0000
2024-01-04T02,18xlz2c,47,13691,WorkReform,5qpzgw,"Hustle culture is not normal.",0,https://i.redd.it/3qynn1mwt8ac1.jpeg,0.93,449,1704295649,2024-01-03T03:27:29+0000
2024-01-04T02,18xly3c,88,6985,ProgrammerHumor,2tex6,bestWayToLearn,0,https://i.redd.it/hv503vcrt8ac1.jpeg,0.98,110,1704295576,2024-01-03T03:26:16+0000
2024-01-04T02,18xlnne,65,10616,comics,2qh0s,"[oc] DISGUSTING",0,https://i.redd.it/dylf065hr8ac1.jpeg,0.95,180,1704294808,2024-01-03T03:13:28+0000
2024-01-04T02,18xlf52,49,13786,worldnews,2qh13,"NATO to buy 1,000 Patriot missiles in face of Russia threat",0,https://www.thedefensepost.com/2024/01/03/nato-buys-patriot-missiles/?expand_article=1,0.95,1259,1704294186,2024-01-03T03:03:06+0000
2024-01-04T02,18xl64i,68,16351,sadposting,5203f0,"Social Experiment",0,https://v.redd.it/bt5xnuljn8ac1,0.84,4797,1704293509,2024-01-03T02:51:49+0000
2024-01-04T02,18xjres,69,13805,PoliticalHumor,2qm21,"No Malarkey, Jack!",0,https://i.redd.it/xa6y20uwb8ac1.jpeg,0.93,388,1704289573,2024-01-03T01:46:13+0000
2024-01-04T01,18xxgk2,78,1370,AbruptChaos,3nasz,"A judge in Las Vegas is attacked during a live hearing after she denied probation",0,https://v.redd.it/g20it3wm6bac1,0.96,298,1704324119,2024-01-03T11:21:59+0000
2024-01-04T01,18xx2ce,64,3503,me_irl,2vegg,"me irl",0,https://i.redd.it/x735ktgr3bac1.png,0.96,50,1704323160,2024-01-03T11:06:00+0000
2024-01-04T01,18xwz76,75,1491,oddlysatisfying,2x93b,"Candle Perfectly Fits Under The Glass",0,https://v.redd.it/s3v9pqq43bac1,0.86,65,1704322942,2024-01-03T11:02:22+0000
2024-01-04T01,18xwwuw,81,1453,nottheonion,2qnts,"Father says his daughter’s car is melting in the driveway. Honda says it’s not covered by warranty",0,https://www.wsbtv.com/news/local/dekalb-county/father-says-his-daughters-car-is-melting-driveway-honda-says-its-not-covered-by-warranty/SYEKOWWHKVBORBR4NMYKVOALW4/,0.94,112,1704322798,2024-01-03T10:59:58+0000
2024-01-04T01,18xwn8n,3,8939,technicallythetruth,3pzez,"Well, I think he got a really good point",0,https://i.redd.it/8pa4b7gd0bac1.png,0.97,181,1704322139,2024-01-03T10:48:59+0000
2024-01-04T01,18xwkm5,51,2127,CrazyFuckingVideos,45hae8,"Man attacks Las Vegas judge after she denies his probation",0,https://v.redd.it/bf5hk7p80bac1,0.96,330,1704321969,2024-01-03T10:46:09+0000
2024-01-04T01,18xw9j8,31,2827,iamatotalpieceofshit,3jj03,"Man attacks Las Vegas judge during sentencing today",0,https://v.redd.it/ibt7lqf0yaac1,0.97,591,1704321233,2024-01-03T10:33:53+0000
2024-01-04T01,18xw9fl,22,3856,tumblr,2r7hk,"This is extremely real",0,https://i.redd.it/ko7w6v41yaac1.jpeg,0.96,40,1704321227,2024-01-03T10:33:47+0000
2024-01-04T01,18xvzdn,1,15302,mildlyinteresting,2ti4h,"Bubbles in my coffee this morning",0,https://i.redd.it/i45ex2nzvaac1.png,0.9,1259,1704320541,2024-01-03T10:22:21+0000
2024-01-04T01,18xvyop,7,6947,NatureIsFuckingLit,3gdh7,"🔥 Chimp experiences freedom from a cage for the first time in 28 years 🔥 ",0,https://v.redd.it/sqwyz2osvaac1,0.97,296,1704320493,2024-01-03T10:21:33+0000
2024-01-04T01,18xvt2s,86,1581,MaliciousCompliance,3boqz,"Boss introduces new timetracking tool to ""avoid time manipulation"", backfires on him",1,https://www.reddit.com/r/MaliciousCompliance/comments/18xvt2s/boss_introduces_new_timetracking_tool_to_avoid/,0.97,94,1704320117,2024-01-03T10:15:17+0000
2024-01-04T01,18xvo5t,27,3385,BeAmazed,363r3,"Absolute Badass",0,https://i.imgur.com/NLABMUv.jpeg,0.96,98,1704319789,2024-01-03T10:09:49+0000
2024-01-04T01,18xvltp,65,1949,nextfuckinglevel,m0bnr,"Man reveals the technique that could have been used on Stonehedge",0,https://v.redd.it/e33rao0vpaac1,0.95,147,1704319633,2024-01-03T10:07:13+0000
2024-01-04T01,18xvk7h,59,2178,ActualPublicFreakouts,27mtyi,"Man Attacks Las Vegas Judge During Sentencing Today",0,https://v.redd.it/47dllx6rsaac1,0.96,549,1704319525,2024-01-03T10:05:25+0000
2024-01-04T01,18xvio8,2,9760,PublicFreakout,2yrq6,"A Man Attacked a Las Vegas Judge During Sentencing Today",0,https://v.redd.it/0klbaupjsaac1,0.98,1892,1704319419,2024-01-03T10:03:39+0000
2024-01-04T01,18xvdhi,53,2477,wizardposting,5hjlp1,"You fools! You absolute fools!",0,https://i.redd.it/7es49kloraac1.jpeg,0.97,117,1704319090,2024-01-03T09:58:10+0000
2024-01-04T01,18xvbu1,8,7279,interestingasfuck,2qhsa,"Beachgoers have a close encounter with a Cassowary ",0,https://v.redd.it/lyp451lbraac1,0.96,1139,1704318974,2024-01-03T09:56:14+0000
2024-01-04T01,18xv7s3,98,1554,LeopardsAteMyFace,3jp3p,"shocking discovery: misogyny attracts misogynists",0,https://www.reddit.com/gallery/18xv7s3,0.97,91,1704318690,2024-01-03T09:51:30+0000
2024-01-04T01,18xv6zs,44,5892,WhitePeopleTwitter,35n7t,"Oh please do go there! Who wants popcorn?",0,https://i.redd.it/ld61kqybqaac1.jpeg,0.98,346,1704318638,2024-01-03T09:50:38+0000
2024-01-04T01,18xuwv0,32,3482,OnePiece,2rfz5,"Nico Robin attempt (surprise on 3rd slide) :D",0,https://www.reddit.com/gallery/18xuwv0,0.84,205,1704317961,2024-01-03T09:39:21+0000
2024-01-04T01,18xuv6q,5,10009,Damnthatsinteresting,2xxyj,"Best Buy is removing all physical media from their stores as of today.",0,https://i.redd.it/ggg8kznynaac1.jpeg,0.96,2229,1704317840,2024-01-03T09:37:20+0000
2024-01-04T01,18xulpi,87,1801,starterpacks,34o9s,"The ""fellas, is it gay to...?"" starter pack",0,https://i.redd.it/vtg94z7ylaac1.png,0.95,232,1704317201,2024-01-03T09:26:41+0000
2024-01-04T01,18xubqo,70,2195,TerrifyingAsFuck,31d92,"Black children watching as white children play in a whites only park, 1956",0,https://i.redd.it/4huvrky2kaac1.jpeg,0.86,105,1704316535,2024-01-03T09:15:35+0000
2024-01-04T01,18xuasw,88,1845,nba,2qo4s,"[Russo] At shootaround today, LA Clippers coach Tyronn Lue said that Mason Plumlee approached him recently to tell Lue that he doesn’t want to “mess up” the “good thing” the Clippers have going as the team has won 17 out of their last 22 games, and will gladly sit behind Daniel Theis.",0,https://x.com/flybyknite/status/1742652878446305609?s=46,0.97,180,1704316477,2024-01-03T09:14:37+0000
2024-01-04T01,18xu74c,34,3711,wholesomememes,3gcwj,"I always feel so terrible",0,https://i.redd.it/07ip85z4jaac1.jpeg,0.98,33,1704316226,2024-01-03T09:10:26+0000
2024-01-04T01,18xu6fg,4,16234,memes,2qjpg,"Getting older can be lonely",0,https://v.redd.it/06dqnsr0jaac1,0.94,321,1704316185,2024-01-03T09:09:45+0000
2024-01-04T01,18xu3p1,38,3410,FluentInFinance,3qpaq8,"Should Student Loans be Forgiven like PPP Loans were?",0,https://i.redd.it/n1r2tyxdiaac1.png,0.89,605,1704315991,2024-01-03T09:06:31+0000
2024-01-04T01,18xu35o,79,2134,Genshin_Impact,12p4l2,"Albedo's family tree.",0,https://i.redd.it/71ghps2ciaac1.png,0.96,155,1704315955,2024-01-03T09:05:55+0000
2024-01-04T01,18xu222,15,6901,facepalm,2r5rp,"The whole clip..",0,https://i.redd.it/68vwtv14iaac1.jpeg,0.89,2587,1704315884,2024-01-03T09:04:44+0000
2024-01-04T01,18xtyve,33,3896,clevercomebacks,dyqlw,"Just like the women he's been with, he never saw this coming",0,https://i.redd.it/8k421j5ihaac1.png,0.92,220,1704315668,2024-01-03T09:01:08+0000
2024-01-04T01,18xtv0h,47,3127,therewasanattempt,39ne7,"To Predict Trumps Fate In 2024 On Fox News",0,https://v.redd.it/brd1joskgaac1,0.95,345,1704315410,2024-01-03T08:56:50+0000
2024-01-04T01,18xtu67,45,3201,funny,2qh33,"Superhero entanglement (Batman, Wonder Woman & Superman)",0,https://i.redd.it/4zzsw8ojgaac1.jpeg,0.9,62,1704315350,2024-01-03T08:55:50+0000
2024-01-04T01,18xtjtd,41,3589,IdiotsInCars,3aimx,"“Dude are you kidding me right now?!” Audi idiot didn’t even look, claims they were not at fault. Dashcam to the rescue! [oc]",0,https://v.redd.it/lhjg7pbheaac1,0.96,511,1704314653,2024-01-03T08:44:13+0000
2024-01-04T01,18xtga5,26,4563,gaming,2qh03,"Jailed Nintendo hacker Gary Bowser denies link to new Switch flash cart",0,https://www.videogameschronicle.com/news/jailed-nintendo-hacker-gary-bowser-denies-link-to-new-switch-flash-cart/,0.97,216,1704314414,2024-01-03T08:40:14+0000
2024-01-04T01,18xt9sz,17,6722,BlackPeopleTwitter,33x33,"All I see is innovation 🤣",0,https://i.redd.it/kcw1oxahcaac1.jpeg,0.9,558,1704313978,2024-01-03T08:32:58+0000
2024-01-04T01,18xsze1,77,5194,cats,2qhta,"My cat on the day I got him….and him today 😍",0,https://www.reddit.com/gallery/18xsze1,0.99,246,1704313267,2024-01-03T08:21:07+0000
2024-01-04T01,18xskmw,52,3827,PeterExplainsTheJoke,121h8r,"Someone please help before I go insane!",0,https://i.redd.it/nvjas4xc7aac1.png,0.91,97,1704312258,2024-01-03T08:04:18+0000
2024-01-04T01,18xsjiw,90,2269,MakeupAddiction,2rww2,"Even toning it down I can't help but be over the top",0,https://www.reddit.com/gallery/18xsjiw,0.86,309,1704312180,2024-01-03T08:03:00+0000
2024-01-04T01,18xsga0,54,3608,europe,2qh4j,"Belarusian is disappearing (2009 & 2019)",0,https://www.reddit.com/gallery/18xsga0,0.96,563,1704311982,2024-01-03T07:59:42+0000
2024-01-04T01,18xsdbg,14,10609,shitposting,2usxq,Facts,0,https://v.redd.it/3mnw7jox5aac1,0.97,176,1704311778,2024-01-03T07:56:18+0000
2024-01-04T01,18xsd98,92,2273,StarWars,2qi4s,"I feel so bad for laughing at this bro was just chillin thinking about life then this happens😭",0,https://i.redd.it/fcuwoufx5aac1.jpeg,0.96,79,1704311774,2024-01-03T07:56:14+0000
2024-01-04T01,18xs90u,21,7429,SipsTea,5tdqj0,"But friend shape...",0,https://v.redd.it/ertmyfr25aac1,0.93,266,1704311488,2024-01-03T07:51:28+0000
2024-01-04T01,18xs8kt,37,4500,Wellthatsucks,2xcv7,"Went to Goodwill yesterday. Got a discount at the register, thought it was because of tag color. Looked at my receipt today and saw this.",0,https://i.redd.it/3xvxjoiz4aac1.jpeg,0.92,184,1704311458,2024-01-03T07:50:58+0000
2024-01-04T01,18xs6ck,43,9480,politics,2cneq,"Trump’s Idiot Lawyer Just Admitted He May Be Guilty of Insurrection: Donald Trump keeps hiring the very best.",0,https://newrepublic.com/post/177822/trump-idiot-lawyer-admit-may-guilty-insurrection,0.95,420,1704311308,2024-01-03T07:48:28+0000
2024-01-04T01,18xry8r,100,2303,LivestreamFail,38jf0,"Maya fell for it",0,https://clips.twitch.tv/KindCogentPeanutCclamChamp-jheswOO8hiB9fBEI,0.91,88,1704310779,2024-01-03T07:39:39+0000
2024-01-04T01,18xrmgi,71,3057,CuratedTumblr,3x5kfw,"Chinese rocks",0,https://www.reddit.com/gallery/18xrmgi,0.97,53,1704310001,2024-01-03T07:26:41+0000
2024-01-04T01,18xr7e1,73,3222,Money,2qjmw,"Just made my first 1000$ in high school",0,https://i.redd.it/g5gy8i3rx9ac1.jpeg,0.8,218,1704309026,2024-01-03T07:10:26+0000
2024-01-04T01,18xr2r3,49,5153,whenthe,23gidu,Perspectives,0,https://v.redd.it/77zxwghuw9ac1,0.94,167,1704308728,2024-01-03T07:05:28+0000
2024-01-04T01,18xqtcm,72,3240,AskReddit,2qh1i,"What’s the craziest WW2 fact that you know of?",1,https://www.reddit.com/r/AskReddit/comments/18xqtcm/whats_the_craziest_ww2_fact_that_you_know_of/,0.93,3486,1704308119,2024-01-03T06:55:19+0000
2024-01-04T01,18xqt09,29,6402,TrueOffMyChest,2yuqy,"My soon to be ex-husband humiliated me on our wedding day and met his karma instantly.",1,https://www.reddit.com/r/TrueOffMyChest/comments/18xqt09/my_soon_to_be_exhusband_humiliated_me_on_our/,0.9,1212,1704308101,2024-01-03T06:55:01+0000
2024-01-04T01,18xqsk8,11,12334,pics,2qh0u,"Temporary NYPD headquarters at a Burger King, 9/11/2001",0,https://i.redd.it/38fxac5wu9ac1.jpeg,0.96,392,1704308073,2024-01-03T06:54:33+0000
2024-01-04T01,18xqr6r,19,10205,FunnyAnimals,2st2l,"Dog thought he was home alone ",0,https://v.redd.it/bc2fgd5nu9ac1,0.97,106,1704307979,2024-01-03T06:52:59+0000
2024-01-04T01,18xqr1b,6,19359,news,2qh3l,"Names in Jeffrey Epstein court documents to be unsealed in New York on Wednesday",0,https://www.cnbc.com/2024/01/03/jeffrey-epstein-court-document-names-unsealed-wednesday-.html,0.96,1905,1704307970,2024-01-03T06:52:50+0000
2024-01-04T01,18xqqfi,57,4503,notinteresting,2u0xf,"My crush returned back the birthday gift I gave her today",0,https://i.redd.it/t7y5j9whu9ac1.jpeg,0.92,421,1704307931,2024-01-03T06:52:11+0000
2024-01-04T01,18xqmsj,30,6117,TwoXChromosomes,2r2jt,"He left and I barely noticed.",1,https://www.reddit.com/r/TwoXChromosomes/comments/18xqmsj/he_left_and_i_barely_noticed/,0.91,274,1704307693,2024-01-03T06:48:13+0000
2024-01-04T01,18xqlpm,9,15244,WhitePeopleTwitter,35n7t,"Trump's Version of 'America First'",0,https://i.redd.it/c8lvm1cit9ac1.png,0.94,567,1704307620,2024-01-03T06:47:00+0000
2024-01-04T01,18xqio1,13,13425,meirl,2s5ti,meirl,0,https://i.redd.it/uc11q2vys9ac1.jpeg,0.98,68,1704307415,2024-01-03T06:43:35+0000
2024-01-04T01,18xqelw,50,5062,Steam,2qwis,"POV: You woke up the next day and realized that the whole Game Award was a bad dream",0,https://i.redd.it/lfngtbe3s9ac1.png,0.87,404,1704307150,2024-01-03T06:39:10+0000
2024-01-04T01,18xq76w,10,16887,politics,2cneq,"Conservatives Are Having a Meltdown Over Trump and the Epstein List: Donald Trump’s biggest supporters are freaking out over the anticipated unveiling.",0,https://newrepublic.com/post/177828/conservatives-meltdown-trump-epstein-list,0.91,2123,1704306643,2024-01-03T06:30:43+0000
2024-01-04T01,18xq5t2,60,12645,facepalm,2r5rp,"Killed for a period….",0,https://i.redd.it/b6j8bhoeq9ac1.jpeg,0.95,1246,1704306555,2024-01-03T06:29:15+0000
2024-01-04T01,18xq5a0,40,5691,technology,2qh16,"23andMe tells victims it's their fault that their data was breached",0,https://techcrunch.com/2024/01/03/23andme-tells-victims-its-their-fault-that-their-data-was-breached/,0.96,578,1704306520,2024-01-03T06:28:40+0000
2024-01-04T01,18xq16a,20,14377,BikiniBottomTwitter,3deqz,"Gary hit em wit the",0,https://v.redd.it/koc84toep9ac1,0.92,285,1704306237,2024-01-03T06:23:57+0000
2024-01-04T01,18xpyab,85,3354,NoStupidQuestions,2w844,"In the 80s did parents really just let their kids go out wherever or is this only in movies?",1,https://www.reddit.com/r/NoStupidQuestions/comments/18xpyab/in_the_80s_did_parents_really_just_let_their_kids/,0.92,5240,1704306043,2024-01-03T06:20:43+0000
2024-01-04T01,18xpx54,25,9287,holdmycatnip,2zhxd,"Have a look at this businessman!",0,https://v.redd.it/5wbxadclo9ac1,0.97,82,1704305971,2024-01-03T06:19:31+0000
2024-01-04T01,18xprtx,28,8813,Unexpected,2w67q,"Looking for her dog",0,https://v.redd.it/axf945gin9ac1,0.91,162,1704305606,2024-01-03T06:13:26+0000
2024-01-04T01,18xpq9m,12,14497,todayilearned,2qqjc,"TIL in 1609, Manhattan supported more ecological diversity per acre than Yellowstone National Park. Research suggests that had Manhattan never been developed, it would be one of the most important national parks",0,https://secretnyc.co/manhattan-used-one-giant-lush-park-looked-like/,0.96,527,1704305502,2024-01-03T06:11:42+0000
2024-01-04T01,18xpl1l,83,4001,discordVideos,2cxozx,"cosplay besties",0,https://v.redd.it/25v0nbb7m9ac1,0.89,120,1704305156,2024-01-03T06:05:56+0000
2024-01-04T01,18xpe1t,23,11693,MurderedByWords,3hx3r,"It's clear as can be",0,https://i.redd.it/t013eymuk9ac1.jpeg,0.9,229,1704304712,2024-01-03T05:58:32+0000
2024-01-04T01,18xpcxb,84,3627,antiwork,2y77d,"Got fired today.",1,https://www.reddit.com/r/antiwork/comments/18xpcxb/got_fired_today/,0.94,269,1704304636,2024-01-03T05:57:16+0000
2024-01-04T01,18xp90e,69,4204,mildlyinfuriating,2ubgg,"Once again affirming why I don't let people borrow my stuff.",1,https://www.reddit.com/r/mildlyinfuriating/comments/18xp90e/once_again_affirming_why_i_dont_let_people_borrow/,0.96,456,1704304370,2024-01-03T05:52:50+0000
2024-01-04T01,18xp5v3,66,4400,IllegallySmolCats,23e19j,"Smol meow ",0,https://v.redd.it/kd607t72j9ac1,0.97,53,1704304155,2024-01-03T05:49:15+0000
2024-01-04T01,18xoxdh,58,5653,ExplainTheJoke,2vmj2,"My friends in Tech found this hilarious. Captioned ""Stack Overflow, In a nutshell"". Please help.",0,https://i.redd.it/xmeqbzjlh9ac1.jpeg,0.96,102,1704303592,2024-01-03T05:39:52+0000
2024-01-04T01,18xoupq,16,17826,cats,2qhta,"Man goes for 21K hike, discovers Lost Kitten, and Adopts it. Changes channel from a Hiking Channel to a Cat Channel.",0,https://v.redd.it/ebaoev85g9ac1,0.94,526,1704303415,2024-01-03T05:36:55+0000
2024-01-04T01,18xoujs,36,8008,PrequelMemes,3i60n,"Someone took the English subtitles of a pirated Chinese copy of Revenge of the Sith and turned them into a dub of the original movie",0,https://v.redd.it/qn9ejxl0h9ac1,0.96,283,1704303405,2024-01-03T05:36:45+0000
2024-01-04T01,18xor3n,62,5502,MadeMeSmile,2uqcm,"Just doodling the clouds",0,https://v.redd.it/9kxjw7w9g9ac1,0.98,73,1704303168,2024-01-03T05:32:48+0000
2024-01-04T01,18xoqm4,24,12690,nbacirclejerk,2td2i,"Since my friend pissed me off: he's both zprolgt and mrsonsfan. They're the same person. You're welcome.",0,https://i.redd.it/6cvalohzf9ac1.png,0.92,909,1704303135,2024-01-03T05:32:15+0000
2024-01-04T01,18xopzb,93,3666,DOG,2qiy5,"We're just Gonna put that Riiiight Back here.",0,https://v.redd.it/xudyab5zf9ac1,0.98,26,1704303093,2024-01-03T05:31:33+0000
2024-01-04T01,18xoory,94,3623,StandUpComedy,2qrp8,"Can't lift my girlfriend 🙅‍♀️",0,https://v.redd.it/g3b98gekf9ac1,0.93,98,1704303029,2024-01-03T05:30:29+0000
2024-01-04T01,18xogx0,18,24305,me_irl,2vegg,Me_irl,0,https://i.redd.it/t615lg9ee9ac1.jpeg,0.96,434,1704302516,2024-01-03T05:21:56+0000
2024-01-04T01,18xoeal,56,16749,pics,2qh0u,"On Christmas, my step sister hid 100 ducks in my house. 96 have been found.",0,https://i.redd.it/15ns48rvd9ac1.png,0.96,551,1704302343,2024-01-03T05:19:03+0000
2024-01-04T01,18xo2fz,76,4648,FunnyandSad,2z7qd,"He was right",0,https://i.redd.it/iduc0rrwa9ac1.png,0.96,14,1704301352,2024-01-03T05:02:32+0000
2024-01-04T01,18xnu1w,67,5355,fightporn,2u5un,"Keep calm and wait for the right moment)",0,https://v.redd.it/hf2v49kh89ac1,0.96,314,1704300599,2024-01-03T04:49:59+0000
2024-01-04T01,18xnl6l,89,4597,blender,2qim4,"Show this to those who haven't yet understood UV mapping.",0,https://i.redd.it/9ef5pds969ac1.jpeg,0.96,68,1704299800,2024-01-03T04:36:40+0000
2024-01-04T01,18xnkll,82,5000,AbsoluteUnits,a7wuv,"Actual size of a Pelican's mouth",0,https://v.redd.it/7svbb1b569ac1,0.96,169,1704299747,2024-01-03T04:35:47+0000
2024-01-04T01,18xnapc,96,4682,yesyesyesyesno,2ytae,"This is the greatest betrayal of all time",0,https://v.redd.it/k3bqgel249ac1,0.92,111,1704299049,2024-01-03T04:24:09+0000
2024-01-04T01,18xn8xa,48,9923,lotrmemes,2v0i1,"*using Pippin because he wouldn’t have read them",0,https://i.redd.it/zdhohfjp39ac1.jpeg,0.92,2292,1704298922,2024-01-03T04:22:02+0000
2024-01-04T01,18xmz0a,46,8666,JeffArcuri,740oig,"Bathroom prank",0,https://v.redd.it/ogur2zul19ac1,0.93,129,1704298228,2024-01-03T04:10:28+0000
2024-01-04T01,18xmyzc,99,12419,gaming,2qh03,"Switch 2 will ""likely be an iteration rather than a revolution"" and launch at $400, according to a Tokyo-based game industry consultancy firm.",0,https://www.videogameschronicle.com/news/switch-2-likely-to-be-iteration-rather-than-revolution-predicts-analyst/,0.93,2939,1704298226,2024-01-03T04:10:26+0000
2024-01-04T01,18xmige,35,13494,TikTokCringe,mvcq5,"Not in here",0,https://v.redd.it/tsunlxoxx8ac1,0.91,1664,1704297066,2024-01-03T03:51:06+0000
2024-01-04T01,18xmie9,68,6924,shittymoviedetails,3mj3w,"In The Last Jedi(2017), Finn and Rose save horses from captivity while not saving the child slaves. The movie was then awarded an Oscar from PETA.",0,https://i.redd.it/gpgg5jv0y8ac1.jpeg,0.93,351,1704297061,2024-01-03T03:51:01+0000
2024-01-04T01,18xmfna,74,21045,todayilearned,2qqjc,"TIL that Jennifer Pan, under intense pressure to succeed, deceived her parents for over a decade, leading them to believe she was a successful pharmacist, despite not graduating high school. When her lies unraveled, she arranged for her parents' murder.",0,https://wikipedia.org/wiki/Jennifer_Pan,0.93,1859,1704296859,2024-01-03T03:47:39+0000
2024-01-04T01,18xlz2c,39,13287,WorkReform,5qpzgw,"Hustle culture is not normal.",0,https://i.redd.it/3qynn1mwt8ac1.jpeg,0.93,445,1704295649,2024-01-03T03:27:29+0000
2024-01-04T01,18xly3c,80,6704,ProgrammerHumor,2tex6,bestWayToLearn,0,https://i.redd.it/hv503vcrt8ac1.jpeg,0.98,104,1704295576,2024-01-03T03:26:16+0000
2024-01-04T01,18xlnne,55,10242,comics,2qh0s,"[oc] DISGUSTING",0,https://i.redd.it/dylf065hr8ac1.jpeg,0.95,178,1704294808,2024-01-03T03:13:28+0000
2024-01-04T01,18xlf52,42,13465,worldnews,2qh13,"NATO to buy 1,000 Patriot missiles in face of Russia threat",0,https://www.thedefensepost.com/2024/01/03/nato-buys-patriot-missiles/?expand_article=1,0.95,1244,1704294186,2024-01-03T03:03:06+0000
2024-01-04T01,18xla8p,95,28028,Damnthatsinteresting,2xxyj,"Rare sighting of a Whale tail sailing.",0,https://i.imgur.com/c68Mvxb.gifv,0.95,1220,1704293837,2024-01-03T02:57:17+0000
2024-01-04T01,18xl64i,61,15662,sadposting,5203f0,"Social Experiment",0,https://v.redd.it/bt5xnuljn8ac1,0.84,4605,1704293509,2024-01-03T02:51:49+0000
2024-01-04T01,18xkkkh,91,7855,AITAH,446kys,"WIBTA If I Divorce My Husband After The Death Of Our Child?",1,https://www.reddit.com/r/AITAH/comments/18xkkkh/wibta_if_i_divorce_my_husband_after_the_death_of/,0.93,2176,1704291852,2024-01-03T02:24:12+0000
2024-01-04T01,18xkajj,97,7347,OneOrangeBraincell,5vej89,"I adopted mine today! Was told his brain cell would come in the mail in 3-4 weeks.",0,https://i.redd.it/wmzsi8tdg8ac1.jpeg,0.97,138,1704291078,2024-01-03T02:11:18+0000
2024-01-04T01,18xjres,63,13412,PoliticalHumor,2qm21,"No Malarkey, Jack!",0,https://i.redd.it/xa6y20uwb8ac1.jpeg,0.93,388,1704289573,2024-01-03T01:46:13+0000
2024-01-04T00,18xwn8n,33,2388,technicallythetruth,3pzez,"Well, I think he got a really good point",0,https://i.redd.it/8pa4b7gd0bac1.png,0.98,38,1704322139,2024-01-03T10:48:59+0000
2024-01-04T00,18xwkm5,83,1245,CrazyFuckingVideos,45hae8,"Man attacks Las Vegas judge after she denies his probation",0,https://v.redd.it/bf5hk7p80bac1,0.98,224,1704321969,2024-01-03T10:46:09+0000
2024-01-04T00,18xw9j8,55,1705,iamatotalpieceofshit,3jj03,"Man attacks Las Vegas judge during sentencing today",0,https://v.redd.it/ibt7lqf0yaac1,0.97,408,1704321233,2024-01-03T10:33:53+0000
2024-01-04T00,18xw9fl,37,2184,tumblr,2r7hk,"This is extremely real",0,https://i.redd.it/ko7w6v41yaac1.jpeg,0.98,18,1704321227,2024-01-03T10:33:47+0000
2024-01-04T00,18xvzdn,1,7559,mildlyinteresting,2ti4h,"Bubbles in my coffee this morning",0,https://i.redd.it/i45ex2nzvaac1.png,0.92,693,1704320541,2024-01-03T10:22:21+0000
2024-01-04T00,18xvyop,21,3353,NatureIsFuckingLit,3gdh7,"🔥 Chimp experiences freedom from a cage for the first time in 28 years 🔥 ",0,https://v.redd.it/sqwyz2osvaac1,0.97,145,1704320493,2024-01-03T10:21:33+0000
2024-01-04T00,18xvk7h,65,1622,ActualPublicFreakouts,27mtyi,"Man Attacks Las Vegas Judge During Sentencing Today",0,https://v.redd.it/47dllx6rsaac1,0.97,439,1704319525,2024-01-03T10:05:25+0000
2024-01-04T00,18xvio8,4,6484,PublicFreakout,2yrq6,"A Man Attacked a Las Vegas Judge During Sentencing Today",0,https://v.redd.it/0klbaupjsaac1,0.98,1266,1704319419,2024-01-03T10:03:39+0000
2024-01-04T00,18xvdhi,98,1284,wizardposting,5hjlp1,"You fools! You absolute fools!",0,https://i.redd.it/7es49kloraac1.jpeg,0.98,91,1704319090,2024-01-03T09:58:10+0000
2024-01-04T00,18xvbu1,17,4012,interestingasfuck,2qhsa,"Beachgoers have a close encounter with a Cassowary ",0,https://v.redd.it/lyp451lbraac1,0.96,671,1704318974,2024-01-03T09:56:14+0000
2024-01-04T00,18xv6zs,51,3487,WhitePeopleTwitter,35n7t,"Oh please do go there! Who wants popcorn?",0,https://i.redd.it/ld61kqybqaac1.jpeg,0.99,207,1704318638,2024-01-03T09:50:38+0000
2024-01-04T00,18xuwv0,39,2412,OnePiece,2rfz5,"Nico Robin attempt (surprise on 3rd slide) :D",0,https://www.reddit.com/gallery/18xuwv0,0.86,155,1704317961,2024-01-03T09:39:21+0000
2024-01-04T00,18xuv6q,15,4431,Damnthatsinteresting,2xxyj,"Best Buy is removing all physical media from their stores as of today.",0,https://i.redd.it/ggg8kznynaac1.jpeg,0.96,1027,1704317840,2024-01-03T09:37:20+0000
2024-01-04T00,18xubqo,79,1696,TerrifyingAsFuck,31d92,"Black children watching as white children play in a whites only park, 1956",0,https://i.redd.it/4huvrky2kaac1.jpeg,0.87,105,1704316535,2024-01-03T09:15:35+0000
2024-01-04T00,18xuasw,97,1441,nba,2qo4s,"[Russo] At shootaround today, LA Clippers coach Tyronn Lue said that Mason Plumlee approached him recently to tell Lue that he doesn’t want to “mess up” the “good thing” the Clippers have going as the team has won 17 out of their last 22 games, and will gladly sit behind Daniel Theis.",0,https://x.com/flybyknite/status/1742652878446305609?s=46,0.97,163,1704316477,2024-01-03T09:14:37+0000
2024-01-04T00,18xu6fg,2,11494,memes,2qjpg,"Getting older can be lonely",0,https://v.redd.it/06dqnsr0jaac1,0.95,214,1704316185,2024-01-03T09:09:45+0000
2024-01-04T00,18xu3p1,54,2247,FluentInFinance,3qpaq8,"Should Student Loans be Forgiven like PPP Loans were?",0,https://i.redd.it/n1r2tyxdiaac1.png,0.89,491,1704315991,2024-01-03T09:06:31+0000
2024-01-04T00,18xu35o,93,1544,Genshin_Impact,12p4l2,"Albedo's family tree.",0,https://i.redd.it/71ghps2ciaac1.png,0.97,119,1704315955,2024-01-03T09:05:55+0000
2024-01-04T00,18xu222,53,4165,facepalm,2r5rp,"The whole clip..",0,https://i.redd.it/68vwtv14iaac1.jpeg,0.91,1727,1704315884,2024-01-03T09:04:44+0000
