date,id,position,score,subreddit_display_name,subreddit_id,title,is_self,url,upvote_ratio,num_comments,created,created_date
2024-01-04T07,18xxgy3,30,5588,KidsAreFuckingStupid,3948y,"He did not care one bit",0,https://v.redd.it/bpzvgolp6bac1,0.93,361,1704324144,2024-01-03T11:22:24+0000
2024-01-04T07,18xxgk2,41,4693,AbruptChaos,3nasz,"A judge in Las Vegas is attacked during a live hearing after she denied probation",0,https://v.redd.it/g20it3wm6bac1,0.95,742,1704324119,2024-01-03T11:21:59+0000
2024-01-04T07,18xxfgu,72,3426,Deltarune,qmi8w,"think about it",0,https://i.redd.it/dsb469zd6bac1.png,0.96,77,1704324044,2024-01-03T11:20:44+0000
2024-01-04T07,18xx8kh,67,3422,blackcats,2twpw,"Everyone congratulate my house panther on her SOCK KILL",0,https://i.redd.it/2x8mdmj05bac1.png,0.97,81,1704323574,2024-01-03T11:12:54+0000
2024-01-04T07,18xx4un,5,12958,todayilearned,2qqjc,"TIL: Short Sleeper Syndrome is a gene mutation discovered by the University of Pittsburgh in 2014. They can function normally with less than 6 hours of sleep and never need to ""recover"" from lack of sleep as opposed to people who purposefully limit sleep. The mutation was given to mice and worked.",0,https://www.healthline.com/health/sleep/natural-short-sleeper,0.97,864,1704323332,2024-01-03T11:08:52+0000
2024-01-04T07,18xx0vg,25,6640,lego,2qhm7,"I made a brass armor for Lego",0,https://www.reddit.com/gallery/18xx0vg,0.98,190,1704323060,2024-01-03T11:04:20+0000
2024-01-04T07,18xx084,63,3745,CatDistributionSystem,7l5bxn,"We stopped at a gas station and got back in car to find this lad in the backseat.",0,https://i.redd.it/2r2i7hpc3bac1.jpeg,0.96,155,1704323015,2024-01-03T11:03:35+0000
2024-01-04T07,18xwz76,22,7271,oddlysatisfying,2x93b,"Candle Perfectly Fits Under The Glass",0,https://v.redd.it/s3v9pqq43bac1,0.86,188,1704322942,2024-01-03T11:02:22+0000
2024-01-04T07,18xwkm5,58,4177,CrazyFuckingVideos,45hae8,"Man attacks Las Vegas judge after she denies his probation",0,https://v.redd.it/bf5hk7p80bac1,0.94,568,1704321969,2024-01-03T10:46:09+0000
2024-01-04T07,18xwdo4,17,10196,pics,2qh0u,"Black children watching as white children play in a only whites park, 1955",0,https://i.redd.it/nwmr2p1wyaac1.jpeg,0.9,879,1704321515,2024-01-03T10:38:35+0000
2024-01-04T07,18xw9j8,43,5634,iamatotalpieceofshit,3jj03,"Man attacks Las Vegas judge during sentencing today",0,https://v.redd.it/ibt7lqf0yaac1,0.95,950,1704321233,2024-01-03T10:33:53+0000
2024-01-04T07,18xw9fl,73,8909,tumblr,2r7hk,"This is extremely real",0,https://i.redd.it/ko7w6v41yaac1.jpeg,0.95,164,1704321227,2024-01-03T10:33:47+0000
2024-01-04T07,18xvzdn,10,30125,mildlyinteresting,2ti4h,"Bubbles in my coffee this morning",0,https://i.redd.it/i45ex2nzvaac1.png,0.86,2224,1704320541,2024-01-03T10:22:21+0000
2024-01-04T07,18xvyop,6,19787,NatureIsFuckingLit,3gdh7,"🔥 Chimp experiences freedom from a cage for the first time in 28 years 🔥 ",0,https://v.redd.it/sqwyz2osvaac1,0.95,748,1704320493,2024-01-03T10:21:33+0000
2024-01-04T07,18xvtbd,27,8257,me_irl,2vegg,me_irl,0,https://i.imgur.com/7jMqPwL.jpeg,0.95,101,1704320134,2024-01-03T10:15:34+0000
2024-01-04T07,18xvt2s,57,4529,MaliciousCompliance,3boqz,"Boss introduces new timetracking tool to ""avoid time manipulation"", backfires on him",1,https://www.reddit.com/r/MaliciousCompliance/comments/18xvt2s/boss_introduces_new_timetracking_tool_to_avoid/,0.97,196,1704320117,2024-01-03T10:15:17+0000
2024-01-04T07,18xvo5t,14,17505,BeAmazed,363r3,"Absolute Badass",0,https://i.imgur.com/NLABMUv.jpeg,0.93,376,1704319789,2024-01-03T10:09:49+0000
2024-01-04T07,18xvltp,21,9888,nextfuckinglevel,m0bnr,"Man reveals the technique that could have been used on Stonehedge",0,https://v.redd.it/e33rao0vpaac1,0.94,403,1704319633,2024-01-03T10:07:13+0000
2024-01-04T07,18xvk7h,85,3572,ActualPublicFreakouts,27mtyi,"Man Attacks Las Vegas Judge During Sentencing Today",0,https://v.redd.it/47dllx6rsaac1,0.94,732,1704319525,2024-01-03T10:05:25+0000
2024-01-04T07,18xvio8,8,17084,PublicFreakout,2yrq6,"A Man Attacked a Las Vegas Judge During Sentencing Today",0,https://v.redd.it/0klbaupjsaac1,0.97,3017,1704319419,2024-01-03T10:03:39+0000
2024-01-04T07,18xvfwx,23,9357,meirl,2s5ti,meirl,0,https://i.redd.it/ppv8o8p4saac1.jpeg,0.98,253,1704319247,2024-01-03T10:00:47+0000
2024-01-04T07,18xvdhi,35,6951,wizardposting,5hjlp1,"You fools! You absolute fools!",0,https://i.redd.it/7es49kloraac1.jpeg,0.96,183,1704319090,2024-01-03T09:58:10+0000
2024-01-04T07,18xvbu1,12,16346,interestingasfuck,2qhsa,"Beachgoers have a close encounter with a Cassowary ",0,https://v.redd.it/lyp451lbraac1,0.94,1937,1704318974,2024-01-03T09:56:14+0000
2024-01-04T07,18xvadq,49,5720,BrandNewSentence,mbn0j,"Now here's a religion I can understand",0,https://i.redd.it/smwfzbwzqaac1.png,0.97,211,1704318872,2024-01-03T09:54:32+0000
2024-01-04T07,18xv6zs,13,16183,WhitePeopleTwitter,35n7t,"Oh please do go there! Who wants popcorn?",0,https://i.redd.it/ld61kqybqaac1.jpeg,0.95,826,1704318638,2024-01-03T09:50:38+0000
2024-01-04T07,18xuwv0,52,6651,OnePiece,2rfz5,"Nico Robin attempt (surprise on 3rd slide) :D",0,https://www.reddit.com/gallery/18xuwv0,0.81,328,1704317961,2024-01-03T09:39:21+0000
2024-01-04T07,18xuv6q,44,23007,Damnthatsinteresting,2xxyj,"Best Buy is removing all physical media from their stores as of today.",0,https://i.redd.it/ggg8kznynaac1.jpeg,0.93,4659,1704317840,2024-01-03T09:37:20+0000
2024-01-04T07,18xuryy,84,3990,YouShouldKnow,2r94o,"YSK: Do not share or click on sappy animal rescue videos",1,https://www.reddit.com/r/YouShouldKnow/comments/18xuryy/ysk_do_not_share_or_click_on_sappy_animal_rescue/,0.93,132,1704317628,2024-01-03T09:33:48+0000
2024-01-04T07,18xu74c,28,10464,wholesomememes,3gcwj,"I always feel so terrible",0,https://i.redd.it/07ip85z4jaac1.jpeg,0.96,108,1704316226,2024-01-03T09:10:26+0000
2024-01-04T07,18xu3p1,39,8280,FluentInFinance,3qpaq8,"Should Student Loans be Forgiven like PPP Loans were?",0,https://i.redd.it/n1r2tyxdiaac1.png,0.88,1003,1704315991,2024-01-03T09:06:31+0000
2024-01-04T07,18xtyve,33,10005,clevercomebacks,dyqlw,"Just like the women he's been with, he never saw this coming",0,https://i.redd.it/8k421j5ihaac1.png,0.88,624,1704315668,2024-01-03T09:01:08+0000
2024-01-04T07,18xtxnp,45,7492,TikTokCringe,mvcq5,"That's a blessin",0,https://v.redd.it/2nlz5br5haac1,0.95,190,1704315599,2024-01-03T08:59:59+0000
2024-01-04T07,18xtu67,42,8875,funny,2qh33,"Superhero entanglement (Batman, Wonder Woman & Superman)",0,https://i.redd.it/4zzsw8ojgaac1.jpeg,0.88,122,1704315350,2024-01-03T08:55:50+0000
2024-01-04T07,18xtjtd,70,5683,IdiotsInCars,3aimx,"“Dude are you kidding me right now?!” Audi idiot didn’t even look, claims they were not at fault. Dashcam to the rescue! [oc]",0,https://v.redd.it/lhjg7pbheaac1,0.96,699,1704314653,2024-01-03T08:44:13+0000
2024-01-04T07,18xtga5,51,7449,gaming,2qh03,"Jailed Nintendo hacker Gary Bowser denies link to new Switch flash cart",0,https://www.videogameschronicle.com/news/jailed-nintendo-hacker-gary-bowser-denies-link-to-new-switch-flash-cart/,0.96,418,1704314414,2024-01-03T08:40:14+0000
2024-01-04T07,18xskmw,79,7005,PeterExplainsTheJoke,121h8r,"Someone please help before I go insane!",0,https://i.redd.it/nvjas4xc7aac1.png,0.88,161,1704312258,2024-01-03T08:04:18+0000
2024-01-04T07,18xsga0,96,5134,europe,2qh4j,"Belarusian is disappearing (2009 & 2019)",0,https://www.reddit.com/gallery/18xsga0,0.94,754,1704311982,2024-01-03T07:59:42+0000
2024-01-04T07,18xs90u,37,14495,SipsTea,5tdqj0,"But friend shape...",0,https://v.redd.it/ertmyfr25aac1,0.91,491,1704311488,2024-01-03T07:51:28+0000
2024-01-04T07,18xs8kt,59,8477,Wellthatsucks,2xcv7,"Went to Goodwill yesterday. Got a discount at the register, thought it was because of tag color. Looked at my receipt today and saw this.",0,https://i.redd.it/3xvxjoiz4aac1.jpeg,0.92,284,1704311458,2024-01-03T07:50:58+0000
2024-01-04T07,18xs6ck,78,16795,politics,2cneq,"Trump’s Idiot Lawyer Just Admitted He May Be Guilty of Insurrection: Donald Trump keeps hiring the very best.",0,https://newrepublic.com/post/177822/trump-idiot-lawyer-admit-may-guilty-insurrection,0.92,686,1704311308,2024-01-03T07:48:28+0000
2024-01-04T07,18xrqgo,99,7459,maybemaybemaybe,38e1l,"Maybe Maybe Maybe ",0,https://v.redd.it/2xrpegvy0aac1,0.77,363,1704310262,2024-01-03T07:31:02+0000
2024-01-04T07,18xqt09,81,8083,TrueOffMyChest,2yuqy,"My soon to be ex-husband humiliated me on our wedding day and met his karma instantly.",1,https://www.reddit.com/r/TrueOffMyChest/comments/18xqt09/my_soon_to_be_exhusband_humiliated_me_on_our/,0.89,1491,1704308101,2024-01-03T06:55:01+0000
2024-01-04T07,18xqsk8,98,17427,pics,2qh0u,"Temporary NYPD headquarters at a Burger King, 9/11/2001",0,https://i.redd.it/38fxac5wu9ac1.jpeg,0.95,518,1704308073,2024-01-03T06:54:33+0000
2024-01-04T07,18xqr6r,36,17885,FunnyAnimals,2st2l,"Dog thought he was home alone ",0,https://v.redd.it/bc2fgd5nu9ac1,0.96,155,1704307979,2024-01-03T06:52:59+0000
2024-01-04T07,18xqr1b,26,26463,news,2qh3l,"Names in Jeffrey Epstein court documents to be unsealed in New York on Wednesday",0,https://www.cnbc.com/2024/01/03/jeffrey-epstein-court-document-names-unsealed-wednesday-.html,0.95,2517,1704307970,2024-01-03T06:52:50+0000
2024-01-04T07,18xqmsj,75,8343,TwoXChromosomes,2r2jt,"He left and I barely noticed.",1,https://www.reddit.com/r/TwoXChromosomes/comments/18xqmsj/he_left_and_i_barely_noticed/,0.9,359,1704307693,2024-01-03T06:48:13+0000
2024-01-04T07,18xqlpm,100,18538,WhitePeopleTwitter,35n7t,"Trump's Version of 'America First'",0,https://i.redd.it/c8lvm1cit9ac1.png,0.93,680,1704307620,2024-01-03T06:47:00+0000
2024-01-04T07,18xq5a0,71,9265,technology,2qh16,"23andMe tells victims it's their fault that their data was breached",0,https://techcrunch.com/2024/01/03/23andme-tells-victims-its-their-fault-that-their-data-was-breached/,0.95,834,1704306520,2024-01-03T06:28:40+0000
2024-01-04T07,18xq16a,53,19400,BikiniBottomTwitter,3deqz,"Gary hit em wit the",0,https://v.redd.it/koc84toep9ac1,0.9,388,1704306237,2024-01-03T06:23:57+0000
2024-01-04T07,18xpyab,94,7738,NoStupidQuestions,2w844,"In the 80s did parents really just let their kids go out wherever or is this only in movies?",1,https://www.reddit.com/r/NoStupidQuestions/comments/18xpyab/in_the_80s_did_parents_really_just_let_their_kids/,0.93,9825,1704306043,2024-01-03T06:20:43+0000
2024-01-04T07,18xpx54,56,13922,holdmycatnip,2zhxd,"Have a look at this businessman!",0,https://v.redd.it/5wbxadclo9ac1,0.97,110,1704305971,2024-01-03T06:19:31+0000
2024-01-04T07,18xpe1t,62,15771,MurderedByWords,3hx3r,"It's clear as can be",0,https://i.redd.it/t013eymuk9ac1.jpeg,0.89,289,1704304712,2024-01-03T05:58:32+0000
2024-01-04T07,18xoxdh,93,10748,ExplainTheJoke,2vmj2,"My friends in Tech found this hilarious. Captioned ""Stack Overflow, In a nutshell"". Please help.",0,https://i.redd.it/xmeqbzjlh9ac1.jpeg,0.95,196,1704303592,2024-01-03T05:39:52+0000
2024-01-04T07,18xoupq,50,24624,cats,2qhta,"Man goes for 21K hike, discovers Lost Kitten, and Adopts it. Changes channel from a Hiking Channel to a Cat Channel.",0,https://v.redd.it/ebaoev85g9ac1,0.94,639,1704303415,2024-01-03T05:36:55+0000
2024-01-04T07,18xoqm4,68,16606,nbacirclejerk,2td2i,"Since my friend pissed me off: he's both zprolgt and mrsonsfan. They're the same person. You're welcome.",0,https://i.redd.it/6cvalohzf9ac1.png,0.91,1052,1704303135,2024-01-03T05:32:15+0000
2024-01-04T06,18y378h,15,3269,Unexpected,2w67q,"Everyone loves her present",0,https://v.redd.it/1f60z2y4gcac1,0.97,91,1704339434,2024-01-04T03:37:14+0000
2024-01-04T06,18y337s,33,2079,mildlyinfuriating,2ubgg,"I had a dentist fart in my face today.",1,https://www.reddit.com/r/mildlyinfuriating/comments/18y337s/i_had_a_dentist_fart_in_my_face_today/,0.97,238,1704339098,2024-01-04T03:31:38+0000
2024-01-04T06,18y31ml,91,2347,tumblr,2r7hk,"ngl I feel like Dio would be a fun coworker to have",0,https://i.redd.it/1h1lcmnrecac1.jpeg,0.99,33,1704338978,2024-01-04T03:29:38+0000
2024-01-04T06,18y291u,9,4131,nottheonion,2qnts,"'Rich Dad, Poor Dad' Robert Kiyosaki says he's $1.2 billion in debt because 'if I go bankrupt, the bank goes bankrupt.' not my problem'",0,https://biz.crast.net/rich-dad-poor-dad-robert-kiyosaki-says-hes-1-2-billion-in-debt-because-if-i-go-bankrupt-the-bank-goes-bankrupt-not-my-problem/,0.96,326,1704336683,2024-01-04T02:51:23+0000
2024-01-04T06,18y25u9,77,1377,AITAH,446kys,"AITAH for calling my Father in law a bastard after he pressured us into getting a paternity test.",1,https://www.reddit.com/r/AITAH/comments/18y25u9/aitah_for_calling_my_father_in_law_a_bastard/,0.95,188,1704336433,2024-01-04T02:47:13+0000
2024-01-04T06,18y24v8,62,1690,nba,2qo4s,"[Highlight] Tyrese Haliburton hits the three then goes behind the back to Myles Turner to put the Bucks away",0,https://streamable.com/7mf5dj,0.97,244,1704336359,2024-01-04T02:45:59+0000
2024-01-04T06,18y22ma,52,1950,NonPoliticalTwitter,39gt6y,Y2K,0,https://i.redd.it/skvz6ieh6cac1.jpeg,0.98,24,1704336175,2024-01-04T02:42:55+0000
2024-01-04T06,18y1gxn,24,3058,facepalm,2r5rp,"Keep it simple stupid",0,https://i.redd.it/4wtyo5vg1cac1.jpeg,0.96,317,1704334500,2024-01-04T02:15:00+0000
2024-01-04T06,18y1d2b,57,1983,Awww,2suml,"Swan couple reunited after one was treated for sickness.",0,https://v.redd.it/5gk5wp6i0cac1,0.98,28,1704334208,2024-01-04T02:10:08+0000
2024-01-04T06,18y10x1,48,2302,aww,2qh1o,"My boy will be 20 this year, and he's still majestic AF",0,https://www.reddit.com/gallery/18y10x1,0.97,67,1704333308,2024-01-04T01:55:08+0000
2024-01-04T06,18y10av,79,3450,mildlyinteresting,2ti4h,"Got tipped 5lbs 12oz of chow mein",0,https://i.redd.it/orwd1yltxbac1.jpeg,0.98,133,1704333262,2024-01-04T01:54:22+0000
2024-01-04T06,18y0nfc,65,4661,Unexpected,2w67q,"Professional pouring job",0,https://v.redd.it/imtssqvtubac1,0.97,102,1704332291,2024-01-04T01:38:11+0000
2024-01-04T06,18y0cfe,40,2896,Hololive,29numb,"Happy New Year, r/hololive! 🐾✨【FUWAMOCO🐾】",0,https://www.reddit.com/gallery/18y0cfe,0.96,74,1704331471,2024-01-04T01:24:31+0000
2024-01-04T06,18y0c3m,22,3963,shitposting,2usxq,"epstein shid himself",0,https://v.redd.it/j7ed6gvesbac1,0.98,112,1704331447,2024-01-04T01:24:07+0000
2024-01-04T06,18y0b0d,10,5500,BlackPeopleTwitter,33x33,"Man was movin like Polamalu",0,https://v.redd.it/rhxvqtr5sbac1,0.96,378,1704331364,2024-01-04T01:22:44+0000
2024-01-04T06,18y0965,86,1669,CemeteryPorn,2sur3,"After 40 years I righted a wrong",0,https://i.redd.it/1epuqhyrrbac1.jpeg,0.96,39,1704331233,2024-01-04T01:20:33+0000
2024-01-04T06,18y04ar,51,2539,BaldursGate3,12967t,"It's tough being the protagonist",0,https://i.redd.it/989j244mqbac1.jpeg,0.96,148,1704330874,2024-01-04T01:14:34+0000
2024-01-04T06,18xzzni,2,10184,Damnthatsinteresting,2xxyj,"How to make lipstick (2000 years ago)",0,https://v.redd.it/asy2bptjpbac1,0.93,513,1704330534,2024-01-04T01:08:54+0000
2024-01-04T06,18xzzjq,11,5968,ContagiousLaughter,2u2bh,"Drill Sergeant Daddy",0,https://v.redd.it/g2bv4nahpbac1,0.95,148,1704330526,2024-01-04T01:08:46+0000
2024-01-04T06,18xzu86,18,4160,politics,2cneq,"Clinton and Trump are named in Jeffrey Epstein documents, no wrongdoing alleged",0,https://www.usatoday.com/story/news/politics/2024/01/03/jeffrey-epstein-list-clinton-trump/72086945007/,0.95,884,1704330129,2024-01-04T01:02:09+0000
2024-01-04T06,18xzg5o,56,2564,worldnews,2qh13,"Hezbollah confirms: Senior member of the organization killed in Israeli strike",0,https://www.israelnationalnews.com/news/383037,0.94,234,1704329125,2024-01-04T12:45:25+0000
2024-01-04T06,18xzfk8,70,2225,gifs,2qt55,"Automatic Candle Extinguisher from 1841",0,https://i.imgur.com/LwWYEaJ.gifv,0.93,68,1704329087,2024-01-04T12:44:47+0000
2024-01-04T06,18xze67,1,20422,MadeMeSmile,2uqcm,"Winning! Final hematologist appointment, cancer free! Acute Myeloid Leukemia in remission, cheers with me.",0,https://i.redd.it/1f6qdhr3lbac1.jpeg,0.96,422,1704328985,2024-01-04T12:43:05+0000
2024-01-04T06,18xz2wm,66,2523,nope,2s5fh,"Man attacks judge after she refused to give him probation",0,https://v.redd.it/zol0i61mibac1,0.94,277,1704328176,2024-01-04T12:29:36+0000
2024-01-04T06,18xyyma,94,1879,chaoticgood,2qjo5,"Texas coffee shop under fire for providing Plan B through Jane’s Due Process",0,https://i.redd.it/7g04whdrhbac1.jpeg,0.98,45,1704327865,2024-01-04T12:24:25+0000
2024-01-04T06,18xyvrx,60,2754,FUCKYOUINPARTICULAR,3538a,"From r/foundsatan 😶",0,https://i.redd.it/we6prpa6hbac1.jpeg,0.94,207,1704327664,2024-01-04T12:21:04+0000
2024-01-04T06,18xyusz,13,8972,memes,2qjpg,"Be safe guys",0,https://i.redd.it/optkvh5zgbac1.jpeg,0.89,459,1704327597,2024-01-04T12:19:57+0000
2024-01-04T06,18xyqll,83,2123,Epstein,1lruuu,"1.3.24 Epstein documents 943 pages",0,https://www.documentcloud.org/documents/24253239-1324-epstein-documents-943-pages,0.96,719,1704327291,2024-01-04T12:14:51+0000
2024-01-04T06,18xykou,49,3276,TopCharacterDesigns,86ohyi,"West of Loathing Concept Art vs In-Game:",0,https://www.reddit.com/gallery/18xykou,0.96,81,1704326873,2024-01-04T12:07:53+0000
2024-01-04T06,18xykgz,74,2405,perfectlycutscreams,3n7fs,"the best one I've seen",0,https://v.redd.it/xpst531sebac1,0.92,27,1704326858,2024-01-04T12:07:38+0000
2024-01-04T06,18xyb1o,81,2356,Animemes,2w6fe,"Magical Girls are having yet another turn!",0,https://i.redd.it/18ykeb3jcbac1.png,0.95,106,1704326209,2024-01-03T11:56:49+0000
2024-01-04T06,18xya9t,80,5155,PublicFreakout,2yrq6,"Full video of the man who attacked a Clark County judge in court after she denied his probation.",0,https://v.redd.it/9q9tvilocbac1,0.97,958,1704326154,2024-01-03T11:55:54+0000
2024-01-04T06,18xy6fb,35,4259,PrequelMemes,3i60n,"The truth was out there",0,https://v.redd.it/ig62pijnbbac1,0.98,33,1704325879,2024-01-03T11:51:19+0000
2024-01-04T06,18xxwq7,88,5748,shitposting,2usxq,ZUCC,0,https://v.redd.it/9o02xqpp9bac1,0.98,86,1704325218,2024-01-03T11:40:18+0000
2024-01-04T06,18xxpgf,28,5021,therewasanattempt,39ne7,"To appear in court",0,https://v.redd.it/2gognt298bac1,0.95,530,1704324728,2024-01-03T11:32:08+0000
2024-01-04T06,18xxl6u,73,2801,Gamingcirclejerk,2sf2b,"War has began",0,https://www.reddit.com/gallery/18xxl6u,0.84,532,1704324440,2024-01-03T11:27:20+0000
2024-01-04T06,18xxkam,46,3831,rareinsults,48t85,"Cute- 😍😍 Not cute- ☹️☹️",0,https://i.redd.it/ra7998je7bac1.jpeg,0.96,42,1704324378,2024-01-03T11:26:18+0000
2024-01-04T06,18xxgy3,31,4809,KidsAreFuckingStupid,3948y,"He did not care one bit",0,https://v.redd.it/bpzvgolp6bac1,0.93,323,1704324144,2024-01-03T11:22:24+0000
2024-01-04T06,18xxgk2,39,4295,AbruptChaos,3nasz,"A judge in Las Vegas is attacked during a live hearing after she denied probation",0,https://v.redd.it/g20it3wm6bac1,0.95,678,1704324119,2024-01-03T11:21:59+0000
2024-01-04T06,18xxfgu,69,3053,Deltarune,qmi8w,"think about it",0,https://i.redd.it/dsb469zd6bac1.png,0.96,75,1704324044,2024-01-03T11:20:44+0000
2024-01-04T06,18xxcfu,98,2340,dankmemes,2zmfe,"my first post here",0,https://i.redd.it/k52fv3t25bac1.jpeg,0.95,53,1704323837,2024-01-03T11:17:17+0000
2024-01-04T06,18xx8kh,68,3068,blackcats,2twpw,"Everyone congratulate my house panther on her SOCK KILL",0,https://i.redd.it/2x8mdmj05bac1.png,0.97,75,1704323574,2024-01-03T11:12:54+0000
2024-01-04T06,18xx4un,4,11571,todayilearned,2qqjc,"TIL: Short Sleeper Syndrome is a gene mutation discovered by the University of Pittsburgh in 2014. They can function normally with less than 6 hours of sleep and never need to ""recover"" from lack of sleep as opposed to people who purposefully limit sleep. The mutation was given to mice and worked.",0,https://www.healthline.com/health/sleep/natural-short-sleeper,0.97,775,1704323332,2024-01-03T11:08:52+0000
2024-01-04T06,18xx0vg,27,5557,lego,2qhm7,"I made a brass armor for Lego",0,https://www.reddit.com/gallery/18xx0vg,0.98,174,1704323060,2024-01-03T11:04:20+0000
2024-01-04T06,18xx084,61,3408,CatDistributionSystem,7l5bxn,"We stopped at a gas station and got back in car to find this lad in the backseat.",0,https://i.redd.it/2r2i7hpc3bac1.jpeg,0.96,149,1704323015,2024-01-03T11:03:35+0000
2024-01-04T06,18xwz76,20,6574,oddlysatisfying,2x93b,"Candle Perfectly Fits Under The Glass",0,https://v.redd.it/s3v9pqq43bac1,0.86,178,1704322942,2024-01-03T11:02:22+0000
2024-01-04T06,18xwt4i,92,2520,BG3,35s7n,"I HAVE PEAKED",0,https://i.redd.it/gi6b8lfx1bac1.png,0.96,111,1704322536,2024-01-03T10:55:36+0000
2024-01-04T06,18xwqcv,21,6512,cats,2qhta,"A mother always knows the sound of her babies.",0,https://v.redd.it/6fslysc11bac1,0.97,100,1704322349,2024-01-03T10:52:29+0000
2024-01-04T06,18xwkm5,54,4032,CrazyFuckingVideos,45hae8,"Man attacks Las Vegas judge after she denies his probation",0,https://v.redd.it/bf5hk7p80bac1,0.95,555,1704321969,2024-01-03T10:46:09+0000
2024-01-04T06,18xwdo4,14,9375,pics,2qh0u,"Black children watching as white children play in a only whites park, 1955",0,https://i.redd.it/nwmr2p1wyaac1.jpeg,0.91,824,1704321515,2024-01-03T10:38:35+0000
2024-01-04T06,18xw9j8,37,5309,iamatotalpieceofshit,3jj03,"Man attacks Las Vegas judge during sentencing today",0,https://v.redd.it/ibt7lqf0yaac1,0.95,910,1704321233,2024-01-03T10:33:53+0000
2024-01-04T06,18xw9fl,16,8380,tumblr,2r7hk,"This is extremely real",0,https://i.redd.it/ko7w6v41yaac1.jpeg,0.95,157,1704321227,2024-01-03T10:33:47+0000
2024-01-04T06,18xvzdn,6,28419,mildlyinteresting,2ti4h,"Bubbles in my coffee this morning",0,https://i.redd.it/i45ex2nzvaac1.png,0.86,2155,1704320541,2024-01-03T10:22:21+0000
2024-01-04T06,18xvyop,3,18280,NatureIsFuckingLit,3gdh7,"🔥 Chimp experiences freedom from a cage for the first time in 28 years 🔥 ",0,https://v.redd.it/sqwyz2osvaac1,0.95,701,1704320493,2024-01-03T10:21:33+0000
2024-01-04T06,18xvtbd,26,7343,me_irl,2vegg,me_irl,0,https://i.imgur.com/7jMqPwL.jpeg,0.95,86,1704320134,2024-01-03T10:15:34+0000
2024-01-04T06,18xvt2s,58,4114,MaliciousCompliance,3boqz,"Boss introduces new timetracking tool to ""avoid time manipulation"", backfires on him",1,https://www.reddit.com/r/MaliciousCompliance/comments/18xvt2s/boss_introduces_new_timetracking_tool_to_avoid/,0.96,186,1704320117,2024-01-03T10:15:17+0000
2024-01-04T06,18xvq3w,99,2871,blackmagicfuckery,3fn31,"real life anime protagonist",0,https://i.imgur.com/EhpctiO.gifv,0.82,161,1704319919,2024-01-03T10:11:59+0000
2024-01-04T06,18xvo5t,12,15446,BeAmazed,363r3,"Absolute Badass",0,https://i.imgur.com/NLABMUv.jpeg,0.94,357,1704319789,2024-01-03T10:09:49+0000
2024-01-04T06,18xvltp,17,8526,nextfuckinglevel,m0bnr,"Man reveals the technique that could have been used on Stonehedge",0,https://v.redd.it/e33rao0vpaac1,0.94,363,1704319633,2024-01-03T10:07:13+0000
2024-01-04T06,18xvk7h,75,3431,ActualPublicFreakouts,27mtyi,"Man Attacks Las Vegas Judge During Sentencing Today",0,https://v.redd.it/47dllx6rsaac1,0.94,713,1704319525,2024-01-03T10:05:25+0000
2024-01-04T06,18xvio8,5,16376,PublicFreakout,2yrq6,"A Man Attacked a Las Vegas Judge During Sentencing Today",0,https://v.redd.it/0klbaupjsaac1,0.97,2943,1704319419,2024-01-03T10:03:39+0000
2024-01-04T06,18xvfwx,23,7869,meirl,2s5ti,meirl,0,https://i.redd.it/ppv8o8p4saac1.jpeg,0.98,200,1704319247,2024-01-03T10:00:47+0000
2024-01-04T06,18xvdhi,36,6337,wizardposting,5hjlp1,"You fools! You absolute fools!",0,https://i.redd.it/7es49kloraac1.jpeg,0.96,176,1704319090,2024-01-03T09:58:10+0000
2024-01-04T06,18xvbu1,7,15398,interestingasfuck,2qhsa,"Beachgoers have a close encounter with a Cassowary ",0,https://v.redd.it/lyp451lbraac1,0.95,1869,1704318974,2024-01-03T09:56:14+0000
2024-01-04T06,18xvadq,50,5000,BrandNewSentence,mbn0j,"Now here's a religion I can understand",0,https://i.redd.it/smwfzbwzqaac1.png,0.97,197,1704318872,2024-01-03T09:54:32+0000
2024-01-04T06,18xv7s3,93,3039,LeopardsAteMyFace,3jp3p,"shocking discovery: misogyny attracts misogynists",0,https://www.reddit.com/gallery/18xv7s3,0.94,150,1704318690,2024-01-03T09:51:30+0000
2024-01-04T06,18xv6zs,8,15068,WhitePeopleTwitter,35n7t,"Oh please do go there! Who wants popcorn?",0,https://i.redd.it/ld61kqybqaac1.jpeg,0.96,777,1704318638,2024-01-03T09:50:38+0000
2024-01-04T06,18xuwv0,45,6246,OnePiece,2rfz5,"Nico Robin attempt (surprise on 3rd slide) :D",0,https://www.reddit.com/gallery/18xuwv0,0.81,315,1704317961,2024-01-03T09:39:21+0000
2024-01-04T06,18xuv6q,42,21766,Damnthatsinteresting,2xxyj,"Best Buy is removing all physical media from their stores as of today.",0,https://i.redd.it/ggg8kznynaac1.jpeg,0.94,4475,1704317840,2024-01-03T09:37:20+0000
2024-01-04T06,18xuryy,78,3641,YouShouldKnow,2r94o,"YSK: Do not share or click on sappy animal rescue videos",1,https://www.reddit.com/r/YouShouldKnow/comments/18xuryy/ysk_do_not_share_or_click_on_sappy_animal_rescue/,0.94,122,1704317628,2024-01-03T09:33:48+0000
2024-01-04T06,18xu74c,25,9581,wholesomememes,3gcwj,"I always feel so terrible",0,https://i.redd.it/07ip85z4jaac1.jpeg,0.96,104,1704316226,2024-01-03T09:10:26+0000
2024-01-04T06,18xu3p1,34,7743,FluentInFinance,3qpaq8,"Should Student Loans be Forgiven like PPP Loans were?",0,https://i.redd.it/n1r2tyxdiaac1.png,0.88,972,1704315991,2024-01-03T09:06:31+0000
2024-01-04T06,18xtyve,29,9362,clevercomebacks,dyqlw,"Just like the women he's been with, he never saw this coming",0,https://i.redd.it/8k421j5ihaac1.png,0.89,587,1704315668,2024-01-03T09:01:08+0000
2024-01-04T06,18xtxnp,41,6979,TikTokCringe,mvcq5,"That's a blessin",0,https://v.redd.it/2nlz5br5haac1,0.96,185,1704315599,2024-01-03T08:59:59+0000
2024-01-04T06,18xtu67,38,8109,funny,2qh33,"Superhero entanglement (Batman, Wonder Woman & Superman)",0,https://i.redd.it/4zzsw8ojgaac1.jpeg,0.88,118,1704315350,2024-01-03T08:55:50+0000
2024-01-04T06,18xtjtd,63,5463,IdiotsInCars,3aimx,"“Dude are you kidding me right now?!” Audi idiot didn’t even look, claims they were not at fault. Dashcam to the rescue! [oc]",0,https://v.redd.it/lhjg7pbheaac1,0.96,686,1704314653,2024-01-03T08:44:13+0000
