date,id,position,score,subreddit_display_name,subreddit_id,title,is_self,url,upvote_ratio,num_comments,created,created_date
2024-01-04T04,18xvzdn,2,24006,mildlyinteresting,2ti4h,"Bubbles in my coffee this morning",0,https://i.redd.it/i45ex2nzvaac1.png,0.87,1840,1704320541,2024-01-03T10:22:21+0000
2024-01-04T04,18xvyop,4,13691,NatureIsFuckingLit,3gdh7,"🔥 Chimp experiences freedom from a cage for the first time in 28 years 🔥 ",0,https://v.redd.it/sqwyz2osvaac1,0.96,533,1704320493,2024-01-03T10:21:33+0000
2024-01-04T04,18xvt2s,59,3015,MaliciousCompliance,3boqz,"Boss introduces new timetracking tool to ""avoid time manipulation"", backfires on him",1,https://www.reddit.com/r/MaliciousCompliance/comments/18xvt2s/boss_introduces_new_timetracking_tool_to_avoid/,0.96,146,1704320117,2024-01-03T10:15:17+0000
2024-01-04T04,18xvo5t,11,10193,BeAmazed,363r3,"Absolute Badass",0,https://i.imgur.com/NLABMUv.jpeg,0.95,250,1704319789,2024-01-03T10:09:49+0000
2024-01-04T04,18xvltp,25,5068,nextfuckinglevel,m0bnr,"Man reveals the technique that could have been used on Stonehedge",0,https://v.redd.it/e33rao0vpaac1,0.95,258,1704319633,2024-01-03T10:07:13+0000
2024-01-04T04,18xvk7h,61,2971,ActualPublicFreakouts,27mtyi,"Man Attacks Las Vegas Judge During Sentencing Today",0,https://v.redd.it/47dllx6rsaac1,0.95,669,1704319525,2024-01-03T10:05:25+0000
2024-01-04T04,18xvio8,3,14069,PublicFreakout,2yrq6,"A Man Attacked a Las Vegas Judge During Sentencing Today",0,https://v.redd.it/0klbaupjsaac1,0.97,2613,1704319419,2024-01-03T10:03:39+0000
2024-01-04T04,18xvdhi,35,4764,wizardposting,5hjlp1,"You fools! You absolute fools!",0,https://i.redd.it/7es49kloraac1.jpeg,0.96,159,1704319090,2024-01-03T09:58:10+0000
2024-01-04T04,18xvbu1,6,12469,interestingasfuck,2qhsa,"Beachgoers have a close encounter with a Cassowary ",0,https://v.redd.it/lyp451lbraac1,0.95,1641,1704318974,2024-01-03T09:56:14+0000
2024-01-04T04,18xvadq,58,3354,BrandNewSentence,mbn0j,"Now here's a religion I can understand",0,https://i.redd.it/smwfzbwzqaac1.png,0.97,139,1704318872,2024-01-03T09:54:32+0000
2024-01-04T04,18xv7s3,87,2456,LeopardsAteMyFace,3jp3p,"shocking discovery: misogyny attracts misogynists",0,https://www.reddit.com/gallery/18xv7s3,0.95,132,1704318690,2024-01-03T09:51:30+0000
2024-01-04T04,18xv6zs,8,11864,WhitePeopleTwitter,35n7t,"Oh please do go there! Who wants popcorn?",0,https://i.redd.it/ld61kqybqaac1.jpeg,0.96,622,1704318638,2024-01-03T09:50:38+0000
2024-01-04T04,18xuwv0,39,5088,OnePiece,2rfz5,"Nico Robin attempt (surprise on 3rd slide) :D",0,https://www.reddit.com/gallery/18xuwv0,0.82,274,1704317961,2024-01-03T09:39:21+0000
2024-01-04T04,18xuv6q,5,17847,Damnthatsinteresting,2xxyj,"Best Buy is removing all physical media from their stores as of today.",0,https://i.redd.it/ggg8kznynaac1.jpeg,0.94,3821,1704317840,2024-01-03T09:37:20+0000
2024-01-04T04,18xuryy,82,2748,YouShouldKnow,2r94o,"YSK: Do not share or click on sappy animal rescue videos",1,https://www.reddit.com/r/YouShouldKnow/comments/18xuryy/ysk_do_not_share_or_click_on_sappy_animal_rescue/,0.94,100,1704317628,2024-01-03T09:33:48+0000
2024-01-04T04,18xulpi,97,2510,starterpacks,34o9s,"The ""fellas, is it gay to...?"" starter pack",0,https://i.redd.it/vtg94z7ylaac1.png,0.94,290,1704317201,2024-01-03T09:26:41+0000
2024-01-04T04,18xujil,62,3443,mildlyinfuriating,2ubgg,"The amount of wrapping paper on this partially used vintage roll (left) vs. a brand new modern roll (right)",0,https://i.redd.it/zgg4z5xmlaac1.jpeg,0.95,163,1704317057,2024-01-03T09:24:17+0000
2024-01-04T04,18xubqo,92,2805,TerrifyingAsFuck,31d92,"Black children watching as white children play in a whites only park, 1956",0,https://i.redd.it/4huvrky2kaac1.jpeg,0.85,105,1704316535,2024-01-03T09:15:35+0000
2024-01-04T04,18xu74c,19,7302,wholesomememes,3gcwj,"I always feel so terrible",0,https://i.redd.it/07ip85z4jaac1.jpeg,0.97,84,1704316226,2024-01-03T09:10:26+0000
2024-01-04T04,18xu6fg,9,22660,memes,2qjpg,"Getting older can be lonely",0,https://v.redd.it/06dqnsr0jaac1,0.93,434,1704316185,2024-01-03T09:09:45+0000
2024-01-04T04,18xu3p1,29,6037,FluentInFinance,3qpaq8,"Should Student Loans be Forgiven like PPP Loans were?",0,https://i.redd.it/n1r2tyxdiaac1.png,0.88,828,1704315991,2024-01-03T09:06:31+0000
2024-01-04T04,18xu35o,90,2936,Genshin_Impact,12p4l2,"Albedo's family tree.",0,https://i.redd.it/71ghps2ciaac1.png,0.96,206,1704315955,2024-01-03T09:05:55+0000
2024-01-04T04,18xtyve,23,7297,clevercomebacks,dyqlw,"Just like the women he's been with, he never saw this coming",0,https://i.redd.it/8k421j5ihaac1.png,0.9,434,1704315668,2024-01-03T09:01:08+0000
2024-01-04T04,18xtxnp,38,5489,TikTokCringe,mvcq5,"That's a blessin",0,https://v.redd.it/2nlz5br5haac1,0.96,154,1704315599,2024-01-03T08:59:59+0000
2024-01-04T04,18xtu67,30,6230,funny,2qh33,"Superhero entanglement (Batman, Wonder Woman & Superman)",0,https://i.redd.it/4zzsw8ojgaac1.jpeg,0.89,97,1704315350,2024-01-03T08:55:50+0000
2024-01-04T04,18xtjtd,51,4781,IdiotsInCars,3aimx,"“Dude are you kidding me right now?!” Audi idiot didn’t even look, claims they were not at fault. Dashcam to the rescue! [oc]",0,https://v.redd.it/lhjg7pbheaac1,0.96,624,1704314653,2024-01-03T08:44:13+0000
2024-01-04T04,18xtga5,33,6271,gaming,2qh03,"Jailed Nintendo hacker Gary Bowser denies link to new Switch flash cart",0,https://www.videogameschronicle.com/news/jailed-nintendo-hacker-gary-bowser-denies-link-to-new-switch-flash-cart/,0.96,356,1704314414,2024-01-03T08:40:14+0000
2024-01-04T04,18xt9sz,17,8775,BlackPeopleTwitter,33x33,"All I see is innovation 🤣",0,https://i.redd.it/kcw1oxahcaac1.jpeg,0.89,705,1704313978,2024-01-03T08:32:58+0000
2024-01-04T04,18xskmw,57,5620,PeterExplainsTheJoke,121h8r,"Someone please help before I go insane!",0,https://i.redd.it/nvjas4xc7aac1.png,0.89,130,1704312258,2024-01-03T08:04:18+0000
2024-01-04T04,18xsga0,67,4331,europe,2qh4j,"Belarusian is disappearing (2009 & 2019)",0,https://www.reddit.com/gallery/18xsga0,0.95,648,1704311982,2024-01-03T07:59:42+0000
2024-01-04T04,18xsdbg,22,12108,shitposting,2usxq,Facts,0,https://v.redd.it/3mnw7jox5aac1,0.97,210,1704311778,2024-01-03T07:56:18+0000
2024-01-04T04,18xs90u,20,11078,SipsTea,5tdqj0,"But friend shape...",0,https://v.redd.it/ertmyfr25aac1,0.92,399,1704311488,2024-01-03T07:51:28+0000
2024-01-04T04,18xs8kt,43,6764,Wellthatsucks,2xcv7,"Went to Goodwill yesterday. Got a discount at the register, thought it was because of tag color. Looked at my receipt today and saw this.",0,https://i.redd.it/3xvxjoiz4aac1.jpeg,0.92,252,1704311458,2024-01-03T07:50:58+0000
2024-01-04T04,18xs6ck,13,13992,politics,2cneq,"Trump’s Idiot Lawyer Just Admitted He May Be Guilty of Insurrection: Donald Trump keeps hiring the very best.",0,https://newrepublic.com/post/177822/trump-idiot-lawyer-admit-may-guilty-insurrection,0.93,582,1704311308,2024-01-03T07:48:28+0000
2024-01-04T04,18xrqgo,81,4843,maybemaybemaybe,38e1l,"Maybe Maybe Maybe ",0,https://v.redd.it/2xrpegvy0aac1,0.79,270,1704310262,2024-01-03T07:31:02+0000
2024-01-04T04,18xrmgi,88,4143,CuratedTumblr,3x5kfw,"Chinese rocks",0,https://www.reddit.com/gallery/18xrmgi,0.97,63,1704310001,2024-01-03T07:26:41+0000
2024-01-04T04,18xr2r3,66,6485,whenthe,23gidu,Perspectives,0,https://v.redd.it/77zxwghuw9ac1,0.93,193,1704308728,2024-01-03T07:05:28+0000
2024-01-04T04,18xqtcm,89,4297,AskReddit,2qh1i,"What’s the craziest WW2 fact that you know of?",1,https://www.reddit.com/r/AskReddit/comments/18xqtcm/whats_the_craziest_ww2_fact_that_you_know_of/,0.93,4304,1704308119,2024-01-03T06:55:19+0000
2024-01-04T04,18xqt09,54,7352,TrueOffMyChest,2yuqy,"My soon to be ex-husband humiliated me on our wedding day and met his karma instantly.",1,https://www.reddit.com/r/TrueOffMyChest/comments/18xqt09/my_soon_to_be_exhusband_humiliated_me_on_our/,0.89,1379,1704308101,2024-01-03T06:55:01+0000
2024-01-04T04,18xqsk8,74,15818,pics,2qh0u,"Temporary NYPD headquarters at a Burger King, 9/11/2001",0,https://i.redd.it/38fxac5wu9ac1.jpeg,0.95,497,1704308073,2024-01-03T06:54:33+0000
2024-01-04T04,18xqr6r,18,14274,FunnyAnimals,2st2l,"Dog thought he was home alone ",0,https://v.redd.it/bc2fgd5nu9ac1,0.97,135,1704307979,2024-01-03T06:52:59+0000
2024-01-04T04,18xqr1b,12,23315,news,2qh3l,"Names in Jeffrey Epstein court documents to be unsealed in New York on Wednesday",0,https://www.cnbc.com/2024/01/03/jeffrey-epstein-court-document-names-unsealed-wednesday-.html,0.95,2290,1704307970,2024-01-03T06:52:50+0000
2024-01-04T04,18xqmsj,50,7412,TwoXChromosomes,2r2jt,"He left and I barely noticed.",1,https://www.reddit.com/r/TwoXChromosomes/comments/18xqmsj/he_left_and_i_barely_noticed/,0.9,321,1704307693,2024-01-03T06:48:13+0000
2024-01-04T04,18xqlpm,73,17367,WhitePeopleTwitter,35n7t,"Trump's Version of 'America First'",0,https://i.redd.it/c8lvm1cit9ac1.png,0.93,656,1704307620,2024-01-03T06:47:00+0000
2024-01-04T04,18xqio1,16,19016,meirl,2s5ti,meirl,0,https://i.redd.it/uc11q2vys9ac1.jpeg,0.97,94,1704307415,2024-01-03T06:43:35+0000
2024-01-04T04,18xqelw,72,5948,Steam,2qwis,"POV: You woke up the next day and realized that the whole Game Award was a bad dream",0,https://i.redd.it/lfngtbe3s9ac1.png,0.86,467,1704307150,2024-01-03T06:39:10+0000
2024-01-04T04,18xq76w,78,19821,politics,2cneq,"Conservatives Are Having a Meltdown Over Trump and the Epstein List: Donald Trump’s biggest supporters are freaking out over the anticipated unveiling.",0,https://newrepublic.com/post/177828/conservatives-meltdown-trump-epstein-list,0.9,2478,1704306643,2024-01-03T06:30:43+0000
2024-01-04T04,18xq5a0,49,7772,technology,2qh16,"23andMe tells victims it's their fault that their data was breached",0,https://techcrunch.com/2024/01/03/23andme-tells-victims-its-their-fault-that-their-data-was-breached/,0.96,713,1704306520,2024-01-03T06:28:40+0000
2024-01-04T04,18xq16a,26,17559,BikiniBottomTwitter,3deqz,"Gary hit em wit the",0,https://v.redd.it/koc84toep9ac1,0.91,348,1704306237,2024-01-03T06:23:57+0000
2024-01-04T04,18xpyab,76,5642,NoStupidQuestions,2w844,"In the 80s did parents really just let their kids go out wherever or is this only in movies?",1,https://www.reddit.com/r/NoStupidQuestions/comments/18xpyab/in_the_80s_did_parents_really_just_let_their_kids/,0.93,7919,1704306043,2024-01-03T06:20:43+0000
2024-01-04T04,18xpx54,32,12068,holdmycatnip,2zhxd,"Have a look at this businessman!",0,https://v.redd.it/5wbxadclo9ac1,0.97,99,1704305971,2024-01-03T06:19:31+0000
2024-01-04T04,18xprtx,52,10283,Unexpected,2w67q,"Looking for her dog",0,https://v.redd.it/axf945gin9ac1,0.91,175,1704305606,2024-01-03T06:13:26+0000
2024-01-04T04,18xpq9m,85,17834,todayilearned,2qqjc,"TIL in 1609, Manhattan supported more ecological diversity per acre than Yellowstone National Park. Research suggests that had Manhattan never been developed, it would be one of the most important national parks",0,https://secretnyc.co/manhattan-used-one-giant-lush-park-looked-like/,0.95,643,1704305502,2024-01-03T06:11:42+0000
2024-01-04T04,18xpe1t,37,14139,MurderedByWords,3hx3r,"It's clear as can be",0,https://i.redd.it/t013eymuk9ac1.jpeg,0.89,265,1704304712,2024-01-03T05:58:32+0000
2024-01-04T04,18xp5v3,95,5382,IllegallySmolCats,23e19j,"Smol meow ",0,https://v.redd.it/kd607t72j9ac1,0.97,60,1704304155,2024-01-03T05:49:15+0000
2024-01-04T04,18xoxdh,65,8383,ExplainTheJoke,2vmj2,"My friends in Tech found this hilarious. Captioned ""Stack Overflow, In a nutshell"". Please help.",0,https://i.redd.it/xmeqbzjlh9ac1.jpeg,0.95,145,1704303592,2024-01-03T05:39:52+0000
2024-01-04T04,18xoupq,24,21733,cats,2qhta,"Man goes for 21K hike, discovers Lost Kitten, and Adopts it. Changes channel from a Hiking Channel to a Cat Channel.",0,https://v.redd.it/ebaoev85g9ac1,0.94,589,1704303415,2024-01-03T05:36:55+0000
2024-01-04T04,18xoqm4,40,14825,nbacirclejerk,2td2i,"Since my friend pissed me off: he's both zprolgt and mrsonsfan. They're the same person. You're welcome.",0,https://i.redd.it/6cvalohzf9ac1.png,0.91,999,1704303135,2024-01-03T05:32:15+0000
2024-01-04T04,18xogx0,28,28283,me_irl,2vegg,Me_irl,0,https://i.redd.it/t615lg9ee9ac1.jpeg,0.95,473,1704302516,2024-01-03T05:21:56+0000
2024-01-04T04,18xnu1w,99,6317,fightporn,2u5un,"Keep calm and wait for the right moment)",0,https://v.redd.it/hf2v49kh89ac1,0.96,344,1704300599,2024-01-03T04:49:59+0000
2024-01-04T04,18xn8xa,79,10973,lotrmemes,2v0i1,"*using Pippin because he wouldn’t have read them",0,https://i.redd.it/zdhohfjp39ac1.jpeg,0.92,2548,1704298922,2024-01-03T04:22:02+0000
2024-01-04T04,18xmz0a,75,9466,JeffArcuri,740oig,"Bathroom prank",0,https://v.redd.it/ogur2zul19ac1,0.93,149,1704298228,2024-01-03T04:10:28+0000
2024-01-04T04,18xmcar,100,9893,technicallythetruth,3pzez,"quite literally a scoop",0,https://i.redd.it/xdkymn5sw8ac1.png,0.95,33,1704296609,2024-01-03T03:43:29+0000
2024-01-04T04,18xlz2c,64,14751,WorkReform,5qpzgw,"Hustle culture is not normal.",0,https://i.redd.it/3qynn1mwt8ac1.jpeg,0.93,460,1704295649,2024-01-03T03:27:29+0000
2024-01-04T04,18xlnne,84,11504,comics,2qh0s,"[oc] DISGUSTING",0,https://i.redd.it/dylf065hr8ac1.jpeg,0.95,188,1704294808,2024-01-03T03:13:28+0000
2024-01-04T04,18xlf52,68,14547,worldnews,2qh13,"NATO to buy 1,000 Patriot missiles in face of Russia threat",0,https://www.thedefensepost.com/2024/01/03/nato-buys-patriot-missiles/?expand_article=1,0.95,1312,1704294186,2024-01-03T03:03:06+0000
2024-01-04T04,18xl64i,96,18608,sadposting,5203f0,"Social Experiment",0,https://v.redd.it/bt5xnuljn8ac1,0.83,5279,1704293509,2024-01-03T02:51:49+0000
2024-01-04T03,18y0cfe,77,1233,Hololive,29numb,"Happy New Year, r/hololive! 🐾✨【FUWAMOCO🐾】",0,https://www.reddit.com/gallery/18y0cfe,0.99,47,1704331471,2024-01-04T01:24:31+0000
2024-01-04T03,18xzt47,82,1272,PoliticalHumor,2qm21,"Sending thoughts and prayers",0,https://i.redd.it/51l0mjn1obac1.png,0.98,53,1704330051,2024-01-04T01:00:51+0000
2024-01-04T03,18xzm8o,70,2958,Damnthatsinteresting,2xxyj,"Bill clinton refrenced in the Epstein documents",0,https://i.redd.it/l6g5qfosmbac1.jpeg,0.89,763,1704329554,2024-01-04T12:52:34+0000
2024-01-04T03,18xze67,7,5377,MadeMeSmile,2uqcm,"Winning! Final hematologist appointment, cancer free! Acute Myeloid Leukemia in remission, cheers with me.",0,https://i.redd.it/1f6qdhr3lbac1.jpeg,0.98,164,1704328985,2024-01-04T12:43:05+0000
2024-01-04T03,18xz2wm,99,1201,nope,2s5fh,"Man attacks judge after she refused to give him probation",0,https://v.redd.it/zol0i61mibac1,0.96,180,1704328176,2024-01-04T12:29:36+0000
2024-01-04T03,18xykou,72,1684,TopCharacterDesigns,86ohyi,"West of Loathing Concept Art vs In-Game:",0,https://www.reddit.com/gallery/18xykou,0.97,42,1704326873,2024-01-04T12:07:53+0000
2024-01-04T03,18xya9t,93,2712,PublicFreakout,2yrq6,"Full video of the man who attacked a Clark County judge in court after she denied his probation.",0,https://v.redd.it/9q9tvilocbac1,0.97,583,1704326154,2024-01-03T11:55:54+0000
2024-01-04T03,18xxm1g,73,1877,nba,2qo4s,"Bill Simmons says Shai Gilgeous-Alexander is better than Jayson Tatum “SGA is a Top 5 guy in the league now”",0,https://www.theringer.com/bill-simmons,0.92,832,1704324500,2024-01-03T11:28:20+0000
2024-01-04T03,18xxl6u,86,1645,Gamingcirclejerk,2sf2b,"War has began",0,https://www.reddit.com/gallery/18xxl6u,0.86,344,1704324440,2024-01-03T11:27:20+0000
2024-01-04T03,18xxgy3,56,2193,KidsAreFuckingStupid,3948y,"He did not care one bit",0,https://v.redd.it/bpzvgolp6bac1,0.94,179,1704324144,2024-01-03T11:22:24+0000
2024-01-04T03,18xxgk2,49,2432,AbruptChaos,3nasz,"A judge in Las Vegas is attacked during a live hearing after she denied probation",0,https://v.redd.it/g20it3wm6bac1,0.96,445,1704324119,2024-01-03T11:21:59+0000
2024-01-04T03,18xxfgu,76,1794,Deltarune,qmi8w,"think about it",0,https://i.redd.it/dsb469zd6bac1.png,0.97,52,1704324044,2024-01-03T11:20:44+0000
2024-01-04T03,18xx98s,68,1994,antiwork,2y77d,"Got fired for this text message",0,https://i.redd.it/m97nezo55bac1.jpeg,0.97,127,1704323622,2024-01-03T11:13:42+0000
2024-01-04T03,18xx8kh,100,1498,blackcats,2twpw,"Everyone congratulate my house panther on her SOCK KILL",0,https://i.redd.it/2x8mdmj05bac1.png,0.98,54,1704323574,2024-01-03T11:12:54+0000
2024-01-04T03,18xx4un,16,4520,todayilearned,2qqjc,"TIL: Short Sleeper Syndrome is a gene mutation discovered by the University of Pittsburgh in 2014. They can function normally with less than 6 hours of sleep and never need to ""recover"" from lack of sleep as opposed to people who purposefully limit sleep. The mutation was given to mice and worked.",0,https://www.healthline.com/health/sleep/natural-short-sleeper,0.98,282,1704323332,2024-01-03T11:08:52+0000
2024-01-04T03,18xx0vg,58,2260,lego,2qhm7,"I made a brass armor for Lego",0,https://www.reddit.com/gallery/18xx0vg,0.98,108,1704323060,2024-01-03T11:04:20+0000
2024-01-04T03,18xx084,75,1915,CatDistributionSystem,7l5bxn,"We stopped at a gas station and got back in car to find this lad in the backseat.",0,https://i.redd.it/2r2i7hpc3bac1.jpeg,0.97,110,1704323015,2024-01-03T11:03:35+0000
2024-01-04T03,18xwz76,35,3161,oddlysatisfying,2x93b,"Candle Perfectly Fits Under The Glass",0,https://v.redd.it/s3v9pqq43bac1,0.88,97,1704322942,2024-01-03T11:02:22+0000
2024-01-04T03,18xwwuw,42,2848,nottheonion,2qnts,"Father says his daughter’s car is melting in the driveway. Honda says it’s not covered by warranty",0,https://www.wsbtv.com/news/local/dekalb-county/father-says-his-daughters-car-is-melting-driveway-honda-says-its-not-covered-by-warranty/SYEKOWWHKVBORBR4NMYKVOALW4/,0.94,167,1704322798,2024-01-03T10:59:58+0000
2024-01-04T03,18xwt4i,96,1671,BG3,35s7n,"I HAVE PEAKED",0,https://i.redd.it/gi6b8lfx1bac1.png,0.96,78,1704322536,2024-01-03T10:55:36+0000
2024-01-04T03,18xwn8n,1,16299,technicallythetruth,3pzez,"Well, I think he got a really good point",0,https://i.redd.it/8pa4b7gd0bac1.png,0.96,368,1704322139,2024-01-03T10:48:59+0000
2024-01-04T03,18xwkm5,44,2967,CrazyFuckingVideos,45hae8,"Man attacks Las Vegas judge after she denies his probation",0,https://v.redd.it/bf5hk7p80bac1,0.96,435,1704321969,2024-01-03T10:46:09+0000
2024-01-04T03,18xwdo4,59,4825,pics,2qh0u,"Black children watching as white children play in a only whites park, 1955",0,https://i.redd.it/nwmr2p1wyaac1.jpeg,0.93,467,1704321515,2024-01-03T10:38:35+0000
2024-01-04T03,18xw9j8,30,3791,iamatotalpieceofshit,3jj03,"Man attacks Las Vegas judge during sentencing today",0,https://v.redd.it/ibt7lqf0yaac1,0.96,732,1704321233,2024-01-03T10:33:53+0000
2024-01-04T03,18xw9fl,15,5539,tumblr,2r7hk,"This is extremely real",0,https://i.redd.it/ko7w6v41yaac1.jpeg,0.96,82,1704321227,2024-01-03T10:33:47+0000
2024-01-04T03,18xw8yg,11,6372,facepalm,2r5rp,"Maybe this is why a President shouldn’t be telling Police to “rough up” suspects a little bit",0,https://i.redd.it/q2edppowxaac1.jpeg,0.97,286,1704321194,2024-01-03T10:33:14+0000
2024-01-04T03,18xvzdn,2,20990,mildlyinteresting,2ti4h,"Bubbles in my coffee this morning",0,https://i.redd.it/i45ex2nzvaac1.png,0.88,1674,1704320541,2024-01-03T10:22:21+0000
2024-01-04T03,18xvyop,5,10870,NatureIsFuckingLit,3gdh7,"🔥 Chimp experiences freedom from a cage for the first time in 28 years 🔥 ",0,https://v.redd.it/sqwyz2osvaac1,0.96,445,1704320493,2024-01-03T10:21:33+0000
2024-01-04T03,18xvt2s,66,2458,MaliciousCompliance,3boqz,"Boss introduces new timetracking tool to ""avoid time manipulation"", backfires on him",1,https://www.reddit.com/r/MaliciousCompliance/comments/18xvt2s/boss_introduces_new_timetracking_tool_to_avoid/,0.97,125,1704320117,2024-01-03T10:15:17+0000
2024-01-04T03,18xvo5t,13,7094,BeAmazed,363r3,"Absolute Badass",0,https://i.imgur.com/NLABMUv.jpeg,0.95,190,1704319789,2024-01-03T10:09:49+0000
2024-01-04T03,18xvltp,37,3567,nextfuckinglevel,m0bnr,"Man reveals the technique that could have been used on Stonehedge",0,https://v.redd.it/e33rao0vpaac1,0.95,218,1704319633,2024-01-03T10:07:13+0000
2024-01-04T03,18xvk7h,60,2673,ActualPublicFreakouts,27mtyi,"Man Attacks Las Vegas Judge During Sentencing Today",0,https://v.redd.it/47dllx6rsaac1,0.96,623,1704319525,2024-01-03T10:05:25+0000
2024-01-04T03,18xvio8,3,12484,PublicFreakout,2yrq6,"A Man Attacked a Las Vegas Judge During Sentencing Today",0,https://v.redd.it/0klbaupjsaac1,0.98,2382,1704319419,2024-01-03T10:03:39+0000
2024-01-04T03,18xvdhi,36,3800,wizardposting,5hjlp1,"You fools! You absolute fools!",0,https://i.redd.it/7es49kloraac1.jpeg,0.97,141,1704319090,2024-01-03T09:58:10+0000
2024-01-04T03,18xvbu1,6,10394,interestingasfuck,2qhsa,"Beachgoers have a close encounter with a Cassowary ",0,https://v.redd.it/lyp451lbraac1,0.95,1490,1704318974,2024-01-03T09:56:14+0000
2024-01-04T03,18xvadq,71,2544,BrandNewSentence,mbn0j,"Now here's a religion I can understand",0,https://i.redd.it/smwfzbwzqaac1.png,0.97,109,1704318872,2024-01-03T09:54:32+0000
2024-01-04T03,18xv7s3,90,2127,LeopardsAteMyFace,3jp3p,"shocking discovery: misogyny attracts misogynists",0,https://www.reddit.com/gallery/18xv7s3,0.95,116,1704318690,2024-01-03T09:51:30+0000
2024-01-04T03,18xv6zs,9,9438,WhitePeopleTwitter,35n7t,"Oh please do go there! Who wants popcorn?",0,https://i.redd.it/ld61kqybqaac1.jpeg,0.97,504,1704318638,2024-01-03T09:50:38+0000
2024-01-04T03,18xuwv0,34,4467,OnePiece,2rfz5,"Nico Robin attempt (surprise on 3rd slide) :D",0,https://www.reddit.com/gallery/18xuwv0,0.82,246,1704317961,2024-01-03T09:39:21+0000
2024-01-04T03,18xuv6q,4,15015,Damnthatsinteresting,2xxyj,"Best Buy is removing all physical media from their stores as of today.",0,https://i.redd.it/ggg8kznynaac1.jpeg,0.95,3206,1704317840,2024-01-03T09:37:20+0000
2024-01-04T03,18xuryy,89,2260,YouShouldKnow,2r94o,"YSK: Do not share or click on sappy animal rescue videos",1,https://www.reddit.com/r/YouShouldKnow/comments/18xuryy/ysk_do_not_share_or_click_on_sappy_animal_rescue/,0.94,82,1704317628,2024-01-03T09:33:48+0000
2024-01-04T03,18xulpi,94,2239,starterpacks,34o9s,"The ""fellas, is it gay to...?"" starter pack",0,https://i.redd.it/vtg94z7ylaac1.png,0.94,271,1704317201,2024-01-03T09:26:41+0000
2024-01-04T03,18xujil,78,2529,mildlyinfuriating,2ubgg,"The amount of wrapping paper on this partially used vintage roll (left) vs. a brand new modern roll (right)",0,https://i.redd.it/zgg4z5xmlaac1.jpeg,0.96,129,1704317057,2024-01-03T09:24:17+0000
2024-01-04T03,18xubqo,81,2608,TerrifyingAsFuck,31d92,"Black children watching as white children play in a whites only park, 1956",0,https://i.redd.it/4huvrky2kaac1.jpeg,0.85,105,1704316535,2024-01-03T09:15:35+0000
2024-01-04T03,18xu74c,25,5826,wholesomememes,3gcwj,"I always feel so terrible",0,https://i.redd.it/07ip85z4jaac1.jpeg,0.97,58,1704316226,2024-01-03T09:10:26+0000
2024-01-04T03,18xu6fg,8,20284,memes,2qjpg,"Getting older can be lonely",0,https://v.redd.it/06dqnsr0jaac1,0.94,397,1704316185,2024-01-03T09:09:45+0000
2024-01-04T03,18xu3p1,32,4965,FluentInFinance,3qpaq8,"Should Student Loans be Forgiven like PPP Loans were?",0,https://i.redd.it/n1r2tyxdiaac1.png,0.88,749,1704315991,2024-01-03T09:06:31+0000
2024-01-04T03,18xu35o,85,2654,Genshin_Impact,12p4l2,"Albedo's family tree.",0,https://i.redd.it/71ghps2ciaac1.png,0.96,196,1704315955,2024-01-03T09:05:55+0000
2024-01-04T03,18xu222,53,9289,facepalm,2r5rp,"The whole clip..",0,https://i.redd.it/68vwtv14iaac1.jpeg,0.88,3334,1704315884,2024-01-03T09:04:44+0000
2024-01-04T03,18xtyve,26,5977,clevercomebacks,dyqlw,"Just like the women he's been with, he never saw this coming",0,https://i.redd.it/8k421j5ihaac1.png,0.91,315,1704315668,2024-01-03T09:01:08+0000
2024-01-04T03,18xtxnp,38,4451,TikTokCringe,mvcq5,"That's a blessin",0,https://v.redd.it/2nlz5br5haac1,0.97,138,1704315599,2024-01-03T08:59:59+0000
2024-01-04T03,18xtv0h,47,3974,therewasanattempt,39ne7,"To Predict Trumps Fate In 2024 On Fox News",0,https://v.redd.it/brd1joskgaac1,0.94,410,1704315410,2024-01-03T08:56:50+0000
2024-01-04T03,18xtu67,33,5040,funny,2qh33,"Superhero entanglement (Batman, Wonder Woman & Superman)",0,https://i.redd.it/4zzsw8ojgaac1.jpeg,0.89,84,1704315350,2024-01-03T08:55:50+0000
2024-01-04T03,18xtjtd,46,4332,IdiotsInCars,3aimx,"“Dude are you kidding me right now?!” Audi idiot didn’t even look, claims they were not at fault. Dashcam to the rescue! [oc]",0,https://v.redd.it/lhjg7pbheaac1,0.96,580,1704314653,2024-01-03T08:44:13+0000
2024-01-04T03,18xtga5,29,5672,gaming,2qh03,"Jailed Nintendo hacker Gary Bowser denies link to new Switch flash cart",0,https://www.videogameschronicle.com/news/jailed-nintendo-hacker-gary-bowser-denies-link-to-new-switch-flash-cart/,0.96,304,1704314414,2024-01-03T08:40:14+0000
2024-01-04T03,18xt9sz,18,8056,BlackPeopleTwitter,33x33,"All I see is innovation 🤣",0,https://i.redd.it/kcw1oxahcaac1.jpeg,0.89,659,1704313978,2024-01-03T08:32:58+0000
2024-01-04T03,18xsze1,87,6275,cats,2qhta,"My cat on the day I got him….and him today 😍",0,https://www.reddit.com/gallery/18xsze1,0.98,298,1704313267,2024-01-03T08:21:07+0000
2024-01-04T03,18xskmw,51,4948,PeterExplainsTheJoke,121h8r,"Someone please help before I go insane!",0,https://i.redd.it/nvjas4xc7aac1.png,0.9,113,1704312258,2024-01-03T08:04:18+0000
2024-01-04T03,18xsga0,63,4076,europe,2qh4j,"Belarusian is disappearing (2009 & 2019)",0,https://www.reddit.com/gallery/18xsga0,0.95,618,1704311982,2024-01-03T07:59:42+0000
2024-01-04T03,18xsdbg,20,11594,shitposting,2usxq,Facts,0,https://v.redd.it/3mnw7jox5aac1,0.97,195,1704311778,2024-01-03T07:56:18+0000
2024-01-04T03,18xs90u,21,9594,SipsTea,5tdqj0,"But friend shape...",0,https://v.redd.it/ertmyfr25aac1,0.92,349,1704311488,2024-01-03T07:51:28+0000
2024-01-04T03,18xs8kt,39,5856,Wellthatsucks,2xcv7,"Went to Goodwill yesterday. Got a discount at the register, thought it was because of tag color. Looked at my receipt today and saw this.",0,https://i.redd.it/3xvxjoiz4aac1.jpeg,0.92,235,1704311458,2024-01-03T07:50:58+0000
2024-01-04T03,18xs6ck,12,12227,politics,2cneq,"Trump’s Idiot Lawyer Just Admitted He May Be Guilty of Insurrection: Donald Trump keeps hiring the very best.",0,https://newrepublic.com/post/177822/trump-idiot-lawyer-admit-may-guilty-insurrection,0.94,515,1704311308,2024-01-03T07:48:28+0000
