date,id,position,score,subreddit_display_name,subreddit_id,title,is_self,url,upvote_ratio,num_comments,created,created_date
2024-01-04T12,18y9jzl,66,863,holdmycatnip,2zhxd,"It fought back",0,https://v.redd.it/5v9d50dwbeac1,0.99,28,1704362273,2024-01-04T09:57:53+0000
2024-01-04T12,18y9i2b,10,2794,tumblr,2r7hk,"Mermaids and werewolves",0,https://i.redd.it/derkqtkebeac1.jpeg,0.98,15,1704362052,2024-01-04T09:54:12+0000
2024-01-04T12,18y8y1z,87,789,HonkaiStarRail,4q5zoc,"Clara mains💀💀",0,https://i.redd.it/p9e1cobr4eac1.jpeg,0.91,172,1704359809,2024-01-04T09:16:49+0000
2024-01-04T12,18y8x4v,95,760,melbourne,2qkhb,"I work in fraud and here are some things you need to know to keep safe.",1,https://www.reddit.com/r/melbourne/comments/18y8x4v/i_work_in_fraud_and_here_are_some_things_you_need/,0.97,146,1704359710,2024-01-04T09:15:10+0000
2024-01-04T12,18y8w4j,41,1253,mapporncirclejerk,2wxxs,"🇪🇺 Eurotrip 🇪🇺",0,https://i.redd.it/tisblttu3eac1.jpeg,0.97,99,1704359582,2024-01-04T09:13:02+0000
2024-01-04T12,18y8u6r,48,1119,gaming,2qh03,"Oklahoma 13-year-old believed to be first person ever to beat Tetris",0,https://www.theguardian.com/technology/2024/jan/03/oklahoma-teen-beat-tetris-first-person-willis-gibson,0.91,93,1704359375,2024-01-04T09:09:35+0000
2024-01-04T12,18y8r41,24,1815,UkraineWarVideoReport,5wjmo8,"Vadim gets emotional explaining his life in Russia",0,https://v.redd.it/aiepx2iy1eac1,0.96,123,1704359015,2024-01-04T09:03:35+0000
2024-01-04T12,18y8qsr,99,756,discordVideos,2cxozx,"convertible concentration camp",0,https://v.redd.it/mzd4ls562eac1,0.95,10,1704358981,2024-01-04T09:03:01+0000
2024-01-04T12,18y8pq7,1,11936,MadeMeSmile,2uqcm,"Parents watching their kid take his first steps",0,https://v.redd.it/tc077dox1eac1,0.98,214,1704358869,2024-01-04T09:01:09+0000
2024-01-04T12,18y8emj,71,1055,cursedcomments,hw1ju,Cursed_men,0,https://i.redd.it/8zd7g7v1ydac1.jpeg,0.96,16,1704357588,2024-01-04T08:39:48+0000
2024-01-04T12,18y8ajr,25,1929,shitposting,2usxq,"She was blessed...and she complained 💀💀",0,https://v.redd.it/uzn7tv77wdac1,0.97,167,1704357098,2024-01-04T08:31:38+0000
2024-01-04T12,18y89b4,21,2210,HolUp,qir9n,"I got problems with your wife password",0,https://v.redd.it/pqbgm84awdac1,0.93,184,1704356964,2024-01-04T08:29:24+0000
2024-01-04T12,18y88ml,91,890,2westerneurope4u,66zq15,"The non European mind cannot comprehend this",0,https://v.redd.it/nxmkcjxzvdac1,0.95,210,1704356883,2024-01-04T08:28:03+0000
2024-01-04T12,18y88aq,89,901,Animemes,2w6fe,"Step one.",0,https://i.redd.it/7moxqcwxvdac1.jpeg,0.99,21,1704356844,2024-01-04T08:27:24+0000
2024-01-04T12,18y821r,82,998,ukraine,2qqcn,"Halyna Fedyshyn, the last female Ukrainian marine in Russian captivity, is now home! She was in Mariupol and Azovstal as a combat medic from the 36th brigade and made it her principle to only speak Ukrainian while in captivity",0,https://i.redd.it/r2llgn3itdac1.jpeg,0.98,22,1704356132,2024-01-04T08:15:32+0000
2024-01-04T12,18y7y0i,68,1197,worldnews,2qh13,"Zuckerberg's Bunker Plans Fuel Speculation on Billionaires Building Bunkers",0,https://decodetoday.com/zuckerbergs-bunker-plans-fuel-speculation-on-billionaires-building-bunkers/,0.95,400,1704355691,2024-01-04T08:08:11+0000
2024-01-04T12,18y7vj7,58,1313,Genshin_Impact_Leaks,3l2acu,"4.3 Phase 2 Character and Weapon Banners",0,https://www.reddit.com/gallery/18y7vj7,0.95,354,1704355409,2024-01-04T08:03:29+0000
2024-01-04T12,18y7qos,100,920,MapPorn,2si92,"The 20 Countries that don't have people living in Frankfurt/Main (Germany)",0,https://i.redd.it/7pl08fy3qdac1.jpeg,0.97,58,1704354883,2024-01-04T07:54:43+0000
2024-01-04T12,18y7fc6,93,1046,animememes,2tcn0,"Take notes",0,https://i.redd.it/0lw38vmemdac1.png,0.96,16,1704353637,2024-01-04T07:33:57+0000
2024-01-04T12,18y76e6,13,4128,comics,2qh0s,"I'm sick today",0,https://i.redd.it/m66awibejdac1.png,0.98,24,1704352652,2024-01-04T07:17:32+0000
2024-01-04T12,18y75oi,9,5673,dankmemes,2zmfe,what,0,https://i.redd.it/169oplh8jdac1.gif,0.94,261,1704352572,2024-01-04T07:16:12+0000
2024-01-04T12,18y74c6,78,1228,Whatcouldgowrong,2x2oy,"Boat fails to clear wave",0,https://v.redd.it/695xcmpridac1,0.94,77,1704352431,2024-01-04T07:13:51+0000
2024-01-04T12,18y73t5,11,4580,Awww,2suml,"Adorable Prank by a Clever Pup",0,https://v.redd.it/lh1mlgwlidac1,0.98,32,1704352374,2024-01-04T07:12:54+0000
2024-01-04T12,18y6juf,73,1484,pcmasterrace,2sgp1,"Who else wants a 1:1 size Lego PC next to their actual PC?",0,https://i.redd.it/ade6bnddcdac1.jpeg,0.93,117,1704350263,2024-01-04T06:37:43+0000
2024-01-04T12,18y6hex,97,1239,Satisfyingasfuck,31s00,"The stone sculptures are very lifelike",0,https://v.redd.it/asz3u8cebdac1,0.96,66,1704349993,2024-01-04T06:33:13+0000
2024-01-04T12,18y6guf,57,1773,Genshin_Impact,12p4l2,"Are you kidding me",0,https://www.reddit.com/gallery/18y6guf,0.92,185,1704349932,2024-01-04T06:32:12+0000
2024-01-04T12,18y68mg,98,1256,bonehurtingjuice,3jwwf,president,0,https://i.redd.it/lm1ie5ox8dac1.jpeg,0.96,33,1704349106,2024-01-04T06:18:26+0000
2024-01-04T12,18y65v0,77,1499,DOG,2qiy5,"Money can buy you a fine dog, but only love can make him wag his tail.",0,https://v.redd.it/p2561a028dac1,0.98,18,1704348830,2024-01-04T06:13:50+0000
2024-01-04T12,18y61ks,51,7652,meirl,2s5ti,Meirl,0,https://i.redd.it/h94hhzct6dac1.jpeg,0.98,88,1704348411,2024-01-04T06:06:51+0000
2024-01-04T12,18y5zjt,40,2381,MinecraftMemes,2sq0h,...,0,https://i.redd.it/pvlmqvma6dac1.jpeg,0.94,137,1704348218,2024-01-04T06:03:38+0000
2024-01-04T12,18y5v80,2,19568,ProgrammerHumor,2tex6,programmingPeaked,0,https://i.redd.it/s2dimkb55dac1.jpeg,0.97,405,1704347833,2024-01-04T05:57:13+0000
2024-01-04T12,18y5rii,14,5646,Steam,2qwis,"Show me a single person who voted RDR2",0,https://i.redd.it/639ams414dac1.png,0.93,452,1704347479,2024-01-04T05:51:19+0000
2024-01-04T12,18y5nu7,8,8724,BatmanArkham,2y9q4,"Our insanity has reached there",0,https://i.redd.it/tdtbv9n33dac1.png,0.94,123,1704347145,2024-01-04T05:45:45+0000
2024-01-04T12,18y530y,43,2543,batman,2qqt8,"Maybe he would actually be a good Batman",0,https://v.redd.it/81hncbnfxcac1,0.93,254,1704345253,2024-01-04T05:14:13+0000
2024-01-04T12,18y51tj,4,16371,wholesomememes,3gcwj,"healthy thinking",0,https://i.redd.it/6chzygf9wcac1.png,0.94,741,1704345142,2024-01-04T05:12:22+0000
2024-01-04T12,18y506p,28,3522,me_irl,2vegg,me_irl,0,https://v.redd.it/v34sc8aqwcac1,0.94,48,1704345004,2024-01-04T05:10:04+0000
2024-01-04T12,18y4zq1,3,19119,meirl,2s5ti,meirl,0,https://v.redd.it/mtgp5y3mwcac1,0.94,253,1704344965,2024-01-04T05:09:25+0000
2024-01-04T12,18y4ze4,46,2589,Hololive,29numb,"Do I return the other one?",0,https://i.redd.it/toz8v3jhwcac1.png,0.97,30,1704344935,2024-01-04T05:08:55+0000
2024-01-04T12,18y4rfo,5,12817,Damnthatsinteresting,2xxyj,"Tsunami in the making",0,https://v.redd.it/snqu8fhducac1,0.96,355,1704344232,2024-01-04T04:57:12+0000
2024-01-04T12,18y4pl4,6,11606,Eyebleach,2s427,"ᵂᵉᵉᵉᵉ",0,https://i.imgur.com/7AJi4eR.gifv,0.98,74,1704344064,2024-01-04T04:54:24+0000
2024-01-04T12,18y4oxn,31,3478,CrazyFuckingVideos,45hae8,"IRL streamer swatted while drunk streaming, he's so out of it he has no idea what is going on",0,https://v.redd.it/yvzq2jgrtcac1,0.95,346,1704344004,2024-01-04T04:53:24+0000
2024-01-04T12,18y4lhi,44,2895,meme,2qi1r,"Good teacher",0,https://i.redd.it/rq9nou6vscac1.png,0.98,13,1704343709,2024-01-04T04:48:29+0000
2024-01-04T12,18y4fm2,19,4601,technology,2qh16,"Starbucks accused of rigging payments in app for nearly $900 million gain over 5 years by consumer watchdog group",0,https://fortune.com/2024/01/03/starbucks-app-dark-side-unspent-payments-900-million-5-years/,0.96,279,1704343195,2024-01-04T04:39:55+0000
2024-01-04T12,18y4dg1,12,11027,memes,2qjpg,"He was on the list, apparently.",0,https://i.redd.it/ykz3brvqqcac1.gif,0.96,279,1704342990,2024-01-04T04:36:30+0000
2024-01-04T12,18y46qm,64,2476,ChainsawMan,rmtrq,Congrats,0,https://i.redd.it/11bd82jzocac1.jpeg,0.97,68,1704342399,2024-01-04T04:26:39+0000
2024-01-04T12,18y3znw,90,1949,reddeadredemption,2rn7o,"Guys, I think I’ve outdone myself this time",0,https://www.reddit.com/gallery/18y3znw,0.95,98,1704341803,2024-01-04T04:16:43+0000
2024-01-04T12,18y3vtu,20,5989,therewasanattempt,39ne7,"To mind your own business",0,https://v.redd.it/29iy6j19mcac1,0.85,160,1704341478,2024-01-04T04:11:18+0000
2024-01-04T12,18y3loi,67,2668,teenagers,2rjli,"My dad bought me this for Christmas…",0,https://i.redd.it/j727940rjcac1.jpeg,0.95,276,1704340639,2024-01-04T03:57:19+0000
2024-01-04T12,18y3cev,54,2948,nba,2qo4s,"[Highlight] Jalen Duren dunks on Walker Kessler then gets on his shoulders for a piggyback ride",0,https://streamable.com/91wpjl,0.97,258,1704339876,2024-01-04T03:44:36+0000
2024-01-04T12,18y3ab7,30,4559,JustGuysBeingDudes,33rtj6,"Care for a puff of color boys?",0,https://v.redd.it/ezeacfiwgcac1,0.92,135,1704339699,2024-01-04T03:41:39+0000
2024-01-04T12,18y378h,7,23024,Unexpected,2w67q,"Everyone loves her present",0,https://v.redd.it/1f60z2y4gcac1,0.93,558,1704339434,2024-01-04T03:37:14+0000
2024-01-04T12,18y337s,16,9962,mildlyinfuriating,2ubgg,"I had a dentist fart in my face today.",1,https://www.reddit.com/r/mildlyinfuriating/comments/18y337s/i_had_a_dentist_fart_in_my_face_today/,0.93,760,1704339098,2024-01-04T03:31:38+0000
2024-01-04T12,18y30pt,60,3240,Terraria,2sg5b,"Some humanized bosses ft. the ladies :D",0,https://www.reddit.com/gallery/18y30pt,0.94,228,1704338900,2024-01-04T03:28:20+0000
2024-01-04T12,18y2ybt,55,3220,funny,2qh33,"The way mom looking at its child😂",0,https://v.redd.it/tm5m4pjzdcac1,0.87,166,1704338704,2024-01-04T03:25:04+0000
2024-01-04T12,18y2h2e,79,2656,malelivingspace,2v70p,"Office set up when I’m too tired to commute",0,https://i.redd.it/hazdz2wp9cac1.jpeg,0.92,311,1704337315,2024-01-04T03:01:55+0000
2024-01-04T12,18y291u,15,10763,nottheonion,2qnts,"'Rich Dad, Poor Dad' Robert Kiyosaki says he's $1.2 billion in debt because 'if I go bankrupt, the bank goes bankrupt.' not my problem'",0,https://biz.crast.net/rich-dad-poor-dad-robert-kiyosaki-says-hes-1-2-billion-in-debt-because-if-i-go-bankrupt-the-bank-goes-bankrupt-not-my-problem/,0.94,776,1704336683,2024-01-04T02:51:23+0000
2024-01-04T12,18y25u9,69,3163,AITAH,446kys,"AITAH for calling my Father in law a bastard after he pressured us into getting a paternity test.",1,https://www.reddit.com/r/AITAH/comments/18y25u9/aitah_for_calling_my_father_in_law_a_bastard/,0.93,340,1704336433,2024-01-04T02:47:13+0000
2024-01-04T12,18y22ma,18,9290,NonPoliticalTwitter,39gt6y,Y2K,0,https://i.redd.it/skvz6ieh6cac1.jpeg,0.96,101,1704336175,2024-01-04T02:42:55+0000
2024-01-04T12,18y22j6,83,2755,SweatyPalms,2v567,"This is dangerous as fuck",0,https://v.redd.it/neutpgag6cac1,0.9,325,1704336167,2024-01-04T02:42:47+0000
2024-01-04T12,18y1xch,29,5780,mildlyinteresting,2ti4h,"The fake phone number I use to get a grocery discount already has saved people $1471.79 this year",0,https://i.redd.it/7g7v41t25cac1.jpeg,0.96,283,1704335765,2024-01-04T02:36:05+0000
2024-01-04T12,18y1mox,52,4228,theydidthemath,2x23b,"[REQUEST] How small would the earth have to be for the bottom to be true?",0,https://i.redd.it/1sc3c7xt2cac1.jpeg,0.94,201,1704334947,2024-01-04T02:22:27+0000
2024-01-04T12,18y1gxn,17,20353,facepalm,2r5rp,"Keep it simple stupid",0,https://i.redd.it/4wtyo5vg1cac1.jpeg,0.92,1015,1704334500,2024-01-04T02:15:00+0000
2024-01-04T12,18y10x1,34,5818,aww,2qh1o,"My boy will be 20 this year, and he's still majestic AF",0,https://www.reddit.com/gallery/18y10x1,0.96,100,1704333308,2024-01-04T01:55:08+0000
2024-01-04T12,18y0r7x,47,5031,oddlyspecific,2wjlc,"Time to grab the pitchforks.",0,https://i.redd.it/7r1ffo6svbac1.jpeg,0.93,837,1704332576,2024-01-04T01:42:56+0000
2024-01-04T12,18y0irm,50,4821,AskReddit,2qh1i,"What hobby is an instant red flag?",1,https://www.reddit.com/r/AskReddit/comments/18y0irm/what_hobby_is_an_instant_red_flag/,0.92,4745,1704331942,2024-01-04T01:32:22+0000
2024-01-04T12,18y0b39,62,4914,technicallythetruth,3pzez,"No, she's got the Point",0,https://i.redd.it/7ugu3un5sbac1.png,0.96,54,1704331370,2024-01-04T01:22:50+0000
2024-01-04T12,18y0b0d,23,10004,BlackPeopleTwitter,33x33,"Man was movin like Polamalu",0,https://v.redd.it/rhxvqtr5sbac1,0.94,607,1704331364,2024-01-04T01:22:44+0000
2024-01-04T12,18y04ar,53,5201,BaldursGate3,12967t,"It's tough being the protagonist",0,https://i.redd.it/989j244mqbac1.jpeg,0.94,219,1704330874,2024-01-04T01:14:34+0000
2024-01-04T12,18xzzjq,22,12229,ContagiousLaughter,2u2bh,"Drill Sergeant Daddy",0,https://v.redd.it/g2bv4nahpbac1,0.93,300,1704330526,2024-01-04T01:08:46+0000
2024-01-04T12,18xzu86,27,8194,politics,2cneq,"Clinton and Trump are named in Jeffrey Epstein documents, no wrongdoing alleged",0,https://www.usatoday.com/story/news/politics/2024/01/03/jeffrey-epstein-list-clinton-trump/72086945007/,0.94,1514,1704330129,2024-01-04T01:02:09+0000
2024-01-04T12,18xzfk8,63,5035,gifs,2qt55,"Automatic Candle Extinguisher from 1841",0,https://i.imgur.com/LwWYEaJ.gifv,0.93,114,1704329087,2024-01-04T12:44:47+0000
2024-01-04T12,18xze67,85,33182,MadeMeSmile,2uqcm,"Winning! Final hematologist appointment, cancer free! Acute Myeloid Leukemia in remission, cheers with me.",0,https://i.redd.it/1f6qdhr3lbac1.jpeg,0.95,611,1704328985,2024-01-04T12:43:05+0000
2024-01-04T12,18xyvrx,92,4402,FUCKYOUINPARTICULAR,3538a,"From r/foundsatan 😶",0,https://i.redd.it/we6prpa6hbac1.jpeg,0.93,292,1704327664,2024-01-04T12:21:04+0000
2024-01-04T12,18xykou,76,5301,TopCharacterDesigns,86ohyi,"West of Loathing Concept Art vs In-Game:",0,https://www.reddit.com/gallery/18xykou,0.95,98,1704326873,2024-01-04T12:07:53+0000
2024-01-04T12,18xykgz,59,7403,perfectlycutscreams,3n7fs,"the best one I've seen",0,https://v.redd.it/xpst531sebac1,0.9,64,1704326858,2024-01-04T12:07:38+0000
2024-01-04T12,18xy6fb,61,7371,PrequelMemes,3i60n,"The truth was out there",0,https://v.redd.it/ig62pijnbbac1,0.97,48,1704325879,2024-01-03T11:51:19+0000
2024-01-04T12,18xxryv,65,6570,cats,2qhta,"Wife kept saying my snoring was waking her up but as it turns out….",0,https://v.redd.it/5vd5ck4y8bac1,0.99,94,1704324898,2024-01-03T11:34:58+0000
2024-01-04T12,18xxkam,42,10523,rareinsults,48t85,"Cute- 😍😍 Not cute- ☹️☹️",0,https://i.redd.it/ra7998je7bac1.jpeg,0.95,124,1704324378,2024-01-03T11:26:18+0000
2024-01-04T12,18xxgy3,56,8246,KidsAreFuckingStupid,3948y,"He did not care one bit",0,https://v.redd.it/bpzvgolp6bac1,0.92,435,1704324144,2024-01-03T11:22:24+0000
2024-01-04T12,18xxgk2,72,6291,AbruptChaos,3nasz,"A judge in Las Vegas is attacked during a live hearing after she denied probation",0,https://v.redd.it/g20it3wm6bac1,0.94,1053,1704324119,2024-01-03T11:21:59+0000
2024-01-04T12,18xx4un,26,16914,todayilearned,2qqjc,"TIL: Short Sleeper Syndrome is a gene mutation discovered by the University of Pittsburgh in 2014. They can function normally with less than 6 hours of sleep and never need to ""recover"" from lack of sleep as opposed to people who purposefully limit sleep. The mutation was given to mice and worked.",0,https://www.healthline.com/health/sleep/natural-short-sleeper,0.96,1135,1704323332,2024-01-03T11:08:52+0000
2024-01-04T12,18xx0vg,39,11394,lego,2qhm7,"I made a brass armor for Lego",0,https://www.reddit.com/gallery/18xx0vg,0.98,252,1704323060,2024-01-03T11:04:20+0000
2024-01-04T12,18xwz76,49,9910,oddlysatisfying,2x93b,"Candle Perfectly Fits Under The Glass",0,https://v.redd.it/s3v9pqq43bac1,0.84,222,1704322942,2024-01-03T11:02:22+0000
2024-01-04T12,18xwdo4,38,13662,pics,2qh0u,"Black children watching as white children play in a only whites park, 1955",0,https://i.redd.it/nwmr2p1wyaac1.jpeg,0.9,1130,1704321515,2024-01-03T10:38:35+0000
2024-01-04T12,18xw9j8,84,6614,iamatotalpieceofshit,3jj03,"Man attacks Las Vegas judge during sentencing today",0,https://v.redd.it/ibt7lqf0yaac1,0.94,1064,1704321233,2024-01-03T10:33:53+0000
2024-01-04T12,18xvyop,32,24360,NatureIsFuckingLit,3gdh7,"🔥 Chimp experiences freedom from a cage for the first time in 28 years 🔥 ",0,https://v.redd.it/sqwyz2osvaac1,0.95,853,1704320493,2024-01-03T10:21:33+0000
2024-01-04T12,18xvt2s,96,6174,MaliciousCompliance,3boqz,"Boss introduces new timetracking tool to ""avoid time manipulation"", backfires on him",1,https://www.reddit.com/r/MaliciousCompliance/comments/18xvt2s/boss_introduces_new_timetracking_tool_to_avoid/,0.96,265,1704320117,2024-01-03T10:15:17+0000
2024-01-04T12,18xvodd,70,9105,vegaslocals,2xdzp,"Man Attacks Vegas Judge During Sentencing Today",0,https://v.redd.it/7lu5w2qotaac1,0.95,2027,1704319804,2024-01-03T10:10:04+0000
2024-01-04T12,18xvo5t,37,24450,BeAmazed,363r3,"Absolute Badass",0,https://i.imgur.com/NLABMUv.jpeg,0.92,457,1704319789,2024-01-03T10:09:49+0000
2024-01-04T12,18xvltp,45,14831,nextfuckinglevel,m0bnr,"Man reveals the technique that could have been used on Stonehedge",0,https://v.redd.it/e33rao0vpaac1,0.93,511,1704319633,2024-01-03T10:07:13+0000
2024-01-04T12,18xvio8,33,19222,PublicFreakout,2yrq6,"A Man Attacked a Las Vegas Judge During Sentencing Today",0,https://v.redd.it/0klbaupjsaac1,0.96,3251,1704319419,2024-01-03T10:03:39+0000
2024-01-04T12,18xvdhi,74,9416,wizardposting,5hjlp1,"You fools! You absolute fools!",0,https://i.redd.it/7es49kloraac1.jpeg,0.96,221,1704319090,2024-01-03T09:58:10+0000
2024-01-04T12,18xvbu1,35,19838,interestingasfuck,2qhsa,"Beachgoers have a close encounter with a Cassowary ",0,https://v.redd.it/lyp451lbraac1,0.94,2149,1704318974,2024-01-03T09:56:14+0000
2024-01-04T12,18xv6zs,36,19622,WhitePeopleTwitter,35n7t,"Oh please do go there! Who wants popcorn?",0,https://i.redd.it/ld61kqybqaac1.jpeg,0.95,956,1704318638,2024-01-03T09:50:38+0000
2024-01-04T12,18xu3p1,81,10344,FluentInFinance,3qpaq8,"Should Student Loans be Forgiven like PPP Loans were?",0,https://i.redd.it/n1r2tyxdiaac1.png,0.88,1122,1704315991,2024-01-03T09:06:31+0000
2024-01-04T12,18xtyve,80,12816,clevercomebacks,dyqlw,"Just like the women he's been with, he never saw this coming",0,https://i.redd.it/8k421j5ihaac1.png,0.87,800,1704315668,2024-01-03T09:01:08+0000
2024-01-04T12,18xtxnp,86,9387,TikTokCringe,mvcq5,"That's a blessin",0,https://v.redd.it/2nlz5br5haac1,0.95,210,1704315599,2024-01-03T08:59:59+0000
2024-01-04T12,18xs90u,88,18243,SipsTea,5tdqj0,"But friend shape...",0,https://v.redd.it/ertmyfr25aac1,0.9,549,1704311488,2024-01-03T07:51:28+0000
2024-01-04T12,18xqr6r,94,21031,FunnyAnimals,2st2l,"Dog thought he was home alone ",0,https://v.redd.it/bc2fgd5nu9ac1,0.96,176,1704307979,2024-01-03T06:52:59+0000
2024-01-04T12,18xqr1b,75,28790,news,2qh3l,"Names in Jeffrey Epstein court documents to be unsealed in New York on Wednesday",0,https://www.cnbc.com/2024/01/03/jeffrey-epstein-court-document-names-unsealed-wednesday-.html,0.94,2649,1704307970,2024-01-03T06:52:50+0000
2024-01-04T11,18y8r41,58,957,UkraineWarVideoReport,5wjmo8,"Vadim gets emotional explaining his life in Russia",0,https://v.redd.it/aiepx2iy1eac1,0.98,84,1704359015,2024-01-04T09:03:35+0000
2024-01-04T11,18y8pq7,4,3940,MadeMeSmile,2uqcm,"Parents watching their kid take his first steps",0,https://v.redd.it/tc077dox1eac1,0.99,98,1704358869,2024-01-04T09:01:09+0000
2024-01-04T11,18y7vj7,67,1059,Genshin_Impact_Leaks,3l2acu,"4.3 Phase 2 Character and Weapon Banners",0,https://www.reddit.com/gallery/18y7vj7,0.96,298,1704355409,2024-01-04T08:03:29+0000
2024-01-04T11,18y7qqf,42,1485,HolUp,qir9n,hahhha,0,https://v.redd.it/4wid3ei2qdac1,0.85,86,1704354888,2024-01-04T07:54:48+0000
2024-01-04T11,18y76e6,23,2185,comics,2qh0s,"I'm sick today",0,https://i.redd.it/m66awibejdac1.png,0.98,19,1704352652,2024-01-04T07:17:32+0000
2024-01-04T11,18y75oi,14,3631,dankmemes,2zmfe,what,0,https://i.redd.it/169oplh8jdac1.gif,0.95,165,1704352572,2024-01-04T07:16:12+0000
2024-01-04T11,18y73t5,22,2486,Awww,2suml,"Adorable Prank by a Clever Pup",0,https://v.redd.it/lh1mlgwlidac1,0.98,20,1704352374,2024-01-04T07:12:54+0000
2024-01-04T11,18y6guf,63,1452,Genshin_Impact,12p4l2,"Are you kidding me",0,https://www.reddit.com/gallery/18y6guf,0.92,168,1704349932,2024-01-04T06:32:12+0000
2024-01-04T11,18y658r,8,5679,pcmasterrace,2sgp1,"Edge's pdf reader is best I've ever seen.",0,https://i.redd.it/9lo2c1id7dac1.png,0.95,346,1704348765,2024-01-04T06:12:45+0000
2024-01-04T11,18y61ks,33,5355,meirl,2s5ti,Meirl,0,https://i.redd.it/h94hhzct6dac1.jpeg,0.98,68,1704348411,2024-01-04T06:06:51+0000
2024-01-04T11,18y5zjt,57,1665,MinecraftMemes,2sq0h,...,0,https://i.redd.it/pvlmqvma6dac1.jpeg,0.95,103,1704348218,2024-01-04T06:03:38+0000
2024-01-04T11,18y5v80,1,14763,ProgrammerHumor,2tex6,programmingPeaked,0,https://i.redd.it/s2dimkb55dac1.jpeg,0.97,325,1704347833,2024-01-04T05:57:13+0000
2024-01-04T11,18y5rii,15,3959,Steam,2qwis,"Show me a single person who voted RDR2",0,https://i.redd.it/639ams414dac1.png,0.94,308,1704347479,2024-01-04T05:51:19+0000
2024-01-04T11,18y5nu7,9,6657,BatmanArkham,2y9q4,"Our insanity has reached there",0,https://i.redd.it/tdtbv9n33dac1.png,0.95,104,1704347145,2024-01-04T05:45:45+0000
2024-01-04T11,18y5huf,10,7528,memes,2qjpg,"Crawls back into my Shell",0,https://i.redd.it/qttb6gzh1dac1.jpeg,0.83,845,1704346607,2024-01-04T05:36:47+0000
2024-01-04T11,18y530y,68,1782,batman,2qqt8,"Maybe he would actually be a good Batman",0,https://v.redd.it/81hncbnfxcac1,0.94,199,1704345253,2024-01-04T05:14:13+0000
2024-01-04T11,18y51tj,3,13173,wholesomememes,3gcwj,"healthy thinking",0,https://i.redd.it/6chzygf9wcac1.png,0.95,630,1704345142,2024-01-04T05:12:22+0000
2024-01-04T11,18y506p,40,2568,me_irl,2vegg,me_irl,0,https://v.redd.it/v34sc8aqwcac1,0.96,32,1704345004,2024-01-04T05:10:04+0000
2024-01-04T11,18y4zq1,2,14299,meirl,2s5ti,meirl,0,https://v.redd.it/mtgp5y3mwcac1,0.95,191,1704344965,2024-01-04T05:09:25+0000
2024-01-04T11,18y4ze4,54,2082,Hololive,29numb,"Do I return the other one?",0,https://i.redd.it/toz8v3jhwcac1.png,0.99,24,1704344935,2024-01-04T05:08:55+0000
2024-01-04T11,18y4rfo,6,9351,Damnthatsinteresting,2xxyj,"Tsunami in the making",0,https://v.redd.it/snqu8fhducac1,0.96,287,1704344232,2024-01-04T04:57:12+0000
2024-01-04T11,18y4pl4,7,8105,Eyebleach,2s427,"ᵂᵉᵉᵉᵉ",0,https://i.imgur.com/7AJi4eR.gifv,0.98,60,1704344064,2024-01-04T04:54:24+0000
2024-01-04T11,18y4oxn,38,2826,CrazyFuckingVideos,45hae8,"IRL streamer swatted while drunk streaming, he's so out of it he has no idea what is going on",0,https://v.redd.it/yvzq2jgrtcac1,0.95,299,1704344004,2024-01-04T04:53:24+0000
2024-01-04T11,18y4lhi,90,1596,meme,2qi1r,"Good teacher",0,https://i.redd.it/rq9nou6vscac1.png,0.98,5,1704343709,2024-01-04T04:48:29+0000
2024-01-04T11,18y4fm2,26,3389,technology,2qh16,"Starbucks accused of rigging payments in app for nearly $900 million gain over 5 years by consumer watchdog group",0,https://fortune.com/2024/01/03/starbucks-app-dark-side-unspent-payments-900-million-5-years/,0.96,200,1704343195,2024-01-04T04:39:55+0000
2024-01-04T11,18y4dg1,43,7770,memes,2qjpg,"He was on the list, apparently.",0,https://i.redd.it/ykz3brvqqcac1.gif,0.96,187,1704342990,2024-01-04T04:36:30+0000
2024-01-04T11,18y46qm,73,2007,ChainsawMan,rmtrq,Congrats,0,https://i.redd.it/11bd82jzocac1.jpeg,0.97,55,1704342399,2024-01-04T04:26:39+0000
2024-01-04T11,18y423v,94,3655,facepalm,2r5rp,"Fun fact: This isnt true",0,https://i.redd.it/6w24bc3rncac1.png,0.94,339,1704342007,2024-01-04T04:20:07+0000
2024-01-04T11,18y3znw,99,1592,reddeadredemption,2rn7o,"Guys, I think I’ve outdone myself this time",0,https://www.reddit.com/gallery/18y3znw,0.96,86,1704341803,2024-01-04T04:16:43+0000
2024-01-04T11,18y3vtu,21,5074,therewasanattempt,39ne7,"To mind your own business",0,https://v.redd.it/29iy6j19mcac1,0.86,143,1704341478,2024-01-04T04:11:18+0000
2024-01-04T11,18y3loi,75,2235,teenagers,2rjli,"My dad bought me this for Christmas…",0,https://i.redd.it/j727940rjcac1.jpeg,0.96,248,1704340639,2024-01-04T03:57:19+0000
2024-01-04T11,18y3cev,52,2649,nba,2qo4s,"[Highlight] Jalen Duren dunks on Walker Kessler then gets on his shoulders for a piggyback ride",0,https://streamable.com/91wpjl,0.97,234,1704339876,2024-01-04T03:44:36+0000
2024-01-04T11,18y3ab7,36,3626,JustGuysBeingDudes,33rtj6,"Care for a puff of color boys?",0,https://v.redd.it/ezeacfiwgcac1,0.93,119,1704339699,2024-01-04T03:41:39+0000
2024-01-04T11,18y378h,5,19772,Unexpected,2w67q,"Everyone loves her present",0,https://v.redd.it/1f60z2y4gcac1,0.94,520,1704339434,2024-01-04T03:37:14+0000
2024-01-04T11,18y337s,13,8705,mildlyinfuriating,2ubgg,"I had a dentist fart in my face today.",1,https://www.reddit.com/r/mildlyinfuriating/comments/18y337s/i_had_a_dentist_fart_in_my_face_today/,0.94,690,1704339098,2024-01-04T03:31:38+0000
2024-01-04T11,18y31ml,17,6870,tumblr,2r7hk,"ngl I feel like Dio would be a fun coworker to have",0,https://i.redd.it/1h1lcmnrecac1.jpeg,0.96,87,1704338978,2024-01-04T03:29:38+0000
2024-01-04T11,18y30pt,56,2857,Terraria,2sg5b,"Some humanized bosses ft. the ladies :D",0,https://www.reddit.com/gallery/18y30pt,0.94,208,1704338900,2024-01-04T03:28:20+0000
2024-01-04T11,18y2ybt,60,2643,funny,2qh33,"The way mom looking at its child😂",0,https://v.redd.it/tm5m4pjzdcac1,0.88,147,1704338704,2024-01-04T03:25:04+0000
2024-01-04T11,18y2qe5,18,5946,todayilearned,2qqjc,"TIL That the dried up white dog poop common before the '90s was due to dog food containing too much calcium and bone meal.",0,https://www.iflscience.com/why-was-white-dog-poop-so-common-before-the-90s-66581,0.97,223,1704338071,2024-01-04T03:14:31+0000
2024-01-04T11,18y2h2e,88,2224,malelivingspace,2v70p,"Office set up when I’m too tired to commute",0,https://i.redd.it/hazdz2wp9cac1.jpeg,0.93,269,1704337315,2024-01-04T03:01:55+0000
2024-01-04T11,18y291u,11,9770,nottheonion,2qnts,"'Rich Dad, Poor Dad' Robert Kiyosaki says he's $1.2 billion in debt because 'if I go bankrupt, the bank goes bankrupt.' not my problem'",0,https://biz.crast.net/rich-dad-poor-dad-robert-kiyosaki-says-hes-1-2-billion-in-debt-because-if-i-go-bankrupt-the-bank-goes-bankrupt-not-my-problem/,0.95,705,1704336683,2024-01-04T02:51:23+0000
