date,id,position,score,subreddit_display_name,subreddit_id,title,is_self,url,upvote_ratio,num_comments,created,created_date
2024-01-04T03,18xrqgo,92,3601,maybemaybemaybe,38e1l,"Maybe Maybe Maybe ",0,https://v.redd.it/2xrpegvy0aac1,0.8,226,1704310262,2024-01-03T07:31:02+0000
2024-01-04T03,18xrmgi,83,3738,CuratedTumblr,3x5kfw,"Chinese rocks",0,https://www.reddit.com/gallery/18xrmgi,0.97,60,1704310001,2024-01-03T07:26:41+0000
2024-01-04T03,18xr7e1,98,3495,Money,2qjmw,"Just made my first 1000$ in high school",0,https://i.redd.it/g5gy8i3rx9ac1.jpeg,0.79,235,1704309026,2024-01-03T07:10:26+0000
2024-01-04T03,18xr2r3,61,5997,whenthe,23gidu,Perspectives,0,https://v.redd.it/77zxwghuw9ac1,0.93,184,1704308728,2024-01-03T07:05:28+0000
2024-01-04T03,18xqtcm,88,3837,AskReddit,2qh1i,"What’s the craziest WW2 fact that you know of?",1,https://www.reddit.com/r/AskReddit/comments/18xqtcm/whats_the_craziest_ww2_fact_that_you_know_of/,0.93,3986,1704308119,2024-01-03T06:55:19+0000
2024-01-04T03,18xqt09,45,6983,TrueOffMyChest,2yuqy,"My soon to be ex-husband humiliated me on our wedding day and met his karma instantly.",1,https://www.reddit.com/r/TrueOffMyChest/comments/18xqt09/my_soon_to_be_exhusband_humiliated_me_on_our/,0.9,1316,1704308101,2024-01-03T06:55:01+0000
2024-01-04T03,18xqsk8,14,14693,pics,2qh0u,"Temporary NYPD headquarters at a Burger King, 9/11/2001",0,https://i.redd.it/38fxac5wu9ac1.jpeg,0.96,457,1704308073,2024-01-03T06:54:33+0000
2024-01-04T03,18xqr6r,19,12617,FunnyAnimals,2st2l,"Dog thought he was home alone ",0,https://v.redd.it/bc2fgd5nu9ac1,0.97,123,1704307979,2024-01-03T06:52:59+0000
2024-01-04T03,18xqr1b,10,21837,news,2qh3l,"Names in Jeffrey Epstein court documents to be unsealed in New York on Wednesday",0,https://www.cnbc.com/2024/01/03/jeffrey-epstein-court-document-names-unsealed-wednesday-.html,0.95,2153,1704307970,2024-01-03T06:52:50+0000
2024-01-04T03,18xqqfi,69,5104,notinteresting,2u0xf,"My crush returned back the birthday gift I gave her today",0,https://i.redd.it/t7y5j9whu9ac1.jpeg,0.92,471,1704307931,2024-01-03T06:52:11+0000
2024-01-04T03,18xqmsj,40,6919,TwoXChromosomes,2r2jt,"He left and I barely noticed.",1,https://www.reddit.com/r/TwoXChromosomes/comments/18xqmsj/he_left_and_i_barely_noticed/,0.9,308,1704307693,2024-01-03T06:48:13+0000
2024-01-04T03,18xqlpm,50,16707,WhitePeopleTwitter,35n7t,"Trump's Version of 'America First'",0,https://i.redd.it/c8lvm1cit9ac1.png,0.94,635,1704307620,2024-01-03T06:47:00+0000
2024-01-04T03,18xqio1,17,16950,meirl,2s5ti,meirl,0,https://i.redd.it/uc11q2vys9ac1.jpeg,0.97,86,1704307415,2024-01-03T06:43:35+0000
2024-01-04T03,18xqelw,65,5601,Steam,2qwis,"POV: You woke up the next day and realized that the whole Game Award was a bad dream",0,https://i.redd.it/lfngtbe3s9ac1.png,0.87,447,1704307150,2024-01-03T06:39:10+0000
2024-01-04T03,18xq76w,52,18789,politics,2cneq,"Conservatives Are Having a Meltdown Over Trump and the Epstein List: Donald Trump’s biggest supporters are freaking out over the anticipated unveiling.",0,https://newrepublic.com/post/177828/conservatives-meltdown-trump-epstein-list,0.91,2379,1704306643,2024-01-03T06:30:43+0000
2024-01-04T03,18xq5a0,43,6990,technology,2qh16,"23andMe tells victims it's their fault that their data was breached",0,https://techcrunch.com/2024/01/03/23andme-tells-victims-its-their-fault-that-their-data-was-breached/,0.96,652,1704306520,2024-01-03T06:28:40+0000
2024-01-04T03,18xq16a,23,16372,BikiniBottomTwitter,3deqz,"Gary hit em wit the",0,https://v.redd.it/koc84toep9ac1,0.91,328,1704306237,2024-01-03T06:23:57+0000
2024-01-04T03,18xpyab,80,4610,NoStupidQuestions,2w844,"In the 80s did parents really just let their kids go out wherever or is this only in movies?",1,https://www.reddit.com/r/NoStupidQuestions/comments/18xpyab/in_the_80s_did_parents_really_just_let_their_kids/,0.92,6773,1704306043,2024-01-03T06:20:43+0000
2024-01-04T03,18xpx54,27,11056,holdmycatnip,2zhxd,"Have a look at this businessman!",0,https://v.redd.it/5wbxadclo9ac1,0.97,91,1704305971,2024-01-03T06:19:31+0000
2024-01-04T03,18xprtx,41,9687,Unexpected,2w67q,"Looking for her dog",0,https://v.redd.it/axf945gin9ac1,0.91,169,1704305606,2024-01-03T06:13:26+0000
2024-01-04T03,18xpq9m,57,16941,todayilearned,2qqjc,"TIL in 1609, Manhattan supported more ecological diversity per acre than Yellowstone National Park. Research suggests that had Manhattan never been developed, it would be one of the most important national parks",0,https://secretnyc.co/manhattan-used-one-giant-lush-park-looked-like/,0.95,608,1704305502,2024-01-03T06:11:42+0000
2024-01-04T03,18xpe1t,28,13206,MurderedByWords,3hx3r,"It's clear as can be",0,https://i.redd.it/t013eymuk9ac1.jpeg,0.9,250,1704304712,2024-01-03T05:58:32+0000
2024-01-04T03,18xp5v3,84,5011,IllegallySmolCats,23e19j,"Smol meow ",0,https://v.redd.it/kd607t72j9ac1,0.97,54,1704304155,2024-01-03T05:49:15+0000
2024-01-04T03,18xoxdh,62,7319,ExplainTheJoke,2vmj2,"My friends in Tech found this hilarious. Captioned ""Stack Overflow, In a nutshell"". Please help.",0,https://i.redd.it/xmeqbzjlh9ac1.jpeg,0.96,135,1704303592,2024-01-03T05:39:52+0000
2024-01-04T03,18xoupq,22,20171,cats,2qhta,"Man goes for 21K hike, discovers Lost Kitten, and Adopts it. Changes channel from a Hiking Channel to a Cat Channel.",0,https://v.redd.it/ebaoev85g9ac1,0.94,572,1704303415,2024-01-03T05:36:55+0000
2024-01-04T03,18xoujs,48,9166,PrequelMemes,3i60n,"Someone took the English subtitles of a pirated Chinese copy of Revenge of the Sith and turned them into a dub of the original movie",0,https://v.redd.it/qn9ejxl0h9ac1,0.96,329,1704303405,2024-01-03T05:36:45+0000
2024-01-04T03,18xoqm4,31,13985,nbacirclejerk,2td2i,"Since my friend pissed me off: he's both zprolgt and mrsonsfan. They're the same person. You're welcome.",0,https://i.redd.it/6cvalohzf9ac1.png,0.91,968,1704303135,2024-01-03T05:32:15+0000
2024-01-04T03,18xogx0,24,26770,me_irl,2vegg,Me_irl,0,https://i.redd.it/t615lg9ee9ac1.jpeg,0.96,462,1704302516,2024-01-03T05:21:56+0000
2024-01-04T03,18xo2fz,97,5238,FunnyandSad,2z7qd,"He was right",0,https://i.redd.it/iduc0rrwa9ac1.png,0.96,14,1704301352,2024-01-03T05:02:32+0000
2024-01-04T03,18xnu1w,91,5916,fightporn,2u5un,"Keep calm and wait for the right moment)",0,https://v.redd.it/hf2v49kh89ac1,0.96,330,1704300599,2024-01-03T04:49:59+0000
2024-01-04T03,18xn8xa,67,10556,lotrmemes,2v0i1,"*using Pippin because he wouldn’t have read them",0,https://i.redd.it/zdhohfjp39ac1.jpeg,0.92,2452,1704298922,2024-01-03T04:22:02+0000
2024-01-04T03,18xmz0a,64,9146,JeffArcuri,740oig,"Bathroom prank",0,https://v.redd.it/ogur2zul19ac1,0.93,141,1704298228,2024-01-03T04:10:28+0000
2024-01-04T03,18xmie9,95,7543,shittymoviedetails,3mj3w,"In The Last Jedi(2017), Finn and Rose save horses from captivity while not saving the child slaves. The movie was then awarded an Oscar from PETA.",0,https://i.redd.it/gpgg5jv0y8ac1.jpeg,0.93,373,1704297061,2024-01-03T03:51:01+0000
2024-01-04T03,18xlz2c,54,14168,WorkReform,5qpzgw,"Hustle culture is not normal.",0,https://i.redd.it/3qynn1mwt8ac1.jpeg,0.93,452,1704295649,2024-01-03T03:27:29+0000
2024-01-04T03,18xlnne,74,11046,comics,2qh0s,"[oc] DISGUSTING",0,https://i.redd.it/dylf065hr8ac1.jpeg,0.95,186,1704294808,2024-01-03T03:13:28+0000
2024-01-04T03,18xlf52,55,14159,worldnews,2qh13,"NATO to buy 1,000 Patriot missiles in face of Russia threat",0,https://www.thedefensepost.com/2024/01/03/nato-buys-patriot-missiles/?expand_article=1,0.95,1281,1704294186,2024-01-03T03:03:06+0000
2024-01-04T03,18xl64i,79,17334,sadposting,5203f0,"Social Experiment",0,https://v.redd.it/bt5xnuljn8ac1,0.84,5033,1704293509,2024-01-03T02:51:49+0000
2024-01-04T02,18xze67,27,2381,MadeMeSmile,2uqcm,"Winning! Final hematologist appointment, cancer free! Acute Myeloid Leukemia in remission, cheers with me.",0,https://i.redd.it/1f6qdhr3lbac1.jpeg,0.98,86,1704328985,2024-01-04T12:43:05+0000
2024-01-04T02,18xyyx0,67,1484,aww,2qh1o,"I turned on the lights to my vanity, then went to the bathroom quickly to brush my teeth. This is the situation I returned to….",0,https://i.redd.it/7yn9qfmthbac1.jpeg,0.98,45,1704327886,2024-01-04T12:24:46+0000
2024-01-04T02,18xykou,97,1150,TopCharacterDesigns,86ohyi,"West of Loathing Concept Art vs In-Game:",0,https://www.reddit.com/gallery/18xykou,0.98,29,1704326873,2024-01-04T12:07:53+0000
2024-01-04T02,18xxm1g,81,1463,nba,2qo4s,"Bill Simmons says Shai Gilgeous-Alexander is better than Jayson Tatum “SGA is a Top 5 guy in the league now”",0,https://www.theringer.com/bill-simmons,0.93,743,1704324500,2024-01-03T11:28:20+0000
2024-01-04T02,18xxgy3,80,1522,KidsAreFuckingStupid,3948y,"He did not care one bit",0,https://v.redd.it/bpzvgolp6bac1,0.94,128,1704324144,2024-01-03T11:22:24+0000
2024-01-04T02,18xxgk2,62,1845,AbruptChaos,3nasz,"A judge in Las Vegas is attacked during a live hearing after she denied probation",0,https://v.redd.it/g20it3wm6bac1,0.96,371,1704324119,2024-01-03T11:21:59+0000
2024-01-04T02,18xxfgu,95,1378,Deltarune,qmi8w,"think about it",0,https://i.redd.it/dsb469zd6bac1.png,0.98,41,1704324044,2024-01-03T11:20:44+0000
2024-01-04T02,18xx4un,82,3052,todayilearned,2qqjc,"TIL: Short Sleeper Syndrome is a gene mutation discovered by the University of Pittsburgh in 2014. They can function normally with less than 6 hours of sleep and never need to ""recover"" from lack of sleep as opposed to people who purposefully limit sleep. The mutation was given to mice and worked.",0,https://www.healthline.com/health/sleep/natural-short-sleeper,0.98,206,1704323332,2024-01-03T11:08:52+0000
2024-01-04T02,18xx2ce,12,4831,me_irl,2vegg,"me irl",0,https://i.redd.it/x735ktgr3bac1.png,0.96,63,1704323160,2024-01-03T11:06:00+0000
2024-01-04T02,18xx0vg,87,1519,lego,2qhm7,"I made a brass armor for Lego",0,https://www.reddit.com/gallery/18xx0vg,0.98,86,1704323060,2024-01-03T11:04:20+0000
2024-01-04T02,18xx084,92,1461,CatDistributionSystem,7l5bxn,"We stopped at a gas station and got back in car to find this lad in the backseat.",0,https://i.redd.it/2r2i7hpc3bac1.jpeg,0.97,94,1704323015,2024-01-03T11:03:35+0000
2024-01-04T02,18xwz76,51,2177,oddlysatisfying,2x93b,"Candle Perfectly Fits Under The Glass",0,https://v.redd.it/s3v9pqq43bac1,0.87,81,1704322942,2024-01-03T11:02:22+0000
2024-01-04T02,18xwwuw,60,2029,nottheonion,2qnts,"Father says his daughter’s car is melting in the driveway. Honda says it’s not covered by warranty",0,https://www.wsbtv.com/news/local/dekalb-county/father-says-his-daughters-car-is-melting-driveway-honda-says-its-not-covered-by-warranty/SYEKOWWHKVBORBR4NMYKVOALW4/,0.94,126,1704322798,2024-01-03T10:59:58+0000
2024-01-04T02,18xwn8n,2,12223,technicallythetruth,3pzez,"Well, I think he got a really good point",0,https://i.redd.it/8pa4b7gd0bac1.png,0.97,273,1704322139,2024-01-03T10:48:59+0000
2024-01-04T02,18xwkm5,46,2515,CrazyFuckingVideos,45hae8,"Man attacks Las Vegas judge after she denies his probation",0,https://v.redd.it/bf5hk7p80bac1,0.96,371,1704321969,2024-01-03T10:46:09+0000
2024-01-04T02,18xwh27,90,1582,NewsOfTheStupid,2tpr6,"Trump’s Idiot Lawyer Just Admitted He May Be Guilty of Insurrection",0,https://newrepublic.com/post/177822/trump-idiot-lawyer-admit-may-guilty-insurrection,0.95,119,1704321734,2024-01-03T10:42:14+0000
2024-01-04T02,18xw9j8,31,3246,iamatotalpieceofshit,3jj03,"Man attacks Las Vegas judge during sentencing today",0,https://v.redd.it/ibt7lqf0yaac1,0.96,666,1704321233,2024-01-03T10:33:53+0000
2024-01-04T02,18xw9fl,18,4639,tumblr,2r7hk,"This is extremely real",0,https://i.redd.it/ko7w6v41yaac1.jpeg,0.96,55,1704321227,2024-01-03T10:33:47+0000
2024-01-04T02,18xvzdn,1,18219,mildlyinteresting,2ti4h,"Bubbles in my coffee this morning",0,https://i.redd.it/i45ex2nzvaac1.png,0.89,1467,1704320541,2024-01-03T10:22:21+0000
2024-01-04T02,18xvyop,6,8611,NatureIsFuckingLit,3gdh7,"🔥 Chimp experiences freedom from a cage for the first time in 28 years 🔥 ",0,https://v.redd.it/sqwyz2osvaac1,0.96,354,1704320493,2024-01-03T10:21:33+0000
2024-01-04T02,18xvt2s,71,1951,MaliciousCompliance,3boqz,"Boss introduces new timetracking tool to ""avoid time manipulation"", backfires on him",1,https://www.reddit.com/r/MaliciousCompliance/comments/18xvt2s/boss_introduces_new_timetracking_tool_to_avoid/,0.97,106,1704320117,2024-01-03T10:15:17+0000
2024-01-04T02,18xvo5t,22,4751,BeAmazed,363r3,"Absolute Badass",0,https://i.imgur.com/NLABMUv.jpeg,0.96,122,1704319789,2024-01-03T10:09:49+0000
2024-01-04T02,18xvltp,53,2533,nextfuckinglevel,m0bnr,"Man reveals the technique that could have been used on Stonehedge",0,https://v.redd.it/e33rao0vpaac1,0.95,179,1704319633,2024-01-03T10:07:13+0000
2024-01-04T02,18xvk7h,59,2405,ActualPublicFreakouts,27mtyi,"Man Attacks Las Vegas Judge During Sentencing Today",0,https://v.redd.it/47dllx6rsaac1,0.96,582,1704319525,2024-01-03T10:05:25+0000
2024-01-04T02,18xvio8,3,10949,PublicFreakout,2yrq6,"A Man Attacked a Las Vegas Judge During Sentencing Today",0,https://v.redd.it/0klbaupjsaac1,0.98,2135,1704319419,2024-01-03T10:03:39+0000
2024-01-04T02,18xvdhi,43,3068,wizardposting,5hjlp1,"You fools! You absolute fools!",0,https://i.redd.it/7es49kloraac1.jpeg,0.97,127,1704319090,2024-01-03T09:58:10+0000
2024-01-04T02,18xvbu1,7,8737,interestingasfuck,2qhsa,"Beachgoers have a close encounter with a Cassowary ",0,https://v.redd.it/lyp451lbraac1,0.96,1315,1704318974,2024-01-03T09:56:14+0000
2024-01-04T02,18xvadq,83,1918,BrandNewSentence,mbn0j,"Now here's a religion I can understand",0,https://i.redd.it/smwfzbwzqaac1.png,0.98,84,1704318872,2024-01-03T09:54:32+0000
2024-01-04T02,18xv7s3,96,1802,LeopardsAteMyFace,3jp3p,"shocking discovery: misogyny attracts misogynists",0,https://www.reddit.com/gallery/18xv7s3,0.96,99,1704318690,2024-01-03T09:51:30+0000
2024-01-04T02,18xv6zs,9,7305,WhitePeopleTwitter,35n7t,"Oh please do go there! Who wants popcorn?",0,https://i.redd.it/ld61kqybqaac1.jpeg,0.98,393,1704318638,2024-01-03T09:50:38+0000
2024-01-04T02,18xuwv0,32,3904,OnePiece,2rfz5,"Nico Robin attempt (surprise on 3rd slide) :D",0,https://www.reddit.com/gallery/18xuwv0,0.83,225,1704317961,2024-01-03T09:39:21+0000
2024-01-04T02,18xuv6q,4,12421,Damnthatsinteresting,2xxyj,"Best Buy is removing all physical media from their stores as of today.",0,https://i.redd.it/ggg8kznynaac1.jpeg,0.95,2655,1704317840,2024-01-03T09:37:20+0000
2024-01-04T02,18xulpi,91,2010,starterpacks,34o9s,"The ""fellas, is it gay to...?"" starter pack",0,https://i.redd.it/vtg94z7ylaac1.png,0.95,249,1704317201,2024-01-03T09:26:41+0000
2024-01-04T02,18xubqo,73,2401,TerrifyingAsFuck,31d92,"Black children watching as white children play in a whites only park, 1956",0,https://i.redd.it/4huvrky2kaac1.jpeg,0.86,105,1704316535,2024-01-03T09:15:35+0000
2024-01-04T02,18xu74c,29,4658,wholesomememes,3gcwj,"I always feel so terrible",0,https://i.redd.it/07ip85z4jaac1.jpeg,0.98,47,1704316226,2024-01-03T09:10:26+0000
2024-01-04T02,18xu6fg,5,18165,memes,2qjpg,"Getting older can be lonely",0,https://v.redd.it/06dqnsr0jaac1,0.94,364,1704316185,2024-01-03T09:09:45+0000
2024-01-04T02,18xu3p1,34,4129,FluentInFinance,3qpaq8,"Should Student Loans be Forgiven like PPP Loans were?",0,https://i.redd.it/n1r2tyxdiaac1.png,0.89,665,1704315991,2024-01-03T09:06:31+0000
2024-01-04T02,18xu35o,77,2372,Genshin_Impact,12p4l2,"Albedo's family tree.",0,https://i.redd.it/71ghps2ciaac1.png,0.96,175,1704315955,2024-01-03T09:05:55+0000
2024-01-04T02,18xu222,13,8173,facepalm,2r5rp,"The whole clip..",0,https://i.redd.it/68vwtv14iaac1.jpeg,0.88,2990,1704315884,2024-01-03T09:04:44+0000
2024-01-04T02,18xtyve,30,4783,clevercomebacks,dyqlw,"Just like the women he's been with, he never saw this coming",0,https://i.redd.it/8k421j5ihaac1.png,0.91,253,1704315668,2024-01-03T09:01:08+0000
2024-01-04T02,18xtv0h,48,3518,therewasanattempt,39ne7,"To Predict Trumps Fate In 2024 On Fox News",0,https://v.redd.it/brd1joskgaac1,0.95,372,1704315410,2024-01-03T08:56:50+0000
2024-01-04T02,18xtu67,37,4084,funny,2qh33,"Superhero entanglement (Batman, Wonder Woman & Superman)",0,https://i.redd.it/4zzsw8ojgaac1.jpeg,0.9,72,1704315350,2024-01-03T08:55:50+0000
2024-01-04T02,18xtjtd,42,3913,IdiotsInCars,3aimx,"“Dude are you kidding me right now?!” Audi idiot didn’t even look, claims they were not at fault. Dashcam to the rescue! [oc]",0,https://v.redd.it/lhjg7pbheaac1,0.96,543,1704314653,2024-01-03T08:44:13+0000
2024-01-04T02,18xtga5,28,5108,gaming,2qh03,"Jailed Nintendo hacker Gary Bowser denies link to new Switch flash cart",0,https://www.videogameschronicle.com/news/jailed-nintendo-hacker-gary-bowser-denies-link-to-new-switch-flash-cart/,0.96,252,1704314414,2024-01-03T08:40:14+0000
2024-01-04T02,18xt9sz,16,7374,BlackPeopleTwitter,33x33,"All I see is innovation 🤣",0,https://i.redd.it/kcw1oxahcaac1.jpeg,0.9,610,1704313978,2024-01-03T08:32:58+0000
2024-01-04T02,18xsze1,75,5695,cats,2qhta,"My cat on the day I got him….and him today 😍",0,https://www.reddit.com/gallery/18xsze1,0.99,270,1704313267,2024-01-03T08:21:07+0000
2024-01-04T02,18xskmw,50,4380,PeterExplainsTheJoke,121h8r,"Someone please help before I go insane!",0,https://i.redd.it/nvjas4xc7aac1.png,0.9,101,1704312258,2024-01-03T08:04:18+0000
2024-01-04T02,18xsga0,55,3836,europe,2qh4j,"Belarusian is disappearing (2009 & 2019)",0,https://www.reddit.com/gallery/18xsga0,0.95,590,1704311982,2024-01-03T07:59:42+0000
2024-01-04T02,18xsdbg,17,11098,shitposting,2usxq,Facts,0,https://v.redd.it/3mnw7jox5aac1,0.97,185,1704311778,2024-01-03T07:56:18+0000
2024-01-04T02,18xsd98,100,2461,StarWars,2qi4s,"I feel so bad for laughing at this bro was just chillin thinking about life then this happens😭",0,https://i.redd.it/fcuwoufx5aac1.jpeg,0.96,84,1704311774,2024-01-03T07:56:14+0000
2024-01-04T02,18xs90u,23,8297,SipsTea,5tdqj0,"But friend shape...",0,https://v.redd.it/ertmyfr25aac1,0.93,305,1704311488,2024-01-03T07:51:28+0000
2024-01-04T02,18xs8kt,38,5124,Wellthatsucks,2xcv7,"Went to Goodwill yesterday. Got a discount at the register, thought it was because of tag color. Looked at my receipt today and saw this.",0,https://i.redd.it/3xvxjoiz4aac1.jpeg,0.92,207,1704311458,2024-01-03T07:50:58+0000
2024-01-04T02,18xs6ck,10,10514,politics,2cneq,"Trump’s Idiot Lawyer Just Admitted He May Be Guilty of Insurrection: Donald Trump keeps hiring the very best.",0,https://newrepublic.com/post/177822/trump-idiot-lawyer-admit-may-guilty-insurrection,0.95,452,1704311308,2024-01-03T07:48:28+0000
2024-01-04T02,18xrmgi,74,3341,CuratedTumblr,3x5kfw,"Chinese rocks",0,https://www.reddit.com/gallery/18xrmgi,0.97,56,1704310001,2024-01-03T07:26:41+0000
2024-01-04T02,18xr7e1,85,3370,Money,2qjmw,"Just made my first 1000$ in high school",0,https://i.redd.it/g5gy8i3rx9ac1.jpeg,0.79,230,1704309026,2024-01-03T07:10:26+0000
2024-01-04T02,18xr2r3,54,5525,whenthe,23gidu,Perspectives,0,https://v.redd.it/77zxwghuw9ac1,0.94,172,1704308728,2024-01-03T07:05:28+0000
2024-01-04T02,18xqtcm,78,3484,AskReddit,2qh1i,"What’s the craziest WW2 fact that you know of?",1,https://www.reddit.com/r/AskReddit/comments/18xqtcm/whats_the_craziest_ww2_fact_that_you_know_of/,0.93,3677,1704308119,2024-01-03T06:55:19+0000
2024-01-04T02,18xqt09,36,6687,TrueOffMyChest,2yuqy,"My soon to be ex-husband humiliated me on our wedding day and met his karma instantly.",1,https://www.reddit.com/r/TrueOffMyChest/comments/18xqt09/my_soon_to_be_exhusband_humiliated_me_on_our/,0.9,1269,1704308101,2024-01-03T06:55:01+0000
2024-01-04T02,18xqsk8,11,13424,pics,2qh0u,"Temporary NYPD headquarters at a Burger King, 9/11/2001",0,https://i.redd.it/38fxac5wu9ac1.jpeg,0.96,421,1704308073,2024-01-03T06:54:33+0000
2024-01-04T02,18xqr6r,19,11253,FunnyAnimals,2st2l,"Dog thought he was home alone ",0,https://v.redd.it/bc2fgd5nu9ac1,0.97,115,1704307979,2024-01-03T06:52:59+0000
2024-01-04T02,18xqr1b,8,20449,news,2qh3l,"Names in Jeffrey Epstein court documents to be unsealed in New York on Wednesday",0,https://www.cnbc.com/2024/01/03/jeffrey-epstein-court-document-names-unsealed-wednesday-.html,0.96,2030,1704307970,2024-01-03T06:52:50+0000
2024-01-04T02,18xqqfi,63,4784,notinteresting,2u0xf,"My crush returned back the birthday gift I gave her today",0,https://i.redd.it/t7y5j9whu9ac1.jpeg,0.92,439,1704307931,2024-01-03T06:52:11+0000
2024-01-04T02,18xqmsj,35,6534,TwoXChromosomes,2r2jt,"He left and I barely noticed.",1,https://www.reddit.com/r/TwoXChromosomes/comments/18xqmsj/he_left_and_i_barely_noticed/,0.9,291,1704307693,2024-01-03T06:48:13+0000
2024-01-04T02,18xqlpm,40,16037,WhitePeopleTwitter,35n7t,"Trump's Version of 'America First'",0,https://i.redd.it/c8lvm1cit9ac1.png,0.94,610,1704307620,2024-01-03T06:47:00+0000
2024-01-04T02,18xqio1,15,15052,meirl,2s5ti,meirl,0,https://i.redd.it/uc11q2vys9ac1.jpeg,0.98,78,1704307415,2024-01-03T06:43:35+0000
2024-01-04T02,18xqelw,56,5317,Steam,2qwis,"POV: You woke up the next day and realized that the whole Game Award was a bad dream",0,https://i.redd.it/lfngtbe3s9ac1.png,0.87,425,1704307150,2024-01-03T06:39:10+0000
2024-01-04T02,18xq76w,45,17813,politics,2cneq,"Conservatives Are Having a Meltdown Over Trump and the Epstein List: Donald Trump’s biggest supporters are freaking out over the anticipated unveiling.",0,https://newrepublic.com/post/177828/conservatives-meltdown-trump-epstein-list,0.91,2261,1704306643,2024-01-03T06:30:43+0000
2024-01-04T02,18xq5t2,66,13314,facepalm,2r5rp,"Killed for a period….",0,https://i.redd.it/b6j8bhoeq9ac1.jpeg,0.95,1324,1704306555,2024-01-03T06:29:15+0000
2024-01-04T02,18xq5a0,39,6298,technology,2qh16,"23andMe tells victims it's their fault that their data was breached",0,https://techcrunch.com/2024/01/03/23andme-tells-victims-its-their-fault-that-their-data-was-breached/,0.96,615,1704306520,2024-01-03T06:28:40+0000
2024-01-04T02,18xq16a,21,15405,BikiniBottomTwitter,3deqz,"Gary hit em wit the",0,https://v.redd.it/koc84toep9ac1,0.92,309,1704306237,2024-01-03T06:23:57+0000
2024-01-04T02,18xpyab,84,3814,NoStupidQuestions,2w844,"In the 80s did parents really just let their kids go out wherever or is this only in movies?",1,https://www.reddit.com/r/NoStupidQuestions/comments/18xpyab/in_the_80s_did_parents_really_just_let_their_kids/,0.92,5740,1704306043,2024-01-03T06:20:43+0000
2024-01-04T02,18xpx54,25,10066,holdmycatnip,2zhxd,"Have a look at this businessman!",0,https://v.redd.it/5wbxadclo9ac1,0.97,86,1704305971,2024-01-03T06:19:31+0000
2024-01-04T02,18xprtx,33,9220,Unexpected,2w67q,"Looking for her dog",0,https://v.redd.it/axf945gin9ac1,0.91,167,1704305606,2024-01-03T06:13:26+0000
2024-01-04T02,18xpq9m,14,15688,todayilearned,2qqjc,"TIL in 1609, Manhattan supported more ecological diversity per acre than Yellowstone National Park. Research suggests that had Manhattan never been developed, it would be one of the most important national parks",0,https://secretnyc.co/manhattan-used-one-giant-lush-park-looked-like/,0.96,575,1704305502,2024-01-03T06:11:42+0000
2024-01-04T02,18xpl1l,94,4185,discordVideos,2cxozx,"cosplay besties",0,https://v.redd.it/25v0nbb7m9ac1,0.89,130,1704305156,2024-01-03T06:05:56+0000
2024-01-04T02,18xpe1t,24,12378,MurderedByWords,3hx3r,"It's clear as can be",0,https://i.redd.it/t013eymuk9ac1.jpeg,0.9,239,1704304712,2024-01-03T05:58:32+0000
2024-01-04T02,18xpcxb,89,3894,antiwork,2y77d,"Got fired today.",1,https://www.reddit.com/r/antiwork/comments/18xpcxb/got_fired_today/,0.94,289,1704304636,2024-01-03T05:57:16+0000
2024-01-04T02,18xp90e,72,4600,mildlyinfuriating,2ubgg,"Once again affirming why I don't let people borrow my stuff.",1,https://www.reddit.com/r/mildlyinfuriating/comments/18xp90e/once_again_affirming_why_i_dont_let_people_borrow/,0.96,490,1704304370,2024-01-03T05:52:50+0000
2024-01-04T02,18xp5v3,70,4654,IllegallySmolCats,23e19j,"Smol meow ",0,https://v.redd.it/kd607t72j9ac1,0.97,54,1704304155,2024-01-03T05:49:15+0000
2024-01-04T02,18xoxdh,58,6396,ExplainTheJoke,2vmj2,"My friends in Tech found this hilarious. Captioned ""Stack Overflow, In a nutshell"". Please help.",0,https://i.redd.it/xmeqbzjlh9ac1.jpeg,0.96,119,1704303592,2024-01-03T05:39:52+0000
2024-01-04T02,18xoupq,20,18886,cats,2qhta,"Man goes for 21K hike, discovers Lost Kitten, and Adopts it. Changes channel from a Hiking Channel to a Cat Channel.",0,https://v.redd.it/ebaoev85g9ac1,0.94,552,1704303415,2024-01-03T05:36:55+0000
2024-01-04T02,18xoujs,41,8527,PrequelMemes,3i60n,"Someone took the English subtitles of a pirated Chinese copy of Revenge of the Sith and turned them into a dub of the original movie",0,https://v.redd.it/qn9ejxl0h9ac1,0.96,300,1704303405,2024-01-03T05:36:45+0000
2024-01-04T02,18xoqm4,26,13299,nbacirclejerk,2td2i,"Since my friend pissed me off: he's both zprolgt and mrsonsfan. They're the same person. You're welcome.",0,https://i.redd.it/6cvalohzf9ac1.png,0.92,936,1704303135,2024-01-03T05:32:15+0000
2024-01-04T02,18xopzb,98,4004,DOG,2qiy5,"We're just Gonna put that Riiiight Back here.",0,https://v.redd.it/xudyab5zf9ac1,0.98,27,1704303093,2024-01-03T05:31:33+0000
2024-01-04T02,18xogx0,64,25512,me_irl,2vegg,Me_irl,0,https://i.redd.it/t615lg9ee9ac1.jpeg,0.96,443,1704302516,2024-01-03T05:21:56+0000
2024-01-04T02,18xoeal,61,17326,pics,2qh0u,"On Christmas, my step sister hid 100 ducks in my house. 96 have been found.",0,https://i.redd.it/15ns48rvd9ac1.png,0.96,564,1704302343,2024-01-03T05:19:03+0000
2024-01-04T02,18xo2fz,86,4904,FunnyandSad,2z7qd,"He was right",0,https://i.redd.it/iduc0rrwa9ac1.png,0.96,14,1704301352,2024-01-03T05:02:32+0000
2024-01-04T02,18xnu1w,76,5582,fightporn,2u5un,"Keep calm and wait for the right moment)",0,https://v.redd.it/hf2v49kh89ac1,0.96,319,1704300599,2024-01-03T04:49:59+0000
2024-01-04T02,18xnl6l,99,4841,blender,2qim4,"Show this to those who haven't yet understood UV mapping.",0,https://i.redd.it/9ef5pds969ac1.jpeg,0.96,69,1704299800,2024-01-03T04:36:40+0000
2024-01-04T02,18xnkll,93,5213,AbsoluteUnits,a7wuv,"Actual size of a Pelican's mouth",0,https://v.redd.it/7svbb1b569ac1,0.96,171,1704299747,2024-01-03T04:35:47+0000
