date,id,position,score,subreddit_display_name,subreddit_id,title,is_self,url,upvote_ratio,num_comments,created,created_date
2024-01-01T04,18vmjkg,59,1395,NatureIsFuckingLit,3gdh7,"🔥 Bison Shedding a Tear",0,https://v.redd.it/0ec11bjgjq9c1,0.96,60,1704074207,2024-01-01T01:56:47+0000
2024-01-01T04,18vm1qm,43,1871,nba,2qo4s,"[Highlight] Victor Wembanyama takes one dribble from 3/4 court and dunks the basketball",0,https://streamable.com/ukl6dz,0.85,358,1704072466,2024-01-01T01:27:46+0000
2024-01-01T04,18vlgk1,78,1404,FUCKYOUINPARTICULAR,3538a,"fuck his hockey stick",0,https://v.redd.it/29g6wvqg8q9c1,0.97,62,1704070505,2024-01-01T12:55:05+0000
2024-01-01T04,18vl9bu,81,3808,Damnthatsinteresting,2xxyj,"Steamboat Willie is now in the public domain",0,https://i.redd.it/vz7c7imh6q9c1.jpeg,0.99,104,1704069831,2024-01-01T12:43:51+0000
2024-01-01T04,18vl7ml,40,2481,shitposting,2usxq,"Heavily relatable",0,https://v.redd.it/k2eysgq06q9c1,0.99,19,1704069679,2024-01-01T12:41:19+0000
2024-01-01T04,18vkk2p,50,2186,ContagiousLaughter,2u2bh,"Bro is about to see sound",0,https://v.redd.it/fvymj9phzp9c1,0.92,160,1704067473,2024-01-01T12:04:33+0000
2024-01-01T04,18vkjnv,67,1743,TwoXChromosomes,2r2jt,"I just had the wildest conversation about child support with another woman",1,https://www.reddit.com/r/TwoXChromosomes/comments/18vkjnv/i_just_had_the_wildest_conversation_about_child/,0.95,204,1704067432,2024-01-01T12:03:52+0000
2024-01-01T04,18vkifx,34,3049,PrequelMemes,3i60n,"For The Republic🫡",0,https://v.redd.it/ce1ky5l2zp9c1,0.97,60,1704067331,2024-01-01T12:02:11+0000
2024-01-01T04,18vkie0,73,1692,PublicFreakout,2yrq6,"NYPD opens gate for NYE ball drop",0,https://v.redd.it/ykfk3x2zyp9c1,0.93,553,1704067327,2024-01-01T12:02:07+0000
2024-01-01T04,18vkgkp,18,4046,news,2qh3l,"New York sergeant, wife and two sons found dead in murder-suicide, police say | US crime",0,https://www.theguardian.com/us-news/2023/dec/31/new-york-police-sergeant-wife-two-sons-found-dead,0.96,379,1704067186,2023-12-31T11:59:46+0000
2024-01-01T04,18vk9n7,53,2213,Hololive,29numb,"Apparently Hololive staff weren't kidding around when it's about Mio's fried chicken Kaarage. Guess they made good use of their equipment to deliver Mio's Kaarage as accurate as possible.",0,https://x.com/ookamimio/status/1741605183698931955?s=20,0.97,70,1704066548,2023-12-31T11:49:08+0000
2024-01-01T04,18vk8my,88,1619,DIY,2qh7d,"Original basement as purchased vs 95% done finishing",0,https://www.reddit.com/gallery/18vk8my,0.9,437,1704066454,2023-12-31T11:47:34+0000
2024-01-01T04,18vk2xk,37,3313,cursedcomments,hw1ju,Cursed_Snake,0,https://i.redd.it/1vyuwabyup9c1.jpeg,0.98,53,1704065945,2023-12-31T11:39:05+0000
2024-01-01T04,18vk2ng,83,1754,TheMajorityReport,36goq,"Love your oppressor 🤮",0,https://i.redd.it/ae5idmlvup9c1.jpeg,0.88,131,1704065920,2023-12-31T11:38:40+0000
2024-01-01T04,18vk2md,2,11781,AbsoluteUnits,a7wuv,"When a Powerlifter meets a Bodybuilder",0,https://v.redd.it/zcgudaxpup9c1,0.96,473,1704065918,2023-12-31T11:38:38+0000
2024-01-01T04,18vjy78,1,17864,pics,2qh0u,"Gary Sinise here. Wishing you all a Happy New Year and a great 2024 from my family to yours",0,https://i.redd.it/4ac8r0xgpp9c1.jpeg,0.94,537,1704065512,2023-12-31T11:31:52+0000
2024-01-01T04,18vjrbs,52,2415,MapPorn,2si92,"Today, the Republic of Artsakh has officially ceased to exist after 32 years",0,https://i.redd.it/wnufnv2rrp9c1.png,0.94,405,1704064870,2023-12-31T11:21:10+0000
2024-01-01T04,18vjqhj,29,3802,BrandNewSentence,mbn0j,"Get a load of this guys",0,https://i.redd.it/0ifbe6mjrp9c1.jpeg,0.96,237,1704064799,2023-12-31T11:19:59+0000
2024-01-01T04,18vjpqq,79,5282,facepalm,2r5rp,"oh yeah?",0,https://i.redd.it/3laauqobrp9c1.jpeg,0.94,917,1704064725,2023-12-31T11:18:45+0000
2024-01-01T04,18vjo9j,84,1868,IdiotsInCars,3aimx,"[OC] My car was totaled, happened 11/15/2023",0,https://v.redd.it/obg9t0mvqp9c1,0.97,154,1704064586,2023-12-31T11:16:26+0000
2024-01-01T04,18vjl51,58,2364,TIHI,r1l2z,"Thanks I hate this activity",0,https://i.redd.it/d99vnph1qp9c1.jpeg,0.95,204,1704064297,2023-12-31T11:11:37+0000
2024-01-01T04,18vjic0,71,2090,JoeRogan,2s4tv,"Dave Chappelle came out the gate with this one in his new Netflix special 'The Dreamer'",0,https://v.redd.it/g6t60ap3pp9c1,0.78,1087,1704064046,2023-12-31T11:07:26+0000
2024-01-01T04,18vjg14,61,2323,TopCharacterDesigns,86ohyi,"Buff Women",0,https://www.reddit.com/gallery/18vjg14,0.9,327,1704063829,2023-12-31T11:03:49+0000
2024-01-01T04,18vjfkv,3,11756,wholesomememes,3gcwj,"The kind of love we all deserve",0,https://i.redd.it/lutgugajop9c1.jpeg,0.97,40,1704063787,2023-12-31T11:03:07+0000
2024-01-01T04,18vjcri,100,1744,sports,2qgzy,"[Kahuna_Med] Panthers owner David Tepper appears to be throwing his drink at a Jags fan at the Jaguars and Panthers game today in this video.",0,https://v.redd.it/97b12zwtnp9c1,0.95,238,1704063553,2023-12-31T10:59:13+0000
2024-01-01T04,18vj8b1,46,8222,pics,2qh0u,"Just bought a house and found this on the garage. 🥺",0,https://i.redd.it/n51gqb2jmp9c1.jpeg,0.97,691,1704063147,2023-12-31T10:52:27+0000
2024-01-01T04,18vj0ac,41,3236,menwritingwomen,3ox0h,"Anti-Suffragette political cartoons from the early 1900s are wild",0,https://www.reddit.com/gallery/18vj0ac,0.95,204,1704062464,2023-12-31T10:41:04+0000
2024-01-01T04,18viz8l,31,4580,MinecraftMemes,2sq0h,"Dont ask",0,https://i.redd.it/weosqko7kp9c1.png,0.96,40,1704062376,2023-12-31T10:39:36+0000
2024-01-01T04,18viw48,87,2050,adventuretime,2s54g,"So did he just fucking die or what?",0,https://i.redd.it/defhzz04jp9c1.png,0.97,57,1704062102,2023-12-31T10:35:02+0000
2024-01-01T04,18viijc,48,3177,PoliticalHumor,2qm21,"Silence of the Sheeple",0,https://i.redd.it/dsffinw2gp9c1.jpeg,0.91,342,1704060957,2023-12-31T10:15:57+0000
2024-01-01T04,18vihhj,70,2425,nostalgia,2qnub,"Family popcorn bowl that was also used as a “barf bowl” when we got sick",0,https://i.redd.it/4c8ufhsufp9c1.jpeg,0.95,297,1704060870,2023-12-31T10:14:30+0000
2024-01-01T04,18vie0i,21,5477,CrappyDesign,2sa3m,"The armrest of my United Airlines seat has flight attendant call buttons. We are only 30 minutes into the flight, and they have already made two announcements not to accidentally push the buttons.",0,https://i.redd.it/8d6wma0yep9c1.jpeg,0.96,150,1704060573,2023-12-31T10:09:33+0000
2024-01-01T04,18vicnx,39,3964,me_irlgbt,3apfn,me_irlgbt,0,https://i.redd.it/m0213cvqpn9c1.png,0.95,64,1704060450,2023-12-31T10:07:30+0000
2024-01-01T04,18vib0a,51,3136,fixedbytheduet,46tcaa,"What else would we be doing?",0,https://v.redd.it/bwwbz7h5ep9c1,0.95,112,1704060308,2023-12-31T10:05:08+0000
2024-01-01T04,18viah4,16,6217,futurama,2qhqw,"Here's to another lousy millenium",0,https://i.redd.it/db5jaxx1ep9c1.jpeg,0.95,148,1704060262,2023-12-31T10:04:22+0000
2024-01-01T04,18vi9ss,26,6083,memes,2qjpg,"Happy New Year",0,https://i.redd.it/7u109yxudp9c1.jpeg,0.93,253,1704060199,2023-12-31T10:03:19+0000
2024-01-01T04,18vi8zh,23,5778,europe,2qh4j,"Estonia has fully legalized same-sex marriages!",0,https://i.redd.it/qfx1805ndp9c1.jpeg,0.83,730,1704060128,2023-12-31T10:02:08+0000
2024-01-01T04,18vi2d5,17,6793,mildlyinfuriating,2ubgg,"Post on craigslist",0,https://i.redd.it/1yhkgmpzbp9c1.jpeg,0.95,947,1704059568,2023-12-31T09:52:48+0000
2024-01-01T04,18vhvhe,8,9231,maybemaybemaybe,38e1l,"Maybe Maybe Maybe ",0,https://v.redd.it/oyrb4tp7ap9c1,0.92,481,1704058987,2023-12-31T09:43:07+0000
2024-01-01T04,18vhtz1,82,2577,notinteresting,2u0xf,"I was banned in less than two seconds",0,https://www.reddit.com/gallery/18vhtz1,0.96,176,1704058860,2023-12-31T09:41:00+0000
2024-01-01T04,18vhnof,65,2926,abandoned,2qicm,"Can't believe they just left them all behind 😳",0,https://v.redd.it/vxxufip48p9c1,0.94,204,1704058329,2023-12-31T09:32:09+0000
2024-01-01T04,18vhm90,11,9202,CuratedTumblr,3x5kfw,"racism skill tree bonuses",0,https://i.redd.it/99oxc8vy7p9c1.jpeg,0.95,342,1704058216,2023-12-31T09:30:16+0000
2024-01-01T04,18vhgzt,56,3455,pcmasterrace,2sgp1,"Friend just send me this picture of all the parts for his PC that have arrived so far…",0,https://i.redd.it/1zivct4n6p9c1.jpeg,0.92,568,1704057776,2023-12-31T09:22:56+0000
2024-01-01T04,18vgxcu,57,3549,NFCEastMemeWar,26lph2,"GET THE FUCK IN HERE!!!!",0,https://i.redd.it/0wf8r67z1p9c1.jpeg,0.93,464,1704056201,2023-12-31T08:56:41+0000
2024-01-01T04,18vgx1p,62,3337,49ers,2rebv,"THE SAN FRANCISCO 49ERS CLINCH THE #1 SEED IN THE NFC",1,https://www.reddit.com/r/49ers/comments/18vgx1p/the_san_francisco_49ers_clinch_the_1_seed_in_the/,0.88,733,1704056176,2023-12-31T08:56:16+0000
2024-01-01T04,18vgw2l,13,10227,interestingasfuck,2qhsa,"He can track even packages",0,https://v.redd.it/k6fqrnnn1p9c1,0.92,231,1704056096,2023-12-31T08:54:56+0000
2024-01-01T04,18vgvdt,35,5747,pettyrevenge,2vg7t,"My dad refused to buy a new water heater when we needed a new one so I made him shower with cold water",1,https://www.reddit.com/r/pettyrevenge/comments/18vgvdt/my_dad_refused_to_buy_a_new_water_heater_when_we/,0.85,838,1704056037,2023-12-31T08:53:57+0000
2024-01-01T04,18vgopw,4,21207,Damnthatsinteresting,2xxyj,"Figure skater doing practice spins",0,https://v.redd.it/4l5baroozo9c1,0.95,919,1704055483,2023-12-31T08:44:43+0000
2024-01-01T04,18vgmzd,94,2774,CringeVideo,3c7w8,"Guy says ""Arrest me! I dare you!"" and gets arrested.",0,https://v.redd.it/tzznlo99zo9c1,0.89,1285,1704055330,2023-12-31T08:42:10+0000
2024-01-01T04,18vglx2,25,7393,therewasanattempt,39ne7,"To practice American exceptionalism ",0,https://v.redd.it/4g15v0b4zo9c1,0.94,531,1704055240,2023-12-31T08:40:40+0000
2024-01-01T04,18vglvj,33,6478,ProgrammerHumor,2tex6,yesIHaveSeenASmartPointerOnce,0,https://i.redd.it/ftt2k3upxo9c1.png,0.95,65,1704055237,2023-12-31T08:40:37+0000
2024-01-01T04,18vgcha,6,14774,NonPoliticalTwitter,39gt6y,"Reddit relationships",0,https://i.redd.it/0kdxziptwo9c1.jpeg,0.95,261,1704054469,2023-12-31T08:27:49+0000
2024-01-01T04,18vg8t6,36,6578,meme,2qi1r,"hope im not the only one",0,https://i.redd.it/7omiva1vvo9c1.jpeg,0.97,209,1704054164,2023-12-31T08:22:44+0000
2024-01-01T04,18vg8bd,42,5303,FunnyAnimals,2st2l,Persuasive.,0,https://v.redd.it/5a7eauvrvo9c1,0.98,49,1704054124,2023-12-31T08:22:04+0000
2024-01-01T04,18vg2wi,68,3705,CrazyFuckingVideos,45hae8,"what was that?",0,https://v.redd.it/e1ka8areuo9c1,0.95,200,1704053692,2023-12-31T08:14:52+0000
2024-01-01T04,18vfrjc,5,17586,aww,2qh1o,"People always said my puppy looked like a fox… swipe to see how he turned out",0,https://www.reddit.com/gallery/18vfrjc,0.94,687,1704052798,2023-12-31T07:59:58+0000
2024-01-01T04,18vfraw,38,6154,MadeMeSmile,2uqcm,"My husband got me this for Christmas. It was a total surprise cause he’s super frugal and cringes at how much Legos cost. I ugly cried at first, but I’m still smiling a week later!",0,https://i.redd.it/w5adikksro9c1.jpeg,0.96,234,1704052779,2023-12-31T07:59:39+0000
2024-01-01T04,18vff9p,97,3355,cyberpunkgame,3az7x,"Failing my role modle",0,https://i.redd.it/alnfeiyzoo9c1.jpeg,0.96,71,1704051837,2023-12-31T07:43:57+0000
2024-01-01T04,18vfeor,9,24072,facepalm,2r5rp,"idiots everywhere",0,https://i.redd.it/dgym67booo9c1.jpeg,0.89,2477,1704051788,2023-12-31T07:43:08+0000
2024-01-01T04,18vf8vd,12,18233,oddlysatisfying,2x93b,"Putting hard oil on my knife handle.",0,https://v.redd.it/k110h9hgno9c1,0.89,830,1704051319,2023-12-31T07:35:19+0000
2024-01-01T04,18vf416,7,17694,WhitePeopleTwitter,35n7t,"Not the onion btw",0,https://i.redd.it/xzfvcgvcmo9c1.jpeg,0.96,719,1704050948,2023-12-31T07:29:08+0000
2024-01-01T04,18vf18s,14,17298,SipsTea,5tdqj0,"Happens to the best of us",0,https://v.redd.it/88lv7vcplo9c1,0.9,408,1704050728,2023-12-31T07:25:28+0000
2024-01-01T04,18vetxq,10,21605,clevercomebacks,dyqlw,"Another reason to love the Beatles",0,https://i.imgur.com/SXTEFOm.jpg,0.94,377,1704050160,2023-12-31T07:16:00+0000
2024-01-01T04,18veqef,85,4088,SpidermanPS4,3f1fs,"I should've expected this I guess",0,https://i.redd.it/sxzqgwq7jo9c1.jpeg,0.94,166,1704049891,2023-12-31T07:11:31+0000
2024-01-01T04,18vekxw,22,11736,gaming,2qh03,"In the early 1980s, video game magazines typically used photographic cameras to capture screenshots directly from the game screen to illustrate their reviews.",0,https://i.redd.it/5mc4a1hxho9c1.jpeg,0.97,300,1704049459,2023-12-31T07:04:19+0000
2024-01-01T04,18vehx4,19,17167,meirl,2s5ti,Meirl,0,https://i.redd.it/2ky4af29ho9c1.jpeg,0.97,366,1704049230,2023-12-31T07:00:30+0000
2024-01-01T04,18vehc9,55,5448,politics,2cneq,"New Florida law requires city officials to disclose net worth; some are resigning instead",0,https://www.usatoday.com/story/news/local/volusia/2023/12/28/shores-commissioners-quit-before-jan-1-financial-disclosure-deadline/72042436007/,0.99,218,1704049194,2023-12-31T06:59:54+0000
2024-01-01T04,18veeqk,77,4811,Grimdank,3ilna,"He then sent custodes to kick their ass",0,https://i.redd.it/bw5q95bigo9c1.jpeg,0.95,193,1704048985,2023-12-31T06:56:25+0000
2024-01-01T04,18ve96f,64,5304,Eyebleach,2s427,"Smol void plotting world domination...",0,https://i.imgur.com/acmJUgK.gifv,0.97,36,1704048546,2023-12-31T06:49:06+0000
2024-01-01T04,18ve63x,95,13626,news,2qh3l,"Plane from Texas drops off over 300 migrants at Rockford airport; buses sent to Chicago: officials",0,https://abc7chicago.com/chicago-migrant-crisis-plane-rockford-airport-texas/14249350/,0.94,3984,1704048296,2023-12-31T06:44:56+0000
2024-01-01T04,18vdzay,76,5061,Piracy,2qmox,"Who's guilty of this?",0,https://i.redd.it/ouk7pktuco9c1.jpeg,0.93,404,1704047752,2023-12-31T06:35:52+0000
2024-01-01T04,18vdtmb,69,5062,OldSchoolCool,2tycb,"Roger Ebert and Gene Siskel review The Shawshank Redemption (1994)",0,https://v.redd.it/ofwqkatjbo9c1,0.96,444,1704047319,2023-12-31T06:28:39+0000
2024-01-01T04,18vdst4,28,12808,CozyPlaces,34ixl,"New Years Eve Cozy Dinner",0,https://i.redd.it/t00chuzcbo9c1.jpeg,0.94,415,1704047250,2023-12-31T06:27:30+0000
2024-01-01T04,18vdsqi,27,18594,technicallythetruth,3pzez,"Once in a century",0,https://i.redd.it/piytwtacbo9c1.jpeg,0.93,367,1704047243,2023-12-31T06:27:23+0000
2024-01-01T04,18vdr3o,74,5405,ParadoxExtra,33t59,"And I wasn’t even playing America!",0,https://i.redd.it/jn7nr71xao9c1.jpeg,0.97,57,1704047111,2023-12-31T06:25:11+0000
2024-01-01T04,18vdlo6,80,5047,todayilearned,2qqjc,"TIL a bear was the first living being to survive a supersonic ejection",0,https://en.wikipedia.org/wiki/Convair_B-58_Hustler,0.97,216,1704046679,2023-12-31T06:17:59+0000
2024-01-01T04,18vdi09,60,6151,cats,2qhta,"She did not make it till midnight",0,https://i.redd.it/xjtcyw4s8o9c1.jpeg,0.98,145,1704046383,2023-12-31T06:13:03+0000
2024-01-01T04,18vdam0,96,4756,HydroHomies,10288s,"Yearly reminder that kidney stones are no joke. Drink water everyone.",0,https://i.redd.it/kwf9angx6o9c1.jpeg,0.96,222,1704045796,2023-12-31T06:03:16+0000
2024-01-01T04,18vdajc,32,18095,me_irl,2vegg,me_irl,0,https://v.redd.it/wsou95707o9c1,0.93,383,1704045789,2023-12-31T06:03:09+0000
2024-01-01T04,18vd80p,24,18305,BlackPeopleTwitter,33x33,"The survival skills were lagging tbf",0,https://v.redd.it/ytuuza384o9c1,0.95,288,1704045603,2023-12-31T06:00:03+0000
2024-01-01T04,18vd5bu,72,6126,oddlyspecific,2wjlc,"Harsh but true",0,https://i.redd.it/y16kofln5o9c1.jpeg,0.94,145,1704045377,2023-12-31T05:56:17+0000
2024-01-01T04,18vd0c5,49,8606,funnyvideos,2qoos,"One of My Favorite Scenes from 22 Jump street",0,https://v.redd.it/kilijp2c4o9c1,0.95,155,1704044980,2023-12-31T05:49:40+0000
2024-01-01T04,18vczub,15,33780,antiwork,2y77d,"Full Circle",0,https://i.redd.it/uyn3yweh4o9c1.png,0.95,1126,1704044936,2023-12-31T05:48:56+0000
2024-01-01T04,18vcwn4,99,4834,blunderyears,2vy3g,"It was 2011, I was 12 years old and in love with my cousin's 18yo skater friend. I guess I thought this would win him over, so I posted it on Facebook.",0,https://i.redd.it/ldq9vlvq3o9c1.jpeg,0.95,181,1704044689,2023-12-31T05:44:49+0000
2024-01-01T04,18vcp34,20,32556,comics,2qh0s,"And Tigger Too",0,https://i.redd.it/5pebbe5y1o9c1.gif,0.96,249,1704044089,2023-12-31T05:34:49+0000
2024-01-01T04,18vcnvn,47,8674,worldnews,2qh13,"Queen of Denmark announces abdication live on TV",0,https://www.bbc.co.uk/news/world-europe-67854395,0.95,940,1704043992,2023-12-31T05:33:12+0000
2024-01-01T04,18vcmkl,91,7775,PeterExplainsTheJoke,121h8r,Petah,0,https://i.redd.it/qyj0ymwc1o9c1.jpeg,0.8,258,1704043890,2023-12-31T05:31:30+0000
2024-01-01T04,18vccov,92,5665,tuckedinkitties,2zoo7,"I don’t have a bf so this is what I wake up to",0,https://www.reddit.com/gallery/18vccov,0.97,112,1704043113,2023-12-31T05:18:33+0000
2024-01-01T04,18vc749,30,37589,rareinsults,48t85,"Libertarians - House Cats",0,https://i.redd.it/0fi3ledrxn9c1.jpeg,0.85,1701,1704042676,2023-12-31T05:11:16+0000
2024-01-01T04,18vbub8,54,9641,Tinder,2w7mz,"I hate it here 😂",0,https://i.redd.it/elbzdpouun9c1.jpeg,0.96,936,1704041697,2023-12-31T04:54:57+0000
2024-01-01T04,18vbs3r,75,10154,dankmemes,2zmfe,"One day left",0,https://i.redd.it/xsyc5gwbun9c1.jpeg,0.95,133,1704041525,2023-12-31T04:52:05+0000
2024-01-01T04,18vbnsj,45,13593,holdmycatnip,2zhxd,"He fell with grace",0,https://v.redd.it/8kf26lnatn9c1,0.97,98,1704041188,2023-12-31T04:46:28+0000
2024-01-01T04,18vapwf,89,10256,KidsAreFuckingStupid,3948y,"Awesome idea",0,https://v.redd.it/urtssl9hln9c1,0.83,509,1704038546,2023-12-31T04:02:26+0000
2024-01-01T04,18vajto,44,19785,TikTokCringe,mvcq5,"This is an absolutely insane job",0,https://v.redd.it/s87lhan1kn9c1,0.93,865,1704038069,2023-12-31T03:54:29+0000
2024-01-01T04,18va931,93,9117,Satisfyingasfuck,31s00,"This is Amazing",0,https://v.redd.it/no2mkt15hn9c1,0.93,351,1704037210,2023-12-31T03:40:10+0000
2024-01-01T04,18va6bu,66,11402,Presidents,2qwlm,"from Time Magazine, 19 February 1990",0,https://i.redd.it/mkfrzn2kgn9c1.png,0.92,561,1704036978,2023-12-31T03:36:18+0000
2024-01-01T04,18v9hia,98,10609,TheLastAirbender,2rybx,"New still",0,https://i.redd.it/gfk779opan9c1.jpeg,0.94,520,1704034924,2023-12-31T03:02:04+0000
2024-01-01T04,18v9f6e,63,16875,Unexpected,2w67q,"Confronting a rival fan",0,https://v.redd.it/bcu4dgs6an9c1,0.94,415,1704034755,2023-12-31T02:59:15+0000
2024-01-01T04,18v98x3,86,12572,Showerthoughts,2szyo,"It's against the law to use your smartphone while driving, but using a giant tablet on the dashboard for most of your car's functions is perfectly fine",1,https://www.reddit.com/r/Showerthoughts/comments/18v98x3/its_against_the_law_to_use_your_smartphone_while/,0.91,915,1704034205,2023-12-31T02:50:05+0000
2024-01-01T04,18v8vwx,90,20972,theydidthemath,2x23b,"[Request] How much money could you make doing this?",0,https://i.redd.it/sajb2vm15n9c1.jpeg,0.92,336,1704033019,2023-12-31T02:30:19+0000
