date,id,position,score,subreddit_display_name,subreddit_id,title,is_self,url,upvote_ratio,num_comments,created,created_date
2024-01-02T01,18waehh,23,3185,tumblr,2r7hk,"You should've become beautiful but you got forced out too soon and now you're in a fucked up half done state",0,https://i.redd.it/gasvyx7mzw9c1.png,0.98,77,1704152489,2024-01-01T11:41:29+0000
2024-01-02T01,18wa74u,73,1561,furry_irl,3b66u,Furry_irl,0,https://i.redd.it/y9q7dm7pyw9c1.jpeg,0.94,218,1704151955,2024-01-01T11:32:35+0000
2024-01-02T01,18w986p,49,2222,wholesome,2z9ds,"Son gives Mother a very thoughtful gift for Christmas ",0,https://v.redd.it/eim2c57arw9c1,0.95,45,1704149460,2024-01-01T10:51:00+0000
2024-01-02T01,18w92ei,94,2671,dankmemes,2zmfe,"Bye bye copyright",0,https://i.redd.it/8b5wfuh2qw9c1.png,0.98,12,1704149051,2024-01-01T10:44:11+0000
2024-01-02T01,18w8kln,12,5291,todayilearned,2qqjc,"TIL that Toronto firefighter Danny Flippidis mysteriously disappeared on a skiing trip in New York. Sis days later, he resurfaced 3000 miles away in Sacramento California with no memory of how he got there. He was wearing the same exact gear when he disappeared and with no ID except a credit card.",0,https://www.cbc.ca/radio/docproject/why-this-toronto-firefighter-may-never-know-what-happened-on-his-puzzling-journey-across-the-u-s-1.4998819,0.96,200,1704147792,2024-01-01T10:23:12+0000
2024-01-02T01,18w8i9v,86,1797,aww,2qh1o,"cats instead of slippers",0,https://v.redd.it/ys8yk2ctlw9c1,0.98,16,1704147624,2024-01-01T10:20:24+0000
2024-01-02T01,18w8epb,83,1855,Spiderman,2rw42,"This might just be the most I’ve ever laughed while reading a comic",0,https://i.redd.it/n3p1j3i3lw9c1.jpeg,0.96,87,1704147379,2024-01-01T10:16:19+0000
2024-01-02T01,18w85a4,60,2209,LiverpoolFC,2qn0o,"Klopp loses his wedding ring while celebrating, then finds it",0,https://v.redd.it/9pl1dzp3jw9c1,0.97,74,1704146709,2024-01-01T10:05:09+0000
2024-01-02T01,18w80e4,13,5534,Fauxmoi,2rqcm8,"David Beckham posts photo with Victoria’s “very working class” family",0,https://i.redd.it/inovp9m4iw9c1.jpeg,0.95,295,1704146381,2024-01-01T09:59:41+0000
2024-01-02T01,18w7r45,100,1779,sciencememes,2u0d4,"Gambler's fallacy",0,https://i.redd.it/mznyyv27gw9c1.png,0.97,61,1704145736,2024-01-01T09:48:56+0000
2024-01-02T01,18w7kog,59,4245,Damnthatsinteresting,2xxyj,"El Nino winter so far visualized",0,https://i.redd.it/frxhpobfew9c1.jpeg,0.95,532,1704145297,2024-01-01T09:41:37+0000
2024-01-02T01,18w7fxo,38,3493,WTF,2qh61,"At US$10,000 a gram or US$10 million a litre, Scorpion venom is the most expensive liquid in the world.",0,https://v.redd.it/velsuizwdw9c1,0.95,351,1704144974,2024-01-01T09:36:14+0000
2024-01-02T01,18w7eag,4,10296,oddlysatisfying,2x93b,"Steam buns fluffing up",0,https://v.redd.it/inhxvf0ldw9c1,0.89,327,1704144857,2024-01-01T09:34:17+0000
2024-01-02T01,18w7c3t,17,5329,IdiotsInCars,3aimx,"[oc] Audi Q5 forces me off the road causing my vehicle to flip 5/6 times",0,https://v.redd.it/4a7eqc94dw9c1,0.95,1003,1704144702,2024-01-01T09:31:42+0000
2024-01-02T01,18w77ax,3,12528,Unexpected,2w67q,"This really got me",0,https://v.redd.it/yzmnm9v5cw9c1,0.86,288,1704144375,2024-01-01T09:26:15+0000
2024-01-02T01,18w73nw,79,3851,meirl,2s5ti,meirl,0,https://v.redd.it/1rnvjkeabw9c1,0.98,55,1704144113,2024-01-01T09:21:53+0000
2024-01-02T01,18w73li,35,4854,therewasanattempt,39ne7,"To “never again” (Gaza 2023 vs Nazi Germany 1943)",0,https://i.redd.it/owfvzehdbw9c1.jpeg,0.72,1143,1704144109,2024-01-01T09:21:49+0000
2024-01-02T01,18w6xc0,75,2472,OnePiece,2rfz5,"my cosplay attempt at Nami",0,http://i.imgur.com/loVfiyb.jpg,0.76,304,1704143675,2024-01-01T09:14:35+0000
2024-01-02T01,18w6ubl,33,4396,gaming,2qh03,"Former Call of Duty and Blizzard Devs Speak Out Against Bobby Kotick; States He Made Games Worse",0,https://mp1st.com/news/former-call-of-duty-and-blizzard-devs-speak-out-against-bobby-kotick-states-he-made-games-worse,0.96,335,1704143459,2024-01-01T09:10:59+0000
2024-01-02T01,18w6sxk,39,3856,mildlyinteresting,2ti4h,"I found a tiny little skull on my stairs while vacuuming",0,https://i.redd.it/xwmwmfd59w9c1.jpeg,0.91,369,1704143363,2024-01-01T09:09:23+0000
2024-01-02T01,18w6q0m,30,10222,facepalm,2r5rp,"Lets go Crazy",0,https://i.redd.it/ybxeto5h8w9c1.jpeg,0.95,470,1704143160,2024-01-01T09:06:00+0000
2024-01-02T01,18w6pk9,21,5105,BlackPeopleTwitter,33x33,"2024 New Year’s resolution",0,https://v.redd.it/hdbykbeg8w9c1,0.93,507,1704143128,2024-01-01T09:05:28+0000
2024-01-02T01,18w6oya,25,5087,interestingasfuck,2qhsa,"Hidden freezer under floorboard at an open house. 2 acre property in Sonoma County.",0,https://v.redd.it/3yly6f7b8w9c1,0.93,931,1704143086,2024-01-01T09:04:46+0000
2024-01-02T01,18w6kt1,99,2113,CFB,2qm9d,"[Game Thread] Rose Bowl: Michigan vs. Alabama (5:00 PM ET)",1,https://www.reddit.com/r/CFB/comments/18w6kt1/game_thread_rose_bowl_michigan_vs_alabama_500_pm/,0.92,75539,1704142806,2024-01-01T09:00:06+0000
2024-01-02T01,18w6bpd,70,2690,marvelmemes,35mye,"which one is the best ?",0,https://i.redd.it/ud21c2rl5w9c1.jpeg,0.96,300,1704142170,2024-01-01T08:49:30+0000
2024-01-02T01,18w6ayu,10,9331,dankmemes,2zmfe,"STEAM BOAT WILLIE, NOOOOOOO!",0,https://i.redd.it/jb7olhcg5w9c1.jpeg,0.94,116,1704142118,2024-01-01T08:48:38+0000
2024-01-02T01,18w6awu,63,5271,tumblr,2r7hk,"Who has suffered more, Jesus Christ or Shounen Anime women?",0,https://i.redd.it/ei5csd0e5w9c1.png,0.92,188,1704142115,2024-01-01T08:48:35+0000
2024-01-02T01,18w61ly,1,23725,MadeMeSmile,2uqcm,"What a weight loss journey! She looks so much happier now",0,https://v.redd.it/r2jkm9vf3w9c1,0.94,658,1704141467,2024-01-01T08:37:47+0000
2024-01-02T01,18w5y7y,2,13841,politics,2cneq,"House Republican: Jeffrey Epstein flight logs not released because colleagues would be ‘compromised’",0,https://www.washingtontimes.com/news/2023/dec/23/reptim-burchett-jeffrey-epstein-flight-logs-not-re/,0.95,1016,1704141226,2024-01-01T08:33:46+0000
2024-01-02T01,18w5vro,16,8715,technicallythetruth,3pzez,"they are more than that but yes",0,https://i.redd.it/fdypabs92w9c1.png,0.96,238,1704141051,2024-01-01T08:30:51+0000
2024-01-02T01,18w5jap,8,10245,news,2qh3l,"CNN: Melissa Hoskins: Two-time Olympic cyclist dies aged 32 after being hit by car",0,https://www.cnn.com/2024/01/01/sport/melissa-hoskins-dies-hit-by-car-spt-intl/index.html,0.94,586,1704140178,2024-01-01T08:16:18+0000
2024-01-02T01,18w5cyl,47,6487,pics,2qh0u,"Michael J. Fox celebrates the New Year with his wife Tracy Pollan",0,https://i.redd.it/1ul63wzdyv9c1.jpeg,0.97,123,1704139745,2024-01-01T08:09:05+0000
2024-01-02T01,18w5a3c,43,7199,todayilearned,2qqjc,"TIL: Supercomputers know how to solve EVERY chess ending that has seven pieces or fewer remaining, regardless of position, makeup of the remaining pieces, or possible moves. This information, known as endgame tablebase, is currently 18.4 terabytes in size.",0,"https://en.wikipedia.org/wiki/Endgame_tablebase#:~:text=By%20August%202012%2C%20tablebases%20had,solve%20all%20eight-piece%20positions..",0.97,265,1704139548,2024-01-01T08:05:48+0000
2024-01-02T01,18w58cu,78,13192,facepalm,2r5rp,"$1500 fine for respecting transgender people",0,https://i.redd.it/81lk129cxv9c1.png,0.86,3415,1704139426,2024-01-01T08:03:46+0000
2024-01-02T01,18w587u,15,9273,CuratedTumblr,3x5kfw,"She's breaking new ground",0,https://i.redd.it/svr5086fxv9c1.jpeg,0.96,381,1704139417,2024-01-01T08:03:37+0000
2024-01-02T01,18w56qp,20,6944,NatureIsFuckingLit,3gdh7,"🔥 Elephant and rhino confrontation",0,https://v.redd.it/budcq5j4xv9c1,0.97,580,1704139319,2024-01-01T08:01:59+0000
2024-01-02T01,18w51e2,64,3428,PeterExplainsTheJoke,121h8r,Petah,0,https://i.redd.it/2vez2rc2wv9c1.jpeg,0.9,174,1704138961,2024-01-01T07:56:01+0000
2024-01-02T01,18w5093,7,18899,me_irl,2vegg,Me_irl,0,https://i.redd.it/excxptitvv9c1.jpeg,0.96,246,1704138884,2024-01-01T07:54:44+0000
2024-01-02T01,18w4y5l,32,5977,HumansBeingBros,2xh58,"Daddy’s little helper ",0,https://v.redd.it/86o993pdvv9c1,0.96,73,1704138736,2024-01-01T07:52:16+0000
2024-01-02T01,18w4vok,72,5669,mildlyinfuriating,2ubgg,"Made a reservation for 11:30 (when they open) at a buffet only to arrive and be told that they don't put the food out until 12.",0,https://i.redd.it/zh2zlmgwuv9c1.jpeg,0.96,209,1704138575,2024-01-01T07:49:35+0000
2024-01-02T01,18w4uay,19,9118,HollowKnightMemes,j958e,"If anyone could find the source, that would be appreciated",0,https://i.redd.it/lipngi6muv9c1.gif,0.95,110,1704138479,2024-01-01T07:47:59+0000
2024-01-02T01,18w4r5f,29,6573,nextfuckinglevel,m0bnr,"Staying so calm while crashing",0,https://v.redd.it/9k88uaqwtv9c1,0.95,339,1704138248,2024-01-01T07:44:08+0000
2024-01-02T01,18w4muz,40,4717,BikiniBottomTwitter,3deqz,"Farewell, Tom Scott",0,https://i.redd.it/ev3o8op0tv9c1.jpeg,0.94,64,1704137937,2024-01-01T07:38:57+0000
2024-01-02T01,18w4iwf,5,30558,facepalm,2r5rp,"You aren't welcome here for Christmas",0,https://i.redd.it/ymd3x1s4sv9c1.png,0.88,1242,1704137652,2024-01-01T07:34:12+0000
2024-01-02T01,18w4frl,81,3202,titanfall,2xh0g,"Developer exclusive Titanfall Xbox One",0,https://www.reddit.com/gallery/18w4frl,0.97,96,1704137433,2024-01-01T07:30:33+0000
2024-01-02T01,18w4f8v,77,3247,SpidermanPS4,3f1fs,"👁️👁️",0,https://i.redd.it/ul7ob7kdrv9c1.jpeg,0.96,230,1704137400,2024-01-01T07:30:00+0000
2024-01-02T01,18w49tg,44,4708,AbsoluteUnits,a7wuv,"Dwarf Juggernaut",0,https://v.redd.it/53wqfc73qv9c1,0.94,320,1704137018,2024-01-01T07:23:38+0000
2024-01-02T01,18w45rn,50,4792,shitposting,2usxq,"""Show us your most memorable-""",0,https://v.redd.it/mtui3eogpv9c1,0.96,114,1704136743,2024-01-01T07:19:03+0000
2024-01-02T01,18w425y,6,27189,pics,2qh0u,"My grandpa just showed me this picture, of my great grandmother with an German politician.",0,https://i.redd.it/7wx4dj9qov9c1.jpeg,0.92,2343,1704136494,2024-01-01T07:14:54+0000
2024-01-02T01,18w3vhy,18,13154,memes,2qjpg,"Legend gone",0,https://i.redd.it/whadcneanv9c1.jpeg,0.93,250,1704136024,2024-01-01T07:07:04+0000
2024-01-02T01,18w3szu,27,9044,comics,2qh0s,"Leaving the Flock",0,https://i.redd.it/049bft3jmv9c1.png,0.87,149,1704135859,2024-01-01T07:04:19+0000
2024-01-02T01,18w3re0,9,23920,Damnthatsinteresting,2xxyj,"The exhaustion level of the participants of the French Cross Race Championship",0,https://v.redd.it/kzqqnlremv9c1,0.9,2144,1704135748,2024-01-01T07:02:28+0000
2024-01-02T01,18w3m2w,98,3059,TikTokCringe,mvcq5,"No cringe but useful to know ",0,https://v.redd.it/rmjnxatelv9c1,0.97,45,1704135384,2024-01-01T06:56:24+0000
2024-01-02T01,18w3k0d,90,5492,BlackPeopleTwitter,33x33,"Does Elon not know what their biggest song is about?",0,https://i.redd.it/boqecm20lv9c1.jpeg,0.95,349,1704135240,2024-01-01T06:54:00+0000
2024-01-02T01,18w3gmc,51,5308,Terraria,2sg5b,"lucky item idea",0,https://i.redd.it/r7dd20sakv9c1.png,0.97,56,1704135004,2024-01-01T06:50:04+0000
2024-01-02T01,18w3e5m,62,4329,BrandNewSentence,mbn0j,"Go go gadget holocaust trauma",0,https://i.redd.it/4d7ce0irjv9c1.png,0.97,72,1704134824,2024-01-01T06:47:04+0000
2024-01-02T01,18w3csk,22,9364,antiwork,2y77d,"This Idea Went Extinct In America.",0,https://i.redd.it/hy0hzr0hjv9c1.jpeg,0.93,190,1704134728,2024-01-01T06:45:28+0000
2024-01-02T01,18w3bnx,41,5385,OldSchoolCool,2tycb,"Chief John Smith was an Ojibwe (Chippewa) Indian who lived in the area of Cass Lake, Minnesota. He died in 1922 at the (alleged) ripe old age of 137.",0,https://i.redd.it/kezakz59jv9c1.jpeg,0.94,240,1704134652,2024-01-01T06:44:12+0000
2024-01-02T01,18w2z1k,14,17775,mildlyinfuriating,2ubgg,"Greedy Landlords are killing the few good businesses.",0,https://i.redd.it/n4gxfljmgv9c1.jpeg,0.89,1159,1704133768,2024-01-01T06:29:28+0000
2024-01-02T01,18w2p3d,67,4465,BeAmazed,363r3,"The early earthquake warning system in Japan!",0,https://v.redd.it/p0z1aqwars9c1,0.96,162,1704133054,2024-01-01T06:17:34+0000
2024-01-02T01,18w2ord,37,7876,meirl,2s5ti,meirl,0,https://i.redd.it/47c0g6dfev9c1.jpeg,0.96,60,1704133029,2024-01-01T06:17:09+0000
2024-01-02T01,18w2np9,46,5620,PublicFreakout,2yrq6,"Entitled Billionaire NFL Owner Throws Drink At Fans",0,https://v.redd.it/mwidnbw3ev9c1,0.95,428,1704132950,2024-01-01T06:15:50+0000
2024-01-02T01,18w2j1v,28,9534,funny,2qh33,"Video game logic.",0,https://i.redd.it/pnatsym6dv9c1.jpeg,0.96,114,1704132611,2024-01-01T06:10:11+0000
2024-01-02T01,18w2hbi,45,8031,whenthe,23gidu,"Whenthe: ",0,https://v.redd.it/7uxgfkkscv9c1,0.94,172,1704132482,2024-01-01T06:08:02+0000
2024-01-02T01,18w2dhe,11,20154,WhitePeopleTwitter,35n7t,"I'm sensing a trend",0,https://i.redd.it/ebm3ztpxbv9c1.jpeg,0.94,470,1704132192,2024-01-01T06:03:12+0000
2024-01-02T01,18w2bon,91,3838,lgbt,2qhh7,"Starting the new year with a win for the girls and the gays😌💅",0,https://i.redd.it/4uflprdkbv9c1.png,0.91,139,1704132070,2024-01-01T06:01:10+0000
2024-01-02T01,18w2ake,53,7057,cursedcomments,hw1ju,"cursed canine",0,https://i.redd.it/wz6nyntdbv9c1.jpeg,0.97,58,1704132008,2024-01-01T06:00:08+0000
2024-01-02T01,18w1wvg,96,3926,AskReddit,2qh1i,"What criminal committed an almost perfect crime and what was the thing that messed it up?",1,https://www.reddit.com/r/AskReddit/comments/18w1wvg/what_criminal_committed_an_almost_perfect_crime/,0.95,1209,1704130995,2024-01-01T05:43:15+0000
2024-01-02T01,18w1r0f,57,6221,madlads,3aegn,"Happy public domain day",0,https://i.redd.it/weofzbp37v9c1.jpeg,0.97,35,1704130565,2024-01-01T05:36:05+0000
2024-01-02T01,18w16vq,55,8339,theydidthemath,2x23b,"[Request] is this true?",0,https://i.redd.it/guqm82fn2v9c1.jpeg,0.93,313,1704129073,2024-01-01T05:11:13+0000
2024-01-02T01,18w16ov,24,14370,ancientrome,2s8l1,"Syrian Archaeologist Khaled al-Asaad pictured with a 2nd Century Roman Palmyrene family’s funerary relief; Palmyra, Syria. He was beheaded by ISIS in 2015, for refusing to disclose the location of ancient artifacts from the site, after a month of torture. Today would’ve been his 92nd birthday",0,https://i.redd.it/skuiujfm2v9c1.jpeg,0.97,291,1704129059,2024-01-01T05:10:59+0000
2024-01-02T01,18w0vqw,52,35709,me_irl,2vegg,"me irl",0,https://i.redd.it/23o76i870v9c1.png,0.91,629,1704128248,2024-01-01T04:57:28+0000
2024-01-02T01,18w0phj,95,4825,AITAH,446kys,"AITA for not telling my sister that my baby's ""name"" was always just a joke",1,https://www.reddit.com/r/AITAH/comments/18w0phj/aita_for_not_telling_my_sister_that_my_babys_name/,0.93,795,1704127776,2024-01-01T04:49:36+0000
2024-01-02T01,18w0ouk,88,10409,MadeMeSmile,2uqcm,"Son Pays The Mortgage Of Parents",0,https://v.redd.it/n14qa1olyu9c1,0.95,368,1704127725,2024-01-01T04:48:45+0000
2024-01-02T01,18w0k89,71,6151,Wellthatsucks,2xcv7,"Happy new year indeed",0,https://i.redd.it/n31xbb4mxu9c1.jpeg,0.97,98,1704127376,2024-01-01T04:42:56+0000
2024-01-02T01,18w0jpw,89,5359,Showerthoughts,2szyo,"A majority of people’s LAST word of the year is ‘one’",1,https://www.reddit.com/r/Showerthoughts/comments/18w0jpw/a_majority_of_peoples_last_word_of_the_year_is_one/,0.88,384,1704127335,2024-01-01T04:42:15+0000
2024-01-02T01,18w0j8h,26,16207,nottheonion,2qnts,"Pastor accused of trying to push McDonald's cook's head into deep fryer for 'disrespecting' his wife",0,https://abc6onyourside.com/news/nation-world/pastor-accused-pushing-mcdonalds-cooks-head-deep-fryer-disrespecting-wife-dwayne-waden-assault-battery-arrest-charges-fast-food-chain-restaurant-attack-employee-victim-high-point-north-carolina,0.95,1050,1704127299,2024-01-01T04:41:39+0000
2024-01-02T01,18w0ied,85,5372,wallstreetbets,2th52,"I Demand Satisfaction",0,https://i.redd.it/pfp0v9e7xu9c1.jpeg,0.96,250,1704127237,2024-01-01T04:40:37+0000
2024-01-02T01,18w0hso,97,8596,politics,2cneq,"The Wisconsin Supreme Court has thrown out the GOP-drawn district maps. That could be a huge change for the purple state",0,https://www.cbsnews.com/news/wisconsin-supreme-court-ruling-republican-drawn-district-maps-fallout/,0.97,302,1704127195,2024-01-01T04:39:55+0000
2024-01-02T01,18w0ho5,31,29274,Funnymemes,2xqtc,"Aye yo lmao 😂 😂",0,https://i.redd.it/tegctgv1xu9c1.jpeg,0.87,922,1704127185,2024-01-01T04:39:45+0000
2024-01-02T01,18w0g7v,58,6822,europe,2qh4j,"France will no longer accept imams trained by foreign countries",0,https://www.rfi.fr/en/france/20240101-france-will-no-longer-accept-imams-trained-by-foreign-countries,0.95,505,1704127074,2024-01-01T04:37:54+0000
2024-01-02T01,18w081v,82,6034,ProgrammerHumor,2tex6,iThoughtItWasAJoke,0,https://i.redd.it/e0jit5zpuu9c1.jpeg,0.94,411,1704126455,2024-01-01T04:27:35+0000
2024-01-02T01,18w02da,65,7214,instantbarbarians,35heo,"⚽🧴balls and gifts",0,https://v.redd.it/5tr6xgjjtu9c1,0.93,47,1704126031,2024-01-01T04:20:31+0000
2024-01-02T01,18vzz4r,54,9145,DOG,2qiy5,"This owner did not give up on their dog after it had stroke. What a champion!",0,https://v.redd.it/i0a9g7v8su9c1,0.95,131,1704125793,2024-01-01T04:16:33+0000
2024-01-02T01,18vztst,92,5385,worldnews,2qh13,"Imports of diamonds from Russia to EU banned from today",0,https://www.ukrinform.net/rubric-economy/3807641-imports-of-diamonds-from-russia-to-eu-banned-from-today.html,0.96,179,1704125392,2024-01-01T04:09:52+0000
2024-01-02T01,18vzo5p,36,15056,videos,2qh1e,"Tom Scott - After ten years, it's time to stop making videos",0,https://www.youtube.com/watch?v=7DKv5H5Frt0,0.91,863,1704124942,2024-01-01T04:02:22+0000
2024-01-02T01,18vzgii,42,14031,clevercomebacks,dyqlw,"Onions are superior",0,https://i.redd.it/g3ypimvlou9c1.png,0.93,309,1704124347,2024-01-01T03:52:27+0000
2024-01-02T01,18vz9fd,56,10608,SipsTea,5tdqj0,"Sir,this is a marker",0,https://v.redd.it/2f9ues9wmu9c1,0.91,210,1704123782,2024-01-01T03:43:02+0000
2024-01-02T01,18vz65a,34,23048,technology,2qh16,"Japanese disaster prevention X account can’t post anymore after hitting API limit - The issue has arisen after major Tsunami warnings have been issued in areas of Japan following a strong earthquake",0,https://www.dexerto.com/tech/japanese-disaster-prevention-x-account-cant-post-anymore-after-hitting-api-limit-2451266/,0.93,1316,1704123526,2024-01-01T03:38:46+0000
2024-01-02T01,18vyx3a,93,13484,news,2qh3l,"Disney's earliest Mickey and Minnie Mouse enter public domain as US copyright expires",0,https://www.bbc.com/news/entertainment-arts-67833411,0.96,592,1704122771,2024-01-01T03:26:11+0000
2024-01-02T01,18vyw24,74,9106,wholesomememes,3gcwj,"Gotta learn to work with those other employees",0,https://i.redd.it/obqxq2okju9c1.jpeg,0.97,128,1704122684,2024-01-01T03:24:44+0000
2024-01-02T01,18vyugs,69,24696,WhitePeopleTwitter,35n7t,"“I’m not a part of the MAGA agenda”",0,https://i.redd.it/jxeszpu9ju9c1.jpeg,0.93,1328,1704122552,2024-01-01T03:22:32+0000
2024-01-02T01,18vykgm,76,8639,megalophobia,31gwh,"This bodycam horror game taking place inside a deep forest where you try to survive against a giant snake",0,https://v.redd.it/3i1iqf6mgu9c1,0.92,425,1704121720,2024-01-01T03:08:40+0000
2024-01-02T01,18vyjmk,87,7966,MapPorn,2si92,"European exploration of North America",0,https://i.redd.it/ponhuyvkgu9c1.jpeg,0.94,506,1704121649,2024-01-01T03:07:29+0000
2024-01-02T01,18vy6l1,66,15843,oddlyterrifying,2yo6b,"New Year's Eve in Paris - 1/1/2024",0,https://v.redd.it/3gik3omucu9c1,0.87,1289,1704120529,2024-01-01T02:48:49+0000
2024-01-02T01,18vxkff,61,13231,PoliticalHumor,2qm21,"quit whining 'cause it's bringing me down",0,https://i.redd.it/fq7dt0m87u9c1.jpeg,0.95,379,1704118504,2024-01-01T02:15:04+0000
2024-01-02T01,18vxeje,68,13305,science,mouw,"Cannabis users appear to be relying less on conventional sleep aids: 80% of surveyed cannabis users reported no longer using sleep aids such as melatonin and benzodiazepines. Instead, they had a strong preference for inhaling high-THC cannabis by smoking joints or vaporizing flower",0,https://news.wsu.edu/press-release/2023/11/13/cannabis-users-appear-to-be-relying-less-on-conventional-sleep-aids/,0.89,1563,1704117933,2024-01-01T02:05:33+0000
2024-01-02T01,18vxd3y,84,10713,toptalent,3ptyd,"Magnus Scheving almost 20 years after Lazy Town",0,https://v.redd.it/h7odkym35u9c1,0.96,184,1704117803,2024-01-01T02:03:23+0000
2024-01-02T01,18vx81g,48,38482,rareinsults,48t85,"self depricating humour",0,https://i.redd.it/xp4zfexs3u9c1.jpeg,0.92,416,1704117351,2024-01-01T01:55:51+0000
2024-01-02T01,18vvccv,80,31247,Construction,2qiuc,"Bricklayer had some time on his hands",0,https://i.redd.it/zlo4rigpit9c1.jpeg,0.96,536,1704110255,2024-01-01T11:57:35+0000
