date,id,position,score,subreddit_display_name,subreddit_id,title,is_self,url,upvote_ratio,num_comments,created,created_date
2024-01-08T17,191omdf,64,1103,JeffArcuri,740oig,"Pregnant ladies",0,https://v.redd.it/16o2uerfp8bc1,0.98,20,1704730051,2024-01-08T04:07:31+0000
2024-01-08T17,191nwj5,57,1409,Embroidery,2rh53,"3 years of work 😅 Only you guys will appreciate it",0,https://i.redd.it/3xqieiq4k8bc1.jpeg,0.99,111,1704728186,2024-01-08T03:36:26+0000
2024-01-08T17,191nvcs,50,1541,nba,2qo4s,"[Wojnarowski] In a new edition of the Draymond Green Show, Golden State’s star suggests that Adam Silver talked him out of retirement: “I told him, ‘Adam this is too much for me…It’s all becoming too much for me – and I’m going to retire.’” Story on ESPN:",0,https://twitter.com/wojespn/status/1744382149145297378,0.93,625,1704728102,2024-01-08T03:35:02+0000
2024-01-08T17,191n7o2,11,3679,pics,2qh0u,"A sheep showing gratitude to the dog that saved him from a wolf attack. Notice the spike collar.",0,https://www.reddit.com/gallery/191n7o2,0.94,228,1704726289,2024-01-08T03:04:49+0000
2024-01-08T17,191n4zn,62,1420,StrangerThings,3adlm,"'Stranger Things 5' Officially Begins Production",0,https://i.redd.it/60pm6opwd8bc1.jpeg,0.95,226,1704726097,2024-01-08T03:01:37+0000
2024-01-08T17,191n1wd,4,5554,Unexpected,2w67q,"The real answer to the trolley problem",0,https://v.redd.it/3fupodx9d8bc1,0.94,116,1704725881,2024-01-08T02:58:01+0000
2024-01-08T17,191mur3,28,2611,technicallythetruth,3pzez,"Different kinds of luck",0,https://i.redd.it/lb429kmhb8bc1.png,0.99,32,1704725295,2024-01-08T02:48:15+0000
2024-01-08T17,191mu4u,27,2731,me_irl,2vegg,"me irl",0,https://i.redd.it/hwyf3r8db8bc1.jpeg,0.99,52,1704725244,2024-01-08T02:47:24+0000
2024-01-08T17,191mtpj,9,4348,comics,2qh0s,"Direct brain injector",0,https://www.reddit.com/gallery/191mtpj,0.99,75,1704725212,2024-01-08T02:46:52+0000
2024-01-08T17,191mj36,31,2558,oddlysatisfying,2x93b,"Machine automates the process of levelling and troweling",0,https://v.redd.it/vlz9qu4o88bc1,0.94,143,1704724351,2024-01-08T02:32:31+0000
2024-01-08T17,191mdwl,14,3773,HolUp,qir9n,"Whats happening here, I'm confused",0,https://i.redd.it/0cjaun3h78bc1.jpeg,0.95,124,1704723939,2024-01-08T02:25:39+0000
2024-01-08T17,191mcmm,55,1747,BlackPeopleTwitter,33x33,"Not everything has to be set to ""oontz-oontz"" music",0,https://i.redd.it/pdtl1pe078bc1.jpeg,0.95,109,1704723839,2024-01-08T02:23:59+0000
2024-01-08T17,191ma11,53,1815,todayilearned,2qqjc,"TIL that Keith Hernandez testified before a federal grand jury in September 1985 that an estimated 40 percent of MLB players used cocaine. Even the Pittsburgh Pirates mascot, the Pirate Parrott, was implicated for buying cocaine.",0,https://www.history.com/this-day-in-history/sports-suspensions-drugs-mlb-scandal,0.98,130,1704723636,2024-01-08T02:20:36+0000
2024-01-08T17,191m48b,8,4770,news,2qh3l,"Lauren Boebert: Police look into apparent Colorado restaurant row",0,https://www.bbc.com/news/world-us-canada-67911826,0.95,355,1704723175,2024-01-08T02:12:55+0000
2024-01-08T17,191m3xd,40,2227,AbsoluteUnits,a7wuv,"of a dog. Bro is built like a brick not a sausage. ",0,https://v.redd.it/jicae6i558bc1,0.83,298,1704723148,2024-01-08T02:12:28+0000
2024-01-08T17,191m3rg,73,1421,videos,2qh1e,"Richard Ayoade Has a Mental Breakdown",0,https://youtu.be/zIi67lzugeg?si=TLvtBqZOAcykNWKn,0.9,275,1704723136,2024-01-08T02:12:16+0000
2024-01-08T17,191m205,16,3522,MapPorn,2si92,"The size of the Roman Empire at its height compared to the United States",0,https://i.redd.it/t14qh2qp48bc1.png,0.94,438,1704723000,2024-01-08T02:10:00+0000
2024-01-08T17,191m1y9,67,1526,nextfuckinglevel,m0bnr,"Amazing acoustic guitar [via IG]",0,https://v.redd.it/0tguesdh18bc1,0.93,164,1704722996,2024-01-08T02:09:56+0000
2024-01-08T17,191m0tp,22,3443,maybemaybemaybe,38e1l,"maybe maybe maybe",0,https://v.redd.it/mcp05yke48bc1,0.86,532,1704722902,2024-01-08T02:08:22+0000
2024-01-08T17,191lyp8,60,1702,Teachers,2qqcs,"A boy started masturbating in class, that wasn’t even why he was expelled.",1,https://www.reddit.com/r/Teachers/comments/191lyp8/a_boy_started_masturbating_in_class_that_wasnt/,0.97,263,1704722735,2024-01-08T02:05:35+0000
2024-01-08T17,191ltc7,100,1167,apple,2qh1f,"Apple Vision Pro available in the U.S. on February 2",0,https://www.apple.com/newsroom/2024/01/apple-vision-pro-available-in-the-us-on-february-2/,0.93,615,1704722338,2024-01-08T01:58:58+0000
2024-01-08T17,191ls8x,34,2789,theydidthemath,2x23b,"[Request] Does this work? And if so, why?",0,https://i.redd.it/qui3zivg28bc1.jpeg,0.96,55,1704722245,2024-01-08T01:57:25+0000
2024-01-08T17,191lmk9,86,1325,Palestine,2qhak,"IOF shoots directly a Palestinian women with walking with a kid holding a white flag in Gaza. ",0,https://v.redd.it/oa6e97kz08bc1,0.92,150,1704721755,2024-01-08T01:49:15+0000
2024-01-08T17,191laqn,32,6496,meirl,2s5ti,meirl,0,https://i.redd.it/dqpoxn0yx7bc1.jpeg,0.93,386,1704720727,2024-01-08T01:32:07+0000
2024-01-08T17,191la6m,58,2013,DeepRockGalactic,3iufz,"Congrats RDR2 on Employee of the Month!",0,https://i.redd.it/9vw46foox7bc1.jpeg,0.97,38,1704720678,2024-01-08T01:31:18+0000
2024-01-08T17,191l9lj,38,2623,rareinsults,48t85,"Na na na na na na na na……",0,https://i.redd.it/kybrktonx7bc1.png,0.95,82,1704720632,2024-01-08T01:30:32+0000
2024-01-08T17,191l3y7,23,3876,wholesomememes,3gcwj,"sweet dad and daughter ❤️",0,https://i.redd.it/xaq0q5d5w7bc1.jpeg,0.98,32,1704720144,2024-01-08T01:22:24+0000
2024-01-08T17,191l3dz,96,1340,NYGiants,2ruqw,"[pelissero] The #Giants fired OL coach Bobby Johnson, per sources.",0,https://twitter.com/tompelissero/status/1744348019091222771?s=46,0.95,265,1704720091,2024-01-08T01:21:31+0000
2024-01-08T17,191l2pc,52,2220,WhitePeopleTwitter,35n7t,"Wake up Babe. The GOP crazies are trying out a new hashtag again.",0,https://i.redd.it/zvgulmzvv7bc1.jpeg,0.96,280,1704720032,2024-01-08T01:20:32+0000
2024-01-08T17,191l005,13,4398,PoliticalHumor,2qm21,"Let's be honest here. Lauren Boebert is like an even dumber version of Sarah Palin.",0,https://i.redd.it/syomfeq6v7bc1.jpeg,0.95,238,1704719796,2024-01-08T01:16:36+0000
2024-01-08T17,191ktnx,66,1832,thesims,2rbdu,"Asked an artist for a tattoo based on this idea, what should I write instead?",0,https://i.redd.it/3wjsgpvit7bc1.jpeg,0.95,142,1704719237,2024-01-08T01:07:17+0000
2024-01-08T17,191ksip,79,2925,clevercomebacks,dyqlw,"Wait crime is illegal…? Since when?",0,https://i.redd.it/5m63ozb8t7bc1.jpeg,0.97,143,1704719140,2024-01-08T01:05:40+0000
2024-01-08T17,191kjam,56,2332,mildlyinteresting,2ti4h,"Dropped my iPhone on a beach and the MagSafe case attracted titanomagnetite from the black sand",0,https://i.redd.it/9axsq9rtq7bc1.jpeg,0.96,140,1704718331,2024-01-08T12:52:11+0000
2024-01-08T17,191kimm,78,1796,india,2qh1q,"He raped her and I couldn’t do anything",1,https://www.reddit.com/r/india/comments/191kimm/he_raped_her_and_i_couldnt_do_anything/,0.89,569,1704718269,2024-01-08T12:51:09+0000
2024-01-08T17,191kij2,49,2653,pokemon,2qmeb,"The plot of Scarlet & Violet is absolutely wild. (OC)",0,https://i.redd.it/tdzb81cmq7bc1.jpeg,0.97,34,1704718261,2024-01-08T12:51:01+0000
2024-01-08T17,191kf2o,21,4224,LeopardsAteMyFace,3jp3p,"Florida man notices that DeSantis no longer spends time in the State instead is using donor money for private flights and lifted cowboy boots!",0,https://www.politico.com/news/2024/01/08/ron-desantis-campaign-legislature-florida-00134265,0.96,93,1704717936,2024-01-08T12:45:36+0000
2024-01-08T17,191k8jb,71,1961,distressingmemes,5aiyne,"Good evening y'all ",0,https://v.redd.it/kc7v5wopn7bc1,0.97,101,1704717284,2024-01-08T12:34:44+0000
2024-01-08T17,191k88r,69,1975,CuratedTumblr,3x5kfw,"Suicidal Ideation Man",0,https://i.redd.it/pu50mkpmn7bc1.jpeg,0.97,36,1704717257,2024-01-08T12:34:17+0000
2024-01-08T17,191k7pj,3,11167,Wellthatsucks,2xcv7,"This is so messed up y’all plz be careful out here",0,https://www.reddit.com/gallery/191k7pj,0.92,2125,1704717203,2024-01-08T12:33:23+0000
2024-01-08T17,191k7m5,33,3663,TikTokCringe,mvcq5,"In a prison, cat is man's best friends",0,https://v.redd.it/kziis41an7bc1,0.94,245,1704717194,2024-01-08T12:33:14+0000
2024-01-08T17,191k5am,65,2103,harrypotter,2qiqi,"I am sorry Hermione he is a what now ?",0,https://i.redd.it/b7f7yainm7bc1.png,0.95,283,1704716972,2024-01-08T12:29:32+0000
2024-01-08T17,191k2pd,75,1955,Weird,2qlia,"Octopus clings to pregnant lady ",0,https://v.redd.it/w9bfhy5yl7bc1,0.9,325,1704716704,2024-01-08T12:25:04+0000
2024-01-08T17,191k1m2,68,2114,oddlyterrifying,2yo6b,"Octopus clings to pregnant lady",0,https://v.redd.it/dzswmukml7bc1,0.89,245,1704716595,2024-01-08T12:23:15+0000
2024-01-08T17,191k0bb,12,5690,SipsTea,5tdqj0,"Your total is going to be 20.18??🤔🤔",0,https://v.redd.it/3n7e0uial7bc1,0.95,198,1704716469,2024-01-08T12:21:09+0000
2024-01-08T17,191jxmm,61,2400,mildlyinfuriating,2ubgg,"Local lady opens “cat cafe”",0,https://i.redd.it/sbhmrpvhk7bc1.jpeg,0.96,206,1704716203,2024-01-08T12:16:43+0000
2024-01-08T17,191jt1i,19,12695,facepalm,2r5rp,"A stronger economy is required.",0,https://i.redd.it/7lnnccx2j7bc1.png,0.95,630,1704715739,2024-01-08T12:08:59+0000
2024-01-08T17,191jqjr,46,3160,FunnyAnimals,2st2l,"I am not worthy, dear sun god",0,https://v.redd.it/nloxgcnai7bc1,0.97,48,1704715468,2024-01-08T12:04:28+0000
2024-01-08T17,191jmqf,51,3010,europe,2qh4j,"what is a fact about your country no one asked for?",0,https://i.redd.it/yzdk2i68h7bc1.jpeg,0.94,1740,1704715102,2024-01-08T11:58:22+0000
2024-01-08T17,191jm0b,20,5180,nottheonion,2qnts,"iPhone Survives 16,000 Foot Drop After Alaska Airlines Midair Door Blow Out",0,https://inshort.geartape.com/iphone-survives-16000-foot-drop-after-alaska-airlines-midair-door-blow-out/,0.91,361,1704715026,2024-01-08T11:57:06+0000
2024-01-08T17,191jlye,94,1808,starwarsmemes,2wzm6,"And we loved it!",0,https://i.redd.it/abpxh8pyg7bc1.jpeg,0.95,74,1704715020,2024-01-08T11:57:00+0000
2024-01-08T17,191jhv8,17,5648,funnyvideos,2qoos,Mr.Bean,0,https://v.redd.it/15nbn31of7bc1,0.96,106,1704714592,2024-01-08T11:49:52+0000
2024-01-08T17,191jhid,47,3420,tumblr,2r7hk,"car battery",0,https://i.redd.it/qr8m70elf7bc1.jpeg,0.96,12,1704714552,2024-01-08T11:49:12+0000
2024-01-08T17,191jgrz,1,19218,meirl,2s5ti,Meirl,0,https://i.redd.it/um0jmw6df7bc1.jpeg,0.96,223,1704714476,2024-01-08T11:47:56+0000
2024-01-08T17,191jfwn,80,2128,Hololive,29numb,"We got the new queen of zako cup",0,https://i.redd.it/pspmvy91f7bc1.jpeg,0.95,84,1704714384,2024-01-08T11:46:24+0000
2024-01-08T17,191jchv,41,3604,BeAmazed,363r3,"Microorganisms in Perspective",0,https://i.imgur.com/hrMeGJc.gifv,0.98,63,1704714043,2024-01-08T11:40:43+0000
2024-01-08T17,191jbpk,26,4981,educationalgifs,2w708,"MICROORGANISMS in Perspective",0,https://i.imgur.com/hrMeGJc.gifv,0.96,135,1704713963,2024-01-08T11:39:23+0000
2024-01-08T17,191jafd,43,3530,MadeMeSmile,2uqcm,"Brie Larson meeting her idol Jennifer Lopez at the Golden Globes",0,https://v.redd.it/9c62f4bed7bc1,0.9,191,1704713827,2024-01-08T11:37:07+0000
2024-01-08T17,191j9ip,29,4669,Eyebleach,2s427,"Capybara- baby",0,https://i.imgur.com/JzdJ6sY.gifv,0.98,45,1704713726,2024-01-08T11:35:26+0000
2024-01-08T17,191j6py,6,10024,politics,2cneq,"Trump didn't even write his tweet urging January 6 protesters to remain 'peaceful': report",0,https://www.businessinsider.com/trump-didnt-even-write-his-own-jan-6-tweets-report-2024-1,0.94,666,1704713438,2024-01-08T11:30:38+0000
2024-01-08T17,191j6ac,76,2327,whenthe,23gidu,Tragic,0,https://v.redd.it/wovqx455c7bc1,0.96,39,1704713402,2024-01-08T11:30:02+0000
2024-01-08T17,191j1rm,99,3450,interestingasfuck,2qhsa,"From the recent Alaska Airlines incident, this passenger phone survives after falling from 16000 feet",0,https://i.redd.it/a3xy0zpka7bc1.jpeg,0.93,349,1704712924,2024-01-08T11:22:04+0000
2024-01-08T17,191ix04,2,20454,facepalm,2r5rp,"Check out this bullshit",0,https://i.redd.it/4ybksdfc97bc1.jpeg,0.94,1836,1704712451,2024-01-08T11:14:11+0000
2024-01-08T17,191iwnw,39,3952,therewasanattempt,39ne7,"to share food and resources",0,https://v.redd.it/x4rajdlw87bc1,0.94,485,1704712413,2024-01-08T11:13:33+0000
2024-01-08T17,191itw4,48,3872,suicidebywords,3on1q,Same,0,https://i.redd.it/dero0zye87bc1.jpeg,0.87,32,1704712139,2024-01-08T11:08:59+0000
2024-01-08T17,191iswp,7,16318,Funnymemes,2xqtc,"Let's keep it going. Give me all you got in the comments 👇",0,https://i.redd.it/rusndkk387bc1.jpeg,0.94,967,1704712032,2024-01-08T11:07:12+0000
2024-01-08T17,191ilo2,93,2226,xboxone,2xbci,"Elite controllers need longer lifespans",0,https://i.redd.it/sc1fxzpx57bc1.jpeg,0.78,981,1704711311,2024-01-08T10:55:11+0000
2024-01-08T17,191ik8d,15,7590,fuckcars,3cs2l,"The car-brain mind can't comprehend this",0,https://v.redd.it/eqcvqr9q47bc1,0.84,848,1704711150,2024-01-08T10:52:30+0000
2024-01-08T17,191iau6,36,11417,comics,2qh0s,Pickpocketing,0,https://i.redd.it/i3ml3ds727bc1.jpeg,0.95,190,1704710078,2024-01-08T10:34:38+0000
2024-01-08T17,191i8p2,18,8144,clevercomebacks,dyqlw,"Cameras in 1400BC🙀",0,https://i.redd.it/ajpwxbyj17bc1.png,0.93,219,1704709833,2024-01-08T10:30:33+0000
2024-01-08T17,191i3p4,59,3941,memes,2qjpg,"During her job interview",0,https://i.redd.it/4hk11s7vz6bc1.jpeg,0.94,58,1704709263,2024-01-08T10:21:03+0000
2024-01-08T17,191i3ju,70,3035,formuladank,3ndbi,"Fernando Rizzlonso",0,https://i.redd.it/tyh9tl4sz6bc1.jpeg,0.93,105,1704709248,2024-01-08T10:20:48+0000
2024-01-08T17,191i2cq,24,10111,shitposting,2usxq,"Happy birthday to myself",0,https://i.redd.it/8fa6wkrfz6bc1.png,0.94,147,1704709123,2024-01-08T10:18:43+0000
2024-01-08T17,191i23y,5,24551,Damnthatsinteresting,2xxyj,"The solitary confinement area for terrorist Anders Breivik, who's suing Norway for inhumane treatment due to being in solitary since 2012.",0,https://v.redd.it/5uktnw6uy6bc1,0.94,4668,1704709097,2024-01-08T10:18:17+0000
2024-01-08T17,191hyta,42,4725,aww,2qh1o,"She tried to jump but it didn’t work out",0,https://v.redd.it/yhuh0j62y6bc1,0.95,82,1704708711,2024-01-08T10:11:51+0000
2024-01-08T17,191hxpv,63,3611,Grimdank,3ilna,"Proud sons of Dorn",0,https://i.redd.it/yf3j6f1ux6bc1.png,0.96,189,1704708587,2024-01-08T10:09:47+0000
2024-01-08T17,191hwnv,91,2630,cyberpunkgame,3az7x,"So did V just cope themselves into being 23 again, what’s with that?",0,https://i.redd.it/a008qrxgx6bc1.jpeg,0.94,315,1704708460,2024-01-08T10:07:40+0000
2024-01-08T17,191huoz,95,2534,holdmycatnip,2zhxd,"smol thief",0,https://i.imgur.com/6gEk2E0.gifv,0.97,26,1704708229,2024-01-08T10:03:49+0000
2024-01-08T17,191huj5,37,5971,PeterExplainsTheJoke,121h8r,"This sub re-ignited my loss paranoia",0,https://i.redd.it/4l9376hqw6bc1.jpeg,0.92,175,1704708210,2024-01-08T10:03:30+0000
2024-01-08T17,191hrmm,25,7587,antiwork,2y77d,Unbelievable,0,https://i.redd.it/eqa0uybuv6bc1.jpeg,0.94,637,1704707910,2024-01-08T09:58:30+0000
2024-01-08T17,191hoiu,84,6306,shitposting,2usxq,"💀",0,https://v.redd.it/3fgpdmnqu6bc1,0.99,53,1704707539,2024-01-08T09:52:19+0000
2024-01-08T17,191hft3,90,3013,MinecraftMemes,2sq0h,"Mojang what the heck",0,https://i.redd.it/v8n05l6or6bc1.png,0.95,99,1704706524,2024-01-08T09:35:24+0000
2024-01-08T17,191hcp0,10,16944,interestingasfuck,2qhsa,"This parrot has unusual baby birds",0,https://v.redd.it/zzw2xmunq6bc1,0.96,251,1704706168,2024-01-08T09:29:28+0000
2024-01-08T17,191h7wo,45,5620,Whatcouldgowrong,2x2oy,"WCGW Climbing in a vase",0,https://v.redd.it/ikjpcuqzo6bc1,0.95,826,1704705615,2024-01-08T09:20:15+0000
2024-01-08T17,191gy04,54,6456,dankmemes,2zmfe,"Thank God it's over",0,https://i.redd.it/gftdy5mml6bc1.jpeg,0.91,452,1704704475,2024-01-08T09:01:15+0000
2024-01-08T17,191gscf,30,8319,worldnews,2qh13,"Australia bans Nazi salute and public display of terror group symbols",0,https://www.ynetnews.com/article/syuerfyut,0.94,999,1704703820,2024-01-08T08:50:20+0000
2024-01-08T17,191gqfs,98,3222,geography,2qnms,"It's lately like this",0,https://i.redd.it/nrilnyei2saa1.png,0.92,227,1704703585,2024-01-08T08:46:25+0000
2024-01-08T17,191gmze,87,3725,AITAH,446kys,"AITAH for switching seats on a plane to sit behind an attractive woman?",1,https://www.reddit.com/r/AITAH/comments/191gmze/aitah_for_switching_seats_on_a_plane_to_sit/,0.78,387,1704703178,2024-01-08T08:39:38+0000
2024-01-08T17,191gm1t,83,3709,JustGuysBeingDudes,33rtj6,"Every facial expression fits the portrait. ",0,https://v.redd.it/g1jkfexfh6bc1,0.95,29,1704703069,2024-01-08T08:37:49+0000
2024-01-08T17,191ga2h,35,10223,BikiniBottomTwitter,3deqz,"In Europe wall punches you",0,https://i.redd.it/3y1zww9bd6bc1.png,0.94,470,1704701680,2024-01-08T08:14:40+0000
2024-01-08T17,191fnj5,92,4228,cats,2qhta,"Under normal circumstances, we often asked who's the father of the litter when the kittens' color differ from their mom. In our case, we questioned if mama cat is really mama cat.",0,https://www.reddit.com/gallery/191fnj5,0.94,229,1704699253,2024-01-08T07:34:13+0000
2024-01-08T17,191fii6,82,5455,ich_iel,37k29,"ich♟️iel",0,https://i.redd.it/vr3dgr4746bc1.png,0.95,103,1704698685,2024-01-08T07:24:45+0000
2024-01-08T17,191fee0,44,10563,Awww,2suml,"so happy...",0,https://v.redd.it/0fjd9ucn26bc1,0.97,90,1704698239,2024-01-08T07:17:19+0000
2024-01-08T17,191eyco,74,16731,Unexpected,2w67q,"There is no stupid question ",0,https://v.redd.it/f1uand17y5bc1,0.94,221,1704696595,2024-01-08T06:49:55+0000
2024-01-08T17,191epxf,77,6849,gaming,2qh03,"Absolutely criminal this game didn’t get a current gen upgrade.",0,https://i.redd.it/cukzkdkjv5bc1.jpeg,0.82,1060,1704695702,2024-01-08T06:35:02+0000
2024-01-08T17,191e1it,97,15055,BeAmazed,363r3,"Kanawatsugi is one of the most difficult joints",0,https://v.redd.it/6uyvdqw9o5bc1,0.95,250,1704693288,2024-01-08T05:54:48+0000
2024-01-08T17,191dpqd,85,7561,wallstreetbets,2th52,"I’m the money printer now",0,https://i.redd.it/ff472z21l5bc1.jpeg,0.95,891,1704692166,2024-01-08T05:36:06+0000
2024-01-08T17,191ddsi,81,8043,ContagiousLaughter,2u2bh,"Scientifically explained, how Santa Claus delivers gifts.",0,https://v.redd.it/tzzitjunh5bc1,0.96,140,1704691039,2024-01-08T05:17:19+0000
2024-01-08T17,191d435,89,7303,fantasyfootball,2qlqq,"Falcons have fired Arthur Smith, per source.",0,https://x.com/adamschefter/status/1744222940403511355,0.95,515,1704690160,2024-01-08T05:02:40+0000
2024-01-08T17,191bzwy,72,15170,chaoticgood,2qjo5,"chad dad",0,https://i.redd.it/xq433ogj45bc1.jpeg,0.93,341,1704686621,2024-01-08T04:03:41+0000
2024-01-08T17,191bttz,88,10835,funny,2qh33,"Catching a break",0,https://v.redd.it/3muriacz25bc1,0.92,293,1704686099,2024-01-08T03:54:59+0000
