date,id,position,score,subreddit_display_name,subreddit_id,title,is_self,url,upvote_ratio,num_comments,created,created_date
2023-12-30T10,18uaud8,44,1308,Awww,2suml,Awww,0,https://v.redd.it/9xu7g5do5e9c1,0.98,18,1703924300,2023-12-30T08:18:20+0000
2023-12-30T10,18ua8ex,30,1750,HumansBeingBros,2xh58,"Mark Potter let his opponent with Down Syndrome win",0,https://v.redd.it/vf8yarujyd9c1,0.93,64,1703921982,2023-12-30T07:39:42+0000
2023-12-30T10,18u9n3o,68,1195,chaoticgood,2qjo5,DOITDOITDOITDOITDOITDOITDOITDOITDOITD,0,https://i.redd.it/8m57wljasd9c1.png,0.95,26,1703919784,2023-12-30T07:03:04+0000
2023-12-30T10,18u92j3,42,1817,MurderedByWords,3hx3r,"Somebody call the morgue!",0,https://i.redd.it/ac48abghmd9c1.jpeg,0.97,25,1703917814,2023-12-30T06:30:14+0000
2023-12-30T10,18u8zqm,69,1335,AITAH,446kys,"AITA for telling my boyfriend if he chooses his mother in life her better choose her in death too",1,https://www.reddit.com/r/AITAH/comments/18u8zqm/aita_for_telling_my_boyfriend_if_he_chooses_his/,0.96,419,1703917537,2023-12-30T06:25:37+0000
2023-12-30T10,18u8tbc,15,3438,me_irlgbt,3apfn,Me_irlgbt,0,https://i.redd.it/1aqlq23tjd9c1.jpeg,0.94,42,1703916929,2023-12-30T06:15:29+0000
2023-12-30T10,18u8syx,75,2202,me_irlgbt,3apfn,"Me🛹irlgbt",0,https://i.redd.it/34cegelojd9c1.jpeg,0.95,39,1703916900,2023-12-30T06:15:00+0000
2023-12-30T10,18u8f8k,1,7899,funnyvideos,2qoos,"Trying to cancel a comedian",0,https://v.redd.it/74c1hrzffd9c1,0.91,565,1703915611,2023-12-30T05:53:31+0000
2023-12-30T10,18u8ek4,84,1255,AbruptChaos,3nasz,Stealth....,0,https://v.redd.it/5234fn5mfd9c1,0.92,72,1703915540,2023-12-30T05:52:20+0000
2023-12-30T10,18u8bq3,98,1111,pcmasterrace,2sgp1,"Thought this deserved to be here unironically",0,https://i.redd.it/qz3yus7xed9c1.jpeg,0.96,149,1703915274,2023-12-30T05:47:54+0000
2023-12-30T10,18u7zco,10,4862,technicallythetruth,3pzez,"I cannot unsee it now",0,https://i.redd.it/sen73brkbd9c1.jpeg,0.99,79,1703914146,2023-12-30T05:29:06+0000
2023-12-30T10,18u7ty6,25,2966,perfectlycutscreams,3n7fs,"Imma beat your ass- aaaaaaaaa",0,https://v.redd.it/2y7qj99v9d9c1,0.96,205,1703913634,2023-12-30T05:20:34+0000
2023-12-30T10,18u7jfq,71,1634,WitchesVsPatriarchy,p3r73,"Cuddles are also good 🙏",0,https://i.redd.it/8hj5jld77d9c1.jpeg,0.95,48,1703912679,2023-12-30T05:04:39+0000
2023-12-30T10,18u7gje,53,2000,whenthe,23gidu,"Autistic people are so commited",0,https://v.redd.it/muzq9fqd6d9c1,0.98,103,1703912434,2023-12-30T05:00:34+0000
2023-12-30T10,18u7fit,74,1629,AskReddit,2qh1i,"What is the scariest story that you know of with actual photographic proof?",1,https://www.reddit.com/r/AskReddit/comments/18u7fit/what_is_the_scariest_story_that_you_know_of_with/,0.92,733,1703912348,2023-12-30T04:59:08+0000
2023-12-30T10,18u7cx3,38,2558,CrazyFuckingVideos,45hae8,"Let me just squeeze over.",0,https://v.redd.it/1prgulxg5d9c1,0.98,187,1703912102,2023-12-30T04:55:02+0000
2023-12-30T10,18u6ysl,5,6934,JustGuysBeingDudes,33rtj6,"Guys will see this and just think ""hell yeah""",0,https://v.redd.it/02ibx2en1d9c1,0.95,190,1703910810,2023-12-30T04:33:30+0000
2023-12-30T10,18u6vo7,27,3104,CFB,2qm9d,"[Postgame Thread] Missouri Defeats Ohio State 14-3",1,https://www.reddit.com/r/CFB/comments/18u6vo7/postgame_thread_missouri_defeats_ohio_state_143/,0.94,2855,1703910543,2023-12-30T04:29:03+0000
2023-12-30T10,18u6vlx,63,3464,BlackPeopleTwitter,33x33,"I think about this like every other day",0,https://i.redd.it/p6rp83fu0d9c1.jpeg,0.96,129,1703910537,2023-12-30T04:28:57+0000
2023-12-30T10,18u6rkn,21,3730,KidsAreFuckingStupid,3948y,"Bro forgot he two-eyed💀",0,https://v.redd.it/cmskx8jrzc9c1,0.93,174,1703910175,2023-12-30T04:22:55+0000
2023-12-30T10,18u6ofg,54,4203,facepalm,2r5rp,"Kitten lawyer",0,https://i.redd.it/srsii2fryc9c1.jpeg,0.94,83,1703909900,2023-12-30T04:18:20+0000
2023-12-30T10,18u6mev,97,1453,nope,2s5fh,"Go to fishing... they say... it's quite relaxing... they say ",0,https://v.redd.it/64laypreyc9c1,0.97,43,1703909719,2023-12-30T04:15:19+0000
2023-12-30T10,18u6kxw,2,13971,facepalm,2r5rp,"""Thousand cock stare"" ???",0,https://i.redd.it/pr1sq0xzxc9c1.jpeg,0.92,1544,1703909583,2023-12-30T04:13:03+0000
2023-12-30T10,18u6iu7,64,2203,Funnymemes,2xqtc,"Fellas you doing this for your girl?",0,https://i.redd.it/xhwq2ngexc9c1.jpeg,0.85,777,1703909400,2023-12-30T04:10:00+0000
2023-12-30T10,18u6coa,6,9226,AbsoluteUnits,a7wuv,"Hardcore fishing.",0,https://v.redd.it/69yaczlsvc9c1,0.9,571,1703908862,2023-12-30T04:01:02+0000
2023-12-30T10,18u684n,77,1976,Genshin_Impact,12p4l2,"You can imagine how hot he is",0,https://i.redd.it/85fdujiouc9c1.jpeg,0.97,93,1703908467,2023-12-30T03:54:27+0000
2023-12-30T10,18u63tj,26,4176,shitposting,2usxq,"It'll require double the effort",0,https://i.redd.it/au4z102ktc9c1.jpeg,0.96,134,1703908087,2023-12-30T03:48:07+0000
2023-12-30T10,18u5vpl,88,1888,CricketShitpost,3fzqh,"THALA WHO?",0,https://i.redd.it/7u695prdrc9c1.jpeg,0.95,143,1703907360,2023-12-30T03:36:00+0000
2023-12-30T10,18u5p83,81,2009,therewasanattempt,39ne7,"To belittle a pornstar",0,https://v.redd.it/9b0qf77rj49c1,0.85,513,1703906773,2023-12-30T03:26:13+0000
2023-12-30T10,18u5mk6,18,5488,WhitePeopleTwitter,35n7t,"So much for doing your own research Charlie",0,https://i.redd.it/8w09ixgzoc9c1.jpeg,0.98,152,1703906549,2023-12-30T03:22:29+0000
2023-12-30T10,18u5lan,73,2229,Costco,2rsgr,"Congratulations Norfolk Virginia",0,https://i.redd.it/pw77t82ooc9c1.jpeg,0.89,307,1703906442,2023-12-30T03:20:42+0000
2023-12-30T10,18u5f4g,33,3836,mildlyinteresting,2ti4h,"My mom got me a stress doll for Christmas and the TSA thought he was drugs :(",0,https://i.redd.it/hbbczoc3nc9c1.jpeg,0.96,146,1703905915,2023-12-30T03:11:55+0000
2023-12-30T10,18u5c9d,7,9726,blackmagicfuckery,3fn31,"Water physics is broken",0,https://v.redd.it/vxkjwhkdmc9c1,0.93,409,1703905674,2023-12-30T03:07:54+0000
2023-12-30T10,18u59k0,62,5000,interestingasfuck,2qhsa,"Finding your car using science",0,https://v.redd.it/us0d9t4qlc9c1,0.93,387,1703905455,2023-12-30T03:04:15+0000
2023-12-30T10,18u58nb,12,8089,marvelmemes,35mye,"Oh, you're right, Storm",0,https://i.redd.it/8diqeahdlc9c1.jpeg,0.97,285,1703905380,2023-12-30T03:03:00+0000
2023-12-30T10,18u53lx,59,2895,Gamingcirclejerk,2sf2b,"Pronouns Rant Guy was right all along!",0,https://i.redd.it/yqoyu1msjc9c1.png,0.89,241,1703904974,2023-12-30T02:56:14+0000
2023-12-30T10,18u4zw7,3,11207,todayilearned,2qqjc,"TIL clover used to be part of every lawn as it was cheap and easy to maintain. After WWII pesticide companies declared it a weed and until recently it's been removed from laws.",0,https://news.wttw.com/2021/05/01/clover-lawns-went-mainstream-maligned-now-they-re-making-comeback,0.97,561,1703904657,2023-12-30T02:50:57+0000
2023-12-30T10,18u4s1t,14,7548,AnimalCrossing,2ro2c,"I crocheted a Lily of the Valley plant and it lights up",0,https://www.reddit.com/gallery/18u4s1t,0.98,134,1703903993,2023-12-30T02:39:53+0000
2023-12-30T10,18u4k6j,85,2403,discordVideos,2cxozx,"Death is upon us.",0,https://v.redd.it/cvpqil7efc9c1,0.98,18,1703903325,2023-12-30T02:28:45+0000
2023-12-30T10,18u4i6p,9,9906,mildlyinfuriating,2ubgg,"Two losers stealing my shoes from a house party",0,https://v.redd.it/pkbjep5uec9c1,0.96,622,1703903155,2023-12-30T02:25:55+0000
2023-12-30T10,18u4ejn,29,4916,Eldenring,122hf1,"my three favorite dragons in the game",0,https://v.redd.it/u2142newdc9c1,0.97,86,1703902844,2023-12-30T02:20:44+0000
2023-12-30T10,18u49va,39,4258,wholesome,2z9ds,"Always look on the bright side.",0,https://v.redd.it/2r1fejuqcc9c1,0.94,88,1703902459,2023-12-30T02:14:19+0000
2023-12-30T10,18u469f,86,4283,politics,2cneq,"Yes, Trump should be removed from the ballot",0,https://www.washingtonpost.com/opinions/2023/12/29/trump-ballot-maine-colorado/,0.93,483,1703902161,2023-12-30T02:09:21+0000
2023-12-30T10,18u45zf,45,3955,Unexpected,2w67q,"As long as Barry is safe",0,https://v.redd.it/6dk73zmsbc9c1,0.95,137,1703902138,2023-12-30T02:08:58+0000
2023-12-30T10,18u45ed,35,4708,ContagiousLaughter,2u2bh,"As long as Barry's safe!",0,https://v.redd.it/gm2xtjznbc9c1,0.94,165,1703902091,2023-12-30T02:08:11+0000
2023-12-30T10,18u44yq,78,2726,DOG,2qiy5,"Lola can make her own decisions",0,https://v.redd.it/wjkxw0ihbc9c1,0.98,36,1703902054,2023-12-30T02:07:34+0000
2023-12-30T10,18u44fw,40,4298,OneOrangeBraincell,5vej89,"My newly adopted son",0,https://i.redd.it/vkt9ngahbc9c1.jpeg,0.96,138,1703902011,2023-12-30T02:06:51+0000
2023-12-30T10,18u3s1d,4,22722,cats,2qhta,"boyfriend broke up with me because he felt like a “second option” to my cat. the cat in question:",0,https://i.redd.it/7ap85pci8c9c1.jpeg,0.9,1470,1703901008,2023-12-30T01:50:08+0000
2023-12-30T10,18u3nf1,60,3680,comics,2qh0s,Court,0,https://i.redd.it/hz3uiide7c9c1.png,0.94,53,1703900639,2023-12-30T01:43:59+0000
2023-12-30T10,18u3jid,72,3133,iamatotalpieceofshit,3jj03,"2 cops in Kentucky threw slushies from their car at 20+ innocent civilians.",0,https://v.redd.it/un52w8qv4c9c1,0.97,266,1703900318,2023-12-30T01:38:38+0000
2023-12-30T10,18u3if8,82,2831,MapPorn,2si92,"Most popular sport in the world",0,https://i.redd.it/zp85ega66c9c1.jpeg,0.94,578,1703900224,2023-12-30T01:37:04+0000
2023-12-30T10,18u3e0i,41,4950,SipsTea,5tdqj0,"He Can't Keep Getting Away With This",0,https://v.redd.it/20yvc3945c9c1,0.93,202,1703899868,2023-12-30T01:31:08+0000
2023-12-30T10,18u3a1c,11,15359,meirl,2s5ti,Meirl,0,https://i.redd.it/g3zav4554c9c1.jpeg,0.96,437,1703899539,2023-12-30T01:25:39+0000
2023-12-30T10,18u386l,51,4332,maybemaybemaybe,38e1l,"Maybe Maybe Maybe ",0,https://v.redd.it/2glwho2k3c9c1,0.94,455,1703899387,2023-12-30T01:23:07+0000
2023-12-30T10,18u373f,52,3894,nottheonion,2qnts,"Philadelphia passes ski mask ban: 'Take them jawns off'",0,https://wlos.com/news/nation-world/philadelphia-bans-ski-masks-in-public-spaces-over-crime-concerns-take-them-jawns-off-philly-violence-criminals-ski-masks-sheisties-mid-atlantic-pennsylvania-pa-keystone-city-council,0.96,392,1703899299,2023-12-30T01:21:39+0000
2023-12-30T10,18u302l,87,5578,meirl,2s5ti,meirl,0,https://i.redd.it/mlgmomms1c9c1.jpeg,0.99,55,1703898749,2023-12-30T01:12:29+0000
2023-12-30T10,18u2x26,13,12193,funny,2qh33,"First Date Ick",0,https://v.redd.it/9ckngvaz0c9c1,0.92,305,1703898504,2023-12-30T01:08:24+0000
2023-12-30T10,18u2vp8,20,8362,crochet,2qm6c,"I'm a beginner. I didn't take into consideration dimensional changes with yarn size",0,https://www.reddit.com/gallery/18u2vp8,0.96,485,1703898398,2023-12-30T01:06:38+0000
2023-12-30T10,18u2ot2,58,4339,adventuretime,2s54g,"And honestly I don’t blame him",0,https://v.redd.it/zwziq0t5zb9c1,0.95,53,1703897874,2023-12-30T12:57:54+0000
2023-12-30T10,18u2o5l,22,11514,Damnthatsinteresting,2xxyj,"Airplane Converted into a house",0,https://v.redd.it/sll0zaozyb9c1,0.79,972,1703897819,2023-12-30T12:56:59+0000
2023-12-30T10,18u2nfl,49,4950,gaming,2qh03,"CYBERPUNK 2077 maxed out with path-tracing really is eye candy",0,https://i.redd.it/oz4nwnnuyb9c1.jpeg,0.83,317,1703897761,2023-12-30T12:56:01+0000
2023-12-30T10,18u2h6e,79,3527,gifsthatkeepongiving,39ssk,"Frosty the snowmans",0,https://i.redd.it/gx9ys5iexb9c1.gif,0.96,114,1703897280,2023-12-30T12:48:00+0000
2023-12-30T10,18u2btw,8,32459,me_irl,2vegg,me_irl,0,https://i.redd.it/qjr1la85wb9c1.jpeg,0.97,422,1703896850,2023-12-30T12:40:50+0000
2023-12-30T10,18u1wz9,89,3336,hockey,2qiel,"Jonathan Quick with a save of the year candidate to keep the game scoreless",0,https://v.redd.it/32b4ucnnsb9c1,0.95,226,1703895704,2023-12-30T12:21:44+0000
2023-12-30T10,18u1pqa,19,23014,toptalent,3ptyd,"Great party trick",0,https://v.redd.it/a5onnkn5rb9c1,0.82,1222,1703895173,2023-12-30T12:12:53+0000
2023-12-30T10,18u1k1h,36,7354,NatureIsFuckingLit,3gdh7,"🔥Indian Black Narrowmouth Frog (Melanobatrachus indicus)",0,https://i.redd.it/9a2z8k1qpb9c1.jpeg,0.97,98,1703894744,2023-12-30T12:05:44+0000
2023-12-30T10,18u1fpz,24,29722,BeAmazed,363r3,"Power Of A Woman",0,https://v.redd.it/fwat84hxob9c1,0.74,1855,1703894438,2023-12-30T12:00:38+0000
2023-12-30T10,18u1c5r,23,9227,pics,2qh0u,"Arnold Schwarzenegger visits with Lucy and Danny Devito on the stage of ""I Need That,"" December 2023",0,https://i.redd.it/401jv0e5ob9c1.jpeg,0.97,309,1703894168,2023-12-29T11:56:08+0000
2023-12-30T10,18u167c,92,7497,mildlyinfuriating,2ubgg,"My friend bought me a Switch game for my birthday. The download code, instead of being on the card itself, is on the receipt. He no longer has the receipt.",0,https://www.reddit.com/gallery/18u167c,0.97,216,1703893721,2023-12-29T11:48:41+0000
2023-12-30T10,18u0tmu,17,26573,interestingasfuck,2qhsa,"How cocaine is made",0,https://v.redd.it/muo227i0kb9c1,0.93,2534,1703892793,2023-12-29T11:33:13+0000
2023-12-30T10,18u0kgy,66,5538,AntiTrumpAlliance,3i9if,"He’s got my vote.",0,https://i.redd.it/1bhta273ib9c1.jpeg,0.86,252,1703892122,2023-12-29T11:22:02+0000
2023-12-30T10,18u0k7l,46,7786,GenZ,2tz25,"Maine is the second state to block Trump from the ballot",0,https://i.redd.it/rj4bwt01ib9c1.jpeg,0.85,3045,1703892102,2023-12-29T11:21:42+0000
2023-12-30T10,18u0j4w,16,22097,BlackPeopleTwitter,33x33,"ITT: What makes you go ""I'm with the boomers on this one""?",0,https://i.redd.it/d8pv5z1qhb9c1.jpeg,0.95,1873,1703892027,2023-12-29T11:20:27+0000
2023-12-30T10,18u0hr8,99,9168,shitposting,2usxq,"Checkmate, mathophiles",0,https://i.redd.it/zb48cq6ihb9c1.jpeg,0.98,205,1703891928,2023-12-29T11:18:48+0000
2023-12-30T10,18u0h1s,28,10610,news,2qh3l,"California becomes first state to offer health insurance to all undocumented immigrants",0,https://abcnews.go.com/Health/california-1st-state-offer-health-insurance-undocumented-immigrants/story?id=105986377,0.86,412,1703891874,2023-12-29T11:17:54+0000
2023-12-30T10,18u0bw2,57,6157,Overwatch,2u5kl,"Activision Blizzard employee speaks mind after Bobby Kotick departure",0,https://www.reddit.com/gallery/18u0bw2,0.96,514,1703891494,2023-12-29T11:11:34+0000
2023-12-30T10,18u0a8e,43,8811,badroommates,2w1n0,"Worst Roommate to ever Exist",0,https://www.reddit.com/gallery/18u0a8e,0.93,1457,1703891376,2023-12-29T11:09:36+0000
2023-12-30T10,18u07fy,34,13555,memes,2qjpg,"Seriously though",0,https://i.redd.it/x1yncik8fb9c1.jpeg,0.94,321,1703891164,2023-12-29T11:06:04+0000
2023-12-30T10,18u06pz,83,4626,TikTokCringe,mvcq5,"Cat's response to returning from work",0,https://v.redd.it/gwizuc51fb9c1,0.96,76,1703891109,2023-12-29T11:05:09+0000
2023-12-30T10,18u03eh,70,6645,HonkaiStarRail,4q5zoc,"First impressions of our last few limited 5 stars (personality wise)",0,https://i.redd.it/b710dj9beb9c1.jpeg,0.95,256,1703890861,2023-12-29T11:01:01+0000
2023-12-30T10,18u02qi,55,6532,holdmycatnip,2zhxd,"The disrespect ",0,https://v.redd.it/qa45ka57eb9c1,0.97,63,1703890819,2023-12-29T11:00:19+0000
2023-12-30T10,18u00w7,67,6661,oddlyterrifying,2yo6b,Triplets,0,https://v.redd.it/031h8aksdb9c1,0.89,718,1703890686,2023-12-29T10:58:06+0000
2023-12-30T10,18tzyqz,56,6706,MadeMeSmile,2uqcm,"Nothing like making your parent’s dream come true on Christmas ",0,https://v.redd.it/hkf940y6db9c1,0.99,56,1703890521,2023-12-29T10:55:21+0000
2023-12-30T10,18tzyfd,50,7772,tumblr,2r7hk,"Hey look lois I became Garfield",0,https://i.redd.it/p31jbv69db9c1.jpeg,0.95,31,1703890497,2023-12-29T10:54:57+0000
2023-12-30T10,18tzy0o,76,5192,Millennials,2rc4u,"So how did people qualify for mortgages and cars before 1989? Credit scores are also Millennials I guess",0,https://i.redd.it/9guuot31f69c1.png,0.94,506,1703890467,2023-12-29T10:54:27+0000
2023-12-30T10,18tzvrv,47,9786,theydidthemath,2x23b,"[request]how many pennies will be needed to make this",0,https://i.redd.it/8cd7sk2ocb9c1.jpeg,0.93,391,1703890300,2023-12-29T10:51:40+0000
2023-12-30T10,18tzguu,48,7747,nostalgia,2qnub,"The beloved 'wrong-way' loop in phone cords",0,https://i.redd.it/fkbuu2th9b9c1.png,0.96,205,1703889232,2023-12-29T10:33:52+0000
2023-12-30T10,18tzeg6,31,10881,politics,2cneq,"Appeals Court Says Trump Can’t Use Presidency to Avoid Capitol Police Lawsuits",0,https://themessenger.com/politics/appeals-court-says-trump-cant-use-presidency-to-avoid-capitol-police-lawsuits,0.97,374,1703889062,2023-12-29T10:31:02+0000
2023-12-30T10,18tzd0a,37,9985,nba,2qo4s,"Victor Wembanyama: ""To me... probably on Earth [Vegas is] the closest thing to a dystopia, so, I'm not the biggest fan of Vegas""",0,https://streamable.com/apxun2,0.95,1383,1703888966,2023-12-29T10:29:26+0000
2023-12-30T10,18txvmi,95,12615,todayilearned,2qqjc,"TIL the father and stepmother of Dee Dee Blanchard, the murdered mother of Gypsy Rose Blanchard would not pay for her funeral and flushed her ashes down the toilet",0,https://en.wikipedia.org/wiki/Murder_of_Dee_Dee_Blanchard?wprov=sfti1,0.92,863,1703885083,2023-12-29T09:24:43+0000
2023-12-30T10,18tx4lb,32,43156,DIY,2qh7d,"My first attempt at a wacky furniture piece.",0,https://www.reddit.com/gallery/18tx4lb,0.91,1359,1703883117,2023-12-29T08:51:57+0000
2023-12-30T10,18tx3zn,80,9024,wholesomememes,3gcwj,"I kind of figured it out Dad : )",0,https://i.redd.it/w6fub724ra9c1.png,0.95,94,1703883075,2023-12-29T08:51:15+0000
2023-12-30T10,18twqqx,96,33609,Damnthatsinteresting,2xxyj,"Police cruiser takes on a Dodge Hellcat in hot pursuit ",0,https://v.redd.it/i0zwz3l8oa9c1,0.85,1361,1703882110,2023-12-29T08:35:10+0000
2023-12-30T10,18twmdv,61,27435,pettyrevenge,2vg7t,"Dressed overly casual at a designer store so that the rude sales rep wouldn’t get commission",1,https://www.reddit.com/r/pettyrevenge/comments/18twmdv/dressed_overly_casual_at_a_designer_store_so_that/,0.8,2771,1703881805,2023-12-29T08:30:05+0000
2023-12-30T10,18twb9x,100,7360,Embroidery,2rh53,"I’ve somehow veered into odd territory with my embroidery. And I love it.",0,https://i.redd.it/gwja1fh0la9c1.jpeg,0.93,209,1703881008,2023-12-29T08:16:48+0000
2023-12-30T10,18tw83a,91,8871,ireland,2qhb9,"Lads this is my last post!!",1,https://www.reddit.com/r/ireland/comments/18tw83a/lads_this_is_my_last_post/,0.92,534,1703880780,2023-12-29T08:13:00+0000
2023-12-30T10,18tvp4b,94,11075,cartoons,2r4sk,"What was a “I can’t believe this aired on a kid’s cartoon channel” moment?",0,https://i.redd.it/s27p07udga9c1.jpeg,0.94,2348,1703879443,2023-12-29T07:50:43+0000
2023-12-30T10,18tvhk3,90,10362,megalophobia,31gwh,"How this massive crane neatly folds together for space optimization",0,https://v.redd.it/uw4rhk1rea9c1,0.94,370,1703878894,2023-12-29T07:41:34+0000
2023-12-30T10,18tuo24,93,12804,FunnyAnimals,2st2l,"He's living his best life.",0,https://v.redd.it/9oa8zazd8a9c1,0.96,104,1703876760,2023-12-29T07:06:00+0000
2023-12-30T10,18tu3n6,65,31114,PoliticalHumor,2qm21,"And with her actions alone she made the world a better place",0,https://i.redd.it/7q0gjrkz3a9c1.png,0.92,1366,1703875312,2023-12-29T06:41:52+0000
