date,id,position,score,subreddit_display_name,subreddit_id,title,is_self,url,upvote_ratio,num_comments,created,created_date
2024-01-06T03,18zh4zp,8,11846,mildlyinteresting,2ti4h,"Ordered some covid tests from amazon, got a free pack of pasta",0,https://i.redd.it/g45e98yuooac1.jpeg,0.95,483,1704487637,2024-01-05T08:47:17+0000
2024-01-06T03,18zh2p0,49,3545,pics,2qh0u,"This comically small tray on Frontier airlines",0,https://i.redd.it/ldjg7x9eooac1.jpeg,0.97,357,1704487482,2024-01-05T08:44:42+0000
2024-01-06T03,18zh2nk,9,12040,BikiniBottomTwitter,3deqz,"Imagine being this inconsiderate...",0,https://i.redd.it/g0f9dy77ooac1.jpeg,0.96,388,1704487479,2024-01-05T08:44:39+0000
2024-01-06T03,18zgwh1,70,2833,StarWars,2qi4s,"Not the Stepfather, the father who stepped up",0,https://i.redd.it/ntg96b91noac1.jpeg,0.96,126,1704487043,2024-01-05T08:37:23+0000
2024-01-06T03,18zguyi,50,3663,antiwork,2y77d,"""Middle age"" is a lie",0,https://i.redd.it/tetrp0vqmoac1.jpeg,0.96,147,1704486941,2024-01-05T08:35:41+0000
2024-01-06T03,18zgrt7,51,8540,WhitePeopleTwitter,35n7t,"Let's finish the job! 💪🏻",0,https://i.redd.it/awp5eed5moac1.jpeg,0.88,588,1704486725,2024-01-05T08:32:05+0000
2024-01-06T03,18zgo3g,12,8210,OldSchoolCool,2tycb,"[90s] Beastie Boys perform Sabotage live on stage.",0,https://v.redd.it/fgyjgbr6loac1,0.96,691,1704486480,2024-01-05T08:28:00+0000
2024-01-06T03,18zgh76,14,9592,wizardposting,5hjlp1,"My fellows...",0,https://i.redd.it/y9ft8c21koac1.png,0.93,351,1704486013,2024-01-05T08:20:13+0000
2024-01-06T03,18zggd2,7,13235,aww,2qh1o,"We spent the entire day searching our apartment for our lost kitten. This is the smug face we saw before we went to bed.",0,https://i.redd.it/ebss1q6vjoac1.jpeg,0.97,251,1704485959,2024-01-05T08:19:19+0000
2024-01-06T03,18zgcyw,55,3599,TwoXChromosomes,2r2jt,"Along with illness, you can add breast reduction as a reason men will leave.",1,https://www.reddit.com/r/TwoXChromosomes/comments/18zgcyw/along_with_illness_you_can_add_breast_reduction/,0.85,593,1704485729,2024-01-05T08:15:29+0000
2024-01-06T03,18zg7kc,30,5964,me_irl,2vegg,"me irl",0,https://i.redd.it/6wlpuzs2ioac1.jpeg,0.97,62,1704485359,2024-01-05T08:09:19+0000
2024-01-06T03,18zfs8i,45,4405,NonPoliticalTwitter,39gt6y,"Vacations are just sneak previews of retirement",0,https://i.imgur.com/mpgpjR2.jpeg,0.96,40,1704484334,2024-01-05T07:52:14+0000
2024-01-06T03,18zfp7d,100,2768,PrequelMemes,3i60n,"HELPING making a meme for every line in the phantom menace. part 31 (info in the comments)",0,https://i.redd.it/zscs3sc6eoac1.jpeg,0.97,46,1704484118,2024-01-05T07:48:38+0000
2024-01-06T03,18zfmg9,97,5939,mildlyinfuriating,2ubgg,"Got charged $1 for a company to say thank you…",0,https://i.redd.it/shrwfbntdoac1.jpeg,0.98,102,1704483926,2024-01-05T07:45:26+0000
2024-01-06T03,18zflnr,44,5230,PeterExplainsTheJoke,121h8r,help?,0,https://i.redd.it/klyvdvhidoac1.png,0.92,159,1704483874,2024-01-05T07:44:34+0000
2024-01-06T03,18zfkrl,22,7288,Justrolledintotheshop,2tteh,"Fed vehicles in for repairs. Government requires emission control devices on OUR vehicles but give themself an exemption to use a “deleted” diesel truck.",0,https://i.redd.it/w1htigchdoac1.jpeg,0.89,781,1704483811,2024-01-05T07:43:31+0000
2024-01-06T03,18zfbzx,28,9710,shitposting,2usxq,Anime...,0,https://v.redd.it/xhsp2a1nboac1,0.93,433,1704483193,2024-01-05T07:33:13+0000
2024-01-06T03,18zf4hh,38,6196,memes,2qjpg,"BASED STANLEY",0,https://i.redd.it/efbrff72aoac1.png,0.95,245,1704482671,2024-01-05T07:24:31+0000
2024-01-06T03,18zf2rp,4,30239,oddlysatisfying,2x93b,"Pretty smooth fist bump ",0,https://v.redd.it/dfsnforp9oac1,0.95,411,1704482545,2024-01-05T07:22:25+0000
2024-01-06T03,18zf2qt,63,4185,Hololive,29numb,"Nerissa is with Kiara in Austria!",0,https://i.redd.it/ld83u4nm9oac1.png,0.95,108,1704482542,2024-01-05T07:22:22+0000
2024-01-06T03,18zf149,42,5403,CuratedTumblr,3x5kfw,"On curating your internets experience",0,https://www.reddit.com/gallery/18zf149,0.97,90,1704482431,2024-01-05T07:20:31+0000
2024-01-06T03,18zf0d4,10,19071,meirl,2s5ti,meirl,0,https://i.redd.it/w4pdci189oac1.png,0.94,205,1704482382,2024-01-05T07:19:42+0000
2024-01-06T03,18zerfb,71,3872,WitchesVsPatriarchy,p3r73,Neeeeeeed,0,https://i.redd.it/j7f00wtd7oac1.jpeg,0.94,93,1704481761,2024-01-05T07:09:21+0000
2024-01-06T03,18zeqfx,88,3703,MinecraftMemes,2sq0h,"So I guess Mojang wants to encourage children to have pet wolves?",0,https://i.redd.it/3k7tlk546oac1.png,0.89,277,1704481690,2024-01-05T07:08:10+0000
2024-01-06T03,18zene7,15,10950,funny,2qh33,"This cop on “cops” writing down some important stuff",0,https://v.redd.it/p6nr665i6oac1,0.95,357,1704481474,2024-01-05T07:04:34+0000
2024-01-06T03,18zelnw,18,10812,news,2qh3l,"Third batch of Jeffrey Epstein documents unsealed",0,https://edition.cnn.com/2024/01/05/business/jeffrey-epstein-documents-unsealed-part-three/index.html,0.96,908,1704481346,2024-01-05T07:02:26+0000
2024-01-06T03,18zed47,90,3495,hewillbebaked,4je8rv,"He will be eaten(alive 😱😱) (1 bite😋🤤)",0,https://v.redd.it/rq3y7nce4oac1,0.96,55,1704480757,2024-01-05T06:52:37+0000
2024-01-06T03,18zeaye,58,4820,clevercomebacks,dyqlw,"10 years later, we finally know the answer to the question.",0,https://i.redd.it/un1jughu3oac1.jpeg,0.95,162,1704480607,2024-01-05T06:50:07+0000
2024-01-06T03,18ze7vg,69,4177,notliketheothergirls,3opft,"Woman posts cute video of husband helping her get around HOURS after giving birth.",0,https://i.redd.it/21cxhg7a3oac1.jpeg,0.96,245,1704480381,2024-01-05T06:46:21+0000
2024-01-06T03,18ze6fq,66,5307,cursedcomments,hw1ju,"Cursed Sheldon",0,https://i.redd.it/4yr5pfgz2oac1.jpeg,0.98,42,1704480281,2024-01-05T06:44:41+0000
2024-01-06T03,18ze51v,76,8539,politics,2cneq,"“Unprofessional”: Experts blast Trump lawyer for saying Brett Kavanaugh “quid pro quo part out loud”",0,https://www.salon.com/2024/01/05/unprofessional-experts-blast-lawyer-for-saying-brett-kavanaugh-quid-pro-quo-part-out-loud/,0.95,766,1704480177,2024-01-05T06:42:57+0000
2024-01-06T03,18zdhcs,16,18482,comics,2qh0s,"Gamer Cafe 1529 - Intrusion",0,https://www.reddit.com/gallery/18zdhcs,0.95,608,1704478535,2024-01-05T06:15:35+0000
2024-01-06T03,18zdgfr,62,5606,notinteresting,2u0xf,"here is my hand (i dont want you reading my palm)",0,https://i.redd.it/hwtvavghxnac1.jpeg,0.92,248,1704478478,2024-01-05T06:14:38+0000
2024-01-06T03,18zcjrj,31,9862,nba,2qo4s,"[Charania] After sitting the final 18 minutes of Nuggets loss, Warriors forward Jonathan Kuminga has lost faith in Steve Kerr and no longer believes that Kerr will allow him to reach his full potential, sources say.",0,https://twitter.com/ShamsCharania/status/1743325699350401078,0.95,1778,1704476232,2024-01-05T05:37:12+0000
2024-01-06T03,18zcfop,19,21074,JustGuysBeingDudes,33rtj6,"Dad's words",0,https://v.redd.it/q089ily3qnac1,0.94,625,1704475953,2024-01-05T05:32:33+0000
2024-01-06T03,18zcf4c,59,6789,rareinsults,48t85,"Did they just unintentionally called her ugly?",0,https://i.redd.it/kv6x8cyzpnac1.png,0.91,786,1704475914,2024-01-05T05:31:54+0000
2024-01-06T03,18zcb4h,33,11378,SipsTea,5tdqj0,"My wife will get upset...",0,https://v.redd.it/34hp38h6pnac1,0.94,231,1704475639,2024-01-05T05:27:19+0000
2024-01-06T03,18zcb2v,36,12412,facepalm,2r5rp,"Yes, good luck with that, lady.",0,https://i.redd.it/dxc7oz35pnac1.jpeg,0.91,3977,1704475636,2024-01-05T05:27:16+0000
2024-01-06T03,18zcad8,48,7218,PublicFreakout,2yrq6,"Man dies after getting into a fight in a Philadelphia train station",0,https://v.redd.it/s3yekegzonac1,0.94,2121,1704475588,2024-01-05T05:26:28+0000
2024-01-06T03,18zc3op,26,12799,GenZ,2tz25,"Who else remembers Net Neutrality and when this guy was the most hated person on the internet for a few weeks",0,https://i.redd.it/ssyp6aqmnnac1.jpeg,0.96,1007,1704475117,2024-01-05T05:18:37+0000
2024-01-06T03,18zby5s,35,10858,interestingasfuck,2qhsa,"Mohammed Qahtani, the winner of the Toastmasters World Championship of Public Speaking, brilliant speech!",0,https://v.redd.it/ljop6x7hmnac1,0.94,222,1704474739,2024-01-05T05:12:19+0000
2024-01-06T03,18zby1g,83,5400,AllThatIsInteresting,93l1mw,"Courtroom footage from 2015 shows Jacob Morgan’s reaction after being convicted of setting a fire that killed his 14-month-old stepbrother. He was sentenced to 15 years. He was released in December 2022 after serving half his sentence.",0,https://v.redd.it/jjhqu7hfmnac1,0.89,1120,1704474729,2024-01-05T05:12:09+0000
2024-01-06T03,18zbw14,25,37262,Damnthatsinteresting,2xxyj,"The work of a motion capture performer",0,https://v.redd.it/7lwknkiwlnac1,0.83,1441,1704474594,2024-01-05T05:09:54+0000
2024-01-06T03,18zbvtw,40,9174,blunderyears,2vy3g,"“Darwin lied” shirt my dad bought me, knee-length shorts, and modesty cami under an XL tee shirt. Yes, I was homeschooled.",0,https://i.redd.it/3n6bbp41mnac1.jpeg,0.94,574,1704474580,2024-01-05T05:09:40+0000
2024-01-06T03,18zbsot,43,8228,JeffArcuri,740oig,Anxiety,0,https://v.redd.it/o6djt9gclnac1,0.92,268,1704474356,2024-01-05T05:05:56+0000
2024-01-06T03,18zbpqr,73,5955,WatchPeopleDieInside,3h4zq,"Thief sees camera",0,https://v.redd.it/rblvsnhrknac1,0.96,348,1704474155,2024-01-05T05:02:35+0000
2024-01-06T03,18zbkwb,32,13686,MadeMeSmile,2uqcm,"Husband finds out he's having triplets ",0,https://v.redd.it/log1jixtjnac1,0.96,692,1704473842,2024-01-05T04:57:22+0000
2024-01-06T03,18zbkpv,91,5334,harrypotter,2qiqi,"Annoys me every bit",0,https://i.redd.it/zc90afpsjnac1.jpeg,0.91,570,1704473830,2024-01-05T04:57:10+0000
2024-01-06T03,18zbh1s,21,18994,nottheonion,2qnts,"Retiring House Republican says $174,000 isn't enough money for members of Congress: 'Most of us don't have money'",0,https://biz.crast.net/retiring-house-republican-says-174000-isnt-enough-money-for-members-of-congress-most-of-us-dont-have-money/,0.92,3202,1704473568,2024-01-05T04:52:48+0000
2024-01-06T03,18zb9ge,47,10105,ProgrammerHumor,2tex6,smallProjectsToLearnRust,0,https://i.redd.it/vhoopi8hhnac1.png,0.97,163,1704473048,2024-01-05T04:44:08+0000
2024-01-06T03,18zazae,54,8246,worldnews,2qh13,"Kremlin launches campaign to meddle in U.S. election, as GOP ends support for Ukraine",0,https://lansinginstitute.org/2024/01/05/kremlin-launches-campaign-to-meddle-in-u-s-election-as-gop-ends-support-for-ukraine/,0.93,708,1704472327,2024-01-05T04:32:07+0000
2024-01-06T03,18zayld,24,18140,todayilearned,2qqjc,"TIL of Dennis Fitch, a pilot who studied the crash of Japan Flight 123 to see if he could have flown the doomed aircraft. Years later, Fitch was a passenger on a plane that also lost hydraulic power. Fitch offered to assist the pilots who miraculously managed to crash land, saving 100+ passengers.",0,https://en.wikipedia.org/wiki/United_Airlines_Flight_232,0.97,528,1704472278,2024-01-05T04:31:18+0000
2024-01-06T03,18zayc1,61,8779,HolUp,qir9n,"A real life Key and Peele skit lol",0,https://i.redd.it/ntmyc0r4fnac1.jpeg,0.98,420,1704472260,2024-01-05T04:31:00+0000
2024-01-06T03,18zamu0,56,9936,lotrmemes,2v0i1,"Oldie but a goodie",0,https://i.redd.it/wkp9zkfqcnac1.png,0.92,218,1704471453,2024-01-05T04:17:33+0000
2024-01-06T03,18zaee8,23,29395,wholesomememes,3gcwj,"What a smart Parrot",0,https://i.redd.it/ipvondezanac1.png,0.97,197,1704470879,2024-01-05T04:07:59+0000
2024-01-06T03,18zab5k,98,7321,ExplainTheJoke,2vmj2,Halp,0,https://i.redd.it/9sf07uidanac1.jpeg,0.87,431,1704470659,2024-01-05T04:04:19+0000
2024-01-06T03,18za4zp,72,9310,toptalent,3ptyd,"How different actors trip",0,https://v.redd.it/m21muga39nac1,0.81,217,1704470247,2024-01-05T03:57:27+0000
2024-01-06T03,18z9uv7,87,8047,MapPorn,2si92,"What Happened to the Disciples?",0,https://i.redd.it/j1oyjtyz6nac1.png,0.9,1115,1704469525,2024-01-05T03:45:25+0000
2024-01-06T03,18z9dsx,81,8790,wallstreetbets,2th52,"When you wake up owing your brokerage $65M because someone exercised your naked SPY calls early",0,https://i.redd.it/y6k34fnc2nac1.png,0.91,1517,1704468263,2024-01-05T03:24:23+0000
2024-01-06T03,18z9dav,75,10362,bi_irl,3nhfo,bi_irl,0,https://i.redd.it/juwup7053nac1.jpeg,0.9,599,1704468225,2024-01-05T03:23:45+0000
2024-01-06T03,18z9a0j,60,10924,ChatGPT,7hqomg,"Where ever could Waldo be?",0,https://www.reddit.com/gallery/18z9a0j,0.98,459,1704467983,2024-01-05T03:19:43+0000
2024-01-06T03,18z98ns,46,15789,pcmasterrace,2sgp1,"You can’t make this stuff up ",0,https://v.redd.it/aotsytp32nac1,0.93,617,1704467881,2024-01-05T03:18:01+0000
2024-01-06T03,18z8w2g,79,9421,gaming,2qh03,"Star Citizen Introducing a $48,000 Ship Bundle, but Only for Players Who Have Already Spent $1,000 - IGN",0,https://www.ign.com/articles/star-citizen-introducing-a-48000-ship-bundle-but-only-for-players-who-have-already-spent-1000,0.92,2698,1704466933,2024-01-05T03:02:13+0000
2024-01-06T03,18z7ur1,52,20240,PoliticalHumor,2qm21,"Good Morning. It's good to start off the day with a nice breakfast, shower, brush teeth and nice community notes own.",0,https://i.redd.it/z7b3pdqjqmac1.jpeg,0.94,905,1704464085,2024-01-05T02:14:45+0000
2024-01-06T03,18z73f8,68,17825,WorkReform,5qpzgw,"Sorry about all that though",0,https://i.redd.it/w6oonf2bkmac1.jpeg,0.92,676,1704461943,2024-01-05T01:39:03+0000
2024-01-06T02,18zlptk,99,1186,WhatsWrongWithYourDog,39ht3,"The face of a man who pooped on a vet tech and needed three people and a muzzle to have his blood drawn today",0,https://i.redd.it/h8ovsp91npac1.jpeg,0.99,46,1704499131,2024-01-05T11:58:51+0000
2024-01-06T02,18zlcuv,43,3161,WhitePeopleTwitter,35n7t,"Donald Trump responds to Iowa school shooting, ends his statement with: get over it.",0,https://i.redd.it/v9dqnofckpac1.jpeg,0.99,350,1704498226,2024-01-05T11:43:46+0000
2024-01-06T02,18zlajx,51,1878,maybemaybemaybe,38e1l,"Maybe maybe maybe",0,https://v.redd.it/abq8ftxujpac1,0.93,321,1704498066,2024-01-05T11:41:06+0000
2024-01-06T02,18zl9l5,72,2457,todayilearned,2qqjc,"TIL That the term 'Superhero' is a trademark owned by Marvel and DC Comics, and competitors need to apply to them for a license to use it",0,https://worldcomicbookreview.com/2017/06/01/superhero-trademark-name-genre-came-owned-dc-marvel-enforce/,0.97,127,1704498006,2024-01-05T11:40:06+0000
2024-01-06T02,18zl84w,2,6740,tumblr,2r7hk,"How to kill a god",0,https://i.redd.it/2enaz7bejpac1.jpeg,0.97,102,1704497908,2024-01-05T11:38:28+0000
2024-01-06T02,18zl82l,30,2435,cats,2qhta,"The jacket we bought did not fit the dog , it did fit the cat.",0,https://i.redd.it/mjdsrnudjpac1.jpeg,0.99,47,1704497904,2024-01-05T11:38:24+0000
2024-01-06T02,18zl0r6,48,2004,TikTokCringe,mvcq5,"Father & Daughter have great voices ",0,https://v.redd.it/f928chwvhpac1,0.93,179,1704497407,2024-01-05T11:30:07+0000
2024-01-06T02,18zkzqm,84,1436,insaneparents,3pkgv,"My parents said I was too addicted to gaming, so they broke my self-purchased Switch Lite",0,https://i.redd.it/duxtoupohpac1.jpeg,0.97,246,1704497333,2024-01-05T11:28:53+0000
2024-01-06T02,18zknct,38,2304,clevercomebacks,dyqlw,"Blue checkmarked too!",0,https://i.imgur.com/GjVaIbQ.jpg,0.94,44,1704496447,2024-01-05T11:14:07+0000
2024-01-06T02,18zkjes,90,1666,Superstonk,43zwn1,"Ryan Cohen new tweet",0,https://x.com/ryancohen/status/1743408923506340150?s=46&t=Xcwu2jDH7BoX7aN0dG0zww,0.95,131,1704496168,2024-01-05T11:09:28+0000
2024-01-06T02,18zk8wa,7,5242,technology,2qh16,"Tesla Cybertruck gets less than 80% of advertised range in YouTuber’s test",0,https://nypost.com/2024/01/05/business/tesla-cybertruck-achieves-less-than-80-of-teslas-advertised-range/amp/,0.9,581,1704495430,2024-01-05T10:57:10+0000
2024-01-06T02,18zk3va,60,3155,funny,2qh33,"USA - Don't use your cell phone while driving! Meanwhile in Hong Kong...",0,https://i.redd.it/btytr8gnapac1.jpeg,0.97,155,1704495073,2024-01-05T10:51:13+0000
2024-01-06T02,18zjx3i,57,2155,suicidebywords,3on1q,"This went viral real quick",0,https://i.redd.it/nl7ucnll9pac1.png,0.93,170,1704494614,2024-01-05T10:43:34+0000
2024-01-06T02,18zjqct,27,3341,mildlyinfuriating,2ubgg,"This new mat my mom put always makes me fall over now. ",0,https://v.redd.it/ldufnsq68pac1,0.89,538,1704494137,2024-01-05T10:35:37+0000
2024-01-06T02,18zjp6f,10,4915,politics,2cneq,"Joe Biden just delivered the speech Democrats have been desperate for him to give",0,https://themessenger.com/politics/joe-biden-just-delivered-the-speech-democrats-have-been-desperate-for-him-to-give,0.94,543,1704494058,2024-01-05T10:34:18+0000
2024-01-06T02,18zjl10,70,1903,iphone,2qh2b,"This is it guys. We went full circle!",0,https://i.redd.it/p07hcrz27pac1.gif,0.95,185,1704493769,2024-01-05T10:29:29+0000
2024-01-06T02,18ziujs,85,1920,starwarsmemes,2wzm6,"True fans know",0,https://i.redd.it/lu70zyrn1pac1.jpeg,0.97,199,1704491942,2024-01-05T09:59:02+0000
2024-01-06T02,18zimub,81,3255,tumblr,2r7hk,"Bloody Mary Needs More Cardio",0,https://i.redd.it/8kv1ix210pac1.jpeg,0.98,22,1704491394,2024-01-05T09:49:54+0000
2024-01-06T02,18zilu0,12,5777,facepalm,2r5rp,"These guys live in an alternate universe",0,https://i.redd.it/oiw0y4iozoac1.png,0.92,953,1704491317,2024-01-05T09:48:37+0000
2024-01-06T02,18zihk0,31,3493,Wellthatsucks,2xcv7,"Good way to start 2024",0,https://v.redd.it/rlriwuzkyoac1,0.93,319,1704491011,2024-01-05T09:43:31+0000
2024-01-06T02,18zi96s,33,3638,dankmemes,2zmfe,"They were not cool enough to be invited",0,https://i.redd.it/sud1wfkkwoac1.jpeg,0.98,24,1704490422,2024-01-05T09:33:42+0000
2024-01-06T02,18zi6vm,91,1968,ShitPostCrusaders,3f7q5,"And that's how Giorno was made",0,https://i.redd.it/u8d8vvinwoac1.jpeg,0.98,35,1704490258,2024-01-05T09:30:58+0000
2024-01-06T02,18zi4oi,36,3326,me_irlgbt,3apfn,"me🙌irlgbt",0,https://www.reddit.com/gallery/18zi4oi,0.92,31,1704490112,2024-01-05T09:28:32+0000
2024-01-06T02,18zhx86,9,7954,wholesomememes,3gcwj,"Dad knows his daughters",0,https://i.redd.it/b40gz1zmuoac1.jpeg,0.94,147,1704489582,2024-01-05T09:19:42+0000
2024-01-06T02,18zhq33,98,1991,HonkaiStarRail,4q5zoc,"When you pull all the Destruction 5-stars but you're F2P",0,https://i.redd.it/a40e0x8isoac1.png,0.97,173,1704489086,2024-01-05T09:11:26+0000
2024-01-06T02,18zhn6e,87,2207,whenthe,23gidu,"People have started believing a lot of it too",0,https://v.redd.it/wdtf0yiksoac1,0.97,57,1704488892,2024-01-05T09:08:12+0000
2024-01-06T02,18zhhle,92,3368,BlackPeopleTwitter,33x33,"Rise and grind Twitter in a nutshell",0,https://i.redd.it/ytfdltufroac1.jpeg,0.98,183,1704488507,2024-01-05T09:01:47+0000
2024-01-06T02,18zhd7x,1,12800,BlackPeopleTwitter,33x33,"His dad also escaped slavery and fought for the Union",0,https://www.reddit.com/gallery/18zhd7x,0.96,393,1704488224,2024-01-05T08:57:04+0000
2024-01-06T02,18zh4zp,5,10073,mildlyinteresting,2ti4h,"Ordered some covid tests from amazon, got a free pack of pasta",0,https://i.redd.it/g45e98yuooac1.jpeg,0.95,384,1704487637,2024-01-05T08:47:17+0000
2024-01-06T02,18zh2nk,6,9987,BikiniBottomTwitter,3deqz,"Imagine being this inconsiderate...",0,https://i.redd.it/g0f9dy77ooac1.jpeg,0.96,328,1704487479,2024-01-05T08:44:39+0000
2024-01-06T02,18zh2ih,49,6260,facepalm,2r5rp,"I'm Batman",0,https://i.redd.it/aby2pxrbooac1.jpeg,0.96,138,1704487468,2024-01-05T08:44:28+0000
2024-01-06T02,18zgwh1,82,2447,StarWars,2qi4s,"Not the Stepfather, the father who stepped up",0,https://i.redd.it/ntg96b91noac1.jpeg,0.96,111,1704487043,2024-01-05T08:37:23+0000
2024-01-06T02,18zguyi,67,2851,antiwork,2y77d,"""Middle age"" is a lie",0,https://i.redd.it/tetrp0vqmoac1.jpeg,0.96,123,1704486941,2024-01-05T08:35:41+0000
2024-01-06T02,18zgrt7,14,7638,WhitePeopleTwitter,35n7t,"Let's finish the job! 💪🏻",0,https://i.redd.it/awp5eed5moac1.jpeg,0.89,492,1704486725,2024-01-05T08:32:05+0000
2024-01-06T02,18zgps2,83,2540,AskReddit,2qh1i,"During your toughest moments, which saying or phrase has kept you going?",1,https://www.reddit.com/r/AskReddit/comments/18zgps2/during_your_toughest_moments_which_saying_or/,0.94,5300,1704486592,2024-01-05T08:29:52+0000
2024-01-06T02,18zgo3g,15,6922,OldSchoolCool,2tycb,"[90s] Beastie Boys perform Sabotage live on stage.",0,https://v.redd.it/fgyjgbr6loac1,0.96,597,1704486480,2024-01-05T08:28:00+0000
2024-01-06T02,18zgkzb,20,6553,technicallythetruth,3pzez,"He got a point",0,https://i.redd.it/zc90afpsjnac1.jpeg,0.93,290,1704486272,2024-01-05T08:24:32+0000
2024-01-06T02,18zgh76,17,8447,wizardposting,5hjlp1,"My fellows...",0,https://i.redd.it/y9ft8c21koac1.png,0.94,326,1704486013,2024-01-05T08:20:13+0000
2024-01-06T02,18zggd2,4,11442,aww,2qh1o,"We spent the entire day searching our apartment for our lost kitten. This is the smug face we saw before we went to bed.",0,https://i.redd.it/ebss1q6vjoac1.jpeg,0.97,219,1704485959,2024-01-05T08:19:19+0000
2024-01-06T02,18zgcyw,58,3305,TwoXChromosomes,2r2jt,"Along with illness, you can add breast reduction as a reason men will leave.",1,https://www.reddit.com/r/TwoXChromosomes/comments/18zgcyw/along_with_illness_you_can_add_breast_reduction/,0.85,556,1704485729,2024-01-05T08:15:29+0000
2024-01-06T02,18zgbzj,56,3376,gifs,2qt55,"Changing gears",0,https://i.imgur.com/1JU6IOr.gifv,0.94,75,1704485657,2024-01-05T08:14:17+0000
2024-01-06T02,18zg7kc,78,4914,me_irl,2vegg,"me irl",0,https://i.redd.it/6wlpuzs2ioac1.jpeg,0.98,49,1704485359,2024-01-05T08:09:19+0000
2024-01-06T02,18zfs8i,55,3629,NonPoliticalTwitter,39gt6y,"Vacations are just sneak previews of retirement",0,https://i.imgur.com/mpgpjR2.jpeg,0.97,31,1704484334,2024-01-05T07:52:14+0000
2024-01-06T02,18zfp7d,100,2604,PrequelMemes,3i60n,"HELPING making a meme for every line in the phantom menace. part 31 (info in the comments)",0,https://i.redd.it/zscs3sc6eoac1.jpeg,0.97,42,1704484118,2024-01-05T07:48:38+0000
2024-01-06T02,18zfmg9,79,4991,mildlyinfuriating,2ubgg,"Got charged $1 for a company to say thank you…",0,https://i.redd.it/shrwfbntdoac1.jpeg,0.98,89,1704483926,2024-01-05T07:45:26+0000
2024-01-06T02,18zflnr,45,4658,PeterExplainsTheJoke,121h8r,help?,0,https://i.redd.it/klyvdvhidoac1.png,0.92,150,1704483874,2024-01-05T07:44:34+0000
2024-01-06T02,18zfkrl,24,6380,Justrolledintotheshop,2tteh,"Fed vehicles in for repairs. Government requires emission control devices on OUR vehicles but give themself an exemption to use a “deleted” diesel truck.",0,https://i.redd.it/w1htigchdoac1.jpeg,0.89,704,1704483811,2024-01-05T07:43:31+0000
2024-01-06T02,18zfbzx,23,9110,shitposting,2usxq,Anime...,0,https://v.redd.it/xhsp2a1nboac1,0.94,417,1704483193,2024-01-05T07:33:13+0000
2024-01-06T02,18zf4hh,37,5496,memes,2qjpg,"BASED STANLEY",0,https://i.redd.it/efbrff72aoac1.png,0.95,225,1704482671,2024-01-05T07:24:31+0000
2024-01-06T02,18zf2rp,3,27471,oddlysatisfying,2x93b,"Pretty smooth fist bump ",0,https://v.redd.it/dfsnforp9oac1,0.95,387,1704482545,2024-01-05T07:22:25+0000
2024-01-06T02,18zf2qt,63,3948,Hololive,29numb,"Nerissa is with Kiara in Austria!",0,https://i.redd.it/ld83u4nm9oac1.png,0.95,102,1704482542,2024-01-05T07:22:22+0000
2024-01-06T02,18zf149,41,4982,CuratedTumblr,3x5kfw,"On curating your internets experience",0,https://www.reddit.com/gallery/18zf149,0.97,80,1704482431,2024-01-05T07:20:31+0000
2024-01-06T02,18zf0d4,8,16894,meirl,2s5ti,meirl,0,https://i.redd.it/w4pdci189oac1.png,0.94,187,1704482382,2024-01-05T07:19:42+0000
2024-01-06T02,18zerfb,75,3559,WitchesVsPatriarchy,p3r73,Neeeeeeed,0,https://i.redd.it/j7f00wtd7oac1.jpeg,0.95,87,1704481761,2024-01-05T07:09:21+0000
2024-01-06T02,18zeqfx,88,3447,MinecraftMemes,2sq0h,"So I guess Mojang wants to encourage children to have pet wolves?",0,https://i.redd.it/3k7tlk546oac1.png,0.89,269,1704481690,2024-01-05T07:08:10+0000
2024-01-06T02,18zene7,13,9971,funny,2qh33,"This cop on “cops” writing down some important stuff",0,https://v.redd.it/p6nr665i6oac1,0.96,334,1704481474,2024-01-05T07:04:34+0000
2024-01-06T02,18zelnw,18,9960,news,2qh3l,"Third batch of Jeffrey Epstein documents unsealed",0,https://edition.cnn.com/2024/01/05/business/jeffrey-epstein-documents-unsealed-part-three/index.html,0.96,867,1704481346,2024-01-05T07:02:26+0000
2024-01-06T02,18zegeq,94,5286,Damnthatsinteresting,2xxyj,"This is the first statue found in Göbeklitepe excavations. It is roughly 11,000 years old.",0,https://i.redd.it/32w7874d4oac1.jpeg,0.98,759,1704480994,2024-01-05T06:56:34+0000
2024-01-06T02,18zed47,96,3129,hewillbebaked,4je8rv,"He will be eaten(alive 😱😱) (1 bite😋🤤)",0,https://v.redd.it/rq3y7nce4oac1,0.96,52,1704480757,2024-01-05T06:52:37+0000
2024-01-06T02,18ze7vg,74,3802,notliketheothergirls,3opft,"Woman posts cute video of husband helping her get around HOURS after giving birth.",0,https://i.redd.it/21cxhg7a3oac1.jpeg,0.96,218,1704480381,2024-01-05T06:46:21+0000
2024-01-06T02,18ze6fq,66,4952,cursedcomments,hw1ju,"Cursed Sheldon",0,https://i.redd.it/4yr5pfgz2oac1.jpeg,0.98,38,1704480281,2024-01-05T06:44:41+0000
2024-01-06T02,18ze51v,50,8185,politics,2cneq,"“Unprofessional”: Experts blast Trump lawyer for saying Brett Kavanaugh “quid pro quo part out loud”",0,https://www.salon.com/2024/01/05/unprofessional-experts-blast-lawyer-for-saying-brett-kavanaugh-quid-pro-quo-part-out-loud/,0.95,735,1704480177,2024-01-05T06:42:57+0000
2024-01-06T02,18zdhcs,11,17661,comics,2qh0s,"Gamer Cafe 1529 - Intrusion",0,https://www.reddit.com/gallery/18zdhcs,0.95,576,1704478535,2024-01-05T06:15:35+0000
2024-01-06T02,18zdgfr,62,5261,notinteresting,2u0xf,"here is my hand (i dont want you reading my palm)",0,https://i.redd.it/hwtvavghxnac1.jpeg,0.93,228,1704478478,2024-01-05T06:14:38+0000
2024-01-06T02,18zcjrj,26,9596,nba,2qo4s,"[Charania] After sitting the final 18 minutes of Nuggets loss, Warriors forward Jonathan Kuminga has lost faith in Steve Kerr and no longer believes that Kerr will allow him to reach his full potential, sources say.",0,https://twitter.com/ShamsCharania/status/1743325699350401078,0.95,1760,1704476232,2024-01-05T05:37:12+0000
2024-01-06T02,18zcfop,16,19704,JustGuysBeingDudes,33rtj6,"Dad's words",0,https://v.redd.it/q089ily3qnac1,0.94,600,1704475953,2024-01-05T05:32:33+0000
2024-01-06T02,18zcf4c,59,6267,rareinsults,48t85,"Did they just unintentionally called her ugly?",0,https://i.redd.it/kv6x8cyzpnac1.png,0.91,732,1704475914,2024-01-05T05:31:54+0000
