date,id,position,score,subreddit_display_name,subreddit_id,title,is_self,url,upvote_ratio,num_comments,created,created_date
2024-01-06T04,18znpw2,1,9969,BeAmazed,363r3,"Marissa Tomei through the years ",0,https://v.redd.it/x6hs7jbd2qac1,0.96,782,1704504449,2024-01-06T01:27:29+0000
2024-01-06T04,18znpuw,19,2883,nba,2qo4s,"[Slater] Steve Kerr: “I played 15 years and all 15 I was frustrated with my playing time.”",0,https://x.com/anthonyvslater/status/1743443483673919580?s=46&t=gEvQlnNLbU9ke0xn1kR1YA,0.97,468,1704504446,2024-01-06T01:27:26+0000
2024-01-06T04,18znnct,95,1161,Eyebleach,2s427,"His first sound sleep after being adopted from a shelter.",0,https://i.redd.it/fr75rgl62qac1.jpeg,0.98,26,1704504258,2024-01-06T01:24:18+0000
2024-01-06T04,18zn127,5,5868,news,2qh3l,"Alaska's snow crab season canceled for second year in a row as population fails to rebound",0,https://www.cbsnews.com/news/alaska-snow-crab-season-canceled-2024/,0.98,402,1704502541,2024-01-06T12:55:41+0000
2024-01-06T04,18zmvj0,59,1604,holdmycatnip,2zhxd,"Orange cat doing orange cat things",0,https://v.redd.it/0o5bsfosvpac1,0.98,46,1704502114,2024-01-06T12:48:34+0000
2024-01-06T04,18zmpfw,91,1334,BaldursGate3,12967t,"What's the big deal about Astarion?",1,https://www.reddit.com/r/BaldursGate3/comments/18zmpfw/whats_the_big_deal_about_astarion/,0.91,294,1704501654,2024-01-06T12:40:54+0000
2024-01-06T04,18zml9q,92,1364,Terraria,2sg5b,"It may not seem it. But i am not a Roblox addict. 🚫🚫",0,https://i.redd.it/75ukswamtpac1.jpeg,0.96,66,1704501345,2024-01-06T12:35:45+0000
2024-01-06T04,18zmkke,44,2128,Satisfyingasfuck,31s00,"Ways to protect a coastline",0,https://v.redd.it/3tod32lbtpac1,0.96,51,1704501294,2024-01-06T12:34:54+0000
2024-01-06T04,18zmkbr,51,1840,LivestreamFail,38jf0,"Asmongold responds to viewer asking about the charity allegations.",0,https://clips.twitch.tv/ArbitraryFrailQueleaTwitchRPG-CAyLDfPvE8W-u6fD,0.91,435,1704501275,2024-01-06T12:34:35+0000
2024-01-06T04,18zmd65,76,1528,MinecraftMemes,2sq0h,"Ask me a question about Minecraft, then edit the question to make me look bad.",0,https://i.redd.it/dfjx0xvwrpac1.jpeg,0.96,336,1704500771,2024-01-06T12:26:11+0000
2024-01-06T04,18zmad9,4,7497,mildlyinteresting,2ti4h,"I’m in a weight loss clinical study and this is the test food I ate.",0,https://i.redd.it/dadiqlmarpac1.jpeg,0.96,1007,1704500563,2024-01-06T12:22:43+0000
2024-01-06T04,18zm45y,39,2360,clevercomebacks,dyqlw,"Readers added context",0,https://i.redd.it/1sifhf90qpac1.jpeg,0.96,108,1704500130,2024-01-06T12:15:30+0000
2024-01-06T04,18zlwle,42,2398,TheLastAirbender,2rybx,"The netflix show's costumes look more show accurate, while the (non-existent) movie's look more grounded",0,https://i.redd.it/avpo4dy5opac1.png,0.95,174,1704499583,2024-01-06T12:06:23+0000
2024-01-06T04,18zltxy,67,1731,AITAH,446kys,"Update: My brother knows everything now.",1,https://www.reddit.com/r/AITAH/comments/18zltxy/update_my_brother_knows_everything_now/,0.96,417,1704499394,2024-01-06T12:03:14+0000
2024-01-06T04,18zlcuv,3,8958,WhitePeopleTwitter,35n7t,"Donald Trump responds to Iowa school shooting, ends his statement with: get over it.",0,https://i.redd.it/v9dqnofckpac1.jpeg,0.96,822,1704498226,2024-01-05T11:43:46+0000
2024-01-06T04,18zlajx,15,5433,maybemaybemaybe,38e1l,"Maybe maybe maybe",0,https://v.redd.it/abq8ftxujpac1,0.91,799,1704498066,2024-01-05T11:41:06+0000
2024-01-06T04,18zl84w,2,12938,tumblr,2r7hk,"How to kill a god",0,https://i.redd.it/2enaz7bejpac1.jpeg,0.95,216,1704497908,2024-01-05T11:38:28+0000
2024-01-06T04,18zl82l,9,6563,cats,2qhta,"The jacket we bought did not fit the dog , it did fit the cat.",0,https://i.redd.it/mjdsrnudjpac1.jpeg,0.98,89,1704497904,2024-01-05T11:38:24+0000
2024-01-06T04,18zl4ac,80,1752,PrequelMemes,3i60n,"Stupid little thing😤",0,https://v.redd.it/w9otzntlipac1,0.98,23,1704497648,2024-01-05T11:34:08+0000
2024-01-06T04,18zl0r6,21,4083,TikTokCringe,mvcq5,"Father & Daughter have great voices ",0,https://v.redd.it/f928chwvhpac1,0.9,330,1704497407,2024-01-05T11:30:07+0000
2024-01-06T04,18zl058,94,1634,leagueoflegends,2rfxx,"Smolder face update",1,https://www.reddit.com/r/leagueoflegends/comments/18zl058/smolder_face_update/,0.97,294,1704497362,2024-01-05T11:29:22+0000
2024-01-06T04,18zkoe0,63,2043,LeopardsAteMyFace,3jp3p,"Looks like Neri Oxman, wife of Bill Ackman, plagiarized much more than was previously thought. Business Insider article pending…",0,https://i.redd.it/1l939tr9fpac1.jpeg,0.96,231,1704496519,2024-01-05T11:15:19+0000
2024-01-06T04,18zkjes,82,2181,Superstonk,43zwn1,"Ryan Cohen new tweet",0,https://x.com/ryancohen/status/1743408923506340150?s=46&t=Xcwu2jDH7BoX7aN0dG0zww,0.93,163,1704496168,2024-01-05T11:09:28+0000
2024-01-06T04,18zkhmf,93,1775,terriblefacebookmemes,2tja6,"Totally comparable. Totally.",0,https://i.redd.it/du59vfhrdpac1.jpeg,0.93,174,1704496039,2024-01-05T11:07:19+0000
2024-01-06T04,18zk8wa,6,9210,technology,2qh16,"Tesla Cybertruck gets less than 80% of advertised range in YouTuber’s test",0,https://nypost.com/2024/01/05/business/tesla-cybertruck-achieves-less-than-80-of-teslas-advertised-range/amp/,0.9,991,1704495430,2024-01-05T10:57:10+0000
2024-01-06T04,18zk3va,12,6976,funny,2qh33,"USA - Don't use your cell phone while driving! Meanwhile in Hong Kong...",0,https://i.redd.it/btytr8gnapac1.jpeg,0.96,261,1704495073,2024-01-05T10:51:13+0000
2024-01-06T04,18zk0io,73,2094,GetNoted,91bxd4,"Stalinist Gets a Reality Check",0,https://i.redd.it/xmrhnimaapac1.jpeg,0.93,144,1704494846,2024-01-05T10:47:26+0000
2024-01-06T04,18zjqct,14,7664,mildlyinfuriating,2ubgg,"This new mat my mom put always makes me fall over now. ",0,https://v.redd.it/ldufnsq68pac1,0.88,1062,1704494137,2024-01-05T10:35:37+0000
2024-01-06T04,18zjp6f,7,9703,politics,2cneq,"Joe Biden just delivered the speech Democrats have been desperate for him to give",0,https://themessenger.com/politics/joe-biden-just-delivered-the-speech-democrats-have-been-desperate-for-him-to-give,0.91,1119,1704494058,2024-01-05T10:34:18+0000
2024-01-06T04,18zjl10,26,4150,iphone,2qh2b,"This is it guys. We went full circle!",0,https://i.redd.it/p07hcrz27pac1.gif,0.95,329,1704493769,2024-01-05T10:29:29+0000
2024-01-06T04,18zj1xh,79,2349,theydidthemath,2x23b,"[Request]Would this actually help reduce the gas used for cooking?",0,https://i.redd.it/l9qg1to9zmac1.jpeg,0.92,167,1704492436,2024-01-05T10:07:16+0000
2024-01-06T04,18ziwfb,86,2279,SpidermanPS4,3f1fs,"The hero we need",0,https://v.redd.it/zuy1yewz1pac1,0.96,77,1704492058,2024-01-05T10:00:58+0000
2024-01-06T04,18ziujs,54,2959,starwarsmemes,2wzm6,"True fans know",0,https://i.redd.it/lu70zyrn1pac1.jpeg,0.96,294,1704491942,2024-01-05T09:59:02+0000
2024-01-06T04,18zirkd,75,2427,thalassophobia,2xfs1,"My stomach hurts watching this",0,https://v.redd.it/ymq9vf801pac1,0.94,148,1704491727,2024-01-05T09:55:27+0000
2024-01-06T04,18zir2k,29,5164,memes,2qjpg,"I'm polite when in a crowded elevator",0,https://i.redd.it/lfr6jdll0pac1.png,0.97,113,1704491692,2024-01-05T09:54:52+0000
2024-01-06T04,18zihk0,24,5465,Wellthatsucks,2xcv7,"Good way to start 2024",0,https://v.redd.it/rlriwuzkyoac1,0.92,484,1704491011,2024-01-05T09:43:31+0000
2024-01-06T04,18zi96s,35,4897,dankmemes,2zmfe,"They were not cool enough to be invited",0,https://i.redd.it/sud1wfkkwoac1.jpeg,0.97,33,1704490422,2024-01-05T09:33:42+0000
2024-01-06T04,18zi6vm,87,2516,ShitPostCrusaders,3f7q5,"And that's how Giorno was made",0,https://i.redd.it/u8d8vvinwoac1.jpeg,0.97,45,1704490258,2024-01-05T09:30:58+0000
2024-01-06T04,18zi4oi,45,3958,me_irlgbt,3apfn,"me🙌irlgbt",0,https://www.reddit.com/gallery/18zi4oi,0.91,44,1704490112,2024-01-05T09:28:32+0000
2024-01-06T04,18zhq33,99,2482,HonkaiStarRail,4q5zoc,"When you pull all the Destruction 5-stars but you're F2P",0,https://i.redd.it/a40e0x8isoac1.png,0.96,208,1704489086,2024-01-05T09:11:26+0000
2024-01-06T04,18zhn6e,89,2679,whenthe,23gidu,"People have started believing a lot of it too",0,https://v.redd.it/wdtf0yiksoac1,0.95,66,1704488892,2024-01-05T09:08:12+0000
2024-01-06T04,18zhd7x,8,15960,BlackPeopleTwitter,33x33,"His dad also escaped slavery and fought for the Union",0,https://www.reddit.com/gallery/18zhd7x,0.96,477,1704488224,2024-01-05T08:57:04+0000
2024-01-06T04,18zh4zp,47,12924,mildlyinteresting,2ti4h,"Ordered some covid tests from amazon, got a free pack of pasta",0,https://i.redd.it/g45e98yuooac1.jpeg,0.95,529,1704487637,2024-01-05T08:47:17+0000
2024-01-06T04,18zh2p0,40,4536,pics,2qh0u,"This comically small tray on Frontier airlines",0,https://i.redd.it/ldjg7x9eooac1.jpeg,0.97,430,1704487482,2024-01-05T08:44:42+0000
2024-01-06T04,18zh2nk,13,14108,BikiniBottomTwitter,3deqz,"Imagine being this inconsiderate...",0,https://i.redd.it/g0f9dy77ooac1.jpeg,0.95,448,1704487479,2024-01-05T08:44:39+0000
2024-01-06T04,18zgwh1,66,3309,StarWars,2qi4s,"Not the Stepfather, the father who stepped up",0,https://i.redd.it/ntg96b91noac1.jpeg,0.95,143,1704487043,2024-01-05T08:37:23+0000
2024-01-06T04,18zguyi,41,4751,antiwork,2y77d,"""Middle age"" is a lie",0,https://i.redd.it/tetrp0vqmoac1.jpeg,0.95,188,1704486941,2024-01-05T08:35:41+0000
2024-01-06T04,18zgrt7,74,9295,WhitePeopleTwitter,35n7t,"Let's finish the job! 💪🏻",0,https://i.redd.it/awp5eed5moac1.jpeg,0.88,631,1704486725,2024-01-05T08:32:05+0000
2024-01-06T04,18zgo3g,17,9485,OldSchoolCool,2tycb,"[90s] Beastie Boys perform Sabotage live on stage.",0,https://v.redd.it/fgyjgbr6loac1,0.96,769,1704486480,2024-01-05T08:28:00+0000
2024-01-06T04,18zgh76,18,10731,wizardposting,5hjlp1,"My fellows...",0,https://i.redd.it/y9ft8c21koac1.png,0.93,377,1704486013,2024-01-05T08:20:13+0000
2024-01-06T04,18zggd2,11,14897,aww,2qh1o,"We spent the entire day searching our apartment for our lost kitten. This is the smug face we saw before we went to bed.",0,https://i.redd.it/ebss1q6vjoac1.jpeg,0.96,270,1704485959,2024-01-05T08:19:19+0000
2024-01-06T04,18zgcyw,57,3943,TwoXChromosomes,2r2jt,"Along with illness, you can add breast reduction as a reason men will leave.",1,https://www.reddit.com/r/TwoXChromosomes/comments/18zgcyw/along_with_illness_you_can_add_breast_reduction/,0.84,649,1704485729,2024-01-05T08:15:29+0000
2024-01-06T04,18zg7kc,30,7263,me_irl,2vegg,"me irl",0,https://i.redd.it/6wlpuzs2ioac1.jpeg,0.96,76,1704485359,2024-01-05T08:09:19+0000
2024-01-06T04,18zfs8i,43,5393,NonPoliticalTwitter,39gt6y,"Vacations are just sneak previews of retirement",0,https://i.imgur.com/mpgpjR2.jpeg,0.96,52,1704484334,2024-01-05T07:52:14+0000
2024-01-06T04,18zflnr,48,5915,PeterExplainsTheJoke,121h8r,help?,0,https://i.redd.it/klyvdvhidoac1.png,0.91,175,1704483874,2024-01-05T07:44:34+0000
2024-01-06T04,18zfkrl,25,8259,Justrolledintotheshop,2tteh,"Fed vehicles in for repairs. Government requires emission control devices on OUR vehicles but give themself an exemption to use a “deleted” diesel truck.",0,https://i.redd.it/w1htigchdoac1.jpeg,0.89,860,1704483811,2024-01-05T07:43:31+0000
2024-01-06T04,18zfbzx,33,10329,shitposting,2usxq,Anime...,0,https://v.redd.it/xhsp2a1nboac1,0.93,458,1704483193,2024-01-05T07:33:13+0000
2024-01-06T04,18zf2rp,10,32974,oddlysatisfying,2x93b,"Pretty smooth fist bump ",0,https://v.redd.it/dfsnforp9oac1,0.95,438,1704482545,2024-01-05T07:22:25+0000
2024-01-06T04,18zf2qt,68,4493,Hololive,29numb,"Nerissa is with Kiara in Austria!",0,https://i.redd.it/ld83u4nm9oac1.png,0.95,119,1704482542,2024-01-05T07:22:22+0000
2024-01-06T04,18zf149,49,5894,CuratedTumblr,3x5kfw,"On curating your internets experience",0,https://www.reddit.com/gallery/18zf149,0.97,98,1704482431,2024-01-05T07:20:31+0000
2024-01-06T04,18zf0d4,16,21151,meirl,2s5ti,meirl,0,https://i.redd.it/w4pdci189oac1.png,0.93,229,1704482382,2024-01-05T07:19:42+0000
2024-01-06T04,18zez49,100,3525,MurderedByWords,3hx3r,"Hilarious response from owner after a bad review",0,https://i.redd.it/dzfq5lgz8oac1.jpeg,0.97,62,1704482298,2024-01-05T07:18:18+0000
2024-01-06T04,18zerfb,78,4200,WitchesVsPatriarchy,p3r73,Neeeeeeed,0,https://i.redd.it/j7f00wtd7oac1.jpeg,0.94,97,1704481761,2024-01-05T07:09:21+0000
2024-01-06T04,18zene7,77,11667,funny,2qh33,"This cop on “cops” writing down some important stuff",0,https://v.redd.it/p6nr665i6oac1,0.95,370,1704481474,2024-01-05T07:04:34+0000
2024-01-06T04,18zelnw,83,11492,news,2qh3l,"Third batch of Jeffrey Epstein documents unsealed",0,https://edition.cnn.com/2024/01/05/business/jeffrey-epstein-documents-unsealed-part-three/index.html,0.96,969,1704481346,2024-01-05T07:02:26+0000
2024-01-06T04,18zed47,98,3858,hewillbebaked,4je8rv,"He will be eaten(alive 😱😱) (1 bite😋🤤)",0,https://v.redd.it/rq3y7nce4oac1,0.96,59,1704480757,2024-01-05T06:52:37+0000
2024-01-06T04,18ze7vg,71,4643,notliketheothergirls,3opft,"Woman posts cute video of husband helping her get around HOURS after giving birth.",0,https://i.redd.it/21cxhg7a3oac1.jpeg,0.96,263,1704480381,2024-01-05T06:46:21+0000
2024-01-06T04,18ze6fq,72,5788,cursedcomments,hw1ju,"Cursed Sheldon",0,https://i.redd.it/4yr5pfgz2oac1.jpeg,0.98,48,1704480281,2024-01-05T06:44:41+0000
2024-01-06T04,18zdhcs,20,19279,comics,2qh0s,"Gamer Cafe 1529 - Intrusion",0,https://www.reddit.com/gallery/18zdhcs,0.95,637,1704478535,2024-01-05T06:15:35+0000
2024-01-06T04,18zdgfr,65,6114,notinteresting,2u0xf,"here is my hand (i dont want you reading my palm)",0,https://i.redd.it/hwtvavghxnac1.jpeg,0.92,262,1704478478,2024-01-05T06:14:38+0000
2024-01-06T04,18zcfop,22,22594,JustGuysBeingDudes,33rtj6,"Dad's words",0,https://v.redd.it/q089ily3qnac1,0.93,675,1704475953,2024-01-05T05:32:33+0000
2024-01-06T04,18zcf4c,62,7425,rareinsults,48t85,"Did they just unintentionally called her ugly?",0,https://i.redd.it/kv6x8cyzpnac1.png,0.91,845,1704475914,2024-01-05T05:31:54+0000
2024-01-06T04,18zcb4h,36,12750,SipsTea,5tdqj0,"My wife will get upset...",0,https://v.redd.it/34hp38h6pnac1,0.94,258,1704475639,2024-01-05T05:27:19+0000
2024-01-06T04,18zcad8,50,7919,PublicFreakout,2yrq6,"Man dies after getting into a fight in a Philadelphia train station",0,https://v.redd.it/s3yekegzonac1,0.94,2273,1704475588,2024-01-05T05:26:28+0000
2024-01-06T04,18zc3op,28,14847,GenZ,2tz25,"Who else remembers Net Neutrality and when this guy was the most hated person on the internet for a few weeks",0,https://i.redd.it/ssyp6aqmnnac1.jpeg,0.96,1147,1704475117,2024-01-05T05:18:37+0000
2024-01-06T04,18zby5s,38,12875,interestingasfuck,2qhsa,"Mohammed Qahtani, the winner of the Toastmasters World Championship of Public Speaking, brilliant speech!",0,https://v.redd.it/ljop6x7hmnac1,0.94,261,1704474739,2024-01-05T05:12:19+0000
2024-01-06T04,18zby1g,88,6044,AllThatIsInteresting,93l1mw,"Courtroom footage from 2015 shows Jacob Morgan’s reaction after being convicted of setting a fire that killed his 14-month-old stepbrother. He was sentenced to 15 years. He was released in December 2022 after serving half his sentence.",0,https://v.redd.it/jjhqu7hfmnac1,0.89,1162,1704474729,2024-01-05T05:12:09+0000
2024-01-06T04,18zbw14,34,39040,Damnthatsinteresting,2xxyj,"The work of a motion capture performer",0,https://v.redd.it/7lwknkiwlnac1,0.82,1485,1704474594,2024-01-05T05:09:54+0000
2024-01-06T04,18zbvtw,46,9708,blunderyears,2vy3g,"“Darwin lied” shirt my dad bought me, knee-length shorts, and modesty cami under an XL tee shirt. Yes, I was homeschooled.",0,https://i.redd.it/3n6bbp41mnac1.jpeg,0.94,592,1704474580,2024-01-05T05:09:40+0000
2024-01-06T04,18zbsot,52,8474,JeffArcuri,740oig,Anxiety,0,https://v.redd.it/o6djt9gclnac1,0.92,278,1704474356,2024-01-05T05:05:56+0000
2024-01-06T04,18zbpqr,81,6333,WatchPeopleDieInside,3h4zq,"Thief sees camera",0,https://v.redd.it/rblvsnhrknac1,0.96,362,1704474155,2024-01-05T05:02:35+0000
2024-01-06T04,18zbkwb,37,14762,MadeMeSmile,2uqcm,"Husband finds out he's having triplets ",0,https://v.redd.it/log1jixtjnac1,0.96,738,1704473842,2024-01-05T04:57:22+0000
2024-01-06T04,18zbh1s,27,19740,nottheonion,2qnts,"Retiring House Republican says $174,000 isn't enough money for members of Congress: 'Most of us don't have money'",0,https://biz.crast.net/retiring-house-republican-says-174000-isnt-enough-money-for-members-of-congress-most-of-us-dont-have-money/,0.92,3278,1704473568,2024-01-05T04:52:48+0000
2024-01-06T04,18zb9ge,53,10550,ProgrammerHumor,2tex6,smallProjectsToLearnRust,0,https://i.redd.it/vhoopi8hhnac1.png,0.97,169,1704473048,2024-01-05T04:44:08+0000
2024-01-06T04,18zazae,56,8980,worldnews,2qh13,"Kremlin launches campaign to meddle in U.S. election, as GOP ends support for Ukraine",0,https://lansinginstitute.org/2024/01/05/kremlin-launches-campaign-to-meddle-in-u-s-election-as-gop-ends-support-for-ukraine/,0.93,750,1704472327,2024-01-05T04:32:07+0000
2024-01-06T04,18zayld,31,19029,todayilearned,2qqjc,"TIL of Dennis Fitch, a pilot who studied the crash of Japan Flight 123 to see if he could have flown the doomed aircraft. Years later, Fitch was a passenger on a plane that also lost hydraulic power. Fitch offered to assist the pilots who miraculously managed to crash land, saving 100+ passengers.",0,https://en.wikipedia.org/wiki/United_Airlines_Flight_232,0.97,552,1704472278,2024-01-05T04:31:18+0000
2024-01-06T04,18zayc1,69,9401,HolUp,qir9n,"A real life Key and Peele skit lol",0,https://i.redd.it/ntmyc0r4fnac1.jpeg,0.98,439,1704472260,2024-01-05T04:31:00+0000
2024-01-06T04,18zamu0,61,10396,lotrmemes,2v0i1,"Oldie but a goodie",0,https://i.redd.it/wkp9zkfqcnac1.png,0.91,229,1704471453,2024-01-05T04:17:33+0000
2024-01-06T04,18zaee8,32,30885,wholesomememes,3gcwj,"What a smart Parrot",0,https://i.redd.it/ipvondezanac1.png,0.97,205,1704470879,2024-01-05T04:07:59+0000
2024-01-06T04,18za4zp,84,10118,toptalent,3ptyd,"How different actors trip",0,https://v.redd.it/m21muga39nac1,0.81,224,1704470247,2024-01-05T03:57:27+0000
2024-01-06T04,18z9dsx,97,9179,wallstreetbets,2th52,"When you wake up owing your brokerage $65M because someone exercised your naked SPY calls early",0,https://i.redd.it/y6k34fnc2nac1.png,0.91,1574,1704468263,2024-01-05T03:24:23+0000
2024-01-06T04,18z9dav,90,10766,bi_irl,3nhfo,bi_irl,0,https://i.redd.it/juwup7053nac1.jpeg,0.9,620,1704468225,2024-01-05T03:23:45+0000
2024-01-06T04,18z9a0j,60,12902,ChatGPT,7hqomg,"Where ever could Waldo be?",0,https://www.reddit.com/gallery/18z9a0j,0.98,507,1704467983,2024-01-05T03:19:43+0000
2024-01-06T04,18z98ns,55,16419,pcmasterrace,2sgp1,"You can’t make this stuff up ",0,https://v.redd.it/aotsytp32nac1,0.93,636,1704467881,2024-01-05T03:18:01+0000
2024-01-06T04,18z8w2g,96,9809,gaming,2qh03,"Star Citizen Introducing a $48,000 Ship Bundle, but Only for Players Who Have Already Spent $1,000 - IGN",0,https://www.ign.com/articles/star-citizen-introducing-a-48000-ship-bundle-but-only-for-players-who-have-already-spent-1000,0.92,2787,1704466933,2024-01-05T03:02:13+0000
2024-01-06T04,18z7ur1,58,21026,PoliticalHumor,2qm21,"Good Morning. It's good to start off the day with a nice breakfast, shower, brush teeth and nice community notes own.",0,https://i.redd.it/z7b3pdqjqmac1.jpeg,0.94,934,1704464085,2024-01-05T02:14:45+0000
2024-01-06T04,18z73f8,85,18311,WorkReform,5qpzgw,"Sorry about all that though",0,https://i.redd.it/w6oonf2bkmac1.jpeg,0.92,685,1704461943,2024-01-05T01:39:03+0000
2024-01-06T03,18znpw2,11,3234,BeAmazed,363r3,"Marissa Tomei through the years ",0,https://v.redd.it/x6hs7jbd2qac1,0.97,269,1704504449,2024-01-06T01:27:29+0000
2024-01-06T03,18zn127,64,2710,news,2qh3l,"Alaska's snow crab season canceled for second year in a row as population fails to rebound",0,https://www.cbsnews.com/news/alaska-snow-crab-season-canceled-2024/,0.98,194,1704502541,2024-01-06T12:55:41+0000
2024-01-06T03,18zmkke,89,1205,Satisfyingasfuck,31s00,"Ways to protect a coastline",0,https://v.redd.it/3tod32lbtpac1,0.96,31,1704501294,2024-01-06T12:34:54+0000
2024-01-06T03,18zmkbr,67,1409,LivestreamFail,38jf0,"Asmongold responds to viewer asking about the charity allegations.",0,https://clips.twitch.tv/ArbitraryFrailQueleaTwitchRPG-CAyLDfPvE8W-u6fD,0.92,358,1704501275,2024-01-06T12:34:35+0000
2024-01-06T03,18zmad9,37,4061,mildlyinteresting,2ti4h,"I’m in a weight loss clinical study and this is the test food I ate.",0,https://i.redd.it/dadiqlmarpac1.jpeg,0.97,575,1704500563,2024-01-06T12:22:43+0000
2024-01-06T03,18zlwle,74,1475,TheLastAirbender,2rybx,"The netflix show's costumes look more show accurate, while the (non-existent) movie's look more grounded",0,https://i.redd.it/avpo4dy5opac1.png,0.95,121,1704499583,2024-01-06T12:06:23+0000
2024-01-06T03,18zluem,77,1442,malelivingspace,2v70p,"30M - Proud of how it’s coming together",0,https://www.reddit.com/gallery/18zluem,0.95,229,1704499427,2024-01-06T12:03:47+0000
2024-01-06T03,18zltxy,94,1281,AITAH,446kys,"Update: My brother knows everything now.",1,https://www.reddit.com/r/AITAH/comments/18zltxy/update_my_brother_knows_everything_now/,0.98,337,1704499394,2024-01-06T12:03:14+0000
2024-01-06T03,18zlcuv,6,5671,WhitePeopleTwitter,35n7t,"Donald Trump responds to Iowa school shooting, ends his statement with: get over it.",0,https://i.redd.it/v9dqnofckpac1.jpeg,0.97,537,1704498226,2024-01-05T11:43:46+0000
2024-01-06T03,18zlajx,20,3255,maybemaybemaybe,38e1l,"Maybe maybe maybe",0,https://v.redd.it/abq8ftxujpac1,0.92,501,1704498066,2024-01-05T11:41:06+0000
2024-01-06T03,18zl84w,1,9915,tumblr,2r7hk,"How to kill a god",0,https://i.redd.it/2enaz7bejpac1.jpeg,0.96,159,1704497908,2024-01-05T11:38:28+0000
2024-01-06T03,18zl82l,13,4223,cats,2qhta,"The jacket we bought did not fit the dog , it did fit the cat.",0,https://i.redd.it/mjdsrnudjpac1.jpeg,0.98,65,1704497904,2024-01-05T11:38:24+0000
2024-01-06T03,18zl0r6,29,2960,TikTokCringe,mvcq5,"Father & Daughter have great voices ",0,https://v.redd.it/f928chwvhpac1,0.92,253,1704497407,2024-01-05T11:30:07+0000
2024-01-06T03,18zl058,96,1409,leagueoflegends,2rfxx,"Smolder face update",1,https://www.reddit.com/r/leagueoflegends/comments/18zl058/smolder_face_update/,0.98,257,1704497362,2024-01-05T11:29:22+0000
2024-01-06T03,18zkpd5,57,2030,technicallythetruth,3pzez,"That long metal thing...",0,https://i.redd.it/dj6hya5ffpac1.png,0.98,18,1704496589,2024-01-05T11:16:29+0000
2024-01-06T03,18zkoe0,78,1630,LeopardsAteMyFace,3jp3p,"Looks like Neri Oxman, wife of Bill Ackman, plagiarized much more than was previously thought. Business Insider article pending…",0,https://i.redd.it/1l939tr9fpac1.jpeg,0.96,202,1704496519,2024-01-05T11:15:19+0000
2024-01-06T03,18zkjes,80,1927,Superstonk,43zwn1,"Ryan Cohen new tweet",0,https://x.com/ryancohen/status/1743408923506340150?s=46&t=Xcwu2jDH7BoX7aN0dG0zww,0.94,147,1704496168,2024-01-05T11:09:28+0000
2024-01-06T03,18zk8wa,3,7193,technology,2qh16,"Tesla Cybertruck gets less than 80% of advertised range in YouTuber’s test",0,https://nypost.com/2024/01/05/business/tesla-cybertruck-achieves-less-than-80-of-teslas-advertised-range/amp/,0.9,770,1704495430,2024-01-05T10:57:10+0000
2024-01-06T03,18zk3va,53,4566,funny,2qh33,"USA - Don't use your cell phone while driving! Meanwhile in Hong Kong...",0,https://i.redd.it/btytr8gnapac1.jpeg,0.97,191,1704495073,2024-01-05T10:51:13+0000
2024-01-06T03,18zk0io,84,1720,GetNoted,91bxd4,"Stalinist Gets a Reality Check",0,https://i.redd.it/xmrhnimaapac1.jpeg,0.94,105,1704494846,2024-01-05T10:47:26+0000
2024-01-06T03,18zjqct,17,5251,mildlyinfuriating,2ubgg,"This new mat my mom put always makes me fall over now. ",0,https://v.redd.it/ldufnsq68pac1,0.88,777,1704494137,2024-01-05T10:35:37+0000
2024-01-06T03,18zjp6f,5,7316,politics,2cneq,"Joe Biden just delivered the speech Democrats have been desperate for him to give",0,https://themessenger.com/politics/joe-biden-just-delivered-the-speech-democrats-have-been-desperate-for-him-to-give,0.92,817,1704494058,2024-01-05T10:34:18+0000
2024-01-06T03,18zjl10,41,2778,iphone,2qh2b,"This is it guys. We went full circle!",0,https://i.redd.it/p07hcrz27pac1.gif,0.95,233,1704493769,2024-01-05T10:29:29+0000
2024-01-06T03,18zj1xh,93,1854,theydidthemath,2x23b,"[Request]Would this actually help reduce the gas used for cooking?",0,https://i.redd.it/l9qg1to9zmac1.jpeg,0.92,153,1704492436,2024-01-05T10:07:16+0000
2024-01-06T03,18ziwfb,95,1891,SpidermanPS4,3f1fs,"The hero we need",0,https://v.redd.it/zuy1yewz1pac1,0.96,62,1704492058,2024-01-05T10:00:58+0000
2024-01-06T03,18ziujs,65,2403,starwarsmemes,2wzm6,"True fans know",0,https://i.redd.it/lu70zyrn1pac1.jpeg,0.96,231,1704491942,2024-01-05T09:59:02+0000
2024-01-06T03,18zirkd,86,1997,thalassophobia,2xfs1,"My stomach hurts watching this",0,https://v.redd.it/ymq9vf801pac1,0.94,132,1704491727,2024-01-05T09:55:27+0000
2024-01-06T03,18zimub,99,3792,tumblr,2r7hk,"Bloody Mary Needs More Cardio",0,https://i.redd.it/8kv1ix210pac1.jpeg,0.98,23,1704491394,2024-01-05T09:49:54+0000
2024-01-06T03,18zihk0,27,4401,Wellthatsucks,2xcv7,"Good way to start 2024",0,https://v.redd.it/rlriwuzkyoac1,0.92,392,1704491011,2024-01-05T09:43:31+0000
2024-01-06T03,18zi96s,34,4234,dankmemes,2zmfe,"They were not cool enough to be invited",0,https://i.redd.it/sud1wfkkwoac1.jpeg,0.97,31,1704490422,2024-01-05T09:33:42+0000
2024-01-06T03,18zi6vm,85,2216,ShitPostCrusaders,3f7q5,"And that's how Giorno was made",0,https://i.redd.it/u8d8vvinwoac1.jpeg,0.97,39,1704490258,2024-01-05T09:30:58+0000
2024-01-06T03,18zi4oi,39,3611,me_irlgbt,3apfn,"me🙌irlgbt",0,https://www.reddit.com/gallery/18zi4oi,0.91,40,1704490112,2024-01-05T09:28:32+0000
2024-01-06T03,18zhq33,92,2211,HonkaiStarRail,4q5zoc,"When you pull all the Destruction 5-stars but you're F2P",0,https://i.redd.it/a40e0x8isoac1.png,0.97,192,1704489086,2024-01-05T09:11:26+0000
2024-01-06T03,18zhn6e,82,2450,whenthe,23gidu,"People have started believing a lot of it too",0,https://v.redd.it/wdtf0yiksoac1,0.96,58,1704488892,2024-01-05T09:08:12+0000
2024-01-06T03,18zhd7x,2,14434,BlackPeopleTwitter,33x33,"His dad also escaped slavery and fought for the Union",0,https://www.reddit.com/gallery/18zhd7x,0.96,432,1704488224,2024-01-05T08:57:04+0000
