date,id,position,score,subreddit_display_name,subreddit_id,title,is_self,url,upvote_ratio,num_comments,created,created_date
2024-01-06T08,18zs69t,22,2545,mildlyinfuriating,2ubgg,"People rendering the concept of reusable Cups useless",0,https://i.redd.it/h2ulmxjk6rac1.jpeg,0.96,216,1704517807,2024-01-06T05:10:07+0000
2024-01-06T08,18zrue2,85,1042,meme,2qi1r,"Both Alaska and Texas can fit into Western Australia",0,https://i.redd.it/gifqkagc3rac1.jpeg,0.9,173,1704516736,2024-01-06T04:52:16+0000
2024-01-06T08,18zrrx4,79,1124,aviation,2qhu8,"10 week old 737 MAX Alaska Airlines 1282 successful return to Portland",0,https://v.redd.it/yzc96e0p2rac1,0.97,340,1704516516,2024-01-06T04:48:36+0000
2024-01-06T08,18zrqku,49,1681,madlads,3aegn,"Not all madlads wear capes",0,https://i.redd.it/dthwwnkd2rac1.jpeg,0.95,84,1704516397,2024-01-06T04:46:37+0000
2024-01-06T08,18zrmzs,2,8821,meirl,2s5ti,Meirl,0,https://i.redd.it/q6ypu24f1rac1.jpeg,0.97,613,1704516076,2024-01-06T04:41:16+0000
2024-01-06T08,18zrhs3,55,1594,wallstreetbets,2th52,"Boeing is so Screwed",0,https://i.redd.it/o3cdskw10rac1.jpeg,0.95,514,1704515615,2024-01-06T04:33:35+0000
2024-01-06T08,18zreek,35,2302,HolUp,qir9n,"In the first half you have me",0,https://i.redd.it/s2hgqn46zqac1.jpeg,0.94,105,1704515330,2024-01-06T04:28:50+0000
2024-01-06T08,18zr8dl,61,1478,Damnthatsinteresting,2xxyj,"Even now -- her eyes are just as captivating -- but there is a real person & her story behind them",0,https://i.redd.it/cxsz3iclxqac1.jpeg,0.87,135,1704514790,2024-01-06T04:19:50+0000
2024-01-06T08,18zr3vv,65,1410,AnimalMemes,2wynd,"skinny guy plays dead",0,https://v.redd.it/0nh9q5g2wqac1,0.97,63,1704514378,2024-01-06T04:12:58+0000
2024-01-06T08,18zr0xi,81,1257,PublicFreakout,2yrq6,"Girl Gets Her Boyfriend KOED",0,https://v.redd.it/wyt8z15kvqac1,0.95,186,1704514104,2024-01-06T04:08:24+0000
2024-01-06T08,18zqyh9,96,1109,NatureIsFuckingLit,3gdh7,"🔥 This is how a chameleon gives birth 🔥",0,https://i.imgur.com/iKLUmfn.gifv,0.94,54,1704513883,2024-01-06T04:04:43+0000
2024-01-06T08,18zqxhh,68,1425,nonononoyes,2xp2p,"Machine vs nature",0,https://i.redd.it/t06ri11muqac1.gif,0.93,83,1704513791,2024-01-06T04:03:11+0000
2024-01-06T08,18zqs54,48,2037,Showerthoughts,2szyo,"Robert Downey Jr might be the last mainstream actor in history to get away with blackface.",1,https://www.reddit.com/r/Showerthoughts/comments/18zqs54/robert_downey_jr_might_be_the_last_mainstream/,0.85,463,1704513329,2024-01-06T03:55:29+0000
2024-01-06T08,18zqnn0,11,5333,technicallythetruth,3pzez,"That’s how vents work",0,https://i.redd.it/73wmf053sqac1.jpeg,0.97,27,1704512938,2024-01-06T03:48:58+0000
2024-01-06T08,18zqfw6,43,2272,SipsTea,5tdqj0,"When a local gives you a warning, you should probably listen...",0,https://v.redd.it/k8oxekh5qqac1,0.98,200,1704512288,2024-01-06T03:38:08+0000
2024-01-06T08,18zqe31,69,1493,CatastrophicFailure,38tab,"Alaska Airlines flight from Portland, OR to Ontario, Ca has rapid depressurization and has window/side blown out 1/5/24",0,https://www.reddit.com/gallery/18zqe31,0.97,304,1704512125,2024-01-06T03:35:25+0000
2024-01-06T08,18zqct7,33,2810,Awww,2suml,"The couple who raised a chimp born with broken ribs and pneumonia after he was abandoned by his mother, comes to visit him.",0,https://v.redd.it/7kbx3rjbpqac1,0.97,46,1704512015,2024-01-06T03:33:35+0000
2024-01-06T08,18zq55p,1,18067,pics,2qh0u,"When you hear a huge boom at 25k feet.",0,https://www.reddit.com/gallery/18zq55p,0.97,2527,1704511366,2024-01-06T03:22:46+0000
2024-01-06T08,18zpu2c,14,4629,BaldursGate3,12967t,"Literally me",0,https://i.redd.it/8xbt8o2okqac1.jpeg,0.96,270,1704510441,2024-01-06T03:07:21+0000
2024-01-06T08,18zpr6m,26,3499,me_irl,2vegg,me_irl,0,https://v.redd.it/4pu05hzujqac1,0.96,93,1704510204,2024-01-06T03:03:24+0000
2024-01-06T08,18zpqb4,28,3196,MadeMeSmile,2uqcm,"This is heartwarming",0,https://v.redd.it/hr69lk4qjqac1,0.95,73,1704510134,2024-01-06T03:02:14+0000
2024-01-06T08,18zpprp,42,2522,nottheonion,2qnts,"White Claw launches new 0% alcohol seltzers: 'Depth of flavor and complexity'",0,https://www.foxbusiness.com/lifestyle/white-claw-launches-0-percent-alcohol-seltzers-depth-flavor-complexity,0.94,312,1704510092,2024-01-06T03:01:32+0000
2024-01-06T08,18zppoi,78,1580,CricketShitpost,3fzqh,"If Star sports made a poster for Warner, it would look like this !",0,https://i.redd.it/q5zuusvljqac1.png,0.97,54,1704510086,2024-01-06T03:01:26+0000
2024-01-06T08,18zpn31,73,1675,Hololive,29numb,"Both Fuwawa's and Mococo's New Year's Outfits are so cute!",0,https://www.reddit.com/gallery/18zpn31,0.95,69,1704509895,2024-01-06T02:58:15+0000
2024-01-06T08,18zpl85,54,2134,FunnyandSad,2z7qd,"strong and ready",0,https://i.redd.it/75gcjjr1hqac1.jpeg,0.94,98,1704509735,2024-01-06T02:55:35+0000
2024-01-06T08,18zphj0,7,7501,todayilearned,2qqjc,"TIL that Queen Anne of Great Britain had seven miscarriages, five stillbirths, two children who died shortly after birth, two who died in infancy, and one who died at age 11. She left no heirs and was succeeded by her second cousin.",0,"https://en.wikipedia.org/wiki/Anne,_Queen_of_Great_Britain",0.97,387,1704509434,2024-01-06T02:50:34+0000
2024-01-06T08,18zpcjm,38,3023,worldnews,2qh13,"Russia Got 7,500-Pound Rockets From North Korea - And promptly Blew Up A Pair Of Ukraine Supply Bases",0,https://www.forbes.com/sites/davidaxe/2024/01/05/russia-got-7500-pound-rockets-from-north-korea-and-promptly-blew-up-a-pair-of-ukrainian-supply-bases/?utm_source=flipboard&utm_content=LindaCypert%2Fmagazine%2F%0AImportant+Trending+Stories+&sh=2134fd8f363f,0.94,475,1704509034,2024-01-06T02:43:54+0000
2024-01-06T08,18zp9f3,92,1480,CrazyFuckingVideos,45hae8,"Guy jumps from window to try and escape police",0,https://v.redd.it/sie690ppfqac1,0.97,155,1704508776,2024-01-06T02:39:36+0000
2024-01-06T08,18zp5sv,91,1486,ChoosingBeggars,35fmc,"Trying to sell a baby swing...",0,https://www.reddit.com/gallery/18zp5sv,0.96,86,1704508483,2024-01-06T02:34:43+0000
2024-01-06T08,18zoy05,6,10422,wholesomememes,3gcwj,"Old dad tried his hardest and my heart melted",0,https://i.redd.it/r4tj665ucqac1.jpeg,0.96,90,1704507868,2024-01-06T02:24:28+0000
2024-01-06T08,18zougq,44,2846,WTF,2qh61,"The results of 30 years of chain-smoking inside a living room.",0,https://i.redd.it/dw8jez77cqac1.jpeg,0.96,209,1704507595,2024-01-06T02:19:55+0000
2024-01-06T08,18zot1s,97,1513,NoStupidQuestions,2w844,"Why do people panic buy bread, milk, and eggs whenever there's supposed to be snow?",1,https://www.reddit.com/r/NoStupidQuestions/comments/18zot1s/why_do_people_panic_buy_bread_milk_and_eggs/,0.87,262,1704507481,2024-01-06T02:18:01+0000
2024-01-06T08,18zos3t,52,7351,WhitePeopleTwitter,35n7t,"Biden from the top rope",0,https://i.redd.it/qa4j5r2nbqac1.jpeg,0.97,125,1704507405,2024-01-06T02:16:45+0000
2024-01-06T08,18zoqni,13,6206,shitposting,2usxq,"Parking lots are very interesting",0,https://v.redd.it/e4xg2j6abqac1,0.95,323,1704507290,2024-01-06T02:14:50+0000
2024-01-06T08,18zontq,5,12647,facepalm,2r5rp,"Gotta love the magic of unintentional, spontaneous photoshoots",0,https://i.redd.it/m7jcf2mlaqac1.jpeg,0.94,507,1704507063,2024-01-06T02:11:03+0000
2024-01-06T08,18zojzp,74,1923,dataisbeautiful,2tk95,"There are more cows than people in the states colored blue. [OC]",0,https://i.redd.it/uajbckao9qac1.png,0.93,217,1704506759,2024-01-06T02:05:59+0000
2024-01-06T08,18zoehm,41,3240,Unexpected,2w67q,"The problem was solved instantly.",0,https://v.redd.it/nyhlkwsh8qac1,0.89,129,1704506348,2024-01-06T01:59:08+0000
2024-01-06T08,18zo5t6,47,3056,CrappyDesign,2sa3m,"Hotel key card that doesn't fit in your wallet",0,https://i.redd.it/5mtgshog6qac1.jpeg,0.95,203,1704505665,2024-01-06T01:47:45+0000
2024-01-06T08,18znyt0,40,3360,nflcirclejerk,2sulf,"the liberals have discovered pat mcafee",0,https://i.redd.it/35p7hvwv4qac1.jpeg,0.89,408,1704505134,2024-01-06T01:38:54+0000
2024-01-06T08,18znwz5,36,3961,Presidents,2qwlm,"Why was Obama’s tan suit so controversial?",0,https://i.redd.it/c3xpmq2g4qac1.jpeg,0.89,1566,1704504986,2024-01-06T01:36:26+0000
2024-01-06T08,18znpw2,3,26317,BeAmazed,363r3,"Marissa Tomei through the years ",0,https://v.redd.it/x6hs7jbd2qac1,0.94,1638,1704504449,2024-01-06T01:27:29+0000
2024-01-06T08,18znpuw,20,5278,nba,2qo4s,"[Slater] Steve Kerr: “I played 15 years and all 15 I was frustrated with my playing time.”",0,https://x.com/anthonyvslater/status/1743443483673919580?s=46&t=gEvQlnNLbU9ke0xn1kR1YA,0.95,702,1704504446,2024-01-06T01:27:26+0000
2024-01-06T08,18znnct,34,4141,Eyebleach,2s427,"His first sound sleep after being adopted from a shelter.",0,https://i.redd.it/fr75rgl62qac1.jpeg,0.97,51,1704504258,2024-01-06T01:24:18+0000
2024-01-06T08,18znlfe,24,5417,ExplainTheJoke,2vmj2,"What happened?",0,https://i.redd.it/y0fwv4ts1qac1.jpeg,0.95,199,1704504101,2024-01-06T01:21:41+0000
2024-01-06T08,18znklm,82,2098,UpliftingNews,2u3ta,"Mark Cuban tells Mavericks employees of plan to pay out $35M in bonuses",0,https://www.reuters.com/sports/basketball/cuban-tells-mavericks-employees-plan-pay-out-35m-bonuses-2024-01-05/,0.94,138,1704504037,2024-01-06T01:20:37+0000
2024-01-06T08,18znfqh,63,2498,lego,2qhm7,"All set up in the new cubicle!",0,https://i.redd.it/fgqgtafi0qac1.jpeg,0.93,149,1704503663,2024-01-06T01:14:23+0000
2024-01-06T08,18zndq3,30,4461,interestingasfuck,2qhsa,"how hockey rinks get set up for a game",0,https://v.redd.it/x65n1fnzzpac1,0.95,244,1704503500,2024-01-06T01:11:40+0000
2024-01-06T08,18zn4y0,75,2365,lies,2qloj,"accidentally dropped my phone from our balcony and it did this",0,https://v.redd.it/japw7twuxpac1,0.91,108,1704502839,2024-01-06T01:00:39+0000
2024-01-06T08,18zn127,4,14756,news,2qh3l,"Alaska's snow crab season canceled for second year in a row as population fails to rebound",0,https://www.cbsnews.com/news/alaska-snow-crab-season-canceled-2024/,0.97,908,1704502541,2024-01-06T12:55:41+0000
2024-01-06T08,18zmvj0,21,6121,holdmycatnip,2zhxd,"Orange cat doing orange cat things",0,https://v.redd.it/0o5bsfosvpac1,0.97,108,1704502114,2024-01-06T12:48:34+0000
2024-01-06T08,18zml9q,67,2865,Terraria,2sg5b,"It may not seem it. But i am not a Roblox addict. 🚫🚫",0,https://i.redd.it/75ukswamtpac1.jpeg,0.94,97,1704501345,2024-01-06T12:35:45+0000
2024-01-06T08,18zmkbr,57,3179,LivestreamFail,38jf0,"Asmongold responds to viewer asking about the charity allegations.",0,https://clips.twitch.tv/ArbitraryFrailQueleaTwitchRPG-CAyLDfPvE8W-u6fD,0.91,662,1704501275,2024-01-06T12:34:35+0000
2024-01-06T08,18zmk9c,100,2086,ProgrammerHumor,2tex6,spentThreeWeeksWritingThis,0,https://i.redd.it/am3hprcetpac1.png,0.98,134,1704501271,2024-01-06T12:34:31+0000
2024-01-06T08,18zmfyz,62,2975,FunnyAnimals,2st2l,"Food now rrrr",0,https://v.redd.it/8wxele0gspac1,0.97,66,1704500971,2024-01-06T12:29:31+0000
2024-01-06T08,18zmcav,80,2579,lgbt,2qhh7,"Rare French W",0,https://i.redd.it/ikkn15uprpac1.jpeg,0.94,181,1704500706,2024-01-06T12:25:06+0000
2024-01-06T08,18zmad9,8,17446,mildlyinteresting,2ti4h,"I’m in a weight loss clinical study and this is the test food I ate.",0,https://i.redd.it/dadiqlmarpac1.jpeg,0.94,1850,1704500563,2024-01-06T12:22:43+0000
2024-01-06T08,18zm45y,19,8089,clevercomebacks,dyqlw,"Readers added context",0,https://i.redd.it/1sifhf90qpac1.jpeg,0.94,382,1704500130,2024-01-06T12:15:30+0000
2024-01-06T08,18zlwle,39,4958,TheLastAirbender,2rybx,"The netflix show's costumes look more show accurate, while the (non-existent) movie's look more grounded",0,https://i.redd.it/avpo4dy5opac1.png,0.93,318,1704499583,2024-01-06T12:06:23+0000
2024-01-06T08,18zltxy,70,2919,AITAH,446kys,"Update: My brother knows everything now.",1,https://www.reddit.com/r/AITAH/comments/18zltxy/update_my_brother_knows_everything_now/,0.94,687,1704499394,2024-01-06T12:03:14+0000
2024-01-06T08,18zltbb,93,2407,AteTheOnion,3i1ww,"Ice was not frozen enough",0,https://i.redd.it/voh6dp2hnpac1.jpeg,0.96,47,1704499352,2024-01-06T12:02:32+0000
2024-01-06T08,18zlcuv,9,16013,WhitePeopleTwitter,35n7t,"Donald Trump responds to Iowa school shooting, ends his statement with: get over it.",0,https://i.redd.it/v9dqnofckpac1.jpeg,0.94,1586,1704498226,2024-01-05T11:43:46+0000
2024-01-06T08,18zlajx,18,12786,maybemaybemaybe,38e1l,"Maybe maybe maybe",0,https://v.redd.it/abq8ftxujpac1,0.89,1516,1704498066,2024-01-05T11:41:06+0000
2024-01-06T08,18zl84w,10,20302,tumblr,2r7hk,"How to kill a god",0,https://i.redd.it/2enaz7bejpac1.jpeg,0.94,334,1704497908,2024-01-05T11:38:28+0000
2024-01-06T08,18zl82l,12,12926,cats,2qhta,"The jacket we bought did not fit the dog , it did fit the cat.",0,https://i.redd.it/mjdsrnudjpac1.jpeg,0.97,157,1704497904,2024-01-05T11:38:24+0000
2024-01-06T08,18zl4ac,77,3142,PrequelMemes,3i60n,"Stupid little thing😤",0,https://v.redd.it/w9otzntlipac1,0.96,35,1704497648,2024-01-05T11:34:08+0000
2024-01-06T08,18zl2oc,66,3409,Wellthatsucks,2xcv7,"The see me rolling",0,https://v.redd.it/4h94mhaaipac1,0.98,68,1704497533,2024-01-05T11:32:13+0000
2024-01-06T08,18zl0tw,64,3470,AskReddit,2qh1i,"What’s a fact that could save your life?",1,https://www.reddit.com/r/AskReddit/comments/18zl0tw/whats_a_fact_that_could_save_your_life/,0.96,2475,1704497413,2024-01-05T11:30:13+0000
2024-01-06T08,18zl0r6,25,7703,TikTokCringe,mvcq5,"Father & Daughter have great voices ",0,https://v.redd.it/f928chwvhpac1,0.89,575,1704497407,2024-01-05T11:30:07+0000
2024-01-06T08,18zktp2,72,3331,whatsthisrock,2w6k5,"Gifted by my grandfather. He found while on a hike. Is it flint?",0,https://i.redd.it/4htbj6vdgpac1.jpeg,0.91,596,1704496894,2024-01-05T11:21:34+0000
2024-01-06T08,18zkoe0,76,3208,LeopardsAteMyFace,3jp3p,"Looks like Neri Oxman, wife of Bill Ackman, plagiarized much more than was previously thought. Business Insider article pending…",0,https://i.redd.it/1l939tr9fpac1.jpeg,0.95,312,1704496519,2024-01-05T11:15:19+0000
2024-01-06T08,18zkhmf,98,2802,terriblefacebookmemes,2tja6,"Totally comparable. Totally.",0,https://i.redd.it/du59vfhrdpac1.jpeg,0.91,247,1704496039,2024-01-05T11:07:19+0000
2024-01-06T08,18zk8wa,15,13686,technology,2qh16,"Tesla Cybertruck gets less than 80% of advertised range in YouTuber’s test",0,https://nypost.com/2024/01/05/business/tesla-cybertruck-achieves-less-than-80-of-teslas-advertised-range/amp/,0.89,1354,1704495430,2024-01-05T10:57:10+0000
2024-01-06T08,18zk3va,16,13405,funny,2qh33,"USA - Don't use your cell phone while driving! Meanwhile in Hong Kong...",0,https://i.redd.it/btytr8gnapac1.jpeg,0.95,458,1704495073,2024-01-05T10:51:13+0000
2024-01-06T08,18zk0io,89,3095,GetNoted,91bxd4,"Stalinist Gets a Reality Check",0,https://i.redd.it/xmrhnimaapac1.jpeg,0.92,211,1704494846,2024-01-05T10:47:26+0000
2024-01-06T08,18zjp6f,17,15048,politics,2cneq,"Joe Biden just delivered the speech Democrats have been desperate for him to give",0,https://themessenger.com/politics/joe-biden-just-delivered-the-speech-democrats-have-been-desperate-for-him-to-give,0.88,1813,1704494058,2024-01-05T10:34:18+0000
2024-01-06T08,18zjl10,32,8397,iphone,2qh2b,"This is it guys. We went full circle!",0,https://i.redd.it/p07hcrz27pac1.gif,0.95,558,1704493769,2024-01-05T10:29:29+0000
2024-01-06T08,18zj1xh,94,3639,theydidthemath,2x23b,"[Request]Would this actually help reduce the gas used for cooking?",0,https://i.redd.it/l9qg1to9zmac1.jpeg,0.92,234,1704492436,2024-01-05T10:07:16+0000
2024-01-06T08,18ziwfb,90,3734,SpidermanPS4,3f1fs,"The hero we need",0,https://v.redd.it/zuy1yewz1pac1,0.95,100,1704492058,2024-01-05T10:00:58+0000
2024-01-06T08,18ziujs,71,4692,starwarsmemes,2wzm6,"True fans know",0,https://i.redd.it/lu70zyrn1pac1.jpeg,0.94,415,1704491942,2024-01-05T09:59:02+0000
2024-01-06T08,18zirkd,84,3862,thalassophobia,2xfs1,"My stomach hurts watching this",0,https://v.redd.it/ymq9vf801pac1,0.93,219,1704491727,2024-01-05T09:55:27+0000
2024-01-06T08,18zir2k,46,9390,memes,2qjpg,"I'm polite when in a crowded elevator",0,https://i.redd.it/lfr6jdll0pac1.png,0.96,176,1704491692,2024-01-05T09:54:52+0000
2024-01-06T08,18zi96s,58,6763,dankmemes,2zmfe,"They were not cool enough to be invited",0,https://i.redd.it/sud1wfkkwoac1.jpeg,0.96,37,1704490422,2024-01-05T09:33:42+0000
2024-01-06T08,18zi4oi,83,4835,me_irlgbt,3apfn,"me🙌irlgbt",0,https://www.reddit.com/gallery/18zi4oi,0.89,48,1704490112,2024-01-05T09:28:32+0000
2024-01-06T08,18zhd7x,23,19529,BlackPeopleTwitter,33x33,"His dad also escaped slavery and fought for the Union",0,https://www.reddit.com/gallery/18zhd7x,0.95,523,1704488224,2024-01-05T08:57:04+0000
2024-01-06T08,18zh2nk,31,18222,BikiniBottomTwitter,3deqz,"Imagine being this inconsiderate...",0,https://i.redd.it/g0f9dy77ooac1.jpeg,0.95,550,1704487479,2024-01-05T08:44:39+0000
2024-01-06T08,18zgwh1,88,4853,StarWars,2qi4s,"Not the Stepfather, the father who stepped up",0,https://i.redd.it/ntg96b91noac1.jpeg,0.95,175,1704487043,2024-01-05T08:37:23+0000
2024-01-06T08,18zguyi,50,8434,antiwork,2y77d,"""Middle age"" is a lie",0,https://i.redd.it/tetrp0vqmoac1.jpeg,0.95,271,1704486941,2024-01-05T08:35:41+0000
2024-01-06T08,18zgo3g,37,12577,OldSchoolCool,2tycb,"[90s] Beastie Boys perform Sabotage live on stage.",0,https://v.redd.it/fgyjgbr6loac1,0.95,936,1704486480,2024-01-05T08:28:00+0000
2024-01-06T08,18zgh76,45,13728,wizardposting,5hjlp1,"My fellows...",0,https://i.redd.it/y9ft8c21koac1.png,0.92,472,1704486013,2024-01-05T08:20:13+0000
2024-01-06T08,18zggd2,27,19268,aww,2qh1o,"We spent the entire day searching our apartment for our lost kitten. This is the smug face we saw before we went to bed.",0,https://i.redd.it/ebss1q6vjoac1.jpeg,0.96,339,1704485959,2024-01-05T08:19:19+0000
2024-01-06T08,18zgcyw,99,4878,TwoXChromosomes,2r2jt,"Along with illness, you can add breast reduction as a reason men will leave.",1,https://www.reddit.com/r/TwoXChromosomes/comments/18zgcyw/along_with_illness_you_can_add_breast_reduction/,0.83,777,1704485729,2024-01-05T08:15:29+0000
2024-01-06T08,18zfs8i,59,8415,NonPoliticalTwitter,39gt6y,"Vacations are just sneak previews of retirement",0,https://i.imgur.com/mpgpjR2.jpeg,0.96,74,1704484334,2024-01-05T07:52:14+0000
2024-01-06T08,18zflnr,86,7589,PeterExplainsTheJoke,121h8r,help?,0,https://i.redd.it/klyvdvhidoac1.png,0.9,213,1704483874,2024-01-05T07:44:34+0000
2024-01-06T08,18zfkrl,53,10643,Justrolledintotheshop,2tteh,"Fed vehicles in for repairs. Government requires emission control devices on OUR vehicles but give themself an exemption to use a “deleted” diesel truck.",0,https://i.redd.it/w1htigchdoac1.jpeg,0.88,1019,1704483811,2024-01-05T07:43:31+0000
2024-01-06T08,18zf2rp,29,40798,oddlysatisfying,2x93b,"Pretty smooth fist bump ",0,https://v.redd.it/dfsnforp9oac1,0.94,482,1704482545,2024-01-05T07:22:25+0000
2024-01-06T08,18zf149,87,7172,CuratedTumblr,3x5kfw,"On curating your internets experience",0,https://www.reddit.com/gallery/18zf149,0.97,122,1704482431,2024-01-05T07:20:31+0000
2024-01-06T08,18zdhcs,51,21133,comics,2qh0s,"Gamer Cafe 1529 - Intrusion",0,https://www.reddit.com/gallery/18zdhcs,0.95,690,1704478535,2024-01-05T06:15:35+0000
2024-01-06T08,18zcfop,56,26281,JustGuysBeingDudes,33rtj6,"Dad's words",0,https://v.redd.it/q089ily3qnac1,0.93,731,1704475953,2024-01-05T05:32:33+0000
2024-01-06T08,18zc3op,60,20008,GenZ,2tz25,"Who else remembers Net Neutrality and when this guy was the most hated person on the internet for a few weeks",0,https://i.redd.it/ssyp6aqmnnac1.jpeg,0.95,1439,1704475117,2024-01-05T05:18:37+0000
2024-01-06T08,18zbvtw,95,10977,blunderyears,2vy3g,"“Darwin lied” shirt my dad bought me, knee-length shorts, and modesty cami under an XL tee shirt. Yes, I was homeschooled.",0,https://i.redd.it/3n6bbp41mnac1.jpeg,0.93,631,1704474580,2024-01-05T05:09:40+0000
2024-01-06T07,18zrmzs,7,4603,meirl,2s5ti,Meirl,0,https://i.redd.it/q6ypu24f1rac1.jpeg,0.97,335,1704516076,2024-01-06T04:41:16+0000
2024-01-06T07,18zreek,50,1481,HolUp,qir9n,"In the first half you have me",0,https://i.redd.it/s2hgqn46zqac1.jpeg,0.94,75,1704515330,2024-01-06T04:28:50+0000
2024-01-06T07,18zr3vv,93,959,AnimalMemes,2wynd,"skinny guy plays dead",0,https://v.redd.it/0nh9q5g2wqac1,0.97,52,1704514378,2024-01-06T04:12:58+0000
2024-01-06T07,18zqs54,71,1223,Showerthoughts,2szyo,"Robert Downey Jr might be the last mainstream actor in history to get away with blackface.",1,https://www.reddit.com/r/Showerthoughts/comments/18zqs54/robert_downey_jr_might_be_the_last_mainstream/,0.84,330,1704513329,2024-01-06T03:55:29+0000
2024-01-06T07,18zqnn0,29,2688,technicallythetruth,3pzez,"That’s how vents work",0,https://i.redd.it/73wmf053sqac1.jpeg,0.97,16,1704512938,2024-01-06T03:48:58+0000
2024-01-06T07,18zqe31,82,1189,CatastrophicFailure,38tab,"Alaska Airlines flight from Portland, OR to Ontario, Ca has rapid depressurization and has window/side blown out 1/5/24",0,https://www.reddit.com/gallery/18zqe31,0.97,253,1704512125,2024-01-06T03:35:25+0000
2024-01-06T07,18zq55p,1,14100,pics,2qh0u,"When you hear a huge boom at 25k feet.",0,https://www.reddit.com/gallery/18zq55p,0.98,2113,1704511366,2024-01-06T03:22:46+0000
2024-01-06T07,18zpu2c,22,3288,BaldursGate3,12967t,"Literally me",0,https://i.redd.it/8xbt8o2okqac1.jpeg,0.96,206,1704510441,2024-01-06T03:07:21+0000
2024-01-06T07,18zpr6m,43,2111,me_irl,2vegg,me_irl,0,https://v.redd.it/4pu05hzujqac1,0.97,69,1704510204,2024-01-06T03:03:24+0000
2024-01-06T07,18zpqb4,34,2449,MadeMeSmile,2uqcm,"This is heartwarming",0,https://v.redd.it/hr69lk4qjqac1,0.96,56,1704510134,2024-01-06T03:02:14+0000
2024-01-06T07,18zpprp,53,1856,nottheonion,2qnts,"White Claw launches new 0% alcohol seltzers: 'Depth of flavor and complexity'",0,https://www.foxbusiness.com/lifestyle/white-claw-launches-0-percent-alcohol-seltzers-depth-flavor-complexity,0.95,230,1704510092,2024-01-06T03:01:32+0000
2024-01-06T07,18zppoi,87,1260,CricketShitpost,3fzqh,"If Star sports made a poster for Warner, it would look like this !",0,https://i.redd.it/q5zuusvljqac1.png,0.97,44,1704510086,2024-01-06T03:01:26+0000
2024-01-06T07,18zpn31,81,1360,Hololive,29numb,"Both Fuwawa's and Mococo's New Year's Outfits are so cute!",0,https://www.reddit.com/gallery/18zpn31,0.96,63,1704509895,2024-01-06T02:58:15+0000
2024-01-06T07,18zpl85,58,1631,FunnyandSad,2z7qd,"strong and ready",0,https://i.redd.it/75gcjjr1hqac1.jpeg,0.94,87,1704509735,2024-01-06T02:55:35+0000
2024-01-06T07,18zphj0,9,5928,todayilearned,2qqjc,"TIL that Queen Anne of Great Britain had seven miscarriages, five stillbirths, two children who died shortly after birth, two who died in infancy, and one who died at age 11. She left no heirs and was succeeded by her second cousin.",0,"https://en.wikipedia.org/wiki/Anne,_Queen_of_Great_Britain",0.97,328,1704509434,2024-01-06T02:50:34+0000
2024-01-06T07,18zpcjm,46,2164,worldnews,2qh13,"Russia Got 7,500-Pound Rockets From North Korea - And promptly Blew Up A Pair Of Ukraine Supply Bases",0,https://www.forbes.com/sites/davidaxe/2024/01/05/russia-got-7500-pound-rockets-from-north-korea-and-promptly-blew-up-a-pair-of-ukrainian-supply-bases/?utm_source=flipboard&utm_content=LindaCypert%2Fmagazine%2F%0AImportant+Trending+Stories+&sh=2134fd8f363f,0.94,343,1704509034,2024-01-06T02:43:54+0000
2024-01-06T07,18zp5sv,95,1257,ChoosingBeggars,35fmc,"Trying to sell a baby swing...",0,https://www.reddit.com/gallery/18zp5sv,0.96,78,1704508483,2024-01-06T02:34:43+0000
2024-01-06T07,18zp37f,51,2095,Awww,2suml,"The most wholesome video you'll ever see.",0,https://v.redd.it/zc7akd93eqac1,0.93,72,1704508276,2024-01-06T02:31:16+0000
2024-01-06T07,18zoy05,6,8009,wholesomememes,3gcwj,"Old dad tried his hardest and my heart melted",0,https://i.redd.it/r4tj665ucqac1.jpeg,0.96,65,1704507868,2024-01-06T02:24:28+0000
2024-01-06T07,18zougq,41,2421,WTF,2qh61,"The results of 30 years of chain-smoking inside a living room.",0,https://i.redd.it/dw8jez77cqac1.jpeg,0.96,188,1704507595,2024-01-06T02:19:55+0000
2024-01-06T07,18zos3t,49,6317,WhitePeopleTwitter,35n7t,"Biden from the top rope",0,https://i.redd.it/qa4j5r2nbqac1.jpeg,0.97,100,1704507405,2024-01-06T02:16:45+0000
2024-01-06T07,18zoqni,17,5103,shitposting,2usxq,"Parking lots are very interesting",0,https://v.redd.it/e4xg2j6abqac1,0.96,277,1704507290,2024-01-06T02:14:50+0000
2024-01-06T07,18zontq,5,9691,facepalm,2r5rp,"Gotta love the magic of unintentional, spontaneous photoshoots",0,https://i.redd.it/m7jcf2mlaqac1.jpeg,0.95,409,1704507063,2024-01-06T02:11:03+0000
2024-01-06T07,18zojzp,70,1678,dataisbeautiful,2tk95,"There are more cows than people in the states colored blue. [OC]",0,https://i.redd.it/uajbckao9qac1.png,0.93,201,1704506759,2024-01-06T02:05:59+0000
2024-01-06T07,18zoehm,55,2290,Unexpected,2w67q,"The problem was solved instantly.",0,https://v.redd.it/nyhlkwsh8qac1,0.88,104,1704506348,2024-01-06T01:59:08+0000
2024-01-06T07,18zo5t6,48,2475,CrappyDesign,2sa3m,"Hotel key card that doesn't fit in your wallet",0,https://i.redd.it/5mtgshog6qac1.jpeg,0.95,182,1704505665,2024-01-06T01:47:45+0000
2024-01-06T07,18znyt0,39,3009,nflcirclejerk,2sulf,"the liberals have discovered pat mcafee",0,https://i.redd.it/35p7hvwv4qac1.jpeg,0.89,350,1704505134,2024-01-06T01:38:54+0000
2024-01-06T07,18znwz5,32,3444,Presidents,2qwlm,"Why was Obama’s tan suit so controversial?",0,https://i.redd.it/c3xpmq2g4qac1.jpeg,0.89,1451,1704504986,2024-01-06T01:36:26+0000
2024-01-06T07,18znpw2,2,23219,BeAmazed,363r3,"Marissa Tomei through the years ",0,https://v.redd.it/x6hs7jbd2qac1,0.94,1524,1704504449,2024-01-06T01:27:29+0000
2024-01-06T07,18znpuw,19,4896,nba,2qo4s,"[Slater] Steve Kerr: “I played 15 years and all 15 I was frustrated with my playing time.”",0,https://x.com/anthonyvslater/status/1743443483673919580?s=46&t=gEvQlnNLbU9ke0xn1kR1YA,0.95,675,1704504446,2024-01-06T01:27:26+0000
2024-01-06T07,18znnct,33,3430,Eyebleach,2s427,"His first sound sleep after being adopted from a shelter.",0,https://i.redd.it/fr75rgl62qac1.jpeg,0.97,47,1704504258,2024-01-06T01:24:18+0000
2024-01-06T07,18znlfe,27,4469,ExplainTheJoke,2vmj2,"What happened?",0,https://i.redd.it/y0fwv4ts1qac1.jpeg,0.95,142,1704504101,2024-01-06T01:21:41+0000
