date,id,position,score,subreddit_display_name,subreddit_id,title,is_self,url,upvote_ratio,num_comments,created,created_date
2024-01-06T06,18zh4zp,73,14316,mildlyinteresting,2ti4h,"Ordered some covid tests from amazon, got a free pack of pasta",0,https://i.redd.it/g45e98yuooac1.jpeg,0.94,558,1704487637,2024-01-05T08:47:17+0000
2024-01-06T06,18zh2nk,21,16658,BikiniBottomTwitter,3deqz,"Imagine being this inconsiderate...",0,https://i.redd.it/g0f9dy77ooac1.jpeg,0.95,510,1704487479,2024-01-05T08:44:39+0000
2024-01-06T06,18zgwh1,69,4237,StarWars,2qi4s,"Not the Stepfather, the father who stepped up",0,https://i.redd.it/ntg96b91noac1.jpeg,0.95,164,1704487043,2024-01-05T08:37:23+0000
2024-01-06T06,18zguyi,42,6886,antiwork,2y77d,"""Middle age"" is a lie",0,https://i.redd.it/tetrp0vqmoac1.jpeg,0.95,242,1704486941,2024-01-05T08:35:41+0000
2024-01-06T06,18zgo3g,26,11444,OldSchoolCool,2tycb,"[90s] Beastie Boys perform Sabotage live on stage.",0,https://v.redd.it/fgyjgbr6loac1,0.95,894,1704486480,2024-01-05T08:28:00+0000
2024-01-06T06,18zgh76,29,12550,wizardposting,5hjlp1,"My fellows...",0,https://i.redd.it/y9ft8c21koac1.png,0.92,435,1704486013,2024-01-05T08:20:13+0000
2024-01-06T06,18zggd2,19,17522,aww,2qh1o,"We spent the entire day searching our apartment for our lost kitten. This is the smug face we saw before we went to bed.",0,https://i.redd.it/ebss1q6vjoac1.jpeg,0.96,318,1704485959,2024-01-05T08:19:19+0000
2024-01-06T06,18zgcyw,74,4475,TwoXChromosomes,2r2jt,"Along with illness, you can add breast reduction as a reason men will leave.",1,https://www.reddit.com/r/TwoXChromosomes/comments/18zgcyw/along_with_illness_you_can_add_breast_reduction/,0.83,728,1704485729,2024-01-05T08:15:29+0000
2024-01-06T06,18zg7kc,40,9013,me_irl,2vegg,"me irl",0,https://i.redd.it/6wlpuzs2ioac1.jpeg,0.95,104,1704485359,2024-01-05T08:09:19+0000
2024-01-06T06,18zfs8i,49,7230,NonPoliticalTwitter,39gt6y,"Vacations are just sneak previews of retirement",0,https://i.imgur.com/mpgpjR2.jpeg,0.96,68,1704484334,2024-01-05T07:52:14+0000
2024-01-06T06,18zflnr,61,6925,PeterExplainsTheJoke,121h8r,help?,0,https://i.redd.it/klyvdvhidoac1.png,0.9,201,1704483874,2024-01-05T07:44:34+0000
2024-01-06T06,18zfkrl,39,9687,Justrolledintotheshop,2tteh,"Fed vehicles in for repairs. Government requires emission control devices on OUR vehicles but give themself an exemption to use a “deleted” diesel truck.",0,https://i.redd.it/w1htigchdoac1.jpeg,0.89,977,1704483811,2024-01-05T07:43:31+0000
2024-01-06T06,18zf2rp,20,37514,oddlysatisfying,2x93b,"Pretty smooth fist bump ",0,https://v.redd.it/dfsnforp9oac1,0.94,469,1704482545,2024-01-05T07:22:25+0000
2024-01-06T06,18zf2qt,95,4938,Hololive,29numb,"Nerissa is with Kiara in Austria!",0,https://i.redd.it/ld83u4nm9oac1.png,0.95,128,1704482542,2024-01-05T07:22:22+0000
2024-01-06T06,18zf149,63,6639,CuratedTumblr,3x5kfw,"On curating your internets experience",0,https://www.reddit.com/gallery/18zf149,0.97,115,1704482431,2024-01-05T07:20:31+0000
2024-01-06T06,18zez49,100,4679,MurderedByWords,3hx3r,"Hilarious response from owner after a bad review",0,https://i.redd.it/dzfq5lgz8oac1.jpeg,0.97,71,1704482298,2024-01-05T07:18:18+0000
2024-01-06T06,18ze7vg,92,5363,notliketheothergirls,3opft,"Woman posts cute video of husband helping her get around HOURS after giving birth.",0,https://i.redd.it/21cxhg7a3oac1.jpeg,0.96,309,1704480381,2024-01-05T06:46:21+0000
2024-01-06T06,18zdhcs,34,20404,comics,2qh0s,"Gamer Cafe 1529 - Intrusion",0,https://www.reddit.com/gallery/18zdhcs,0.95,675,1704478535,2024-01-05T06:15:35+0000
2024-01-06T06,18zdgfr,90,6897,notinteresting,2u0xf,"here is my hand (i dont want you reading my palm)",0,https://i.redd.it/hwtvavghxnac1.jpeg,0.92,285,1704478478,2024-01-05T06:14:38+0000
2024-01-06T06,18zcfop,37,24913,JustGuysBeingDudes,33rtj6,"Dad's words",0,https://v.redd.it/q089ily3qnac1,0.93,719,1704475953,2024-01-05T05:32:33+0000
2024-01-06T06,18zcf4c,88,8513,rareinsults,48t85,"Did they just unintentionally called her ugly?",0,https://i.redd.it/kv6x8cyzpnac1.png,0.9,948,1704475914,2024-01-05T05:31:54+0000
2024-01-06T06,18zcad8,64,9513,PublicFreakout,2yrq6,"Man dies after getting into a fight in a Philadelphia train station",0,https://v.redd.it/s3yekegzonac1,0.94,2526,1704475588,2024-01-05T05:26:28+0000
2024-01-06T06,18zc3op,43,17503,GenZ,2tz25,"Who else remembers Net Neutrality and when this guy was the most hated person on the internet for a few weeks",0,https://i.redd.it/ssyp6aqmnnac1.jpeg,0.96,1319,1704475117,2024-01-05T05:18:37+0000
2024-01-06T06,18zbw14,53,42163,Damnthatsinteresting,2xxyj,"The work of a motion capture performer",0,https://v.redd.it/7lwknkiwlnac1,0.82,1540,1704474594,2024-01-05T05:09:54+0000
2024-01-06T06,18zbvtw,65,10467,blunderyears,2vy3g,"“Darwin lied” shirt my dad bought me, knee-length shorts, and modesty cami under an XL tee shirt. Yes, I was homeschooled.",0,https://i.redd.it/3n6bbp41mnac1.jpeg,0.94,620,1704474580,2024-01-05T05:09:40+0000
2024-01-06T06,18zbsot,77,8894,JeffArcuri,740oig,Anxiety,0,https://v.redd.it/o6djt9gclnac1,0.92,313,1704474356,2024-01-05T05:05:56+0000
2024-01-06T06,18zbh1s,48,20940,nottheonion,2qnts,"Retiring House Republican says $174,000 isn't enough money for members of Congress: 'Most of us don't have money'",0,https://biz.crast.net/retiring-house-republican-says-174000-isnt-enough-money-for-members-of-congress-most-of-us-dont-have-money/,0.91,3394,1704473568,2024-01-05T04:52:48+0000
2024-01-06T06,18zb9ge,80,11246,ProgrammerHumor,2tex6,smallProjectsToLearnRust,0,https://i.redd.it/vhoopi8hhnac1.png,0.97,185,1704473048,2024-01-05T04:44:08+0000
2024-01-06T06,18zamu0,98,11130,lotrmemes,2v0i1,"Oldie but a goodie",0,https://i.redd.it/wkp9zkfqcnac1.png,0.91,235,1704471453,2024-01-05T04:17:33+0000
2024-01-06T06,18z9a0j,83,16465,ChatGPT,7hqomg,"Where ever could Waldo be?",0,https://www.reddit.com/gallery/18z9a0j,0.97,604,1704467983,2024-01-05T03:19:43+0000
2024-01-06T06,18z98ns,85,17514,pcmasterrace,2sgp1,"You can’t make this stuff up ",0,https://v.redd.it/aotsytp32nac1,0.92,654,1704467881,2024-01-05T03:18:01+0000
2024-01-06T06,18z7ur1,93,21993,PoliticalHumor,2qm21,"Good Morning. It's good to start off the day with a nice breakfast, shower, brush teeth and nice community notes own.",0,https://i.redd.it/z7b3pdqjqmac1.jpeg,0.94,966,1704464085,2024-01-05T02:14:45+0000
2024-01-06T05,18zq55p,7,3985,pics,2qh0u,"When you hear a huge boom at 25k feet.",0,https://www.reddit.com/gallery/18zq55p,0.99,642,1704511366,2024-01-06T03:22:46+0000
2024-01-06T05,18zphj0,29,2152,todayilearned,2qqjc,"TIL that Queen Anne of Great Britain had seven miscarriages, five stillbirths, two children who died shortly after birth, two who died in infancy, and one who died at age 11. She left no heirs and was succeeded by her second cousin.",0,"https://en.wikipedia.org/wiki/Anne,_Queen_of_Great_Britain",0.98,132,1704509434,2024-01-06T02:50:34+0000
2024-01-06T05,18zp2uk,4,6344,facepalm,2r5rp,"defeat socialism",0,https://i.redd.it/dae1hhe6dqac1.png,0.95,481,1704508247,2024-01-06T02:30:47+0000
2024-01-06T05,18zoy05,19,3270,wholesomememes,3gcwj,"Old dad tried his hardest and my heart melted",0,https://i.redd.it/r4tj665ucqac1.jpeg,0.98,23,1704507868,2024-01-06T02:24:28+0000
2024-01-06T05,18zougq,63,1341,WTF,2qh61,"The results of 30 years of chain-smoking inside a living room.",0,https://i.redd.it/dw8jez77cqac1.jpeg,0.97,142,1704507595,2024-01-06T02:19:55+0000
2024-01-06T05,18zoqni,22,2807,shitposting,2usxq,"Parking lots are very interesting",0,https://v.redd.it/e4xg2j6abqac1,0.97,129,1704507290,2024-01-06T02:14:50+0000
2024-01-06T05,18zontq,61,3628,facepalm,2r5rp,"Gotta love the magic of unintentional, spontaneous photoshoots",0,https://i.redd.it/m7jcf2mlaqac1.jpeg,0.98,178,1704507063,2024-01-06T02:11:03+0000
2024-01-06T05,18zo5t6,85,1288,CrappyDesign,2sa3m,"Hotel key card that doesn't fit in your wallet",0,https://i.redd.it/5mtgshog6qac1.jpeg,0.96,114,1704505665,2024-01-06T01:47:45+0000
2024-01-06T05,18znyt0,43,1993,nflcirclejerk,2sulf,"the liberals have discovered pat mcafee",0,https://i.redd.it/35p7hvwv4qac1.jpeg,0.9,278,1704505134,2024-01-06T01:38:54+0000
2024-01-06T05,18znwz5,41,2101,Presidents,2qwlm,"Why was Obama’s tan suit so controversial?",0,https://i.redd.it/c3xpmq2g4qac1.jpeg,0.89,1072,1704504986,2024-01-06T01:36:26+0000
2024-01-06T05,18znpw2,1,15301,BeAmazed,363r3,"Marissa Tomei through the years ",0,https://v.redd.it/x6hs7jbd2qac1,0.95,1120,1704504449,2024-01-06T01:27:29+0000
2024-01-06T05,18znpuw,18,3799,nba,2qo4s,"[Slater] Steve Kerr: “I played 15 years and all 15 I was frustrated with my playing time.”",0,https://x.com/anthonyvslater/status/1743443483673919580?s=46&t=gEvQlnNLbU9ke0xn1kR1YA,0.96,579,1704504446,2024-01-06T01:27:26+0000
2024-01-06T05,18znnct,51,1864,Eyebleach,2s427,"His first sound sleep after being adopted from a shelter.",0,https://i.redd.it/fr75rgl62qac1.jpeg,0.98,35,1704504258,2024-01-06T01:24:18+0000
2024-01-06T05,18znlfe,48,2001,ExplainTheJoke,2vmj2,"What happened?",0,https://i.redd.it/y0fwv4ts1qac1.jpeg,0.98,75,1704504101,2024-01-06T01:21:41+0000
2024-01-06T05,18znfqh,89,1370,lego,2qhm7,"All set up in the new cubicle!",0,https://i.redd.it/fgqgtafi0qac1.jpeg,0.94,100,1704503663,2024-01-06T01:14:23+0000
2024-01-06T05,18zn127,2,8904,news,2qh3l,"Alaska's snow crab season canceled for second year in a row as population fails to rebound",0,https://www.cbsnews.com/news/alaska-snow-crab-season-canceled-2024/,0.98,605,1704502541,2024-01-06T12:55:41+0000
2024-01-06T05,18zmvj0,37,2567,holdmycatnip,2zhxd,"Orange cat doing orange cat things",0,https://v.redd.it/0o5bsfosvpac1,0.97,55,1704502114,2024-01-06T12:48:34+0000
2024-01-06T05,18zmpfw,67,1765,BaldursGate3,12967t,"What's the big deal about Astarion?",1,https://www.reddit.com/r/BaldursGate3/comments/18zmpfw/whats_the_big_deal_about_astarion/,0.9,360,1704501654,2024-01-06T12:40:54+0000
2024-01-06T05,18zml9q,71,1773,Terraria,2sg5b,"It may not seem it. But i am not a Roblox addict. 🚫🚫",0,https://i.redd.it/75ukswamtpac1.jpeg,0.95,74,1704501345,2024-01-06T12:35:45+0000
2024-01-06T05,18zmkke,28,3328,Satisfyingasfuck,31s00,"Ways to protect a coastline",0,https://v.redd.it/3tod32lbtpac1,0.95,71,1704501294,2024-01-06T12:34:54+0000
2024-01-06T05,18zmkbr,47,2248,LivestreamFail,38jf0,"Asmongold responds to viewer asking about the charity allegations.",0,https://clips.twitch.tv/ArbitraryFrailQueleaTwitchRPG-CAyLDfPvE8W-u6fD,0.91,487,1704501275,2024-01-06T12:34:35+0000
2024-01-06T05,18zmfyz,96,1525,FunnyAnimals,2st2l,"Food now rrrr",0,https://v.redd.it/8wxele0gspac1,0.98,40,1704500971,2024-01-06T12:29:31+0000
2024-01-06T05,18zmd65,57,2059,MinecraftMemes,2sq0h,"Ask me a question about Minecraft, then edit the question to make me look bad.",0,https://i.redd.it/dfjx0xvwrpac1.jpeg,0.95,381,1704500771,2024-01-06T12:26:11+0000
2024-01-06T05,18zmcav,94,1553,lgbt,2qhh7,"Rare French W",0,https://i.redd.it/ikkn15uprpac1.jpeg,0.96,104,1704500706,2024-01-06T12:25:06+0000
2024-01-06T05,18zmad9,3,10980,mildlyinteresting,2ti4h,"I’m in a weight loss clinical study and this is the test food I ate.",0,https://i.redd.it/dadiqlmarpac1.jpeg,0.96,1343,1704500563,2024-01-06T12:22:43+0000
2024-01-06T05,18zm9ut,68,4733,WhitePeopleTwitter,35n7t,"Totally on brand",0,https://i.redd.it/a0fgehn6rpac1.jpeg,0.99,126,1704500526,2024-01-06T12:22:06+0000
2024-01-06T05,18zm7wc,98,1530,lethalcompany,9al6ft,"""I fell in a pit""",0,https://i.redd.it/7rbyur2jqpac1.png,0.97,32,1704500390,2024-01-06T12:19:50+0000
2024-01-06T05,18zm45y,25,3800,clevercomebacks,dyqlw,"Readers added context",0,https://i.redd.it/1sifhf90qpac1.jpeg,0.95,168,1704500130,2024-01-06T12:15:30+0000
2024-01-06T05,18zlwle,34,3138,TheLastAirbender,2rybx,"The netflix show's costumes look more show accurate, while the (non-existent) movie's look more grounded",0,https://i.redd.it/avpo4dy5opac1.png,0.94,220,1704499583,2024-01-06T12:06:23+0000
2024-01-06T05,18zltxy,60,2085,AITAH,446kys,"Update: My brother knows everything now.",1,https://www.reddit.com/r/AITAH/comments/18zltxy/update_my_brother_knows_everything_now/,0.95,489,1704499394,2024-01-06T12:03:14+0000
2024-01-06T05,18zlcuv,6,11376,WhitePeopleTwitter,35n7t,"Donald Trump responds to Iowa school shooting, ends his statement with: get over it.",0,https://i.redd.it/v9dqnofckpac1.jpeg,0.95,1064,1704498226,2024-01-05T11:43:46+0000
2024-01-06T05,18zlajx,13,7633,maybemaybemaybe,38e1l,"Maybe maybe maybe",0,https://v.redd.it/abq8ftxujpac1,0.9,1083,1704498066,2024-01-05T11:41:06+0000
2024-01-06T05,18zl84w,5,15169,tumblr,2r7hk,"How to kill a god",0,https://i.redd.it/2enaz7bejpac1.jpeg,0.95,258,1704497908,2024-01-05T11:38:28+0000
2024-01-06T05,18zl82l,10,8584,cats,2qhta,"The jacket we bought did not fit the dog , it did fit the cat.",0,https://i.redd.it/mjdsrnudjpac1.jpeg,0.98,110,1704497904,2024-01-05T11:38:24+0000
2024-01-06T05,18zl4ac,72,2126,PrequelMemes,3i60n,"Stupid little thing😤",0,https://v.redd.it/w9otzntlipac1,0.97,29,1704497648,2024-01-05T11:34:08+0000
2024-01-06T05,18zl0r6,21,5221,TikTokCringe,mvcq5,"Father & Daughter have great voices ",0,https://v.redd.it/f928chwvhpac1,0.9,406,1704497407,2024-01-05T11:30:07+0000
2024-01-06T05,18zl058,93,1824,leagueoflegends,2rfxx,"Smolder face update",1,https://www.reddit.com/r/leagueoflegends/comments/18zl058/smolder_face_update/,0.97,312,1704497362,2024-01-05T11:29:22+0000
2024-01-06T05,18zktp2,86,2003,whatsthisrock,2w6k5,"Gifted by my grandfather. He found while on a hike. Is it flint?",0,https://i.redd.it/4htbj6vdgpac1.jpeg,0.91,430,1704496894,2024-01-05T11:21:34+0000
2024-01-06T05,18zkoe0,58,2436,LeopardsAteMyFace,3jp3p,"Looks like Neri Oxman, wife of Bill Ackman, plagiarized much more than was previously thought. Business Insider article pending…",0,https://i.redd.it/1l939tr9fpac1.jpeg,0.95,267,1704496519,2024-01-05T11:15:19+0000
2024-01-06T05,18zkjes,90,2382,Superstonk,43zwn1,"Ryan Cohen new tweet",0,https://x.com/ryancohen/status/1743408923506340150?s=46&t=Xcwu2jDH7BoX7aN0dG0zww,0.92,176,1704496168,2024-01-05T11:09:28+0000
2024-01-06T05,18zkhmf,87,2062,terriblefacebookmemes,2tja6,"Totally comparable. Totally.",0,https://i.redd.it/du59vfhrdpac1.jpeg,0.92,194,1704496039,2024-01-05T11:07:19+0000
2024-01-06T05,18zk8wa,9,10610,technology,2qh16,"Tesla Cybertruck gets less than 80% of advertised range in YouTuber’s test",0,https://nypost.com/2024/01/05/business/tesla-cybertruck-achieves-less-than-80-of-teslas-advertised-range/amp/,0.9,1077,1704495430,2024-01-05T10:57:10+0000
2024-01-06T05,18zk3va,12,8882,funny,2qh33,"USA - Don't use your cell phone while driving! Meanwhile in Hong Kong...",0,https://i.redd.it/btytr8gnapac1.jpeg,0.96,337,1704495073,2024-01-05T10:51:13+0000
2024-01-06T05,18zk0io,75,2407,GetNoted,91bxd4,"Stalinist Gets a Reality Check",0,https://i.redd.it/xmrhnimaapac1.jpeg,0.92,164,1704494846,2024-01-05T10:47:26+0000
2024-01-06T05,18zjqct,16,9778,mildlyinfuriating,2ubgg,"This new mat my mom put always makes me fall over now. ",0,https://v.redd.it/ldufnsq68pac1,0.87,1266,1704494137,2024-01-05T10:35:37+0000
2024-01-06T05,18zjp6f,8,11612,politics,2cneq,"Joe Biden just delivered the speech Democrats have been desperate for him to give",0,https://themessenger.com/politics/joe-biden-just-delivered-the-speech-democrats-have-been-desperate-for-him-to-give,0.9,1367,1704494058,2024-01-05T10:34:18+0000
2024-01-06T05,18zjl10,24,5482,iphone,2qh2b,"This is it guys. We went full circle!",0,https://i.redd.it/p07hcrz27pac1.gif,0.95,399,1704493769,2024-01-05T10:29:29+0000
2024-01-06T05,18zj1xh,78,2708,theydidthemath,2x23b,"[Request]Would this actually help reduce the gas used for cooking?",0,https://i.redd.it/l9qg1to9zmac1.jpeg,0.92,193,1704492436,2024-01-05T10:07:16+0000
2024-01-06T05,18ziwfb,82,2649,SpidermanPS4,3f1fs,"The hero we need",0,https://v.redd.it/zuy1yewz1pac1,0.96,81,1704492058,2024-01-05T10:00:58+0000
2024-01-06T05,18ziujs,53,3482,starwarsmemes,2wzm6,"True fans know",0,https://i.redd.it/lu70zyrn1pac1.jpeg,0.95,334,1704491942,2024-01-05T09:59:02+0000
2024-01-06T05,18zirkd,74,2848,thalassophobia,2xfs1,"My stomach hurts watching this",0,https://v.redd.it/ymq9vf801pac1,0.94,172,1704491727,2024-01-05T09:55:27+0000
2024-01-06T05,18zir2k,31,6550,memes,2qjpg,"I'm polite when in a crowded elevator",0,https://i.redd.it/lfr6jdll0pac1.png,0.97,136,1704491692,2024-01-05T09:54:52+0000
2024-01-06T05,18zihk0,27,6396,Wellthatsucks,2xcv7,"Good way to start 2024",0,https://v.redd.it/rlriwuzkyoac1,0.91,561,1704491011,2024-01-05T09:43:31+0000
2024-01-06T05,18zi96s,38,5444,dankmemes,2zmfe,"They were not cool enough to be invited",0,https://i.redd.it/sud1wfkkwoac1.jpeg,0.97,33,1704490422,2024-01-05T09:33:42+0000
2024-01-06T05,18zi6vm,92,2825,ShitPostCrusaders,3f7q5,"And that's how Giorno was made",0,https://i.redd.it/u8d8vvinwoac1.jpeg,0.97,48,1704490258,2024-01-05T09:30:58+0000
2024-01-06T05,18zi4oi,50,4221,me_irlgbt,3apfn,"me🙌irlgbt",0,https://www.reddit.com/gallery/18zi4oi,0.9,45,1704490112,2024-01-05T09:28:32+0000
2024-01-06T05,18zi46y,49,4195,meirl,2s5ti,Meirl,0,https://i.redd.it/ev9f3mp3woac1.jpeg,0.96,200,1704490076,2024-01-05T09:27:56+0000
2024-01-06T05,18zhl0v,40,5358,SipsTea,5tdqj0,"Sips tea ",0,https://v.redd.it/j92wp2n5soac1,0.95,65,1704488747,2024-01-05T09:05:47+0000
2024-01-06T05,18zhd7x,11,17208,BlackPeopleTwitter,33x33,"His dad also escaped slavery and fought for the Union",0,https://www.reddit.com/gallery/18zhd7x,0.96,494,1704488224,2024-01-05T08:57:04+0000
2024-01-06T05,18zh4zp,59,13726,mildlyinteresting,2ti4h,"Ordered some covid tests from amazon, got a free pack of pasta",0,https://i.redd.it/g45e98yuooac1.jpeg,0.94,547,1704487637,2024-01-05T08:47:17+0000
2024-01-06T05,18zh2nk,17,15548,BikiniBottomTwitter,3deqz,"Imagine being this inconsiderate...",0,https://i.redd.it/g0f9dy77ooac1.jpeg,0.95,475,1704487479,2024-01-05T08:44:39+0000
2024-01-06T05,18zgwh1,69,3796,StarWars,2qi4s,"Not the Stepfather, the father who stepped up",0,https://i.redd.it/ntg96b91noac1.jpeg,0.95,152,1704487043,2024-01-05T08:37:23+0000
2024-01-06T05,18zguyi,39,5853,antiwork,2y77d,"""Middle age"" is a lie",0,https://i.redd.it/tetrp0vqmoac1.jpeg,0.95,211,1704486941,2024-01-05T08:35:41+0000
2024-01-06T05,18zgo3g,20,10543,OldSchoolCool,2tycb,"[90s] Beastie Boys perform Sabotage live on stage.",0,https://v.redd.it/fgyjgbr6loac1,0.96,829,1704486480,2024-01-05T08:28:00+0000
2024-01-06T05,18zgh76,23,11724,wizardposting,5hjlp1,"My fellows...",0,https://i.redd.it/y9ft8c21koac1.png,0.92,406,1704486013,2024-01-05T08:20:13+0000
2024-01-06T05,18zggd2,14,16261,aww,2qh1o,"We spent the entire day searching our apartment for our lost kitten. This is the smug face we saw before we went to bed.",0,https://i.redd.it/ebss1q6vjoac1.jpeg,0.96,290,1704485959,2024-01-05T08:19:19+0000
2024-01-06T05,18zgcyw,64,4244,TwoXChromosomes,2r2jt,"Along with illness, you can add breast reduction as a reason men will leave.",1,https://www.reddit.com/r/TwoXChromosomes/comments/18zgcyw/along_with_illness_you_can_add_breast_reduction/,0.84,683,1704485729,2024-01-05T08:15:29+0000
2024-01-06T05,18zg7kc,33,8253,me_irl,2vegg,"me irl",0,https://i.redd.it/6wlpuzs2ioac1.jpeg,0.96,89,1704485359,2024-01-05T08:09:19+0000
2024-01-06T05,18zfs8i,44,6355,NonPoliticalTwitter,39gt6y,"Vacations are just sneak previews of retirement",0,https://i.imgur.com/mpgpjR2.jpeg,0.96,55,1704484334,2024-01-05T07:52:14+0000
2024-01-06T05,18zflnr,52,6433,PeterExplainsTheJoke,121h8r,help?,0,https://i.redd.it/klyvdvhidoac1.png,0.91,184,1704483874,2024-01-05T07:44:34+0000
2024-01-06T05,18zfkrl,32,9032,Justrolledintotheshop,2tteh,"Fed vehicles in for repairs. Government requires emission control devices on OUR vehicles but give themself an exemption to use a “deleted” diesel truck.",0,https://i.redd.it/w1htigchdoac1.jpeg,0.89,926,1704483811,2024-01-05T07:43:31+0000
2024-01-06T05,18zf2rp,15,35442,oddlysatisfying,2x93b,"Pretty smooth fist bump ",0,https://v.redd.it/dfsnforp9oac1,0.94,454,1704482545,2024-01-05T07:22:25+0000
2024-01-06T05,18zf2qt,81,4725,Hololive,29numb,"Nerissa is with Kiara in Austria!",0,https://i.redd.it/ld83u4nm9oac1.png,0.95,123,1704482542,2024-01-05T07:22:22+0000
2024-01-06T05,18zf149,54,6289,CuratedTumblr,3x5kfw,"On curating your internets experience",0,https://www.reddit.com/gallery/18zf149,0.97,107,1704482431,2024-01-05T07:20:31+0000
2024-01-06T05,18zez49,95,4118,MurderedByWords,3hx3r,"Hilarious response from owner after a bad review",0,https://i.redd.it/dzfq5lgz8oac1.jpeg,0.97,66,1704482298,2024-01-05T07:18:18+0000
2024-01-06T05,18zerfb,91,4483,WitchesVsPatriarchy,p3r73,Neeeeeeed,0,https://i.redd.it/j7f00wtd7oac1.jpeg,0.94,99,1704481761,2024-01-05T07:09:21+0000
2024-01-06T05,18ze7vg,83,5026,notliketheothergirls,3opft,"Woman posts cute video of husband helping her get around HOURS after giving birth.",0,https://i.redd.it/21cxhg7a3oac1.jpeg,0.96,283,1704480381,2024-01-05T06:46:21+0000
2024-01-06T05,18ze6fq,88,6121,cursedcomments,hw1ju,"Cursed Sheldon",0,https://i.redd.it/4yr5pfgz2oac1.jpeg,0.97,54,1704480281,2024-01-05T06:44:41+0000
2024-01-06T05,18zdhcs,26,19889,comics,2qh0s,"Gamer Cafe 1529 - Intrusion",0,https://www.reddit.com/gallery/18zdhcs,0.95,660,1704478535,2024-01-05T06:15:35+0000
2024-01-06T05,18zdgfr,79,6517,notinteresting,2u0xf,"here is my hand (i dont want you reading my palm)",0,https://i.redd.it/hwtvavghxnac1.jpeg,0.92,273,1704478478,2024-01-05T06:14:38+0000
2024-01-06T05,18zcfop,30,23919,JustGuysBeingDudes,33rtj6,"Dad's words",0,https://v.redd.it/q089ily3qnac1,0.93,701,1704475953,2024-01-05T05:32:33+0000
2024-01-06T05,18zcf4c,77,7987,rareinsults,48t85,"Did they just unintentionally called her ugly?",0,https://i.redd.it/kv6x8cyzpnac1.png,0.9,902,1704475914,2024-01-05T05:31:54+0000
2024-01-06T05,18zcad8,56,8753,PublicFreakout,2yrq6,"Man dies after getting into a fight in a Philadelphia train station",0,https://v.redd.it/s3yekegzonac1,0.94,2412,1704475588,2024-01-05T05:26:28+0000
2024-01-06T05,18zc3op,35,16370,GenZ,2tz25,"Who else remembers Net Neutrality and when this guy was the most hated person on the internet for a few weeks",0,https://i.redd.it/ssyp6aqmnnac1.jpeg,0.96,1252,1704475117,2024-01-05T05:18:37+0000
2024-01-06T05,18zby5s,45,14721,interestingasfuck,2qhsa,"Mohammed Qahtani, the winner of the Toastmasters World Championship of Public Speaking, brilliant speech!",0,https://v.redd.it/ljop6x7hmnac1,0.93,293,1704474739,2024-01-05T05:12:19+0000
2024-01-06T05,18zby1g,99,6626,AllThatIsInteresting,93l1mw,"Courtroom footage from 2015 shows Jacob Morgan’s reaction after being convicted of setting a fire that killed his 14-month-old stepbrother. He was sentenced to 15 years. He was released in December 2022 after serving half his sentence.",0,https://v.redd.it/jjhqu7hfmnac1,0.89,1223,1704474729,2024-01-05T05:12:09+0000
2024-01-06T05,18zbw14,42,40595,Damnthatsinteresting,2xxyj,"The work of a motion capture performer",0,https://v.redd.it/7lwknkiwlnac1,0.82,1511,1704474594,2024-01-05T05:09:54+0000
2024-01-06T05,18zbvtw,55,10129,blunderyears,2vy3g,"“Darwin lied” shirt my dad bought me, knee-length shorts, and modesty cami under an XL tee shirt. Yes, I was homeschooled.",0,https://i.redd.it/3n6bbp41mnac1.jpeg,0.94,607,1704474580,2024-01-05T05:09:40+0000
2024-01-06T05,18zbsot,62,8702,JeffArcuri,740oig,Anxiety,0,https://v.redd.it/o6djt9gclnac1,0.92,310,1704474356,2024-01-05T05:05:56+0000
2024-01-06T05,18zbpqr,97,6667,WatchPeopleDieInside,3h4zq,"Thief sees camera",0,https://v.redd.it/rblvsnhrknac1,0.96,374,1704474155,2024-01-05T05:02:35+0000
2024-01-06T05,18zbkwb,46,15715,MadeMeSmile,2uqcm,"Husband finds out he's having triplets ",0,https://v.redd.it/log1jixtjnac1,0.96,772,1704473842,2024-01-05T04:57:22+0000
2024-01-06T05,18zbh1s,36,20426,nottheonion,2qnts,"Retiring House Republican says $174,000 isn't enough money for members of Congress: 'Most of us don't have money'",0,https://biz.crast.net/retiring-house-republican-says-174000-isnt-enough-money-for-members-of-congress-most-of-us-dont-have-money/,0.91,3345,1704473568,2024-01-05T04:52:48+0000
2024-01-06T05,18zb9ge,66,10910,ProgrammerHumor,2tex6,smallProjectsToLearnRust,0,https://i.redd.it/vhoopi8hhnac1.png,0.97,179,1704473048,2024-01-05T04:44:08+0000
2024-01-06T05,18zazae,65,9582,worldnews,2qh13,"Kremlin launches campaign to meddle in U.S. election, as GOP ends support for Ukraine",0,https://lansinginstitute.org/2024/01/05/kremlin-launches-campaign-to-meddle-in-u-s-election-as-gop-ends-support-for-ukraine/,0.93,797,1704472327,2024-01-05T04:32:07+0000
2024-01-06T05,18zayc1,84,9898,HolUp,qir9n,"A real life Key and Peele skit lol",0,https://i.redd.it/ntmyc0r4fnac1.jpeg,0.98,449,1704472260,2024-01-05T04:31:00+0000
2024-01-06T05,18zamu0,80,10752,lotrmemes,2v0i1,"Oldie but a goodie",0,https://i.redd.it/wkp9zkfqcnac1.png,0.91,232,1704471453,2024-01-05T04:17:33+0000
2024-01-06T05,18za4zp,100,10802,toptalent,3ptyd,"How different actors trip",0,https://v.redd.it/m21muga39nac1,0.81,228,1704470247,2024-01-05T03:57:27+0000
2024-01-06T05,18z9a0j,73,14725,ChatGPT,7hqomg,"Where ever could Waldo be?",0,https://www.reddit.com/gallery/18z9a0j,0.97,561,1704467983,2024-01-05T03:19:43+0000
2024-01-06T05,18z98ns,70,16974,pcmasterrace,2sgp1,"You can’t make this stuff up ",0,https://v.redd.it/aotsytp32nac1,0.92,648,1704467881,2024-01-05T03:18:01+0000
2024-01-06T05,18z7ur1,76,21550,PoliticalHumor,2qm21,"Good Morning. It's good to start off the day with a nice breakfast, shower, brush teeth and nice community notes own.",0,https://i.redd.it/z7b3pdqjqmac1.jpeg,0.94,952,1704464085,2024-01-05T02:14:45+0000
2024-01-06T04,18zp2uk,23,2322,facepalm,2r5rp,"defeat socialism",0,https://i.redd.it/dae1hhe6dqac1.png,0.95,249,1704508247,2024-01-06T02:30:47+0000
2024-01-06T04,18znyt0,70,1281,nflcirclejerk,2sulf,"the liberals have discovered pat mcafee",0,https://i.redd.it/35p7hvwv4qac1.jpeg,0.92,192,1704505134,2024-01-06T01:38:54+0000
2024-01-06T04,18znwz5,64,1349,Presidents,2qwlm,"Why was Obama’s tan suit so controversial?",0,https://i.redd.it/c3xpmq2g4qac1.jpeg,0.91,816,1704504986,2024-01-06T01:36:26+0000
