date,id,position,score,subreddit_display_name,subreddit_id,title,is_self,url,upvote_ratio,num_comments,created,created_date
2024-01-07T20,190yx17,80,1197,LiverpoolFC,2qn0o,"Congratulations to Sadio Mané, who got married today 💍",0,https://i.redd.it/5f00f7gfb2bc1.jpeg,0.98,81,1704652617,2024-01-07T06:36:57+0000
2024-01-07T20,190ynq8,90,1169,OldSchoolCool,2tycb,"Princess Diana look-alike contest in Washington D.C., 1985",0,https://i.redd.it/9r7cdwqh92bc1.jpeg,0.98,102,1704651982,2024-01-07T06:26:22+0000
2024-01-07T20,190yfzi,31,2450,AbsoluteUnits,a7wuv,"of a chef",0,https://v.redd.it/giiv4nbs72bc1,0.93,183,1704651413,2024-01-07T06:16:53+0000
2024-01-07T20,190xpt9,65,1538,BlackPeopleTwitter,33x33,"The way people switched up on Kevin Hart to fit in the anti Hollywood crowd.",0,https://i.redd.it/sorawj6e22bc1.jpeg,0.93,416,1704649579,2024-01-07T05:46:19+0000
2024-01-07T20,190xlcb,81,1412,clevercomebacks,dyqlw,"The founders would say ""Fuck it's an Ohio?""",0,https://i.redd.it/pd5kxuf712bc1.jpeg,0.95,70,1704649272,2024-01-07T05:41:12+0000
2024-01-07T20,190xjvb,94,2369,cats,2qhta,"Kind stranger fishes Cat out of the water",0,https://v.redd.it/zru4671412bc1,0.99,93,1704649173,2024-01-07T05:39:33+0000
2024-01-07T20,190xcpm,34,2600,BikiniBottomTwitter,3deqz,"Tough choice",0,https://i.redd.it/dc5qkz5sz1bc1.jpeg,0.97,118,1704648700,2024-01-07T05:31:40+0000
2024-01-07T20,190x5ao,66,1667,PoliticalHumor,2qm21,"Nepo Baby Feigns Hardship",0,https://i.redd.it/yirt61n6y1bc1.jpeg,0.98,210,1704648163,2024-01-07T05:22:43+0000
2024-01-07T20,190wyju,93,1389,AccidentalComedy,2xbus,"Good joke google",0,https://i.redd.it/7eg1olkrw1bc1.png,0.98,40,1704647690,2024-01-07T05:14:50+0000
2024-01-07T20,190wsbu,52,2033,bi_irl,3nhfo,bi_irl,0,https://i.redd.it/i51kob5cv1bc1.jpeg,0.95,68,1704647232,2024-01-07T05:07:12+0000
2024-01-07T20,190wr4v,99,1361,science,mouw,"U.S. cities with soda taxes saw sales of sugary drinks fall as prices rose: on average, prices for sugar drinks went up by 33.1% and purchases went down by the same amount –33%, and consumers didn’t make cross-border purchases",0,https://www.npr.org/sections/health-shots/2024/01/06/1223243244/cities-with-soda-taxes-saw-sales-of-sugary-drinks-fall-as-prices-rose-study-find,0.95,101,1704647142,2024-01-07T05:05:42+0000
2024-01-07T20,190wn1z,28,3124,todayilearned,2qqjc,"TIL Canadian infantry brought over 1000 of ""The Airborne Folding Bicycle"" on D-Day, 1944, to travel greater distances than on foot.",0,https://www.junobeach.org/a-new-iconic-artefact-at-the-museum/,0.98,186,1704646856,2024-01-07T05:00:56+0000
2024-01-07T20,190w59v,47,4242,politics,2cneq,"Lauren Boebert’s Ex Called The Cops After Physical Fight in Public on Saturday Night",0,https://www.thedailybeast.com/lauren-boeberts-ex-husband-jayson-called-the-cops-after-physical-fight-in-public?ref=home?ref=home,0.98,456,1704645562,2024-01-07T04:39:22+0000
2024-01-07T20,190w4ga,46,2370,space,2qh87,"I traveled 33 hours to Africa and shot for over 4 hours to capture this image. The final resolution is 24,000 x 12,000!",0,https://i.redd.it/9k2y40rho1bc1.jpeg,0.96,105,1704645500,2024-01-07T04:38:20+0000
2024-01-07T20,190vxp8,48,2438,HonkaiStarRail,4q5zoc,"I got yeeted out of Herta's Space Station after losing in Simulated Universe",0,https://i.redd.it/qll3ojdno1bc1.png,0.97,73,1704645016,2024-01-07T04:30:16+0000
2024-01-07T20,190vx9w,74,1808,inthenews,2rgzp,"NBC and CBS evening news shows failed to cover a report that Trump’s businesses received millions from foreign countries while he was in office",0,https://www.mediamatters.org/abc-world-news-tonight/nbc-and-cbs-evening-news-shows-failed-cover-report-trumps-businesses,0.96,108,1704644986,2024-01-07T04:29:46+0000
2024-01-07T20,190vlaa,45,2648,AnimalsBeingGeniuses,2z6fi,"Blind man safely crosses the road, thanks to his loyal guide dog",0,https://v.redd.it/gs7v819zl1bc1,0.93,87,1704644079,2024-01-07T04:14:39+0000
2024-01-07T20,190vdsg,41,5589,pics,2qh0u,"X-47B of U.S. navy",0,https://i.redd.it/v571bfzdk1bc1.jpeg,0.98,456,1704643523,2024-01-07T04:05:23+0000
2024-01-07T20,190v6ky,97,1725,videogames,2qhzy,"I'd vote for him",0,https://i.redd.it/k877yryki1bc1.png,0.97,184,1704643000,2024-01-07T03:56:40+0000
2024-01-07T20,190v4kg,58,2342,nottheonion,2qnts,"'Try not to let moose lick your car' warns Parks Canada, as more moose flock to highways",0,https://www.cbc.ca/news/canada/british-columbia/dont-let-moose-lick-1.7074587,0.97,148,1704642843,2024-01-07T03:54:03+0000
2024-01-07T20,190v3li,56,2407,ThatsInsane,swxxz,"A 'coyote' or human smuggler drops off his clients and takes proof of delivery.",0,https://v.redd.it/sqoc7hc1i1bc1,0.96,432,1704642761,2024-01-07T03:52:41+0000
2024-01-07T20,190v00t,83,1907,brasil,2qh9i,"Os portugueses ficam putos com isso?",0,https://i.redd.it/racrli7ah1bc1.jpeg,0.95,282,1704642480,2024-01-07T03:48:00+0000
2024-01-07T20,190uztd,64,4228,interestingasfuck,2qhsa,"Zombie fishes come back to life",0,https://v.redd.it/2736xy28h1bc1,0.94,118,1704642462,2024-01-07T03:47:42+0000
2024-01-07T20,190uuve,54,2677,shittymoviedetails,3mj3w,"In Despicable Me 3 (2017), the “villain” is a former child star wants to destroy Hollywood. Remind me how he’s supposed to be the bad guy again?",0,https://i.redd.it/orwv98x3g1bc1.jpeg,0.94,69,1704642084,2024-01-07T03:41:24+0000
2024-01-07T20,190um99,71,2197,abandoned,2qicm,"This old house is for sale for $22.000 in Syracuse, New York",0,https://v.redd.it/g5718kk4e1bc1,0.94,393,1704641422,2024-01-07T03:30:22+0000
2024-01-07T20,190ukpe,42,3202,dataisbeautiful,2tk95,"[OC] US Presidents | Age at start of presidency",0,https://i.redd.it/8vkt135qd1bc1.png,0.94,434,1704641310,2024-01-07T03:28:30+0000
2024-01-07T20,190uju5,98,1850,baldursgatememes,3865zd,"from thatsushichick on twi-…X",0,https://i.redd.it/lrg37c4md1bc1.jpeg,0.96,43,1704641245,2024-01-07T03:27:25+0000
2024-01-07T20,190udc0,9,8742,facepalm,2r5rp,"Okay, so...",0,https://i.redd.it/iks1b9s2c1bc1.png,0.93,735,1704640742,2024-01-07T03:19:02+0000
2024-01-07T20,190u6yw,15,5924,WorkReform,5qpzgw,"Fixed that for you.",0,https://i.redd.it/5ofupwzha1bc1.jpeg,0.96,46,1704640263,2024-01-07T03:11:03+0000
2024-01-07T20,190ty8g,92,2038,LifeProTips,2s5oq,"LPT: hotels can help you get away from someone",1,https://www.reddit.com/r/LifeProTips/comments/190ty8g/lpt_hotels_can_help_you_get_away_from_someone/,0.95,77,1704639610,2024-01-07T03:00:10+0000
2024-01-07T20,190tur2,14,7163,tumblr,2r7hk,"I just want to be nice for niceness sake",0,https://i.redd.it/8fnonidy71bc1.jpeg,0.94,128,1704639342,2024-01-07T02:55:42+0000
2024-01-07T20,190tqbz,19,6149,meme,2qi1r,"Night time humor",0,https://i.redd.it/ocpf02ds61bc1.jpeg,0.97,47,1704638994,2024-01-07T02:49:54+0000
2024-01-07T20,190tpd3,3,24742,MadeMeSmile,2uqcm,"Her reaction ❤",0,https://v.redd.it/qj7m9spe61bc1,0.93,452,1704638914,2024-01-07T02:48:34+0000
2024-01-07T20,190tmi6,1,28341,mildlyinfuriating,2ubgg,"How my Air India business class flight went.",0,https://i.redd.it/oq3rj5sz51bc1.jpeg,0.94,3236,1704638685,2024-01-07T02:44:45+0000
2024-01-07T20,190tij0,17,6633,cats,2qhta,"This is why I don't buy her things",0,https://i.redd.it/m57sfxo051bc1.jpeg,0.98,304,1704638362,2024-01-07T02:39:22+0000
2024-01-07T20,190thsc,70,5275,me_irl,2vegg,"Me irl",0,https://i.redd.it/pul8fvku41bc1.jpeg,0.98,16,1704638298,2024-01-07T02:38:18+0000
2024-01-07T20,190th1p,72,5560,shitposting,2usxq,"Lives were changed ",0,https://v.redd.it/ltb9zpen41bc1,0.96,140,1704638232,2024-01-07T02:37:12+0000
2024-01-07T20,190tglb,89,2313,SipsTea,5tdqj0,"I don't know about that",0,https://v.redd.it/osf7ktli41bc1,0.98,301,1704638195,2024-01-07T02:36:35+0000
2024-01-07T20,190taxu,2,24179,Damnthatsinteresting,2xxyj,"Never walk under these red flags when you visit Oslo, Norway",0,https://v.redd.it/ax0ctyg531bc1,0.96,773,1704637727,2024-01-07T02:28:47+0000
2024-01-07T20,190taob,26,5383,Wellthatsucks,2xcv7,"Grenade in the air",0,https://v.redd.it/6lgij2pw21bc1,0.94,306,1704637705,2024-01-07T02:28:25+0000
2024-01-07T20,190t9lx,49,3783,cursedcomments,hw1ju,"Cursed dictator",0,https://i.redd.it/zyarkjus21bc1.jpeg,0.97,60,1704637621,2024-01-07T02:27:01+0000
2024-01-07T20,190t99p,87,2394,Tinder,2w7mz,"Missed opportunity i guess 😅",0,https://i.redd.it/hkgfwfsq21bc1.jpeg,0.95,237,1704637591,2024-01-07T02:26:31+0000
2024-01-07T20,190t7cy,79,4863,WhitePeopleTwitter,35n7t,"Americans have a message for MAGA and the GOP",0,https://i.imgur.com/c5Pa4H5.png,0.91,349,1704637435,2024-01-07T02:23:55+0000
2024-01-07T20,190t5wq,59,3100,nba,2qo4s,"Draymond Green lost nearly $1.9 million in salary after his 12-game suspension",0,https://www.themirror.com/sport/basketball/draymond-green-warriors-nba-suspensions-273037?utm_source=linkCopy&utm_medium=social&utm_campaign=sharebar,0.94,451,1704637310,2024-01-07T02:21:50+0000
2024-01-07T20,190t4pa,6,13430,politics,2cneq,"Trump Mocked After Claiming Magnets Don’t Work Underwater at Rally - 'All I know about magnets is this, give me a glass of water, let me drop it on the magnets, that’s the end of the magnets,' Trump declared",0,https://themessenger.com/politics/trump-mocked-after-claiming-magnets-dont-work-underwater-at-rally,0.96,1540,1704637211,2024-01-07T02:20:11+0000
2024-01-07T20,190t4j8,4,25492,interestingasfuck,2qhsa,"These dogs were taken to an introverted dog meetup and this is what happened",0,https://v.redd.it/5knshtik11bc1,0.93,752,1704637201,2024-01-07T02:20:01+0000
2024-01-07T20,190t0yh,84,2554,Hololive,29numb,"Ao-kun this whole tournament.",0,https://i.redd.it/vbg0f0ol01bc1.png,0.98,53,1704636885,2024-01-07T02:14:45+0000
2024-01-07T20,190t0ve,7,12372,WhitePeopleTwitter,35n7t,"Profiles in coup rage",0,https://i.redd.it/ssjejcmm01bc1.jpeg,0.95,366,1704636878,2024-01-07T02:14:38+0000
2024-01-07T20,190su5r,5,41554,memes,2qjpg,"She really thought she did something",0,https://v.redd.it/o71ckltvy0bc1,0.91,1474,1704636296,2024-01-07T02:04:56+0000
2024-01-07T20,190srlk,25,6569,CuratedTumblr,3x5kfw,"Philosophical Zombies",0,https://i.redd.it/knde22u7y0bc1.jpeg,0.96,82,1704636084,2024-01-07T02:01:24+0000
2024-01-07T20,190sphg,29,6804,PeterExplainsTheJoke,121h8r,Peter!!!!!!,0,https://i.redd.it/akg7xf1qx0bc1.png,0.91,484,1704635911,2024-01-07T01:58:31+0000
2024-01-07T20,190sn13,69,3022,WinStupidPrizes,3k2t0,"Not looking forward while speeding on  the highway",0,https://v.redd.it/v92flbw0x0bc1,0.95,102,1704635690,2024-01-07T01:54:50+0000
2024-01-07T20,190slvm,86,2711,197,3enhu,"grand prize ",0,https://v.redd.it/p4r25ywrw0bc1,0.91,51,1704635584,2024-01-07T01:53:04+0000
2024-01-07T20,190slad,76,2984,ProgrammerHumor,2tex6,ThisSubDuringHolidays,0,https://i.redd.it/ps9s073mw0bc1.png,0.97,59,1704635528,2024-01-07T01:52:08+0000
2024-01-07T20,190sjqv,10,10553,GlowUps,ruinb,"March vs December",0,https://v.redd.it/x7ve1cc7w0bc1,0.93,527,1704635394,2024-01-07T01:49:54+0000
2024-01-07T20,190sip5,55,3557,AntiTrumpAlliance,3i9if,"We know how legitimately stupid he is. But about half of Americans are just as stupid.",0,https://i.redd.it/a8vw2fdxv0bc1.jpeg,0.95,319,1704635296,2024-01-07T01:48:16+0000
2024-01-07T20,190sii4,57,3777,perfectlycutscreams,3n7fs,"wake up!",0,https://v.redd.it/fypvuhxrv0bc1,0.94,230,1704635279,2024-01-07T01:47:59+0000
2024-01-07T20,190si8w,73,3101,Funnymemes,2xqtc,"💀",0,https://i.redd.it/dghxo1bsv0bc1.jpeg,0.93,94,1704635253,2024-01-07T01:47:33+0000
2024-01-07T20,190sgaa,91,2723,discordVideos,2cxozx,"Last day of school be like ",0,https://v.redd.it/pu4ttgs8v0bc1,0.97,41,1704635070,2024-01-07T01:44:30+0000
2024-01-07T20,190sdvi,33,5969,therewasanattempt,39ne7,"To just have... dinner",0,https://v.redd.it/r2i1e8miu0bc1,0.96,154,1704634848,2024-01-07T01:40:48+0000
2024-01-07T20,190sc1f,24,8523,dankmemes,2zmfe,"Dark times are upon us.",0,https://i.redd.it/3eud94v3u0bc1.jpeg,0.95,269,1704634685,2024-01-07T01:38:05+0000
2024-01-07T20,190s9za,30,6379,HolUp,qir9n,"Sports presenter realize on air that her sister who is a court side reporter is wearing her watch",0,https://v.redd.it/2e637stjt0bc1,0.96,107,1704634501,2024-01-07T01:35:01+0000
2024-01-07T20,190s8vb,16,8790,oddlysatisfying,2x93b,"The trash receptacles of the Netherlands",0,https://v.redd.it/017hqaf8t0bc1,0.95,481,1704634392,2024-01-07T01:33:12+0000
2024-01-07T20,190s515,78,3200,MapPorn,2si92,"Belief in life after death",0,https://i.redd.it/nmf6umc7s0bc1.jpeg,0.91,663,1704634051,2024-01-07T01:27:31+0000
2024-01-07T20,190s4k6,8,19510,pics,2qh0u,"South Korean Soldiers Hold Hands So They Don't Get Pulled Into North Korea",0,https://i.redd.it/yjb6nl8ir0bc1.jpeg,0.93,1062,1704634004,2024-01-07T01:26:44+0000
2024-01-07T20,190s1m9,36,5662,funny,2qh33,"Sadness spending",0,https://i.redd.it/uhqce4qar0bc1.jpeg,0.96,50,1704633740,2024-01-07T01:22:20+0000
2024-01-07T20,190s0c1,12,11927,me_irl,2vegg,me_irl,0,https://i.redd.it/3le3xv6xq0bc1.jpeg,0.95,229,1704633626,2024-01-07T01:20:26+0000
2024-01-07T20,190rzf9,39,5579,Satisfyingasfuck,31s00,"That's real abstract art",0,https://v.redd.it/px0w3u1pq0bc1,0.93,152,1704633548,2024-01-07T01:19:08+0000
2024-01-07T20,190ru8q,13,11569,wholesomememes,3gcwj,Alright....,0,https://i.redd.it/ugtid6c8p0bc1.png,0.97,208,1704633051,2024-01-07T01:10:51+0000
2024-01-07T20,190rn6t,27,8331,comics,2qh0s,"Creepy DMs (OC)",0,https://www.reddit.com/gallery/190rn6t,0.91,286,1704632424,2024-01-07T01:00:24+0000
2024-01-07T20,190rg4o,63,3873,PrematureTruncation,3l7inz,"Nasty way to go",0,https://i.redd.it/bfm8ilvfl0bc1.jpeg,0.97,65,1704631770,2024-01-07T12:49:30+0000
2024-01-07T20,190rfiy,77,3650,funnysigns,2u04j,"Beware of Zeb",0,https://i.redd.it/syrx6na8l0bc1.png,0.98,56,1704631709,2024-01-07T12:48:29+0000
2024-01-07T20,190rfd1,44,13662,Damnthatsinteresting,2xxyj,"Behind the scenes - TITANIC(1997)",0,https://v.redd.it/xmk5gdy1l0bc1,0.97,404,1704631695,2024-01-07T12:48:15+0000
2024-01-07T20,190rf9z,40,6189,holdmycatnip,2zhxd,"""i want to be beauteful too! 🥺""",0,https://v.redd.it/er8k3tztk0bc1,0.97,58,1704631686,2024-01-07T12:48:06+0000
2024-01-07T20,190rbis,85,3515,notinteresting,2u0xf,"This redditor wants to trade",0,https://i.redd.it/36x27am3k0bc1.jpeg,0.95,326,1704631321,2024-01-07T12:42:01+0000
2024-01-07T20,190r5og,11,16362,mildlyinteresting,2ti4h,"My dad has officially been warned for returning to many things to Walmart",0,https://i.redd.it/meybt2t9i0bc1.jpeg,0.92,2531,1704630704,2024-01-07T12:31:44+0000
2024-01-07T20,190r09m,38,6579,technology,2qh16,"Microsoft poised to overtake Apple as most valuable company",0,https://appleinsider.com/articles/24/01/05/microsoft-poised-to-overtake-apple-as-most-valuable-company,0.95,853,1704630150,2024-01-07T12:22:30+0000
2024-01-07T20,190qyvi,20,16160,shitposting,2usxq,"Anon's maternal affair",0,https://i.redd.it/5yn9wzp6g0bc1.png,0.95,258,1704630005,2024-01-07T12:20:05+0000
2024-01-07T20,190qypl,50,5128,nostalgia,2qnub,"The original cast of Mighty Morphin Power Rangers",0,https://i.redd.it/hd199935g0bc1.jpeg,0.96,493,1704629988,2024-01-07T12:19:48+0000
2024-01-07T20,190qy0c,62,10609,BeAmazed,363r3,"This is the story of Yasushi Takahashi. He is the man who traveled across Japan with a GPS tracker to Create a 7,163-km drawing to propose to his girlfriend. It's been since certified as World's largest GPS drawing.",0,https://i.redd.it/4sk9v2itf0bc1.jpeg,0.96,248,1704629908,2024-01-07T12:18:28+0000
2024-01-07T20,190qss6,37,7394,europe,2qh4j,"Excerpt from Yeltsin’s conversation with Clinton in Istanbul 1999",0,https://i.redd.it/8v0f3k17e0bc1.jpeg,0.95,926,1704629334,2024-01-07T12:08:54+0000
2024-01-07T20,190qshh,75,4135,goldenretrievers,2st00,"My golden sits and looks out the window like she pays the rent",0,https://www.reddit.com/gallery/190qshh,0.97,124,1704629301,2024-01-07T12:08:21+0000
2024-01-07T20,190qows,21,12407,nextfuckinglevel,m0bnr,"Man helps goose with metal stuck in its mouth",0,https://v.redd.it/1sqfrgqwc0bc1,0.97,287,1704628907,2024-01-07T12:01:47+0000
2024-01-07T20,190qov2,67,4689,Animemes,2w6fe,"My favorite trope",0,https://i.redd.it/l4j9yjzwc0bc1.jpeg,0.97,129,1704628903,2024-01-07T12:01:43+0000
2024-01-07T20,190qkr5,61,5432,pcmasterrace,2sgp1,"Priorities ",0,https://v.redd.it/x2csxr9nb0bc1,0.96,174,1704628485,2024-01-07T11:54:45+0000
2024-01-07T20,190qk72,51,21466,MadeMeSmile,2uqcm,Nintendogs,0,https://i.redd.it/hq3m3nhfb0bc1.jpeg,0.92,281,1704628419,2024-01-07T11:53:39+0000
2024-01-07T20,190qjcl,23,11986,gaming,2qh03,"You need a goddamn account for everything today!",0,https://i.redd.it/3a3t181za0bc1.jpeg,0.91,684,1704628323,2024-01-07T11:52:03+0000
2024-01-07T20,190qi1a,60,5807,rareinsults,48t85,"Don't wanna go to this kinda heaven",0,https://i.redd.it/yxr8jndra0bc1.png,0.89,298,1704628182,2024-01-07T11:49:42+0000
2024-01-07T20,190qgs0,18,18817,BeAmazed,363r3,"Japanese buildings utilize seismic isolation bearings.",0,https://v.redd.it/z4nt7zm5a0bc1,0.92,439,1704628033,2024-01-07T11:47:13+0000
2024-01-07T20,190qepe,53,18135,facepalm,2r5rp,"Scared to help kids?",0,https://i.redd.it/dssf34ul90bc1.png,0.92,2201,1704627798,2024-01-07T11:43:18+0000
2024-01-07T20,190qcsv,22,13563,PublicFreakout,2yrq6,"Man throws smoke bomb at girl as a prank, girl throws pot of boiling water in his face. Russia, January 2024",0,https://v.redd.it/05inwxqq80bc1,0.95,1921,1704627589,2024-01-07T11:39:49+0000
2024-01-07T20,190qca1,100,3764,wow,2qio8,"I've created a simple addon that allows you to remember other players and notify you when you meet again (had to censor names)",0,https://i.redd.it/ja9kw4sq80bc1.gif,0.96,292,1704627524,2024-01-07T11:38:44+0000
2024-01-07T20,190q7bq,32,14610,meirl,2s5ti,Meirl,0,https://v.redd.it/smjzkmp470bc1,0.89,299,1704626960,2024-01-07T11:29:20+0000
2024-01-07T20,190q3hw,96,6036,TikTokCringe,mvcq5,"Woke barber vs Ethnics",0,https://v.redd.it/hz45sb8t50bc1,0.67,3602,1704626518,2024-01-07T11:21:58+0000
2024-01-07T20,190ppu4,35,14922,Unexpected,2w67q,"Do you have a girlfriend?",0,https://v.redd.it/dewbqnh910bc1,0.9,417,1704624986,2024-01-07T10:56:26+0000
2024-01-07T20,190pb61,43,11669,KidsAreFuckingStupid,3948y,"Advanced humor ",0,https://v.redd.it/4g3yy4a2wzac1,0.94,174,1704623237,2024-01-07T10:27:17+0000
2024-01-07T20,190p8rn,82,14019,wholesomememes,3gcwj,"What a wonderful actor",0,https://i.redd.it/8ptnqon7vzac1.png,0.97,104,1704622959,2024-01-07T10:22:39+0000
2024-01-07T20,190ov5y,95,6015,animememes,2tcn0,"Anime movies*",0,https://i.redd.it/xbguawtfqzac1.jpeg,0.95,59,1704621347,2024-01-07T09:55:47+0000
2024-01-07T20,190opxs,88,6405,DOG,2qiy5,"This dog's sense of balance is so good!",0,https://v.redd.it/j4hfti8jozac1,0.97,56,1704620715,2024-01-07T09:45:15+0000
2024-01-07T20,190o95b,68,9325,mathmemes,3fz4c,"Tough life",0,https://v.redd.it/x2tdf5w2izac1,0.95,137,1704618746,2024-01-07T09:12:26+0000
