date,id,position,score,subreddit_display_name,subreddit_id,title,is_self,url,upvote_ratio,num_comments,created,created_date
2024-01-05T08,18yz4xp,57,1362,comics,2qh0s,"I regret nothing about how stupid this is. I REGRET NOTHING!! (oc)",0,https://www.reddit.com/gallery/18yz4xp,0.99,15,1704432714,2024-01-05T05:31:54+0000
2024-01-05T08,18yz449,1,10283,nba,2qo4s,"[Highlight] Jokic wins it at the buzzer!",0,https://streamable.com/us1ioa,0.97,1395,1704432642,2024-01-05T05:30:42+0000
2024-01-05T08,18yy9k9,44,1950,BeAmazed,363r3,"Veterinarian deftly removes a toy stuck in a German Shepherd's oesophagus",0,https://i.imgur.com/mdCsINH.gifv,0.98,20,1704429911,2024-01-05T04:45:11+0000
2024-01-05T08,18yy8lv,27,2519,Damnthatsinteresting,2xxyj,"This is how a chameleon gives birth",0,https://i.imgur.com/iKLUmfn.gifv,0.97,101,1704429828,2024-01-05T04:43:48+0000
2024-01-05T08,18yy5cw,41,2021,Eyebleach,2s427,"I have chosen you, human. Come in.",0,https://i.imgur.com/8kRBeCO.gifv,0.98,30,1704429550,2024-01-05T04:39:10+0000
2024-01-05T08,18yy507,90,1233,FunnyAnimals,2st2l,"I have chosen you, human. Come in.",0,https://i.imgur.com/8kRBeCO.gifv,0.98,29,1704429517,2024-01-05T04:38:37+0000
2024-01-05T08,18yxu89,39,2184,therewasanattempt,39ne7,"to BBQ p*dophiles",0,https://i.redd.it/0n5a8bd7tjac1.jpeg,0.97,216,1704428565,2024-01-05T04:22:45+0000
2024-01-05T08,18yxpd7,31,2588,memes,2qjpg,"Which one are you?",0,https://i.redd.it/7dr0ep6xrjac1.png,0.97,288,1704428153,2024-01-05T04:15:53+0000
2024-01-05T08,18yxofb,32,2501,NonPoliticalTwitter,39gt6y,"Costco samples in a classier setting",0,https://i.redd.it/apjpqcgqrjac1.jpeg,0.96,53,1704428071,2024-01-05T04:14:31+0000
2024-01-05T08,18yxnhx,25,2895,HolUp,qir9n,"I didn’t get confused to be honest with you guys lmao",0,https://v.redd.it/u9e4sxqhrjac1,0.96,34,1704427989,2024-01-05T04:13:09+0000
2024-01-05T08,18yxkza,51,1811,australia,2qh8e,"Just saw this",0,https://i.redd.it/aequar2wqjac1.jpeg,0.95,297,1704427786,2024-01-05T04:09:46+0000
2024-01-05T08,18yxizb,2,11871,maybemaybemaybe,38e1l,"Maybe Maybe Maybe",0,https://v.redd.it/prh47isbqjac1,0.94,429,1704427613,2024-01-05T04:06:53+0000
2024-01-05T08,18yx7sq,48,2036,movies,2qh3s,"30 Years On, Tombstone Looks Like The Only Normal Western Of The ‘90’s",0,https://www.pastemagazine.com/movies/kurt-russell/tombstone-western-90s-old-fashioned,0.92,383,1704426655,2024-01-05T03:50:55+0000
2024-01-05T08,18yx3ub,8,5990,SipsTea,5tdqj0,"Airplane mode ",0,https://v.redd.it/xsq6wg7imjac1,0.92,290,1704426315,2024-01-05T03:45:15+0000
2024-01-05T08,18yx02d,79,1637,wholesomememes,3gcwj,"Life's tough enough without the drama we have to deal with",0,https://i.redd.it/rnklc47jljac1.jpeg,0.99,14,1704425993,2024-01-05T03:39:53+0000
2024-01-05T08,18ywz2l,28,2975,BlackPeopleTwitter,33x33,"Out of the mouths of babes",0,https://www.reddit.com/gallery/18ywz2l,0.96,109,1704425908,2024-01-05T03:38:28+0000
2024-01-05T08,18ywxhb,7,7284,facepalm,2r5rp,"This will instantly lead to the bloodiest civil war in history",0,https://i.redd.it/0uu7kmnzjjac1.jpeg,0.9,1603,1704425770,2024-01-05T03:36:10+0000
2024-01-05T08,18ywv92,14,5130,Unexpected,2w67q,"I remember when I was so innocent ♥️",0,https://v.redd.it/kpzgxigckjac1,0.92,95,1704425585,2024-01-05T03:33:05+0000
2024-01-05T08,18ywv2i,74,1665,DIY,2qh7d,"Vent right next to/under toilet. How would you deal with this? There is a smell 😵‍💫",0,https://www.reddit.com/gallery/18ywv2i,0.94,839,1704425570,2024-01-05T03:32:50+0000
2024-01-05T08,18ywrsf,29,3058,pics,2qh0u,"I saw this when I parked and opened my car door after work. It is not my husband's.",0,https://i.redd.it/i2zr399ijjac1.jpeg,0.94,412,1704425304,2024-01-05T03:28:24+0000
2024-01-05T08,18ywmb9,18,4479,Satisfyingasfuck,31s00,"They edit really well",0,https://v.redd.it/7aq9xpw2ijac1,0.95,81,1704424844,2024-01-05T03:20:44+0000
2024-01-05T08,18ywk3v,10,6346,holdmycatnip,2zhxd,"this is my throne now",0,https://v.redd.it/qhw4igjlhjac1,0.97,116,1704424671,2024-01-05T03:17:51+0000
2024-01-05T08,18ywjup,36,2775,clevercomebacks,dyqlw,"Naruto irony",0,https://i.redd.it/81qxttdkhjac1.jpeg,0.97,46,1704424650,2024-01-05T03:17:30+0000
2024-01-05T08,18ywhwu,17,5157,shitposting,2usxq,Breasts,0,https://v.redd.it/9z7unek9gjac1,0.92,253,1704424493,2024-01-05T03:14:53+0000
2024-01-05T08,18ywf7n,100,1444,Hololive,29numb,"""She can ruin me""",0,https://i.redd.it/jlx7i1b5gjac1.png,0.97,46,1704424267,2024-01-05T03:11:07+0000
2024-01-05T08,18ywa9x,88,1647,malelivingspace,2v70p,"First High Rise Apartment (650sqft)",0,https://www.reddit.com/gallery/18ywa9x,0.96,559,1704423875,2024-01-05T03:04:35+0000
2024-01-05T08,18yw72w,5,7353,mildlyinteresting,2ti4h,"This remote can take a single 12 volt battery or two AAA batteries",0,https://i.redd.it/w4s2lhugejac1.jpeg,0.97,172,1704423639,2024-01-05T03:00:39+0000
2024-01-05T08,18yvyd0,68,5794,nba,2qo4s,"[Highlight] Wemby blocks the Giannis dunk to save the game!",0,https://streamable.com/ikr7ra,0.96,492,1704422965,2024-01-05T02:49:25+0000
2024-01-05T08,18yvs38,96,4522,todayilearned,2qqjc,"TIL General Electric dumped toxic ""forever"" chemicals into the Hudson River and its CEO, Jack Welch, disputed the EPA's findings that these chemicals are toxic.",0,https://www.timesunion.com/business/article/Jack-Welch-GE-chairman-who-left-complicated-15098587.php,0.98,173,1704422459,2024-01-05T02:40:59+0000
2024-01-05T08,18yvlqi,56,2354,AITAH,446kys,"AITA for giving my children permission to defend themselves and ruining my brother's visit?",1,https://www.reddit.com/r/AITAH/comments/18yvlqi/aita_for_giving_my_children_permission_to_defend/,0.95,402,1704421961,2024-01-05T02:32:41+0000
2024-01-05T08,18yv9p3,72,2241,meme,2qi1r,Bruh...,0,https://i.redd.it/qh1utq0q6jac1.png,0.96,80,1704421004,2024-01-05T02:16:44+0000
2024-01-05T08,18yv9o4,3,28450,mildlyinfuriating,2ubgg,"Server tipped herself",0,https://i.redd.it/w3wixjqp6jac1.jpeg,0.92,3468,1704421001,2024-01-05T02:16:41+0000
2024-01-05T08,18yv5nv,16,5967,MadeMeSmile,2uqcm,"Brotherly love",0,https://v.redd.it/eyqbu37r2jac1,0.97,117,1704420678,2024-01-05T02:11:18+0000
2024-01-05T08,18yuuff,73,2321,wallstreetbets,2th52,"2023 congressional members returns vs. S&P 500",0,https://i.redd.it/ffs7zj363jac1.jpeg,0.95,394,1704419808,2024-01-05T01:56:48+0000
2024-01-05T08,18yunq6,78,2298,AskReddit,2qh1i,"Europeans of Reddit, what do Americans have everyday that you see as a luxury?",1,https://www.reddit.com/r/AskReddit/comments/18yunq6/europeans_of_reddit_what_do_americans_have/,0.88,3587,1704419260,2024-01-05T01:47:40+0000
2024-01-05T08,18yunjj,98,1909,anime,2qh22,"Marin Kitagawa explains Eroge, Humiliation & 'Chained Soldiers' [My Dress-Up Darling]",0,https://v.redd.it/ap3etu6k0jac1,0.94,49,1704419245,2024-01-05T01:47:25+0000
2024-01-05T08,18yulmi,37,3510,nflcirclejerk,2sulf,"Another member for the Classy, Sneaky Athletic Team",0,https://i.redd.it/ny3jvn621jac1.jpeg,0.95,278,1704419099,2024-01-05T01:44:59+0000
2024-01-05T08,18yul37,66,9545,interestingasfuck,2qhsa,"12 year old preserved child sacrifice victim",0,https://v.redd.it/404qlqa50jac1,0.95,365,1704419060,2024-01-05T01:44:20+0000
2024-01-05T08,18yufbf,20,5672,sports,2qgzy,"Shaq is told on air that the Orlando Magic are retiring his jersey number.",0,https://v.redd.it/c74ow5hmziac1,0.95,231,1704418626,2024-01-05T01:37:06+0000
2024-01-05T08,18yuez1,52,2932,CuratedTumblr,3x5kfw,"The Dunning-Krueger of Dragon Nerds",0,https://i.redd.it/5ed7fyikziac1.png,0.96,88,1704418598,2024-01-05T01:36:38+0000
2024-01-05T08,18yudwr,9,11279,tumblr,2r7hk,"The Dunning-Krueger of Dragon Nerds",0,https://i.redd.it/0fhqq3lbziac1.png,0.96,217,1704418515,2024-01-05T01:35:15+0000
2024-01-05T08,18yuatd,4,14175,AbsoluteUnits,a7wuv,"of this Crocodile, a real river monster",0,https://v.redd.it/muk7hl7rxiac1,0.93,914,1704418285,2024-01-05T01:31:25+0000
2024-01-05T08,18yu87z,26,6760,PeterExplainsTheJoke,121h8r,Peetah,0,https://i.redd.it/8gv2slg2yiac1.jpeg,0.73,473,1704418093,2024-01-05T01:28:13+0000
2024-01-05T08,18yu7mi,6,10412,PoliticalHumor,2qm21,"GOP, just be yourself",0,https://i.redd.it/ygvzkj9xxiac1.png,0.93,355,1704418045,2024-01-05T01:27:25+0000
2024-01-05T08,18yu7f2,53,3047,oddlyterrifying,2yo6b,"Bull Orca dying of natural causes and sinking to bottom of ocean",0,https://v.redd.it/3ppn59ouxiac1,0.95,193,1704418030,2024-01-05T01:27:10+0000
2024-01-05T08,18yu56i,92,2114,nbacirclejerk,2td2i,"We can finally go back to normal",0,https://i.redd.it/mj1nw3ldxiac1.jpeg,0.95,75,1704417860,2024-01-05T01:24:20+0000
2024-01-05T08,18ytxk9,55,3109,ImTheMainCharacter,4c4j2u,"It’s almost like people don’t want to be recorded while minding their own business.",0,https://v.redd.it/kbw62belviac1,0.88,381,1704417280,2024-01-05T01:14:40+0000
2024-01-05T08,18ytqpe,70,2891,MinecraftMemes,2sq0h,"Back when mob votes were fun",0,https://i.redd.it/k2d63r14uiac1.jpeg,0.96,61,1704416762,2024-01-05T01:06:02+0000
2024-01-05T08,18ytnid,61,3016,TIHI,r1l2z,"Thanks, I hate Disney Princess faceswaps with Villains",0,https://i.redd.it/twqg2pddtiac1.jpeg,0.97,129,1704416525,2024-01-05T01:02:05+0000
2024-01-05T08,18yt6q1,87,2595,UpliftingNews,2u3ta,"Conservation group buys out hunting rights in B.C. rainforest to protect wildlife",0,https://www.thestar.com/news/conservation-group-buys-out-hunting-rights-in-b-c-rainforest-to-protect-wildlife/article_737a503a-bf9d-57bd-8b76-778b6159b426.html,0.95,77,1704415300,2024-01-05T12:41:40+0000
2024-01-05T08,18yt3er,94,2478,TrueOffMyChest,2yuqy,"My best friend died and sent me a gift",1,https://www.reddit.com/r/TrueOffMyChest/comments/18yt3er/my_best_friend_died_and_sent_me_a_gift/,0.97,56,1704415059,2024-01-05T12:37:39+0000
2024-01-05T08,18yt2gk,80,2919,funnyvideos,2qoos,"This had me rolling 🤣 😂 ",0,https://v.redd.it/oae4lrytoiac1,0.95,41,1704414989,2024-01-05T12:36:29+0000
2024-01-05T08,18ysyb5,58,3370,Costco,2rsgr,"Whoever you are…your membership should be cancelled.",0,https://i.redd.it/1ibniioxniac1.jpeg,0.92,292,1704414689,2024-01-05T12:31:29+0000
2024-01-05T08,18ysxwe,65,3284,PS5,2s887,"PS5 has been out for a couple of years now. How many of you are age 30+ and still game regularly.",1,https://www.reddit.com/r/PS5/comments/18ysxwe/ps5_has_been_out_for_a_couple_of_years_now_how/,0.82,2242,1704414659,2024-01-05T12:30:59+0000
2024-01-05T08,18yskib,30,5636,antiwork,2y77d,"The CEO actually admitted fault. Are we in the twilight zone?",0,https://i.redd.it/mkhhjli0liac1.jpeg,0.95,346,1704413703,2024-01-05T12:15:03+0000
2024-01-05T08,18ysh1t,12,13276,nottheonion,2qnts,"Florida venue cancels Marjorie Taylor Greene event after learning of its Jan. 6 focus",0,https://www.nbcnews.com/politics/politics-news/florida-venue-cancels-marjorie-taylor-greene-jan-6-event-rcna132365,0.94,462,1704413450,2024-01-05T12:10:50+0000
2024-01-05T08,18ysczr,82,3118,LivestreamFail,38jf0,"Emily gets mistaken for a crackhead",0,https://clips.twitch.tv/StupidExquisiteEggDancingBaby-2JVQv7x5rZ2uxwzg,0.92,265,1704413160,2024-01-05T12:06:00+0000
2024-01-05T08,18yscfi,24,7405,me_irl,2vegg,me_irl,0,https://i.redd.it/kdpe7h0ajiac1.jpeg,0.96,104,1704413119,2024-01-05T12:05:19+0000
2024-01-05T08,18ys5fz,62,3652,houseplants,2skiq,"Plant shelf before and after 10 months of growth.",0,https://www.reddit.com/gallery/18ys5fz,0.97,132,1704412658,2024-01-04T11:57:38+0000
2024-01-05T08,18ys1yu,22,10296,whenthe,23gidu,"The Iron Nonce",0,https://v.redd.it/5egq77v4hiac1,0.92,203,1704412412,2024-01-04T11:53:32+0000
2024-01-05T08,18ys1bz,15,11996,todayilearned,2qqjc,"TIL: The USA doesnt use A4 or other A series paper sizes, but instead their own standard, ""Letter"", ""Legal"" and ""Tabloid""",0,"https://www.swiftpublisher.com/useful-articles/paper-sizes-and-formats-explained#:~:text=The%20most%20commonly%20used%20ISO,8.5%20in%20%C3%97%2014%20in).",0.9,1869,1704412367,2024-01-04T11:52:47+0000
2024-01-05T08,18yrbr2,11,21366,funny,2qh33,"""It's mine meow""",0,https://v.redd.it/jmvm0cuobiac1,0.96,276,1704410568,2024-01-04T11:22:48+0000
2024-01-05T08,18yr825,13,24362,interestingasfuck,2qhsa,"The Final Moments of a Bull Killer Whale.",0,https://v.redd.it/0r2r0zuqaiac1,0.93,1938,1704410310,2024-01-04T11:18:30+0000
2024-01-05T08,18yqzhp,84,3652,WhatsWrongWithYourDog,39ht3,"Google lens thinks my dog looks like taxidermy",0,https://www.reddit.com/gallery/18yqzhp,0.96,121,1704409704,2024-01-04T11:08:24+0000
2024-01-05T08,18yqrir,81,4369,BatmanArkham,2y9q4,"İF THİS POST GETS 2048 UPVOTES İ WİLL POST 2048 MAN",0,https://i.redd.it/89q2lihi7iac1.jpeg,0.83,117,1704409167,2024-01-04T10:59:27+0000
2024-01-05T08,18yqkok,33,7081,politics,2cneq,"Illinois voters ask elections board to take Trump off 2024 ballot",0,https://www.cnn.com/2024/01/04/politics/illinois-voters-ask-elections-board-to-take-trump-off-2024-ballot/index.html,0.97,424,1704408700,2024-01-04T10:51:40+0000
2024-01-05T08,18yq74j,64,4877,Tinder,2w7mz,"My attempt at flirting failed miserably. Also, he totally ruined the mood.",0,https://www.reddit.com/gallery/18yq74j,0.9,451,1704407784,2024-01-04T10:36:24+0000
2024-01-05T08,18ypz37,42,7007,Construction,2qiuc,"Anybody else following that tunnel lady on tiktok?",0,https://v.redd.it/6e8cad272iac1,0.92,1456,1704407383,2024-01-04T10:29:43+0000
2024-01-05T08,18ypwgr,76,4500,notmycat,38c5p,"I’m a mailman. There are some strays at a trailer park I deliver to that I feed every day. Here are a few of them",0,https://www.reddit.com/gallery/18ypwgr,0.97,180,1704407201,2024-01-04T10:26:41+0000
2024-01-05T08,18ypu98,46,7387,PrequelMemes,3i60n,"Roses Are Red🌹",0,https://i.redd.it/4anbpqv61iac1.jpeg,0.94,301,1704407055,2024-01-04T10:24:15+0000
2024-01-05T08,18ypscs,97,3783,HermitCraft,2twma,"I’d like to make a Jellie appreciation thread. Rest in peace Jellie",0,https://i.redd.it/u8rjs13v0iac1.jpeg,0.94,329,1704406926,2024-01-04T10:22:06+0000
2024-01-05T08,18ypnpu,21,15730,AnimalsBeingBros,2wmvy,"That’s his kitten now",0,https://v.redd.it/dhq3nrovzhac1,0.96,114,1704406609,2024-01-04T10:16:49+0000
2024-01-05T08,18ypmsb,23,12207,cats,2qhta,"Jack, my oldest cat and most willing to entertain me with photos",0,https://www.reddit.com/gallery/18ypmsb,0.97,620,1704406546,2024-01-04T10:15:46+0000
2024-01-05T08,18ypkqh,69,5229,MapPorn,2si92,"The population of jews in Europe (1939 vs 2015)",0,https://www.reddit.com/gallery/18ypkqh,0.91,1599,1704406403,2024-01-04T10:13:23+0000
2024-01-05T08,18ypikv,77,4644,sadcringe,2wsc9,"News Anchor tells 13 year old kid to ""go outside"" and that beating the game ""isn't a life goal"" after he becomes the first person to beat Classic Tetris",0,https://v.redd.it/6nu1cl0iyhac1,0.93,478,1704406250,2024-01-04T10:10:50+0000
2024-01-05T08,18yp6cp,50,6655,shittymoviedetails,3mj3w,"According to Jason X, hockey was outlawed in 2024. Enjoy while you can, hockey fans",0,https://i.redd.it/7metdwpbwhac1.png,0.96,108,1704405454,2024-01-04T09:57:34+0000
2024-01-05T08,18yoybk,19,20935,pettyrevenge,2vg7t,"Continuously kick my seat on flight, get your belongings soaked",1,https://www.reddit.com/r/pettyrevenge/comments/18yoybk/continuously_kick_my_seat_on_flight_get_your/,0.94,538,1704404884,2024-01-04T09:48:04+0000
2024-01-05T08,18yomc1,54,6662,fixedbytheduet,46tcaa,"Dad of the year",0,https://v.redd.it/3xcsi7vbshac1,0.95,114,1704404057,2024-01-04T09:34:17+0000
2024-01-05T08,18yolpn,93,4579,BaldursGate3,12967t,"If you wake Shadowheart with Astarion instead of TAV...",1,https://www.reddit.com/r/BaldursGate3/comments/18yolpn/if_you_wake_shadowheart_with_astarion_instead_of/,0.96,301,1704404011,2024-01-04T09:33:31+0000
2024-01-05T08,18yois3,60,6047,80s,2raga,"A very Atari Christmas (1981)",0,https://i.redd.it/zp6mzcqlrhac1.jpeg,0.96,566,1704403812,2024-01-04T09:30:12+0000
2024-01-05T08,18yofld,75,5699,fightporn,2u5un,"Security guy makes quick work of heckler",0,https://v.redd.it/09l8r24nqhac1,0.96,398,1704403591,2024-01-04T09:26:31+0000
2024-01-05T08,18yoa6p,67,6794,me_irlgbt,3apfn,"me🦄irlgbt",0,https://i.redd.it/b8doecinphac1.png,0.84,169,1704403220,2024-01-04T09:20:20+0000
2024-01-05T08,18ynybc,89,5310,KidsAreFuckingStupid,3948y,"I feel so bad for this first grade teacher at my kids school...so gross and she's a real sweet lady.",0,https://i.redd.it/1ygee8wenhac1.png,0.97,411,1704402405,2024-01-04T09:06:45+0000
2024-01-05T08,18ynree,85,6375,ExplainTheJoke,2vmj2,"This one stumped me.",0,https://i.redd.it/bz0x17q1mhac1.jpeg,0.87,460,1704401943,2024-01-04T08:59:03+0000
2024-01-05T08,18ynhfh,91,5726,PublicFreakout,2yrq6,"Just another day at Walmart",0,https://v.redd.it/cs5tui5ujhac1,0.87,1629,1704401248,2024-01-04T08:47:28+0000
2024-01-05T08,18yngjv,38,11315,WhitePeopleTwitter,35n7t,"American Dream",0,https://i.redd.it/1dyqrapsjhac1.jpeg,0.96,363,1704401186,2024-01-04T08:46:26+0000
2024-01-05T08,18yn4k2,99,5497,gaming,2qh03,"What video game quotes are burned into your brain?",1,https://www.reddit.com/r/gaming/comments/18yn4k2/what_video_game_quotes_are_burned_into_your_brain/,0.92,10694,1704400338,2024-01-04T08:32:18+0000
2024-01-05T08,18ymn1j,43,11860,aww,2qh1o,"Coyote broke into our yard to play with and steal our dogs toys ",0,https://v.redd.it/p6852aohdhac1,0.97,322,1704399127,2024-01-04T08:12:07+0000
2024-01-05T08,18ymlxk,95,6499,theydidthemath,2x23b,"[Request] How fast would an average human need to run to accomplish this?",0,https://i.redd.it/3q98eshfdhac1.jpeg,0.95,196,1704399045,2024-01-04T08:10:45+0000
2024-01-05T08,18ymkmg,47,14720,TheLastAirbender,2rybx,"The difference is INSANE",0,https://www.reddit.com/gallery/18ymkmg,0.9,875,1704398958,2024-01-04T08:09:18+0000
2024-01-05T08,18ym71g,49,12923,2meirl4meirl,3ee85,2meirl4meirl,0,https://i.redd.it/vrai085hahac1.png,0.95,445,1704398055,2024-01-04T07:54:15+0000
2024-01-05T08,18ym52c,34,19413,news,2qh3l,"New York City announces lawsuit against bus companies sending migrants to city, seeks $708 million",0,https://abcnews.go.com/US/new-york-city-announces-lawsuit-bus-companies-sending/story?id=106110357,0.92,1441,1704397922,2024-01-04T07:52:02+0000
2024-01-05T08,18ym4s5,59,12727,meirl,2s5ti,Meirl,0,https://i.redd.it/23b42581ahac1.jpeg,0.93,422,1704397903,2024-01-04T07:51:43+0000
2024-01-05T08,18ym1ez,83,7997,JustGuysBeingDudes,33rtj6,"Not everyone is greedy.",0,https://v.redd.it/n3gq6d5b9hac1,0.95,98,1704397683,2024-01-04T07:48:03+0000
2024-01-05T08,18ylskt,35,24274,BrandNewSentence,mbn0j,"It was just a good Christian honk",0,https://i.redd.it/z391cy0k7hac1.png,0.93,693,1704397098,2024-01-04T07:38:18+0000
2024-01-05T08,18ylqs9,45,14533,OldSchoolCool,2tycb,"My mom circa 1998",0,https://i.redd.it/tsz936b97hac1.png,0.92,734,1704396975,2024-01-04T07:36:15+0000
2024-01-05T08,18ylhs6,40,22044,oddlysatisfying,2x93b,"Creation of ceiling art using plaster",0,https://v.redd.it/xims3e395hac1,0.94,446,1704396347,2024-01-04T07:25:47+0000
2024-01-05T08,18yjswj,63,17596,ContagiousLaughter,2u2bh,"Marriage Goals.",0,https://v.redd.it/pdvv8ug9tgac1,0.94,160,1704392263,2024-01-04T06:17:43+0000
2024-01-05T08,18yi9ce,86,27207,lego,2qhm7,"I was messing around and discovered you can perfectly insert 8 cheese slope pieces into window panes. Makes for a cool stained-glass effect.",0,https://i.redd.it/1igfkulxhgac1.jpeg,0.88,103,1704388453,2024-01-04T05:14:13+0000
2024-01-05T08,18yhwwn,71,25361,worldnews,2qh13,"Joe Biden boots Uganda from trade deal over horrific “Kill the Gays” law",0,https://www.lgbtqnation.com/2024/01/joe-biden-boots-uganda-from-trade-deal-over-horrific-kill-the-gays-law/,0.93,1268,1704387605,2024-01-04T05:00:05+0000
