date,id,position,score,subreddit_display_name,subreddit_id,title,is_self,url,upvote_ratio,num_comments,created,created_date
2023-12-31T16,18v9b0n,88,748,ChatGPT,7hqomg,"A rich man getting richer each time",0,https://www.reddit.com/gallery/18v9b0n,0.83,107,1704034389,2023-12-31T02:53:09+0000
2023-12-31T16,18v93sp,38,1485,LeopardsAteMyFace,3jp3p,"Wait, capitalism means I don't get free education?!",0,https://i.redd.it/ys96xp277n9c1.jpeg,0.97,110,1704033743,2023-12-31T02:42:23+0000
2023-12-31T16,18v8quj,80,832,FunnyAnimals,2st2l,"Husky speaks italian",0,https://v.redd.it/6mvoffdl3n9c1,0.98,13,1704032549,2023-12-31T02:22:29+0000
2023-12-31T16,18v8n6i,33,1715,interestingasfuck,2qhsa,"The Jaws of the Vipertoothed Dogfish.",0,https://v.redd.it/uyyfpxdk2n9c1,0.98,97,1704032199,2023-12-31T02:16:39+0000
2023-12-31T16,18v8cw2,40,1633,Unexpected,2w67q,"Cheapest world problem!?‽",0,https://v.redd.it/3s9o466zym9c1,0.91,168,1704031263,2023-12-31T02:01:03+0000
2023-12-31T16,18v8crq,50,1286,politics,2cneq,"Donald Trump stung by legal filing hours before New Year's Eve",0,https://www.newsweek.com/donald-trump-legal-filing-new-years-eve-1856777,0.97,124,1704031254,2023-12-31T02:00:54+0000
2023-12-31T16,18v8bbc,62,1056,ukraine,2qqcn,"Here are the 'journalists' who write all that anti-Ukrainian bullshit in NY Times - One was raised in Putin's hometown & worked at Moscow Times, the other graduated from MGIMO (Moscow State Institute of International Relations). Would not be surprised if they are the Kremlin’s agents",0,https://x.com/TonyaMaliei/status/1741212892811194865?s=20,0.98,65,1704031135,2023-12-31T01:58:55+0000
2023-12-31T16,18v88w2,90,1829,oddlysatisfying,2x93b,"This paper cutting machine at work",0,https://v.redd.it/bdu1tjxqym9c1,0.95,123,1704030904,2023-12-31T01:55:04+0000
2023-12-31T16,18v87ds,9,4078,shitposting,2usxq,Titanic,0,https://i.redd.it/kyr3hnkaym9c1.jpeg,0.97,80,1704030750,2023-12-31T01:52:30+0000
2023-12-31T16,18v86d7,74,2095,technicallythetruth,3pzez,"That's one way to say it",0,https://i.redd.it/pi7kiuagxm9c1.png,0.98,17,1704030655,2023-12-31T01:50:55+0000
2023-12-31T16,18v83fb,49,1370,pics,2qh0u,"Happy new year from Sydney, Australia.",0,https://i.redd.it/pqye6xr7xm9c1.jpeg,0.99,23,1704030386,2023-12-31T01:46:26+0000
2023-12-31T16,18v80t5,91,893,gaming,2qh03,"We mean no harm. Our units are merely passing through the area.",0,https://i.redd.it/jsoi8badvm9c1.jpeg,0.95,41,1704030144,2023-12-31T01:42:24+0000
2023-12-31T16,18v7ubo,19,2675,CuratedTumblr,3x5kfw,Language,0,https://i.redd.it/7et7gojmum9c1.jpeg,0.96,76,1704029538,2023-12-31T01:32:18+0000
2023-12-31T16,18v7tub,31,1988,oddlyterrifying,2yo6b,"Before a heart transplant, organ is connected to a warm perfusion device that pumps a continuous supply of oxygenated blood and electrolytes, keeping temperature and pressure constant while the organ is outside the human body.",0,https://v.redd.it/teov9y9hum9c1,0.96,105,1704029493,2023-12-31T01:31:33+0000
2023-12-31T16,18v7nbu,26,2398,Weird,2qlia,"Pakistan International Airlines Ad (1980s)",0,https://i.redd.it/nrlbgalqsm9c1.png,0.93,132,1704028884,2023-12-31T01:21:24+0000
2023-12-31T16,18v7esg,72,1114,PublicFreakout,2yrq6,"Lady in wheelchair tries to stab people with knife, gets hosed.",0,https://v.redd.it/d8vwcln6qm9c1,0.91,245,1704028040,2023-12-31T01:07:20+0000
2023-12-31T16,18v7chc,61,1259,popculturechat,5rj68d,"Fashion Showdown (also known as celebrities wearing the same outfit)",0,https://www.reddit.com/gallery/18v7chc,0.93,363,1704027817,2023-12-31T01:03:37+0000
2023-12-31T16,18v78fz,48,1581,pcmasterrace,2sgp1,"I found a 3060ti in the local Walmart clearance section",0,https://i.redd.it/00dmibufom9c1.jpeg,0.97,93,1704027434,2023-12-31T12:57:14+0000
2023-12-31T16,18v7812,93,2150,todayilearned,2qqjc,"TIL about Pine Mouth, a potential consequence from eating pine nuts that gives you a metallic taste in your mouth, sometimes for weeks.",0,https://www.bonappetit.com/story/pine-nut-mouth-syndrome,0.99,69,1704027389,2023-12-31T12:56:29+0000
2023-12-31T16,18v741c,99,958,indiadiscussion,3eeon,India,0,https://i.redd.it/bozrdiq1nm9c1.jpeg,0.94,141,1704026968,2023-12-31T12:49:28+0000
2023-12-31T16,18v73sd,79,1087,de,22i0,"Mit Isolierband gegen Böllerbubis - Eine Handlungsempfehlung",0,https://i.redd.it/wqanb8vymm9c1.jpeg,0.91,139,1704026940,2023-12-31T12:49:00+0000
2023-12-31T16,18v72cj,15,3564,lotrmemes,2v0i1,Ackshually!,0,https://i.redd.it/wuyy4xpimm9c1.jpeg,0.9,205,1704026789,2023-12-31T12:46:29+0000
2023-12-31T16,18v6ya4,12,4056,oddlysatisfying,2x93b,"Satisfying Hydraulic Press compilation",0,https://v.redd.it/oxvfsndvkm9c1,0.89,192,1704026346,2023-12-31T12:39:06+0000
2023-12-31T16,18v6xsi,85,1087,NotHowGirlsWork,adf18,"How the turntables..",0,https://i.redd.it/55jopor0lm9c1.png,0.96,41,1704026291,2023-12-31T12:38:11+0000
2023-12-31T16,18v6xeu,52,1623,AnimalCrossing,2ro2c,"Flashback to when my sister was logging in to do her NYE event in 2020",0,https://i.redd.it/9khms2nwkm9c1.jpeg,0.97,30,1704026248,2023-12-31T12:37:28+0000
2023-12-31T16,18v6po7,47,1840,ksi,2xd5g,"Hope randy is doing okay😥",0,https://i.redd.it/u6i9jx5bim9c1.jpeg,0.94,103,1704025374,2023-12-31T12:22:54+0000
2023-12-31T16,18v6p5r,73,1260,OneOrangeBraincell,5vej89,"What’s she yelling about? I don’t speak orange",0,https://i.redd.it/qqa5rq35im9c1.jpeg,0.98,52,1704025316,2023-12-31T12:21:56+0000
2023-12-31T16,18v6nz7,66,1427,starwarsmemes,2wzm6,Accurate?,0,https://i.redd.it/5asur56rhm9c1.jpeg,0.89,103,1704025188,2023-12-31T12:19:48+0000
2023-12-31T16,18v6gzu,10,6336,dankmemes,2zmfe,"Unis hate this one trick",0,https://i.redd.it/6nfb8dzdfm9c1.gif,0.98,28,1704024398,2023-12-31T12:06:38+0000
2023-12-31T16,18v6g3x,18,3655,me_irl,2vegg,me_irl,0,https://v.redd.it/fu3dabi0fm9c1,0.96,235,1704024299,2023-12-31T12:04:59+0000
2023-12-31T16,18v6feh,95,2449,news,2qh3l,"Tire shop owner shoots landscaper for blowing leaves onto his property in NW Miami-Dade",0,https://www.nbcmiami.com/news/local/owner-shoots-landscaper-for-blowing-leaves-onto-his-property-in-nw-miami-dade/3193778/,0.96,298,1704024213,2023-12-31T12:03:33+0000
2023-12-31T16,18v6czy,16,4120,AITAH,446kys,"AITAH for telling my husband that he needs to give me half his company if he wants me to be a housewife?",1,https://www.reddit.com/r/AITAH/comments/18v6czy/aitah_for_telling_my_husband_that_he_needs_to/,0.86,3669,1704023975,2023-12-31T11:59:35+0000
2023-12-31T16,18v6ch6,4,8029,MapPorn,2si92,"2024, a worldwide election year",0,https://i.redd.it/ojlw4q9zdm9c1.jpeg,0.96,921,1704023916,2023-12-31T11:58:36+0000
2023-12-31T16,18v6cck,27,3041,mildlyinteresting,2ti4h,"We have a vacuum system in the house, where you just put a long hose on and it starts sucking",0,https://i.redd.it/oq9971rxdm9c1.jpeg,0.87,930,1704023902,2023-12-31T11:58:22+0000
2023-12-31T16,18v6c29,14,4375,AbsoluteUnits,a7wuv,"Eddie Hall looking like a historically accurate Thor",0,https://v.redd.it/dovs19etdm9c1,0.87,620,1704023868,2023-12-31T11:57:48+0000
2023-12-31T16,18v6b2y,35,2589,HumansBeingBros,2xh58,"Martin Kemp and his son Roman have a chat. Roman has been a mental health advocate since he lost his best friend to suicide. It always helps to have that support.",0,https://v.redd.it/qdgyqe7fdm9c1,0.95,74,1704023745,2023-12-31T11:55:45+0000
2023-12-31T16,18v6a2d,28,7563,tumblr,2r7hk,"Idk what to title this just felt was important to bring attention to",0,https://i.redd.it/oivl2jb4dm9c1.jpeg,0.96,363,1704023628,2023-12-31T11:53:48+0000
2023-12-31T16,18v69oq,7,6912,facepalm,2r5rp,"Prove me wrong!...Gladly",0,https://i.redd.it/vxohisdwcm9c1.png,0.92,259,1704023580,2023-12-31T11:53:00+0000
2023-12-31T16,18v65ai,76,1388,BlackPeopleTwitter,33x33,"All this effort just for TikTok😭",0,https://v.redd.it/14o79c0fbm9c1,0.89,201,1704023075,2023-12-31T11:44:35+0000
2023-12-31T16,18v60bt,1,15344,funny,2qh33,"This Malaysian restaurant has had enough",0,https://i.redd.it/l4414aso9m9c1.jpeg,0.91,1050,1704022475,2023-12-31T11:34:35+0000
2023-12-31T16,18v5yn9,25,3462,comics,2qh0s,"Reality Checks on the Beach",0,https://www.reddit.com/gallery/18v5yn9,0.92,43,1704022280,2023-12-31T11:31:20+0000
2023-12-31T16,18v5xgo,2,10146,meirl,2s5ti,Meirl,0,https://i.redd.it/ed6z9drp8m9c1.jpeg,0.97,282,1704022146,2023-12-31T11:29:06+0000
2023-12-31T16,18v5vh3,92,1313,stunfisk,2sn6d,"Balance changes to some random moves",0,https://www.reddit.com/gallery/18v5vh3,0.94,123,1704021901,2023-12-31T11:25:01+0000
2023-12-31T16,18v5v1d,98,1261,thalassophobia,2xfs1,"Snorkelling in the rain, was quite relaxing ",0,https://v.redd.it/xwwndiis7m9c1,0.97,55,1704021843,2023-12-31T11:24:03+0000
2023-12-31T16,18v5po8,8,7654,Damnthatsinteresting,2xxyj,"Before a heart transplant, organ is connected to a warm perfusion device that pumps a continuous supply of oxygenated blood and electrolytes, keeping temperature and pressure constant while the organ is outside the human body.",0,https://v.redd.it/5jpqq62w5m9c1,0.96,341,1704021204,2023-12-31T11:13:24+0000
2023-12-31T16,18v5p3e,70,1629,Jokes,2qh72,"A guy goes to Las Vegas to gamble and he loses all his money. He doesn't even have enough for a cab, but he flagged one down anyway. He explained to the driver that he would pay him back next time and gave him his phone number, but the driver told him, ""Get the fuck out of my cab.""",1,https://www.reddit.com/r/Jokes/comments/18v5p3e/a_guy_goes_to_las_vegas_to_gamble_and_he_loses/,0.91,79,1704021136,2023-12-31T11:12:16+0000
2023-12-31T16,18v5gew,55,2113,science,mouw,"Psychopathic men have more children: A new study examined the link between psychopathic traits and number of children in a community sample of men and women, finding that prototypical psychopathy was associated with having more children among men, but not women.",0,https://www.psypost.org/2023/12/psychopathic-men-have-more-children-study-finds-220372,0.92,257,1704020157,2023-12-31T10:55:57+0000
2023-12-31T16,18v5eph,86,1510,2westerneurope4u,66zq15,Barbarus!,0,https://i.redd.it/o3gywa422m9c1.png,0.95,138,1704019946,2023-12-31T10:52:26+0000
2023-12-31T16,18v5dgw,54,5731,dankmemes,2zmfe,"People who don't/people who do",0,https://i.redd.it/b6uno4wq1m9c1.jpeg,0.95,68,1704019804,2023-12-31T10:50:04+0000
2023-12-31T16,18v5b01,34,3282,brasil,2qh9i,"CHEGOU A HORA! VAMOS LEVAR O CÃO CHUPANDO MANGA PARA A FRONTPAGE MAIS UMA VEZ 🐶🥭",0,https://i.redd.it/tvy9jrfv0m9c1.png,0.93,152,1704019509,2023-12-31T10:45:09+0000
2023-12-31T16,18v58s9,24,4205,chaoticgood,2qjo5,"The hero we need.",0,https://i.redd.it/fzi119tyzl9c1.jpeg,0.95,83,1704019235,2023-12-31T10:40:35+0000
2023-12-31T16,18v582f,60,1990,HonkaiStarRail,4q5zoc,"That thing is an absolute menace in the new event",0,https://i.redd.it/fmfm7fwszl9c1.jpeg,0.94,182,1704019150,2023-12-31T10:39:10+0000
2023-12-31T16,18v51ob,5,11123,tumblr,2r7hk,"Dog Theater",0,https://i.redd.it/4rxys4kixl9c1.jpeg,0.97,102,1704018380,2023-12-31T10:26:20+0000
2023-12-31T16,18v5199,57,2264,nextfuckinglevel,m0bnr,"Octopus changing it's colors",0,https://i.imgur.com/XpTdaIB.gifv,0.97,57,1704018332,2023-12-31T10:25:32+0000
2023-12-31T16,18v50ul,75,1771,sciencememes,2u0d4,"A boy once said that to me, too. Damn, he was good at guessing!",0,https://i.redd.it/tgsqneq7xl9c1.jpeg,0.88,110,1704018287,2023-12-31T10:24:47+0000
2023-12-31T16,18v4s1d,32,3687,worldnews,2qh13,"US Military Says Sank Three Huthi Vessels That Attacked Container Ship In Red Sea and opened fire on the US helicopters",0,https://www.barrons.com/news/us-military-says-sank-three-huthi-vessels-that-attacked-container-ship-in-red-sea-32c2f671,0.96,440,1704017270,2023-12-31T10:07:50+0000
2023-12-31T16,18v4qbm,13,6892,NonPoliticalTwitter,39gt6y,"We are not friends, Who are you",0,https://i.redd.it/wppkmn69tl9c1.png,0.95,145,1704017062,2023-12-31T10:04:22+0000
2023-12-31T16,18v4l1f,3,15984,clevercomebacks,dyqlw,"Based Readers added context",0,https://i.redd.it/d330lyljrl9c1.png,0.95,373,1704016464,2023-12-31T09:54:24+0000
2023-12-31T16,18v4kxn,69,2108,Grimdank,3ilna,"Happy New Year my dudes and dudettes!",0,https://i.redd.it/sue0namwql9c1.png,0.95,225,1704016450,2023-12-31T09:54:10+0000
2023-12-31T16,18v4evw,36,4377,youngpeopleyoutube,nngwo,"Based younger brother",0,https://i.redd.it/4ezyyq4npl9c1.jpeg,0.95,212,1704015732,2023-12-31T09:42:12+0000
2023-12-31T16,18v4bma,21,6436,technicallythetruth,3pzez,"That's a lot of information to swallow",0,https://i.redd.it/y1iux5laol9c1.jpeg,0.96,78,1704015350,2023-12-31T09:35:50+0000
2023-12-31T16,18v4b4p,94,1870,Genshin_Impact,12p4l2,"😬 a Misunderstanding",0,https://i.redd.it/snn0178col9c1.jpeg,0.96,49,1704015294,2023-12-31T09:34:54+0000
2023-12-31T16,18v49l1,81,1982,Eyebleach,2s427,"Everyone need Hugs",0,https://i.imgur.com/DFTdIVD.gifv,0.98,16,1704015114,2023-12-31T09:31:54+0000
2023-12-31T16,18v42i0,41,3825,Gamingcirclejerk,2sf2b,"someone check on neil 😹",0,https://i.redd.it/2fb8ys2fll9c1.jpeg,0.88,491,1704014313,2023-12-31T09:18:33+0000
2023-12-31T16,18v40bg,6,15064,mildlyinfuriating,2ubgg,"Email about my HP Printer",0,https://i.redd.it/fk37qkkokl9c1.jpeg,0.97,1757,1704014064,2023-12-31T09:14:24+0000
2023-12-31T16,18v3j2e,43,4098,BeAmazed,363r3,"Cloud in Turkey before the earthquake.",0,https://v.redd.it/mzdx2rgsel9c1,0.95,499,1704012109,2023-12-31T08:41:49+0000
2023-12-31T16,18v3fs7,20,9322,MadeMeSmile,2uqcm,"Man meets his hero in the most unusual circumstance",0,https://v.redd.it/33ezbp4sdl9c1,0.84,611,1704011745,2023-12-31T08:35:45+0000
2023-12-31T16,18v3fj9,11,11970,SipsTea,5tdqj0,"The kangaroo actually passed it back",0,https://v.redd.it/ep7hpx3odl9c1,0.94,252,1704011714,2023-12-31T08:35:14+0000
2023-12-31T16,18v3f1u,46,3866,wholesomememes,3gcwj,"Did It For Me",0,https://i.redd.it/8rsce8lbray41.png,0.98,13,1704011667,2023-12-31T08:34:27+0000
2023-12-31T16,18v3ds6,71,2707,Steam,2qwis,"My new PC parts haven't arrived yet",0,https://i.redd.it/uwpdsc4ycl9c1.png,0.85,229,1704011518,2023-12-31T08:31:58+0000
2023-12-31T16,18v3bqu,17,9632,KidsAreFuckingStupid,3948y,"She nearly drowned him",0,https://v.redd.it/ggswtlafcl9c1,0.94,425,1704011289,2023-12-31T08:28:09+0000
2023-12-31T16,18v35k3,44,16493,facepalm,2r5rp,"​",0,https://i.redd.it/2ajul37dal9c1.jpeg,0.95,1537,1704010596,2023-12-31T08:16:36+0000
2023-12-31T16,18v32cw,39,5230,europe,2qh4j,"Flooding continues in parts of Germany",0,https://i.redd.it/9j475dy89l9c1.jpeg,0.98,277,1704010219,2023-12-31T08:10:19+0000
2023-12-31T16,18v2tnv,45,4750,ProgrammerHumor,2tex6,iDoNotKnowWhatPolymortismIsButIWorkAtGoogle,0,https://i.redd.it/25gnuzk46l9c1.png,0.95,254,1704009249,2023-12-31T07:54:09+0000
2023-12-31T16,18v2sk3,78,2908,PeterExplainsTheJoke,121h8r,"Can someone please help",0,https://i.redd.it/t4k9dcsz5l9c1.png,0.82,501,1704009129,2023-12-31T07:52:09+0000
2023-12-31T16,18v2evw,37,6766,MurderedByWords,3hx3r,"Good luck to the women in your future",0,https://i.redd.it/yh44fvji1l9c1.jpeg,0.95,224,1704007621,2023-12-31T07:27:01+0000
2023-12-31T16,18v25qv,100,2844,theydidthemath,2x23b,"[Request] What is the odd of this actually happening?",0,https://i.redd.it/j1u4eaqmyk9c1.jpeg,0.93,93,1704006650,2023-12-31T07:10:50+0000
2023-12-31T16,18v20tb,51,4901,DesignPorn,2sj06,"Use Spades Not Ships (1941)",0,https://i.redd.it/yejbauh3xk9c1.png,0.95,87,1704006133,2023-12-31T07:02:13+0000
2023-12-31T16,18v1z7n,67,16340,shitposting,2usxq,"Stay safe buddy",0,https://v.redd.it/724rdxhowk9c1,0.95,330,1704005992,2023-12-31T06:59:52+0000
2023-12-31T16,18v1a73,68,4288,TikTokCringe,mvcq5,"Clarence Thomas is the worst",0,https://v.redd.it/i40pz6x2pk9c1,0.93,174,1704003439,2023-12-31T06:17:19+0000
2023-12-31T16,18v13oi,56,5519,FunnyandSad,2z7qd,"Fascinating Perspectives on Refrigeration",0,https://i.redd.it/10bkb1r6nk9c1.jpeg,0.96,138,1704002818,2023-12-31T06:06:58+0000
2023-12-31T16,18v12dl,30,11299,holdmycatnip,2zhxd,"Oh lawd he coming. Cannonball chonk",0,https://i.imgur.com/7DCGRKo.gifv,0.97,140,1704002696,2023-12-31T06:04:56+0000
2023-12-31T16,18v100f,29,11088,NatureIsFuckingLit,3gdh7,"🔥 drone footage of volcano eruption 🔥",0,https://i.imgur.com/MWIyDRI.gifv,0.97,198,1704002479,2023-12-31T06:01:19+0000
2023-12-31T16,18v0qij,59,5271,Showerthoughts,2szyo,"Considering how big of a deal it was, it’s really surprising that the moon landing is not a national holiday in the U.S.",1,https://www.reddit.com/r/Showerthoughts/comments/18v0qij/considering_how_big_of_a_deal_it_was_its_really/,0.96,333,1704001600,2023-12-31T05:46:40+0000
2023-12-31T16,18v0k7h,23,18543,todayilearned,2qqjc,"TIL that Better Call Saul was nominated for 53 Primetime Emmys without winning a single one",0,https://www.goldderby.com/article/2023/better-call-saul-last-chance-2023-emmys/,0.96,874,1704001013,2023-12-31T05:36:53+0000
2023-12-31T16,18v0gl0,83,20023,meirl,2s5ti,meirl,0,https://i.redd.it/3yznw1svgk9c1.jpeg,0.95,759,1704000681,2023-12-31T05:31:21+0000
2023-12-31T16,18v0dsp,42,15081,memes,2qjpg,"Love Story",0,https://i.redd.it/imvuhsi2gk9c1.jpeg,0.88,795,1704000428,2023-12-31T05:27:08+0000
2023-12-31T16,18v08z0,22,22395,news,2qh3l,"As many as 10 patients dead from nurse injecting tap water instead of Fentanyl at Oregon hospital",0,https://kobi5.com/news/crime-news/only-on-5-sources-say-8-9-died-at-rrmc-from-drug-diversion-219561/,0.96,1689,1703999992,2023-12-31T05:19:52+0000
2023-12-31T16,18uzz7z,89,4706,Awww,2suml,"A horse having fun.",0,https://v.redd.it/i3k987k4ck9c1,0.98,79,1703999093,2023-12-31T05:04:53+0000
2023-12-31T16,18uzi77,77,18504,Damnthatsinteresting,2xxyj,"Anthony Hopkins plays an empty hotel lobby in Vancouver: 'Something about a piano in an empty lobby… PERFECT venue'",0,https://v.redd.it/fab8noka6k9c1,0.96,564,1703997580,2023-12-31T04:39:40+0000
2023-12-31T16,18uz8he,96,5348,Eldenring,122hf1,"Does anyone know why morgott was frozen here?",0,https://v.redd.it/d8ndump05k9c1,0.94,125,1703996710,2023-12-31T04:25:10+0000
2023-12-31T16,18uz3t3,63,7818,geography,2qnms,"An Interesting Fact About Russia And USA",0,https://i.redd.it/nzkh2iwt3k9c1.jpeg,0.94,274,1703996290,2023-12-31T04:18:10+0000
2023-12-31T16,18uz3o7,84,6393,Funnymemes,2xqtc,"Black is....☠️",0,https://i.redd.it/hasvy4zr3k9c1.jpeg,0.88,445,1703996278,2023-12-31T04:17:58+0000
2023-12-31T16,18uyboh,97,6431,starterpacks,34o9s,"Anti-Intellectualism on Social Media Starterpack",0,https://i.redd.it/of7ikn7gwj9c1.jpeg,0.92,417,1703993808,2023-12-31T03:36:48+0000
2023-12-31T16,18uy91u,64,9973,marvelmemes,35mye,"Here comes the Money",0,https://i.redd.it/5p2r4bbqvj9c1.jpeg,0.95,121,1703993577,2023-12-31T03:32:57+0000
2023-12-31T16,18uwmqd,53,22622,WhitePeopleTwitter,35n7t,"The richest man in the world can't afford Mr. Beast",0,https://i.redd.it/eq9is1z8hj9c1.png,0.94,548,1703988712,2023-12-31T02:11:52+0000
2023-12-31T16,18uwjvu,87,11272,rareinsults,48t85,"He’s very correct though",0,https://i.redd.it/6kidezaagj9c1.jpeg,0.95,119,1703988474,2023-12-31T02:07:54+0000
2023-12-31T16,18uwgru,58,16063,aww,2qh1o,"(OC) My dog trying to boss my girlfriend into feeding her 15 minutes early",0,https://v.redd.it/gfbf3lrtfj9c1,0.96,400,1703988222,2023-12-31T02:03:42+0000
2023-12-31T16,18uvwrk,65,14894,nba,2qo4s,"[Post Game Thread] Streak Ended - The Detroit Pistons (3-29) avoid the longest losing streak in NBA history - defeating the Toronto Raptors (12-20) by a score of 129-127",1,https://www.reddit.com/r/nba/comments/18uvwrk/post_game_thread_streak_ended_the_detroit_pistons/,0.95,1388,1703986636,2023-12-31T01:37:16+0000
2023-12-31T16,18uv0xt,82,13085,spaceporn,2s9jc,"It's Jupiter's lo, as seen by Juno spacecraft, taken just moments ago, as it flew just 900 miles above the moon's hypervolcanic surface.",0,https://i.redd.it/879rl0pt3j9c1.jpeg,0.97,461,1703984181,2023-12-31T12:56:21+0000
