date,id,position,score,subreddit_display_name,subreddit_id,title,is_self,url,upvote_ratio,num_comments,created,created_date
2024-01-03T16,18xksmd,31,1954,WhitePeopleTwitter,35n7t,Thoughts?,0,https://i.redd.it/5osk7i1ik8ac1.jpeg,0.97,162,1704292461,2024-01-03T02:34:21+0000
2024-01-03T16,18xkajj,88,917,OneOrangeBraincell,5vej89,"I adopted mine today! Was told his brain cell would come in the mail in 3-4 weeks.",0,https://i.redd.it/wmzsi8tdg8ac1.jpeg,0.99,34,1704291078,2024-01-03T02:11:18+0000
2024-01-03T16,18xk6mf,85,930,Cricket,2qhe0,"India losses their last 6 wickets without scoring a single run.",0,https://i.redd.it/xj3ckjpgf8ac1.jpeg,0.96,200,1704290767,2024-01-03T02:06:07+0000
2024-01-03T16,18xk4ij,18,2800,memes,2qjpg,"At this rate, Japan won't be a geographic location by april",0,https://i.redd.it/3pdxp0sye8ac1.jpeg,0.98,77,1704290600,2024-01-03T02:03:20+0000
2024-01-03T16,18xjw8k,3,4465,meirl,2s5ti,meirl,0,https://i.redd.it/gc3rxb2xc8ac1.jpeg,0.98,31,1704289967,2024-01-03T01:52:47+0000
2024-01-03T16,18xju95,78,1064,gameofthrones,2rjz2,"Top 10 wine drinkers in AGOT, based on the amount of glasses they consumed on screen",0,https://i.redd.it/4t7bs81mc8ac1.jpeg,0.98,69,1704289809,2024-01-03T01:50:09+0000
2024-01-03T16,18xjres,67,1237,PoliticalHumor,2qm21,"No Malarkey, Jack!",0,https://i.redd.it/xa6y20uwb8ac1.jpeg,0.96,43,1704289573,2024-01-03T01:46:13+0000
2024-01-03T16,18xjqe1,25,2578,funnyvideos,2qoos,"I want to love my job like this guy",0,https://v.redd.it/00vrv6ilb8ac1,0.95,33,1704289492,2024-01-03T01:44:52+0000
2024-01-03T16,18xjjcu,82,1114,OnePunchMan,2vm97,"How Iron Man Vs. Saitama would go by @redandblacktac",0,https://i.redd.it/ehc2b9bx98ac1.png,0.98,42,1704288904,2024-01-03T01:35:04+0000
2024-01-03T16,18xjihr,54,1579,ClashOfClans,2usfk,"A kind message to everybody for this cwl",0,https://i.redd.it/03gh7q0p98ac1.jpeg,0.97,63,1704288829,2024-01-03T01:33:49+0000
2024-01-03T16,18xjfr6,77,1159,HonkaiStarRail,4q5zoc,"Youtube these days be like:",0,https://i.redd.it/8xkc5goz88ac1.jpeg,0.97,105,1704288608,2024-01-03T01:30:08+0000
2024-01-03T16,18xj6uc,28,2599,BlackPeopleTwitter,33x33,"Well damn Harry Potter",0,https://v.redd.it/thuhqtwr68ac1,0.93,395,1704287846,2024-01-03T01:17:26+0000
2024-01-03T16,18xj6ub,38,2239,pics,2qh0u,"South norway currently. We have had like 5 meters of snow the past 4 days",0,https://i.redd.it/w7qf3iur68ac1.jpeg,0.98,169,1704287846,2024-01-03T01:17:26+0000
2024-01-03T16,18xj6jv,58,1560,theydidthemath,2x23b,"[REQUEST] what's the average person's average velocity relative to earth?",0,https://i.redd.it/5hcj55fn68ac1.jpeg,0.89,158,1704287822,2024-01-03T01:17:02+0000
2024-01-03T16,18xivr3,27,2813,SipsTea,5tdqj0,Holup,0,https://v.redd.it/a3h41pir38ac1,0.95,271,1704286880,2024-01-03T01:01:20+0000
2024-01-03T16,18xircc,11,4055,MadeMeSmile,2uqcm,"Insane match",0,https://v.redd.it/p2o2yw0r28ac1,0.96,46,1704286495,2024-01-03T12:54:55+0000
2024-01-03T16,18xirbu,86,1138,ChatGPT,7hqomg,"Created a custom instruction that generates copyright images",0,https://www.reddit.com/gallery/18xirbu,0.97,81,1704286494,2024-01-03T12:54:54+0000
2024-01-03T16,18xiraj,32,2628,madlads,3aegn,"Madlad rangers",0,https://i.redd.it/a94maxuq28ac1.jpeg,0.96,75,1704286491,2024-01-03T12:54:51+0000
2024-01-03T16,18xir4i,49,2001,cursedcomments,hw1ju,cursed_twitter,0,https://i.redd.it/orlm4dkn28ac1.png,0.98,70,1704286477,2024-01-03T12:54:37+0000
2024-01-03T16,18xiof3,12,4104,therewasanattempt,39ne7,"to win a medal",0,https://v.redd.it/pkvds7ex18ac1,0.95,149,1704286229,2024-01-03T12:50:29+0000
2024-01-03T16,18xijf8,43,2265,Awww,2suml,"Fun in bar",0,https://v.redd.it/5r6vqijyz7ac1,0.97,13,1704285769,2024-01-03T12:42:49+0000
2024-01-03T16,18xiilv,96,1105,formuladank,3ndbi,"What Happened To This Shape Of Helmet?",0,https://i.redd.it/cgjzhbkc08ac1.jpeg,0.98,46,1704285691,2024-01-03T12:41:31+0000
2024-01-03T16,18xig1d,63,3093,Damnthatsinteresting,2xxyj,"What a RPG can do to a human",0,https://v.redd.it/t2b3y55nz7ac1,0.95,386,1704285451,2024-01-03T12:37:31+0000
2024-01-03T16,18xifi5,60,1655,terriblefacebookmemes,2tja6,"Found on the wild Wild West of Quora",0,https://i.redd.it/hmj2zd8iz7ac1.jpeg,0.93,335,1704285403,2024-01-03T12:36:43+0000
2024-01-03T16,18xicci,65,3029,BeAmazed,363r3,"Man and his dog rescues two dogs in an icy reservoir",0,https://v.redd.it/h57y0q7my7ac1,0.98,99,1704285109,2024-01-03T12:31:49+0000
2024-01-03T16,18xic7h,74,2768,shitposting,2usxq,"Title ",0,https://v.redd.it/umadofkly7ac1,0.97,30,1704285097,2024-01-03T12:31:37+0000
2024-01-03T16,18xibpz,69,1542,PublicFreakout,2yrq6,"Man screams at transgender people",0,https://v.redd.it/zd3fftd7y7ac1,0.8,657,1704285052,2024-01-03T12:30:52+0000
2024-01-03T16,18xi92p,24,3289,funny,2qh33,"Gave an assist to himself ",0,https://v.redd.it/lgvqg27rx7ac1,0.95,106,1704284819,2024-01-03T12:26:59+0000
2024-01-03T16,18xi5af,53,1950,oddlysatisfying,2x93b,"Needle felted sculptures by fibre artist",0,https://v.redd.it/amjyy3epw7ac1,0.96,48,1704284466,2024-01-03T12:21:06+0000
2024-01-03T16,18xhyza,21,3654,AITAH,446kys,"My ex left me the majority of his estate(amounts to $700000). His parents demand that I leave it to his wife and child.",1,https://www.reddit.com/r/AITAH/comments/18xhyza/my_ex_left_me_the_majority_of_his_estateamounts/,0.93,1620,1704283863,2024-01-03T12:11:03+0000
2024-01-03T16,18xhrci,9,4992,politics,2cneq,"The Polls Prove It: Many Republicans Love Fascism",0,https://newrepublic.com/article/177796/polls-republicans-trump-maga-fascism,0.92,705,1704283161,2024-01-03T11:59:21+0000
2024-01-03T16,18xhqk2,15,5037,HolUp,qir9n,"Cosmetic Industry is a Big Lie",0,https://i.redd.it/q1ggofpls7ac1.jpeg,0.9,164,1704283081,2024-01-03T11:58:01+0000
2024-01-03T16,18xhn87,5,6778,holdmycatnip,2zhxd,"WHO MADE THIS CAT SAD? ☹️",0,https://v.redd.it/j3pda6ler7ac1,0.96,121,1704282742,2024-01-03T11:52:22+0000
2024-01-03T16,18xhkxg,68,1755,Eyebleach,2s427,"Lets shake",0,https://i.imgur.com/zDKqVM3.gifv,0.97,13,1704282513,2024-01-03T11:48:33+0000
2024-01-03T16,18xhial,94,1350,2meirl4meirl,3ee85,2meirl4meirl,0,https://i.redd.it/bojxsrx3q7ac1.jpeg,0.97,17,1704282245,2024-01-03T11:44:05+0000
2024-01-03T16,18xhi7y,50,2341,unitedstatesofindia,2kz7we,"The ' Last Press Conference by an Indian PM' was 10 years ago on this day",0,https://i.redd.it/0n9x68z1q7ac1.jpeg,0.91,165,1704282238,2024-01-03T11:43:58+0000
2024-01-03T16,18xhgki,47,2468,ProgrammerHumor,2tex6,threePagesRequired,0,https://i.redd.it/ojrbu4lkp7ac1.png,0.93,201,1704282061,2024-01-03T11:41:01+0000
2024-01-03T16,18xhfs7,20,4336,maybemaybemaybe,38e1l,"Maybe maybe maybe",0,https://v.redd.it/f02k420no7ac1,0.88,539,1704281987,2024-01-03T11:39:47+0000
2024-01-03T16,18xheeg,1,12255,me_irl,2vegg,Me_irl,0,https://i.redd.it/durfmqnwo7ac1.png,0.97,279,1704281837,2024-01-03T11:37:17+0000
2024-01-03T16,18xhdef,26,4009,shitposting,2usxq,Hello,0,https://v.redd.it/u7ugpe3lo7ac1,0.97,53,1704281730,2024-01-03T11:35:30+0000
2024-01-03T16,18xhbt2,14,4793,technology,2qh16,"A 13-year-old is the first human to beat Tetris | Numerous theoretical milestones remain",0,https://www.techspot.com/news/101383-13-year-old-first-human-beat-tetris.html,0.95,320,1704281562,2024-01-03T11:32:42+0000
2024-01-03T16,18xh977,71,1807,lotr,2rfb9,"Happy birthday, Tolkien!",0,https://i.redd.it/gyaz6r3an7ac1.jpeg,0.96,12,1704281289,2024-01-03T11:28:09+0000
2024-01-03T16,18xh1e2,36,6900,me_irl,2vegg,"Me irl",0,https://i.redd.it/le0b6f6xk7ac1.jpeg,0.98,352,1704280496,2024-01-03T11:14:56+0000
2024-01-03T16,18xh0iz,57,2287,polandball,2sih3,"Official Polandball World Map 2023",0,https://i.redd.it/wssytgdfk7ac1.png,0.93,174,1704280401,2024-01-03T11:13:21+0000
2024-01-03T16,18xgu4k,13,5540,news,2qh3l,"Starbucks will now let customers use personal cups for nearly all orders | CNN Business",0,https://www.cnn.com/2024/01/03/food/starbucks-reusable-cup-expansion/index.html,0.95,568,1704279765,2024-01-03T11:02:45+0000
2024-01-03T16,18xgtm4,66,2155,Animemes,2w6fe,"Came for the ""plot"", stayed for the funny (and the ""plot"")",0,https://i.redd.it/6ax7p5idi7ac1.jpeg,0.95,33,1704279720,2024-01-03T11:02:00+0000
2024-01-03T16,18xgok3,2,10837,Damnthatsinteresting,2xxyj,"Laser bending in a stream of water",0,https://v.redd.it/zn7vtko3h7ac1,0.97,118,1704279223,2024-01-03T10:53:43+0000
2024-01-03T16,18xgngt,99,1549,2westerneurope4u,66zq15,"🤲🏻",0,https://i.redd.it/m3yx3bqsg7ac1.jpeg,0.95,138,1704279109,2024-01-03T10:51:49+0000
2024-01-03T16,18xgmkz,37,7810,facepalm,2r5rp,"Trying to cross the border to sell cocaine",0,https://i.redd.it/k12s464gg7ac1.png,0.96,316,1704279024,2024-01-03T10:50:24+0000
2024-01-03T16,18xgkf8,29,4495,animememes,2tcn0,"Fr Todo carried the whole gang most of the time",0,https://i.redd.it/gjyg4qeuf7ac1.jpeg,0.95,144,1704278792,2024-01-03T10:46:32+0000
2024-01-03T16,18xgiwn,81,1882,PrequelMemes,3i60n,"Meme-ception. Twice the pride, double the fall!",0,https://i.redd.it/u3f1ic3af7ac1.png,0.96,11,1704278625,2024-01-03T10:43:45+0000
2024-01-03T16,18xgily,48,2901,nonononoyes,2xp2p,"Reserve parachutes are the way to go",0,https://i.imgur.com/u0Q2tip.gifv,0.97,136,1704278589,2024-01-03T10:43:09+0000
2024-01-03T16,18xgfq7,40,3457,pcmasterrace,2sgp1,"Game launchers tier list",0,https://i.redd.it/zgnra8f5e7ac1.png,0.86,701,1704278280,2024-01-03T10:38:00+0000
2024-01-03T16,18xgf6j,76,1988,AnarchyChess,2yvry,"What do I do in this position? (I'm white)",0,https://i.redd.it/zxotq8y4e7ac1.jpeg,0.94,135,1704278215,2024-01-03T10:36:55+0000
2024-01-03T16,18xgf3r,92,1676,me_irlgbt,3apfn,me_irlgbt,0,https://www.reddit.com/gallery/18xgf3r,0.85,79,1704278206,2024-01-03T10:36:46+0000
2024-01-03T16,18xgdtc,8,7146,mildlyinfuriating,2ubgg,"Phone call from the funeral home",1,https://www.reddit.com/r/mildlyinfuriating/comments/18xgdtc/phone_call_from_the_funeral_home/,0.96,495,1704278059,2024-01-03T10:34:19+0000
2024-01-03T16,18xgbd9,7,9017,NonPoliticalTwitter,39gt6y,"The evolution of Uber",0,https://i.redd.it/6dxh5spwc7ac1.jpeg,0.96,399,1704277801,2024-01-03T10:30:01+0000
2024-01-03T16,18xgb69,30,4351,LateStageCapitalism,39qgx,"In 2016, Daniel Shaver was fatally shot while begging for his life and complying with police officer Philip Brailsford. The cop was acquitted, rehired, claimed PTSD and receiving tax-free pension worth $31,000 a year for life .",0,https://i.redd.it/rmbzn2msc7ac1.jpeg,0.97,245,1704277780,2024-01-03T10:29:40+0000
2024-01-03T16,18xgawb,84,1838,691,33xbyi,Rule,0,https://i.redd.it/v39grgwqc7ac1.png,0.97,21,1704277747,2024-01-03T10:29:07+0000
2024-01-03T16,18xg6d2,87,1840,discordVideos,2cxozx,Respect,0,https://v.redd.it/rshthc1g77ac1,0.94,11,1704277238,2024-01-03T10:20:38+0000
2024-01-03T16,18xg4r8,62,4916,wholesomememes,3gcwj,"Lol kids are so wholesome",0,https://i.redd.it/y5xi9p9oa7ac1.jpeg,0.98,29,1704277076,2024-01-03T10:17:56+0000
2024-01-03T16,18xg4iw,35,4131,interestingasfuck,2qhsa,"Foam car magically appears and scares cops",0,https://v.redd.it/xng1x58ha7ac1,0.96,69,1704277052,2024-01-03T10:17:32+0000
2024-01-03T16,18xg3ok,41,3645,Satisfyingasfuck,31s00,"Still lake in Latvia",0,https://v.redd.it/6l0qol36a7ac1,0.97,74,1704276964,2024-01-03T10:16:04+0000
2024-01-03T16,18xg34y,98,1734,Wellthatsucks,2xcv7,"Poor old man",0,https://v.redd.it/ww34nv14a7ac1,0.91,188,1704276908,2024-01-03T10:15:08+0000
2024-01-03T16,18xfygg,75,2197,FunnyAnimals,2st2l,"He really said ‘allow me to do the honor madame’ 😂",0,https://v.redd.it/1z2u4k9n87ac1,0.98,7,1704276381,2024-01-03T10:06:21+0000
2024-01-03T16,18xfrdw,4,12904,comics,2qh0s,"TUGPHAT (OC)",0,https://www.reddit.com/gallery/18xfrdw,0.92,281,1704275603,2024-01-03T09:53:23+0000
2024-01-03T16,18xfqf9,61,2801,titanfall,2xh0g,"Throw a grenade down there",0,https://v.redd.it/2dm5uy8067ac1,0.95,105,1704275482,2024-01-03T09:51:22+0000
2024-01-03T16,18xfo92,100,1894,ukraine,2qqcn,"Ukrainian military personnel shoot down a Russian cruise missile from a ZU-23-2 anti-aircraft gun on January 2nd, 2024",0,https://v.redd.it/nkt76fpy47ac1,0.98,99,1704275234,2024-01-03T09:47:14+0000
2024-01-03T16,18xfo5q,59,2963,meme,2qi1r,"In Search of a Quality Duck",0,https://i.redd.it/gllez9k757ac1.jpeg,0.95,64,1704275224,2024-01-03T09:47:04+0000
2024-01-03T16,18xfkya,34,4710,lotrmemes,2v0i1,"""Gandalf the White? Gandalf the FOOL!""",0,https://i.redd.it/ppkpiop347ac1.jpeg,0.97,137,1704274840,2024-01-03T09:40:40+0000
2024-01-03T16,18xfiqd,19,7027,technicallythetruth,3pzez,"Instant insulation, just add manual labor",0,https://i.redd.it/44jb9ofc37ac1.jpeg,0.98,77,1704274584,2024-01-03T09:36:24+0000
2024-01-03T16,18xfh0y,10,9025,BeAmazed,363r3,"The whale shark asked the fisherman to cut the rope",0,https://v.redd.it/ysc8mmtm27ac1,0.97,222,1704274384,2024-01-03T09:33:04+0000
2024-01-03T16,18xfbjn,80,2390,blackcats,2twpw,"Stinky is home!!",0,https://www.reddit.com/gallery/18xfbjn,0.97,145,1704273761,2024-01-03T09:22:41+0000
2024-01-03T16,18xf63c,90,2193,mapporncirclejerk,2wxxs,"Anyone else think this'll be the year Macedonia takes it's land back?",0,https://i.redd.it/5j3hs910z6ac1.jpeg,0.94,216,1704273125,2024-01-03T09:12:05+0000
2024-01-03T16,18xf48c,16,9069,nextfuckinglevel,m0bnr,"Ninja-level Card Throwing Skill",0,https://v.redd.it/iyh69zvcy6ac1,0.89,584,1704272910,2024-01-03T09:08:30+0000
2024-01-03T16,18xexo0,45,4267,worldnews,2qh13,"Britain bans foreign students from bringing families into UK",0,https://www.scmp.com/news/world/europe/article/3246929/britain-bans-foreign-students-bringing-families-uk,0.95,366,1704272158,2024-01-03T08:55:58+0000
2024-01-03T16,18xetst,17,8533,mildlyinteresting,2ti4h,"My colleagues pliers breaks always on same spot",0,https://i.redd.it/hsncwd3uu6ac1.jpeg,0.95,721,1704271724,2024-01-03T08:48:44+0000
2024-01-03T16,18xerdm,46,4333,AnimalsBeingBros,2wmvy,"Young dog lays toys for older dog so he can also join play the fetch",0,https://v.redd.it/e9vgyte0u6ac1,0.96,47,1704271449,2024-01-03T08:44:09+0000
2024-01-03T16,18xenkm,6,35911,facepalm,2r5rp,"Idk what to say lol",0,https://i.redd.it/zapa2g0os6ac1.png,0.93,1392,1704270996,2024-01-03T08:36:36+0000
2024-01-03T16,18xehow,73,3228,MemePiece,2tt3v,"I gave robin her tan and bangs back",0,https://www.reddit.com/gallery/18xehow,0.89,431,1704270336,2024-01-03T08:25:36+0000
2024-01-03T16,18xeezn,55,12306,HolUp,qir9n,"Happens all the time",0,https://v.redd.it/ppj2blxtp6ac1,0.97,119,1704270041,2024-01-03T08:20:41+0000
2024-01-03T16,18xdyo0,23,10321,wholesomememes,3gcwj,"soo cute.....",0,https://i.redd.it/397bzfh3k6ac1.jpeg,0.98,48,1704268285,2024-01-03T07:51:25+0000
2024-01-03T16,18xdl4q,42,7044,MapPorn,2si92,"Countries with bases in the USA",0,https://i.redd.it/2qg68n8v14ac1.jpeg,0.91,516,1704266798,2024-01-03T07:26:38+0000
2024-01-03T16,18xcy3z,33,10776,BetterEveryLoop,3abwq,"I know a shortcut",0,https://i.redd.it/iipblbg196ac1.gif,0.95,275,1704264416,2024-01-03T06:46:56+0000
2024-01-03T16,18xcoko,93,3934,whenthe,23gidu,"Just Meagre Amounts of Frivolous Fun",0,https://v.redd.it/rmu6pgqa66ac1,0.95,126,1704263485,2024-01-03T06:31:25+0000
2024-01-03T16,18xc93m,51,8896,clevercomebacks,dyqlw,"Don't run from your emotions",0,https://i.redd.it/9l7zfs9j16ac1.jpeg,0.83,1681,1704261995,2024-01-03T06:06:35+0000
2024-01-03T16,18xc91a,39,12853,MurderedByWords,3hx3r,"Don't run from your emotions",0,https://i.redd.it/mwvaenvi16ac1.jpeg,0.85,1248,1704261990,2024-01-03T06:06:30+0000
2024-01-03T16,18xc1ht,56,7925,gaming,2qh03,"Players are frustrated with The Finals' “impossible to finish” battle pass, forcing users to play 100-150+ hours just to complete it",0,https://www.dexerto.com/gaming/the-finals-players-frustrated-with-impossible-to-finish-battle-pass-2450351/,0.84,1822,1704261329,2024-01-03T05:55:29+0000
2024-01-03T16,18xbsds,22,25933,TikTokCringe,mvcq5,"Dads with the spare random piece of wood in the garage",0,https://v.redd.it/20p87xngx5ac1,0.93,574,1704260503,2024-01-03T05:41:43+0000
2024-01-03T16,18xbjn2,64,8457,Gamingcirclejerk,2sf2b,"My dishonest company is better than your dishonest company",0,https://i.redd.it/o0sivau6v5ac1.jpeg,0.85,849,1704259736,2024-01-03T05:28:56+0000
2024-01-03T16,18xbfab,95,15834,memes,2qjpg,"Which game is this",0,https://i.redd.it/3j52xeixs5ac1.png,0.93,2395,1704259336,2024-01-03T05:22:16+0000
2024-01-03T16,18xaen4,72,7525,antiwork,2y77d,"“Suggest a solution” got me rileddd. Management 🥴🥴",0,https://i.redd.it/zfexwoeek5ac1.jpeg,0.97,357,1704256107,2024-01-03T04:28:27+0000
2024-01-03T16,18xa356,79,7813,funnysigns,2u04j,"Google is Wrong Funny",0,https://i.redd.it/hvw6o2kih5ac1.jpeg,0.95,83,1704255144,2024-01-03T04:12:24+0000
2024-01-03T16,18xa1ir,89,19296,mildlyinfuriating,2ubgg,"How my mom decided to put up her decoration",0,https://i.redd.it/n6kuc185h5ac1.jpeg,0.96,981,1704255013,2024-01-03T04:10:13+0000
2024-01-03T16,18x9d6x,44,21610,nottheonion,2qnts,"Burger King Employee Who Went 27 Years Without Missing a Day of Work Buys First Home Thanks to Donations",0,https://inshort.geartape.com/burger-king-employee-who-went-27-years-without-missing-a-day-of-work-buys-first-home-thanks-to-donations/,0.93,1175,1704253003,2024-01-03T03:36:43+0000
2024-01-03T16,18x91l2,52,20594,cats,2qhta,"this is baxter. he’s on a diet and last night i caught him trying to break into that container of dog food. shame him.",0,https://www.reddit.com/gallery/18x91l2,0.95,1341,1704252036,2024-01-03T03:20:36+0000
2024-01-03T16,18x8v9g,70,31338,Unexpected,2w67q,"Bro got packed up",0,https://v.redd.it/7rh41w2s65ac1,0.79,655,1704251527,2024-01-03T03:12:07+0000
2024-01-03T16,18x6htm,97,12575,wallstreetbets,2th52,"'Rich Dad, Poor Dad's' Robert Kiyosaki Says He's $1.2 Billion In Debt Because 'If I Go Bust, The Bank Goes Bust. Not My Problem'",0,https://finance.yahoo.com/news/rich-dad-poor-dads-robert-193714809.html,0.94,1496,1704244893,2024-01-03T01:21:33+0000
2024-01-03T16,18x6d2j,91,12950,aww,2qh1o,"Rescued this little guy 2 months ago on a cold night. Pics from the night he was found and then last night.",0,https://www.reddit.com/gallery/18x6d2j,0.97,159,1704244539,2024-01-03T01:15:39+0000
2024-01-03T16,18x5p4l,83,20220,todayilearned,2qqjc,"TIL that during the first moon landing, according to the schedule, the astronauts were SUPPOSED to sleep for a few hours first, keeping the entire world waiting, but they could not sleep and asked to go ahead of schedule and leave the lander early.",0,https://www.scienceandmediamuseum.org.uk/objects-and-stories/moon-to-living-room-apollo-11-broadcast,0.95,512,1704242747,2024-01-03T12:45:47+0000
